2023-03-13 12:22:49,363 - [INFO] - main_ERKNM - __init__(74) - Начало авторизации
2023-03-13 12:22:59,906 - [INFO] - main_ERKNM - autorize(176) - Autorization successfull completed!
2023-03-13 12:35:42,442 - [INFO] - ERKNM_http.py - get_all_knm_for_a_year(173) - Запись в json завершена, заносим в базу данных
2023-03-13 12:35:42,445 - [INFO] - direct_sql.py - multiple_inserts(142) - старт программы
2023-03-13 12:57:37,980 - [ERROR] - direct_sql.py - new_insert_in_database(300) - (1040, 'ny connections')
2023-03-13 12:57:37,984 - [INFO] - direct_sql.py - new_insert_in_database(301) - {'actCreateDate': None, 'actCreateDateEn': None, 'addresses': ['152986, ОБЛАСТЬ, ЯРОСЛАВСКАЯ, РАЙОН, РЫБИНСКИЙ, ДОМ 101, 76015000136'], 'admLevelId': 50001, 'appealed': False, 'approveDocOrderDate': '18.05.2022', 'approveDocOrderNum': '493', 'approveDocRequestDate': None, 'approveDocRequestNum': None, 'approveDocs': [], 'approveRequired': False, 'approved': True, 'approvedErknm': 'Согласовано', 'chlistCount': 0, 'chlistFilledCount': 0, 'chlistFillingIndicationTypeId': [], 'collaboratingOrganizations': [], 'collaboratingOrganizationsIds': [], 'comment': None, 'controllingOrganization': 'Управление Роспотребнадзора по Ярославской области', 'controllingOrganizationId': 10001022016, 'createPlanDate': '10.08.2021 12.57.38', 'createPlanDateLong': 1628600258, 'createdByErpDb': False, 'createdById': 99664, 'dataNotEqualEGRUL': False, 'dataSetNotInTime': True, 'deleted': False, 'directDurationDays': None, 'disapprove': False, 'district': 'Ярославская область', 'districtId': 1030780000000001, 'durationDays': None, 'durationHours': 15, 'erknmActViolationIds': [2, 3], 'erknmResultKindDecisionIds': [], 'erpId': '76220041000100695047', 'events': [{'startDate': '07.06.2022', 'stopDate': '20.06.2022', 'title': 'Осмотр'}, {'startDate': '07.06.2022', 'stopDate': '20.06.2022', 'title': 'Истребование документов'}, {'startDate': '07.06.2022', 'stopDate': '20.06.2022', 'title': 'Отбор проб (образцов)'}], 'federalLaw': '248', 'federalLawId': 3, 'fullFieldViolationKnm': False, 'hasViolations': False, 'id': 10767173, 'inn': '7610125500', 'inspectorFullName': ['Комарова О. Г.', 'Небахарева Е. В.'], 'isFromSmev': False, 'isHasApproveDocs': False, 'isHasCollaboratingOrganization': False, 'isHasRequirements': True, 'isHasViolationTerm': False, 'isPm': False, 'kind': 'Выездная проверка', 'knmAnnulled': False, 'knmRejected': False, 'knmType': 'Плановое КНМ', 'knmTypeId': 4, 'legalBasisDocName': [], 'links': [], 'mspCategory': ['Микропредприятие'], 'noPunishment': False, 'notifyLate': False, 'objectsKind': ['Деятельность детских лагерей на время каникул'], 'objectsSubKind': ['Деятельность детских лагерей на время каникул'], 'objectsType': ['Деятельность и действия'], 'ogrn': '1177627031229', 'oldKnm': None, 'oldPlan': None, 'orderDone': False, 'organizationName': 'ОБЩЕСТВО С ОГРАНИЧЕННОЙ ОТВЕТСТВЕННОСТЬЮ ОЗДОРОВИТЕЛЬНЫЙ ЦЕНТР ВЫСОКОВСКИЙ БОР', 'organizationsInn': ['7610125500'], 'organizationsName': ['ОБЩЕСТВО С ОГРАНИЧЕННОЙ ОТВЕТСТВЕННОСТЬЮ ОЗДОРОВИТЕЛЬНЫЙ ЦЕНТР ВЫСОКОВСКИЙ БОР'], 'organizationsOgrn': ['1177627031229'], 'planId': '2022038464', 'prosecutorOrganization': 'Прокуратура Ярославской области', 'prosecutorOrganizationId': 529, 'publishedStatus': 'PUBLISHED', 'reasons': [202], 'reasonsList': [{'assignmentDate': None, 'assignmentDateEn': None, 'assignmentNumber': None, 'date': '01.02.2019', 'dateEn': '2019-02-01', 'requirementDetails': None, 'text': '(ФЗ 248) Истечение установленного федеральным законом о виде контроля, положением о виде контроля периода времени с даты государственной регистрации организации или гражданина в качестве индивидуального предпринимателя'}], 'recEmptyOrLate': False, 'regDateEgrul': '08.09.2021', 'regDateEgrulEn': '2021-09-08', 'regLate': False, 'regTypes': ['MSP'], 'requirements': 12, 'requirementsList': [{'nameNpa': 'None', 'numberNpa': '30.03.1999', 'title': 'Федеральный закон «О санитарно-эпидемиологическом благополучии населения» № 52-ФЗ'}, {'nameNpa': 'None', 'numberNpa': '23.02.2013', 'title': 'Федеральный закон от 23.02.2013 N 15-ФЗ Об охране здоровья граждан от воздействия окружающего табачного дыма и последствий потребления табака'}, {'nameNpa': 'None', 'numberNpa': '28.01.2021', 'title': 'СанПиН 1.2.3685-21 «Гигиенические нормативы и требования к обеспечению безопасности и (или) безвредности для человека факторов среды обитания»'}, {'nameNpa': 'None', 'numberNpa': '18.09.2020', 'title': 'СП 2.4.3648-20 «Санитарно-эпидемиологические требования к организациям воспитания и обучения, отдыха и оздоровления детей и молодежи»'}, {'nameNpa': 'None', 'numberNpa': '27.10.2020', 'title': 'Глава 1-8СанПиН 2.3/2.4.3590-20 «Санитарно-эпидемиологические требования к организации общественного питания населения»'}, {'nameNpa': 'None', 'numberNpa': '30.06.2020', 'title': 'СП 3.1/2.4.3598-20 «Санитарно-эпидемиологические требования к устройству, содержанию и организации работы образовательных организаций и других объектов социальной инфраструктуры для детей и молодежи в условиях распространения новой коронавирусной инфекции (COVID-19)»'}, {'nameNpa': 'None', 'numberNpa': '22.05.2020', 'title': 'СП 3.1.3597-20 «Профилактика новой коронавирусной инфекции (COVID-19)»'}, {'nameNpa': 'None', 'numberNpa': '28.01.2021', 'title': 'СанПиН 3.3686-21 Санитарно-эпидемиологические требования по профилактике инфекционных болезней'}, {'nameNpa': 'None', 'numberNpa': '28.01.2021', 'title': 'СанПиН 2.1.3684-21 «Санитарно-эпидемиологические требования к содержанию территорий городских и сельских поселений, к водным объектам, питьевой воде и питьевому водоснабжению, атмосферному воздуху, почвам, жилым помещениям, эксплуатации производственных, общественных помещений, организации и проведению санитарно-противоэпидемических (профилактических) мероприятий» '}, {'nameNpa': 'None', 'numberNpa': '13.07.2001', 'title': 'СанПиН 1.1.1058-01 «Организация и проведение производственного контроля за соблюдением санитарных правил и выполнением санитарно-противоэпидемиологических (профилактических) мероприятий», постановление '}, {'nameNpa': 'None', 'numberNpa': '28.01.2021', 'title': 'Приказ Минздрава России N 29н «Об утверждении Порядка проведения обязательных предварительных и периодических медицинских осмотров работников, предусмотренных частью четвертой статьи 213 Трудового кодекса Российской Федерации, перечня медицинских противопоказаний к осуществлению работ с вредными и (или) опасными производственными факторами, а также работам, при выполнении которых проводятся обязательные предварительные и периодические медицинские осмотры» '}, {'nameNpa': 'None', 'numberNpa': '14.11.2001', 'title': 'СанПиН 2.3.2.1078-01 «Гигиенические требования безопасности и пищевой ценности пищевых продуктов» '}], 'resolved': False, 'resultEmpty': False, 'resultEmptyOrLate': False, 'resultInfoTypeCodes': [], 'resultViolationKnm': False, 'riskCategory': ['чрезвычайно высокий риск'], 'riskCategoryAndDangerClass': ['чрезвычайно высокий риск'], 'sezRegistryExists': False, 'signed': True, 'smevInfoType': None, 'smevMessageType': None, 'smevReceivedAt': None, 'smevReceivedAtEn': None, 'smevReceivedAtMonth': None, 'smevReceivedAtYear': None, 'spvRegistryExists': False, 'startDate': '07.06.2022', 'startDateEn': '2022-06-07', 'status': 'Завершено', 'statusEgrul': 'Найден', 'statusId': 7, 'stopDate': '20.06.2022', 'stopDateEn': '2022-06-20', 'subjectTypeId': 0, 'supervisionType': 'Федеральный государственный санитарно-эпидемиологический контроль (надзор)', 'supervisionTypeId': '004', 'torRegistryExists': False, 'updatePlanDate': '14.06.2022 15.11.03', 'updatePlanDateLong': 1655219463, 'version': 'ERKNM', 'violationLawsuitTypeCodes': [], 'violationTypeCodes': [], 'year': 2022}
2023-03-13 12:57:37,987 - [WARNING] - direct_sql.py - new_insert_in_database(302) - Проведена повторная попытка внесения с параметром special, результат неудачный.
2023-03-13 12:57:37,987 - [INFO] - direct_sql.py - database_inserts_conductor_for_multiprocessing(133) - Возникла ошибка, с которой не удалось справиться...
2023-03-13 12:57:37,987 - [INFO] - direct_sql.py - database_inserts_conductor_for_multiprocessing(134) - 
2023-03-13 12:57:37,994 - [ERROR] - direct_sql.py - new_insert_in_database(300) - (1040, 'ny connections')
2023-03-13 12:57:37,995 - [INFO] - direct_sql.py - new_insert_in_database(301) - {'actCreateDate': None, 'actCreateDateEn': None, 'addresses': ['101000, ГОРОД МОСКВА, ПЕРЕУЛОК СВЕРЧКОВ, 4/1, ', 'г.Москва, бульв. Ходынский, д.10', '101000, г. Москва, пер. Девяткин, д 5, стр. 3'], 'admLevelId': 50001, 'appealed': False, 'approveDocOrderDate': None, 'approveDocOrderNum': None, 'approveDocRequestDate': None, 'approveDocRequestNum': None, 'approveDocs': [], 'approveRequired': False, 'approved': False, 'approvedErknm': 'Отказано', 'chlistCount': 0, 'chlistFilledCount': 0, 'chlistFillingIndicationTypeId': [], 'collaboratingOrganizations': [], 'collaboratingOrganizationsIds': [], 'comment': 'Привести в соответствие срок проведения проверки, установленный  ч. 7 ст. 73 Федерального закона № 248-ФЗ «О государственном контроле (надзоре) и муниципальном контроле в Российской Федерации».  В графе формулировка требования необходимо  указать структурные единицы НПА, содержащие обязательные требования, соблюдение  которых  является предметом КНМ. ', 'controllingOrganization': 'Управление Роспотребнадзора по г. Москве', 'controllingOrganizationId': 10001029839, 'createPlanDate': '02.09.2021 11.01.04', 'createPlanDateLong': 1630580464, 'createdByErpDb': False, 'createdById': 97218, 'dataNotEqualEGRUL': False, 'dataSetNotInTime': False, 'deleted': False, 'directDurationDays': None, 'disapprove': False, 'district': 'Город Москва столица Российской Федерации город федерального значения', 'districtId': 1030450000000001, 'durationDays': 10, 'durationHours': None, 'erknmActViolationIds': [], 'erknmResultKindDecisionIds': [], 'erpId': '77220041000100945691', 'events': [{'startDate': '20.06.2022', 'stopDate': '01.07.2022', 'title': 'Осмотр'}, {'startDate': '20.06.2022', 'stopDate': '01.07.2022', 'title': 'Досмотр'}, {'startDate': '20.06.2022', 'stopDate': '01.07.2022', 'title': 'Опрос'}, {'startDate': '20.06.2022', 'stopDate': '01.07.2022', 'title': 'Получение письменных объяснений'}, {'startDate': '20.06.2022', 'stopDate': '01.07.2022', 'title': 'Истребование документов'}, {'startDate': '20.06.2022', 'stopDate': '01.07.2022', 'title': 'Отбор проб (образцов)'}, {'startDate': '20.06.2022', 'stopDate': '01.07.2022', 'title': 'Экспертиза'}, {'startDate': '20.06.2022', 'stopDate': '01.07.2022', 'title': 'Инструментальное обследование'}, {'startDate': '20.06.2022', 'stopDate': '01.07.2022', 'title': 'Испытание'}], 'federalLaw': '248', 'federalLawId': 3, 'fullFieldViolationKnm': False, 'hasViolations': False, 'id': 11017817, 'inn': '7701885820', 'inspectorFullName': [], 'isFromSmev': False, 'isHasApproveDocs': False, 'isHasCollaboratingOrganization': False, 'isHasRequirements': True, 'isHasViolationTerm': False, 'isPm': False, 'kind': 'Выездная проверка', 'knmAnnulled': False, 'knmRejected': False, 'knmType': 'Плановое КНМ', 'knmTypeId': 4, 'legalBasisDocName': [], 'links': [], 'mspCategory': ['Не является субъектом МСП'], 'noPunishment': False, 'notifyLate': False, 'objectsKind': ['Объекты производственного назначения', 'Объекты производственного назначения', 'Объекты производственного назначения'], 'objectsSubKind': ['Объекты производственного назначения', 'Объекты производственного назначения', 'Объекты производственного назначения'], 'objectsType': ['Производственные объекты', 'Производственные объекты', 'Производственные объекты'], 'ogrn': '1107746614436', 'oldKnm': None, 'oldPlan': None, 'orderDone': False, 'organizationName': 'АКЦИОНЕРНОЕ ОБЩЕСТВО МОСИНЖПРОЕКТ', 'organizationsInn': ['7701885820'], 'organizationsName': ['АКЦИОНЕРНОЕ ОБЩЕСТВО МОСИНЖПРОЕКТ'], 'organizationsOgrn': ['1107746614436'], 'planId': '2022040517', 'prosecutorOrganization': 'Прокуратура города Москвы', 'prosecutorOrganizationId': 554, 'publishedStatus': 'UNPUBLISHED', 'reasons': [202], 'reasonsList': [{'assignmentDate': None, 'assignmentDateEn': None, 'assignmentNumber': None, 'date': '03.08.2010', 'dateEn': '2010-08-03', 'requirementDetails': None, 'text': '(ФЗ 248) Истечение установленного федеральным законом о виде контроля, положением о виде контроля периода времени с даты государственной регистрации организации или гражданина в качестве индивидуального предпринимателя'}], 'recEmptyOrLate': False, 'regDateEgrul': '17.03.2022', 'regDateEgrulEn': '2022-03-17', 'regLate': False, 'regTypes': [], 'requirements': 80, 'requirementsList': [{'nameNpa': 'None', 'numberNpa': '16.08.2011', 'title': 'ТР ТС 004/2011. Технический регламент Таможенного Союза «О безопасности низковольтного оборудования»\n\n'}, {'nameNpa': 'None', 'numberNpa': '16.08.2011', 'title': 'ТР ТС 005/2011. Технический регламент Таможенного союза «О безопасности упаковки»\n\n'}, {'nameNpa': 'None', 'numberNpa': '23.09.2011', 'title': 'ТР ТС 007/2011. Технический регламент Таможенного Союза «О безопасности продукции, предназначенной для детей и подростков»\n\n'}, {'nameNpa': 'None', 'numberNpa': '23.09.2011', 'title': 'ТР ТС 008/2011. Технический регламент Таможенного союза «О безопасности игрушек»\n\n'}, {'nameNpa': 'None', 'numberNpa': '23.09.2011', 'title': 'ТР ТС 009/2011. Технический регламент Таможенного союза «О безопасности парфюмерно-косметической продукции»\n\n'}, {'nameNpa': 'None', 'numberNpa': '18.10.2011', 'title': 'ТР ТС 010/2011. Технический регламент Таможенного союза «О безопасности машин и оборудования»\n\n'}, {'nameNpa': 'None', 'numberNpa': '09.12.2011', 'title': 'ТР ТС 017/2011. Технический регламент Таможенного союза «О безопасности продукции легкой промышленности»\n\n'}, {'nameNpa': 'None', 'numberNpa': '09.12.2011', 'title': 'ТР ТС 019/2011. Технический регламент Таможенного союза «О безопасности средств индивидуальной защиты»\n\n'}, {'nameNpa': 'None', 'numberNpa': '09.12.2011', 'title': 'ТР ТС 021/2011. Технический регламент Таможенного союза «О безопасности пищевой продукции»\n\n'}, {'nameNpa': 'None', 'numberNpa': '09.12.2011', 'title': 'ТР ТС 022/2011. Технический регламент Таможенного союза «Пищевая продукция в части ее маркировки»\n\n'}, {'nameNpa': 'None', 'numberNpa': '09.12.2011', 'title': 'ТР ТС 023/2011. Технический регламент Таможенного союза «Технический регламент на соковую продукцию из фруктов и овощей»\n\n'}, {'nameNpa': 'None', 'numberNpa': '09.12.2011', 'title': 'ТР ТС 024/2011. Технический регламент Таможенного союза «Технический регламент на масложировую продукцию»\n\n'}, {'nameNpa': 'None', 'numberNpa': '15.06.2012', 'title': 'ТР ТС 025/2012. Технический регламент Таможенного союза «О безопасности мебельной продукции»\n\n'}, {'nameNpa': 'None', 'numberNpa': '20.07.2012', 'title': 'ТР ТС 029/2012. Технический регламент Таможенного союза «Требования безопасности пищевых добавок, ароматизаторов и технологических вспомогательных средств»\n\n'}, {'nameNpa': 'None', 'numberNpa': '09.10.2013', 'title': 'ТР ТС 033/2013. Технический регламент Таможенного союза «О безопасности молока и молочной продукции»\n\n'}, {'nameNpa': 'None', 'numberNpa': '09.10.2013', 'title': 'ТР ТС 034/2013. Технический регламент Таможенного союза «О безопасности мяса и мясной продукции»\n\n'}, {'nameNpa': 'None', 'numberNpa': '07.04.2011', 'title': 'Решение Комиссии Таможенного союза «О Положении о порядке применения типовых схем оценки (подтверждения) соответствия требованиям технических регламентов Таможенного союза»\n\n'}, {'nameNpa': 'None', 'numberNpa': '28.05.2010', 'title': 'Решение Комиссии Таможенного союза Единые санитарно-эпидемиологические и гигиенические требования к продукции (товарам), подлежащей санитарно-эпидемиологическому надзору (контролю) (с изменениями на 8 декабря 2020 года)\n\n'}, {'nameNpa': 'None', 'numberNpa': '18.10.2016', 'title': 'ТР ЕАЭС 040/2016. Технический регламент\nЕвразийского экономического союза «О безопасности рыбы и рыбной продукции»\n\n'}, {'nameNpa': 'None', 'numberNpa': '23.06.2017', 'title': 'ТР ЕАЭС 044/2017. Технический регламент\nЕвразийского экономического союза «О безопасности упакованной питьевой воды, включая природную минеральную воду»\n\n'}, {'nameNpa': 'None', 'numberNpa': '30.03.1999', 'title': 'Федеральный закон №52-ФЗ «О санитарно-эпидемиологическом благополучии населения»\n\n'}, {'nameNpa': 'None', 'numberNpa': '02.01.2000', 'title': 'Федеральный закон N 29-ФЗ «О качестве и безопасности пищевых продуктов»\n\n'}, {'nameNpa': 'None', 'numberNpa': '17.09.1998', 'title': 'Федеральный закон N157-ФЗ «Об иммунопрофилактике инфекционных болезней» \n\n'}, {'nameNpa': 'None', 'numberNpa': '07.12.2011', 'title': 'Федеральный закон №416-ФЗ «О водоснабжении и водоотведении»\n\n'}, {'nameNpa': 'None', 'numberNpa': '09.01.1996', 'title': 'Федеральный закон №3-ФЗ «О радиационной безопасности населения»\n\n'}, {'nameNpa': 'None', 'numberNpa': '18.06.2001', 'title': 'Федеральный закон №77-ФЗ «О предупреждении распространения туберкулеза в Российской Федерации»\n\n'}, {'nameNpa': 'None', 'numberNpa': '19.07.1997', 'title': 'Федеральный закон №109-ФЗ «О безопасном обращении с пестицидами и агрохимикатами»\n\n'}, {'nameNpa': 'None', 'numberNpa': '22.12.2008', 'title': 'Федеральный закон N 268-ФЗ «Технический регламент на табачную продукцию»\n\n'}, {'nameNpa': 'None', 'numberNpa': '23.02.2013', 'title': 'Федеральный закон №15-ФЗ «Об охране здоровья граждан от воздействия окружающего табачного дыма и последствий потребления табака»\n\n'}, {'nameNpa': 'None', 'numberNpa': '24.06.1998', 'title': 'Федеральный закон №89-ФЗ «Об отходах производства и потребления»\n\n'}, {'nameNpa': 'None', 'numberNpa': '27.12.2002', 'title': 'Федеральный закон №184-ФЗ О техническом регулировании\n\n'}, {'nameNpa': 'None', 'numberNpa': '15.07.1999', 'title': 'Постановление Правительства Российской Федерации «Об утверждении перечня работ, выполнение которых связано с высоким риском заболевания инфекционными болезнями и требует обязательного проведения профилактических прививок»\n\n'}, {'nameNpa': 'None', 'numberNpa': '06.01.2015', 'title': 'Постановление Правительства Российской Федерации «О порядке осуществления производственного контроля качества и безопасности питьевой воды, горячей воды»\n\n'}, {'nameNpa': 'None', 'numberNpa': '09.03.2010', 'title': 'Постановление Правительства Российской Федерации «Об обязательных требованиях в отношении отдельных видов продукции и связанных с требованиями к ней процессов проектирования (включая изыскания), производства, строительства, монтажа, наладки, эксплуатации, хранения, перевозки, реализации и утилизации, содержащихся в технических регламентах Республики Казахстан, являющейся государством - участником таможенного союза»\n\n'}, {'nameNpa': 'None', 'numberNpa': '20.07.2015', 'title': 'Постановление Главного государственного санитарного врача Российской Федерации «Об утверждении СанПиН 2.6.1.3289-15 Гигиенические требования по обеспечению радиационной безопасности при обращении с источниками, генерирующими рентгеновское излучение при ускоряющем напряжении до 150 кВ»\n\n'}, {'nameNpa': 'None', 'numberNpa': '04.09.2017', 'title': 'Постановление Главного государственного санитарного врача Российской Федерации «Об утверждении СанПиН 2.6.1.3488-17 «Гигиенические требования по обеспечению радиационной безопасности при обращении с лучевыми досмотровыми установками»\n\n'}, {'nameNpa': 'None', 'numberNpa': '12.01.2015', 'title': 'Постановление Главного государственного санитарного врача Российской Федерации «Об утверждении СП 2.6.1.3247-15 «Гигиенические требования к размещению, устройству, оборудованию и эксплуатации радоновых лабораторий, отделений радонотерапии»\n\n'}, {'nameNpa': 'None', 'numberNpa': '24.12.2014', 'title': 'Постановление Главного государственного санитарного врача Российской Федерации «Об утверждении СП 2.6.1.3241-14 «Гигиенические требования по обеспечению радиационной безопасности при радионуклидной дефектоскопии»\n\n'}, {'nameNpa': 'None', 'numberNpa': '26.04.2010', 'title': 'Постановление Главного государственного санитарного врача Российской Федерации «Об утверждении СП 2.6.1.2612-10 «Основные санитарные правила обеспечения радиационной безопасности (ОСПОРБ-99/2010) с изменениями на 16.09.2013»\n\n'}, {'nameNpa': 'None', 'numberNpa': '07.07.2009', 'title': 'Постановление Главного государственного санитарного врача Российской Федерации «Об утверждении СанПиН 2.6.1.2523-09. Нормы радиационной безопасности. НРБ-99/2009»\n   \n\n'}, {'nameNpa': 'None', 'numberNpa': '29.05.2007', 'title': 'Постановление Главного государственного санитарного врача Российской Федерации «Об утверждении санитарных правил СП 2.6.1.2216-07 «Санитарно-защитные зоны и зоны наблюдения радиационных объектов. Условия эксплуатации и обоснование границ»\n\n'}, {'nameNpa': 'None', 'numberNpa': '12.07.2011', 'title': 'Постановление Главного государственного санитарного врача Российской Федерации «Об утверждении СП 2.3.3.2892-11 «Санитарно-гигиенические требования к организации и проведению работ с метанолом»\n\n'}, {'nameNpa': 'None', 'numberNpa': '18.02.2003', 'title': 'Постановление Главного государственного санитарного врача РФ «О введении в действие СанПиН 2.6.1.1192-03\n«Ионизирующее излучение, радиационная безопасность. Гигиенические требования к устройству и эксплуатации рентгеновских кабинетов, аппаратов и проведению рентгенологических исследований»\n\n'}, {'nameNpa': 'None', 'numberNpa': '10.04.2001', 'title': ' Приказ Министерства здравоохранения Российской Федерации «О введении в действие санитарно-эпидемиологических правил и нормативов СанПиН 2.6.1.993-00 «Гигиенические требования к обеспечению радиационной безопасности при заготовке и реализации металлолома» \n\n'}, {'nameNpa': 'None', 'numberNpa': '14.07.2009', 'title': 'Постановление Главного государственного санитарного врача Российской Федерации\n«Об утверждении СанПиН 2.6.1.2525-09. Изменение № 1 к СанПиНу 2.6.1.993-00»«Гигиенические требования к обеспечению радиационной безопасности при заготовке и реализации металлолома» \n'}, {'nameNpa': 'None', 'numberNpa': '14.07.2015', 'title': 'Постановление Главного государственного санитарного врача Российской Федерации\n«Об утверждении СанПиН 2.6.1.3287-15 «Санитарно-эпидемиологические требования к обращению с радиоизотопными приборами и их устройству»\n'}, {'nameNpa': 'None', 'numberNpa': '07.07.2011', 'title': 'Постановление Главного государственного санитарного врача Российской Федерации   \n«Об утверждении СанПиН 2.6.1.2891-11 «Требования радиационной безопасности при производстве, эксплуатации и выводе из эксплуатации (утилизации) медицинской техники, содержащей источники ионизирующего излучения»\n\n'}, {'nameNpa': 'None', 'numberNpa': '27.12.2010', 'title': 'Постановление Главного государственного санитарного врача Российской Федерации «Об утверждении СанПиН 2.6.1.2802-10 «Ионизирующее излучение, радиационная безопасность. Гигиенические требования по обеспечению радиационной безопасности при проведении работ со скважинными генераторами нейтронов»\n\n'}, {'nameNpa': 'None', 'numberNpa': '24.12.2010', 'title': 'Постановление Главного государственного санитарного врача Российской Федерации «Об утверждении СанПиН 2.6.1.2800-10 «Гигиенические требования по ограничению облучения населения за счет источников ионизирующего излучения»\n\n'}, {'nameNpa': 'None', 'numberNpa': '15.10.2010', 'title': 'Постановление Главного государственного санитарного врача Российской Федерации\n «Об утверждении СанПиН 2.6.1.2748-10 «Гигиенические требования по обеспечению радиационной безопасности при работе с источниками неиспользуемого рентгеновского излучения»\n'}, {'nameNpa': 'None', 'numberNpa': '18.01.2010', 'title': 'Постановление Главного государственного санитарного врача РФ «Об утверждении СанПиН 2.6.1.2573-10 «Гигиенические требования к размещению и эксплуатации ускорителей электронов с энергией до 100 МэВ»\n\n'}, {'nameNpa': 'None', 'numberNpa': '16.06.2008', 'title': 'Постановление Главного государственного санитарного врача Российской Федерации «Об утверждении СанПиН 2.6.1.2368-08. «Гигиенические требования по обеспечению радиационной безопасности при проведении лучевой терапии с помощью открытых радионуклидных источников»\n   \n\n'}, {'nameNpa': 'None', 'numberNpa': '17.04.2003', 'title': 'Постановление Главного государственного санитарного врача Российской Федерации «О введении в действие СанПиН 2.6.1.1281-03 «Ионизирующее излучение. радиационная безопасность. Санитарные правила по радиационной безопасности персонала и населения при транспортировании радиоактивных материалов (веществ)»\n   \n\n'}, {'nameNpa': 'None', 'numberNpa': '12.03.2003', 'title': 'Постановление Главного государственного санитарного врача Российской Федерации «О введении в действие СанПиН 2.6.1.1202-03 «Ионизирующее излучение, радиационная безопасность. Гигиенические требования к использованию закрытых радионуклидных источников ионизирующего излучения при геофизических работах на буровых скважинах»\n   \n\n'}, {'nameNpa': 'None', 'numberNpa': '19.03.2002', 'title': 'Постановление Главного государственного санитарного врача Российской Федерации\n«О введении в действие санитарно-эпидемиологических правил и нормативов СанПиН 2.1.4.1116-02.«Питьевая вода и водоснабжение населенных мест. Питьевая вода. Гигиенические требования к качеству воды, расфасованной в емкости. Контроль качества»\n'}, {'nameNpa': 'None', 'numberNpa': '27.10.2020', 'title': 'Постановление Главного государственного санитарного врача Российской Федерации «Об утверждении санитарно-эпидемиологических правил и норм\nСанПиН 2.3/2.4.3590-20 «Санитарно-эпидемиологические требования к организации общественного питания населения»\n\n'}, {'nameNpa': 'None', 'numberNpa': '20.11.2020', 'title': 'Постановление Главного государственного санитарного врача Российской Федерации\n«Об утверждении санитарно-эпидемиологических правил\nСП 2.3.6.3668-20 «Санитарно-эпидемиологические требования к\n условиям деятельности торговых объектов и рынков, реализующих пищевую продукцию»\n'}, {'nameNpa': 'None', 'numberNpa': '16.10.2020', 'title': 'Постановление Главного государственного санитарного врача Российской Федерации\n«Об утверждении санитарных правил СП 2.5.3650-20 «Санитарно-эпидемиологические требования к отдельным видам транспорта и объектам транспортной инфраструктуры»\n'}, {'nameNpa': 'None', 'numberNpa': '02.12.2020', 'title': 'Постановление Главного государственного санитарного врача Российской Федерации «Об утверждении санитарных правил СП 2.2.3670-20 «Санитарно-эпидемиологичекие требования к условиям труда»\n\n'}, {'nameNpa': 'None', 'numberNpa': '24.12.2020', 'title': 'Постановление Главного государственного санитарного врача Российской Федерации\n«Об утверждении санитарных правил СП 2.1.3678-20 «Санитарно-эпидемиологические требования к эксплуатации помещений, зданий,сооружений, оборудования и транспорта, а также условиям деятельности хозяйствующих субъектов, осуществляющих продажу товаров, выполнение работ или оказание услуг»\n'}, {'nameNpa': 'None', 'numberNpa': '28.01.2021', 'title': 'Постановление Главного государственного санитарного врача Российской Федерации\n«Об утверждении санитарных правил и норм СанПин 1.2.3685-21 «Гигиенические нормативы и требования к обеспечению безопасности и (или) безвредности для человека факторов среды обитания»\n'}, {'nameNpa': 'None', 'numberNpa': '28.01.2021', 'title': 'Постановление Главного государственного санитарного врача Российской Федерации\n«Об утверждении санитарных правил и норм СанПин 2.1.3684-21 «Санитарно-эпидемиологические требования к содержанию территорий городских и сельских поселений, к водным объектам, питьевой воде и питьевому водоснабжению, атмосферному воздуху, почвам, жилым помещениям, эксплуатации производственных, общественных помещений, организации и проведению санитарно-противоэпидемиологических (профилактических) мероприятий»\n'}, {'nameNpa': 'None', 'numberNpa': '28.09.2020', 'title': 'Постановление Главного государственного санитарного врача Российской Федерации\n«Об утверждении санитарных правил СП 2.2.3648-20 «Санитарно-эпидемиологические требования к \nорганизациям воспитания и обучения, отдыха и оздоровления детей и молодежи»\n'}, {'nameNpa': 'None', 'numberNpa': '28.01.2021', 'title': 'Постановление Главного государственного санитарного врача Российской Федерации\nОб утверждении санитарных правил и норм СанПиН 3.3686-21 Санитарно-эпидемиологические требования по профилактике инфекционных болезней\n\n\n'}, {'nameNpa': 'None', 'numberNpa': '21.11.2011', 'title': 'Федеральный закон №323-ФЗ Об основах охраны здоровья граждан в Российской Федерации'}, {'nameNpa': 'None', 'numberNpa': '23.11.2009', 'title': 'Федеральный закон №261-ФЗ Об энергосбережении и о повышении энергетической эффективности и о внесении изменений в отдельные законодательные акты Российской Федерации'}, {'nameNpa': 'None', 'numberNpa': '10.01.2002', 'title': 'Федеральный закон №7-ФЗ Об охране окружающей среды'}, {'nameNpa': 'None', 'numberNpa': '22.11.1995', 'title': 'Федеральный закон N171-ФЗ О государственном регулировании производства и оборота этилового спирта, алкогольной и спиртосодержащей продукции и об ограничении потребления (распития) алкогольной продукции'}, {'nameNpa': 'None', 'numberNpa': '15.07.1999', 'title': 'Постановление Правительства РФ №825 Об утверждении перечня работ, выполнение которых связано с высоким риском заболевания инфекционными болезнями и требует обязательного проведения профилактических прививок'}, {'nameNpa': 'None', 'numberNpa': '28.01.2021', 'title': 'Приказ Минздрава России №29н Об утверждении Порядка проведения обязательных предварительных и периодических медицинских осмотров работников, предусмотренных частью четвертой статьи 213 Трудового кодекса Российской Федерации, перечня медицинских противопоказаний к осуществлению работ с вредными и (или) опасными производственными факторами, а также работам, при выполнении которых проводятся обязательные предварительные и периодические медицинские осмотры'}, {'nameNpa': 'None', 'numberNpa': '31.12.2020', 'title': 'Приказ Минтруда России N 988н, Минздрава России N 1420н Об утверждении перечня вредных и (или) опасных производственных факторов и работ, при выполнении которых проводятся обязательные предварительные медицинские осмотры при поступлении на работу и периодические медицинские осмотры'}, {'nameNpa': 'None', 'numberNpa': '20.02.2021', 'title': 'Приказ Минздрава России N129н Об утверждении требований к знаку о запрете курения табака, потребления никотинсодержащей продукции или использования кальянов и к порядку его размещения'}, {'nameNpa': 'None', 'numberNpa': '21.03.2014', 'title': 'Приказ Минздрава России №125н Об утверждении национального календаря профилактических прививок и календаря профилактических прививок по эпидемическим показаниям'}, {'nameNpa': 'None', 'numberNpa': '15.12.2014', 'title': 'Приказ Минздрава России №835н Об утверждении Порядка проведения предсменных, предрейсовых и послесменных, послерейсовых медицинских осмотров'}, {'nameNpa': 'None', 'numberNpa': '11.05.2001', 'title': 'Постановление Правительства РФ N369 Об утверждении Правил обращения с ломом и отходами черных металлов и их отчуждения'}, {'nameNpa': 'None', 'numberNpa': '11.05.2001', 'title': 'Постановление Правительства РФ №370 Об утверждении Правил обращения с ломом и отходами цветных металлов и их отчуждения'}, {'nameNpa': 'None', 'numberNpa': '18.11.2019', 'title': 'Приказ Департамента здравоохранения города Москвы №975 «Об утверждении регионального календаря профилактических прививок и календаря профилактических прививок по эпидемическим показаниям»'}, {'nameNpa': 'None', 'numberNpa': '16.10.2020', 'title': 'СП 2.5.3650-20 Санитарно-эпидемиологические требования к отдельным видам транспорта и объектам транспортной инфраструктуры'}, {'nameNpa': 'None', 'numberNpa': '05.05.2014', 'title': 'СанПиН 2.6.1.3164-14 Гигиенические требования по обеспечению радиационной безопасности при рентгеновской дефектоскопии'}, {'nameNpa': 'None', 'numberNpa': '22.05.2020', 'title': 'СП 3.1.3597-20 Профилактика новой коронавирусной инфекции (COVID-19)'}], 'resolved': False, 'resultEmpty': True, 'resultEmptyOrLate': False, 'resultInfoTypeCodes': [], 'resultViolationKnm': False, 'riskCategory': ['значительный риск', 'значительный риск', 'значительный риск'], 'riskCategoryAndDangerClass': ['значительный риск / Третий', 'значительный риск / Третий', 'значительный риск / Третий'], 'sezRegistryExists': False, 'signed': False, 'smevInfoType': None, 'smevMessageType': None, 'smevReceivedAt': None, 'smevReceivedAtEn': None, 'smevReceivedAtMonth': None, 'smevReceivedAtYear': None, 'spvRegistryExists': False, 'startDate': '20.06.2022', 'startDateEn': '2022-06-20', 'status': 'Исключена', 'statusEgrul': 'Найден', 'statusId': 15, 'stopDate': '01.07.2022', 'stopDateEn': '2022-07-01', 'subjectTypeId': 0, 'supervisionType': 'Федеральный государственный санитарно-эпидемиологический контроль (надзор)', 'supervisionTypeId': '004', 'torRegistryExists': False, 'updatePlanDate': '09.09.2022 14.29.51', 'updatePlanDateLong': 1662733791, 'version': 'ERKNM', 'violationLawsuitTypeCodes': [], 'violationTypeCodes': [], 'year': 2022}
2023-03-13 12:57:37,998 - [WARNING] - direct_sql.py - new_insert_in_database(302) - Проведена повторная попытка внесения с параметром special, результат неудачный.
2023-03-13 12:57:37,999 - [INFO] - direct_sql.py - database_inserts_conductor_for_multiprocessing(133) - Возникла ошибка, с которой не удалось справиться...
2023-03-13 12:57:37,999 - [INFO] - direct_sql.py - database_inserts_conductor_for_multiprocessing(134) - 
2023-03-13 12:57:38,013 - [ERROR] - direct_sql.py - new_insert_in_database(300) - (1040, 'ny connections')
2023-03-13 12:57:38,017 - [INFO] - direct_sql.py - new_insert_in_database(301) - {'actCreateDate': None, 'actCreateDateEn': None, 'addresses': ['Ленинградская область, Всеволожский район, Ждановские озера'], 'admLevelId': 50001, 'appealed': False, 'approveDocOrderDate': None, 'approveDocOrderNum': None, 'approveDocRequestDate': None, 'approveDocRequestNum': None, 'approveDocs': [], 'approveRequired': False, 'approved': True, 'approvedErknm': 'Согласовано', 'chlistCount': 0, 'chlistFilledCount': 0, 'chlistFillingIndicationTypeId': [], 'collaboratingOrganizations': [], 'collaboratingOrganizationsIds': [], 'comment': 'Не указан срок взаимодействия в ходе проведения выездной проверки, который должен соответствовать положениям ч. 7 ст. 73 Федерального закона от 31.07.2020 № 248-ФЗ. ', 'controllingOrganization': 'Управление Роспотребнадзора по Ленинградской области', 'controllingOrganizationId': 10001029910, 'createPlanDate': '04.08.2021 16.03.49', 'createPlanDateLong': 1628093029, 'createdByErpDb': False, 'createdById': 80949, 'dataNotEqualEGRUL': False, 'dataSetNotInTime': True, 'deleted': False, 'directDurationDays': None, 'disapprove': False, 'district': 'Ленинградская область', 'districtId': 1031410000000001, 'durationDays': 10, 'durationHours': 15, 'erknmActViolationIds': [], 'erknmResultKindDecisionIds': [], 'erpId': '78220041000101107439', 'events': [{'startDate': '15.08.2022', 'stopDate': '26.08.2022', 'title': 'Осмотр'}, {'startDate': '15.08.2022', 'stopDate': '26.08.2022', 'title': 'Опрос'}, {'startDate': '15.08.2022', 'stopDate': '26.08.2022', 'title': 'Получение письменных объяснений'}, {'startDate': '15.08.2022', 'stopDate': '26.08.2022', 'title': 'Истребование документов'}, {'startDate': '15.08.2022', 'stopDate': '26.08.2022', 'title': 'Отбор проб (образцов)'}, {'startDate': '15.08.2022', 'stopDate': '26.08.2022', 'title': 'Инструментальное обследование'}, {'startDate': '15.08.2022', 'stopDate': '26.08.2022', 'title': 'Испытание'}, {'startDate': '15.08.2022', 'stopDate': '26.08.2022', 'title': 'Экспертиза'}], 'federalLaw': '248', 'federalLawId': 3, 'fullFieldViolationKnm': False, 'hasViolations': False, 'id': 11179565, 'inn': '7814567144', 'inspectorFullName': ['Владимирова Ольга Викторовна', 'Скворцова Любовь Андреевна'], 'isFromSmev': False, 'isHasApproveDocs': False, 'isHasCollaboratingOrganization': False, 'isHasRequirements': True, 'isHasViolationTerm': False, 'isPm': False, 'kind': 'Выездная проверка', 'knmAnnulled': False, 'knmRejected': False, 'knmType': 'Плановое КНМ', 'knmTypeId': 4, 'legalBasisDocName': [], 'links': [], 'mspCategory': ['Микропредприятие'], 'noPunishment': False, 'notifyLate': False, 'objectsKind': ['организации отдыха детей и их оздоровления, в том числе лагеря с дневным пребыванием'], 'objectsSubKind': [], 'objectsType': ['Деятельность и действия'], 'ogrn': '1137847118310', 'oldKnm': None, 'oldPlan': None, 'orderDone': False, 'organizationName': 'ОБЩЕСТВО С ОГРАНИЧЕННОЙ ОТВЕТСТВЕННОСТЬЮ ВЕСТА', 'organizationsInn': ['7814567144'], 'organizationsName': ['ОБЩЕСТВО С ОГРАНИЧЕННОЙ ОТВЕТСТВЕННОСТЬЮ ВЕСТА'], 'organizationsOgrn': ['1137847118310'], 'planId': '2022038295', 'prosecutorOrganization': 'Прокуратура Ленинградской области', 'prosecutorOrganizationId': 767, 'publishedStatus': 'PUBLISHED', 'reasons': [204], 'reasonsList': [{'assignmentDate': None, 'assignmentDateEn': None, 'assignmentNumber': None, 'date': None, 'dateEn': None, 'requirementDetails': None, 'text': '(ФЗ 248) Истечение установленного федеральным законом о виде контроля, положением о виде контроля периода времени с даты иного события, установленного федеральным законом о виде контроля, положением о виде контроля, которое ведет к возникновению объекта контроля'}], 'recEmptyOrLate': False, 'regDateEgrul': '29.09.2021', 'regDateEgrulEn': '2021-09-29', 'regLate': False, 'regTypes': ['MSP'], 'requirements': 12, 'requirementsList': [{'nameNpa': 'None', 'numberNpa': '30.03.1999', 'title': 'О санитарно-эпидемиологическом благополучии населения '}, {'nameNpa': 'None', 'numberNpa': '17.09.1998', 'title': 'Об иммунопрофилактике инфекционных болезней '}, {'nameNpa': 'None', 'numberNpa': '27.12.2002', 'title': 'О техническом регулировании'}, {'nameNpa': 'None', 'numberNpa': '02.01.2000', 'title': ' О качестве и безопасности пищевых продуктов '}, {'nameNpa': 'None', 'numberNpa': '16.08.2011', 'title': 'О безопасности упаковки '}, {'nameNpa': 'None', 'numberNpa': '09.12.2011', 'title': 'О безопасности пищевой продукции '}, {'nameNpa': 'None', 'numberNpa': '09.12.2011', 'title': 'Пищевая продукция в части ее маркировки \t09.12.2011'}, {'nameNpa': 'None', 'numberNpa': '01.07.2014', 'title': '025/2012 «О безопасности мебельной продукции» \t'}, {'nameNpa': 'None', 'numberNpa': '27.10.2020', 'title': '«Санитарно-эпидемиологические требования к организации общественного питания населения» \t'}, {'nameNpa': 'None', 'numberNpa': '28.09.2020', 'title': '«Санитарно-эпидемиологические требования к организациям воспитания и обучения, отдыха и оздоровления детей и молодежи» \t'}, {'nameNpa': 'None', 'numberNpa': '28.01.2021', 'title': 'Гигиенические нормативы и требования к обеспечению безопасности и (или) безвредности для человека факторов среды обитания\t'}, {'nameNpa': 'None', 'numberNpa': '30.06.2020', 'title': '«Санитарно-эпидемиологические требования к устройству, содержанию и организации работы образовательных организаций и других объектов социальной инфраструктуры для детей и молодежи в условиях распространения новой коронавирусной инфекции (COVID-19) \t'}], 'resolved': False, 'resultEmpty': True, 'resultEmptyOrLate': False, 'resultInfoTypeCodes': [], 'resultViolationKnm': False, 'riskCategory': ['чрезвычайно высокий риск'], 'riskCategoryAndDangerClass': ['чрезвычайно высокий риск'], 'sezRegistryExists': False, 'signed': True, 'smevInfoType': None, 'smevMessageType': None, 'smevReceivedAt': None, 'smevReceivedAtEn': None, 'smevReceivedAtMonth': None, 'smevReceivedAtYear': None, 'spvRegistryExists': False, 'startDate': '15.08.2022', 'startDateEn': '2022-08-15', 'status': 'Ожидает завершения', 'statusEgrul': 'Найден', 'statusId': 6, 'stopDate': '26.08.2022', 'stopDateEn': '2022-08-26', 'subjectTypeId': 0, 'supervisionType': 'Федеральный государственный санитарно-эпидемиологический контроль (надзор)', 'supervisionTypeId': '004', 'torRegistryExists': False, 'updatePlanDate': '29.09.2022 19.14.54', 'updatePlanDateLong': 1664478894, 'version': 'ERKNM', 'violationLawsuitTypeCodes': [], 'violationTypeCodes': [], 'year': 2022}
2023-03-13 12:57:38,018 - [WARNING] - direct_sql.py - new_insert_in_database(302) - Проведена повторная попытка внесения с параметром special, результат неудачный.
2023-03-13 12:57:38,018 - [INFO] - direct_sql.py - database_inserts_conductor_for_multiprocessing(133) - Возникла ошибка, с которой не удалось справиться...
2023-03-13 12:57:38,018 - [INFO] - direct_sql.py - database_inserts_conductor_for_multiprocessing(134) - 
2023-03-13 12:57:38,019 - [ERROR] - direct_sql.py - new_insert_in_database(300) - (1040, 'ny connections')
2023-03-13 12:57:38,020 - [INFO] - direct_sql.py - new_insert_in_database(301) - {'actCreateDate': None, 'actCreateDateEn': None, 'addresses': ['ОБЛАСТЬ, ЯРОСЛАВСКАЯ, РАЙОН, РЫБИНСКИЙ, п.Кстово, 102, 760150010000284', 'ОБЛАСТЬ, ЯРОСЛАВСКАЯ, РАЙОН, РЫБИНСКИЙ, д.Вараксино, 105, 760150010000284', 'ОБЛАСТЬ, ЯРОСЛАВСКАЯ, РАЙОН, РЫБИНСКИЙ, с.Михайловское, уч.70, 760150010000284'], 'admLevelId': 50001, 'appealed': False, 'approveDocOrderDate': '18.05.2022', 'approveDocOrderNum': '492', 'approveDocRequestDate': None, 'approveDocRequestNum': None, 'approveDocs': [], 'approveRequired': False, 'approved': True, 'approvedErknm': 'Согласовано', 'chlistCount': 0, 'chlistFilledCount': 0, 'chlistFillingIndicationTypeId': [], 'collaboratingOrganizations': [], 'collaboratingOrganizationsIds': [], 'comment': None, 'controllingOrganization': 'Управление Роспотребнадзора по Ярославской области', 'controllingOrganizationId': 10001022016, 'createPlanDate': '10.08.2021 12.57.38', 'createPlanDateLong': 1628600258, 'createdByErpDb': False, 'createdById': 99664, 'dataNotEqualEGRUL': False, 'dataSetNotInTime': True, 'deleted': False, 'directDurationDays': None, 'disapprove': False, 'district': 'Ярославская область', 'districtId': 1030780000000001, 'durationDays': 10, 'durationHours': None, 'erknmActViolationIds': [3], 'erknmResultKindDecisionIds': ['D_1'], 'erpId': '76220041000100697567', 'events': [{'startDate': '10.06.2022', 'stopDate': '23.06.2022', 'title': 'Осмотр'}, {'startDate': '10.06.2022', 'stopDate': '23.06.2022', 'title': 'Истребование документов'}, {'startDate': '10.06.2022', 'stopDate': '23.06.2022', 'title': 'Отбор проб (образцов)'}], 'federalLaw': '248', 'federalLawId': 3, 'fullFieldViolationKnm': False, 'hasViolations': False, 'id': 10769693, 'inn': '7610028151', 'inspectorFullName': ['Комарова О. Г.', 'Небахарева Е. В.', 'Сысоева Ю. В.', 'Шильникова Е. В.'], 'isFromSmev': False, 'isHasApproveDocs': False, 'isHasCollaboratingOrganization': False, 'isHasRequirements': True, 'isHasViolationTerm': False, 'isPm': False, 'kind': 'Выездная проверка', 'knmAnnulled': False, 'knmRejected': False, 'knmType': 'Плановое КНМ', 'knmTypeId': 4, 'legalBasisDocName': [], 'links': [], 'mspCategory': ['Не является субъектом МСП'], 'noPunishment': False, 'notifyLate': False, 'objectsKind': ['Деятельность детских лагерей на время каникул', 'Деятельность детских лагерей на время каникул', 'Деятельность детских лагерей на время каникул'], 'objectsSubKind': ['Деятельность детских лагерей на время каникул', 'Деятельность детских лагерей на время каникул', 'Деятельность детских лагерей на время каникул'], 'objectsType': ['Деятельность и действия', 'Деятельность и действия', 'Деятельность и действия'], 'ogrn': '1027601114947', 'oldKnm': None, 'oldPlan': None, 'orderDone': False, 'organizationName': 'МУНИЦИПАЛЬНОЕ АВТОНОМНОЕ УЧРЕЖДЕНИЕ ЦЕНТР ОТДЫХА СОДРУЖЕСТВО', 'organizationsInn': ['7610028151'], 'organizationsName': ['МУНИЦИПАЛЬНОЕ АВТОНОМНОЕ УЧРЕЖДЕНИЕ ЦЕНТР ОТДЫХА СОДРУЖЕСТВО'], 'organizationsOgrn': ['1027601114947'], 'planId': '2022038464', 'prosecutorOrganization': 'Прокуратура Ярославской области', 'prosecutorOrganizationId': 529, 'publishedStatus': 'PUBLISHED', 'reasons': [204], 'reasonsList': [{'assignmentDate': None, 'assignmentDateEn': None, 'assignmentNumber': None, 'date': '12.08.2021', 'dateEn': '2021-08-12', 'requirementDetails': None, 'text': '(ФЗ 248) Истечение установленного федеральным законом о виде контроля, положением о виде контроля периода времени с даты иного события, установленного федеральным законом о виде контроля, положением о виде контроля, которое ведет к возникновению объекта контроля'}], 'recEmptyOrLate': False, 'regDateEgrul': '08.09.2021', 'regDateEgrulEn': '2021-09-08', 'regLate': False, 'regTypes': [], 'requirements': 12, 'requirementsList': [{'nameNpa': 'None', 'numberNpa': '30.03.1999', 'title': 'Федеральный закон «О санитарно-эпидемиологическом благополучии населения» № 52-ФЗ'}, {'nameNpa': 'None', 'numberNpa': '23.02.2013', 'title': 'Федеральный закон от 23.02.2013 N 15-ФЗ Об охране здоровья граждан от воздействия окружающего табачного дыма и последствий потребления табака'}, {'nameNpa': 'None', 'numberNpa': '28.01.2021', 'title': 'СанПиН 1.2.3685-21 «Гигиенические нормативы и требования к обеспечению безопасности и (или) безвредности для человека факторов среды обитания»'}, {'nameNpa': 'None', 'numberNpa': '18.09.2020', 'title': 'СП 2.4.3648-20 «Санитарно-эпидемиологические требования к организациям воспитания и обучения, отдыха и оздоровления детей и молодежи»'}, {'nameNpa': 'None', 'numberNpa': '27.10.2020', 'title': 'СанПиН 2.3/2.4.3590-20 «Санитарно-эпидемиологические требования к организации общественного питания населения»'}, {'nameNpa': 'None', 'numberNpa': '30.06.2020', 'title': 'СП 3.1/2.4.3598-20 «Санитарно-эпидемиологические требования к устройству, содержанию и организации работы образовательных организаций и других объектов социальной инфраструктуры для детей и молодежи в условиях распространения новой коронавирусной инфекции (COVID-19)»'}, {'nameNpa': 'None', 'numberNpa': '22.05.2020', 'title': 'СП 3.1.3597-20 «Профилактика новой коронавирусной инфекции (COVID-19)»'}, {'nameNpa': 'None', 'numberNpa': '28.01.2021', 'title': 'СанПиН 3.3686-21 Санитарно-эпидемиологические требования по профилактике инфекционных болезней'}, {'nameNpa': 'None', 'numberNpa': '28.01.2021', 'title': 'СанПиН 2.1.3684-21 «Санитарно-эпидемиологические требования к содержанию территорий городских и сельских поселений, к водным объектам, питьевой воде и питьевому водоснабжению, атмосферному воздуху, почвам, жилым помещениям, эксплуатации производственных, общественных помещений, организации и проведению санитарно-противоэпидемических (профилактических) мероприятий» '}, {'nameNpa': 'None', 'numberNpa': '13.07.2001', 'title': 'СанПиН 1.1.1058-01 «Организация и проведение производственного контроля за соблюдением санитарных правил и выполнением санитарно-противоэпидемиологических (профилактических) мероприятий», постановление'}, {'nameNpa': 'None', 'numberNpa': '28.01.2021', 'title': 'Приказ Минздрава России N 29н «Об утверждении Порядка проведения обязательных предварительных и периодических медицинских осмотров работников, предусмотренных частью четвертой статьи 213 Трудового кодекса Российской Федерации, перечня медицинских противопоказаний к осуществлению работ с вредными и (или) опасными производственными факторами, а также работам, при выполнении которых проводятся обязательные предварительные и периодические медицинские осмотры» '}, {'nameNpa': 'None', 'numberNpa': '14.11.2001', 'title': 'СанПиН 2.3.2.1078-01 «Гигиенические требования безопасности и пищевой ценности пищевых продуктов»'}], 'resolved': False, 'resultEmpty': False, 'resultEmptyOrLate': False, 'resultInfoTypeCodes': [], 'resultViolationKnm': False, 'riskCategory': ['чрезвычайно высокий риск', 'чрезвычайно высокий риск', 'чрезвычайно высокий риск'], 'riskCategoryAndDangerClass': ['чрезвычайно высокий риск', 'чрезвычайно высокий риск', 'чрезвычайно высокий риск'], 'sezRegistryExists': False, 'signed': True, 'smevInfoType': None, 'smevMessageType': None, 'smevReceivedAt': None, 'smevReceivedAtEn': None, 'smevReceivedAtMonth': None, 'smevReceivedAtYear': None, 'spvRegistryExists': False, 'startDate': '10.06.2022', 'startDateEn': '2022-06-10', 'status': 'Завершено', 'statusEgrul': 'Найден', 'statusId': 7, 'stopDate': '23.06.2022', 'stopDateEn': '2022-06-23', 'subjectTypeId': 0, 'supervisionType': 'Федеральный государственный санитарно-эпидемиологический контроль (надзор)', 'supervisionTypeId': '004', 'torRegistryExists': False, 'updatePlanDate': '14.06.2022 15.11.03', 'updatePlanDateLong': 1655219463, 'version': 'ERKNM', 'violationLawsuitTypeCodes': [], 'violationTypeCodes': [], 'year': 2022}
2023-03-13 12:57:38,021 - [WARNING] - direct_sql.py - new_insert_in_database(302) - Проведена повторная попытка внесения с параметром special, результат неудачный.
2023-03-13 12:57:38,021 - [INFO] - direct_sql.py - database_inserts_conductor_for_multiprocessing(133) - Возникла ошибка, с которой не удалось справиться...
2023-03-13 12:57:38,021 - [INFO] - direct_sql.py - database_inserts_conductor_for_multiprocessing(134) - 
2023-03-13 12:57:38,033 - [ERROR] - direct_sql.py - new_insert_in_database(300) - (1040, 'ny connections')
2023-03-13 12:57:38,033 - [INFO] - direct_sql.py - new_insert_in_database(301) - {'actCreateDate': None, 'actCreateDateEn': None, 'addresses': ['188322, Ленинградская область, Р-Н Гатчинский, Г. Коммунар, УЛ. Центральная, Д. Д.1А, '], 'admLevelId': 50001, 'appealed': False, 'approveDocOrderDate': '26.07.2022', 'approveDocOrderNum': '47-01-06-208-22', 'approveDocRequestDate': None, 'approveDocRequestNum': None, 'approveDocs': [], 'approveRequired': False, 'approved': None, 'approvedErknm': None, 'chlistCount': 0, 'chlistFilledCount': 0, 'chlistFillingIndicationTypeId': [], 'collaboratingOrganizations': [], 'collaboratingOrganizationsIds': [], 'comment': None, 'controllingOrganization': 'Управление Роспотребнадзора по Ленинградской области', 'controllingOrganizationId': 10001029910, 'createPlanDate': None, 'createPlanDateLong': None, 'createdByErpDb': False, 'createdById': 173998, 'dataNotEqualEGRUL': False, 'dataSetNotInTime': True, 'deleted': False, 'directDurationDays': None, 'disapprove': False, 'district': 'Ленинградская область', 'districtId': 1031410000000001, 'durationDays': 10, 'durationHours': None, 'erknmActViolationIds': [3], 'erknmResultKindDecisionIds': ['D_1'], 'erpId': '78220041000102654201', 'events': [{'startDate': '15.08.2022', 'stopDate': '26.08.2022', 'title': 'Осмотр'}, {'startDate': '15.08.2022', 'stopDate': '26.08.2022', 'title': 'Опрос'}, {'startDate': '15.08.2022', 'stopDate': '26.08.2022', 'title': 'Получение письменных объяснений'}, {'startDate': '15.08.2022', 'stopDate': '26.08.2022', 'title': 'Истребование документов'}, {'startDate': '15.08.2022', 'stopDate': '26.08.2022', 'title': 'Отбор проб (образцов)'}, {'startDate': '15.08.2022', 'stopDate': '26.08.2022', 'title': 'Инструментальное обследование'}, {'startDate': '15.08.2022', 'stopDate': '26.08.2022', 'title': 'Экспертиза'}], 'federalLaw': '248', 'federalLawId': 3, 'fullFieldViolationKnm': False, 'hasViolations': False, 'id': 12726320, 'inn': '026800217782', 'inspectorFullName': ['Романюк Ольга Олеговна', 'Смирнова Татьяна Михайловна-', 'Румянцева Светлана Валерьевна'], 'isFromSmev': False, 'isHasApproveDocs': False, 'isHasCollaboratingOrganization': False, 'isHasRequirements': True, 'isHasViolationTerm': False, 'isPm': False, 'kind': 'Выездная проверка', 'knmAnnulled': False, 'knmRejected': False, 'knmType': 'Внеплановое КНМ', 'knmTypeId': 5, 'legalBasisDocName': [], 'links': [], 'mspCategory': ['Не является субъектом МСП'], 'noPunishment': False, 'notifyLate': False, 'objectsKind': ['гостиницы и прочие места для временного проживания'], 'objectsSubKind': ['гостиницы и прочие места для временного проживания'], 'objectsType': ['Деятельность и действия'], 'ogrn': '317470400057949', 'oldKnm': None, 'oldPlan': None, 'orderDone': False, 'organizationName': 'САРГАЕВ КИРИЛ АНАТОЛЬЕВИЧ', 'organizationsInn': ['026800217782'], 'organizationsName': ['САРГАЕВ КИРИЛ АНАТОЛЬЕВИЧ'], 'organizationsOgrn': ['317470400057949'], 'planId': None, 'prosecutorOrganization': 'Прокуратура Ленинградской области', 'prosecutorOrganizationId': 767, 'publishedStatus': 'PUBLISHED', 'reasons': [309], 'reasonsList': [{'assignmentDate': None, 'assignmentDateEn': None, 'assignmentNumber': None, 'date': None, 'dateEn': None, 'requirementDetails': None, 'text': '(Постановление 336) Поручение Президента Российской Федерации'}], 'recEmptyOrLate': False, 'regDateEgrul': '26.07.2022', 'regDateEgrulEn': '2022-07-26', 'regLate': False, 'regTypes': [], 'requirements': 7, 'requirementsList': [{'nameNpa': 'None', 'numberNpa': '30.03.1999', 'title': 'Соблюдение санитарно-эпидемиологических требований ст.11 Закона РФ «О санитарно-эпидемиологическом благополучии населения»№52 ФЗ от 30.03.1999 г. '}, {'nameNpa': 'None', 'numberNpa': '28.01.2021', 'title': '«Санитарно-эпидемиологические требования к содержанию территорий 5 городских и сельских поселений, к водным объектам, питьевой воде и питьевому водоснабжению, атмосферному воздуху, почвам, жилым помещениям, эксплуатации производственных, общественных помещений, организации и проведению санитарно противоэпидемических (профилактических) мероприятий»'}, {'nameNpa': 'None', 'numberNpa': '28.01.2021', 'title': 'Гигиенические нормативы и требования к обеспечению безопасности и (или) безвредности для человека факторов среды обитания\n'}, {'nameNpa': 'None', 'numberNpa': '18.07.2021', 'title': '«Санитарно-эпидемиологические требования к эксплуатации помещений, зданий, сооружений, оборудования и транспорта, а также условиям деятельности хозяйствующих субъектов, осуществляющих продажу товаров, выполнение работ»'}, {'nameNpa': 'None', 'numberNpa': '15.02.2021', 'title': ' «Санитарно-эпидемиологические требования по профилактике инфекционных болезней»\n'}, {'nameNpa': 'None', 'numberNpa': '22.05.2020', 'title': '«Профилактика новой коронавирусной инфекции (COVID-19)»'}, {'nameNpa': 'None', 'numberNpa': '27.10.2020', 'title': '«Санитарно-эпидемиологические требования к организации общественного питания населения» '}], 'resolved': False, 'resultEmpty': False, 'resultEmptyOrLate': False, 'resultInfoTypeCodes': [], 'resultViolationKnm': False, 'riskCategory': [], 'riskCategoryAndDangerClass': ['Не применяется'], 'sezRegistryExists': False, 'signed': True, 'smevInfoType': None, 'smevMessageType': None, 'smevReceivedAt': None, 'smevReceivedAtEn': None, 'smevReceivedAtMonth': None, 'smevReceivedAtYear': None, 'spvRegistryExists': False, 'startDate': '15.08.2022', 'startDateEn': '2022-08-15', 'status': 'Завершено', 'statusEgrul': 'Не найден', 'statusId': 7, 'stopDate': '26.08.2022', 'stopDateEn': '2022-08-26', 'subjectTypeId': 0, 'supervisionType': 'Федеральный государственный санитарно-эпидемиологический контроль (надзор)', 'supervisionTypeId': '004', 'torRegistryExists': False, 'updatePlanDate': None, 'updatePlanDateLong': None, 'version': 'ERKNM', 'violationLawsuitTypeCodes': [], 'violationTypeCodes': [], 'year': 2022}
2023-03-13 12:57:38,035 - [WARNING] - direct_sql.py - new_insert_in_database(302) - Проведена повторная попытка внесения с параметром special, результат неудачный.
2023-03-13 12:57:38,035 - [INFO] - direct_sql.py - database_inserts_conductor_for_multiprocessing(133) - Возникла ошибка, с которой не удалось справиться...
2023-03-13 12:57:38,035 - [INFO] - direct_sql.py - database_inserts_conductor_for_multiprocessing(134) - 
2023-03-13 12:57:38,035 - [ERROR] - direct_sql.py - new_insert_in_database(300) - (1040, 'ny connections')
2023-03-13 12:57:38,036 - [INFO] - direct_sql.py - new_insert_in_database(301) - {'actCreateDate': None, 'actCreateDateEn': None, 'addresses': ['124536, ГОРОД МОСКВА, Г.ЗЕЛЕНОГРАД, ПР-Д НИКОЛЬСКИЙ, Д.5', '124482, г.Москва, г.Зеленоград, Никольский проезд, д. 5'], 'admLevelId': 50001, 'appealed': False, 'approveDocOrderDate': '17.06.2022', 'approveDocOrderNum': '01-32-00014', 'approveDocRequestDate': None, 'approveDocRequestNum': None, 'approveDocs': [], 'approveRequired': False, 'approved': True, 'approvedErknm': 'Согласовано', 'chlistCount': 0, 'chlistFilledCount': 0, 'chlistFillingIndicationTypeId': [], 'collaboratingOrganizations': [], 'collaboratingOrganizationsIds': [], 'comment': 'Привести в соответствие срок проведения проверки, установленный  ч. 7 ст. 73 Федерального закона № 248-ФЗ «О государственном контроле (надзоре) и муниципальном контроле в Российской Федерации».  В графе формулировка требования необходимо  указать структурные единицы НПА, содержащие обязательные требования, соблюдение  которых  является предметом КНМ. ', 'controllingOrganization': 'Управление Роспотребнадзора по г. Москве', 'controllingOrganizationId': 10001029839, 'createPlanDate': '02.09.2021 11.01.04', 'createPlanDateLong': 1630580464, 'createdByErpDb': False, 'createdById': 79739, 'dataNotEqualEGRUL': False, 'dataSetNotInTime': True, 'deleted': False, 'directDurationDays': None, 'disapprove': False, 'district': 'Город Москва столица Российской Федерации город федерального значения', 'districtId': 1030450000000001, 'durationDays': 10, 'durationHours': None, 'erknmActViolationIds': [2, 3], 'erknmResultKindDecisionIds': ['D_6'], 'erpId': '77220041000100946500', 'events': [{'startDate': '20.06.2022', 'stopDate': '01.07.2022', 'title': 'Осмотр'}, {'startDate': '20.06.2022', 'stopDate': '01.07.2022', 'title': 'Опрос'}, {'startDate': '20.06.2022', 'stopDate': '01.07.2022', 'title': 'Получение письменных объяснений'}, {'startDate': '20.06.2022', 'stopDate': '01.07.2022', 'title': 'Истребование документов'}, {'startDate': '20.06.2022', 'stopDate': '01.07.2022', 'title': 'Отбор проб (образцов)'}, {'startDate': '20.06.2022', 'stopDate': '01.07.2022', 'title': 'Инструментальное обследование'}, {'startDate': '20.06.2022', 'stopDate': '01.07.2022', 'title': 'Испытание'}, {'startDate': '20.06.2022', 'stopDate': '01.07.2022', 'title': 'Экспертиза'}], 'federalLaw': '248', 'federalLawId': 3, 'fullFieldViolationKnm': False, 'hasViolations': False, 'id': 11018626, 'inn': '7735545349', 'inspectorFullName': ['Королева Ирина Ивановна', 'Никитенко Ирина Владимировна', 'Монтоев Чингиз Дашиевич'], 'isFromSmev': False, 'isHasApproveDocs': False, 'isHasCollaboratingOrganization': False, 'isHasRequirements': True, 'isHasViolationTerm': False, 'isPm': False, 'kind': 'Выездная проверка', 'knmAnnulled': False, 'knmRejected': False, 'knmType': 'Плановое КНМ', 'knmTypeId': 4, 'legalBasisDocName': [], 'links': [], 'mspCategory': ['Не является субъектом МСП'], 'noPunishment': False, 'notifyLate': False, 'objectsKind': ['Деятельность санаторно-курортных учреждений ', 'Деятельность санаторно-курортных учреждений '], 'objectsSubKind': ['Оказание стационарной и санаторно-курортной медицинской помощи', 'Оказание стационарной и санаторно-курортной медицинской помощи'], 'objectsType': ['Деятельность и действия', 'Результаты деятельности'], 'ogrn': '5087746333197', 'oldKnm': None, 'oldPlan': None, 'orderDone': False, 'organizationName': 'ГОСУДАРСТВЕННОЕ БЮДЖЕТНОЕ УЧРЕЖДЕНИЕ ГОРОДА МОСКВЫ ПАНСИОНАТ НИКОЛЬСКИЙ ПАРК ДЕПАРТАМЕНТА ТРУДА И СОЦИАЛЬНОЙ ЗАЩИТЫ НАСЕЛЕНИЯ ГОРОДА МОСКВЫ', 'organizationsInn': ['7735545349'], 'organizationsName': ['ГОСУДАРСТВЕННОЕ БЮДЖЕТНОЕ УЧРЕЖДЕНИЕ ГОРОДА МОСКВЫ ПАНСИОНАТ НИКОЛЬСКИЙ ПАРК ДЕПАРТАМЕНТА ТРУДА И СОЦИАЛЬНОЙ ЗАЩИТЫ НАСЕЛЕНИЯ ГОРОДА МОСКВЫ'], 'organizationsOgrn': ['5087746333197'], 'planId': '2022040517', 'prosecutorOrganization': 'Прокуратура города Москвы', 'prosecutorOrganizationId': 554, 'publishedStatus': 'PUBLISHED', 'reasons': [201], 'reasonsList': [{'assignmentDate': None, 'assignmentDateEn': None, 'assignmentNumber': None, 'date': '25.03.2021', 'dateEn': '2021-03-25', 'requirementDetails': None, 'text': '(ФЗ 248) Истечение установленного федеральным законом о виде контроля, положением о виде контроля период времени с даты окончания проведения последнего планового контрольного (надзорного) мероприятия'}], 'recEmptyOrLate': False, 'regDateEgrul': '22.09.2021', 'regDateEgrulEn': '2021-09-22', 'regLate': False, 'regTypes': [], 'requirements': 14, 'requirementsList': [{'nameNpa': 'None', 'numberNpa': '09.12.2011', 'title': 'ТР ТС 021/2011. Технический регламент Таможенного союза «О безопасности пищевой продукции»'}, {'nameNpa': 'None', 'numberNpa': '09.12.2011', 'title': 'ТР ТС 022/2011. Технический регламент Таможенного союза «Пищевая продукция в части ее маркировки»'}, {'nameNpa': 'None', 'numberNpa': '09.10.2013', 'title': 'ТР ТС 033/2013. Технический регламент Таможенного союза «О безопасности молока и молочной продукции» '}, {'nameNpa': 'None', 'numberNpa': '09.10.2013', 'title': 'ТР ТС 034/2013. Технический регламент Таможенного союза «О безопасности мяса и мясной продукции» '}, {'nameNpa': 'None', 'numberNpa': '18.10.2016', 'title': 'ТР ЕАЭС 040/2016. Технический регламент\nЕвразийского экономического союза «О безопасности рыбы и рыбной продукции» '}, {'nameNpa': 'None', 'numberNpa': '30.03.1999', 'title': 'Федеральный закон «О санитарно-эпидемиологическом благополучии населения» №52-ФЗ '}, {'nameNpa': 'None', 'numberNpa': '17.09.1998', 'title': 'Федеральный закон «Об иммунопрофилактике инфекционных болезней» №157-ФЗ '}, {'nameNpa': 'None', 'numberNpa': '23.02.2013', 'title': 'Федеральный закон «Об охране здоровья граждан от воздействия окружающего табачного дыма и последствий потребления табака» №15-ФЗ '}, {'nameNpa': 'None', 'numberNpa': '27.03.2007', 'title': 'Постановление Главного государственного санитарного врача РФ «Об утверждении санитарных правил\nСП 1.1.2193-07 «Изменения и дополнения № 1 к санитарным правилам «Организация и проведение производственного контроля за соблюдением санитарных правил и выполнением санитарно-противоэпидемических (профилактических) мероприятий» '}, {'nameNpa': 'None', 'numberNpa': '22.05.2020', 'title': 'Постановление Главного государственного санитарного врача Российской Федерации «Об утверждении санитарно-эпидемиологических правил\nСП 3.1.3597-20 Профилактика новой коронавирусной инфекции (COVID-19)» '}, {'nameNpa': 'None', 'numberNpa': '27.10.2020', 'title': 'Постановление Главного государственного санитарного врача Российской Федерации «Об утверждении санитарно-эпидемиологических правил и норм\nСанПиН 2.3/2.4.3590-20 «Санитарно-эпидемиологические требования к организации общественного питания населения»'}, {'nameNpa': 'None', 'numberNpa': '13.11.2020', 'title': 'Постановление Главного государственного санитарного врача Российской Федерации «О внесении изменений в постановление Главного государственного санитарного врача Российской Федерации от 22.05.2020 № 15 «Об утверждении санитарно-эпидемиологических правил СП 3.1.3597-20 «Профилактика новой коронавирусной инфекции (COVID-19)»'}, {'nameNpa': 'None', 'numberNpa': '24.12.2020', 'title': 'Постановление Главного государственного санитарного врача Российской Федерации «Об утверждении санитарных правил СП 2.1.3678-20 «Санитарно-эпидемиологические требования к эксплуатации помещений, зданий,сооружений, оборудования и транспорта, а также условиям деятельности хозяйствующих субъектов, осуществляющих продажу товаров, выполнение работ или оказание услуг» '}, {'nameNpa': 'None', 'numberNpa': '28.01.2021', 'title': 'Постановление Главного государственного санитарного врача Российской Федерации Об утверждении санитарных правил и норм СанПиН 3.3686-21 Санитарно-эпидемиологические требования по профилактике инфекционных болезней '}], 'resolved': False, 'resultEmpty': False, 'resultEmptyOrLate': False, 'resultInfoTypeCodes': [], 'resultViolationKnm': False, 'riskCategory': ['чрезвычайно высокий риск', 'чрезвычайно высокий риск'], 'riskCategoryAndDangerClass': ['чрезвычайно высокий риск / Первый', 'чрезвычайно высокий риск / Первый'], 'sezRegistryExists': False, 'signed': True, 'smevInfoType': None, 'smevMessageType': None, 'smevReceivedAt': None, 'smevReceivedAtEn': None, 'smevReceivedAtMonth': None, 'smevReceivedAtYear': None, 'spvRegistryExists': False, 'startDate': '20.06.2022', 'startDateEn': '2022-06-20', 'status': 'Завершено', 'statusEgrul': 'Найден', 'statusId': 7, 'stopDate': '01.07.2022', 'stopDateEn': '2022-07-01', 'subjectTypeId': 0, 'supervisionType': 'Федеральный государственный санитарно-эпидемиологический контроль (надзор)', 'supervisionTypeId': '004', 'torRegistryExists': False, 'updatePlanDate': '09.09.2022 14.29.51', 'updatePlanDateLong': 1662733791, 'version': 'ERKNM', 'violationLawsuitTypeCodes': [], 'violationTypeCodes': [], 'year': 2022}
2023-03-13 12:57:38,036 - [WARNING] - direct_sql.py - new_insert_in_database(302) - Проведена повторная попытка внесения с параметром special, результат неудачный.
2023-03-13 12:57:38,037 - [INFO] - direct_sql.py - database_inserts_conductor_for_multiprocessing(133) - Возникла ошибка, с которой не удалось справиться...
2023-03-13 12:57:38,037 - [INFO] - direct_sql.py - database_inserts_conductor_for_multiprocessing(134) - 
2023-03-13 12:57:38,053 - [ERROR] - direct_sql.py - new_insert_in_database(300) - (1040, 'ny connections')
2023-03-13 12:57:38,056 - [INFO] - direct_sql.py - new_insert_in_database(301) - {'actCreateDate': None, 'actCreateDateEn': None, 'addresses': ['рп. Черемушки, микрорайон 4, 31'], 'admLevelId': 50001, 'appealed': False, 'approveDocOrderDate': None, 'approveDocOrderNum': None, 'approveDocRequestDate': None, 'approveDocRequestNum': None, 'approveDocs': [], 'approveRequired': False, 'approved': False, 'approvedErknm': 'Отказано', 'chlistCount': 0, 'chlistFilledCount': 0, 'chlistFillingIndicationTypeId': [], 'collaboratingOrganizations': [], 'collaboratingOrganizationsIds': [], 'comment': None, 'controllingOrganization': 'Управление Роспотребнадзора по Республике Хакасия', 'controllingOrganizationId': 10001021478, 'createPlanDate': '07.09.2021 05.31.05', 'createPlanDateLong': 1630992665, 'createdByErpDb': False, 'createdById': 74947, 'dataNotEqualEGRUL': False, 'dataSetNotInTime': False, 'deleted': False, 'directDurationDays': None, 'disapprove': False, 'district': 'Республика Хакасия', 'districtId': 1035950000000001, 'durationDays': 10, 'durationHours': 80, 'erknmActViolationIds': [], 'erknmResultKindDecisionIds': [], 'erpId': '19220041000100870569', 'events': [{'startDate': '12.07.2022', 'stopDate': '25.07.2022', 'title': 'Осмотр'}, {'startDate': '12.07.2022', 'stopDate': '25.07.2022', 'title': 'Досмотр'}, {'startDate': '12.07.2022', 'stopDate': '25.07.2022', 'title': 'Опрос'}, {'startDate': '12.07.2022', 'stopDate': '25.07.2022', 'title': 'Получение письменных объяснений'}, {'startDate': '12.07.2022', 'stopDate': '25.07.2022', 'title': 'Истребование документов'}, {'startDate': '12.07.2022', 'stopDate': '25.07.2022', 'title': 'Отбор проб (образцов)'}, {'startDate': '12.07.2022', 'stopDate': '25.07.2022', 'title': 'Инструментальное обследование'}, {'startDate': '12.07.2022', 'stopDate': '25.07.2022', 'title': 'Испытание'}, {'startDate': '12.07.2022', 'stopDate': '25.07.2022', 'title': 'Экспертиза'}], 'federalLaw': '248', 'federalLawId': 3, 'fullFieldViolationKnm': False, 'hasViolations': False, 'id': 10942695, 'inn': '1902015399', 'inspectorFullName': [], 'isFromSmev': False, 'isHasApproveDocs': False, 'isHasCollaboratingOrganization': False, 'isHasRequirements': True, 'isHasViolationTerm': False, 'isPm': False, 'kind': 'Выездная проверка', 'knmAnnulled': False, 'knmRejected': False, 'knmType': 'Плановое КНМ', 'knmTypeId': 4, 'legalBasisDocName': [], 'links': [], 'mspCategory': ['Не является субъектом МСП'], 'noPunishment': False, 'notifyLate': False, 'objectsKind': ['Деятельность дошкольных образовательных организаций'], 'objectsSubKind': ['Деятельность дошкольных образовательных организаций'], 'objectsType': ['Деятельность и действия'], 'ogrn': '1021900672826', 'oldKnm': None, 'oldPlan': None, 'orderDone': False, 'organizationName': 'МУНИЦИПАЛЬНОЕ БЮДЖЕТНОЕ ДОШКОЛЬНОЕ ОБРАЗОВАТЕЛЬНОЕ УЧРЕЖДЕНИЕ ДЕТСКИЙ САД № 10 ЩЕЛКУНЧИК МУНИЦИПАЛЬНОГО ОБРАЗОВАНИЯ Г. САЯНОГОРСК', 'organizationsInn': ['1902015399'], 'organizationsName': ['МУНИЦИПАЛЬНОЕ БЮДЖЕТНОЕ ДОШКОЛЬНОЕ ОБРАЗОВАТЕЛЬНОЕ УЧРЕЖДЕНИЕ ДЕТСКИЙ САД № 10 ЩЕЛКУНЧИК МУНИЦИПАЛЬНОГО ОБРАЗОВАНИЯ Г. САЯНОГОРСК'], 'organizationsOgrn': ['1021900672826'], 'planId': '2022041622', 'prosecutorOrganization': 'Прокуратура республики Хакасия', 'prosecutorOrganizationId': 2080, 'publishedStatus': 'UNPUBLISHED', 'reasons': [201], 'reasonsList': [{'assignmentDate': None, 'assignmentDateEn': None, 'assignmentNumber': None, 'date': '21.04.2019', 'dateEn': '2019-04-21', 'requirementDetails': None, 'text': '(ФЗ 248) Истечение установленного федеральным законом о виде контроля, положением о виде контроля период времени с даты окончания проведения последнего планового контрольного (надзорного) мероприятия'}], 'recEmptyOrLate': False, 'regDateEgrul': '19.09.2021', 'regDateEgrulEn': '2021-09-19', 'regLate': False, 'regTypes': [], 'requirements': 16, 'requirementsList': [{'nameNpa': 'None', 'numberNpa': '30.03.1999', 'title': 'Федеральный закон от 30.03.1999 № 52 О санитарно-эпидемиологическом благополучии населения'}, {'nameNpa': 'None', 'numberNpa': '02.01.2000', 'title': 'Федеральный Закон от 02.01.2000 № 29-ФЗ «О качестве и безопасности пищевых продуктов», принят Государственной Думой 01.12.1999г, одобрен Советом Федерации 23.12.1999 (с последующими изменениями и дополнениями)'}, {'nameNpa': 'None', 'numberNpa': '27.12.2002', 'title': 'Федеральный Закон от 27.12.2002 № 184-ФЗ «О техническом регулировании» принят Государственной Думой 15.12.2002, одобрен Советом Федерации 18.12.2002 (с после-дующими изменениями и дополнениями)'}, {'nameNpa': 'None', 'numberNpa': '23.02.2013', 'title': 'Федеральный Закон от 23.02.2013 № 15-ФЗ «Об охране здоровья граж-дан от воздействия окружающего табачного дыма и последствий потребления табака», принят Государственной Думой 12.02.2013, одобрен Советом Федерации 20.02.2013 (с последующими изменениями и дополнениями)'}, {'nameNpa': 'None', 'numberNpa': '17.09.1998', 'title': 'Федеральный Закон от 17.09.1998 № 157-ФЗ «Об имму-нопрофилактике инфекционных болезней», принят Государственной Думой 17.07.1998, одобрен Советом Федерации 04.09.1998 (с последующими изменениями и дополнения-ми)'}, {'nameNpa': 'None', 'numberNpa': '18.06.2001', 'title': 'Федеральный Закон от 18.06.2001 № 77-ФЗ «О предупреждении распростране-ния туберкулеза в Российской Федерации», принят Государственной Думой 24.05.2001, одобрен Советом Федерации 06.06.2001 (с последующими изменениями и дополнения-ми)'}, {'nameNpa': 'None', 'numberNpa': '28.09.2020', 'title': 'СП 2.4.3648-20 «Санитарно-эпидемиологические требования к организа-циям воспитания и обучения, отдыха и оздоровления детей и молодежи» (утв. постановлением Главного государственного санитарного врача России 28.09.2020 N 28, зарегистрировано в Минюсте России 18.12.2020 N 61573) с 01.01.2021\n'}, {'nameNpa': 'None', 'numberNpa': '27.10.2020', 'title': 'СанПиН 2.3/2.4.3590-20 «Санитарно-эпидемиологические тре-бования к организации общественного питания населения» (утв. Постановлением Глав-ного государственного санитарного врача России № 32 от 27.10.2020, зарегистрирова-ны в Минюсте Российской Федерации 11ноября 2020) с 01.01.2021'}, {'nameNpa': 'None', 'numberNpa': '30.06.2020', 'title': 'СП 3.1/2.4.3598-20 «Санитарно-эпидемиологические требования к устройст-ву, содержанию и организации работы образовательных организаций и других объектов социальной инфраструктуры для детей и молодежи в условиях распространения новой коронавирусной инфекции (COVID-19)» (утв. постановлением Главного государственного санитарного врача России 30.06.2020 N 16, зарегистрировано в Минюсте России 03.07.2020 N 58824)'}, {'nameNpa': 'None', 'numberNpa': '22.05.2020', 'title': 'СП 3.1.3597-20 «Профилактика новой коронавирусной инфекции (COVID-19), (утв. постановлением Главного государственного санитарного врача России 22.05.2020 № 15, зарегистрировано в Минюсте России 26.05.2020 № 58465)'}, {'nameNpa': 'None', 'numberNpa': '02.12.2020', 'title': 'СП 2.2.3670-20 «Санитарно-эпидемиологические требования к ус-ловиям труда», утверждены Постановлением Главного государственного санитарного врача РФ от 02.12.2020 N 40, зарегистрировано в Минюсте России 29.12.2020 N 6189'}, {'nameNpa': 'None', 'numberNpa': '24.12.2020', 'title': 'СП 2.1.3678-20 «Санитарно-эпидемиологические требования к эксплуатации помещений, зданий, сооружений, оборудо-вания и транспорта, а также условиям деятельности хозяйствующих субъектов, осуществ-ляющих продажу товаров, выполнение работ или оказание услуг», утверждены Постановле-нием Главного государственного санитарного врача РФ от 24.12.2020 N 44, зарегистрировано в Минюсте России 30.12.2020 N 61953'}, {'nameNpa': 'None', 'numberNpa': '28.01.2021', 'title': 'СанПиН 2.1.3684-21 «Санитарно-эпидемиологические требо-вания к содержанию территорий городских и сельских поселений, к водным объектам, питьевой воде и питьевому водоснабжению, атмосферному воздуху, почвам, жилым по-мещениям, эксплуатации производственных, общественных помещений, организации и проведению санитарно-противоэпидемических (профилактических) мероприятий», ут-верждены Постановлением Главного государственного санитарного врача РФ от 28.01.2021 N 3, зарегистрировано в Минюсте России 29.01.2021 N 62297'}, {'nameNpa': 'None', 'numberNpa': '28.01.2021', 'title': 'СанПиН 1.2.3685-21 «Гигиениче-ские нормативы и требования к обеспечению безопасности и (или) безвредности для че-ловека факторов среды обитания», утверждены Постановлением Главного государственного санитарного врача РФ от 28.01.2021 N 2, Зарегистрировано в Минюсте России 29.01.2021 N 62296'}, {'nameNpa': 'None', 'numberNpa': '28.01.2021', 'title': 'СанПиН 3.3686-21 «Санитарно-эпидемиологические требования по профи-лак-тике инфекционных болезней» (утв. Постановлением Главного государственного сани-тарно-го врача Российской Федерации 28.01.2021 №4, Зарегистрировано в Минюсте России 15.02.2021 N 62500)'}, {'nameNpa': 'None', 'numberNpa': '30.03.1999', 'title': 'Федеральный закон от 30.03.1999 № 52 О санитарно-эпидемиологическом благополучии населения'}], 'resolved': False, 'resultEmpty': True, 'resultEmptyOrLate': False, 'resultInfoTypeCodes': [], 'resultViolationKnm': False, 'riskCategory': ['чрезвычайно высокий риск'], 'riskCategoryAndDangerClass': ['чрезвычайно высокий риск'], 'sezRegistryExists': False, 'signed': False, 'smevInfoType': None, 'smevMessageType': None, 'smevReceivedAt': None, 'smevReceivedAtEn': None, 'smevReceivedAtMonth': None, 'smevReceivedAtYear': None, 'spvRegistryExists': False, 'startDate': '12.07.2022', 'startDateEn': '2022-07-12', 'status': 'Исключена', 'statusEgrul': 'Найден', 'statusId': 15, 'stopDate': None, 'stopDateEn': None, 'subjectTypeId': 0, 'supervisionType': 'Федеральный государственный санитарно-эпидемиологический контроль (надзор)', 'supervisionTypeId': '004', 'torRegistryExists': False, 'updatePlanDate': '11.01.2023 09.14.51', 'updatePlanDateLong': 1673428491, 'version': 'ERKNM', 'violationLawsuitTypeCodes': [], 'violationTypeCodes': [], 'year': 2022}
2023-03-13 12:57:38,059 - [WARNING] - direct_sql.py - new_insert_in_database(302) - Проведена повторная попытка внесения с параметром special, результат неудачный.
2023-03-13 12:57:38,059 - [INFO] - direct_sql.py - database_inserts_conductor_for_multiprocessing(133) - Возникла ошибка, с которой не удалось справиться...
2023-03-13 12:57:38,060 - [INFO] - direct_sql.py - database_inserts_conductor_for_multiprocessing(134) - 
2023-03-13 12:57:38,074 - [ERROR] - direct_sql.py - new_insert_in_database(300) - (1040, 'ny connections')
2023-03-13 12:57:38,074 - [INFO] - direct_sql.py - new_insert_in_database(301) - {'actCreateDate': None, 'actCreateDateEn': None, 'addresses': ['150022, ОБЛАСТЬ, ЯРОСЛАВСКАЯ, ГОРОД, ЯРОСЛАВЛЬ, УЛИЦА, 2-Я ПОРТОВАЯ, 1, 760000010000672', 'г.Ярославль, Фрунзенский район, ул.2-я Портовая, д. 1', '150022, ОБЛАСТЬ, ЯРОСЛАВСКАЯ, ГОРОД, ЯРОСЛАВЛЬ, УЛИЦА, 2-Я ПОРТОВАЯ, 1, 760000010000672', '150022, ОБЛАСТЬ, ЯРОСЛАВСКАЯ, ГОРОД, ЯРОСЛАВЛЬ, УЛИЦА, 2-Я ПОРТОВАЯ, 1, 760000010000672', '150022, ОБЛАСТЬ, ЯРОСЛАВСКАЯ, ГОРОД, ЯРОСЛАВЛЬ, УЛИЦА, 2-Я ПОРТОВАЯ, 1, 760000010000672', '150022, ОБЛАСТЬ, ЯРОСЛАВСКАЯ, ГОРОД, ЯРОСЛАВЛЬ, УЛИЦА, 2-Я ПОРТОВАЯ, 1, 760000010000672', '150022, ОБЛАСТЬ, ЯРОСЛАВСКАЯ, ГОРОД, ЯРОСЛАВЛЬ, УЛ Тормозное шоссе д.117а', '150022, ОБЛАСТЬ, ЯРОСЛАВСКАЯ, ГОРОД, ЯРОСЛАВЛЬ, дер Парково'], 'admLevelId': 50001, 'appealed': False, 'approveDocOrderDate': None, 'approveDocOrderNum': None, 'approveDocRequestDate': None, 'approveDocRequestNum': None, 'approveDocs': [], 'approveRequired': False, 'approved': False, 'approvedErknm': 'Отказано', 'chlistCount': 0, 'chlistFilledCount': 0, 'chlistFillingIndicationTypeId': [], 'collaboratingOrganizations': [], 'collaboratingOrganizationsIds': [], 'comment': None, 'controllingOrganization': 'Управление Роспотребнадзора по Ярославской области', 'controllingOrganizationId': 10001022016, 'createPlanDate': '10.08.2021 12.57.38', 'createPlanDateLong': 1628600258, 'createdByErpDb': False, 'createdById': 107773, 'dataNotEqualEGRUL': False, 'dataSetNotInTime': False, 'deleted': False, 'directDurationDays': None, 'disapprove': False, 'district': 'Ярославская область', 'districtId': 1030780000000001, 'durationDays': 10, 'durationHours': None, 'erknmActViolationIds': [], 'erknmResultKindDecisionIds': [], 'erpId': '76220041000100727523', 'events': [{'startDate': '06.06.2022', 'stopDate': '17.06.2022', 'title': 'Осмотр'}, {'startDate': '06.06.2022', 'stopDate': '17.06.2022', 'title': 'Истребование документов'}, {'startDate': '06.06.2022', 'stopDate': '17.06.2022', 'title': 'Отбор проб (образцов)'}], 'federalLaw': '248', 'federalLawId': 3, 'fullFieldViolationKnm': False, 'hasViolations': False, 'id': 10799649, 'inn': '7607001209', 'inspectorFullName': [], 'isFromSmev': False, 'isHasApproveDocs': False, 'isHasCollaboratingOrganization': False, 'isHasRequirements': True, 'isHasViolationTerm': False, 'isPm': False, 'kind': 'Выездная проверка', 'knmAnnulled': False, 'knmRejected': False, 'knmType': 'Плановое КНМ', 'knmTypeId': 4, 'legalBasisDocName': [], 'links': [], 'mspCategory': ['Не является субъектом МСП'], 'noPunishment': False, 'notifyLate': False, 'objectsKind': ['Деятельность водного транспорта', 'Деятельность водного транспорта', 'Деятельность водного транспорта', 'Деятельность водного транспорта', 'Деятельность водного транспорта', 'Деятельность водного транспорта', 'Вспомогательная и дополнительнаятранспортная деятельность', 'Вспомогательная и дополнительнаятранспортная деятельность'], 'objectsSubKind': ['Деятельность водного транспорта', 'Деятельность водного транспорта', 'Деятельность водного транспорта', 'Деятельность водного транспорта', 'Деятельность водного транспорта', 'Деятельность водного транспорта', 'Вспомогательная и дополнительнаятранспортная деятельность', 'Вспомогательная и дополнительнаятранспортная деятельность'], 'objectsType': ['Деятельность и действия', 'Деятельность и действия', 'Деятельность и действия', 'Деятельность и действия', 'Деятельность и действия', 'Деятельность и действия', 'Деятельность и действия', 'Деятельность и действия'], 'ogrn': '1027600983629', 'oldKnm': None, 'oldPlan': None, 'orderDone': False, 'organizationName': 'АКЦИОНЕРНОЕ ОБЩЕСТВО ЯРОСЛАВСКИЙ РЕЧНОЙ ПОРТ', 'organizationsInn': ['7607001209'], 'organizationsName': ['АКЦИОНЕРНОЕ ОБЩЕСТВО ЯРОСЛАВСКИЙ РЕЧНОЙ ПОРТ'], 'organizationsOgrn': ['1027600983629'], 'planId': '2022038464', 'prosecutorOrganization': 'Прокуратура Ярославской области', 'prosecutorOrganizationId': 529, 'publishedStatus': 'UNPUBLISHED', 'reasons': [201], 'reasonsList': [{'assignmentDate': None, 'assignmentDateEn': None, 'assignmentNumber': None, 'date': '17.05.2018', 'dateEn': '2018-05-17', 'requirementDetails': None, 'text': '(ФЗ 248) Истечение установленного федеральным законом о виде контроля, положением о виде контроля период времени с даты окончания проведения последнего планового контрольного (надзорного) мероприятия'}], 'recEmptyOrLate': False, 'regDateEgrul': '15.03.2022', 'regDateEgrulEn': '2022-03-15', 'regLate': False, 'regTypes': [], 'requirements': 10, 'requirementsList': [{'nameNpa': 'None', 'numberNpa': '30.03.1999', 'title': 'Федеральный закон от 30 марта 1999 г. № 52-ФЗ О санитарно-эпидемиологическом благополучии населения '}, {'nameNpa': 'None', 'numberNpa': '17.09.1998', 'title': 'Федеральный закон от 17.09.1998 г.№ 157-ФЗОб иммунопрофилактике инфекционных болезней '}, {'nameNpa': 'None', 'numberNpa': '16.10.2020', 'title': 'СП 2.5.3650-20 «Санитарно-эпидемиологические требования к отдельным видам транспорта и объектам транспортной инфраструктуры»'}, {'nameNpa': 'None', 'numberNpa': 'None', 'title': 'СП 3.1.3597-20 Профилактика новой коронавирусной инфекции (COVID-19)'}, {'nameNpa': 'None', 'numberNpa': 'None', 'title': ' СанПиН 1.2.3685-21 «Гигиенические нормативы и требования к обеспечению безопасности и (или) безвредности для человека факторов среды обитания».'}, {'nameNpa': 'None', 'numberNpa': 'None', 'title': 'Федеральный закон от 23 февраля 2013 г. №15-ФЗ Об охране здоровья граждан от воздействия окружающего табачного дыма и последствий потребления табака» '}, {'nameNpa': 'None', 'numberNpa': 'None', 'title': '«Организация и проведение производственного контроля за соблюдением санитарных правил и выполнением санитарно-противоэпидемических (профилактических) мероприятий'}, {'nameNpa': 'None', 'numberNpa': 'None', 'title': ' СП 2.2.3670-20 САНИТАРНО-ЭПИДЕМИОЛОГИЧЕСКИЕ ТРЕБОВАНИЯ К УСЛОВИЯМ ТРУДА\n Гл.4 САНПИН 2.1.3684-21 САНИТАРНО-ЭПИДЕМИОЛОГИЧЕСКИЕ ТРЕБОВАНИЯ К СОДЕРЖАНИЮ ТЕРРИТОРИЙ ГОРОДСКИХ И СЕЛЬСКИХ ПОСЕЛЕНИЙ, К ВОДНЫМ ОБЪЕКТАМ, ПИТЬЕВОЙ ВОДЕ И ПИТЬЕВОМУ ВОДОСНАБЖЕНИЮ, АТМОСФЕРНОМУ ВОЗДУХУ, ПОЧВАМ, ЖИЛЫМ ПОМЕЩЕНИЯМ, ЭКСПЛУАТАЦИИ ПРОИЗВОДСТВЕННЫХ, ОБЩЕСТВЕННЫХ ПОМЕЩЕНИЙ, ОРГАНИЗАЦИИ И ПРОВЕДЕНИЮ САНИТАРНО-ПРОТИВОЭПИДЕМИЧЕСКИХ (ПРОФИЛАКТИЧЕСКИХ) МЕРОПРИЯТИЙ\n'}, {'nameNpa': 'None', 'numberNpa': 'None', 'title': 'СП 2.1.3678-20 САНИТАРНО-ЭПИДЕМИОЛОГИЧЕСКИЕ ТРЕБОВАНИЯ К ЭКСПЛУАТАЦИИ ПОМЕЩЕНИЙ, ЗДАНИЙ, СООРУЖЕНИЙ, ОБОРУДОВАНИЯ И ТРАНСПОРТА, А ТАКЖЕ УСЛОВИЯМ ДЕЯТЕЛЬНОСТИ ХОЗЯЙСТВУЮЩИХ СУБЪЕКТОВ, ОСУЩЕСТВЛЯЮЩИХ ПРОДАЖУ ТОВАРОВ, ВЫПОЛНЕНИЕ РАБОТ ИЛИ ОКАЗАНИЕ УСЛУГСП 2.1.3678-20 '}, {'nameNpa': 'None', 'numberNpa': 'None', 'title': ' МЗ РФ ПРИКАЗ от 28 января 2021 г. N 29н ОБ УТВЕРЖДЕНИИ ПОРЯДКА ПРОВЕДЕНИЯ ОБЯЗАТЕЛЬНЫХ ПРЕДВАРИТЕЛЬНЫХ И ПЕРИОДИЧЕСКИХ МЕДИЦИНСКИХ ОСМОТРОВ РАБОТНИКОВ, ПРЕДУСМОТРЕННЫХ ЧАСТЬЮ ЧЕТВЕРТОЙ СТАТЬИ 213 ТРУДОВОГО КОДЕКСА РОССИЙСКОЙ ФЕДЕРАЦИИ, ПЕРЕЧНЯ МЕДИЦИНСКИХ ПРОТИВОПОКАЗАНИЙ К ОСУЩЕСТВЛЕНИЮ РАБОТ С ВРЕДНЫМИ И (ИЛИ) ОПАСНЫМИ ПРОИЗВОДСТВЕННЫМИ ФАКТОРАМИ, А ТАКЖЕ РАБОТАМ, ПРИ ВЫПОЛНЕНИИ КОТОРЫХ ПРОВОДЯТСЯ ОБЯЗАТЕЛЬНЫЕ ПРЕДВАРИТЕЛЬНЫЕ И ПЕРИОДИЧЕСКИЕ МЕДИЦИНСКИЕ ОСМОТРЫ'}], 'resolved': False, 'resultEmpty': True, 'resultEmptyOrLate': False, 'resultInfoTypeCodes': [], 'resultViolationKnm': False, 'riskCategory': ['значительный риск', 'значительный риск', 'значительный риск', 'значительный риск', 'значительный риск', 'значительный риск', 'значительный риск', 'значительный риск'], 'riskCategoryAndDangerClass': ['значительный риск', 'значительный риск', 'значительный риск', 'значительный риск', 'значительный риск', 'значительный риск', 'значительный риск', 'значительный риск'], 'sezRegistryExists': False, 'signed': False, 'smevInfoType': None, 'smevMessageType': None, 'smevReceivedAt': None, 'smevReceivedAtEn': None, 'smevReceivedAtMonth': None, 'smevReceivedAtYear': None, 'spvRegistryExists': False, 'startDate': '06.06.2022', 'startDateEn': '2022-06-06', 'status': 'Исключена', 'statusEgrul': 'Найден', 'statusId': 15, 'stopDate': None, 'stopDateEn': None, 'subjectTypeId': 0, 'supervisionType': 'Федеральный государственный санитарно-эпидемиологический контроль (надзор)', 'supervisionTypeId': '004', 'torRegistryExists': False, 'updatePlanDate': '14.06.2022 15.11.03', 'updatePlanDateLong': 1655219463, 'version': 'ERKNM', 'violationLawsuitTypeCodes': [], 'violationTypeCodes': [], 'year': 2022}
2023-03-13 12:57:38,075 - [WARNING] - direct_sql.py - new_insert_in_database(302) - Проведена повторная попытка внесения с параметром special, результат неудачный.
2023-03-13 12:57:38,075 - [INFO] - direct_sql.py - database_inserts_conductor_for_multiprocessing(133) - Возникла ошибка, с которой не удалось справиться...
2023-03-13 12:57:38,076 - [INFO] - direct_sql.py - database_inserts_conductor_for_multiprocessing(134) - 
2023-03-13 12:57:38,079 - [ERROR] - direct_sql.py - new_insert_in_database(300) - (1040, 'ny connections')
2023-03-13 12:57:38,079 - [ERROR] - direct_sql.py - new_insert_in_database(300) - (1040, 'ny connections')
2023-03-13 12:57:38,079 - [INFO] - direct_sql.py - new_insert_in_database(301) - {'actCreateDate': None, 'actCreateDateEn': None, 'addresses': ['199034, ГОРОД САНКТ-ПЕТЕРБУРГ, ПРОСПЕКТ БОЛЬШОЙ В.О., ДОМ 18, ЛИТЕР А, ПОМЕЩЕНИЕ 48-Н КОМНАТА 8'], 'admLevelId': 50001, 'appealed': False, 'approveDocOrderDate': '15.08.2022', 'approveDocOrderNum': '47-01-04-311/22', 'approveDocRequestDate': '16.08.2022', 'approveDocRequestNum': None, 'approveDocs': [], 'approveRequired': False, 'approved': False, 'approvedErknm': 'Отказано', 'chlistCount': 0, 'chlistFilledCount': 0, 'chlistFillingIndicationTypeId': [], 'collaboratingOrganizations': [], 'collaboratingOrganizationsIds': [], 'comment': None, 'controllingOrganization': 'Управление Роспотребнадзора по Ленинградской области', 'controllingOrganizationId': 10001029910, 'createPlanDate': None, 'createPlanDateLong': None, 'createdByErpDb': False, 'createdById': 198607, 'dataNotEqualEGRUL': False, 'dataSetNotInTime': False, 'deleted': False, 'directDurationDays': None, 'disapprove': False, 'district': 'Ленинградская область', 'districtId': 1031410000000001, 'durationDays': 10, 'durationHours': 26, 'erknmActViolationIds': [], 'erknmResultKindDecisionIds': [], 'erpId': '78220041000102868484', 'events': [{'startDate': '18.08.2022', 'stopDate': '31.08.2022', 'title': 'Осмотр'}, {'startDate': '18.08.2022', 'stopDate': '31.08.2022', 'title': 'Опрос'}, {'startDate': '18.08.2022', 'stopDate': '31.08.2022', 'title': 'Получение письменных объяснений'}, {'startDate': '18.08.2022', 'stopDate': '31.08.2022', 'title': 'Истребование документов'}, {'startDate': '18.08.2022', 'stopDate': '31.08.2022', 'title': 'Экспертиза'}], 'federalLaw': '248', 'federalLawId': 3, 'fullFieldViolationKnm': False, 'hasViolations': False, 'id': 12940601, 'inn': '7825335145', 'inspectorFullName': ['Стрежнева Наталья Петровна', 'Морозова Диана Сергеевна', 'Усмонова Лилия Викторовна', 'Владимирова Ольга Викторовна', 'Голикова Ольга Валерьевна', 'Ермолаева-Маковская Алла Николаевна', 'Скворцова Любовь Андреевна', 'Борисенко Светлана Анатольевна'], 'isFromSmev': False, 'isHasApproveDocs': False, 'isHasCollaboratingOrganization': False, 'isHasRequirements': True, 'isHasViolationTerm': False, 'isPm': False, 'kind': 'Выездная проверка', 'knmAnnulled': False, 'knmRejected': False, 'knmType': 'Внеплановое КНМ', 'knmTypeId': 5, 'legalBasisDocName': [], 'links': [], 'mspCategory': ['Не является субъектом МСП'], 'noPunishment': False, 'notifyLate': False, 'objectsKind': ['Объекты общественного питания'], 'objectsSubKind': ['Объекты общественного питания'], 'objectsType': ['Деятельность и действия'], 'ogrn': '1027809227050', 'oldKnm': None, 'oldPlan': None, 'orderDone': False, 'organizationName': 'ОБЩЕСТВО С ОГРАНИЧЕННОЙ ОТВЕТСТВЕННОСТЬЮ АМРЕСТ', 'organizationsInn': ['7825335145'], 'organizationsName': ['ОБЩЕСТВО С ОГРАНИЧЕННОЙ ОТВЕТСТВЕННОСТЬЮ АМРЕСТ'], 'organizationsOgrn': ['1027809227050'], 'planId': None, 'prosecutorOrganization': 'Прокуратура Ленинградской области', 'prosecutorOrganizationId': 767, 'publishedStatus': 'UNPUBLISHED', 'reasons': [306], 'reasonsList': [{'assignmentDate': None, 'assignmentDateEn': None, 'assignmentNumber': None, 'date': None, 'dateEn': None, 'requirementDetails': None, 'text': '(Постановление 336) Непосредственная угроза причинения вреда жизни и тяжкого вреда здоровью граждан, факты причинения вреда жизни и тяжкого вреда здоровью граждан'}], 'recEmptyOrLate': False, 'regDateEgrul': '15.08.2022', 'regDateEgrulEn': '2022-08-15', 'regLate': False, 'regTypes': [], 'requirements': 4, 'requirementsList': [{'nameNpa': 'None', 'numberNpa': '30.03.1999', 'title': 'Федеральный закон от 30.03.1999 № 52-ФЗ «О санитарно-эпидемиологическом благополучии населения»'}, {'nameNpa': 'None', 'numberNpa': '27.10.2020', 'title': 'СанПиН2.3/2.4.3590-20 «Санитарно-эпидемиологические требования к организации общественного питания населения»;'}, {'nameNpa': 'None', 'numberNpa': '28.01.2021', 'title': 'СанПиН 2.1.3684-21 «Санитарно-эпидемиологические требования к содержанию территорий городских и сельских поселений, к водным объектам, питьевой воде и питьевому водоснабжению, атмосферному воздуху, почвам, жилым помещениям, эксплуатации производственных, общественных помещений, организации и проведению санитарно-противоэпидемических (профилактических) мероприятий»;'}, {'nameNpa': 'None', 'numberNpa': '28.01.2021', 'title': 'СанПиН 1.2.3685-21 «Гигиенические нормативы и требования к обеспечению безопасности и (или) безвредности для человека факторов среды обитания».'}], 'resolved': False, 'resultEmpty': True, 'resultEmptyOrLate': False, 'resultInfoTypeCodes': [], 'resultViolationKnm': False, 'riskCategory': ['высокий риск'], 'riskCategoryAndDangerClass': ['высокий риск / Второй'], 'sezRegistryExists': False, 'signed': True, 'smevInfoType': None, 'smevMessageType': None, 'smevReceivedAt': None, 'smevReceivedAtEn': None, 'smevReceivedAtMonth': None, 'smevReceivedAtYear': None, 'spvRegistryExists': False, 'startDate': '18.08.2022', 'startDateEn': '2022-08-18', 'status': 'Не согласована', 'statusEgrul': 'Найден', 'statusId': 14, 'stopDate': '31.08.2022', 'stopDateEn': '2022-08-31', 'subjectTypeId': 0, 'supervisionType': 'Федеральный государственный санитарно-эпидемиологический контроль (надзор)', 'supervisionTypeId': '004', 'torRegistryExists': False, 'updatePlanDate': None, 'updatePlanDateLong': None, 'version': 'ERKNM', 'violationLawsuitTypeCodes': [], 'violationTypeCodes': [], 'year': 2022}
2023-03-13 12:57:38,080 - [WARNING] - direct_sql.py - new_insert_in_database(302) - Проведена повторная попытка внесения с параметром special, результат неудачный.
2023-03-13 12:57:38,080 - [INFO] - direct_sql.py - database_inserts_conductor_for_multiprocessing(133) - Возникла ошибка, с которой не удалось справиться...
ГОРОД, КОРПУС 435', '124498, ГОРОД МОСКВА, Г. ЗЕЛЕНОГРАД, К. 435\n'], 'admLevelId': 50001, 'appealed': False, 'approveDocOrderDate': None, 'approveDocOrderNum': None, 'approveDocRequestDate': None, 'approveDocRequestNum': None, 'approveDocs': [], 'approveRequired': False, 'approved': False, 'approvedErknm': 'Отказано', 'chlistCount': 0, 'chlistFilledCount': 0, 'chlistFillingIndicationTypeId': [], 'collaboratingOrganizations': [], 'collaboratingOrganizationsIds': [], 'comment': 'Привести в соответствие срок проведения проверки, установленный  ч. 7 ст. 73 Федерального закона № 248-ФЗ «О государственном контроле (надзоре) и муниципальном контроле в Российской Федерации».  В графе формулировка требования необходимо  указать структурные единицы НПА, содержащие обязательные требования, соблюдение  которых  является предметом КНМ. ', 'controllingOrganization': 'Управление Роспотребнадзора по г. Москве', 'controllingOrganizationId': 10001029839, 'createPlanDate': '02.09.2021 11.01.04', 'createPlanDateLong': 1630580464, 'createdByErpDb': False, 'createdById': 142037, 'dataNotEqualEGRUL': False, 'dataSetNotInTime': False, 'deleted': False, 'directDurationDays': None, 'disapprove': False, 'district': 'Город Москва столица Российской Федерации город федерального значения', 'districtId': 1030450000000001, 'durationDays': None, 'durationHours': 15, 'erknmActViolationIds': [], 'erknmResultKindDecisionIds': [], 'erpId': '77220041000101003687', 'events': [{'startDate': '20.06.2022', 'stopDate': '01.07.2022', 'title': 'Осмотр'}, {'startDate': '20.06.2022', 'stopDate': '01.07.2022', 'title': 'Опрос'}, {'startDate': '20.06.2022', 'stopDate': '01.07.2022', 'title': 'Получение письменных объяснений'}, {'startDate': '20.06.2022', 'stopDate': '01.07.2022', 'title': 'Истребование документов'}, {'startDate': '20.06.2022', 'stopDate': '01.07.2022', 'title': 'Отбор проб (образцов)'}, {'startDate': '20.06.2022', 'stopDate': '01.07.2022', 'title': 'Инструментальное обследование'}, {'startDate': '20.06.2022', 'stopDate': '01.07.2022', 'title': 'Испытание'}, {'startDate': '20.06.2022', 'stopDate': '01.07.2022', 'title': 'Экспертиза'}], 'federalLaw': '248', 'federalLawId': 3, 'fullFieldViolationKnm': False, 'hasViolations': False, 'id': 11075813, 'inn': '7735149923', 'inspectorFullName': [], 'isFromSmev': False, 'isHasApproveDocs': False, 'isHasCollaboratingOrganization': False, 'isHasRequirements': True, 'isHasViolationTerm': False, 'isPm': False, 'kind': 'Выездная проверка', 'knmAnnulled': False, 'knmRejected': False, 'knmType': 'Плановое КНМ', 'knmTypeId': 4, 'legalBasisDocName': [], 'links': [], 'mspCategory': ['Микропредприятие'], 'noPunishment': False, 'notifyLate': False, 'objectsKind': ['Объекты общественного питания', 'Объекты общественного питания'], 'objectsSubKind': ['Деятельность ресторанов, кафе, баров, закусочных, столовых, в том числе столовых при предприятиях и учреждениях, поставка продукции общественного питания', 'Деятельность ресторанов, кафе, баров, закусочных, столовых, в том числе столовых при предприятиях и учреждениях, поставка продукции общественного питания'], 'objectsType': ['Деятельность и действия', 'Результаты деятельности'], 'ogrn': '1167746114250', 'oldKnm': None, 'oldPlan': None, 'orderDone': False, 'organizationName': 'ОБЩЕСТВО С ОГРАНИЧЕННОЙ ОТВЕТСТВЕННОСТЬЮ ЗЕЛФУД', 'organizationsInn': ['7735149923'], 'organizationsName': ['ОБЩЕСТВО С ОГРАНИЧЕННОЙ ОТВЕТСТВЕННОСТЬЮ ЗЕЛФУД'], 'organizationsOgrn': ['1167746114250'], 'planId': '2022040517', 'prosecutorOrganization': 'Прокуратура города Москвы', 'prosecutorOrganizationId': 554, 'publishedStatus': 'UNPUBLISHED', 'reasons': [204], 'reasonsList': [{'assignmentDate': None, 'assignmentDateEn': None, 'assignmentNumber': None, 'date': None, 'dateEn': None, 'requirementDetails': None, 'text': '(ФЗ 248) Истечение установленного федеральным законом о виде контроля, положением о виде контроля периода времени с даты иного события, установленного федеральным законом о виде контроля, положением о виде контроля, которое ведет к возникновению объекта контроля'}], 'recEmptyOrLate': False, 'regDateEgrul': '18.03.2022', 'regDateEgrulEn': '2022-03-18', 'regLate': False, 'regTypes': ['MSP'], 'requirements': 21, 'requirementsList': [{'nameNpa': 'None', 'numberNpa': '16.08.2011', 'title': 'ТР ТС 005/2011. Технический регламент Таможенного союза «О безопасности упаковки» '}, {'nameNpa': 'None', 'numberNpa': '09.12.2011', 'title': 'ТР ТС 021/2011. Технический регламент Таможенного союза «О безопасности пищевой продукции» '}, {'nameNpa': 'None', 'numberNpa': '09.12.2011', 'title': 'ТР ТС 022/2011. Технический регламент Таможенного союза «Пищевая продукция в части ее маркировки» '}, {'nameNpa': 'None', 'numberNpa': '09.12.2011', 'title': 'ТР ТС 023/2011. Технический регламент Таможенного союза «Технический регламент на соковую продукцию из фруктов и овощей»'}, {'nameNpa': 'None', 'numberNpa': '09.12.2011', 'title': 'ТР ТС 024/2011. Технический регламент Таможенного союза «Технический регламент на масложировую продукцию» '}, {'nameNpa': 'None', 'numberNpa': '09.10.2013', 'title': 'ТР ТС 033/2013. Технический регламент Таможенного союза «О безопасности молока и молочной продукции»'}, {'nameNpa': 'None', 'numberNpa': '09.10.2013', 'title': 'ТР ТС 034/2013. Технический регламент Таможенного союза «О безопасности мяса и мясной продукции»'}, {'nameNpa': 'None', 'numberNpa': '18.10.2016', 'title': 'ТР ЕАЭС 040/2016. Технический регламент\nЕвразийского экономического союза «О безопасности рыбы и рыбной продукции» '}, {'nameNpa': 'None', 'numberNpa': '23.06.2017', 'title': 'ТР ЕАЭС 044/2017. Технический регламент\nЕвразийского экономического союза «О безопасности упакованной питьевой воды, включая природную минеральную воду»'}, {'nameNpa': 'None', 'numberNpa': '30.03.1999', 'title': 'Федеральный закон «О санитарно-эпидемиологическом благополучии населения» №52-ФЗ '}, {'nameNpa': 'None', 'numberNpa': '02.01.2000', 'title': 'Федеральный закон «О качестве и безопасности пищевых продуктов» №29-ФЗ '}, {'nameNpa': 'None', 'numberNpa': '07.12.2011', 'title': 'Федеральный закон «О водоснабжении и водоотведении» № 416-ФЗ '}, {'nameNpa': 'None', 'numberNpa': '23.02.2013', 'title': 'Федеральный закон «Об охране здоровья граждан от воздействия окружающего табачного дыма и последствий потребления табака» №15-ФЗ '}, {'nameNpa': 'None', 'numberNpa': '24.06.1998', 'title': 'Федеральный закон «Об отходах производства и потребления» № 89-ФЗ '}, {'nameNpa': 'None', 'numberNpa': '27.12.2002', 'title': 'Федеральный закон О техническом регулировании №184-ФЗ '}, {'nameNpa': 'None', 'numberNpa': '07.08.2014', 'title': 'Постановление Правительства Российской Федерации «О мерах по реализации указов Президента Российской Федерации от 6 августа 2014 г. № 560, от 24 июня 2015 г. № 320 и от 29 июня 2016 г. № 305» '}, {'nameNpa': 'None', 'numberNpa': '10.07.2001', 'title': 'Постановление Главного государственного санитарного врача Российской Федерации «Об утверждении санитарных правил СП 1.1.1058-01. 1.1. Общие вопросы. Организация и проведение производственного контроля за соблюдением Санитарных правил и выполнением санитарно-противоэпидемических (профилактических) мероприятий» '}, {'nameNpa': 'None', 'numberNpa': '22.05.2020', 'title': 'Постановление Главного государственного санитарного врача Российской Федерации «Об утверждении санитарно-эпидемиологических правил\nСП 3.1.3597-20 Профилактика новой коронавирусной инфекции (COVID-19)» '}, {'nameNpa': 'None', 'numberNpa': '27.10.2020', 'title': 'Постановление Главного государственного санитарного врача Российской Федерации «Об утверждении санитарно-эпидемиологических правил и норм\nСанПиН 2.3/2.4.3590-20 «Санитарно-эпидемиологические требования к организации общественного питания населения» '}, {'nameNpa': 'None', 'numberNpa': '13.11.2020', 'title': 'Постановление Главного государственного санитарного врача Российской Федерации «О внесении изменений в постановление Главного государственного санитарного врача Российской Федерации от 22.05.2020 № 15 «Об утверждении санитарно-эпидемиологических правил СП 3.1.3597-20 «Профилактика новой коронавирусной инфекции (COVID-19)» '}, {'nameNpa': 'None', 'numberNpa': '02.12.2020', 'title': 'Постановление Главного государственного санитарного врача Российской Федерации «Об утверждении санитарных правил СП 2.2.3670-20 «Санитарно-эпидемиологичекие требования к условиям труда»'}], 'resolved': False, 'resultEmpty': True, 'resultEmptyOrLate': False, 'resultInfoTypeCodes': [], 'resultViolationKnm': False, 'riskCategory': ['высокий риск', 'высокий риск'], 'riskCategoryAndDangerClass': ['высокий риск / Второй', 'высокий риск / Второй'], 'sezRegistryExists': False, 'signed': False, 'smevInfoType': None, 'smevMessageType': None, 'smevReceivedAt': None, 'smevReceivedAtEn': None, 'smevReceivedAtMonth': None, 'smevReceivedAtYear': None, 'spvRegistryExists': False, 'startDate': '20.06.2022', 'startDateEn': '2022-06-20', 'status': 'Исключена', 'statusEgrul': 'Найден', 'statusId': 15, 'stopDate': '01.07.2022', 'stopDateEn': '2022-07-01', 'subjectTypeId': 0, 'supervisionType': 'Федеральный государственный санитарно-эпидемиологический контроль (надзор)', 'supervisionTypeId': '004', 'torRegistryExists': False, 'updatePlanDate': '09.09.2022 14.29.51', 'updatePlanDateLong': 1662733791, 'version': 'ERKNM', 'violationLawsuitTypeCodes': [], 'violationTypeCodes': [], 'year': 2022}
2023-03-13 12:57:38,080 - [WARNING] - direct_sql.py - new_insert_in_database(302) - Проведена повторная попытка внесения с параметром special, результат неудачный.
