2023-03-16 13:32:32,478 - [INFO] - main_ERKNM - __init__(74) - Начало авторизации
2023-03-16 13:32:46,601 - [INFO] - main_ERKNM - autorize(176) - Autorization successfull completed!
2023-03-16 13:44:53,549 - [INFO] - ERKNM_http.py - get_all_knm_for_a_year(173) - Запись в json завершена, заносим в базу данных
2023-03-16 13:44:53,554 - [INFO] - direct_sql.py - multiple_inserts(142) - старт программы
2023-03-16 14:08:11,626 - [ERROR] - direct_sql.py - new_insert_in_database(300) - (1040, 'ny connections')
2023-03-16 14:08:11,631 - [INFO] - direct_sql.py - new_insert_in_database(301) - {'actCreateDate': None, 'actCreateDateEn': None, 'addresses': ['183038, г. Мурманск, пр-д Северный, д.14'], 'admLevelId': 50001, 'appealed': False, 'approveDocOrderDate': None, 'approveDocOrderNum': None, 'approveDocRequestDate': None, 'approveDocRequestNum': None, 'approveDocs': [], 'approveRequired': False, 'approved': False, 'approvedErknm': 'Отказано', 'chlistCount': 0, 'chlistFilledCount': 0, 'chlistFillingIndicationTypeId': [], 'collaboratingOrganizations': [], 'collaboratingOrganizationsIds': [], 'comment': 'не указан срок проведения КНМ (ПП РФ № 2428 от 31.12.2020', 'controllingOrganization': 'Управление Роспотребнадзора по Мурманской области', 'controllingOrganizationId': 10001017456, 'createPlanDate': '04.08.2021 12.21.12', 'createPlanDateLong': 1628079672, 'createdByErpDb': False, 'createdById': 83322, 'dataNotEqualEGRUL': False, 'dataSetNotInTime': False, 'deleted': False, 'directDurationDays': None, 'disapprove': False, 'district': 'Мурманская область', 'districtId': 1031470000000001, 'durationDays': 10, 'durationHours': 50, 'erknmActViolationIds': [], 'erknmResultKindDecisionIds': [], 'erpId': '51220041000100878082', 'events': [{'startDate': '01.08.2022', 'stopDate': '12.08.2022', 'title': 'Осмотр'}, {'startDate': '01.08.2022', 'stopDate': '12.08.2022', 'title': 'Опрос'}, {'startDate': '01.08.2022', 'stopDate': '12.08.2022', 'title': 'Получение письменных объяснений'}, {'startDate': '01.08.2022', 'stopDate': '12.08.2022', 'title': 'Истребование документов'}, {'startDate': '01.08.2022', 'stopDate': '12.08.2022', 'title': 'Отбор проб (образцов)'}, {'startDate': '01.08.2022', 'stopDate': '12.08.2022', 'title': 'Инструментальное обследование'}, {'startDate': '01.08.2022', 'stopDate': '12.08.2022', 'title': 'Испытание'}, {'startDate': '01.08.2022', 'stopDate': '12.08.2022', 'title': 'Экспертиза'}], 'federalLaw': '248', 'federalLawId': 3, 'fullFieldViolationKnm': False, 'hasViolations': False, 'id': 10950208, 'inn': '5190117758', 'inspectorFullName': [], 'isFromSmev': False, 'isHasApproveDocs': False, 'isHasCollaboratingOrganization': False, 'isHasRequirements': True, 'isHasViolationTerm': False, 'isPm': False, 'kind': 'Выездная проверка', 'knmAnnulled': False, 'knmRejected': False, 'knmType': 'Плановое КНМ', 'knmTypeId': 4, 'legalBasisDocName': [], 'links': [], 'mspCategory': ['Малое предприятие'], 'noPunishment': False, 'notifyLate': False, 'objectsKind': ['Деятельность, действия (бездействие) контролируемых лиц, в рамках которых должны соблюдаться обязательные требования, в том числе предъявляемые к контролируемым лицам, осуществляющим деятельность, действия (бездействие)'], 'objectsSubKind': [], 'objectsType': ['Деятельность и действия'], 'ogrn': '1035100180785', 'oldKnm': None, 'oldPlan': None, 'orderDone': False, 'organizationName': 'ОБЩЕСТВО С ОГРАНИЧЕННОЙ ОТВЕТСТВЕННОСТЬЮ МЕДИЦИНСКИЙ ЦЕНТР М-КЛИНИК', 'organizationsInn': ['5190117758'], 'organizationsName': ['ОБЩЕСТВО С ОГРАНИЧЕННОЙ ОТВЕТСТВЕННОСТЬЮ МЕДИЦИНСКИЙ ЦЕНТР М-КЛИНИК'], 'organizationsOgrn': ['1035100180785'], 'planId': '2022038280', 'prosecutorOrganization': 'Прокуратура Мурманской области', 'prosecutorOrganizationId': 788, 'publishedStatus': 'UNPUBLISHED', 'reasons': [201], 'reasonsList': [{'assignmentDate': None, 'assignmentDateEn': None, 'assignmentNumber': None, 'date': '10.03.2020', 'dateEn': '2020-03-10', 'requirementDetails': None, 'text': '(ФЗ 248) Истечение установленного федеральным законом о виде контроля, положением о виде контроля период времени с даты окончания проведения последнего планового контрольного (надзорного) мероприятия'}], 'recEmptyOrLate': False, 'regDateEgrul': '18.03.2022', 'regDateEgrulEn': '2022-03-18', 'regLate': False, 'regTypes': ['MSP'], 'requirements': 1, 'requirementsList': [{'nameNpa': 'None', 'numberNpa': 'None', 'title': '1.\tФедеральный закон от 30.03.1999г. № 52-ФЗ О санитарно-эпидемиологическом благополучии населения ст.1-4,11-36,41-42,55,57\n2.\tФедеральный закон от 17.09.1998г. № 157-ФЗ Об иммунопрофилактике инфекционных болезней ст.1,3,4,5,9,12..\n3.\tФедеральный закон от 27.12.2002г. № 184-ФЗ О техническом регулировании ст.1-4,5.1, 6-7, 18-30,36-42.\n4.\tФедеральный закон от 18.06.2001г. № 77-ФЗ О предупреждении распространения туберкулеза в Российской Федерации ст.1-19. \n5.\tФедеральный закон РФ от 04.05.2011г. № 99-ФЗ О лицензировании отдельных видов деятельности ст.1-24.\n6.\tФедеральный закон № 89-ФЗ от 24.06.1998г. Об отходах производства и потребления ст. 1-31.\n7.\tТехнический регламент таможенного союза ТР ТС 004/2011 «О безопасности низковольтного оборудования» ст. 1-9, приложение.\n8.\tТехнический регламент таможенного союза ТР ТС 005/2011 «О безопасности упаковки» ст.1-9, приложения № 1-5.\n9.\tТР ТС 019/2011 «О безопасности средств индивидуальной защиты» главы 1-7 приложения 1-5.\n10.\tТехнический регламент таможенного союза ТР ТС 010/2011 «О безопасности машин и оборудования» ст.1-13, приложения 1-3.\n11.\tПостановление Правительства РФ от 15.07.1999г. № 825 Об утверждении перечня работ, выполнение которых связано с высоким риском заболевания инфекционными болезнями и требует обязательного проведения профилактических прививок.\n12.\tСанПиН 2.1.3684-21 «Санитарно-эпидемиологические требования к содержанию территорий городских и сельских поселений, к водным объектам, питьевой воде и питьевому водоснабжению, атмосферному воздуху, почвам, жилым помещениям, эксплуатации производственных, общественных помещений, организации и проведению санитарно- противоэпидемических (профилактических) мероприятий» \n13.\tСанПиН 1.2.3685-21 Гигиенические нормативы и требования к обеспечению безопасности и (или) безвредности для человека факторов среды обитания» \n14.\tСанПиН 3.3686-21 Санитарно-эпидемиологические требования по профилактике инфекционных болезней\n15.\tСП 1.1.1058-01 Организация и проведение производственного контроля за соблюдением санитарных правил и выполнением противоэпидемических (профилактических) мероприятий с изменениями и дополнениями п.п.1-6.2.\n16.\tСП 2.2.3670-20 «Санитарно-эпидемиологические требования к условиям труда», п.п. 1.1-8.21, приложения 1,2.\n17.\tСП 2.1.3678-20 «Санитарно-эпидемиологические требования к эксплуатации помещений, зданий, сооружений, оборудования и транспорта, а также условиям деятельности хозяйствующих субъектов, осуществляющих продажу товаров, выполнение работ или оказание услуг» \n18.\tСП 3.1.3597-20 Профилактика новой коронавирусной инфекции (COVID-19)\n19.\tПостановление Главного государственного санитарного врача РФ от 13.07.2020г. № 20 О мероприятиях по профилактике гриппа и острых респираторных вирусных инфекций, в том числе новой коронавирусной инфекции (COVID-19) в эпидемическом сезоне 2020-2021 годов.\n20.\tПриказ Минздравсоцразвития России от 21.03.2014г. № 125-н Об утверждении национального календаря профилактических прививок и календаря профилактических прививок по эпидемическим показаниям. \n21.\tПриказ Министерства здравоохранения РФ от 28.01.2021г. N 29н «Об утверждении Порядка проведения обязательных предварительных и периодических медицинских осмотров работников, предусмотренных ч. 4 ст. 213 Трудового Кодекса РФ, перечня медицинских противопоказаний к осуществлению работ с вредными и (или) опасными производственными факторами, а также работам, при выполнении которых проводятся обязательные предварительные и периодические медицинские осмотры».\n22.\tПриказ Роспотребнадзора от 20.05.2005 N 402 (ред. от 07.04.2009) О личной медицинской книжке и санитарном паспорте (Зарегистрировано в Минюсте РФ 01.06.2005 N 6674).\n23.\tРуководство Р3.5.1904-04 Использование ультрафиолетового бактерицидного излучения для обеззараживания воздуха в помещениях раздел 1-10, приложения 1-5.\n24.\tМУ287-113 от 30.12.1998г. «Методические указания по дезинфекции, предстерилизационной очистке и стерилизации изделий медицинского назначения».'}], 'resolved': False, 'resultEmpty': True, 'resultEmptyOrLate': False, 'resultInfoTypeCodes': [], 'resultViolationKnm': False, 'riskCategory': ['высокий риск'], 'riskCategoryAndDangerClass': ['высокий риск'], 'sezRegistryExists': False, 'signed': False, 'smevInfoType': None, 'smevMessageType': None, 'smevReceivedAt': None, 'smevReceivedAtEn': None, 'smevReceivedAtMonth': None, 'smevReceivedAtYear': None, 'spvRegistryExists': False, 'startDate': '01.08.2022', 'startDateEn': '2022-08-01', 'status': 'Исключена', 'statusEgrul': 'Найден', 'statusId': 15, 'stopDate': None, 'stopDateEn': None, 'subjectTypeId': 0, 'supervisionType': 'Федеральный государственный санитарно-эпидемиологический контроль (надзор)', 'supervisionTypeId': '004', 'torRegistryExists': False, 'updatePlanDate': '11.07.2022 22.02.26', 'updatePlanDateLong': 1657576946, 'version': 'ERKNM', 'violationLawsuitTypeCodes': [], 'violationTypeCodes': [], 'year': 2022}
2023-03-16 14:08:11,634 - [WARNING] - direct_sql.py - new_insert_in_database(302) - Проведена повторная попытка внесения с параметром special, результат неудачный.
2023-03-16 14:08:11,634 - [INFO] - direct_sql.py - database_inserts_conductor_for_multiprocessing(133) - Возникла ошибка, с которой не удалось справиться...
2023-03-16 14:08:11,635 - [INFO] - direct_sql.py - database_inserts_conductor_for_multiprocessing(134) - 
2023-03-16 14:08:11,635 - [ERROR] - direct_sql.py - new_insert_in_database(300) - (1040, 'ny connections')
2023-03-16 14:08:11,638 - [INFO] - direct_sql.py - new_insert_in_database(301) - {'actCreateDate': None, 'actCreateDateEn': None, 'addresses': ['429826, ЧУВАШИЯ, ЧУВАШСКАЯ РЕСПУБЛИКА -, ГОРОД, АЛАТЫРЬ, ПРОЕЗД, ШКОЛЬНЫЙ, ДОМ 1, 210000220000193'], 'admLevelId': 50001, 'appealed': False, 'approveDocOrderDate': None, 'approveDocOrderNum': None, 'approveDocRequestDate': None, 'approveDocRequestNum': None, 'approveDocs': [], 'approveRequired': False, 'approved': False, 'approvedErknm': 'Отказано', 'chlistCount': 0, 'chlistFilledCount': 0, 'chlistFillingIndicationTypeId': [], 'collaboratingOrganizations': [], 'collaboratingOrganizationsIds': [], 'comment': None, 'controllingOrganization': 'Управление Роспотребнадзора по Чувашской Республике', 'controllingOrganizationId': 10001021692, 'createPlanDate': '08.09.2021 09.53.30', 'createPlanDateLong': 1631094810, 'createdByErpDb': False, 'createdById': 91234, 'dataNotEqualEGRUL': False, 'dataSetNotInTime': False, 'deleted': False, 'directDurationDays': None, 'disapprove': False, 'district': 'Шумерлинский район', 'districtId': 1033972500000001, 'durationDays': 10, 'durationHours': None, 'erknmActViolationIds': [], 'erknmResultKindDecisionIds': [], 'erpId': '21220041000100851686', 'events': [{'startDate': '12.07.2022', 'stopDate': '25.07.2022', 'title': 'Осмотр'}, {'startDate': '12.07.2022', 'stopDate': '25.07.2022', 'title': 'Досмотр'}, {'startDate': '12.07.2022', 'stopDate': '25.07.2022', 'title': 'Опрос'}, {'startDate': '12.07.2022', 'stopDate': '25.07.2022', 'title': 'Получение письменных объяснений'}, {'startDate': '12.07.2022', 'stopDate': '25.07.2022', 'title': 'Истребование документов'}, {'startDate': '12.07.2022', 'stopDate': '25.07.2022', 'title': 'Отбор проб (образцов)'}, {'startDate': '12.07.2022', 'stopDate': '25.07.2022', 'title': 'Инструментальное обследование'}, {'startDate': '12.07.2022', 'stopDate': '25.07.2022', 'title': 'Испытание'}, {'startDate': '12.07.2022', 'stopDate': '25.07.2022', 'title': 'Экспертиза'}], 'federalLaw': '248', 'federalLawId': 3, 'fullFieldViolationKnm': False, 'hasViolations': False, 'id': 10923812, 'inn': '2122004408', 'inspectorFullName': [], 'isFromSmev': False, 'isHasApproveDocs': False, 'isHasCollaboratingOrganization': False, 'isHasRequirements': True, 'isHasViolationTerm': False, 'isPm': False, 'kind': 'Выездная проверка', 'knmAnnulled': False, 'knmRejected': False, 'knmType': 'Плановое КНМ', 'knmTypeId': 4, 'legalBasisDocName': [], 'links': [], 'mspCategory': ['Не является субъектом МСП'], 'noPunishment': False, 'notifyLate': False, 'objectsKind': ['Дошкольное и начальное общее образование'], 'objectsSubKind': ['Дошкольное и начальное общее образование'], 'objectsType': ['Деятельность и действия'], 'ogrn': '1022101629450', 'oldKnm': None, 'oldPlan': None, 'orderDone': False, 'organizationName': 'МУНИЦИПАЛЬНОЕ БЮДЖЕТНОЕ ДОШКОЛЬНОЕ ОБРАЗОВАТЕЛЬНОЕ УЧРЕЖДЕНИЕ ДЕТСКИЙ САД № 6 КОЛОСОК ГОРОДА АЛАТЫРЯ ЧУВАШСКОЙ РЕСПУБЛИКИ', 'organizationsInn': ['2122004408'], 'organizationsName': ['МУНИЦИПАЛЬНОЕ БЮДЖЕТНОЕ ДОШКОЛЬНОЕ ОБРАЗОВАТЕЛЬНОЕ УЧРЕЖДЕНИЕ ДЕТСКИЙ САД № 6 КОЛОСОК ГОРОДА АЛАТЫРЯ ЧУВАШСКОЙ РЕСПУБЛИКИ'], 'organizationsOgrn': ['1022101629450'], 'planId': '2022042026', 'prosecutorOrganization': 'Шумерлинская межрайонная прокуратура', 'prosecutorOrganizationId': 1377, 'publishedStatus': 'UNPUBLISHED', 'reasons': [204], 'reasonsList': [{'assignmentDate': None, 'assignmentDateEn': None, 'assignmentNumber': None, 'date': None, 'dateEn': None, 'requirementDetails': None, 'text': '(ФЗ 248) Истечение установленного федеральным законом о виде контроля, положением о виде контроля периода времени с даты иного события, установленного федеральным законом о виде контроля, положением о виде контроля, которое ведет к возникновению объекта контроля'}], 'recEmptyOrLate': False, 'regDateEgrul': '17.09.2021', 'regDateEgrulEn': '2021-09-17', 'regLate': False, 'regTypes': [], 'requirements': 17, 'requirementsList': [{'nameNpa': 'None', 'numberNpa': '30.03.1999', 'title': '№ 52-«О санитарно-эпидемиологическом благополучии населения»;ФЗ '}, {'nameNpa': 'None', 'numberNpa': '02.01.2000', 'title': '«О качестве и безопасности пищевых продуктов»'}, {'nameNpa': 'None', 'numberNpa': '23.02.2013', 'title': 'Об охране здоровья граждан от воздействия окружающего табачного дыма и последствий потребления табака'}, {'nameNpa': 'None', 'numberNpa': '27.12.2002', 'title': '«О техническом регулировании»'}, {'nameNpa': 'None', 'numberNpa': '17.09.1998', 'title': '«Об иммунопрофилактике инфекционных болезней»'}, {'nameNpa': 'None', 'numberNpa': '09.12.2011', 'title': '«О безопасности пищевой продукции»'}, {'nameNpa': 'None', 'numberNpa': '09.12.2011', 'title': '«Пищевая продукция в части ее маркировки»'}, {'nameNpa': 'None', 'numberNpa': '09.12.2011', 'title': '«Технический регламент на соковую продукцию из фруктов и овощей'}, {'nameNpa': 'None', 'numberNpa': '09.12.2011', 'title': '«Технический регламент на масложировую продукцию»'}, {'nameNpa': 'None', 'numberNpa': '09.10.2013', 'title': '«О безопасности молока и молочной продукции»'}, {'nameNpa': 'None', 'numberNpa': '09.10.2013', 'title': 'О безопасности мяса и мясной продукции'}, {'nameNpa': 'None', 'numberNpa': '18.10.2016', 'title': 'О безопасности рыбы и рыбной продукции'}, {'nameNpa': 'None', 'numberNpa': '15.06.2012', 'title': '«О безопасности мебельной продукции»\n\n'}, {'nameNpa': 'None', 'numberNpa': '28.09.2020', 'title': '«Санитарно-эпидемиологические требования к организациям воспитания и обучения, отдыха и оздоровления детей и молодежи»'}, {'nameNpa': 'None', 'numberNpa': '27.10.2020', 'title': '«Санитарно-эпидемиологические требования к организации общественного питания населения»'}, {'nameNpa': 'None', 'numberNpa': '28.01.2021', 'title': 'Гигиенические нормативы и требования к обеспечению безопасности и (или) безвредности для человека факторов среды обитания'}, {'nameNpa': 'None', 'numberNpa': '28.01.2021', 'title': 'Санитарно-эпидемиологические требования по профилактике инфекционных болезней'}], 'resolved': False, 'resultEmpty': True, 'resultEmptyOrLate': False, 'resultInfoTypeCodes': [], 'resultViolationKnm': False, 'riskCategory': ['чрезвычайно высокий риск'], 'riskCategoryAndDangerClass': ['чрезвычайно высокий риск / Первый'], 'sezRegistryExists': False, 'signed': False, 'smevInfoType': None, 'smevMessageType': None, 'smevReceivedAt': None, 'smevReceivedAtEn': None, 'smevReceivedAtMonth': None, 'smevReceivedAtYear': None, 'spvRegistryExists': False, 'startDate': '12.07.2022', 'startDateEn': '2022-07-12', 'status': 'Исключена', 'statusEgrul': 'Найден', 'statusId': 15, 'stopDate': '25.07.2022', 'stopDateEn': '2022-07-25', 'subjectTypeId': 0, 'supervisionType': 'Федеральный государственный санитарно-эпидемиологический контроль (надзор)', 'supervisionTypeId': '004', 'torRegistryExists': False, 'updatePlanDate': '27.06.2022 18.35.18', 'updatePlanDateLong': 1656354918, 'version': 'ERKNM', 'violationLawsuitTypeCodes': [], 'violationTypeCodes': [], 'year': 2022}
2023-03-16 14:08:11,643 - [WARNING] - direct_sql.py - new_insert_in_database(302) - Проведена повторная попытка внесения с параметром special, результат неудачный.
2023-03-16 14:08:11,643 - [INFO] - direct_sql.py - database_inserts_conductor_for_multiprocessing(133) - Возникла ошибка, с которой не удалось справиться...
2023-03-16 14:08:11,643 - [INFO] - direct_sql.py - database_inserts_conductor_for_multiprocessing(134) - 
2023-03-16 14:08:11,643 - [ERROR] - direct_sql.py - new_insert_in_database(300) - (1040, 'ny connections')
2023-03-16 14:08:11,645 - [INFO] - direct_sql.py - new_insert_in_database(301) - {'actCreateDate': None, 'actCreateDateEn': None, 'addresses': ['668400, РЕСПУБЛИКА, ТЫВА, РАЙОН, КАА-ХЕМСКИЙ, УЛИЦА, ДРУЖБЫ, ДОМ 41, 170050000010008'], 'admLevelId': 50001, 'appealed': False, 'approveDocOrderDate': None, 'approveDocOrderNum': None, 'approveDocRequestDate': None, 'approveDocRequestNum': None, 'approveDocs': [], 'approveRequired': False, 'approved': False, 'approvedErknm': 'Отказано', 'chlistCount': 0, 'chlistFilledCount': 0, 'chlistFillingIndicationTypeId': [], 'collaboratingOrganizations': [], 'collaboratingOrganizationsIds': [], 'comment': 'в соответствии с ч. 2 ст. 3 248-ФЗ порядок организации и осуществления государственного контроля (надзора) устанавливается положением о соответствующем виде контроля (надзора). ПП РФ от 30.06.2021 № 1100 действует до 01.09.2021', 'controllingOrganization': 'Управление Роспотребнадзора по Республике Тыва', 'controllingOrganizationId': 10001022904, 'createPlanDate': '28.09.2021 11.23.18', 'createPlanDateLong': 1632828198, 'createdByErpDb': False, 'createdById': 99349, 'dataNotEqualEGRUL': False, 'dataSetNotInTime': False, 'deleted': False, 'directDurationDays': None, 'disapprove': False, 'district': 'Республика Тыва', 'districtId': 1035930000000001, 'durationDays': 15, 'durationHours': None, 'erknmActViolationIds': [], 'erknmResultKindDecisionIds': [], 'erpId': '17220041000101113056', 'events': [{'startDate': '03.10.2022', 'stopDate': '21.10.2022', 'title': 'Осмотр'}, {'startDate': '03.10.2022', 'stopDate': '21.10.2022', 'title': 'Получение письменных объяснений'}, {'startDate': '03.10.2022', 'stopDate': '21.10.2022', 'title': 'Истребование документов'}, {'startDate': '03.10.2022', 'stopDate': '21.10.2022', 'title': 'Отбор проб (образцов)'}, {'startDate': '03.10.2022', 'stopDate': '21.10.2022', 'title': 'Инструментальное обследование'}, {'startDate': '03.10.2022', 'stopDate': '21.10.2022', 'title': 'Испытание'}, {'startDate': '03.10.2022', 'stopDate': '21.10.2022', 'title': 'Экспертиза'}], 'federalLaw': '248', 'federalLawId': 3, 'fullFieldViolationKnm': False, 'hasViolations': False, 'id': 11185182, 'inn': '1704002623', 'inspectorFullName': [], 'isFromSmev': False, 'isHasApproveDocs': False, 'isHasCollaboratingOrganization': False, 'isHasRequirements': True, 'isHasViolationTerm': False, 'isPm': False, 'kind': 'Выборочный контроль', 'knmAnnulled': False, 'knmRejected': False, 'knmType': 'Плановое КНМ', 'knmTypeId': 4, 'legalBasisDocName': [], 'links': [], 'mspCategory': ['Не является субъектом МСП'], 'noPunishment': False, 'notifyLate': False, 'objectsKind': ['общеобразовательные организации'], 'objectsSubKind': ['Деятельность общеобразовательных организаций'], 'objectsType': ['Деятельность и действия'], 'ogrn': '1021700564192', 'oldKnm': None, 'oldPlan': None, 'orderDone': False, 'organizationName': 'МУНИЦИПАЛЬНОЕ БЮДЖЕТНОЕ ОБЩЕОБРАЗОВАТЕЛЬНОЕ УЧРЕЖДЕНИЕ ВЕЧЕРНЯЯ СМЕННАЯ ОБЩЕОБРАЗОВАТЕЛЬНАЯ ШКОЛА С. САРЫГ-СЕП КАА-ХЕМСКОГО РАЙОНА РЕСПУБЛИКИ ТЫВА', 'organizationsInn': ['1704002623'], 'organizationsName': ['МУНИЦИПАЛЬНОЕ БЮДЖЕТНОЕ ОБЩЕОБРАЗОВАТЕЛЬНОЕ УЧРЕЖДЕНИЕ ВЕЧЕРНЯЯ СМЕННАЯ ОБЩЕОБРАЗОВАТЕЛЬНАЯ ШКОЛА С. САРЫГ-СЕП КАА-ХЕМСКОГО РАЙОНА РЕСПУБЛИКИ ТЫВА'], 'organizationsOgrn': ['1021700564192'], 'planId': '2022046248', 'prosecutorOrganization': 'Прокуратура Республики Тыва', 'prosecutorOrganizationId': 2062, 'publishedStatus': 'UNPUBLISHED', 'reasons': [204], 'reasonsList': [{'assignmentDate': None, 'assignmentDateEn': None, 'assignmentNumber': None, 'date': None, 'dateEn': None, 'requirementDetails': None, 'text': '(ФЗ 248) Истечение установленного федеральным законом о виде контроля, положением о виде контроля периода времени с даты иного события, установленного федеральным законом о виде контроля, положением о виде контроля, которое ведет к возникновению объекта контроля'}], 'recEmptyOrLate': False, 'regDateEgrul': '29.09.2021', 'regDateEgrulEn': '2021-09-29', 'regLate': False, 'regTypes': [], 'requirements': 25, 'requirementsList': [{'nameNpa': 'None', 'numberNpa': '18.06.2001', 'title': '«О предупреждении распространения туберкулеза в Российской Федерации»'}, {'nameNpa': 'None', 'numberNpa': '27.10.2020', 'title': '«Санитарно-эпидемиологические требования к организации общественного питания населения» '}, {'nameNpa': 'None', 'numberNpa': '07.07.2009', 'title': '«Нормы радиационной безопасности (НРБ-99/2009)»'}, {'nameNpa': 'None', 'numberNpa': '26.04.2010', 'title': '«Основные санитарные правила обеспечения радиационной безопасности (ОСПОРБ-99/2010)»'}, {'nameNpa': 'None', 'numberNpa': '09.12.2011', 'title': 'Технический регламент ТС «Технический регламент на масложировую продукцию»'}, {'nameNpa': 'None', 'numberNpa': '09.12.2011', 'title': 'Технический регламент на соковую продукцию из фруктов и овощей\n'}, {'nameNpa': 'None', 'numberNpa': '04.05.2011', 'title': 'О лицензировании отдельных видов деятельности\n'}, {'nameNpa': 'None', 'numberNpa': '14.11.2001', 'title': ' «Гигиенические требования безопасности и пищевой ценности пищевых продуктов»'}, {'nameNpa': 'None', 'numberNpa': '09.10.2013', 'title': 'Технический регламент ТС «О безопасности мяса и мясной продукции» '}, {'nameNpa': 'None', 'numberNpa': '18.10.2016', 'title': ' «О безопасности рыбы и рыбной продукции»'}, {'nameNpa': 'None', 'numberNpa': '24.12.2020', 'title': '«Санитарно-эпидемиологические требования к эксплуатации помещений, зданий, сооружений, оборудования и транспорта, а также условиям деятельности хозяйствующих субъектов, осуществляющих продажу товаров, выполнение работ или оказание услуг»'}, {'nameNpa': 'None', 'numberNpa': '28.01.2021', 'title': ' «Санитарно-эпидемиологические требования к содержанию территорий городских и сельских поселений, к водным объектам, питьевой воде и питьевому водоснабжению населения, атмосферному воздуху, почвам, жилым помещениям, эксплуатации производственных, общественных помещений, организации и проведению санитарно-противоэпидемических (профилактических) мероприятий»'}, {'nameNpa': 'None', 'numberNpa': '09.10.2013', 'title': 'Технический регламент ТС «О безопасности молока и молочной продукции» '}, {'nameNpa': 'None', 'numberNpa': '30.03.1999', 'title': '«О санитарно-эпидемиологическом благополучии населения»'}, {'nameNpa': 'None', 'numberNpa': '23.02.2013', 'title': ' «Об охране здоровья граждан от воздействия окружающего табачного дыма и последствий потребления табака»'}, {'nameNpa': 'None', 'numberNpa': '21.03.2014', 'title': ' «Об утверждении национального календаря профилактических прививок и календаря профилактических прививок по эпидемическим показаниям»'}, {'nameNpa': 'None', 'numberNpa': '28.09.2020', 'title': ' «Санитарно-эпидемиологические требования к организациям воспитания и обучения, отдыха и оздоровления детей и молодежи»'}, {'nameNpa': 'None', 'numberNpa': '10.07.2001', 'title': ' «Организация и проведение производственного контроля за соблюдением санитарных правил и выполнением санитарно-противоэпидемических (профилактических) мероприятий»'}, {'nameNpa': 'None', 'numberNpa': '28.01.2021', 'title': ' «Санитарно-эпидемиологические требования по профилактике инфекционных болезней»'}, {'nameNpa': 'None', 'numberNpa': '28.01.2021', 'title': '«Об утверждении Порядка проведения обязательных предварительных и периодических медицинских осмотров работников, предусмотренных частью четвертой статьи 213 Трудового кодекса Российской Федерации, перечня медицинских противопоказаний к осуществлению работ с вредными и (или) опасными производственными факторами, а также работам, при выполнении которых проводятся обязательные предварительные и периодические медицинские осмотры».'}, {'nameNpa': 'None', 'numberNpa': '28.01.2021', 'title': '«Гигиенические нормативы и требования к обеспечению безопасности и (или) безвредности для человека факторов среды обитания»'}, {'nameNpa': 'None', 'numberNpa': '09.12.2011', 'title': 'Технический регламент ТС «Пищевая продукция в части ее маркировки» '}, {'nameNpa': 'None', 'numberNpa': '02.12.2020', 'title': ' «Санитарно-эпидемиологические требования к условиям труда»'}, {'nameNpa': 'None', 'numberNpa': '23.09.2011', 'title': 'Технический регламент ТС «О безопасности продукции, предназначенной для детей и подростков»'}, {'nameNpa': 'None', 'numberNpa': '09.12.2011', 'title': 'Технический регламент ТС «О безопасности пищевой продукции» '}], 'resolved': False, 'resultEmpty': True, 'resultEmptyOrLate': False, 'resultInfoTypeCodes': [], 'resultViolationKnm': False, 'riskCategory': ['чрезвычайно высокий риск'], 'riskCategoryAndDangerClass': ['чрезвычайно высокий риск'], 'sezRegistryExists': False, 'signed': True, 'smevInfoType': None, 'smevMessageType': None, 'smevReceivedAt': None, 'smevReceivedAtEn': None, 'smevReceivedAtMonth': None, 'smevReceivedAtYear': None, 'spvRegistryExists': False, 'startDate': '03.10.2022', 'startDateEn': '2022-10-03', 'status': 'Исключена', 'statusEgrul': 'Найден', 'statusId': 15, 'stopDate': '21.10.2022', 'stopDateEn': '2022-10-21', 'subjectTypeId': 0, 'supervisionType': 'Федеральный государственный санитарно-эпидемиологический контроль (надзор)', 'supervisionTypeId': '004', 'torRegistryExists': False, 'updatePlanDate': '25.08.2022 09.32.43', 'updatePlanDateLong': 1661419963, 'version': 'ERKNM', 'violationLawsuitTypeCodes': [], 'violationTypeCodes': [], 'year': 2022}
2023-03-16 14:08:11,647 - [WARNING] - direct_sql.py - new_insert_in_database(302) - Проведена повторная попытка внесения с параметром special, результат неудачный.
2023-03-16 14:08:11,647 - [INFO] - direct_sql.py - database_inserts_conductor_for_multiprocessing(133) - Возникла ошибка, с которой не удалось справиться...
2023-03-16 14:08:11,647 - [INFO] - direct_sql.py - database_inserts_conductor_for_multiprocessing(134) - 
2023-03-16 14:08:11,664 - [ERROR] - direct_sql.py - new_insert_in_database(300) - (1040, 'ny connections')
2023-03-16 14:08:11,664 - [INFO] - direct_sql.py - new_insert_in_database(301) - {'actCreateDate': None, 'actCreateDateEn': None, 'addresses': ['184209, Мурманская обл., г. Апатиты, ул.Дзержинского, д.21; 184209, Мурманская обл., г. Апатиты, Дзержинского, 32а '], 'admLevelId': 50001, 'appealed': False, 'approveDocOrderDate': None, 'approveDocOrderNum': None, 'approveDocRequestDate': None, 'approveDocRequestNum': None, 'approveDocs': [], 'approveRequired': False, 'approved': False, 'approvedErknm': 'Отказано', 'chlistCount': 0, 'chlistFilledCount': 0, 'chlistFillingIndicationTypeId': [], 'collaboratingOrganizations': [], 'collaboratingOrganizationsIds': [], 'comment': None, 'controllingOrganization': 'Управление Роспотребнадзора по Мурманской области', 'controllingOrganizationId': 10001017456, 'createPlanDate': '04.08.2021 12.21.12', 'createPlanDateLong': 1628079672, 'createdByErpDb': False, 'createdById': 108896, 'dataNotEqualEGRUL': False, 'dataSetNotInTime': False, 'deleted': False, 'directDurationDays': None, 'disapprove': False, 'district': 'Мурманская область', 'districtId': 1031470000000001, 'durationDays': 10, 'durationHours': None, 'erknmActViolationIds': [], 'erknmResultKindDecisionIds': [], 'erpId': '51220041000100885317', 'events': [{'startDate': '01.08.2022', 'stopDate': '12.08.2022', 'title': 'Осмотр'}, {'startDate': '01.08.2022', 'stopDate': '12.08.2022', 'title': 'Опрос'}, {'startDate': '01.08.2022', 'stopDate': '12.08.2022', 'title': 'Получение письменных объяснений'}, {'startDate': '01.08.2022', 'stopDate': '12.08.2022', 'title': 'Истребование документов'}, {'startDate': '01.08.2022', 'stopDate': '12.08.2022', 'title': 'Отбор проб (образцов)'}, {'startDate': '01.08.2022', 'stopDate': '12.08.2022', 'title': 'Инструментальное обследование'}, {'startDate': '01.08.2022', 'stopDate': '12.08.2022', 'title': 'Отбор проб (образцов)'}, {'startDate': '01.08.2022', 'stopDate': '12.08.2022', 'title': 'Экспертиза'}, {'startDate': '01.08.2022', 'stopDate': '12.08.2022', 'title': 'Испытание'}], 'federalLaw': '248', 'federalLawId': 3, 'fullFieldViolationKnm': False, 'hasViolations': False, 'id': 10957443, 'inn': '5101750104', 'inspectorFullName': [], 'isFromSmev': False, 'isHasApproveDocs': False, 'isHasCollaboratingOrganization': False, 'isHasRequirements': True, 'isHasViolationTerm': False, 'isPm': False, 'kind': 'Выездная проверка', 'knmAnnulled': False, 'knmRejected': False, 'knmType': 'Плановое КНМ', 'knmTypeId': 4, 'legalBasisDocName': [], 'links': [], 'mspCategory': ['Не является субъектом МСП'], 'noPunishment': False, 'notifyLate': False, 'objectsKind': ['Деятельность, действия (бездействие) контролируемых лиц, в рамках которых должны соблюдаться обязательные требования, в том числе предъявляемые к контролируемым лицам, осуществляющим деятельность, действия (бездействие)'], 'objectsSubKind': [], 'objectsType': ['Деятельность и действия'], 'ogrn': '1025100510687', 'oldKnm': None, 'oldPlan': None, 'orderDone': False, 'organizationName': 'МУНИЦИПАЛЬНОЕ АВТОНОМНОЕ ДОШКОЛЬНОЕ ОБРАЗОВАТЕЛЬНОЕ УЧРЕЖДЕНИЕ № 35 Г. АПАТИТЫ', 'organizationsInn': ['5101750104'], 'organizationsName': ['МУНИЦИПАЛЬНОЕ АВТОНОМНОЕ ДОШКОЛЬНОЕ ОБРАЗОВАТЕЛЬНОЕ УЧРЕЖДЕНИЕ № 35 Г. АПАТИТЫ'], 'organizationsOgrn': ['1025100510687'], 'planId': '2022038280', 'prosecutorOrganization': 'Прокуратура Мурманской области', 'prosecutorOrganizationId': 788, 'publishedStatus': 'UNPUBLISHED', 'reasons': [201], 'reasonsList': [{'assignmentDate': None, 'assignmentDateEn': None, 'assignmentNumber': None, 'date': '14.05.2021', 'dateEn': '2021-05-14', 'requirementDetails': None, 'text': '(ФЗ 248) Истечение установленного федеральным законом о виде контроля, положением о виде контроля период времени с даты окончания проведения последнего планового контрольного (надзорного) мероприятия'}], 'recEmptyOrLate': False, 'regDateEgrul': '20.09.2021', 'regDateEgrulEn': '2021-09-20', 'regLate': False, 'regTypes': [], 'requirements': 1, 'requirementsList': [{'nameNpa': 'None', 'numberNpa': 'None', 'title': '1.\tФедеральный закон от 30 марта 1999 г. № 52-ФЗ “О санитарно-эпидемиологическом благополучии населения” ст.1-4, 11-36, 41-42, 55, 57.\n2.\tФедеральный закон от 17.09.1998г. № 157-ФЗ «Об иммунопрофилактике инфекционных болезней» ст.1, 3, 4, 5\n3.\tФедеральный закон от 18.06.2001 N 77-ФЗ «О предупреждении распространения туберкулеза в Российской Федерации» ст. 1-19. \n4.\tФедеральный закон от 29.12.2012 N 273-ФЗ (ред. от 21.07.2014) Об образовании в Российской Федерации ст.1-2, ст.35, ст.37, ст.38, ст.41.\n5.\tФедеральный закон от 27 декабря 2002г. № 184-ФЗ «О техническом регулировании» ст.1-4, 5.1, 6-7, 18-30, 36-42.\n6.\tТР ТС 005/2011 «О безопасности упаковки». ст. 1-9, приложения № 1-5\n7.\tТР ТС 007/2011 «О безопасности продукции, предназначенной для детей и подростков» ст.1-14, приложения 1-22.\n8.\tТР ТС 021/2011 «О безопасности пищевой продукции» ст.1-40, приложения 1-10.\n9.\tТР ТС 033/2013 «О безопасности молока и молочной продукции» п.1-115, прил. 1-16.\n10.\tТР ТС 022/2011 «Пищевая продукция в части ее маркировки» ст.1-5, приложения 1-5.\n11.\tТР ТС 023/2011 «Технический регламент на соковую продукцию из фруктов и овощей» ст.1-8, приложения 1-3.\n12.\tТР ТС 024/2011  «Технический  регламент  на  масложировую продукцию» главы 1 - 7, ст.1-21, приложения 1-5.\n13.\tТР ТС 034/2013 «О безопасности мяса и мясной продукции I-XVI приложения 1-5. \n14.\tТР ТС 019/2011 «О безопасности средств индивидуальной защиты» главы 1-7 приложения 1-5.\n15.\tТР ТС 008/2011 Технический регламент Таможенного союза «О безопасности игрушек» статьи 1-8, приложения 1-3.\n16.\tТР ТС 009/2011 Технический регламент Таможенного союза «О безопасности парфюмерно-косметической продукции» статьи от 1-9, приложения 1-12.\n17.\tТР ТС 025/2012. Технический регламент Таможенного союза. «О безопасности мебельной продукции ст. 1-8, приложения 1-5.\n18.\tСанПиН 2.3/2.4.3590-20 Санитарно-эпидемиологические требования к организации общественного питания населения глава 8, приложения 1-13\n19.\tСП 2.4.3648-20 Санитарно-эпидемиологические требования к организациям воспитания и обучения, отдыха и оздоровления детей и молодежи главы 1-3\n20.\tСанПиН 1.2.3685-21 Гигиенические нормативы и требования к обеспечению безопасности и (или) безвредности для человека факторов среды обитания\n21.\tСП 2.2.3670-20 Санитарно-эпидемиологические требования к условиям труда\n22.\tСанПиН 2.1.3684-21 Санитарно-эпидемиологические требования к содержанию территорий городских и сельских поселений, к водным объектам, питьевой воде и питьевому водоснабжению, атмосферному воздуху, почвам, жилым помещениям, эксплуатации производственных, общественных помещений, организации и проведению санитарно-противоэпидемических (профилактических) мероприятий разделы 3, 4,п.13, п.117-118,п.123\n23.\tСанПиН 3.3686-21 Санитарно-эпидемиологические требования по профилактике инфекционных болезней\n24.\tПриказ Минтруда России N 988н, Минздрава России N 1420н от 31.12.2020 Об утверждении перечня вредных и (или) опасных производственных факторов и работ, при выполнении которых проводятся обязательные предварительные медицинские осмотры при поступлении на работу и периодические медицинские осмотры раздел V\n25.\tПриказ Минздрава России от 28.01.2021 N 29н Об утверждении Порядка проведения обязательных предварительных и периодических медицинских осмотров работников, предусмотренных частью четвертой статьи 213 Трудового кодекса Российской Федерации, перечня медицинских противопоказаний к осуществлению работ с вредными и (или) опасными производственными факторами, а также работам, при выполнении которых проводятся обязательные предварительные и периодические медицинские осмотры п.25\n26.\tПриказ от 21 марта 2014 г. N 125н «Об утверждении национального календаря профилактических прививок и календаря профилактических прививок по эпидемиологическим показателям.\n27.\tСП 3.1/2.4.3598-20 Санитарно-эпидемиологические требования к устройству, содержанию и организации работы образовательных организаций и других объектов социальной инфраструктуры для детей и молодежи в условиях распространения новой коронавирусной инфекции (COVID-19) главы1-3\n28.\tСП 3.1.3597-20 Профилактика новой коронавирусной инфекции (COVID-19)\n29.\tПисьмо Роспотребнадзора от 08.09.2020 N 02/18612-2020-32 О дополнительных мерах по профилактике новой коронавирусной инфекции\n30.\tСанПиН 2.3.2.1324 – 03 «Гигиенические требования к срокам годности и условиям хранения пищевых продуктов» п.п.1.1 - 3.4.7., приложения 1-2.\n31.\tЕдиные санитарно-эпидемиологические и гигиенические требования к товарам, подлежащим санитарно-эпидемиологическому надзору (контролю), утвержденные Решениями Комиссии таможенного союза от 28 мая 2010г. №299, от 17 августа 2010г. №341, от 18 ноября 2010г. №456 разделы I-III, главы I-III, приложения 1-3, I-VI, приложения 1-5.\n32.\tПриказ МЗ от 29.06.2000 г. № 229 «О профессиональной гигиенической подготовке и аттестации должностных лиц работников организаций».\n33.\tПриказ Роспотребнадзора от 20.05.2005 N 402 (ред. от 07.04.2009) О личной медицинской книжке и санитарном паспорте (Зарегистрировано в Минюсте РФ 01.06.2005 N 6674).\n34.\t Постановление Правительства РФ от 28.12.2020 N 2314 Об утверждении Правил обращения с отходами производства и потребления в части осветительных устройств, электрических ламп, ненадлежащие сбор, накопление, использование, обезвреживание, транспортирование и размещение которых может повлечь причинение вреда жизни, здоровью граждан, вреда животным, растениям и окружающей среде\n35.\tСП 1.1.1058-01 «Организация и проведение производственного контроля за соблюдением санитарных правил и выполнением противоэпидемических (профилактических) мероприятий» с изменениями и дополнениями п.п.1.1. - 6.2.\n36.\tСанПиН 2.6.1.2523-09 «Нормы радиационной безопасности (НРБ-99/2009)» (приложение)\n37.\tСанПиН 2.6.1.2800-10 «Гигиенические требования по ограничению облучения населения за счет источников ионизирующего излучения».\n38.\tСП 2.6.1.2612-10 «Основные санитарные правила обеспечения радиационной безопасности ОСПРБ-99/2010)».\n39.\tСП 2.1.3678-20 Санитарно-эпидемиологические требования к эксплуатации помещений, зданий, сооружений, оборудования и транспорта, а также условиям деятельности хозяйствующих субъектов, осуществляющих продажу товаров, выполнение работ или оказание услуг, главы I, II'}], 'resolved': False, 'resultEmpty': True, 'resultEmptyOrLate': False, 'resultInfoTypeCodes': [], 'resultViolationKnm': False, 'riskCategory': ['чрезвычайно высокий риск'], 'riskCategoryAndDangerClass': ['чрезвычайно высокий риск'], 'sezRegistryExists': False, 'signed': False, 'smevInfoType': None, 'smevMessageType': None, 'smevReceivedAt': None, 'smevReceivedAtEn': None, 'smevReceivedAtMonth': None, 'smevReceivedAtYear': None, 'spvRegistryExists': False, 'startDate': '01.08.2022', 'startDateEn': '2022-08-01', 'status': 'Исключена', 'statusEgrul': 'Найден', 'statusId': 15, 'stopDate': None, 'stopDateEn': None, 'subjectTypeId': 0, 'supervisionType': 'Федеральный государственный санитарно-эпидемиологический контроль (надзор)', 'supervisionTypeId': '004', 'torRegistryExists': False, 'updatePlanDate': '11.07.2022 22.02.26', 'updatePlanDateLong': 1657576946, 'version': 'ERKNM', 'violationLawsuitTypeCodes': [], 'violationTypeCodes': [], 'year': 2022}
2023-03-16 14:08:11,665 - [WARNING] - direct_sql.py - new_insert_in_database(302) - Проведена повторная попытка внесения с параметром special, результат неудачный.
2023-03-16 14:08:11,665 - [INFO] - direct_sql.py - database_inserts_conductor_for_multiprocessing(133) - Возникла ошибка, с которой не удалось справиться...
2023-03-16 14:08:11,665 - [INFO] - direct_sql.py - database_inserts_conductor_for_multiprocessing(134) - 
2023-03-16 14:08:11,672 - [ERROR] - direct_sql.py - new_insert_in_database(300) - (1040, 'ny connections')
2023-03-16 14:08:11,672 - [INFO] - direct_sql.py - new_insert_in_database(301) - {'actCreateDate': None, 'actCreateDateEn': None, 'addresses': ['429380, ЧУВАШИЯ, ЧУВАШСКАЯ РЕСПУБЛИКА , РАЙОН ЯЛЬЧИКСКИЙ, С.ЯЛЬЧИКИ, УЛИЦА КОМСОМОЛЬСКАЯ, 9'], 'admLevelId': 50001, 'appealed': False, 'approveDocOrderDate': None, 'approveDocOrderNum': None, 'approveDocRequestDate': None, 'approveDocRequestNum': None, 'approveDocs': [], 'approveRequired': False, 'approved': False, 'approvedErknm': 'Отказано', 'chlistCount': 0, 'chlistFilledCount': 0, 'chlistFillingIndicationTypeId': [], 'collaboratingOrganizations': [], 'collaboratingOrganizationsIds': [], 'comment': None, 'controllingOrganization': 'Управление Роспотребнадзора по Чувашской Республике', 'controllingOrganizationId': 10001021692, 'createPlanDate': '08.09.2021 09.53.40', 'createPlanDateLong': 1631094820, 'createdByErpDb': False, 'createdById': 82063, 'dataNotEqualEGRUL': False, 'dataSetNotInTime': False, 'deleted': False, 'directDurationDays': None, 'disapprove': False, 'district': 'Батыревский район', 'districtId': 1033972070000001, 'durationDays': 10, 'durationHours': None, 'erknmActViolationIds': [], 'erknmResultKindDecisionIds': [], 'erpId': '21220041000100853339', 'events': [{'startDate': '11.07.2022', 'stopDate': '22.07.2022', 'title': 'Осмотр'}, {'startDate': '11.07.2022', 'stopDate': '22.07.2022', 'title': 'Досмотр'}, {'startDate': '11.07.2022', 'stopDate': '22.07.2022', 'title': 'Опрос'}, {'startDate': '11.07.2022', 'stopDate': '22.07.2022', 'title': 'Получение письменных объяснений'}, {'startDate': '11.07.2022', 'stopDate': '22.07.2022', 'title': 'Истребование документов'}, {'startDate': '11.07.2022', 'stopDate': '22.07.2022', 'title': 'Отбор проб (образцов)'}, {'startDate': '11.07.2022', 'stopDate': '22.07.2022', 'title': 'Инструментальное обследование'}, {'startDate': '11.07.2022', 'stopDate': '22.07.2022', 'title': 'Испытание'}, {'startDate': '11.07.2022', 'stopDate': '22.07.2022', 'title': 'Экспертиза'}], 'federalLaw': '248', 'federalLawId': 3, 'fullFieldViolationKnm': False, 'hasViolations': False, 'id': 10925465, 'inn': '2120002684', 'inspectorFullName': [], 'isFromSmev': False, 'isHasApproveDocs': False, 'isHasCollaboratingOrganization': False, 'isHasRequirements': True, 'isHasViolationTerm': False, 'isPm': False, 'kind': 'Выездная проверка', 'knmAnnulled': False, 'knmRejected': False, 'knmType': 'Плановое КНМ', 'knmTypeId': 4, 'legalBasisDocName': [], 'links': [], 'mspCategory': ['Не является субъектом МСП'], 'noPunishment': False, 'notifyLate': False, 'objectsKind': ['Деятельность дошкольных образовательных организаций'], 'objectsSubKind': ['Деятельность дошкольных образовательных организаций'], 'objectsType': ['Деятельность и действия'], 'ogrn': '1052132002757', 'oldKnm': None, 'oldPlan': None, 'orderDone': False, 'organizationName': 'МУНИЦИПАЛЬНОЕ БЮДЖЕТНОЕ ДОШКОЛЬНОЕ ОБРАЗОВАТЕЛЬНОЕ УЧРЕЖДЕНИЕ ДЕТСКИЙ САД СОЛНЫШКО СЕЛА ЯЛЬЧИКИ ЯЛЬЧИКСКОГО РАЙОНА ЧУВАШСКОЙ РЕСПУБЛИКИ', 'organizationsInn': ['2120002684'], 'organizationsName': ['МУНИЦИПАЛЬНОЕ БЮДЖЕТНОЕ ДОШКОЛЬНОЕ ОБРАЗОВАТЕЛЬНОЕ УЧРЕЖДЕНИЕ ДЕТСКИЙ САД СОЛНЫШКО СЕЛА ЯЛЬЧИКИ ЯЛЬЧИКСКОГО РАЙОНА ЧУВАШСКОЙ РЕСПУБЛИКИ'], 'organizationsOgrn': ['1052132002757'], 'planId': '2022042027', 'prosecutorOrganization': 'Прокуратура Батыревского района ЧР', 'prosecutorOrganizationId': 1361, 'publishedStatus': 'UNPUBLISHED', 'reasons': [204], 'reasonsList': [{'assignmentDate': None, 'assignmentDateEn': None, 'assignmentNumber': None, 'date': None, 'dateEn': None, 'requirementDetails': None, 'text': '(ФЗ 248) Истечение установленного федеральным законом о виде контроля, положением о виде контроля периода времени с даты иного события, установленного федеральным законом о виде контроля, положением о виде контроля, которое ведет к возникновению объекта контроля'}], 'recEmptyOrLate': False, 'regDateEgrul': '17.09.2021', 'regDateEgrulEn': '2021-09-17', 'regLate': False, 'regTypes': [], 'requirements': 19, 'requirementsList': [{'nameNpa': 'None', 'numberNpa': '30.03.1999', 'title': '«О санитарно-эпидемиологическом благополучии населения»'}, {'nameNpa': 'None', 'numberNpa': '17.09.1998', 'title': '«Об иммунопрофилактике инфекционных болезней»'}, {'nameNpa': 'None', 'numberNpa': '27.12.2002', 'title': ' «О техническом регулировании»;'}, {'nameNpa': 'None', 'numberNpa': 'None', 'title': 'Об охране здоровья граждан от воздействия окружающего табачного дыма и последствий потребления табака;'}, {'nameNpa': 'None', 'numberNpa': '02.01.2000', 'title': '«О качестве и безопасности пищевых продуктов»'}, {'nameNpa': 'None', 'numberNpa': 'None', 'title': ' «Санитарно-эпидемиологические требования к организации общественного питания населения»'}, {'nameNpa': 'None', 'numberNpa': '28.01.2021', 'title': '«Санитарно-эпидемиологические требования по профилактике инфекционных болезней»'}, {'nameNpa': 'None', 'numberNpa': 'None', 'title': ' Санитарно-эпидемиологические требования к организациям воспитания и обучения, отдыха и оздоровления детей и молодежи»'}, {'nameNpa': 'None', 'numberNpa': 'None', 'title': 'Гигиенические нормативы и требования к обеспечению безопасности и (или) безвредности для человека факторов среды обитания'}, {'nameNpa': 'None', 'numberNpa': '28.01.2021', 'title': 'Санитарно-эпидемиологические требования к содержанию территорий городских и сельских поселений, к водным объектам, питьевой воде и питьевому водоснабжению, атмосферному воздуху, почвам, жилым помещениям, эксплуатации производственных, общественных помещений, организации и проведению санитарно-противоэпидемических (профилактических) мероприятий'}, {'nameNpa': 'None', 'numberNpa': '18.10.2016', 'title': 'О безопасности рыбы и рыбной продукции'}, {'nameNpa': 'None', 'numberNpa': '09.12.2011', 'title': '«Пищевая продукция в части ее маркировки»'}, {'nameNpa': 'None', 'numberNpa': '09.10.2013', 'title': '«О безопасности молока и молочной продукции»'}, {'nameNpa': 'None', 'numberNpa': '09.12.2011', 'title': '«Технический регламент на соковую продукцию из фруктов и овощей'}, {'nameNpa': 'None', 'numberNpa': 'None', 'title': '«Технический регламент на масложировую продукцию»;'}, {'nameNpa': 'None', 'numberNpa': '09.12.2011', 'title': '«О безопасности пищевой продукции»'}, {'nameNpa': 'None', 'numberNpa': '09.10.2013', 'title': '«О безопасности мяса и мясной продукции»'}, {'nameNpa': 'None', 'numberNpa': '15.06.2012', 'title': '«О безопасности мебельной продукции»'}, {'nameNpa': 'None', 'numberNpa': '28.01.2021', 'title': '«Об утверждении порядка проведения обязательных предварительных и периодических медицинских осмотров работников, предусмотренных частью четвертой статьи 213 Трудового кодекса Российской Федерации, перечня медицинских противопоказаний к осуществлению работ с вредными и (или) опасными производственными факторами, а также работам, при выполнении которых проводятся обязательные предварительные и периодические медицинские осмотры»'}], 'resolved': False, 'resultEmpty': True, 'resultEmptyOrLate': False, 'resultInfoTypeCodes': [], 'resultViolationKnm': False, 'riskCategory': ['чрезвычайно высокий риск'], 'riskCategoryAndDangerClass': ['чрезвычайно высокий риск / Первый'], 'sezRegistryExists': False, 'signed': False, 'smevInfoType': None, 'smevMessageType': None, 'smevReceivedAt': None, 'smevReceivedAtEn': None, 'smevReceivedAtMonth': None, 'smevReceivedAtYear': None, 'spvRegistryExists': False, 'startDate': '11.07.2022', 'startDateEn': '2022-07-11', 'status': 'Исключена', 'statusEgrul': 'Найден', 'statusId': 15, 'stopDate': '22.07.2022', 'stopDateEn': '2022-07-22', 'subjectTypeId': 0, 'supervisionType': 'Федеральный государственный санитарно-эпидемиологический контроль (надзор)', 'supervisionTypeId': '004', 'torRegistryExists': False, 'updatePlanDate': '27.06.2022 17.41.05', 'updatePlanDateLong': 1656351665, 'version': 'ERKNM', 'violationLawsuitTypeCodes': [], 'violationTypeCodes': [], 'year': 2022}
2023-03-16 14:08:11,673 - [WARNING] - direct_sql.py - new_insert_in_database(302) - Проведена повторная попытка внесения с параметром special, результат неудачный.
2023-03-16 14:08:11,673 - [INFO] - direct_sql.py - database_inserts_conductor_for_multiprocessing(133) - Возникла ошибка, с которой не удалось справиться...
2023-03-16 14:08:11,673 - [INFO] - direct_sql.py - database_inserts_conductor_for_multiprocessing(134) - 
2023-03-16 14:08:11,674 - [ERROR] - direct_sql.py - new_insert_in_database(300) - (1040, 'ny connections')
2023-03-16 14:08:11,674 - [INFO] - direct_sql.py - new_insert_in_database(301) - {'actCreateDate': None, 'actCreateDateEn': None, 'addresses': ['668420, РЕСПУБЛИКА, ТЫВА, РАЙОН, КАА-ХЕМСКИЙ, УЛИЦА, ЦЕНТРАЛЬНАЯ, ДОМ 62 А, 170050000110004'], 'admLevelId': 50001, 'appealed': False, 'approveDocOrderDate': None, 'approveDocOrderNum': None, 'approveDocRequestDate': None, 'approveDocRequestNum': None, 'approveDocs': [], 'approveRequired': False, 'approved': False, 'approvedErknm': 'Отказано', 'chlistCount': 0, 'chlistFilledCount': 0, 'chlistFillingIndicationTypeId': [], 'collaboratingOrganizations': [], 'collaboratingOrganizationsIds': [], 'comment': 'в соответствии с ч. 2 ст. 3 248-ФЗ порядок организации и осуществления государственного контроля (надзора) устанавливается положением о соответствующем виде контроля (надзора). ПП РФ от 30.06.2021 № 1100 действует до 01.09.2021', 'controllingOrganization': 'Управление Роспотребнадзора по Республике Тыва', 'controllingOrganizationId': 10001022904, 'createPlanDate': '28.09.2021 11.23.18', 'createPlanDateLong': 1632828198, 'createdByErpDb': False, 'createdById': 99349, 'dataNotEqualEGRUL': False, 'dataSetNotInTime': False, 'deleted': False, 'directDurationDays': None, 'disapprove': False, 'district': 'Республика Тыва', 'districtId': 1035930000000001, 'durationDays': 10, 'durationHours': None, 'erknmActViolationIds': [], 'erknmResultKindDecisionIds': [], 'erpId': '17220041000101114997', 'events': [{'startDate': '03.10.2022', 'stopDate': '14.10.2022', 'title': 'Осмотр'}, {'startDate': '03.10.2022', 'stopDate': '14.10.2022', 'title': 'Досмотр'}, {'startDate': '03.10.2022', 'stopDate': '14.10.2022', 'title': 'Опрос'}, {'startDate': '03.10.2022', 'stopDate': '14.10.2022', 'title': 'Получение письменных объяснений'}, {'startDate': '03.10.2022', 'stopDate': '14.10.2022', 'title': 'Истребование документов'}, {'startDate': '03.10.2022', 'stopDate': '14.10.2022', 'title': 'Отбор проб (образцов)'}, {'startDate': '03.10.2022', 'stopDate': '14.10.2022', 'title': 'Инструментальное обследование'}, {'startDate': '03.10.2022', 'stopDate': '14.10.2022', 'title': 'Испытание'}, {'startDate': '03.10.2022', 'stopDate': '14.10.2022', 'title': 'Экспертиза'}], 'federalLaw': '248', 'federalLawId': 3, 'fullFieldViolationKnm': False, 'hasViolations': False, 'id': 11187123, 'inn': '1704000464', 'inspectorFullName': [], 'isFromSmev': False, 'isHasApproveDocs': False, 'isHasCollaboratingOrganization': False, 'isHasRequirements': True, 'isHasViolationTerm': False, 'isPm': False, 'kind': 'Выездная проверка', 'knmAnnulled': False, 'knmRejected': False, 'knmType': 'Плановое КНМ', 'knmTypeId': 4, 'legalBasisDocName': [], 'links': [], 'mspCategory': ['Не является субъектом МСП'], 'noPunishment': False, 'notifyLate': False, 'objectsKind': ['объекты организаций, оказывающих социальные услуги для детей-сирот и детей, оставшихся без попечения родителей'], 'objectsSubKind': ['Деятельность организаций, оказывающих социальные услуги для детей-сирот и детей, оставшихся без попечения родителей'], 'objectsType': ['Деятельность и действия'], 'ogrn': '1021700563807', 'oldKnm': None, 'oldPlan': None, 'orderDone': False, 'organizationName': 'ГОСУДАРСТВЕННОЕ БЮДЖЕТНОЕ УЧРЕЖДЕНИЕ РЕСПУБЛИКИ ТЫВА ЦЕНТР СОЦИАЛЬНОЙ ПОМОЩИ СЕМЬЕ И ДЕТЯМ КАА-ХЕМСКОГО КОЖУУНА', 'organizationsInn': ['1704000464'], 'organizationsName': ['ГОСУДАРСТВЕННОЕ БЮДЖЕТНОЕ УЧРЕЖДЕНИЕ РЕСПУБЛИКИ ТЫВА ЦЕНТР СОЦИАЛЬНОЙ ПОМОЩИ СЕМЬЕ И ДЕТЯМ КАА-ХЕМСКОГО КОЖУУНА'], 'organizationsOgrn': ['1021700563807'], 'planId': '2022046248', 'prosecutorOrganization': 'Прокуратура Республики Тыва', 'prosecutorOrganizationId': 2062, 'publishedStatus': 'UNPUBLISHED', 'reasons': [204], 'reasonsList': [{'assignmentDate': None, 'assignmentDateEn': None, 'assignmentNumber': None, 'date': None, 'dateEn': None, 'requirementDetails': None, 'text': '(ФЗ 248) Истечение установленного федеральным законом о виде контроля, положением о виде контроля периода времени с даты иного события, установленного федеральным законом о виде контроля, положением о виде контроля, которое ведет к возникновению объекта контроля'}], 'recEmptyOrLate': False, 'regDateEgrul': '29.09.2021', 'regDateEgrulEn': '2021-09-29', 'regLate': False, 'regTypes': [], 'requirements': 24, 'requirementsList': [{'nameNpa': 'None', 'numberNpa': '30.03.1999', 'title': '«О санитарно-эпидемиологическом благополучии населения»'}, {'nameNpa': 'None', 'numberNpa': '23.02.2013', 'title': ' «Об охране здоровья граждан от воздействия окружающего табачного дыма и последствий потребления табака»'}, {'nameNpa': 'None', 'numberNpa': '18.06.2001', 'title': '«О предупреждении распространения туберкулеза в Российской Федерации»'}, {'nameNpa': 'None', 'numberNpa': '04.05.2011', 'title': 'О лицензировании отдельных видов деятельности\n'}, {'nameNpa': 'None', 'numberNpa': '28.09.2020', 'title': ' «Санитарно-эпидемиологические требования к организациям воспитания и обучения, отдыха и оздоровления детей и молодежи»'}, {'nameNpa': 'None', 'numberNpa': '27.10.2020', 'title': '«Санитарно-эпидемиологические требования к организации общественного питания населения» '}, {'nameNpa': 'None', 'numberNpa': '10.07.2001', 'title': ' «Организация и проведение производственного контроля за соблюдением санитарных правил и выполнением санитарно-противоэпидемических (профилактических) мероприятий»'}, {'nameNpa': 'None', 'numberNpa': '28.01.2021', 'title': '«Гигиенические нормативы и требования к обеспечению безопасности и (или) безвредности для человека факторов среды обитания»'}, {'nameNpa': 'None', 'numberNpa': '14.11.2001', 'title': ' «Гигиенические требования безопасности и пищевой ценности пищевых продуктов»'}, {'nameNpa': 'None', 'numberNpa': '24.12.2020', 'title': '«Санитарно-эпидемиологические требования к эксплуатации помещений, зданий, сооружений, оборудования и транспорта, а также условиям деятельности хозяйствующих субъектов, осуществляющих продажу товаров, выполнение работ или оказание услуг»'}, {'nameNpa': 'None', 'numberNpa': '28.01.2021', 'title': ' «Санитарно-эпидемиологические требования к содержанию территорий городских и сельских поселений, к водным объектам, питьевой воде и питьевому водоснабжению населения, атмосферному воздуху, почвам, жилым помещениям, эксплуатации производственных, общественных помещений, организации и проведению санитарно-противоэпидемических (профилактических) мероприятий»'}, {'nameNpa': 'None', 'numberNpa': '02.12.2020', 'title': ' «Санитарно-эпидемиологические требования к условиям труда»'}, {'nameNpa': 'None', 'numberNpa': '28.01.2021', 'title': ' «Санитарно-эпидемиологические требования по профилактике инфекционных болезней»'}, {'nameNpa': 'None', 'numberNpa': '07.07.2009', 'title': '«Нормы радиационной безопасности (НРБ-99/2009)»'}, {'nameNpa': 'None', 'numberNpa': '26.04.2010', 'title': '«Основные санитарные правила обеспечения радиационной безопасности (ОСПОРБ-99/2010)»'}, {'nameNpa': 'None', 'numberNpa': '21.03.2014', 'title': ' «Об утверждении национального календаря профилактических прививок и календаря профилактических прививок по эпидемическим показаниям»'}, {'nameNpa': 'None', 'numberNpa': '28.01.2021', 'title': '«Об утверждении Порядка проведения обязательных предварительных и периодических медицинских осмотров работников, предусмотренных частью четвертой статьи 213 Трудового кодекса Российской Федерации, перечня медицинских противопоказаний к осуществлению работ с вредными и (или) опасными производственными факторами, а также работам, при выполнении которых проводятся обязательные предварительные и периодические медицинские осмотры».'}, {'nameNpa': 'None', 'numberNpa': '09.12.2011', 'title': 'Технический регламент ТС «О безопасности пищевой продукции» '}, {'nameNpa': 'None', 'numberNpa': '23.09.2011', 'title': 'Технический регламент ТС «О безопасности продукции, предназначенной для детей и подростков»'}, {'nameNpa': 'None', 'numberNpa': '09.12.2011', 'title': 'Технический регламент ТС «Пищевая продукция в части ее маркировки» '}, {'nameNpa': 'None', 'numberNpa': '09.12.2011', 'title': 'Технический регламент ТС «Технический регламент на масложировую продукцию»'}, {'nameNpa': 'None', 'numberNpa': '09.10.2013', 'title': 'Технический регламент ТС «О безопасности молока и молочной продукции» '}, {'nameNpa': 'None', 'numberNpa': '09.10.2013', 'title': 'Технический регламент ТС «О безопасности мяса и мясной продукции» '}, {'nameNpa': 'None', 'numberNpa': '18.10.2016', 'title': ' «О безопасности рыбы и рыбной продукции»'}], 'resolved': False, 'resultEmpty': True, 'resultEmptyOrLate': False, 'resultInfoTypeCodes': [], 'resultViolationKnm': False, 'riskCategory': ['чрезвычайно высокий риск'], 'riskCategoryAndDangerClass': ['чрезвычайно высокий риск'], 'sezRegistryExists': False, 'signed': True, 'smevInfoType': None, 'smevMessageType': None, 'smevReceivedAt': None, 'smevReceivedAtEn': None, 'smevReceivedAtMonth': None, 'smevReceivedAtYear': None, 'spvRegistryExists': False, 'startDate': '03.10.2022', 'startDateEn': '2022-10-03', 'status': 'Исключена', 'statusEgrul': 'Найден', 'statusId': 15, 'stopDate': '14.10.2022', 'stopDateEn': '2022-10-14', 'subjectTypeId': 0, 'supervisionType': 'Федеральный государственный санитарно-эпидемиологический контроль (надзор)', 'supervisionTypeId': '004', 'torRegistryExists': False, 'updatePlanDate': '25.08.2022 09.32.43', 'updatePlanDateLong': 1661419963, 'version': 'ERKNM', 'violationLawsuitTypeCodes': [], 'violationTypeCodes': [], 'year': 2022}
2023-03-16 14:08:11,675 - [WARNING] - direct_sql.py - new_insert_in_database(302) - Проведена повторная попытка внесения с параметром special, результат неудачный.
2023-03-16 14:08:11,675 - [INFO] - direct_sql.py - database_inserts_conductor_for_multiprocessing(133) - Возникла ошибка, с которой не удалось справиться...
2023-03-16 14:08:11,675 - [INFO] - direct_sql.py - database_inserts_conductor_for_multiprocessing(134) - 
2023-03-16 14:08:11,685 - [ERROR] - direct_sql.py - new_insert_in_database(300) - (1040, 'ny connections')
2023-03-16 14:08:11,687 - [ERROR] - direct_sql.py - new_insert_in_database(300) - (1040, 'ny connections')
2023-03-16 14:08:11,693 - [ERROR] - direct_sql.py - new_insert_in_database(300) - (1040, 'ny connections')
2023-03-16 14:08:11,693 - [INFO] - direct_sql.py - new_insert_in_database(301) - {'actCreateDate': None, 'actCreateDateEn': None, 'addresses': ['184209, Мурманская обл., г. Апатиты, ул. Дзержинского, 33 '], 'admLevelId': 50001, 'appealed': False, 'approveDocOrderDate': None, 'approveDocOrderNum': None, 'approveDocRequestDate': None, 'approveDocRequestNum': None, 'approveDocs': [], 'approveRequired': False, 'approved': False, 'approvedErknm': 'Отказано', 'chlistCount': 0, 'chlistFilledCount': 0, 'chlistFillingIndicationTypeId': [], 'collaboratingOrganizations': [], 'collaboratingOrganizationsIds': [], 'comment': None, 'controllingOrganization': 'Управление Роспотребнадзора по Мурманской области', 'controllingOrganizationId': 10001017456, 'createPlanDate': '04.08.2021 12.21.12', 'createPlanDateLong': 1628079672, 'createdByErpDb': False, 'createdById': 108896, 'dataNotEqualEGRUL': False, 'dataSetNotInTime': False, 'deleted': False, 'directDurationDays': None, 'disapprove': False, 'district': 'Мурманская область', 'districtId': 1031470000000001, 'durationDays': 10, 'durationHours': None, 'erknmActViolationIds': [], 'erknmResultKindDecisionIds': [], 'erpId': '51220041000100889537', 'events': [{'startDate': '01.08.2022', 'stopDate': '12.08.2022', 'title': 'Осмотр'}, {'startDate': '01.08.2022', 'stopDate': '12.08.2022', 'title': 'Опрос'}, {'startDate': '01.08.2022', 'stopDate': '12.08.2022', 'title': 'Получение письменных объяснений'}, {'startDate': '01.08.2022', 'stopDate': '12.08.2022', 'title': 'Истребование документов'}, {'startDate': '01.08.2022', 'stopDate': '12.08.2022', 'title': 'Отбор проб (образцов)'}, {'startDate': '01.08.2022', 'stopDate': '12.08.2022', 'title': 'Инструментальное обследование'}, {'startDate': '01.08.2022', 'stopDate': '12.08.2022', 'title': 'Экспертиза'}, {'startDate': '01.08.2022', 'stopDate': '12.08.2022', 'title': 'Испытание'}], 'federalLaw': '248', 'federalLawId': 3, 'fullFieldViolationKnm': False, 'hasViolations': False, 'id': 10961663, 'inn': '5101750150', 'inspectorFullName': [], 'isFromSmev': False, 'isHasApproveDocs': False, 'isHasCollaboratingOrganization': False, 'isHasRequirements': True, 'isHasViolationTerm': False, 'isPm': False, 'kind': 'Выездная проверка', 'knmAnnulled': False, 'knmRejected': False, 'knmType': 'Плановое КНМ', 'knmTypeId': 4, 'legalBasisDocName': [], 'links': [], 'mspCategory': ['Не является субъектом МСП'], 'noPunishment': False, 'notifyLate': False, 'objectsKind': ['Деятельность, действия (бездействие) контролируемых лиц, в рамках которых должны соблюдаться обязательные требования, в том числе предъявляемые к контролируемым лицам, осуществляющим деятельность, действия (бездействие)'], 'objectsSubKind': [], 'objectsType': ['Деятельность и действия'], 'ogrn': '1025100510600', 'oldKnm': None, 'oldPlan': None, 'orderDone': False, 'organizationName': 'МУНИЦИПАЛЬНОЕ БЮДЖЕТНОЕ ДОШКОЛЬНОЕ ОБРАЗОВАТЕЛЬНОЕ УЧРЕЖДЕНИЕ № 50 Г. АПАТИТЫ', 'organizationsInn': ['5101750150'], 'organizationsName': ['МУНИЦИПАЛЬНОЕ БЮДЖЕТНОЕ ДОШКОЛЬНОЕ ОБРАЗОВАТЕЛЬНОЕ УЧРЕЖДЕНИЕ № 50 Г. АПАТИТЫ'], 'organizationsOgrn': ['1025100510600'], 'planId': '2022038280', 'prosecutorOrganization': 'Прокуратура Мурманской области', 'prosecutorOrganizationId': 788, 'publishedStatus': 'UNPUBLISHED', 'reasons': [201], 'reasonsList': [{'assignmentDate': None, 'assignmentDateEn': None, 'assignmentNumber': None, 'date': '07.07.2021', 'dateEn': '2021-07-07', 'requirementDetails': None, 'text': '(ФЗ 248) Истечение установленного федеральным законом о виде контроля, положением о виде контроля период времени с даты окончания проведения последнего планового контрольного (надзорного) мероприятия'}], 'recEmptyOrLate': False, 'regDateEgrul': '20.09.2021', 'regDateEgrulEn': '2021-09-20', 'regLate': False, 'regTypes': [], 'requirements': 1, 'requirementsList': [{'nameNpa': 'None', 'numberNpa': 'None', 'title': '1.\tФедеральный закон от 30 марта 1999 г. № 52-ФЗ “О санитарно-эпидемиологическом благополучии населения” ст.1-4, 11-36, 41-42, 55, 57.\n2.\tФедеральный закон от 17.09.1998г. № 157-ФЗ «Об иммунопрофилактике инфекционных болезней» ст.1, 3, 4, 5\n3.\tФедеральный закон от 18.06.2001 N 77-ФЗ «О предупреждении распространения туберкулеза в Российской Федерации» ст. 1-19. \n4.\tФедеральный закон от 29.12.2012 N 273-ФЗ (ред. от 21.07.2014) Об образовании в Российской Федерации ст.1-2, ст.35, ст.37, ст.38, ст.41.\n5.\tФедеральный закон от 27 декабря 2002г. № 184-ФЗ «О техническом регулировании» ст.1-4, 5.1, 6-7, 18-30, 36-42.\n6.\tТР ТС 005/2011 «О безопасности упаковки». ст. 1-9, приложения № 1-5\n7.\tТР ТС 007/2011 «О безопасности продукции, предназначенной для детей и подростков» ст.1-14, приложения 1-22.\n8.\tТР ТС 021/2011 «О безопасности пищевой продукции» ст.1-40, приложения 1-10.\n9.\tТР ТС 033/2013 «О безопасности молока и молочной продукции» п.1-115, прил. 1-16.\n10.\tТР ТС 022/2011 «Пищевая продукция в части ее маркировки» ст.1-5, приложения 1-5.\n11.\tТР ТС 023/2011 «Технический регламент на соковую продукцию из фруктов и овощей» ст.1-8, приложения 1-3.\n12.\tТР ТС 024/2011  «Технический  регламент  на  масложировую продукцию» главы 1 - 7, ст.1-21, приложения 1-5.\n13.\tТР ТС 034/2013 «О безопасности мяса и мясной продукции I-XVI приложения 1-5. \n14.\tТР ТС 019/2011 «О безопасности средств индивидуальной защиты» главы 1-7 приложения 1-5.\n15.\tТР ТС 008/2011 Технический регламент Таможенного союза «О безопасности игрушек» статьи 1-8, приложения 1-3.\n16.\tТР ТС 009/2011 Технический регламент Таможенного союза «О безопасности парфюмерно-косметической продукции» статьи от 1-9, приложения 1-12.\n17.\tТР ТС 025/2012. Технический регламент Таможенного союза. «О безопасности мебельной продукции ст. 1-8, приложения 1-5.\n18.\tСанПиН 2.3/2.4.3590-20 Санитарно-эпидемиологические требования к организации общественного питания населения глава 8, приложения 1-13\n19.\tСП 2.4.3648-20 Санитарно-эпидемиологические требования к организациям воспитания и обучения, отдыха и оздоровления детей и молодежи главы 1-3\n20.\tСанПиН 1.2.3685-21 Гигиенические нормативы и требования к обеспечению безопасности и (или) безвредности для человека факторов среды обитания\n21.\tСП 2.2.3670-20 Санитарно-эпидемиологические требования к условиям труда\n22.\tСанПиН 2.1.3684-21 Санитарно-эпидемиологические требования к содержанию территорий городских и сельских поселений, к водным объектам, питьевой воде и питьевому водоснабжению, атмосферному воздуху, почвам, жилым помещениям, эксплуатации производственных, общественных помещений, организации и проведению санитарно-противоэпидемических (профилактических) мероприятий разделы 3, 4,п.13, п.117-118,п.123\n23.\tСанПиН 3.3686-21 Санитарно-эпидемиологические требования по профилактике инфекционных болезней\n24.\tПриказ Минтруда России N 988н, Минздрава России N 1420н от 31.12.2020 Об утверждении перечня вредных и (или) опасных производственных факторов и работ, при выполнении которых проводятся обязательные предварительные медицинские осмотры при поступлении на работу и периодические медицинские осмотры раздел V\n25.\tПриказ Минздрава России от 28.01.2021 N 29н Об утверждении Порядка проведения обязательных предварительных и периодических медицинских осмотров работников, предусмотренных частью четвертой статьи 213 Трудового кодекса Российской Федерации, перечня медицинских противопоказаний к осуществлению работ с вредными и (или) опасными производственными факторами, а также работам, при выполнении которых проводятся обязательные предварительные и периодические медицинские осмотры п.25\n26.\tПриказ от 21 марта 2014 г. N 125н «Об утверждении национального календаря профилактических прививок и календаря профилактических прививок по эпидемиологическим показателям.\n27.\tСП 3.1/2.4.3598-20 Санитарно-эпидемиологические требования к устройству, содержанию и организации работы образовательных организаций и других объектов социальной инфраструктуры для детей и молодежи в условиях распространения новой коронавирусной инфекции (COVID-19) главы1-3\n28.\tСП 3.1.3597-20 Профилактика новой коронавирусной инфекции (COVID-19)\n29.\tПисьмо Роспотребнадзора от 08.09.2020 N 02/18612-2020-32 О дополнительных мерах по профилактике новой коронавирусной инфекции\n30.\tСанПиН 2.3.2.1324 – 03 «Гигиенические требования к срокам годности и условиям хранения пищевых продуктов» п.п.1.1 - 3.4.7., приложения 1-2.\n31.\tЕдиные санитарно-эпидемиологические и гигиенические требования к товарам, подлежащим санитарно-эпидемиологическому надзору (контролю), утвержденные Решениями Комиссии таможенного союза от 28 мая 2010г. №299, от 17 августа 2010г. №341, от 18 ноября 2010г. №456 разделы I-III, главы I-III, приложения 1-3, I-VI, приложения 1-5.\n32.\tПриказ МЗ от 29.06.2000 г. № 229 «О профессиональной гигиенической подготовке и аттестации должностных лиц работников организаций».\n33.\tПриказ Роспотребнадзора от 20.05.2005 N 402 (ред. от 07.04.2009) О личной медицинской книжке и санитарном паспорте (Зарегистрировано в Минюсте РФ 01.06.2005 N 6674).\n34.\t Постановление Правительства РФ от 28.12.2020 N 2314 Об утверждении Правил обращения с отходами производства и потребления в части осветительных устройств, электрических ламп, ненадлежащие сбор, накопление, использование, обезвреживание, транспортирование и размещение которых может повлечь причинение вреда жизни, здоровью граждан, вреда животным, растениям и окружающей среде\n35.\tСП 1.1.1058-01 «Организация и проведение производственного контроля за соблюдением санитарных правил и выполнением противоэпидемических (профилактических) мероприятий» с изменениями и дополнениями п.п.1.1. - 6.2.\n36.\tСанПиН 2.6.1.2523-09 «Нормы радиационной безопасности (НРБ-99/2009)» (приложение)\n37.\tСанПиН 2.6.1.2800-10 «Гигиенические требования по ограничению облучения населения за счет источников ионизирующего излучения».\n38.\tСП 2.6.1.2612-10 «Основные санитарные правила обеспечения радиационной безопасности ОСПРБ-99/2010)».\n39.\tСП 2.1.3678-20 Санитарно-эпидемиологические требования к эксплуатации помещений, зданий, сооружений, оборудования и транспорта, а также условиям деятельности хозяйствующих субъектов, осуществляющих продажу товаров, выполнение работ или оказание услуг, главы I, II.\n'}], 'resolved': False, 'resultEmpty': True, 'resultEmptyOrLate': False, 'resultInfoTypeCodes': [], 'resultViolationKnm': False, 'riskCategory': ['чрезвычайно высокий риск'], 'riskCategoryAndDangerClass': ['чрезвычайно высокий риск'], 'sezRegistryExists': False, 'signed': False, 'smevInfoType': None, 'smevMessageType': None, 'smevReceivedAt': None, 'smevReceivedAtEn': None, 'smevReceivedAtMonth': None, 'smevReceivedAtYear': None, 'spvRegistryExists': False, 'startDate': '01.08.2022', 'startDateEn': '2022-08-01', 'status': 'Исключена', 'statusEgrul': 'Найден', 'statusId': 15, 'stopDate': None, 'stopDateEn': None, 'subjectTypeId': 0, 'supervisionType': 'Федеральный государственный санитарно-эпидемиологический контроль (надзор)', 'supervisionTypeId': '004', 'torRegistryExists': False, 'updatePlanDate': '11.07.2022 22.02.26', 'updatePlanDateLong': 1657576946, 'version': 'ERKNM', 'violationLawsuitTypeCodes': [], 'violationTypeCodes': [], 'year': 2022}
2023-03-16 14:08:11,694 - [WARNING] - direct_sql.py - new_insert_in_database(302) - Проведена повторная попытка внесения с параметром special, результат неудачный.
2023-03-16 14:08:11,693 - [INFO] - direct_sql.py - new_insert_in_database(301) - {'actCreateDate': None, 'actCreateDateEn': None, 'addresses': ['111555, ГОРОД, МОСКВА, УЛИЦА, СТАЛЕВАРОВ, 10А, 770000000000449', '111555, г. Москва, ул. Сталеваров, д. 16А', '111555, г. Москва, ул. Сталеваров, д. 8А'], 'admLevelId': 50001, 'appealed': False, 'approveDocOrderDate': None, 'approveDocOrderNum': None, 'approveDocRequestDate': None, 'approveDocRequestNum': None, 'approveDocs': [], 'approveRequired': False, 'approved': False, 'approvedErknm': 'Отказано', 'chlistCount': 0, 'chlistFilledCount': 0, 'chlistFillingIndicationTypeId': [], 'collaboratingOrganizations': [], 'collaboratingOrganizationsIds': [], 'comment': None, 'controllingOrganization': 'Управление Роспотребнадзора по г. Москве', 'controllingOrganizationId': 10001029839, 'createPlanDate': '02.09.2021 11.01.04', 'createPlanDateLong': 1630580464, 'createdByErpDb': False, 'createdById': 89189, 'dataNotEqualEGRUL': False, 'dataSetNotInTime': False, 'deleted': False, 'directDurationDays': None, 'disapprove': False, 'district': 'Город Москва столица Российской Федерации город федерального значения', 'districtId': 1030450000000001, 'durationDays': 10, 'durationHours': 80, 'erknmActViolationIds': [], 'erknmResultKindDecisionIds': [], 'erpId': '77220041000100818459', 'events': [{'startDate': '06.06.2022', 'stopDate': '17.06.2022', 'title': 'Осмотр'}, {'startDate': '06.06.2022', 'stopDate': '17.06.2022', 'title': 'Опрос'}, {'startDate': '06.06.2022', 'stopDate': '17.06.2022', 'title': 'Получение письменных объяснений'}, {'startDate': '06.06.2022', 'stopDate': '17.06.2022', 'title': 'Истребование документов'}, {'startDate': '06.06.2022', 'stopDate': '17.06.2022', 'title': 'Отбор проб (образцов)'}, {'startDate': '06.06.2022', 'stopDate': '17.06.2022', 'title': 'Инструментальное обследование'}, {'startDate': '06.06.2022', 'stopDate': '17.06.2022', 'title': 'Испытание'}, {'startDate': '06.06.2022', 'stopDate': '17.06.2022', 'title': 'Экспертиза'}], 'federalLaw': '248', 'federalLawId': 3, 'fullFieldViolationKnm': False, 'hasViolations': False, 'id': 10890585, 'inn': '7720675962', 'inspectorFullName': [], 'isFromSmev': False, 'isHasApproveDocs': False, 'isHasCollaboratingOrganization': False, 'isHasRequirements': True, 'isHasViolationTerm': False, 'isPm': False, 'kind': 'Выездная проверка', 'knmAnnulled': False, 'knmRejected': False, 'knmType': 'Плановое КНМ', 'knmTypeId': 4, 'legalBasisDocName': [], 'links': [], 'mspCategory': ['Не является субъектом МСП'], 'noPunishment': False, 'notifyLate': False, 'objectsKind': ['Деятельность общеобразовательных организаций', 'Деятельность общеобразовательных организаций', 'Деятельность общеобразовательных организаций'], 'objectsSubKind': ['Деятельность общеобразовательных организаций', 'Деятельность общеобразовательных организаций', 'Деятельность общеобразовательных организаций'], 'objectsType': ['Деятельность и действия', 'Деятельность и действия', 'Деятельность и действия'], 'ogrn': '1107746022559', 'oldKnm': None, 'oldPlan': None, 'orderDone': False, 'organizationName': 'ГОСУДАРСТВЕННОЕ БЮДЖЕТНОЕ ОБЩЕОБРАЗОВАТЕЛЬНОЕ УЧРЕЖДЕНИЕ ГОРОДА МОСКВЫ ШКОЛА № 1504', 'organizationsInn': ['7720675962'], 'organizationsName': ['ГОСУДАРСТВЕННОЕ БЮДЖЕТНОЕ ОБЩЕОБРАЗОВАТЕЛЬНОЕ УЧРЕЖДЕНИЕ ГОРОДА МОСКВЫ ШКОЛА № 1504'], 'organizationsOgrn': ['1107746022559'], 'planId': '2022040517', 'prosecutorOrganization': 'Прокуратура города Москвы', 'prosecutorOrganizationId': 554, 'publishedStatus': 'UNPUBLISHED', 'reasons': [201], 'reasonsList': [{'assignmentDate': None, 'assignmentDateEn': None, 'assignmentNumber': None, 'date': '30.11.2015', 'dateEn': '2015-11-30', 'requirementDetails': None, 'text': '(ФЗ 248) Истечение установленного федеральным законом о виде контроля, положением о виде контроля период времени с даты окончания проведения последнего планового контрольного (надзорного) мероприятия'}], 'recEmptyOrLate': False, 'regDateEgrul': '16.09.2021', 'regDateEgrulEn': '2021-09-16', 'regLate': False, 'regTypes': [], 'requirements': 16, 'requirementsList': [{'nameNpa': 'None', 'numberNpa': '28.01.2021', 'title': 'Постановление Главного государственного санитарного врача РФ от 28.01.2021 г. N 4\nОб утверждении санитарных правил и норм СанПиН 3.3686-21 Санитарно-эпидемиологические требования по профилактике инфекционных болезней\n'}, {'nameNpa': 'None', 'numberNpa': '28.01.2021', 'title': 'Постановление Главного государственного санитарного врача РФ\nот 28.01.2021 г. N 3\nОб утверждении санитарных правил и норм СанПиН 2.1.3684-21 Санитарно-эпидемиологические требования к содержанию территорий городских и сельских поселений, к водным объектам, питьевой воде и питьевому водоснабжению, атмосферному воздуху, почвам, жилым помещениям, эксплуатации производственных, общественных помещений, организации и проведению санитарно-противоэпидемических (профилактических) мероприятий\n\n'}, {'nameNpa': 'None', 'numberNpa': '24.12.2020', 'title': 'Постановление Главного государственного санитарного врача РФ от 24.12.2020 г. N 44\nОб утверждении санитарных правил СП 2.1.3678-20 Санитарно-эпидемиологические требования к эксплуатации помещений, зданий, сооружений, оборудования и транспорта, а также условиям деятельности хозяйствующих субъектов, осуществляющих продажу товаров, выполнение работ или оказание услуг\n\n'}, {'nameNpa': 'None', 'numberNpa': '28.01.2021', 'title': 'Постановление Главного государственного санитарного врача РФ от 28.01.2021 г. N 2\nОб утверждении санитарных правил и норм СанПиН 1.2.3685-21 Гигиенические нормативы и требования к обеспечению безопасности и (или) безвредности для человека факторов среды обитания\n'}, {'nameNpa': 'None', 'numberNpa': '27.10.2020', 'title': 'Постановление Главного государственного санитарного врача РФ от 27.10.2020 г. N 32\nОб утверждении санитарно-эпидемиологических правил и норм СанПиН 2.3/2.4.3590-20 Санитарно-эпидемиологические требования к организации общественного питания населения\n\n'}, {'nameNpa': 'None', 'numberNpa': '28.10.2020', 'title': 'Постановление Главного государственного санитарного врача РФ\nот 28.10.2020 г. N 28\nОб утверждении санитарных правил СП 2.4.3648-20 Санитарно-эпидемиологические требования к организациям воспитания и обучения, отдыха и оздоровления детей и молодежи\n'}, {'nameNpa': 'None', 'numberNpa': '30.03.1999', 'title': 'Федеральный закон от 30.03.1999 г. №52-ФЗ «О санитарно-эпидемиологическом благополучии населения», '}, {'nameNpa': 'None', 'numberNpa': '23.02.2013', 'title': 'Федеральный закон от 23.02.2013 №15-ФЗ Об охране здоровья граждан от воздействия окружающего табачного дыма, последствий потребления табака или потребления никотинсодержащей продукции\n\n'}, {'nameNpa': 'None', 'numberNpa': '17.09.1998', 'title': 'Федеральный закон от 17.09.1998 N 157-ФЗ Об иммунопрофилактике инфекционных болезней\n\n'}, {'nameNpa': 'None', 'numberNpa': '28.01.2021', 'title': 'Приказ Минздрава России от 28.01.2021 №29н Об утверждении Порядка проведения обязательных предварительных и периодических медицинских осмотров работников, предусмотренных частью четвертой статьи 213 Трудового кодекса Российской Федерации, перечня медицинских противопоказаний к осуществлению работ с вредными и (или) опасными производственными факторами, а также работам, при выполнении которых проводятся обязательные предварительные и периодические медицинские осмотры'}, {'nameNpa': 'None', 'numberNpa': '12.05.2014', 'title': 'Приказ Министерства здравоохранения РФ от 12.05.2014г. №214н «Об утверждении требований к знаку о запрете курения и к порядку его размещения»'}, {'nameNpa': 'None', 'numberNpa': '09.12.2011', 'title': 'Технический регламент О безопасности пищевой продукции (ТР ТС 021/2011) и осуществления оценки (подтверждения) соответствия продукции\n (утв. Решением Комиссии Таможенного союза от 9.12.2011 N 880)\n\n'}, {'nameNpa': 'None', 'numberNpa': '15.06.2012', 'title': 'Технический регламент Таможенного союза\nТР ТС 025/2012\nО безопасности мебельной продукции\n(принят решением Совета Евразийской экономической комиссии\nот 15.06.2012 г. N 32\n'}, {'nameNpa': 'None', 'numberNpa': '23.06.2017', 'title': 'Технический регламент Евразийского экономического союза О безопасности упакованной питьевой воды, включая природную минеральную воду (ТР ЕАЭС 044/2017) (принят Решением Совета\nЕвразийской экономической комиссии\nот 23.06.2017 года N 45)\t\n'}, {'nameNpa': 'None', 'numberNpa': '28.05.2010', 'title': 'Единые санитарно-эпидемиологические и гигиенические требования к продукции (товарам), подлежащей санитарно-эпидемиологическому надзору (контролю) УТВЕРЖДЕНЫ \nРешением Комиссии таможенного союза\nот 28.05.2010 года № 299\n\n'}, {'nameNpa': 'None', 'numberNpa': '02.01.2000', 'title': 'Федеральный закон О качестве и безопасности пищевых продуктов от 02.01.2000 N 29-ФЗ\n\n\n'}], 'resolved': False, 'resultEmpty': True, 'resultEmptyOrLate': False, 'resultInfoTypeCodes': [], 'resultViolationKnm': False, 'riskCategory': ['чрезвычайно высокий риск', 'чрезвычайно высокий риск', 'чрезвычайно высокий риск'], 'riskCategoryAndDangerClass': ['чрезвычайно высокий риск / Первый', 'чрезвычайно высокий риск / Первый', 'чрезвычайно высокий риск / Первый'], 'sezRegistryExists': False, 'signed': False, 'smevInfoType': None, 'smevMessageType': None, 'smevReceivedAt': None, 'smevReceivedAtEn': None, 'smevReceivedAtMonth': None, 'smevReceivedAtYear': None, 'spvRegistryExists': False, 'startDate': '06.06.2022', 'startDateEn': '2022-06-06', 'status': 'Исключена', 'statusEgrul': 'Найден', 'statusId': 15, 'stopDate': '17.06.2022', 'stopDateEn': '2022-06-17', 'subjectTypeId': 0, 'supervisionType': 'Федеральный государственный санитарно-эпидемиологический контроль (надзор)', 'supervisionTypeId': '004', 'torRegistryExists': False, 'updatePlanDate': '09.09.2022 14.29.51', 'updatePlanDateLong': 1662733791, 'version': 'ERKNM', 'violationLawsuitTypeCodes': [], 'violationTypeCodes': [], 'year': 2022}
2023-03-16 14:08:11,694 - [INFO] - direct_sql.py - database_inserts_conductor_for_multiprocessing(134) - 
2023-03-16 14:08:11,694 - [WARNING] - direct_sql.py - new_insert_in_database(302) - Проведена повторная попытка внесения с параметром special, результат неудачный.
2023-03-16 14:08:11,695 - [INFO] - direct_sql.py - database_inserts_conductor_for_multiprocessing(133) - Возникла ошибка, с которой не удалось справиться...
2023-03-16 14:08:11,695 - [INFO] - direct_sql.py - database_inserts_conductor_for_multiprocessing(134) - 
2023-03-16 14:08:11,690 - [INFO] - direct_sql.py - new_insert_in_database(301) - {'actCreateDate': None, 'actCreateDateEn': None, 'addresses': ['399551, обл. Липецкая, р-н Тербунский, с Вторые Тербуны, ул. Советская, д 37'], 'admLevelId': 50001, 'appealed': False, 'approveDocOrderDate': None, 'approveDocOrderNum': None, 'approveDocRequestDate': None, 'approveDocRequestNum': None, 'approveDocs': [], 'approveRequired': False, 'approved': False, 'approvedErknm': 'Отказано', 'chlistCount': 0, 'chlistFilledCount': 0, 'chlistFillingIndicationTypeId': [], 'collaboratingOrganizations': [], 'collaboratingOrganizationsIds': [], 'comment': 'Не соответствует требованиям п. 5 постановления Правительства РФ от 30.06.2021 №1100 (положение о виде контроля действует до 01.09.2022)', 'controllingOrganization': 'Управление Роспотребнадзора по Липецкой области', 'controllingOrganizationId': 10001025214, 'createPlanDate': '06.08.2021 08.50.09', 'createPlanDateLong': 1628239809, 'createdByErpDb': False, 'createdById': 130573, 'dataNotEqualEGRUL': False, 'dataSetNotInTime': False, 'deleted': False, 'directDurationDays': None, 'disapprove': False, 'district': 'Липецкая область', 'districtId': 1030420000000001, 'durationDays': 10, 'durationHours': None, 'erknmActViolationIds': [], 'erknmResultKindDecisionIds': [], 'erpId': '48220041000101063131', 'events': [{'startDate': '15.09.2022', 'stopDate': '16.09.2022', 'title': 'Осмотр'}, {'startDate': '15.09.2022', 'stopDate': '16.09.2022', 'title': 'Опрос'}, {'startDate': '15.09.2022', 'stopDate': '16.09.2022', 'title': 'Получение письменных объяснений'}, {'startDate': '15.09.2022', 'stopDate': '16.09.2022', 'title': 'Истребование документов'}, {'startDate': '15.09.2022', 'stopDate': '16.09.2022', 'title': 'Отбор проб (образцов)'}, {'startDate': '15.09.2022', 'stopDate': '16.09.2022', 'title': 'Инструментальное обследование'}], 'federalLaw': '248', 'federalLawId': 3, 'fullFieldViolationKnm': False, 'hasViolations': False, 'id': 11135257, 'inn': '4815000923', 'inspectorFullName': [], 'isFromSmev': False, 'isHasApproveDocs': False, 'isHasCollaboratingOrganization': False, 'isHasRequirements': True, 'isHasViolationTerm': False, 'isPm': False, 'kind': 'Выездная проверка', 'knmAnnulled': False, 'knmRejected': False, 'knmType': 'Плановое КНМ', 'knmTypeId': 4, 'legalBasisDocName': [], 'links': [], 'mspCategory': ['Не является субъектом МСП'], 'noPunishment': False, 'notifyLate': False, 'objectsKind': ['Деятельность общеобразовательных организаций'], 'objectsSubKind': ['общеобразовательные организации'], 'objectsType': ['Деятельность и действия'], 'ogrn': '1024800717700', 'oldKnm': None, 'oldPlan': None, 'orderDone': False, 'organizationName': 'МУНИЦИПАЛЬНОЕ БЮДЖЕТНОЕ ОБЩЕОБРАЗОВАТЕЛЬНОЕ УЧРЕЖДЕНИЕ СРЕДНЯЯ ОБЩЕОБРАЗОВАТЕЛЬНАЯ ШКОЛА С. ВТОРЫЕ ТЕРБУНЫ ТЕРБУНСКОГО МУНИЦИПАЛЬНОГО РАЙОНА ЛИПЕЦКОЙ ОБЛАСТИ', 'organizationsInn': ['4815000923'], 'organizationsName': ['МУНИЦИПАЛЬНОЕ БЮДЖЕТНОЕ ОБЩЕОБРАЗОВАТЕЛЬНОЕ УЧРЕЖДЕНИЕ СРЕДНЯЯ ОБЩЕОБРАЗОВАТЕЛЬНАЯ ШКОЛА С. ВТОРЫЕ ТЕРБУНЫ ТЕРБУНСКОГО МУНИЦИПАЛЬНОГО РАЙОНА ЛИПЕЦКОЙ ОБЛАСТИ'], 'organizationsOgrn': ['1024800717700'], 'planId': '2022038357', 'prosecutorOrganization': 'Прокуратура Липецкой области', 'prosecutorOrganizationId': 248, 'publishedStatus': 'UNPUBLISHED', 'reasons': [201], 'reasonsList': [{'assignmentDate': None, 'assignmentDateEn': None, 'assignmentNumber': None, 'date': '09.09.2021', 'dateEn': '2021-09-09', 'requirementDetails': None, 'text': '(ФЗ 248) Истечение установленного федеральным законом о виде контроля, положением о виде контроля период времени с даты окончания проведения последнего планового контрольного (надзорного) мероприятия'}], 'recEmptyOrLate': False, 'regDateEgrul': '27.09.2021', 'regDateEgrulEn': '2021-09-27', 'regLate': False, 'regTypes': [], 'requirements': 2, 'requirementsList': [{'nameNpa': 'None', 'numberNpa': '30.03.1999', 'title': ' «О санитарно-эпидемиологическом благополучии населения» '}, {'nameNpa': 'None', 'numberNpa': '28.09.2020', 'title': '«Санитарно-эпидемиологические требования к организации воспитания и обучения, отдыха и оздоровления детей и молодежи»'}], 'resolved': False, 'resultEmpty': True, 'resultEmptyOrLate': False, 'resultInfoTypeCodes': [], 'resultViolationKnm': False, 'riskCategory': ['чрезвычайно высокий риск'], 'riskCategoryAndDangerClass': ['чрезвычайно высокий риск / Первый'], 'sezRegistryExists': False, 'signed': True, 'smevInfoType': None, 'smevMessageType': None, 'smevReceivedAt': None, 'smevReceivedAtEn': None, 'smevReceivedAtMonth': None, 'smevReceivedAtYear': None, 'spvRegistryExists': False, 'startDate': '05.09.2022', 'startDateEn': '2022-09-05', 'status': 'Исключена', 'statusEgrul': 'Найден', 'statusId': 15, 'stopDate': '16.09.2022', 'stopDateEn': '2022-09-16', 'subjectTypeId': 0, 'supervisionType': 'Федеральный государственный санитарно-эпидемиологический контроль (надзор)', 'supervisionTypeId': '004', 'torRegistryExists': False, 'updatePlanDate': '26.08.2022 13.26.16', 'updatePlanDateLong': 1661520376, 'version': 'ERKNM', 'violationLawsuitTypeCodes': [], 'violationTypeCodes': [], 'year': 2022}
2023-03-16 14:08:11,696 - [WARNING] - direct_sql.py - new_insert_in_database(302) - Проведена повторная попытка внесения с параметром special, результат неудачный.
2023-03-16 14:08:11,697 - [INFO] - direct_sql.py - database_inserts_conductor_for_multiprocessing(133) - Возникла ошибка, с которой не удалось справиться...
2023-03-16 14:08:11,697 - [INFO] - direct_sql.py - database_inserts_conductor_for_multiprocessing(134) - 
2023-03-16 14:08:11,705 - [ERROR] - direct_sql.py - new_insert_in_database(300) - (1040, 'ny connections')
2023-03-16 14:08:11,705 - [INFO] - direct_sql.py - new_insert_in_database(301) - {'actCreateDate': None, 'actCreateDateEn': None, 'addresses': ['429380, ЧУВАШИЯ, ЧУВАШСКАЯ РЕСПУБЛИКА , РАЙОН ЯЛЬЧИКСКИЙ, С.ЯЛЬЧИКИ, УЛИЦА, НОВАЯ, 23'], 'admLevelId': 50001, 'appealed': False, 'approveDocOrderDate': None, 'approveDocOrderNum': None, 'approveDocRequestDate': None, 'approveDocRequestNum': None, 'approveDocs': [], 'approveRequired': False, 'approved': False, 'approvedErknm': 'Отказано', 'chlistCount': 0, 'chlistFilledCount': 0, 'chlistFillingIndicationTypeId': [], 'collaboratingOrganizations': [], 'collaboratingOrganizationsIds': [], 'comment': None, 'controllingOrganization': 'Управление Роспотребнадзора по Чувашской Республике', 'controllingOrganizationId': 10001021692, 'createPlanDate': '08.09.2021 09.53.40', 'createPlanDateLong': 1631094820, 'createdByErpDb': False, 'createdById': 82063, 'dataNotEqualEGRUL': False, 'dataSetNotInTime': False, 'deleted': False, 'directDurationDays': None, 'disapprove': False, 'district': 'Батыревский район', 'districtId': 1033972070000001, 'durationDays': 10, 'durationHours': None, 'erknmActViolationIds': [], 'erknmResultKindDecisionIds': [], 'erpId': '21220041000100853720', 'events': [{'startDate': '12.07.2022', 'stopDate': '25.07.2022', 'title': 'Осмотр'}, {'startDate': '12.07.2022', 'stopDate': '25.07.2022', 'title': 'Досмотр'}, {'startDate': '12.07.2022', 'stopDate': '25.07.2022', 'title': 'Опрос'}, {'startDate': '12.07.2022', 'stopDate': '25.07.2022', 'title': 'Получение письменных объяснений'}, {'startDate': '12.07.2022', 'stopDate': '25.07.2022', 'title': 'Истребование документов'}, {'startDate': '12.07.2022', 'stopDate': '25.07.2022', 'title': 'Отбор проб (образцов)'}, {'startDate': '12.07.2022', 'stopDate': '25.07.2022', 'title': 'Инструментальное обследование'}, {'startDate': '12.07.2022', 'stopDate': '25.07.2022', 'title': 'Испытание'}, {'startDate': '12.07.2022', 'stopDate': '25.07.2022', 'title': 'Экспертиза'}], 'federalLaw': '248', 'federalLawId': 3, 'fullFieldViolationKnm': False, 'hasViolations': False, 'id': 10925846, 'inn': '2120000937', 'inspectorFullName': [], 'isFromSmev': False, 'isHasApproveDocs': False, 'isHasCollaboratingOrganization': False, 'isHasRequirements': True, 'isHasViolationTerm': False, 'isPm': False, 'kind': 'Выездная проверка', 'knmAnnulled': False, 'knmRejected': False, 'knmType': 'Плановое КНМ', 'knmTypeId': 4, 'legalBasisDocName': [], 'links': [], 'mspCategory': ['Не является субъектом МСП'], 'noPunishment': False, 'notifyLate': False, 'objectsKind': ['Деятельность дошкольных образовательных организаций'], 'objectsSubKind': ['Деятельность дошкольных образовательных организаций'], 'objectsType': ['Деятельность и действия'], 'ogrn': '1132132000241', 'oldKnm': None, 'oldPlan': None, 'orderDone': False, 'organizationName': 'МУНИЦИПАЛЬНОЕ БЮДЖЕТНОЕ ДОШКОЛЬНОЕ ОБРАЗОВАТЕЛЬНОЕ УЧРЕЖДЕНИЕ ДЕТСКИЙ САД ШЕВЛЕ СЕЛА ЯЛЬЧИКИ ЯЛЬЧИКСКОГО РАЙОНА ЧУВАШСКОЙ РЕСПУБЛИКИ', 'organizationsInn': ['2120000937'], 'organizationsName': ['МУНИЦИПАЛЬНОЕ БЮДЖЕТНОЕ ДОШКОЛЬНОЕ ОБРАЗОВАТЕЛЬНОЕ УЧРЕЖДЕНИЕ ДЕТСКИЙ САД ШЕВЛЕ СЕЛА ЯЛЬЧИКИ ЯЛЬЧИКСКОГО РАЙОНА ЧУВАШСКОЙ РЕСПУБЛИКИ'], 'organizationsOgrn': ['1132132000241'], 'planId': '2022042027', 'prosecutorOrganization': 'Прокуратура Батыревского района ЧР', 'prosecutorOrganizationId': 1361, 'publishedStatus': 'UNPUBLISHED', 'reasons': [204], 'reasonsList': [{'assignmentDate': None, 'assignmentDateEn': None, 'assignmentNumber': None, 'date': None, 'dateEn': None, 'requirementDetails': None, 'text': '(ФЗ 248) Истечение установленного федеральным законом о виде контроля, положением о виде контроля периода времени с даты иного события, установленного федеральным законом о виде контроля, положением о виде контроля, которое ведет к возникновению объекта контроля'}], 'recEmptyOrLate': False, 'regDateEgrul': '17.09.2021', 'regDateEgrulEn': '2021-09-17', 'regLate': False, 'regTypes': [], 'requirements': 19, 'requirementsList': [{'nameNpa': 'None', 'numberNpa': '17.09.1998', 'title': '«Об иммунопрофилактике инфекционных болезней»'}, {'nameNpa': 'None', 'numberNpa': '27.12.2002', 'title': ' «О техническом регулировании»;'}, {'nameNpa': 'None', 'numberNpa': '02.01.2000', 'title': '«О качестве и безопасности пищевых продуктов»'}, {'nameNpa': 'None', 'numberNpa': 'None', 'title': 'Об охране здоровья граждан от воздействия окружающего табачного дыма и последствий потребления табака;'}, {'nameNpa': 'None', 'numberNpa': 'None', 'title': 'Гигиенические нормативы и требования к обеспечению безопасности и (или) безвредности для человека факторов среды обитания'}, {'nameNpa': 'None', 'numberNpa': 'None', 'title': ' «Санитарно-эпидемиологические требования к организации общественного питания населения»'}, {'nameNpa': 'None', 'numberNpa': '28.01.2021', 'title': 'Санитарно-эпидемиологические требования по профилактике инфекционных болезней'}, {'nameNpa': 'None', 'numberNpa': '28.01.2021', 'title': 'Санитарно-эпидемиологические требования к содержанию территорий городских и сельских поселений, к водным объектам, питьевой воде и питьевому водоснабжению, атмосферному воздуху, почвам, жилым помещениям, эксплуатации производственных, общественных помещений, организации и проведению санитарно-противоэпидемических (профилактических) мероприятий'}, {'nameNpa': 'None', 'numberNpa': '28.09.2020', 'title': '«Санитарно-эпидемиологические требования к организациям воспитания и обучения, отдыха и оздоровления детей и молодежи»'}, {'nameNpa': 'None', 'numberNpa': '18.10.2016', 'title': 'О безопасности рыбы и рыбной продукции'}, {'nameNpa': 'None', 'numberNpa': '09.12.2011', 'title': '«Пищевая продукция в части ее маркировки»'}, {'nameNpa': 'None', 'numberNpa': '09.10.2013', 'title': '«О безопасности молока и молочной продукции»'}, {'nameNpa': 'None', 'numberNpa': '13.06.2017', 'title': '«О безопасности упакованной питьевой воды, включая природную минеральную воду»'}, {'nameNpa': 'None', 'numberNpa': 'None', 'title': '«Технический регламент на масложировую продукцию»;'}, {'nameNpa': 'None', 'numberNpa': '09.12.2011', 'title': '«Технический регламент на соковую продукцию из фруктов и овощей'}, {'nameNpa': 'None', 'numberNpa': '09.12.2011', 'title': '«О безопасности пищевой продукции»'}, {'nameNpa': 'None', 'numberNpa': 'None', 'title': 'О безопасности мяса и мясной продукции» (за исключением пп. 1-8, 26-48, 53, 54 и абзаца 2 пункта 99);'}, {'nameNpa': 'None', 'numberNpa': '15.06.2012', 'title': '«О безопасности мебельной продукции» '}, {'nameNpa': 'None', 'numberNpa': '28.01.2021', 'title': '«Об утверждении Порядка проведения обязательных предварительных и периодических медицинских осмотров работников, предусмотренных частью четвертой статьи 213 Трудового кодекса Российской Федерации, перечня медицинских противопоказаний к осуществлению работ с вредными и (или) опасными производственными факторами, а также работам, при выполнении которых проводятся обязательные предварительные и периодические медицинские осмотры»'}], 'resolved': False, 'resultEmpty': True, 'resultEmptyOrLate': False, 'resultInfoTypeCodes': [], 'resultViolationKnm': False, 'riskCategory': ['чрезвычайно высокий риск'], 'riskCategoryAndDangerClass': ['чрезвычайно высокий риск / Первый'], 'sezRegistryExists': False, 'signed': False, 'smevInfoType': None, 'smevMessageType': None, 'smevReceivedAt': None, 'smevReceivedAtEn': None, 'smevReceivedAtMonth': None, 'smevReceivedAtYear': None, 'spvRegistryExists': False, 'startDate': '12.07.2022', 'startDateEn': '2022-07-12', 'status': 'Исключена', 'statusEgrul': 'Найден', 'statusId': 15, 'stopDate': '25.07.2022', 'stopDateEn': '2022-07-25', 'subjectTypeId': 0, 'supervisionType': 'Федеральный государственный санитарно-эпидемиологический контроль (надзор)', 'supervisionTypeId': '004', 'torRegistryExists': False, 'updatePlanDate': '27.06.2022 17.41.05', 'updatePlanDateLong': 1656351665, 'version': 'ERKNM', 'violationLawsuitTypeCodes': [], 'violationTypeCodes': [], 'year': 2022}
2023-03-16 14:08:11,706 - [WARNING] - direct_sql.py - new_insert_in_database(302) - Проведена повторная попытка внесения с параметром special, результат неудачный.
2023-03-16 14:08:11,706 - [INFO] - direct_sql.py - database_inserts_conductor_for_multiprocessing(133) - Возникла ошибка, с которой не удалось справиться...
2023-03-16 14:08:11,706 - [INFO] - direct_sql.py - database_inserts_conductor_for_multiprocessing(134) - 
2023-03-16 14:08:11,715 - [ERROR] - direct_sql.py - new_insert_in_database(300) - (1040, 'ny connections')
2023-03-16 14:08:11,716 - [INFO] - direct_sql.py - new_insert_in_database(301) - {'actCreateDate': None, 'actCreateDateEn': None, 'addresses': ['668420, РЕСПУБЛИКА, ТЫВА, РАЙОН, КАА-ХЕМСКИЙ, УЛИЦА, ЦЕНТРАЛЬНАЯ, ДОМ 62 А, 170050000110004'], 'admLevelId': 50001, 'appealed': False, 'approveDocOrderDate': None, 'approveDocOrderNum': None, 'approveDocRequestDate': None, 'approveDocRequestNum': None, 'approveDocs': [], 'approveRequired': False, 'approved': False, 'approvedErknm': 'Отказано', 'chlistCount': 0, 'chlistFilledCount': 0, 'chlistFillingIndicationTypeId': [], 'collaboratingOrganizations': [], 'collaboratingOrganizationsIds': [], 'comment': 'в соответствии с ч. 2 ст. 3 248-ФЗ порядок организации и осуществления государственного контроля (надзора) устанавливается положением о соответствующем виде контроля (надзора). ПП РФ от 30.06.2021 № 1100 действует до 01.09.2021', 'controllingOrganization': 'Управление Роспотребнадзора по Республике Тыва', 'controllingOrganizationId': 10001022904, 'createPlanDate': '28.09.2021 11.23.18', 'createPlanDateLong': 1632828198, 'createdByErpDb': False, 'createdById': 99349, 'dataNotEqualEGRUL': False, 'dataSetNotInTime': False, 'deleted': False, 'directDurationDays': None, 'disapprove': False, 'district': 'Республика Тыва', 'districtId': 1035930000000001, 'durationDays': 10, 'durationHours': None, 'erknmActViolationIds': [], 'erknmResultKindDecisionIds': [], 'erpId': '17220041000101116001', 'events': [{'startDate': '03.10.2022', 'stopDate': '14.10.2022', 'title': 'Осмотр'}, {'startDate': '03.10.2022', 'stopDate': '14.10.2022', 'title': 'Досмотр'}, {'startDate': '03.10.2022', 'stopDate': '14.10.2022', 'title': 'Опрос'}, {'startDate': '03.10.2022', 'stopDate': '14.10.2022', 'title': 'Получение письменных объяснений'}, {'startDate': '03.10.2022', 'stopDate': '14.10.2022', 'title': 'Истребование документов'}, {'startDate': '03.10.2022', 'stopDate': '14.10.2022', 'title': 'Отбор проб (образцов)'}, {'startDate': '03.10.2022', 'stopDate': '14.10.2022', 'title': 'Инструментальное обследование'}, {'startDate': '03.10.2022', 'stopDate': '14.10.2022', 'title': 'Испытание'}, {'startDate': '03.10.2022', 'stopDate': '14.10.2022', 'title': 'Экспертиза'}], 'federalLaw': '248', 'federalLawId': 3, 'fullFieldViolationKnm': False, 'hasViolations': False, 'id': 11188127, 'inn': '1704003024', 'inspectorFullName': [], 'isFromSmev': False, 'isHasApproveDocs': False, 'isHasCollaboratingOrganization': False, 'isHasRequirements': True, 'isHasViolationTerm': False, 'isPm': False, 'kind': 'Выездная проверка', 'knmAnnulled': False, 'knmRejected': False, 'knmType': 'Плановое КНМ', 'knmTypeId': 4, 'legalBasisDocName': [], 'links': [], 'mspCategory': ['Не является субъектом МСП'], 'noPunishment': False, 'notifyLate': False, 'objectsKind': ['дошкольные образовательные организации'], 'objectsSubKind': ['Деятельность дошкольных образовательных организаций'], 'objectsType': ['Деятельность и действия'], 'ogrn': '1031700563663', 'oldKnm': None, 'oldPlan': None, 'orderDone': False, 'organizationName': 'МУНИЦИПАЛЬНОЕ БЮДЖЕТНОЕ ДОШКОЛЬНОЕ ОБРАЗОВАТЕЛЬНОЕ УЧРЕЖДЕНИЕ ДЕТСКИЙ САД ЧЕЛЭЭШ С. КУНДУСТУГ, КАА-ХЕМСКОГО РАЙОНА РЕСПУБЛИКИ ТЫВА', 'organizationsInn': ['1704003024'], 'organizationsName': ['МУНИЦИПАЛЬНОЕ БЮДЖЕТНОЕ ДОШКОЛЬНОЕ ОБРАЗОВАТЕЛЬНОЕ УЧРЕЖДЕНИЕ ДЕТСКИЙ САД ЧЕЛЭЭШ С. КУНДУСТУГ, КАА-ХЕМСКОГО РАЙОНА РЕСПУБЛИКИ ТЫВА'], 'organizationsOgrn': ['1031700563663'], 'planId': '2022046248', 'prosecutorOrganization': 'Прокуратура Республики Тыва', 'prosecutorOrganizationId': 2062, 'publishedStatus': 'UNPUBLISHED', 'reasons': [204], 'reasonsList': [{'assignmentDate': None, 'assignmentDateEn': None, 'assignmentNumber': None, 'date': None, 'dateEn': None, 'requirementDetails': None, 'text': '(ФЗ 248) Истечение установленного федеральным законом о виде контроля, положением о виде контроля периода времени с даты иного события, установленного федеральным законом о виде контроля, положением о виде контроля, которое ведет к возникновению объекта контроля'}], 'recEmptyOrLate': False, 'regDateEgrul': '29.09.2021', 'regDateEgrulEn': '2021-09-29', 'regLate': False, 'regTypes': [], 'requirements': 24, 'requirementsList': [{'nameNpa': 'None', 'numberNpa': '30.03.1999', 'title': '«О санитарно-эпидемиологическом благополучии населения»'}, {'nameNpa': 'None', 'numberNpa': '23.02.2013', 'title': ' «Об охране здоровья граждан от воздействия окружающего табачного дыма и последствий потребления табака»'}, {'nameNpa': 'None', 'numberNpa': '18.06.2001', 'title': '«О предупреждении распространения туберкулеза в Российской Федерации»'}, {'nameNpa': 'None', 'numberNpa': '04.05.2011', 'title': 'О лицензировании отдельных видов деятельности\n'}, {'nameNpa': 'None', 'numberNpa': '28.09.2020', 'title': ' «Санитарно-эпидемиологические требования к организациям воспитания и обучения, отдыха и оздоровления детей и молодежи»'}, {'nameNpa': 'None', 'numberNpa': '27.10.2020', 'title': '«Санитарно-эпидемиологические требования к организации общественного питания населения» '}, {'nameNpa': 'None', 'numberNpa': '10.07.2001', 'title': ' «Организация и проведение производственного контроля за соблюдением санитарных правил и выполнением санитарно-противоэпидемических (профилактических) мероприятий»'}, {'nameNpa': 'None', 'numberNpa': '28.01.2021', 'title': '«Гигиенические нормативы и требования к обеспечению безопасности и (или) безвредности для человека факторов среды обитания»'}, {'nameNpa': 'None', 'numberNpa': '14.11.2001', 'title': ' «Гигиенические требования безопасности и пищевой ценности пищевых продуктов»'}, {'nameNpa': 'None', 'numberNpa': '24.12.2020', 'title': '«Санитарно-эпидемиологические требования к эксплуатации помещений, зданий, сооружений, оборудования и транспорта, а также условиям деятельности хозяйствующих субъектов, осуществляющих продажу товаров, выполнение работ или оказание услуг»'}, {'nameNpa': 'None', 'numberNpa': '28.01.2021', 'title': ' «Санитарно-эпидемиологические требования к содержанию территорий городских и сельских поселений, к водным объектам, питьевой воде и питьевому водоснабжению населения, атмосферному воздуху, почвам, жилым помещениям, эксплуатации производственных, общественных помещений, организации и проведению санитарно-противоэпидемических (профилактических) мероприятий»'}, {'