2023-01-19 12:15:41,094 - [INFO] - undetected_chromedriver.patcher - patch_exe(231) - patching driver executable C:\Users\zaitsev_ad\appdata\roaming\undetected_chromedriver\fad9c03aa4107a47_chromedriver.exe
2023-01-19 12:15:44,381 - [INFO] - main_ERKNM - __init__(59) - Начало авторизации
2023-01-19 12:15:53,727 - [INFO] - main_ERKNM - autorize(161) - Autorization successfull completed!
2023-01-19 12:26:02,816 - [INFO] - ERKNM_http.py - get_all_knm_for_a_year(168) - Запись в json завершена, заносим в базу данных
2023-01-19 12:26:02,818 - [INFO] - direct_sql.py - multiple_inserts(141) - старт программы
2023-01-19 12:36:02,847 - [ERROR] - direct_sql.py - new_insert_in_database(267) - (1040, 'ny connections')
2023-01-19 12:36:02,848 - [INFO] - direct_sql.py - new_insert_in_database(268) - {'actCreateDate': None, 'actCreateDateEn': None, 'addresses': ['305019, ОБЛАСТЬ КУРСКАЯ, ГОРОД КУРСК, УЛИЦА ПОЛЕВАЯ, 19, '], 'admLevelId': 50001, 'appealed': False, 'approveDocOrderDate': None, 'approveDocOrderNum': None, 'approveDocRequestDate': None, 'approveDocRequestNum': None, 'approveDocs': [], 'approveRequired': False, 'approved': False, 'approvedErknm': 'Отказано', 'chlistCount': 1, 'chlistFilledCount': 1, 'chlistFillingIndicationTypeId': [], 'collaboratingOrganizations': [], 'collaboratingOrganizationsIds': [], 'comment': 'На основании пункта 11(4) постановления Правительства РФ от 10.03.2022 № 336 в планы проведения плановых КНМ на 2023 год не включаются КНМ в отношении государственных и муниципальных учреждений дошкольного и начального общего образования, основного общего и среднего общего образования, объекты которых отнесены к категориям чрезвычайно высокого и высокого риска.', 'controllingOrganization': 'Управления Роспотребнадзора по Курской области', 'controllingOrganizationId': 10001017235, 'createPlanDate': None, 'createPlanDateLong': None, 'createdByErpDb': False, 'createdById': 161797, 'dataNotEqualEGRUL': False, 'dataSetNotInTime': False, 'deleted': False, 'directDurationDays': None, 'disapprove': False, 'district': 'Курская область', 'districtId': 1030380000000001, 'durationDays': 10, 'durationHours': 75, 'erknmActViolationIds': [], 'erknmResultKindDecisionIds': [], 'erpId': '46230041000102930707', 'events': [{'startDate': '02.06.2023', 'stopDate': '16.06.2023', 'title': 'Осмотр'}, {'startDate': '02.06.2023', 'stopDate': '16.06.2023', 'title': 'Истребование документов'}, {'startDate': '02.06.2023', 'stopDate': '16.06.2023', 'title': 'Отбор проб (образцов)'}, {'startDate': '02.06.2023', 'stopDate': '16.06.2023', 'title': 'Инструментальное обследование'}, {'startDate': '02.06.2023', 'stopDate': '16.06.2023', 'title': 'Испытание'}, {'startDate': '02.06.2023', 'stopDate': '16.06.2023', 'title': 'Экспертиза'}], 'federalLaw': '248', 'federalLawId': 3, 'fullFieldViolationKnm': False, 'hasViolations': False, 'id': 13002824, 'inn': '4631007904', 'inspectorFullName': [], 'isFromSmev': False, 'isHasApproveDocs': False, 'isHasCollaboratingOrganization': False, 'isHasRequirements': True, 'isHasViolationTerm': False, 'isPm': False, 'kind': 'Выездная проверка', 'knmAnnulled': False, 'knmRejected': False, 'knmType': 'Плановое КНМ', 'knmTypeId': 4, 'legalBasisDocName': [], 'links': [], 'mspCategory': ['Не является субъектом МСП'], 'noPunishment': False, 'notifyLate': False, 'objectsKind': ['Деятельность по организации отдыха детей и их оздоровления, в том числе лагеря с дневным пребыванием'], 'objectsSubKind': ['Деятельность по организации отдыха детей и их оздоровления, в том числе лагеря с дневным пребыванием'], 'objectsType': ['Деятельность и действия'], 'ogrn': '1024600950956', 'oldKnm': None, 'oldPlan': None, 'orderDone': False, 'organizationName': 'МУНИЦИПАЛЬНОЕ БЮДЖЕТНОЕ ОБЩЕОБРАЗОВАТЕЛЬНОЕ УЧРЕЖДЕНИЕ СРЕДНЯЯ ОБЩЕОБРАЗОВАТЕЛЬНАЯ ШКОЛА № 12 ИМ. С.Н. ПЕРЕКАЛЬСКОГО', 'organizationsInn': ['4631007904'], 'organizationsName': ['МУНИЦИПАЛЬНОЕ БЮДЖЕТНОЕ ОБЩЕОБРАЗОВАТЕЛЬНОЕ УЧРЕЖДЕНИЕ СРЕДНЯЯ ОБЩЕОБРАЗОВАТЕЛЬНАЯ ШКОЛА № 12 ИМ. С.Н. ПЕРЕКАЛЬСКОГО'], 'organizationsOgrn': ['1024600950956'], 'planId': '2023050566', 'prosecutorOrganization': 'Прокуратура Курской области', 'prosecutorOrganizationId': 214, 'publishedStatus': 'UNPUBLISHED', 'reasons': [201], 'reasonsList': [{'assignmentDate': None, 'assignmentDateEn': None, 'assignmentNumber': None, 'date': '16.06.2022', 'dateEn': '2022-06-16', 'requirementDetails': None, 'text': '(ФЗ 248) Истечение установленного федеральным законом о виде контроля, положением о виде контроля период времени с даты окончания проведения последнего планового контрольного (надзорного) мероприятия'}], 'recEmptyOrLate': False, 'regDateEgrul': '18.08.2022', 'regDateEgrulEn': '2022-08-18', 'regLate': False, 'regTypes': [], 'requirements': 8, 'requirementsList': [{'nameNpa': 'Федеральный закон О санитарно-эпидемиологическом благополучии населения от 30.03.1999 N 52-ФЗ: ', 'numberNpa': '30.03.1999', 'title': 'соблюдение требований \nст.12, ст.13, ст.14, ст.15, ст.16, ст.17, ст.18, ст.19, ст.20, ст.21, ст.22, ст.23, ст.24, ст.25, ст.26, ст.27, ст.28, ст.29, ст.30, ст.31, ст.32, ст.33, ст.34, ст.36, ст.40, ст.41'}, {'nameNpa': 'Приказ Минздрава России от 28.01.2021 N 29н «Об утверждении Порядка проведения обязательных предварительных и периодических медицинских осмотров работников, предусмотренных частью четвертой статьи 213 Трудового кодекса Российской Федерации, перечня медицинских противопоказаний к осуществлению работ с вредными и (или) опасными производственными факторами, а также работам, при выполнении которых проводятся обязательные предварительные и периодические медицинские осмотры» ', 'numberNpa': '28.01.2021', 'title': 'соблюдение требований п. 4.1 приложения к Порядку проведения обязательных предварительных и периодических медицинских осмотров работников, предусмотренных частью четвертой статьи 213 Трудового кодекса Российской Федерации'}, {'nameNpa': 'Федеральный закон Об отходах производства и потребления от 24.06.1998 N 89-ФЗ ', 'numberNpa': '24.06.1998', 'title': 'соблюдение требований ч.1 ст.13, ч.1, 3, ст.13.4, ч.1,2 ст.16'}, {'nameNpa': 'СанПиН 3.3686-21 Санитарно-эпидемиологические требования по профилактике инфекционных болезней  ', 'numberNpa': '28.01.2021', 'title': 'соблюдение требований п. п. 5,9-11,13-78,21,22,24,26,35,36,38-42,52-54,58,62-65,72,75-78,79-89,90-94,98-107,108,109,110,111,114,115,116,117,126,130,752,764,784,808,823,901,1862,1880,1881,1884,1885,1887,1888,1890,1895,1896,1898,1900,1905,1997,1999,2001,\n2008,2180,2181,2182,2183,2190,2368,2369,2386,2387,2388,2401,2405,2406,2417,2426,2513,2516,2518,2519,2612,2613,2614,2616,2623,2624,2631,2665,2666,\n2667,2677,2678,2679,2680,2681,2686,2694,2695,2696,2709,2708,2709.2710,\n2743,2747,2751,2820,2850,2851,2891,2903,2905,2963,3020,3071,3131,3148,\n3149,3150,3151,3152,3153,3157,3263,3264,3267,3268,3271,3307,3366,3367,\n3368,3369,3371,3372,3373,3390 '}, {'nameNpa': 'СП 2.4.3648-20 «Санитарно – эпидемиологические требования к организациям воспитания и обучения, отдыха и оздоровления детей и молодежи» ', 'numberNpa': '28.09.2020', 'title': 'соблюдение требований п.1.1- п. 2.11.9.; п.3.11- п.3.11.11.'}, {'nameNpa': 'СанПиН 1.2.3685-21 «Гигиенические нормативы и требования к обеспечению безопасности и (или) безвредности для человека факторов среды обитания» : \n \n', 'numberNpa': '28.01.2021', 'title': 'соблюдение требований раздел V, раздел VI '}, {'nameNpa': '\nСанПиН 2.3./2.4.3590-20 «Санитарно – эпидемиологические требования к организации общественного питания населения»  \n', 'numberNpa': '27.10.2020', 'title': 'соблюдение требований п.1.1. – п.5.2.; п.8.1.- п. 8.7.6., приложение 1-13   '}, {'nameNpa': 'СП 3.1/2.4.3598-20 «Санитарно – эпидемиологические требования к устройству, содержанию и организации работы образовательных организаций и других объектов социальной инфраструктуры для детей и молодежи в условиях распространении новой \nкоронавирусной инфекции (COVID-19): \n', 'numberNpa': '30.06.2020', 'title': 'соблюдение требований п.1.1.- п.2.7., п.3.1. '}], 'resolved': False, 'resultEmpty': True, 'resultEmptyOrLate': False, 'resultInfoTypeCodes': [], 'resultViolationKnm': False, 'riskCategory': ['чрезвычайно высокий риск'], 'riskCategoryAndDangerClass': ['чрезвычайно высокий риск / Не применяется'], 'sezRegistryExists': False, 'signed': True, 'smevInfoType': None, 'smevMessageType': None, 'smevReceivedAt': None, 'smevReceivedAtEn': None, 'smevReceivedAtMonth': None, 'smevReceivedAtYear': None, 'spvRegistryExists': False, 'startDate': '02.06.2023', 'startDateEn': '2023-06-02', 'status': 'Исключена', 'statusEgrul': 'В процессе поиска', 'statusId': 15, 'stopDate': '16.06.2023', 'stopDateEn': '2023-06-16', 'subjectTypeId': 0, 'supervisionType': 'Федеральный государственный санитарно-эпидемиологический контроль (надзор)', 'supervisionTypeId': 4, 'torRegistryExists': False, 'updatePlanDate': None, 'updatePlanDateLong': None, 'version': 'ERKNM', 'violationLawsuitTypeCodes': [], 'violationTypeCodes': [], 'year': 2023}
2023-01-19 12:36:02,850 - [WARNING] - direct_sql.py - new_insert_in_database(269) - Проведена повторная попытка внесения с параметром special, результат неудачный.
2023-01-19 12:36:02,850 - [INFO] - direct_sql.py - database_inserts_conductor_for_multiprocessing(132) - Возникла ошибка, с которой не удалось справиться...
2023-01-19 12:36:02,851 - [INFO] - direct_sql.py - database_inserts_conductor_for_multiprocessing(133) - 
2023-01-19 12:36:02,870 - [ERROR] - direct_sql.py - new_insert_in_database(267) - (1040, 'ny connections')
2023-01-19 12:36:02,870 - [INFO] - direct_sql.py - new_insert_in_database(268) - {'actCreateDate': None, 'actCreateDateEn': None, 'addresses': ['169511, РЕСПУБЛИКА КОМИ, ГОРОД СОСНОГОРСК, СЕЛО УСТЬ-УХТА, УЛИЦА ШКОЛЬНАЯ, 32, ', 'Республика Коми, г. Сосногорск, с. Усть-Ухта, ул. Школьная, д. 32\n'], 'admLevelId': 50001, 'appealed': False, 'approveDocOrderDate': None, 'approveDocOrderNum': None, 'approveDocRequestDate': None, 'approveDocRequestNum': None, 'approveDocs': [], 'approveRequired': False, 'approved': False, 'approvedErknm': 'Отказано', 'chlistCount': 2, 'chlistFilledCount': 2, 'chlistFillingIndicationTypeId': [], 'collaboratingOrganizations': [], 'collaboratingOrganizationsIds': [], 'comment': 'в силу положений п. 11(4) постановления Правительства Российской Федерации от 10.03.2022 № 336 в планы проведения плановых КНМ не подлежат включению плановые КНМ  в отношении государственных и муниципальных учреждений дошкольного и начального общего, основного общего и среднего общего образования, объекты контроля которых отнесены к категориям чрезвычайно высокого и высокого риска', 'controllingOrganization': 'Управление Роспотребнадзора по Республике Коми', 'controllingOrganizationId': 10001016637, 'createPlanDate': None, 'createPlanDateLong': None, 'createdByErpDb': False, 'createdById': 160403, 'dataNotEqualEGRUL': False, 'dataSetNotInTime': False, 'deleted': False, 'directDurationDays': None, 'disapprove': False, 'district': 'Республика Коми', 'districtId': 1031870000000001, 'durationDays': 10, 'durationHours': None, 'erknmActViolationIds': [], 'erknmResultKindDecisionIds': [], 'erpId': '11230041000103524596', 'events': [{'startDate': '06.06.2023', 'stopDate': '20.06.2023', 'title': 'Осмотр'}, {'startDate': '06.06.2023', 'stopDate': '20.06.2023', 'title': 'Опрос'}, {'startDate': '06.06.2023', 'stopDate': '20.06.2023', 'title': 'Получение письменных объяснений'}, {'startDate': '06.06.2023', 'stopDate': '20.06.2023', 'title': 'Истребование документов'}, {'startDate': '06.06.2023', 'stopDate': '20.06.2023', 'title': 'Отбор проб (образцов)'}, {'startDate': '06.06.2023', 'stopDate': '20.06.2023', 'title': 'Испытание'}, {'startDate': '06.06.2023', 'stopDate': '20.06.2023', 'title': 'Экспертиза'}], 'federalLaw': '248', 'federalLawId': 3, 'fullFieldViolationKnm': False, 'hasViolations': False, 'id': 13596713, 'inn': '1108011592', 'inspectorFullName': [], 'isFromSmev': False, 'isHasApproveDocs': False, 'isHasCollaboratingOrganization': False, 'isHasRequirements': True, 'isHasViolationTerm': False, 'isPm': False, 'kind': 'Выездная проверка', 'knmAnnulled': False, 'knmRejected': False, 'knmType': 'Плановое КНМ', 'knmTypeId': 4, 'legalBasisDocName': [], 'links': [], 'mspCategory': ['Не является субъектом МСП'], 'noPunishment': False, 'notifyLate': False, 'objectsKind': ['Деятельность по организации отдыха детей и их оздоровления, в том числе лагеря с дневным пребыванием', 'Деятельность по организации отдыха детей и их оздоровления, в том числе лагеря с дневным пребыванием'], 'objectsSubKind': ['Деятельность по организации отдыха детей и их оздоровления, в том числе лагеря с дневным пребыванием', 'Деятельность по организации отдыха детей и их оздоровления, в том числе лагеря с дневным пребыванием'], 'objectsType': ['Деятельность и действия', 'Деятельность и действия'], 'ogrn': '1021100949660', 'oldKnm': None, 'oldPlan': None, 'orderDone': False, 'organizationName': 'МУНИЦИПАЛЬНОЕ БЮДЖЕТНОЕ ОБЩЕОБРАЗОВАТЕЛЬНОЕ УЧРЕЖДЕНИЕ ОСНОВНАЯ ОБЩЕОБРАЗОВАТЕЛЬНАЯ ШКОЛА С. УСТЬ-УХТА', 'organizationsInn': ['1108011592'], 'organizationsName': ['МУНИЦИПАЛЬНОЕ БЮДЖЕТНОЕ ОБЩЕОБРАЗОВАТЕЛЬНОЕ УЧРЕЖДЕНИЕ ОСНОВНАЯ ОБЩЕОБРАЗОВАТЕЛЬНАЯ ШКОЛА С. УСТЬ-УХТА'], 'organizationsOgrn': ['1021100949660'], 'planId': '2023059758', 'prosecutorOrganization': 'Прокуратура Республики Коми', 'prosecutorOrganizationId': 654, 'publishedStatus': 'UNPUBLISHED', 'reasons': [204], 'reasonsList': [{'assignmentDate': None, 'assignmentDateEn': None, 'assignmentNumber': None, 'date': '01.06.2023', 'dateEn': '2023-06-01', 'requirementDetails': None, 'text': '(ФЗ 248) Истечение установленного федеральным законом о виде контроля, положением о виде контроля периода времени с даты иного события, установленного федеральным законом о виде контроля, положением о виде контроля, которое ведет к возникновению объекта контроля'}], 'recEmptyOrLate': False, 'regDateEgrul': '20.09.2022', 'regDateEgrulEn': '2022-09-20', 'regLate': False, 'regTypes': [], 'requirements': 1, 'requirementsList': [{'nameNpa': 'Федеральный закон №52-ФЗ от 30.03.1999 г. «О санитарно-эпидемиологическом благополучии населения» (ст.15, ст.17, ст.19, ст.21, ст.22, ст.24, ст.28, ст.29, ст.31, ст.32, ст.34, ст.36);\n- Федеральный закон от 24.07.1998г. № 124-ФЗ «Об основных гарантиях прав ребенка в Российской Федерации» (п.2 ст. 12);\n- Федеральный закон от 02.01.2000г. № 29-ФЗ «О качестве и безопасности пищевых продуктов» (п.1-3 ст. 3; п.1, 2 ст.5; п. 1, 3 ст.9; ст.15; ст.17; ст.20; ст.23; ст.24; п.1 ст.25.1; ст.25.2);\n- Федеральный закон от 23.02.2013г. №15-ФЗ «Об охране здоровья граждан от воздействия окружающего табачного дыма, последствий потребления табака или потребления никотинсодержащей продукции» (ст. 12, ст.20);\n- Федеральный закон от 17.09.1998 г. №157-ФЗ «Об иммунопрофилактике инфекционных болезней» (ст. 9, п. 4 ст.11);\n- Федеральный закон от 18.06.2001г. № 77-ФЗ «О предупреждении распро-странения туберкулёза в Российской Федерации» (п.п. 3, 4 ст. 8);\n- Федеральный закон от 24.06.1998 № 89-ФЗ Об отходах производства и потребления (ч.ч.1, 3 ст.13.4);\n- Технический регламент Таможенного союза «О безопасности пищевой продукции» ТР ТС 021/2011 (за исключением статьи 6, абзацев 2, 7, 12-14 части 5 статьи 7, части 3 статьи 13, части 2 статьи 18, статей 30 и 40); \n- Технический регламент Таможенного союза «Пищевая продукция в части её маркировки» ТР ТС 022/2011;\n- Технический регламент Таможенного союза «Технический регламент на соковую продукцию из фруктов и овощей» ТР ТС 023/2011 (ст. 3 - ст. 8);\n- Технический регламент Таможенного союза «Технический регламент на масложировую продукцию» ТР ТС 024/2011;\n- Технический регламент Таможенного союза «О безопасности мебельной продукции» ТР ТС 025/2012 (ст. 4 – ст.7);\n- Технический регламент Таможенного союза «О безопасности отдельных видов специализированной пищевой продукции, в том числе диетического, лечебного и диетического профилактического питания» ТР ТС 027/2012;\n- Технический регламент Таможенного союза «Требования безопасности пищевых добавок, ароматизаторов и технологических вспомогательных средств» ТР ТС 029/2012;\n- Технический регламент Таможенного союза «О безопасности молока и молочной продукции» ТР ТС 033/2013 (за исключением пунктов 13, 14, 97, 98 и 115);\n- Технический регламент Таможенного союза «О безопасности мяса и мясной продукции» ТР ТС 034/2013 (за исключением пунктов 1-8, 26-48, 53, 54 и абзаца 2 пункта 99);\n- Разделы IV и V (за исключением пункта 14), VIII, IX, X, XI (за исключе-нием пунктов 85, 86), XII Технического регламента Евразийского экономического союза «О безопасности рыбы и рыбной продукции» ТР ЕАЭС 040/2016;\n- разделы III, IV, V, VI, VII и X Технического регламента Евразийского эко-номического союза «О безопасности упакованной питьевой воды, включая природную минеральную воду» ТР ЕАЭС 044/2017; \n- Технический регламент Таможенного союза «О безопасности игрушек» ТР ТС 008/2011 (ст. 3 – ст. 7); \n- Технический регламент Таможенного союза «О безопасности продукции, предназначенной для детей и подростков» ТР ТС 007/2011 (ст. 3 – ст. 11, ст 13);\n- раздел IV, пункты 15, 16, подпункты а, д пункта 18 раздела VI, пункт 49 раздела VIII, разделы IX и X в части требований к покрытию для детских игровых площадок и связанным с ним процессам Технического регламента Евразийского экономического союза О безопасности оборудования для детских игровых площадок ТР ЕАЭС 042/2017; \n- Единые санитарно-эпидемиологические и гигиенические требования к то-варам, подлежащим санитарно-эпидемиологическому надзору (контролю), утвержденные решением Комиссии Таможенного союза 28.05.2010 № 299;   \n- СП 2.4.3648-20 Санитарно-эпидемиологические требования к организациям воспитания и обучения, отдыха и оздоровления детей и молодежи\n- СП 3.1/2.4.3598-20 «Санитарно-эпидемиологические требования к устрой-ству, содержанию и организации работы образовательных организаций и других объектов социальной инфраструктуры для детей и молодежи в усло-виях распространения новой коронавирусной инфекции (COVID-19)»; \n- СанПиН 2.3/2.4.3590-20 «Санитарно-эпидемиологические требования к организации общественного питания населения»;\n- СанПиН 1.2.3685-21 «Гигиенические нормативы и требования к обеспече-нию безопасности и (или) безвредности для человека факторов среды обитания»;\n- СанПиН 2.1.3684-21 «Санитарно-эпидемиологические требования к содержанию территорий городских и сельских поселений, к водным объектам, питьевой воде и питьевому водоснабжению, атмосферному воздуху, почвам, жилым помещениям, эксплуатации производственных, общественных помещений, организации и проведению санитарно-противоэпидемических (профилактических) мероприятий»;\n- СП 3.1.3597-20 Профилактика новой коронавирусной инфекции (COVID-19)\n- СанПиН 3.3686-21 Санитарно-эпидемиологические требования по профилактике инфекционных болезней; \n- СП 2.2.3670-20 «Санитарно-эпидемиологические требования к условиям труда»;\n- приказ Министерства труда и социальной защиты Российской Федерации и Министерства здравоохранения Российской Федерации от 31.12.2020 г. № 988н/1420н «Об утверждении перечня вредных и (или) опасных производственных факторов и работ, при выполнении которых проводятся обязательные предварительные медицинские осмотры при поступлении на работу и периодические медицинские осмотры»;\n- приказ Министерства здравоохранения Российской Федерации от 28.01.2021 года № 29н «Об утверждении Порядка проведения обязательных предварительных и периодических медицинских осмотров работников, предусмотренных частью четвертой статьи 213 Трудового кодекса Российской Федерации, перечня медицинских противопоказаний к осуществлению работ с вредными и (или) опасными производственными факторами, а также работам, при выполнении которых проводятся обязательные предварительные и периодические медицинские осмотры»\n\n', 'numberNpa': '30.03.1999', 'title': 'Соблюдение обязательных требований'}], 'resolved': False, 'resultEmpty': True, 'resultEmptyOrLate': False, 'resultInfoTypeCodes': [], 'resultViolationKnm': False, 'riskCategory': ['чрезвычайно высокий риск', 'чрезвычайно высокий риск'], 'riskCategoryAndDangerClass': ['чрезвычайно высокий риск / Первый', 'чрезвычайно высокий риск / Первый'], 'sezRegistryExists': False, 'signed': True, 'smevInfoType': None, 'smevMessageType': None, 'smevReceivedAt': None, 'smevReceivedAtEn': None, 'smevReceivedAtMonth': None, 'smevReceivedAtYear': None, 'spvRegistryExists': False, 'startDate': '06.06.2023', 'startDateEn': '2023-06-06', 'status': 'Исключена', 'statusEgrul': 'Найден', 'statusId': 15, 'stopDate': None, 'stopDateEn': None, 'subjectTypeId': 0, 'supervisionType': 'Федеральный государственный санитарно-эпидемиологический контроль (надзор)', 'supervisionTypeId': 4, 'torRegistryExists': False, 'updatePlanDate': None, 'updatePlanDateLong': None, 'version': 'ERKNM', 'violationLawsuitTypeCodes': [], 'violationTypeCodes': [], 'year': 2023}
2023-01-19 12:36:02,872 - [WARNING] - direct_sql.py - new_insert_in_database(269) - Проведена повторная попытка внесения с параметром special, результат неудачный.
2023-01-19 12:36:02,873 - [INFO] - direct_sql.py - database_inserts_conductor_for_multiprocessing(132) - Возникла ошибка, с которой не удалось справиться...
2023-01-19 12:36:02,873 - [INFO] - direct_sql.py - database_inserts_conductor_for_multiprocessing(133) - 
2023-01-19 12:36:02,884 - [ERROR] - direct_sql.py - new_insert_in_database(267) - (1040, 'ny connections')
2023-01-19 12:36:02,884 - [INFO] - direct_sql.py - new_insert_in_database(268) - {'actCreateDate': None, 'actCreateDateEn': None, 'addresses': ['305031, ОБЛАСТЬ, КУРСКАЯ, ГОРОД, КУРСК, УЛИЦА, СТРЕЛЕЦКАЯ 2-Я, 46, 460000010000720'], 'admLevelId': 50001, 'appealed': False, 'approveDocOrderDate': None, 'approveDocOrderNum': None, 'approveDocRequestDate': None, 'approveDocRequestNum': None, 'approveDocs': [], 'approveRequired': False, 'approved': False, 'approvedErknm': 'Отказано', 'chlistCount': 1, 'chlistFilledCount': 1, 'chlistFillingIndicationTypeId': [], 'collaboratingOrganizations': [], 'collaboratingOrganizationsIds': [], 'comment': 'На основании пункта 11(4) постановления Правительства РФ от 10.03.2022 № 336 в планы проведения плановых КНМ на 2023 год не включаются КНМ в отношении государственных и муниципальных учреждений дошкольного и начального общего образования, основного общего и среднего общего образования, объекты которых отнесены к категориям чрезвычайно высокого и высокого риска.', 'controllingOrganization': 'Управления Роспотребнадзора по Курской области', 'controllingOrganizationId': 10001017235, 'createPlanDate': None, 'createPlanDateLong': None, 'createdByErpDb': False, 'createdById': 161797, 'dataNotEqualEGRUL': False, 'dataSetNotInTime': False, 'deleted': False, 'directDurationDays': None, 'disapprove': False, 'district': 'Курская область', 'districtId': 1030380000000001, 'durationDays': 10, 'durationHours': 75, 'erknmActViolationIds': [], 'erknmResultKindDecisionIds': [], 'erpId': '46230041000102935250', 'events': [{'startDate': '02.06.2023', 'stopDate': '16.06.2023', 'title': 'Осмотр'}, {'startDate': '02.06.2023', 'stopDate': '16.06.2023', 'title': 'Истребование документов'}, {'startDate': '02.06.2023', 'stopDate': '16.06.2023', 'title': 'Отбор проб (образцов)'}, {'startDate': '02.06.2023', 'stopDate': '16.06.2023', 'title': 'Инструментальное обследование'}, {'startDate': '02.06.2023', 'stopDate': '16.06.2023', 'title': 'Испытание'}, {'startDate': '02.06.2023', 'stopDate': '16.06.2023', 'title': 'Экспертиза'}], 'federalLaw': '248', 'federalLawId': 3, 'fullFieldViolationKnm': False, 'hasViolations': False, 'id': 13007367, 'inn': '4631010022', 'inspectorFullName': [], 'isFromSmev': False, 'isHasApproveDocs': False, 'isHasCollaboratingOrganization': False, 'isHasRequirements': True, 'isHasViolationTerm': False, 'isPm': False, 'kind': 'Выездная проверка', 'knmAnnulled': False, 'knmRejected': False, 'knmType': 'Плановое КНМ', 'knmTypeId': 4, 'legalBasisDocName': [], 'links': [], 'mspCategory': ['Не является субъектом МСП'], 'noPunishment': False, 'notifyLate': False, 'objectsKind': ['Деятельность по организации отдыха детей и их оздоровления, в том числе лагеря с дневным пребыванием'], 'objectsSubKind': ['Деятельность по организации отдыха детей и их оздоровления, в том числе лагеря с дневным пребыванием'], 'objectsType': ['Деятельность и действия'], 'ogrn': '1024600954663', 'oldKnm': None, 'oldPlan': None, 'orderDone': False, 'organizationName': 'МУНИЦИПАЛЬНОЕ БЮДЖЕТНОЕ ОБЩЕОБРАЗОВАТЕЛЬНОЕ УЧРЕЖДЕНИЕ СРЕДНЯЯ ОБЩЕОБРАЗОВАТЕЛЬНАЯ ШКОЛА № 16', 'organizationsInn': ['4631010022'], 'organizationsName': ['МУНИЦИПАЛЬНОЕ БЮДЖЕТНОЕ ОБЩЕОБРАЗОВАТЕЛЬНОЕ УЧРЕЖДЕНИЕ СРЕДНЯЯ ОБЩЕОБРАЗОВАТЕЛЬНАЯ ШКОЛА № 16'], 'organizationsOgrn': ['1024600954663'], 'planId': '2023050566', 'prosecutorOrganization': 'Прокуратура Курской области', 'prosecutorOrganizationId': 214, 'publishedStatus': 'UNPUBLISHED', 'reasons': [201], 'reasonsList': [{'assignmentDate': None, 'assignmentDateEn': None, 'assignmentNumber': None, 'date': '15.06.2022', 'dateEn': '2022-06-15', 'requirementDetails': None, 'text': '(ФЗ 248) Истечение установленного федеральным законом о виде контроля, положением о виде контроля период времени с даты окончания проведения последнего планового контрольного (надзорного) мероприятия'}], 'recEmptyOrLate': False, 'regDateEgrul': '18.08.2022', 'regDateEgrulEn': '2022-08-18', 'regLate': False, 'regTypes': [], 'requirements': 8, 'requirementsList': [{'nameNpa': 'Федеральный закон О санитарно-эпидемиологическом благополучии населения от 30.03.1999 N 52-ФЗ', 'numberNpa': '30.03.1999', 'title': 'соблюдение требований \nст.12, ст.13, ст.14, ст.15, ст.16, ст.17, ст.18, ст.19, ст.20, ст.21, ст.22, ст.23, ст.24, ст.25, ст.26, ст.27, ст.28, ст.29, ст.30, ст.31, ст.32, ст.33, ст.34, ст.36, ст.40, ст.41'}, {'nameNpa': 'Приказ Минздрава России от 28.01.2021 N 29н «Об утверждении Порядка проведения обязательных предварительных и периодических медицинских осмотров работников, предусмотренных частью четвертой статьи 213 Трудового кодекса Российской Федерации, перечня медицинских противопоказаний к осуществлению работ с вредными и (или) опасными производственными факторами, а также работам, при выполнении которых проводятся обязательные предварительные и периодические медицинские осмотры» ', 'numberNpa': '28.01.2021', 'title': 'соблюдение требований п. 4.1 приложения к Порядку проведения обязательных предварительных и периодических медицинских осмотров работников, предусмотренных частью четвертой статьи 213 Трудового кодекса Российской Федерации'}, {'nameNpa': 'Федеральный закон Об отходах производства и потребления от 24.06.1998 N 89-ФЗ ', 'numberNpa': '24.06.1998', 'title': ' соблюдение требований ч.1 ст.13, ч.1, 3, ст.13.4, ч.1,2 ст.16'}, {'nameNpa': 'СанПиН 3.3686-21 Санитарно-эпидемиологические требования по профилактике инфекционных болезней  ', 'numberNpa': '28.01.2021', 'title': 'соблюдение требований п. п. 5,9-11,13-78,21,22,24,26,35,36,38-42,52-54,58,62-65,72,75-78,79-89,90-94,98-107,108,109,110,111,114,115,116,117,126,130,752,764,784,808,823,901,1862,1880,1881,1884,1885,1887,1888,1890,1895,1896,1898,1900,1905,1997,1999,2001,\n2008,2180,2181,2182,2183,2190,2368,2369,2386,2387,2388,2401,2405,2406,2417,2426,2513,2516,2518,2519,2612,2613,2614,2616,2623,2624,2631,2665,2666,\n2667,2677,2678,2679,2680,2681,2686,2694,2695,2696,2709,2708,2709.2710,\n2743,2747,2751,2820,2850,2851,2891,2903,2905,2963,3020,3071,3131,3148,\n3149,3150,3151,3152,3153,3157,3263,3264,3267,3268,3271,3307,3366,3367,\n3368,3369,3371,3372,3373,3390 '}, {'nameNpa': 'СП 2.4.3648-20 «Санитарно – эпидемиологические требования к организациям воспитания и обучения, отдыха и оздоровления детей и молодежи» ', 'numberNpa': '28.09.2020', 'title': 'соблюдение требований п.1.1- п. 2.11.9.; п.3.11- п.3.11.11.\n'}, {'nameNpa': 'СанПиН 1.2.3685-21 «Гигиенические нормативы и требования к обеспечению безопасности и (или) безвредности для человека факторов среды обитания» : \n', 'numberNpa': '28.01.2021', 'title': 'соблюдение требований раздел V, раздел VI  \n'}, {'nameNpa': 'СанПиН 2.3./2.4.3590-20 «Санитарно – эпидемиологические требования к организации общественного питания населения»   ', 'numberNpa': '27.10.2020', 'title': 'соблюдение требований п.1.1. – п.5.2.; п.8.1.- п. 8.7.6., приложение 1-13  '}, {'nameNpa': 'СП 3.1/2.4.3598-20 «Санитарно – эпидемиологические требования к устройству, содержанию и организации работы образовательных организаций и других объектов социальной инфраструктуры для детей и молодежи в условиях распространении новой \nкоронавирусной инфекции (COVID-19):  \n', 'numberNpa': '30.06.2020', 'title': 'соблюдение требований п.1.1.- п.2.7., п.3.1. '}], 'resolved': False, 'resultEmpty': True, 'resultEmptyOrLate': False, 'resultInfoTypeCodes': [], 'resultViolationKnm': False, 'riskCategory': ['чрезвычайно высокий риск'], 'riskCategoryAndDangerClass': ['чрезвычайно высокий риск / Не применяется'], 'sezRegistryExists': False, 'signed': True, 'smevInfoType': None, 'smevMessageType': None, 'smevReceivedAt': None, 'smevReceivedAtEn': None, 'smevReceivedAtMonth': None, 'smevReceivedAtYear': None, 'spvRegistryExists': False, 'startDate': '02.06.2023', 'startDateEn': '2023-06-02', 'status': 'Исключена', 'statusEgrul': 'Найден', 'statusId': 15, 'stopDate': '16.06.2023', 'stopDateEn': '2023-06-16', 'subjectTypeId': 0, 'supervisionType': 'Федеральный государственный санитарно-эпидемиологический контроль (надзор)', 'supervisionTypeId': 4, 'torRegistryExists': False, 'updatePlanDate': None, 'updatePlanDateLong': None, 'version': 'ERKNM', 'violationLawsuitTypeCodes': [], 'violationTypeCodes': [], 'year': 2023}
2023-01-19 12:36:02,885 - [WARNING] - direct_sql.py - new_insert_in_database(269) - Проведена повторная попытка внесения с параметром special, результат неудачный.
2023-01-19 12:36:02,885 - [INFO] - direct_sql.py - database_inserts_conductor_for_multiprocessing(132) - Возникла ошибка, с которой не удалось справиться...
2023-01-19 12:36:02,885 - [INFO] - direct_sql.py - database_inserts_conductor_for_multiprocessing(133) - 
2023-01-19 12:36:02,908 - [ERROR] - direct_sql.py - new_insert_in_database(267) - (1040, 'ny connections')
2023-01-19 12:36:02,909 - [INFO] - direct_sql.py - new_insert_in_database(268) - {'actCreateDate': None, 'actCreateDateEn': None, 'addresses': ['155523, ОБЛАСТЬ ИВАНОВСКАЯ, РАЙОН ФУРМАНОВСКИЙ, ГОРОД ФУРМАНОВ, УЛИЦА ТИМИРЯЗЕВА, 32, '], 'admLevelId': 50001, 'appealed': False, 'approveDocOrderDate': None, 'approveDocOrderNum': None, 'approveDocRequestDate': None, 'approveDocRequestNum': None, 'approveDocs': [], 'approveRequired': False, 'approved': True, 'approvedErknm': 'Согласовано', 'chlistCount': 0, 'chlistFilledCount': 0, 'chlistFillingIndicationTypeId': [], 'collaboratingOrganizations': [], 'collaboratingOrganizationsIds': [], 'comment': None, 'controllingOrganization': 'Управление Роспотребнадзора по Ивановской области', 'controllingOrganizationId': 10001013491, 'createPlanDate': None, 'createPlanDateLong': None, 'createdByErpDb': False, 'createdById': 175346, 'dataNotEqualEGRUL': False, 'dataSetNotInTime': True, 'deleted': False, 'directDurationDays': None, 'disapprove': False, 'district': 'Ивановская область', 'districtId': 1030240000000001, 'durationDays': 10, 'durationHours': None, 'erknmActViolationIds': [], 'erknmResultKindDecisionIds': [], 'erpId': '37230041000103151988', 'events': [{'startDate': '16.05.2023', 'stopDate': '29.05.2023', 'title': 'Получение письменных объяснений'}, {'startDate': '16.05.2023', 'stopDate': '29.05.2023', 'title': 'Истребование документов'}], 'federalLaw': '248', 'federalLawId': 3, 'fullFieldViolationKnm': False, 'hasViolations': False, 'id': 13224105, 'inn': '3705004747', 'inspectorFullName': [], 'isFromSmev': False, 'isHasApproveDocs': False, 'isHasCollaboratingOrganization': False, 'isHasRequirements': True, 'isHasViolationTerm': False, 'isPm': False, 'kind': 'Документарная проверка', 'knmAnnulled': False, 'knmRejected': False, 'knmType': 'Плановое КНМ', 'knmTypeId': 4, 'legalBasisDocName': [], 'links': [], 'mspCategory': ['Не является субъектом МСП'], 'noPunishment': False, 'notifyLate': False, 'objectsKind': ['Деятельность по организации отдыха детей и их оздоровления, в том числе лагеря с дневным пребыванием'], 'objectsSubKind': ['Деятельность по организации отдыха детей и их оздоровления, в том числе лагеря с дневным пребыванием'], 'objectsType': ['Деятельность и действия'], 'ogrn': '1023701359021', 'oldKnm': None, 'oldPlan': None, 'orderDone': False, 'organizationName': 'МУНИЦИПАЛЬНОЕ АВТОНОМНОЕ УЧРЕЖДЕНИЕ ДОПОЛНИТЕЛЬНОГО ОБРАЗОВАНИЯ ЦЕНТР ДЕТСКОГО ТВОРЧЕСТВА ГОРОДА ФУРМАНОВА', 'organizationsInn': ['3705004747'], 'organizationsName': ['МУНИЦИПАЛЬНОЕ АВТОНОМНОЕ УЧРЕЖДЕНИЕ ДОПОЛНИТЕЛЬНОГО ОБРАЗОВАНИЯ ЦЕНТР ДЕТСКОГО ТВОРЧЕСТВА ГОРОДА ФУРМАНОВА'], 'organizationsOgrn': ['1023701359021'], 'planId': '2023050673', 'prosecutorOrganization': 'Прокуратура Ивановской области', 'prosecutorOrganizationId': 130, 'publishedStatus': 'PUBLISHED', 'reasons': [201], 'reasonsList': [{'assignmentDate': None, 'assignmentDateEn': None, 'assignmentNumber': None, 'date': '24.06.2022', 'dateEn': '2022-06-24', 'requirementDetails': None, 'text': '(ФЗ 248) Истечение установленного федеральным законом о виде контроля, положением о виде контроля период времени с даты окончания проведения последнего планового контрольного (надзорного) мероприятия'}], 'recEmptyOrLate': False, 'regDateEgrul': '25.08.2022', 'regDateEgrulEn': '2022-08-25', 'regLate': False, 'regTypes': [], 'requirements': 4, 'requirementsList': [{'nameNpa': 'None', 'numberNpa': 'None', 'title': 'None'}, {'nameNpa': 'None', 'numberNpa': 'None', 'title': 'None'}, {'nameNpa': 'None', 'numberNpa': 'None', 'title': 'None'}, {'nameNpa': 'None', 'numberNpa': 'None', 'title': 'None'}], 'resolved': False, 'resultEmpty': True, 'resultEmptyOrLate': False, 'resultInfoTypeCodes': [], 'resultViolationKnm': False, 'riskCategory': ['чрезвычайно высокий риск'], 'riskCategoryAndDangerClass': ['чрезвычайно высокий риск'], 'sezRegistryExists': False, 'signed': True, 'smevInfoType': None, 'smevMessageType': None, 'smevReceivedAt': None, 'smevReceivedAtEn': None, 'smevReceivedAtMonth': None, 'smevReceivedAtYear': None, 'spvRegistryExists': False, 'startDate': '16.05.2023', 'startDateEn': '2023-05-16', 'status': 'Ожидает проведения', 'statusEgrul': 'Найден', 'statusId': 5, 'stopDate': '29.05.2023', 'stopDateEn': '2023-05-29', 'subjectTypeId': 0, 'supervisionType': 'Федеральный государственный санитарно-эпидемиологический контроль (надзор)', 'supervisionTypeId': 4, 'torRegistryExists': False, 'updatePlanDate': None, 'updatePlanDateLong': None, 'version': 'ERKNM', 'violationLawsuitTypeCodes': [], 'violationTypeCodes': [], 'year': 2023}
2023-01-19 12:36:02,909 - [WARNING] - direct_sql.py - new_insert_in_database(269) - Проведена повторная попытка внесения с параметром special, результат неудачный.
2023-01-19 12:36:02,909 - [INFO] - direct_sql.py - new_insert_in_database(268) - {'actCreateDate': None, 'actCreateDateEn': None, 'addresses': ['169313, РЕСПУБЛИКА КОМИ, ГОРОД УХТА, УЛИЦА ДЗЕРЖИНСКОГО, ДОМ 13, ', 'Республика Коми, г. Ухта, ул. Дзержинского, д.13\n'], 'admLevelId': 50001, 'appealed': False, 'approveDocOrderDate': None, 'approveDocOrderNum': None, 'approveDocRequestDate': None, 'approveDocRequestNum': None, 'approveDocs': [], 'approveRequired': False, 'approved': False, 'approvedErknm': 'Отказано', 'chlistCount': 2, 'chlistFilledCount': 2, 'chlistFillingIndicationTypeId': [], 'collaboratingOrganizations': [], 'collaboratingOrganizationsIds': [], 'comment': 'в силу положений п. 11(4) постановления Правительства Российской Федерации от 10.03.2022 № 336 в планы проведения плановых КНМ не подлежат включению плановые КНМ  в отношении государственных и муниципальных учреждений дошкольного и начального общего, основного общего и среднего общего образования, объекты контроля которых отнесены к категориям чрезвычайно высокого и высокого риска', 'controllingOrganization': 'Управление Роспотребнадзора по Республике Коми', 'controllingOrganizationId': 10001016637, 'createPlanDate': None, 'createPlanDateLong': None, 'createdByErpDb': False, 'createdById': 160403, 'dataNotEqualEGRUL': False, 'dataSetNotInTime': False, 'deleted': False, 'directDurationDays': None, 'disapprove': False, 'district': 'Республика Коми', 'districtId': 1031870000000001, 'durationDays': 10, 'durationHours': None, 'erknmActViolationIds': [], 'erknmResultKindDecisionIds': [], 'erpId': '11230041000103538480', 'events': [{'startDate': '05.06.2023', 'stopDate': '19.06.2023', 'title': 'Осмотр'}, {'startDate': '05.06.2023', 'stopDate': '19.06.2023', 'title': 'Опрос'}, {'startDate': '05.06.2023', 'stopDate': '19.06.2023', 'title': 'Получение письменных объяснений'}, {'startDate': '05.06.2023', 'stopDate': '19.06.2023', 'title': 'Истребование документов'}, {'startDate': '05.06.2023', 'stopDate': '19.06.2023', 'title': 'Отбор проб (образцов)'}, {'startDate': '05.06.2023', 'stopDate': '19.06.2023', 'title': 'Испытание'}, {'startDate': '05.06.2023', 'stopDate': '19.06.2023', 'title': 'Экспертиза'}], 'federalLaw': '248', 'federalLawId': 3, 'fullFieldViolationKnm': False, 'hasViolations': False, 'id': 13610597, 'inn': '1102026200', 'inspectorFullName': [], 'isFromSmev': False, 'isHasApproveDocs': False, 'isHasCollaboratingOrganization': False, 'isHasRequirements': True, 'isHasViolationTerm': False, 'isPm': False, 'kind': 'Выездная проверка', 'knmAnnulled': False, 'knmRejected': False, 'knmType': 'Плановое КНМ', 'knmTypeId': 4, 'legalBasisDocName': [], 'links': [], 'mspCategory': ['Не является субъектом МСП'], 'noPunishment': False, 'notifyLate': False, 'objectsKind': ['Деятельность по организации отдыха детей и их оздоровления, в том числе лагеря с дневным пребыванием', 'Деятельность по организации отдыха детей и их оздоровления, в том числе лагеря с дневным пребыванием'], 'objectsSubKind': ['Деятельность по организации отдыха детей и их оздоровления, в том числе лагеря с дневным пребыванием', 'Деятельность по организации отдыха детей и их оздоровления, в том числе лагеря с дневным пребыванием'], 'objectsType': ['Деятельность и действия', 'Деятельность и действия'], 'ogrn': '1021100733664', 'oldKnm': None, 'oldPlan': None, 'orderDone': False, 'organizationName': 'МУНИЦИПАЛЬНОЕ ОБЩЕОБРАЗОВАТЕЛЬНОЕ УЧРЕЖДЕНИЕ СРЕДНЯЯ ОБЩЕОБРАЗОВАТЕЛЬНАЯ ШКОЛА №10', 'organizationsInn': ['1102026200'], 'organizationsName': ['МУНИЦИПАЛЬНОЕ ОБЩЕОБРАЗОВАТЕЛЬНОЕ УЧРЕЖДЕНИЕ СРЕДНЯЯ ОБЩЕОБРАЗОВАТЕЛЬНАЯ ШКОЛА №10'], 'organizationsOgrn': ['1021100733664'], 'planId': '2023059758', 'prosecutorOrganization': 'Прокуратура Республики Коми', 'prosecutorOrganizationId': 654, 'publishedStatus': 'UNPUBLISHED', 'reasons': [204], 'reasonsList': [{'assignmentDate': None, 'assignmentDateEn': None, 'assignmentNumber': None, 'date': '01.06.2023', 'dateEn': '2023-06-01', 'requirementDetails': None, 'text': '(ФЗ 248) Истечение установленного федеральным законом о виде контроля, положением о виде контроля периода времени с даты иного события, установленного федеральным законом о виде контроля, положением о виде контроля, которое ведет к возникновению объекта контроля'}], 'recEmptyOrLate': False, 'regDateEgrul': '21.09.2022', 'regDateEgrulEn': '2022-09-21', 'regLate': False, 'regTypes': [], 'requirements': 1, 'requirementsList': [{'nameNpa': 'Федеральный закон №52-ФЗ от 30.03.1999 г. «О санитарно-эпидемиологическом благополучии населения» (ст.15, ст.17, ст.19, ст.21, ст.22, ст.24, ст.28, ст.29, ст.31, ст.32, ст.34, ст.36);\n- Федеральный закон от 24.07.1998г. № 124-ФЗ «Об основных гарантиях прав ребенка в Российской Федерации» (п.2 ст. 12);\n- Федеральный закон от 02.01.2000г. № 29-ФЗ «О качестве и безопасности пищевых продуктов» (п.1-3 ст. 3; п.1, 2 ст.5; п. 1, 3 ст.9; ст.15; ст.17; ст.20; ст.23; ст.24; п.1 ст.25.1; ст.25.2);\n- Федеральный закон от 23.02.2013г. №15-ФЗ «Об охране здоровья граждан от воздействия окружающего табачного дыма, последствий потребления табака или потребления никотинсодержащей продукции» (ст. 12, ст.20);\n- Федеральный закон от 17.09.1998 г. №157-ФЗ «Об иммунопрофилактике инфекционных болезней» (ст. 9, п. 4 ст.11);\n- Федеральный закон от 18.06.2001г. № 77-ФЗ «О предупреждении распро-странения туберкулёза в Российской Федерации» (п.п. 3, 4 ст. 8);\n- Федеральный закон от 24.06.1998 № 89-ФЗ Об отходах производства и потребления (ч.ч.1, 3 ст.13.4);\n- Технический регламент Таможенного союза «О безопасности пищевой продукции» ТР ТС 021/2011 (за исключением статьи 6, абзацев 2, 7, 12-14 части 5 статьи 7, части 3 статьи 13, части 2 статьи 18, статей 30 и 40); \n- Технический регламент Таможенного союза «Пищевая продукция в части её маркировки» ТР ТС 022/2011;\n- Технический регламент Таможенного союза «Технический регламент на соковую продукцию из фруктов и овощей» ТР ТС 023/2011 (ст. 3 - ст. 8);\n- Технический регламент Таможенного союза «Технический регламент на масложировую продукцию» ТР ТС 024/2011;\n- Технический регламент Таможенного союза «О безопасности мебельной продукции» ТР ТС 025/2012 (ст. 4 – ст.7);\n- Технический регламент Таможенного союза «О безопасности отдельных видов специализированной пищевой продукции, в том числе диетического, лечебного и диетического профилактического питания» ТР ТС 027/2012;\n- Технический регламент Таможенного союза «Требования безопасности пищевых добавок, ароматизаторов и технологических вспомогательных средств» ТР ТС 029/2012;\n- Технический регламент Таможенного союза «О безопасности молока и молочной продукции» ТР ТС 033/2013 (за исключением пунктов 13, 14, 97, 98 и 115);\n- Технический регламент Таможенного союза «О безопасности мяса и мясной продукции» ТР ТС 034/2013 (за исключением пунктов 1-8, 26-48, 53, 54 и абзаца 2 пункта 99);\n- Разделы IV и V (за исключением пункта 14), VIII, IX, X, XI (за исключе-нием пунктов 85, 86), XII Технического регламента Евразийского экономического союза «О безопасности рыбы и рыбной продукции» ТР ЕАЭС 040/2016;\n- разделы III, IV, V, VI, VII и X Технического регламента Евразийского эко-номического союза «О безопасности упакованной питьевой воды, включая природную минеральную воду» ТР ЕАЭС 044/2017; \n- Технический регламент Таможенного союза «О безопасности игрушек» ТР ТС 008/2011 (ст. 3 – ст. 7); \n- Технический регламент Таможенного союза «О безопасности продукции, предназначенной для детей и подростков» ТР ТС 007/2011 (ст. 3 – ст. 11, ст 13);\n- раздел IV, пункты 15, 16, подпункты а, д пункта 18 раздела VI, пункт 49 раздела VIII, разделы IX и X в части требований к покрытию для детских игровых площадок и связанным с ним процессам Технического регламента Евразийского экономического союза О безопасности оборудования для детских игровых площадок ТР ЕАЭС 042/2017; \n- Единые санитарно-эпидемиологические и гигиенические требования к то-варам, подлежащим санитарно-эпидемиологическому надзору (контролю), утвержденные решением Комиссии Таможенного союза 28.05.2010 № 299;   \n- СП 2.4.3648-20 Санитарно-эпидемиологические требования к организациям воспитания и обучения, отдыха и оздоровления детей и молодежи\n- СП 3.1/2.4.3598-20 «Санитарно-эпидемиологические требования к устрой-ству, содержанию и организации работы образовательных организаций и других объектов социальной инфраструктуры для детей и молодежи в усло-виях распространения новой коронавирусной инфекции (COVID-19)»; \n- СанПиН 2.3/2.4.3590-20 «Санитарно-эпидемиологические требования к организации общественного питания населения»;\n- СанПиН 1.2.3685-21 «Гигиенические нормативы и требования к обеспече-нию безопасности и (или) безвредности для человека факторов среды обитания»;\n- СанПиН 2.1.3684-21 «Санитарно-эпидемиологические требования к содержанию территорий городских и сельских поселений, к водным объектам, питьевой воде и питьевому водоснабжению, атмосферному воздуху, почвам, жилым помещениям, эксплуатации производственных, общественных помещений, организации и проведению санитарно-противоэпидемических (профилактических) мероприятий»;\n- СП 3.1.3597-20 Профилактика новой коронавирусной инфекции (COVID-19)\n- СанПиН 3.3686-21 Санитарно-эпидемиологические требования по профилактике инфекционных болезней; \n- СП 2.2.3670-20 «Санитарно-эпидемиологические требования к условиям труда»;\n- приказ Министерства труда и социальной защиты Российской Федерации и Министерства здравоохранения Российской Федерации от 31.12.2020 г. № 988н/1420н «Об утверждении перечня вредных и (или) опасных производственных факторов и работ, при выполнении которых проводятся обязательные предварительные медицинские осмотры при поступлении на работу и периодические медицинские осмотры»;\n- приказ Министерства здравоохранения Российской Федерации от 28.01.2021 года № 29н «Об утверждении Порядка проведения обязательных предварительных и периодических медицинских осмотров работников, предусмотренных частью четвертой статьи 213 Трудового кодекса Российской Федерации, перечня медицинских противопоказаний к осуществлению работ с вредными и (или) опасными производственными факторами, а также работам, при выполнении которых проводятся обязательные предварительные и периодические медицинские осмотры»\n\n', 'numberNpa': '30.03.1999', 'title': 'Соблюдение обязательных требований'}], 'resolved': False, 'resultEmpty': True, 'resultEmptyOrLate': False, 'resultInfoTypeCodes': [], 'resultViolationKnm': False, 'riskCategory': ['чрезвычайно высокий риск', 'чрезвычайно высокий риск'], 'riskCategoryAndDangerClass': ['чрезвычайно высокий риск / Первый', 'чрезвычайно высокий риск / Первый'], 'sezRegistryExists': False, 'signed': True, 'smevInfoType': None, 'smevMessageType': None, 'smevReceivedAt': None, 'smevReceivedAtEn': None, 'smevReceivedAtMonth': None, 'smevReceivedAtYear': None, 'spvRegistryExists': False, 'startDate': '05.06.2023', 'startDateEn': '2023-06-05', 'status': 'Исключена', 'statusEgrul': 'Найден', 'statusId': 15, 'stopDate': None, 'stopDateEn': None, 'subjectTypeId': 0, 'supervisionType': 'Федеральный государственный санитарно-эпидемиологический контроль (надзор)', 'supervisionTypeId': 4, 'torRegistryExists': False, 'updatePlanDate': None, 'updatePlanDateLong': None, 'version': 'ERKNM', 'violationLawsuitTypeCodes': [], 'violationTypeCodes': [], 'year': 2023}
2023-01-19 12:36:02,909 - [INFO] - direct_sql.py - database_inserts_conductor_for_multiprocessing(132) - Возникла ошибка, с которой не удалось справиться...
2023-01-19 12:36:02,909 - [WARNING] - direct_sql.py - new_insert_in_database(269) - Проведена повторная попытка внесения с параметром special, результат неудачный.
2023-01-19 12:36:02,909 - [INFO] - direct_sql.py - database_inserts_conductor_for_multiprocessing(133) - 
2023-01-19 12:36:02,910 - [INFO] - direct_sql.py - database_inserts_conductor_for_multiprocessing(132) - Возникла ошибка, с которой не удалось справиться...
2023-01-19 12:36:02,910 - [INFO] - direct_sql.py - database_inserts_conductor_for_multiprocessing(133) - 
2023-01-19 12:36:02,914 - [ERROR] - direct_sql.py - new_insert_in_database(267) - (1040, 'ny connections')
2023-01-19 12:36:02,915 - [INFO] - direct_sql.py - new_insert_in_database(268) - {'actCreateDate': None, 'actCreateDateEn': None, 'addresses': ['307853, ОБЛАСТЬ КУРСКАЯ, РАЙОН БОЛЬШЕСОЛДАТСКИЙ, СЕЛО РОЗГРЕБЛИ, УЛИЦА ШКОЛЬНАЯ, 1, '], 'admLevelId': 50001, 'appealed': False, 'approveDocOrderDate': None, 'approveDocOrderNum': None, 'approveDocRequestDate': None, 'approveDocRequestNum': None, 'approveDocs': [], 'approveRequired': False, 'approved': False, 'approvedErknm': 'Отказано', 'chlistCount': 2, 'chlistFilledCount': 2, 'chlistFillingIndicationTypeId': [], 'collaboratingOrganizations': [], 'collaboratingOrganizationsIds': [], 'comment': 'На основании пункта 11(4) постановления Правительства РФ от 10.03.2022 № 336 в планы проведения плановых КНМ на 2023 год не включаются КНМ в отношении государственных и муниципальных учреждений дошкольного и начального общего образования, основного общего и среднего общего образования, объекты которых отнесены к категориям чрезвычайно высокого и высокого риска.', 'controllingOrganization': 'Управления Роспотребнадзора по Курской области', 'controllingOrganizationId': 10001017235, 'createPlanDate': None, 'createPlanDateLong': None, 'createdByErpDb': False, 'createdById': 164580, 'dataNotEqualEGRUL': False, 'dataSetNotInTime': False, 'deleted': False, 'directDurationDays': None, 'disapprove': False, 'district': 'Курская область', 'districtId': 1030380000000001, 'durationDays': 10, 'durationHours': 75, 'erknmActViolationIds': [], 'erknmResultKindDecisionIds': [], 'erpId': '46230041000103109037', 'events': [{'startDate': '01.06.2023', 'stopDate': '15.06.2023', 'title': 'Осмотр'}, {'startDate': '01.06.2023', 'stopDate': '15.06.2023', 'title': 'Получение письменных объяснений'}, {'startDate': '01.06.2023', 'stopDate': '15.06.2023', 'title': 'Истребование документов'}, {'startDate': '01.06.2023', 'stopDate': '15.06.2023', 'title': 'Отбор проб (образцов)'}, {'startDate': '01.06.2023', 'stopDate': '15.06.2023', 'title': 'Инструментальное обследование'}, {'startDate': '01.06.2023', 'stopDate': '15.06.2023', 'title': 'Испытание'}, {'startDate': '01.06.2023', 'stopDate': '15.06.2023', 'title': 'Экспертиза'}], 'federalLaw': '248', 'federalLawId': 3, 'fullFieldViolationKnm': False, 'hasViolations': False, 'id': 13181154, 'inn': '4602002556', 'inspectorFullName': [], 'isFromSmev': False, 'isHasApproveDocs': False, 'isHasCollaboratingOrganization': False, 'isHasRequirements': True, 'isHasViolationTerm': False, 'isPm': False, 'kind': 'Выездная проверка', 'knmAnnulled': False, 'knmRejected': False, 'knmType': 'Плановое КНМ', 'knmTypeId': 4, 'legalBasisDocName': [], 'links': [], 'mspCategory': ['Не является субъектом МСП'], 'noPunishment': False, 'notifyLate': False, 'objectsKind': ['Деятельность по организации отдыха детей и их оздоровления, в том числе лагеря с дневным пребыванием'], 'objectsSubKind': ['Деятельность по организации отдыха детей и их оздоровления, в том числе лагеря с дневным пребыванием'], 'objectsType': ['Деятельность и действия'], 'ogrn': '1024600784955', 'oldKnm': None, 'oldPlan': None, 'orderDone': False, 'organizationName': 'МУНИЦИПАЛЬНОЕ КАЗЕННОЕ ОБЩЕОБРАЗОВАТЕЛЬНОЕ УЧРЕЖДЕНИЕ РОЗГРЕБЕЛЬСКАЯ СРЕДНЯЯ ОБЩЕОБРАЗОВАТЕЛЬНАЯ ШКОЛА БОЛЬШЕСОЛДАТСКОГО РАЙОНА КУРСКОЙ ОБЛАСТИ', 'organizationsInn': ['4602002556'], 'organizationsName': ['МУНИЦИПАЛЬНОЕ КАЗЕННОЕ ОБЩЕОБРАЗОВАТЕЛЬНОЕ УЧРЕЖДЕНИЕ РОЗГРЕБЕЛЬСКАЯ СРЕДНЯЯ ОБЩЕОБРАЗОВАТЕЛЬНАЯ ШКОЛА БОЛЬШЕСОЛДАТСКОГО РАЙОНА КУРСКОЙ ОБЛАСТИ'], 'organizationsOgrn': ['1024600784955'], 'planId': '2023050566', 'prosecutorOrganization': 'Прокуратура Курской области', 'prosecutorOrganizationId': 214, 'publishedStatus': 'UNPUBLISHED', 'reasons': [201], 'reasonsList': [{'assignmentDate': None, 'assignmentDateEn': None, 'assignmentNumber': None, 'date': '23.06.2021', 'dateEn': '2021-06-23', 'requirementDetails': None, 'text': '(ФЗ 248) Истечение установленного федеральным законом о виде контроля, положением о виде контроля период времени с даты окончания проведения последнего планового контрольного (надзорного) мероприятия'}], 'recEmptyOrLate': False, 'regDateEgrul': '22.08.2022', 'regDateEgrulEn': '2022-08-22', 'regLate': False, 'regTypes': [], 'requirements': 14, 'requirementsList': [{'nameNpa': 'СП 2.4.3648-20 «Санитарно – эпидемиологические требования к организациям воспитания и обучения, отдыха и оздоровления детей и молодежи» ', 'numberNpa': '28.09.2020', 'title': 'соблюдение требований    п.1.1- п. 2.11.9.; п. 3.12.- п. 3.12.5.'}, {'nameNpa': 'СанПиН 2.3./2.4.3590-20 «Санитарно – эпидемиологические требования к организации общественного питания населения» ', 'numberNpa': '27.10.2020', 'title': 'соблюдение требований п.1.1. – п.5.2.; п.8.1.- п. 8.7.6., приложение 1-13'}, {'nameNpa': 'СП 3.1/2.4.3598-20 «Санитарно – эпидемиологические требования к устройству, содержанию и организации работы образовательных организаций и других объектов социальной инфраструктуры для детей и молодежи в условиях распространении новой \nкоронавирусной инфекции (COVID-19) \n', 'numberNpa': '24.03.2021', 'title': 'соблюдение требований п.1.1.- п.2.7., п. 3.3., п. 3.5.'}, {'nameNpa': 'СанПиН 1.2.3685-21 «Гигиенические нормативы и требования к обеспечению безопасности и (или) безвредности для человека факторов среды обитания»\n \n', 'numberNpa': '28.01.2021', 'title': 'соблюдение требований раздел V, раздел VI'}, {'nameNpa': 'Приказ Министерства здравоохранения Российской Федерации от 28.01.2021 № 29н Об утверждении порядка проведения обязательных предварительных и периодических медицинских осмотров работников, предусмотренных четвертой статьи 213 трудового кодекса Российской Федерации, перечня медицинских противопоказаний к осуществлению работ с вредными и (или) опасными производственными факторами, а также работам, при выполнении которых проводятся обязательные предварительные и периодические медицинские осмотры ', 'numberNpa': '28.01.2021', 'title': 'соблюдение требований п.1, п. 2, приложения № 1, № 2'}, {'nameNpa': 'Федеральный закон от 02.01.2000 № 29-ФЗ «О качестве и безопасности пищевых продуктов»: ', 'numberNpa': '02.01.2000', 'title': 'соблюдение требований гл. I ст. 4-5, IV ст. 15-25, IV.1 ст. 25.1-25.3'}, {'nameNpa': 'Федеральный закон от 24.06.1998 N 89-ФЗ «Об отходах производства и потребления» ', 'numberNpa': '24.06.1998', 'title': 'соблюдение требований ст. 13.4; 24.7.'}, {'nameNpa': 'Федеральный закон от 30 марта 1999 г. N 52-ФЗ О санитарно-эпидемиологическом благополучии населения ', 'numberNpa': '30.03.1999', 'title': 'соблюдение требований  ст.12, ст.13, ст.14, ст.15, ст.16, ст.17, ст.18, ст.19, ст.20, ст.21, ст.22, ст.23, ст.24, ст.25, ст.26, ст.27, ст.28, ст.29, ст.30, ст.31, ст.32, ст.33, ст.34, ст.36, ст.40, ст.41'}, {'nameNpa': 'ТР ТС 021/2011О безопасности пищевой продукции (ТР ТС 021/2011) \n \n', 'numberNpa': '09.12.2011', 'title': 'соблюдение требований ст. 1-5; ст. 7 ч.1-4, ч. 5 абзац 1; ст. 8; ст. 13 ч. 1, 2, 4; ст. 14-17; ст. 18 ч.1, 7, 8; ст. 21 ч.1; ст. 23 ч. 1, 2, 3; ст. 24 ч. 1,2; ст. 39\nприложения № 1-4, 6, 8, 9, 10 '}, {'nameNpa': 'ТР ТС 022/2011 «Пищевая продукция в части ее маркировки» \n   \n', 'numberNpa': '09.12.2011', 'title': 'соблюдение требований ст. 1-5, приложение 1-5  '}, {'nameNpa': 'ТР ТС 023/2011 Технический регламент на соковую продукцию из фруктов и овощей\n\n', 'numberNpa': '09.12.2011', 'title': 'соблюдение требований ст. 3, 4, 5; приложения № 1, 2, 3'}, {'nameNpa': 'ТР ТС 033/2013 О безопасности молока и молочной продукции\n\n', 'numberNpa': '09.10.2013', 'title': 'соблюдение требований п. 1-8, п. 30, 32-36, п. 47-59, 60, 62, 65-84, 86-96, 99, 100, 103, 105, 111-114\nприложения № 1-4, 8-11, 13, 16 '}, {'nameNpa': 'ТР ТС 034/2013 «О безопасности мяса и мясной продукции» \n', 'numberNpa': '09.10.2013', 'title': 'соблюдение требований п. 9; п. 10 ч. 1, п. 11-19; п. 59-60; п. 89-98; п. 101, 102, п. 106-126; п. 129, 132, 133, п. 147-149; приложения № 1-5'}, {'nameNpa': 'ТР ЕАЭС 040/2016 О безопасности рыбы и рыбной продукции', 'numberNpa': '18.10.2016', 'title': ' соблюдение требований раздел IV; раздел V п. 13, п. 15-21; разделы IX, X, раздел XI п. 80-84; раздел XII; приложения № 1-4, 6, 7 '}], 'resolved': False, 'resultEmpty': True, 'resultEmptyOrLate': False, 'resultInfoTypeCodes': [], 'resultViolationKnm': False, 'riskCategory': ['чрезвычайно высокий риск'], 'riskCategoryAndDangerClass': ['чрезвычайно высокий риск / Не применяется'], 'sezRegistryExists': False, 'signed': True, 'smevInfoType': None, 'smevMessageType': None, 'smevReceivedAt': None, 'smevReceivedAtEn': None, 'smevReceivedAtMonth': None, 'smevReceivedAtYear': None, 'spvRegistryExists': False, 'startDate': '01.06.2023', 'startDateEn': '2023-06-01', 'status': 'Исключена', 'statusEgrul': 'Найден', 'statusId': 15, 'stopDate': '15.06.2023', 'stopDateEn': '2023-06-15', 'subjectTypeId': 0, 'supervisionType': 'Федеральный государственный санитарно-эпидемиологический контроль (надзор)', 'supervisionTypeId': 4, 'torRegistryExists': False, 'updatePlanDate': None, 'updatePlanDateLong': None, 'version': 'ERKNM', 'violationLawsuitTypeCodes': [], 'violationTypeCodes': [], 'year': 2023}
2023-01-19 12:36:02,915 - [WARNING] - direct_sql.py - new_insert_in_database(269) - Проведена повторная попытка внесения с параметром special, результат неудачный.
2023-01-19 12:36:02,915 - [INFO] - direct_sql.py - database_inserts_conductor_for_multiprocessing(132) - Возникла ошибка, с которой не удалось справиться...
2023-01-19 12:36:02,916 - [INFO] - direct_sql.py - database_inserts_conductor_for_multiprocessing(133) - 
2023-01-19 12:36:02,933 - [ERROR] - direct_sql.py - new_insert_in_database(267) - (1040, 'ny connections')
2023-01-19 12:36:02,934 - [INFO] - direct_sql.py - new_insert_in_database(268) - {'actCreateDate': None, 'actCreateDateEn': None, 'addresses': ['427070, РЕСПУБЛИКА УДМУРТСКАЯ, РАЙОН ШАРКАНСКИЙ, СЕЛО ШАРКАН, УЛИЦА МИРНАЯ, ДОМ 4 А, '], 'admLevelId': 50001, 'appealed': False, 'approveDocOrderDate': None, 'approveDocOrderNum': None, 'approveDocRequestDate': None, 'approveDocRequestNum': None, 'approveDocs': [], 'approveRequired': False, 'approved': False, 'approvedErknm': 'Отказано', 'chlistCount': 1, 'chlistFilledCount': 1, 'chlistFillingIndicationTypeId': [], 'collaboratingOrganizations': [], 'collaboratingOrganizationsIds': [], 'comment': 'Несоответствие запланированного планового контрольного (надзорного) мероприятия  требованиям пункта 11(4) Постановления Правительства Российской Федерации от 10.03.2022 № 336 «Об особенностях организации и осуществления государственного контроля (надзора), муниципального контроля». ', 'controllingOrganization': 'Управления Роспотребнадзора по Удмуртской Республике', 'controllingOrganizationId': 10001012486, 'createPlanDate': None, 'createPlanDateLong': None, 'createdByErpDb': False, 'createdById': 168890, 'dataNotEqualEGRUL': False, 'dataSetNotInTime': False, 'deleted': False, 'directDurationDays': None, 'disapprove': False, 'district': 'Удмуртская Республика', 'districtId': 1033940000000001, 'durationDays': 10, 'durationHours': None, 'erknmActViolationIds': [], 'erknmResultKindDecisionIds': [], 'erpId': '18230041000103665845', 'events': [{'startDate': '22.05.2023', 'stopDate': '02.06.2023', 'title': 'Осмотр'}, {'startDate': '22.05.2023', 'stopDate': '02.06.2023', 'title': 'Опрос'}, {'startDate': '22.05.2023', 'stopDate': '02.06.2023', 'title': 'Получение письменных объяснений'}, {'startDate': '22.05.2023', 'stopDate': '02.06.2023', 'title': 'Истребование документов'}, {'startDate': '22.05.2023', 'stopDate': '02.06.2023', 'title': 'Отбор проб (образцов)'}, {'startDate': '22.05.2023', 'stopDate': '02.06.2023', 'title': 'Инструментальное обследование'}, {'startDate': '22.05.2023', 'stopDate': '02.06.2023', 'title': 'Испытание'}, {'startDate': '22.05.2023', 'stopDate': '02.06.2023', 'title': 'Экспертиза'}], 'federalLaw': '248', 'federalLawId': 3, 'fullFieldViolationKnm': False, 'hasViolations': False, 'id': 13737962, 'inn': '1828024098', 'inspectorFullName': [], 'isFromSmev': False, 'isHasApproveDocs': False, 'isHasCollaboratingOrganization': False, 'isHasRequirements': True, 'isHasViolationTerm': False, 'isPm': False, 'kind': 'Выездная проверка', 'knmAnnulled': False, 'knmRejected': False, 'knmType': 'Плановое КНМ', 'knmTypeId': 4, 'legalBasisDocName': [], 'links': [], 'mspCategory': ['Не является субъектом МСП'], 'noPunishment': False, 'notifyLate': False, 'objectsKind': ['Деятельность дошкольных образовательных организаций'], 'objectsSubKind': ['Деятельность дошкольных образовательных организаций'], 'objectsType': ['Деятельность и действия'], 'ogrn': '1131828000842', 'oldKnm': None, 'oldPlan': None, 'orderDone': False, 'organizationName': 'МУНИЦИПАЛЬНОЕ БЮДЖЕТНОЕ ДОШКОЛЬНОЕ ОБРАЗОВАТЕЛЬНОЕ УЧРЕЖДЕНИЕ ШАРКАНСКИЙ ДЕТСКИЙ САД № 4', 'organizationsInn': ['1828024098'], 'organizationsName': ['МУНИЦИПАЛЬНОЕ БЮДЖЕТНОЕ ДОШКОЛЬНОЕ ОБРАЗОВАТЕЛЬНОЕ УЧРЕЖДЕНИЕ ШАРКАНСКИЙ ДЕТСКИЙ САД № 4'], 'organizationsOgrn': ['1131828000842'], 'planId': '2023049688', 'prosecutorOrganization': 'Прокуратура Удмуртской Республики', 'prosecutorOrganizationId': 1324, 'publishedStatus': 'UNPUBLISHED', 'reasons': [201], 'reasonsList': [{'assignmentDate': None, 'assignmentDateEn': None, 'assignmentNumber': None, 'date': '06.05.2022', 'dateEn': '2022-05-06', 'requirementDetails': None, 'text': '(ФЗ 248) Истечение установленного федеральным законом о виде контроля, положением о виде контроля период времени с даты окончания проведения последнего планового контрольного (надзорного) мероприятия'}], 'recEmptyOrLate': False, 'regDateEgrul': '27.09.2022', 'regDateEgrulEn': '2022-09-27', 'regLate': False, 'regTypes': [], 'requirements': 1, 'requirementsList': [{'nameNpa': 'None', 'numberNpa': 'None', 'title': 'None'}], 'resolved': False, 'resultEmpty': True, 'resultEmptyOrLate': False, 'resultInfoTypeCodes': [], 'resultViolationKnm': False, 'riskCategory': ['чрезвычайно высокий риск'], 'riskCategoryAndDangerClass': ['чрезвычайно высокий риск'], 'sezRegistryExists': False, 'signed': True, 'smevInfoType': None, 'smevMessageType': None, 'smevReceivedAt': None, 'smevReceivedAtEn': None, 'smevReceivedAtMonth': None, 'smevReceivedAtYear': None, 'spvRegistryExists': False, 'startDate': '22.05.2023', 'startDateEn': '2023-05-22', 'status': 'Исключена', 'statusEgrul': 'Найден', 'statusId': 15, 'stopDate': '02.06.2023', 'stopDateEn': '2023-06-02', 'subjectTypeId': 0, 'supervisionType': 'Федеральный государственный санитарно-эпидемиологический контроль (надзор)', 'supervisionTypeId': 4, 'torRegistryExists': False, 'updatePlanDate': None, 'updatePlanDateLong': None, 'version': 'ERKNM', 'violationLawsuitTypeCodes': [], 'violationTypeCodes': [], 'year': 2023}
2023-01-19 12:36:02,934 - [WARNING] - direct_sql.py - new_insert_in_database(269) - Проведена повторная попытка внесения с параметром special, результат неудачный.
2023-01-19 12:36:02,934 - [INFO] - direct_sql.py - database_inserts_conductor_for_multiprocessing(132) - Возникла ошибка, с которой не удалось справиться...
2023-01-19 12:36:02,934 - [INFO] - direct_sql.py - database_inserts_conductor_for_multiprocessing(133) - 
2023-01-19 12:36:02,950 - [ERROR] - direct_sql.py - new_insert_in_database(267) - (1040, 'ny connections')
2023-01-19 12:36:02,950 - [ERROR] - direct_sql.py - new_insert_in_database(267) - (1040, 'ny connections')
2023-01-19 12:36:02,950 - [INFO] - direct_sql.py - new_insert_in_database(268) - {'actCreateDate': None, 'actCreateDateEn': None, 'addresses': ['169303, РЕСПУБЛИКА КОМИ, ГОРОД УХТА, УЛИЦА КИРПИЧНАЯ, 23, ', 'Республика Коми, г. Ухта, ул. Кирпичная, д.23\n'], 'admLevelId': 50001, 'appealed': False, 'approveDocOrderDate': None, 'approveDocOrderNum': None, 'approveDocRequestDate': None, 'approveDocRequestNum': None, 'approveDocs': [], 'approveRequired': False, 'approved': False, 'approvedErknm': 'Отказано', 'chlistCount': 2, 'chlistFilledCount': 2, 'chlistFillingIndicationTypeId': [], 'collaboratingOrganizations': [], 'collaboratingOrganizationsIds': [], 'comment': 'в силу положений п. 11(4) постановления Правительства Российской Федерации от 10.03.2022 № 336 в планы проведения плановых КНМ не подлежат включению плановые КНМ  в отношении государственных и муниципальных учреждений дошкольного и начального общего, основного общего и среднего общего образования, объекты контроля которых отнесены к категориям чрезвычайно высокого и высокого риска', 'controllingOrganization': 'Управление Роспотребнадзора по Республике Коми', 'controllingOrganizationId': 10001016637, 'createPlanDate': None, 'createPlanDateLong': None, 'createdByErpDb': False, 'createdById': 160403, 'dataNotEqualEGRUL': False, 'dataSetNotInTime': False, 'deleted': False, 'directDurationDays': None, 'disapprove': False, 'district': 'Республика Коми', 'districtId': 1031870000000001, 'durationDays': 10, 'durationHours': None, 'erknmActViolationIds': [], 'erknmResultKindDecisionIds': [], 'erpId': '11230041000103538774', 'events': [{'startDate': '05.06.2023', 'stopDate': '19.06.2023', 'title': 'Осмотр'}, {'startDate': '05.06.2023', 'stopDate': '19.06.2023', 'title': 'Опрос'}, {'startDate': '05.06.2023', 'stopDate': '19.06.2023', 'title': 'Получение письменных объяснений'}, {'startDate': '05.06.2023', 'stopDate': '19.06.2023', 'title': 'Истребование документов'}, {'startDate': '05.06.2023', 'stopDate': '19.06.2023', 'title': 'Отбор проб (образцов)'}, {'startDate': '05.06.2023', 'stopDate': '19.06.2023', 'title': 'Испытание'}, {'startDate': '05.06.2023', 'stopDate': '19.06.2023', 'title': 'Экспертиза'}], 'federalLaw': '248', 'federalLawId': 3, 'fullFieldViolationKnm': False, 'hasViolations': False, 'id': 13610891, 'inn': '1102027236', 'inspectorFullName': [], 'isFromSmev': False, 'isHasApproveDocs': False, 'isHasCollaboratingOrganization': False, 'isHasRequirements': True, 'isHasViolationTerm': False, 'isPm': False, 'kind': 'Выездная проверка', 'knmAnnulled': False, 'knmRejected': False, 'knmType': 'Плановое КНМ', 'knmTypeId': 4, 'legalBasisDocName': [], 'links': [], 'mspCategory': ['Не является субъектом МСП'], 'noPunishment': False, 'notifyLate': False, 'objectsKind': ['Деятельность по организации отдыха детей и их оздоровления, в том числе лагеря с дневным пребыванием', 'Деятельность по организации отдыха детей и их оздоровления, в том числе лагеря с дневным пребыванием'], 'objectsSubKind': ['Деятельность по организации отдыха детей и их оздоровления, в том числе лагеря с дневным пребыванием', 'Деятельность по организации отдыха детей и их оздоровления, в том числе лагеря с дневным пребыванием'], 'objectsType': ['Деятельность и действия', 'Деятельность и действия'], 'ogrn': '1021100742145', 'oldKnm': None, 'oldPlan': None, 'orderDone': False, 'organizationName': 'МУНИЦИПАЛЬНОЕ ОБЩЕОБРАЗОВАТЕЛЬНОЕ УЧРЕЖДЕНИЕ ОСНОВНАЯ ОБЩЕОБРАЗОВАТЕЛЬНАЯ ШКОЛА №8', 'organizationsInn': ['1102027236'], 'organizationsName': ['МУНИЦИПАЛЬНОЕ ОБЩЕОБРАЗОВАТЕЛЬНОЕ УЧРЕЖДЕНИЕ ОСНОВНАЯ ОБЩЕОБРАЗОВАТЕЛЬНАЯ ШКОЛА №8'], 'organizationsOgrn': ['1021100742145'], 'planId': '2023059758', 'prosecutorOrganization': 'Прокуратура Республики Коми', 'prosecutorOrganizationId': 654, 'publishedStatus': 'UNPUBLISHED', 'reasons': [204], 'reasonsList': [{'assignmentDate': None, 'assignmentDateEn': None, 'assignmentNumber': None, 'date': '01.06.2023', 'dateEn': '2023-06-01', 'requirementDetails': None, 'text': '(ФЗ 248) Истечение установленного федеральным законом о виде контроля, положением о виде контроля периода времени с даты иного события, установленного федеральным законом о виде контроля, положением о виде контроля, которое ведет к возникновению объекта контроля'}], 'recEmptyOrLate': False, 'regDateEgrul': '21.09.2022', 'regDateEgrulEn': '2022-09-21', 'regLate': False, 'regTypes': [], 'requirements': 1, 'requirementsList': [{'nameNpa': 'Федеральный закон №52-ФЗ от 30.03.1999 г. «О санитарно-эпидемиологическом благополучии населения» (ст.15, ст.17, ст.19, ст.21, ст.22, ст.24, ст.28, ст.29, ст.31, ст.32, ст.34, ст.36);\n- Федеральный закон от 24.07.1998г. № 124-ФЗ «Об основных гарантиях прав ребенка в Российской Федерации» (п.2 ст. 12);\n- Федеральный закон от 02.01.2000г. № 29-ФЗ «О качестве и безопасности пищевых продуктов» (п.1-3 ст. 3; п.1, 2 ст.5; п. 1, 3 ст.9; ст.15; ст.17; ст.20; ст.23; ст.24; п.1 ст.25.1; ст.25.2);\n- Ф2023-01-19 12:36:02,950 - [WARNING] - direct_sql.py - new_insert_in_database(269) - Проведена повторная попытка внесения с параметром special, результат неудачный.
ления табака или потребления никотинсодержащей продукции» (ст. 12, ст.20);\n- Федеральный закон от 17.09.1998 г. №157-ФЗ «Об иммунопрофилактике инфекционных болезней» (ст. 9, п. 4 ст.11);\n- Федеральный закон от 18.06.2001г. № 77-ФЗ «О предупреждении распро-странения туберкулёза в Российской Федерации» (п.п. 3, 4 ст. 8);\n- Федеральный закон от 24.06.1998 № 89-ФЗ Об отходах производства и потребления (ч.ч.1, 3 ст.13.4);\n- Технический регламент Таможенного союза «О безопасности пищевой продукции» ТР ТС 021/2011 (за исключением статьи 6, абзацев 2, 7, 12-14 части 5 статьи 7, части 3 статьи 13, части 2 статьи 18, статей 30 и 40); \n- Технический регламент Таможенного союза «Пищевая продукция в части её маркировки» ТР ТС 022/2011;\n- Технический регламент Таможенного союза «Технический регламент на соковую продукцию из фруктов и овощей» ТР ТС 023/2011 (ст. 3 - ст. 8);\n- Технический регламент Таможенного союза «Технический регламент на масложировую продукцию» ТР ТС 024/2011;\n- Технический регламент Таможенного союза «О безопасности мебельной продукции» ТР ТС 025/2012 (ст. 4 – ст.7);\n- Технический регламент Таможенного союза «О безопасности отдельных видов специализированной пищевой продукции, в том числе диетического, лечебного и диетического профилактического питания» ТР ТС 027/2012;\n- Технический регламент Таможенного союза «Требования безопасности пищевых добавок, ароматизаторов и технологических вспомогательных средств» ТР ТС 029/2012;\n- Технический регламент Таможенного союза «О безопасности молока и молочной продукции» ТР ТС 033/2013 (за исключением пунктов 13, 14, 97, 98 и 115);\n- Технический регламент Таможенного союза «О безопасности мяса и мясной продукции» ТР ТС 034/2013 (за исключением пунктов 1-8, 26-48, 53, 54 и абзаца 2 пункта 99);\n- Разделы IV и V (за исключением пункта 14), VIII, IX, X, XI (за исключе-нием пунктов 85, 86), XII Технического регламента Евразийского экономического союза «О безопасности рыбы и рыбной продукции» ТР ЕАЭС 040/2016;\n- разделы III, IV, V, VI, VII и X Технического регламента Евразийского эко-номического союза «О безопасности упакованной питьевой воды, включая природную минеральную воду» ТР ЕАЭС 044/2017; \n- Технический регламент Таможенного союза «О безопасности игрушек» ТР ТС 008/2011 (ст. 3 – ст. 7); \n- Технический регламент Таможенного союза «О безопасности продукции, предназначенной для детей и подростков» ТР ТС 007/2011 (ст. 3 – ст. 11, ст 13);\n- раздел IV, пункты 15, 16, подпункты а, д пункта 18 раздела VI, пункт 49 раздела VIII, разделы IX и X в части требований к покрытию для детских игровых площадок и связанным с ним процессам Технического регламента Евразийского экономического союза О безопасности оборудования для детских игровых площадок ТР ЕАЭС 042/2017; \n- Единые санитарно-эпидемиологические и гигиенические требования к то-варам, подлежащим санитарно-эпидемиологическому надзору (контролю), утвержденные решением Комиссии Таможенного союза 28.05.2010 № 299;   \n- СП 2.4.3648-20 Санитарно-эпидемиологические требования к организациям воспитания и обучения, отдыха и оздоровления детей и молодежи\n- СП 3.1/2.4.3598-20 «Санитарно-эпидемиологические требования к устрой-ству, содержанию и организации работы образовательных организаций и других объектов социальной инфраструктуры для детей и молодежи в усло-виях распространения новой коронавирусной инфекции (COVID-19)»; \n- СанПиН 2.3/2.4.3590-20 «Санитарно-эпидемиологические требования к организации общественного питания населения»;\n- СанПиН 1.2.3685-21 «Гигиенические нормативы и требования к обеспече-нию безопасности и (или) безвредности для человека факторов среды обитания»;\n- СанПиН 2.1.3684-21 «Санитарно-эпидемиологические требования к содержанию территорий городских и сельских поселений, к водным объектам, питьевой воде и питьевому водоснабжению, атмосферному воздуху, почвам, жилым помещениям, эксплуатации производственных, общественных помещений, организации и проведению санитарно-противоэпидемических (профилактических) мероприятий»;\n- СП 3.1.3597-20 Профилактика новой коронавирусной инфекции (COVID-19)\n- СанПиН 3.3686-21 Санитарно-эпидемиологические требования по профилактике инфекционных болезней; \n- СП 2.2.3670-20 «Санитарно-эпидемиологические требования к условиям труда»;\n- приказ Министерства труда и социальной защиты Российской Федерации и Министерства здравоохранения Российской Федерации от 31.12.2020 г. № 988н/1420н «Об утверждении перечня вредных и (или) опасных производственных факторов и работ, при выполнении которых проводятся обязательные предварительные медицинские осмотры при поступлении на работу и периодические медицинские осмотры»;\n- приказ Министерства здравоохранения Российской Федерации от 28.01.2021 года № 29н «Об утверждении Порядка проведения обязательных предварительных и периодических медицинских осмотров работников, предусмотренных частью четвертой статьи 213 Трудового кодекса Российской Федерации, перечня медицинских противопоказаний к осуществлению работ с вредными и (или) опасными производственными факторами, а также работам, при выполнении которых проводятся обязательные предварительные и периодические медицинские осмотры»\n\n', 'numberNpa': '30.03.1999', 'title': 'Соблюдение обязательных требований'}], 'resolved': False, 'resultEmpty': True, 'resultEmptyOrLate': False, 'resultInfoTypeCodes': [], 'resultViolationKnm': False, 'riskCategory': ['чрезвычайно высокий риск', 'чрезвычайно высокий риск'], 'riskCategoryAndDangerClass': ['чрезвычайно высокий риск / Первый', 'чрезвычайно высокий риск / Первый'], 'sezRegistryExists': False, 'signed': True, 'smevInfoType': None, 'smevMessageType': None, 'smevReceivedAt': None, 'smevReceivedAtEn': None, 'smevReceivedAtMonth': None, 'smevReceivedAtYear': None, 'spvRegistryExists': False, 'startDate': '05.06.2023', 'startDateEn': '2023-06-05', 'status': 'Исключена', 'statusEgrul': 'Найден', 'statusId': 15, 'stopDate': None, 'stopDateEn': None, 'subjectTypeId': 0, 'supervisionType': 'Федеральный государственный санитарно-эпидемиологический контроль (надзор)', 'supervisionTypeId': 4, 'torRegistryExists': False, 'updatePlanDate': None, 'updatePlanDateLong': None, 'version': 'ERKNM', 'violationLawsuitTypeCodes': [], 'violationTypeCodes': [], 'year': 2023}
2023-01-19 12:36:02,951 - [WARNING] - direct_sql.py - new_insert_in_database(269) - Проведена повторная попытка внесения с параметром special, результат неудачный.
2023-01-19 12:36:02,951 - [INFO] - direct_sql.py - database_inserts_conductor_for_multiprocessing(132) - Возникла ошибка, с которой не удалось справиться...
2023-01-19 12:36:02,951 - [INFO] - direct_sql.py - database_inserts_conductor_for_multiprocessing(133) - 
2023-01-19 12:36:02,951 - [INFO] - direct_sql.py - database_inserts_conductor_for_multiprocessing(132) - Возникла ошибка, с которой не удалось справиться...
2023-01-19 12:36:02,952 - [INFO] - direct_sql.py - database_inserts_conductor_for_multiprocessing(133) - 
2023-01-19 12:36:02,953 - [ERROR] - direct_sql.py - new_insert_in_database(267) - (1040, 'ny connections')
2023-01-19 12:36:02,954 - [INFO] - direct_sql.py - new_insert_in_database(268) - {'actCreateDate': None, 'actCreateDateEn': None, 'addresses': ['155520, ОБЛАСТЬ, ИВАНОВСКАЯ, РАЙОН, ФУРМАНОВСКИЙ, ГОРОД, ФУРМАНОВ, УЛИЦА, РЕВОЛЮЦИОННАЯ, 20А, 370180010000165'], 'admLevelId': 50001, 'appealed': False, 'approveDocOrderDate': None, 'approveDocOrderNum': None, 'approveDocRequestDate': None, 'approveDocRequestNum': None, 'approveDocs': [], 'approveRequired': False, 'approved': True, 'approvedErknm': 'Согласовано', 'chlistCount': 0, 'chlistFilledCount': 0, 'chlistFillingIndicationTypeId': [], 'collaboratingOrganizations': [], 'collaboratingOrganizationsIds': [], 'comment': None, 'controllingOrganization': 'Управление Роспотребнадзора по Ивановской области', 'controllingOrganizationId': 10001013491, 'createPlanDate': None, 'createPlanDateLong': None, 'createdByErpDb': False, 'createdById': 175346, 'dataNotEqualEGRUL': False, 'dataSetNotInTime': True, 'deleted': False, 'directDurationDays': None, 'disapprove': False, 'district': 'Ивановская область', 'districtId': 1030240000000001, 'durationDays': 10, 'durationHours': None, 'erknmActViolationIds': [], 'erknmResultKindDecisionIds': [], 'erpId': '37230041000103152231', 'events': [{'startDate': '16.05.2023', 'stopDate': '29.05.2023', 'title': 'Получение письменных объяснений'}, {'startDate': '16.05.2023', 'stopDate': '29.05.2023', 'title': 'Истребование документов'}], 'federalLaw': '248', 'federalLawId': 3, 'fullFieldViolationKnm': False, 'hasViolations': False, 'id': 13224348, 'inn': '3705006688', 'inspectorFullName': [], 'isFromSmev': False, 'isHasApproveDocs': False, 'isHasCollaboratingOrganization': False, 'isHasRequirements': True, 'isHasViolationTerm': False, 'isPm': False, 'kind': 'Документарная проверка', 'knmAnnulled': False, 'knmRejected': False, 'knmType': 'Плановое КНМ', 'knmTypeId': 4, 'legalBasisDocName': [], 'links': [], 'mspCategory': ['Не является субъектом МСП'], 'noPunishment': False, 'notifyLate': False, 'objectsKind': ['Деятельность по организации отдыха детей и их оздоровления, в том числе лагеря с дневным пребыванием'], 'objectsSubKind': ['Деятельность по организации отдыха детей и их оздоровления, в том числе лагеря с дневным пребыванием'], 'objectsType': ['Деятельность и действия'], 'ogrn': '1023701359923', 'oldKnm': None, 'oldPlan': None, 'orderDone': False, 'organizationName': 'МУНИЦИПАЛЬНОЕ БЮДЖЕТНОЕ УЧРЕЖДЕНИЕ ДОПОЛНИТЕЛЬНОГО ОБРАЗОВАНИЯ ДЕТСКАЯ ХУДОЖЕСТВЕННАЯ ШКОЛА ФУРМАНОВСКОГО МУНИЦИПАЛЬНОГО РАЙОНА', 'organizationsInn': ['3705006688'], 'organizationsName': ['МУНИЦИПАЛЬНОЕ БЮДЖЕТНОЕ УЧРЕЖДЕНИЕ ДОПОЛНИТЕЛЬНОГО ОБРАЗОВАНИЯ ДЕТСКАЯ ХУДОЖЕСТВЕННАЯ ШКОЛА ФУРМАНОВСКОГО МУНИЦИПАЛЬНОГО РАЙОНА'], 'organizationsOgrn': ['1023701359923'], 'planId': '2023050673', 'prosecutorOrganization': 'Прокуратура Ивановской области', 'prosecutorOrganizationId': 130, 'publishedStatus': 'PUBLISHED', 'reasons': [201], 'reasonsList': [{'assignmentDate': None, 'assignmentDateEn': None, 'assignmentNumber': None, 'date': '27.06.2022', 'dateEn': '2022-06-27', 'requirementDetails': None, 'text': '(ФЗ 248) Истечение установленного федеральным законом о виде контроля, положением о виде контроля период времени с даты окончания проведения последнего планового контрольного (надзорного) мероприятия'}], 'recEmptyOrLate': False, 'regDateEgrul': '25.08.2022', 'regDateEgrulEn': '2022-08-25', 'regLate': False, 'regTypes': [], 'requirements': 4, 'requirementsList': [{'nameNpa': 'None', 'numberNpa': 'None', 'title': 'None'}, {'nameNpa': 'None', 'numberNpa': 'None', 'title': 'None'}, {'nameNpa': 'None', 'numberNpa': 'None', 'title': 'None'}, {'nameNpa': 'None', 'numberNpa': 'None', 'title': 'None'}], 'resolved': False, 'resultEmpty': True, 'resultEmptyOrLate': False, 'resultInfoTypeCodes': [], 'resultViolationKnm': False, 'riskCategory': ['чрезвычайно высокий риск'], 'riskCategoryAndDangerClass': ['чрезвычайно высокий риск'], 'sezRegistryExists': False, 'signed': True, 'smevInfoType': None, 'smevMessageType': None, 'smevReceivedAt': None, 'smevReceivedAtEn': None, 'smevReceivedAtMonth': None, 'smevReceivedAtYear': None, 'spvRegistryExists': False, 'startDate': '16.05.2023', 'startDateEn': '2023-05-16', 'status': 'Ожидает проведения', 'statusEgrul': 'Найден', 'statusId': 5, 'stopDate': '29.05.2023', 'stopDateEn': '2023-05-29', 'subjectTypeId': 0, 'supervisionType': 'Федеральный государственный санитарно-эпидемиологический контроль (надзор)', 'supervisionTypeId': 4, 'torRegistryExists': False, 'updatePlanDate': None, 'updatePlanDateLong': None, 'version': 'ERKNM', 'violationLawsuitTypeCodes': [], 'violationTypeCodes': [], 'year': 2023}
2023-01-19 12:36:02,954 - [WARNING] - direct_sql.py - new_insert_in_database(269) - Проведена повторная попытка внесения с параметром special, результат неудачный.
2023-01-19 12:36:02,954 - [INFO] - direct_sql.py - database_inserts_conductor_for_multiprocessing(132) - Возникла ошибка, с которой не удалось справиться...
2023-01-19 12:36:02,954 - [INFO] - direct_sql.py - database_inserts_conductor_for_multiprocessing(133) - 
2023-01-19 12:36:02,966 - [ERROR] - direct_sql.py - new_insert_in_database(267) - (1040, 'ny connections')
2023-01-19 12:36:02,966 - [INFO] - direct_sql.py - new_insert_in_database(268) - {'actCreateDate': None, 'actCreateDateEn': None, 'addresses': ['155057, ОБЛАСТЬ, ИВАНОВСКАЯ, РАЙОН, ТЕЙКОВСКИЙ, УЛИЦА, МОЛОДЕЖНАЯ, ДОМ 7, 370170000750002'], 'admLevelId': 50001, 'appealed': False, 'approveDocOrderDate': None, 'approveDocOrderNum': None, 'approveDocRequestDate': None, 'approveDocRequestNum': None, 'approveDocs': [], 'approveRequired': False, 'approved': False, 'approvedErknm': 'Отказано', 'chlistCount': 0, 'chlistFilledCount': 0, 'chlistFillingIndicationTypeId': [], 'collaboratingOrganizations': [], 'collaboratingOrganizationsIds': [], 'comment': 'п. 11 (4) Постановления Правительства РФ от 10.03.2022 № 336', 'controllingOrganization': 'Управление Роспотребнадзора по Ивановской области', 'controllingOrganizationId': 10001013491, 'createPlanDate': None, 'createPlanDateLong': None, 'createdByErpDb': False, 'createdById': 160995, 'dataNotEqualEGRUL': False, 'dataSetNotInTime': False, 'deleted': False, 'directDurationDays': None, 'disapprove': False, 'district': 'Ивановская область', 'districtId': 1030240000000001, 'durationDays': 10, 'durationHours': None, 'erknmActViolationIds': [], 'erknmResultKindDecisionIds': [], 'erpId': '37230041000102885723', 'events': [{'startDate': '12.05.2023', 'stopDate': '25.05.2023', 'title': 'Получение письменных объяснений'}, {'startDate': '12.05.2023', 'stopDate': '25.05.2023', 'title': 'Истребование документов'}], 'federalLaw': '248', 'federalLawId': 3, 'fullFieldViolationKnm': False, 'hasViolations': False, 'id': 12957840, 'inn': '3724003474', 'inspectorFullName': [], 'isFromSmev': False, 'isHasApproveDocs': False, 'isHasCollaboratingOrganization': False, 'isHasRequirements': True, 'isHasViolationTerm': False, 'isPm': False, 'kind': 'Документарная проверка', 'knmAnnulled': False, 'knmRejected': False, 'knmType': 'Плановое КНМ', 'knmTypeId': 4, 'legalBasisDocName': [], 'links': [], 'mspCategory': ['Не является субъектом МСП'], 'noPunishment': False, 'notifyLate': False, 'objectsKind': ['Деятельность по организации отдыха детей и их оздоровления, в том числе лагеря с дневным пребыванием'], 'objectsSubKind': ['Деятельность по организации отдыха детей и их оздоровления, в том числе лагеря с дневным пребыванием'], 'objectsType': ['Деятельность и действия'], 'ogrn': '1023701789704', 'oldKnm': None, 'oldPlan': None, 'orderDone': False, 'organizationName': 'МУНИЦИПАЛЬНОЕ БЮДЖЕТНОЕ ОБЩЕОБРАЗОВАТЕЛЬНОЕ УЧРЕЖДЕНИЕ ТЕЙКОВСКОГО МУНИЦИПАЛЬНОГО РАЙОНА НОВОГОРЯНОВСКАЯ СРЕДНЯЯ ОБЩЕОБРАЗОВАТЕЛЬНАЯ ШКОЛА', 'organizationsInn': ['3724003474'], 'organizationsName': ['МУНИЦИПАЛЬНОЕ БЮДЖЕТНОЕ ОБЩЕОБРАЗОВАТЕЛЬНОЕ УЧРЕЖДЕНИЕ ТЕЙКОВСКОГО МУНИЦИПАЛЬНОГО РАЙОНА НОВОГОРЯНОВСКАЯ СРЕДНЯЯ ОБЩЕОБРАЗОВАТЕЛЬНАЯ ШКОЛА'], 'organizationsOgrn': ['1023701789704'], 'planId': '2023050673', 'prosecutorOrganization': 'Прокуратура Ивановской области', 'prosecutorOrganizationId': 130, 'publishedStatus': 'UNPUBLISHED', 'reasons': [201], 'reasonsList': [{'assignmentDate': None, 'assignmentDateEn': None, 'assignmentNumber': None, 'date': '20.06.2019', 'dateEn': '2019-06-20', 'requirementDetails': None, 'text': '(ФЗ 248) Истечение установленного федеральным законом о виде контроля, положением о виде контроля период времени с даты окончания проведения последнего планового контрольного (надзорного) мероприятия'}], 'recEmptyOrLate': False, 'regDateEgrul': '16.08.2022', 'regDateEgrulEn': '2022-08-16', 'regLate': False, 'regTypes': [], 'requirements': 8, 'requirementsList': [{'nameNpa': 'Федеральный закон № 52-ФЗ от 30.03.1999 «О санитарно-эпидемиологическом благополучии населения» (ст.12, ст.13, ст.14, ст.15, ст.16, ст.17, ст.18, ст.19, ст.20, ст.21, ст.22, ст.23, ст.24, ст.25, ст.26, ст.27, ст.28, ст.29, ст.30, ст.31, ст.32, ст.33, ст.34, ст.36, ст.40, ст.41, ст.43, п.4 ст.44.1)', 'numberNpa': '30.03.1999', 'title': 'требования санитарного законодательства'}, {'nameNpa': 'Приказ Министерства здравоохранения Российской Федерации № 29н Об утверждении Порядка проведения обязательных предварительных и периодических медицинских осмотров работников, предусмотренных частью четвертой статьи 213 Трудового кодекса Российской Федерации, перечня медицинских противопоказаний к осуществлению работ с вредными и (или) опасными производственными факторами, а также работам, при выполнении которых проводятся обязательные предварительные и периодические медицинские осмотры (п. 4.1 приложения к Порядку проведения обязательных предварительных и периодических медицинских осмотров работников, предусмотренных частью четвертой статьи 213 Трудового кодекса Российской Федерации) ', 'numberNpa': '28.01.2021', 'title': 'требования санитарного законодательства'}, {'nameNpa': 'СП 2.4.3648-20 «Санитарно-эпидемиологические требования к организациям воспитания и обучения, отдыха и оздоровления детей и молодежи» (весь документ) ', 'numberNpa': '28.09.2020', 'title': 'требования санитарного законодательства'}, {'nameNpa': 'СанПиН 2.3/2.4.3590-20 «Санитарно-эпидемиологические требования к организации общественного питания населения» (весь документ) ', 'numberNpa': '27.10.2020', 'title': 'требования санитарного законодательства'}, {'nameNpa': 'СП 3.1./2.4.3598-20 «Санитарно-эпидемиологические требования к устройству, содержанию и организации работы образовательных организаций и других объектов социальной инфраструктуры для детей и молодежи в условиях распространения новой коронавирусной инфекции (COVID-19)» (весь документ) ', 'numberNpa': '30.06.2020', 'title': 'требования санитарного законодательства'}, {'nameNpa': 'СанПиН 1.2.3685-21 «Гигиенические нормативы и требования к обеспечению безопасности и (или) безвредности для человека факторов среды обитания» (весь документ) ', 'numberNpa': '28.01.2021', 'title': 'требования санитарного законодательства'}, {'nameNpa': 'СанПиН 2.1.3684-21 «Санитарно-эпидемиологические требования к содержанию территорий городских и сельских поселений, к водным объектам, питьевой воде и питьевому водоснабжению, атмосферному воздуху, почвам, жилым помещениям, эксплуатации производственных, общественных помещений, организации и проведению санитарно-противоэпидемиологических (профилактических) мероприятий» (весь документ)', 'numberNpa': '28.01.2021', 'title': 'требования санитарного законодательства'}, {'nameNpa': 'СанПиН 3.3686-21 Санитарно-эпидемиологические требования по профилактике инфекционных болезней (весь документ) ', 'numberNpa': '28.01.2021', 'title': 'требования санитарного законодательства'}], 'resolved': False, 'resultEmpty': True, 'resultEmptyOrLate': False, 'resultInfoTypeCodes': [], 'resultViolationKnm': False, 'riskCategory': ['чрезвычайно высокий риск'], 'riskCategoryAndDangerClass': ['чрезвычайно высокий риск'], 'sezRegistryExists': False, 'signed': True, 'smevInfoType': None, 'smevMessageType': None, 'smevReceivedAt': None, 'smevReceivedAtEn': None, 'smevReceivedAtMonth': None, 'smevReceivedAtYear': None, 'spvRegistryExists': False, 'startDate': '12.05.2023', 'startDateEn': '2023-05-12', 'status': 'Исключена', 'statusEgrul': 'Найден', 'statusId': 15, 'stopDate': '25.05.2023', 'stopDateEn': '2023-05-25', 'subjectTypeId': 0, 'supervisionType': 'Федеральный государственный санитарно-эпидемиологический контроль (надзор)', 'supervisionTypeId': 4, 'torRegistryExists': False, 'updatePlanDate': None, 'updatePlanDateLong': None, 'version': 'ERKNM', 'violationLawsuitTypeCodes': [], 'violationTypeCodes': [], 'year': 2023}
2023-01-19 12:36:02,967 - [WARNING] - direct_sql.py - new_insert_in_database(269) - Проведена повторная попытка внесения с параметром special, результат неудачный.
2023-01-19 12:36:02,968 - [INFO] - direct_sql.py - database_inserts_conductor_for_multiprocessing(132) - Возникла ошибка, с которой не удалось справиться...
2023-01-19 12:36:02,968 - [INFO] - direct_sql.py - database_inserts_conductor_for_multiprocessing(133) - 
2023-01-19 12:36:02,969 - [ERROR] - direct_sql.py - new_insert_in_database(267) - (1040, 'ny connections')
2023-01-19 12:36:02,969 - [ERROR] - direct_sql.py - new_insert_in_database(267) - (1040, 'ny connections')
2023-01-19 12:36:02,969 - [INFO] - direct_sql.py - new_insert_in_database(268) - {'actCreateDate': None, 'actCreateDateEn': None, 'addresses': ['427719, РЕСПУБЛИКА УДМУРТСКАЯ, РАЙОН КИЗНЕРСКИЙ, СЕЛО КИБЬЯ, УЛИЦА ШКОЛЬНАЯ, 10, '], 'admLevelId': 50001, 'appealed': False, 'approveDocOrderDate': None, 'approveDocOrderNum': None, 'approveDocRequestDate': None, 'approveDocRequestNum': None, 'approveDocs': [], 'approveRequired': False, 'approved': False, 'approvedErknm': 'Отказано', 'chlistCount': 0, 'chlistFilledCount': 0, 'chlistFillingIndicationTypeId': [], 'collaboratingOrganizations': [], 'collaboratingOrganizationsIds': [], 'comment': 'Несоответствие запланированного планового контрольного (надзорного) мероприятия  требованиям пункта 11(4) Постановления Правительства Российской Федерации от 10.03.2022 № 336 «Об особенностях организации и осуществления государственного контроля (надзора), муниципального контроля». ', 'controllingOrganization': 'Управления Роспотребнадзора по Удмуртской Республике', 'controllingOrganizationId': 10001012486, 'createPlanDate': None, 'createPlanDateLong': None, 'createdByErpDb': False, 'createdById': 177218, 'dataNotEqualEGRUL': False, 'dataSetNotInTime': False, 'deleted': False, 'directDurationDays': None, 'disapprove': False, 'district': 'Удмуртская Республика', 'districtId': 1033940000000001, 'durationDays': 10, 'durationHours': None, 'erknmActViolationIds': [], 'erknmResultKindDecisionIds': [], 'erpId': '18230041000103670894', 'events': [{'startDate': '23.05.2023', 'stopDate': '05.06.2023', 'title': 'Получение письменных объяснений'}, {'startDate': '23.05.2023', 'stopDate': '05.06.2023', 'title': 'Истребование документов'}, {'startDate': '23.05.2023', 'stopDate': '05.06.2023', 'title': 'Экспертиза'}], 'federalLaw': '248', 'federalLawId': 3, 'fullFieldViolationKnm': False, 'hasViolations': False, 'id': 13743011, 'inn': '1813003306', 'inspectorFullName': [], 'isFromSmev': False, 'isHasApproveDocs': False, 'isHasCollaboratingOrganization': False, 'isHasRequirements': True, 'isHasViolationTerm': False, 'isPm': False, 'kind': 'Документарная проверка', 'knmAnnulled': False, 'knmRejected': False, 'knmType': 'Плановое КНМ', 'knmTypeId': 4, 'legalBasisDocName': [], 'links': [], 'mspCategory': ['Не является субъектом МСП'], 'noPunishment': False, 'notifyLate': False, 'objectsKind': ['Деятельность дошкольных образовательных организаций'], 'objectsSubKind': ['Деятельность дошкольных образовательных организаций'], 'objectsType': ['Деятельность и действия'], 'ogrn': '1021800841358', 'oldKnm': None, 'oldPlan': None, 'orderDone': False, 'organizationName': 'МУНИЦИПАЛЬНОЕ БЮДЖЕТНОЕ ДОШКОЛЬНОЕ ОБРАЗОВАТЕЛЬНОЕ УЧРЕЖДЕНИЕ КИБЬИНСКИЙ ДЕТСКИЙ САД', 'organizationsInn': ['1813003306'], 'organizationsName': ['МУНИЦИПАЛЬНОЕ БЮДЖЕТНОЕ ДОШКОЛЬНОЕ ОБРАЗОВАТЕЛЬНОЕ УЧРЕЖДЕНИЕ КИБЬИНСКИЙ ДЕТСКИЙ САД'], 'organizationsOgrn': ['1021800841358'], 'planId': '2023049688', 'prosecutorOrganization': 'Прокуратура Удмуртской Республики', 'prosecutorOrganizationId': 1324, 'publishedStatus': 'UNPUBLISHED', 'reasons': [201], 'reasonsList': [{'assignmentDate': None, 'assignmentDateEn': None, 'assignmentNumber': None, 'date': '14.02.2022', 'dateEn': '2022-02-14', 'requirementDetails': None, 'text': '(ФЗ 248) Истечение установленного федеральным законом о виде контроля, положением о виде контроля период времени с даты окончания проведения последнего планового контрольного (надзорного) мероприятия'}], 'recEmptyOrLate': False, 'regDateEgrul': '27.09.2022', 'regDateEgrulEn': '2022-09-27', 'regLate': False, 'regTypes': [], 'requirements': 1, 'requirementsList': [{'nameNpa': 'None', 'numberNpa': 'None', 'title': 'None'}], 'resolved': False, 'resultEmpty': True, 'resultEmptyOrLate': False, 'resultInfoTypeCodes': [], 'resultViolationKnm': False, 'riskCategory': ['чрезвычайно высокий риск'], 'riskCategoryAndDangerClass': ['чрезвычайно высокий риск'], 'sezRegistryExists': False, 'signed': True, 'smevInfoType': None, 'smevMessageType': None, 'smevReceivedAt': None, 'smevReceivedAtEn': None, 'smevReceivedAtMonth': None, 'smevReceivedAtYear': None, 'spvRegistryExists': False, 'startDate': '23.05.2023', 'startDateEn': '2023-05-23', 'status': 'Исключена', 'statusEgrul': 'Найден', 'statusId': 15, 'stopDate': '05.06.2023', 'stopDateEn': '2023-06-05', 'subjectTypeId': 0, 'supervisionType': 'Федеральный государственный санитарно-эпидемиологический контроль (надзор)', 'supervisionTypeId': 4, 'torRegistryExists': False, 'updatePlanDate': None, 'updatePlanDateLong': None, 'version': 'ERKNM', 'violationLawsuitTypeCodes': [], 'violationTypeCodes': [], 'year': 2023}
2023-01-19 12:36:02,969 - [WARNING] - direct_sql.py - new_insert_in_database(269) - Проведена повторная попытка внесения с параметром special, результат неудачный.
2023-01-19 12:36:02,969 - [INFO] - direct_sql.py - database_inserts_conductor_for_multiprocessing(132) - Возникла ошибка, с которой не удалось справиться...
ОЛЬШЕСОЛДАТСКИЙ, 46003000009'], 'admLevelId': 50001, 'appealed': False, 'approveDocOrderDate': None, 'approveDocOrderNum': None, 'approveDocRequestDate': None, 'approveDocRequestNum': None, 'approveDocs': [], 'approveRequired': False, 'approved': False, 'approvedErknm': 'Отказано', 'chlistCount': 2, 'chlistFilledCount': 2, 'chlistFillingIndicationTypeId': [], 'collaboratingOrganizations': [], 'collaboratingOrganizationsIds': [], 'comment': 'На основании пункта 11(4) постановления Правительства РФ от 10.03.2022 № 336 в планы проведения плановых КНМ на 2023 год не включаются КНМ в отношении государственных и муниципальных учреждений дошкольного и начального общего образования, основного общего и среднего общего образования, объекты которых отнесены к категориям чрезвычайно высокого и высокого риска.', 'controllingOrganization': 'Управления Роспотребнадзора по Курской области', 'controllingOrganizationId': 10001017235, 'createPlanDate': None, 'createPlanDateLong': None, 'createdByErpDb': False, 'createdById': 164580, 'dataNotEqualEGRUL': False, 'dataSetNotInTime': False, 'deleted': False, 'directDurationDays': None, 'disapprove': False, 'district': 'Курская область', 'districtId': 1030380000000001, 'durationDays': 10, 'durationHours': 75, 'erknmActViolationIds': [], 'erknmResultKindDecisionIds': [], 'erpId': '46230041000103109644', 'events': [{'startDate': '01.06.2023', 'stopDate': '15.06.2023', 'title': 'Осмотр'}, {'startDate': '01.06.2023', 'stopDate': '15.06.2023', 'title': 'Получение письменных объяснений'}, {'startDate': '01.06.2023', 'stopDate': '15.06.2023', 'title': 'Истребование документов'}, {'startDate': '01.06.2023', 'stopDate': '15.06.2023', 'title': 'Отбор проб (образцов)'}, {'startDate': '01.06.2023', 'stopDate': '15.06.2023', 'title': 'Инструментальное обследование'}, {'startDate': '01.06.2023', 'stopDate': '15.06.2023', 'title': 'Испытание'}, {'startDate': '01.06.2023', 'stopDate': '15.06.2023', 'title': 'Экспертиза'}], 'federalLaw': '248', 'federalLawId': 3, 'fullFieldViolationKnm': False, 'hasViolations': False, 'id': 13181761, 'inn': '4602002490', 'inspectorFullName': [], 'isFromSmev': False, 'isHasApproveDocs': False, 'isHasCollaboratingOrganization': False, 'isHasRequirements': True, 'isHasViolationTerm': False, 'isPm': False, 'kind': 'Выездная проверка', 'knmAnnulled': False, 'knmRejected': False, 'knmType': 'Плановое КНМ', 'knmTypeId': 4, 'legalBasisDocName': [], 'links': [], 'mspCategory': ['Не является субъектом МСП'], 'noPunishment': False, 'notifyLate': False, 'objectsKind': ['Деятельность по организации отдыха детей и их оздоровления, в том числе лагеря с дневным пребыванием'], 'objectsSubKind': ['Деятельность по организации отдыха детей и их оздоровления, в том числе лагеря с дневным пребыванием'], 'objectsType': ['Деятельность и действия'], 'ogrn': '1024600784108', 'oldKnm': None, 'oldPlan': None, 'orderDone': False, 'organizationName': 'МУНИЦИПАЛЬНОЕ КАЗЕННОЕ ОБЩЕОБРАЗОВАТЕЛЬНОЕ УЧРЕЖДЕНИЕ ЛЮБОСТАНСКАЯ СРЕДНЯЯ ОБЩЕОБРАЗОВАТЕЛЬНАЯ ШКОЛА БОЛЬШЕСОЛДАТСКОГО РАЙОНА КУРСКОЙ ОБЛАСТИ', 'organizationsInn': ['4602002490'], 'organizationsName': ['МУНИЦИПАЛЬНОЕ КАЗЕННОЕ ОБЩЕОБРАЗОВАТЕЛЬНОЕ УЧРЕЖДЕНИЕ ЛЮБОСТАНСКАЯ СРЕДНЯЯ ОБЩЕОБРАЗОВАТЕЛЬНАЯ ШКОЛА БОЛЬШЕСОЛДАТСКОГО РАЙОНА КУРСКОЙ ОБЛАСТИ'], 'organizationsOgrn': ['1024600784108'], 'planId': '2023050566', 'prosecutorOrganization': 'Прокуратура Курской области', 'prosecutorOrganizationId': 214, 'publishedStatus': 'UNPUBLISHED', 'reasons': [201], 'reasonsList': [{'assignmentDate': None, 'assignmentDateEn': None, 'assignmentNumber': None, 'date': '20.06.2019', 'dateEn': '2019-06-20', 'requirementDetails': None, 'text': '(ФЗ 248) Истечение установленного федеральным законом о виде контроля, положением о виде контроля период времени с даты окончания проведения последнего планового контрольного (надзорного) мероприятия'}], 'recEmptyOrLate': False, 'regDateEgrul': '22.08.2022', 'regDateEgrulEn': '2022-08-22', 'regLate': False, 'regTypes': [], 'requirements': 14, 'requirementsList': [{'nameNpa': 'СП 2.4.3648-20 «Санитарно – эпидемиологические требования к организациям воспитания и обучения, отдыха и оздоровления детей и молодежи» ', 'numberNpa': '28.09.2020', 'title': 'соблюдение требований    п.1.1- п. 2.11.9.; п. 3.12.- п. 3.12.5. '}, {'nameNpa': 'СанПиН 2.3./2.4.3590-20 «Санитарно – эпидемиологические требования к организации общественного питания населения» ', 'numberNpa': '27.10.2020', 'title': 'соблюдение требований п.1.1. – п.5.2.; п.8.1.- п. 8.7.6., приложение 1-13'}, {'nameNpa': 'СП 3.1/2.4.3598-20 «Санитарно – эпидемиологические требования к устройству, содержанию и организации работы образовательных организаций и других объектов социальной инфраструктуры для детей и молодежи в условиях распространении новой \nкоронавирусной инфекции (COVID-19) \n', 'numberNpa': '24.03.2021', 'title': 'соблюдение требований п.1.1.- п.2.7., п. 3.3., п. 3.5. '}, {'nameNpa': 'СанПиН 1.2.3685-21 «Гигиенические нормативы и требования к обеспечению безопасности и (или) безвредности для человека факторов среды обитания»\n \n', 'numberNpa': '28.01.2021', 'title': 'соблюдение требований раздел V, раздел VI'}, {'nameNpa': 'Приказ Министерства здравоохранения Российской Федерации от 28.01.2021 № 29н Об утверждении порядка проведения обязательных предварительных и периодических медицинских осмотров работников, предусмотренных четвертой статьи 213 трудового кодекса Российской Федерации, перечня медицинских противопоказаний к осуществлению работ с вредными и (или) опасными производственными факторами, а также работам, при выполнении которых проводятся обязательные предварительные и периодические медицинские осмотры ', 'numberNpa': '28.01.2021', 'title': 'соблюдение требований п.1, п. 2, приложения № 1, № 2'}, {'nameNpa': 'Федеральный закон от 02.01.2000 № 29-ФЗ «О качестве и безопасности пищевых продуктов»: ', 'numberNpa': '02.01.2000', 'title': 'соблюдение требований гл. I ст. 4-5, IV ст. 15-25, IV.1 ст. 25.1-25.3'}, {'nameNpa': 'Федеральный закон от 24.06.1998 N 89-ФЗ «Об отходах производства и потребления» ', 'numberNpa': '24.06.1998', 'title': 'соблюдение требований ст. 13.4; 24.7.'}, {'nameNpa': 'Федеральный закон от 30 марта 1999 г. N 52-ФЗ О санитарно-эпидемиологическом благополучии населения (с изменениями и дополнениями) \n\n', 'numberNpa': '30.03.1999', 'title': 'соблюдение требований  ст.12, ст.13, ст.14, ст.15, ст.16, ст.17, ст.18, ст.19, ст.20, ст.21, ст.22, ст.23, ст.24, ст.25, ст.26, ст.27, ст.28, ст.29, ст.30, ст.31, ст.32, ст.33, ст.34, ст.36, ст.40, ст.41'}, {'nameNpa': 'ТР ТС 021/2011О безопасности пищевой продукции (ТР ТС 021/2011) \n.\n', 'numberNpa': '09.12.2011', 'title': ' соблюдение требований ст. 1-5; ст. 7 ч.1-4, ч. 5 абзац 1; ст. 8; ст. 13 ч. 1, 2, 4; ст. 14-17; ст. 18 ч.1, 7, 8; ст. 21 ч.1; ст. 23 ч. 1, 2, 3; ст24 ч. 1,2; ст. 39\nприложения № 1-4, 6, 8, 9, 10 '}, {'nameNpa': 'ТР ТС 022/2011 «Пищевая продукция в части ее маркировки» \n    \n', 'numberNpa': '09.12.2011', 'title': 'соблюдение требований ст. 1-5, приложение 1-5 '}, {'nameNpa': 'ТР ТС 023/2011 Технический регламент на соковую продукцию из фруктов и овощей\n\n', 'numberNpa': '09.12.2011', 'title': 'соблюдение требований ст. 3, 4, 5; приложения № 1, 2, 3'}, {'nameNpa': 'ТР ТС 033/2013 О безопасности молока и молочной продукции\n\n', 'numberNpa': '09.10.2013', 'title': 'соблюдение требований п. 1-8, п. 30, 32-36, п. 47-59, 60, 62, 65-84, 86-96, 99, 100, 103, 105, 111-114\nприложения № 1-4, 8-11, 13, 16 '}, {'nameNpa': 'ТР ТС 034/2013 «О безопасности мяса и мясной продукции»\n', 'numberNpa': '09.10.2013', 'title': 'соблюдение требований п. 9; п. 10 ч. 1, п. 11-19; п. 59-60; п. 89-98; п. 101, 102, п. 106-126; п. 129, 132, 133, п. 147-149; приложения № 1-5'}, {'nameNpa': 'ТР ЕАЭС 040/2016 О безопасности рыбы и рыбной продукции\n \n', 'numberNpa': '18.10.2016', 'title': 'соблюдение требований раздел IV; раздел V п. 13, п. 15-21; разделы IX, X, раздел XI п. 80-84; раздел XII; приложения № 1-4, 6, 7'}], 'resolved': False, 'resultEmpty': True, 'resultEmptyOrLate': False, 'resultInfoTypeCodes': [], 'resultViolationKnm': False, 'riskCategory': ['чрезвычайно высокий риск'], 'riskCategoryAndDangerClass': ['чрезвычайно высокий риск / Не применяется'], 'sezRegistryExists': False, 'signed': True, 'smevInfoType': None, 'smevMessageType': None, 'smevReceivedAt': None, 'smevReceivedAtEn': None, 'smevReceivedAtMonth': None, 'smevReceivedAtYear': None, 'spvRegistryExists': False, 'startDate': '01.06.2023', 'startDateEn': '2023-06-01', 'status': 'Исключена', 'statusEgrul': 'Найден', 'statusId': 15, 'stopDate': '15.06.2023', 'stopDateEn': '2023-06-15', 'subjectTypeId': 0, 'supervisionType': 'Федеральный государственный санитарно-эпидемиологический контроль (надзор)', 'supervisionTypeId': 4, 'torRegistryExists': False, 'updatePlanDate': None, 'updatePlanDateLong': None, 'version': 'ERKNM', 'violationLawsuitTypeCodes': [], 'violationTypeCodes': [], 'year': 2023}
2023-01-19 12:36:02,970 - [INFO] - direct_sql.py - database_inserts_conductor_for_multiprocessing(133) - 
2023-01-19 12:36:02,970 - [WARNING] - direct_sql.py - new_insert_in_database(269) - Проведена повторная попытка внесения с параметром special, результат неудачный.
2023-01-19 12:36:02,970 - [INFO] - direct_sql.py - database_inserts_conductor_for_multiprocessing(132) - Возникла ошибка, с которой не удалось справиться...
2023-01-19 12:36:02,970 - [INFO] - direct_sql.py - database_inserts_conductor_for_multiprocessing(133) - 
2023-01-19 12:36:02,996 - [ERROR] - direct_sql.py - new_insert_in_database(267) - (1040, 'ny connections')
2023-01-19 12:36:02,996 - [ERROR] - direct_sql.py - new_insert_in_database(267) - (1040, 'ny connections')
2023-01-19 12:36:02,996 - [INFO] - direct_sql.py - new_insert_in_database(268) - {'actCreateDate': None, 'actCreateDateEn': None, 'addresses': ['155550, ОБЛАСТЬ, ИВАНОВСКАЯ, РАЙОН, ПРИВОЛЖСКИЙ, ГОРОД, ПРИВОЛЖСК, УЛИЦА, СОЦИАЛИСТИЧЕСКАЯ, 4, 370130010000093'], 'admLevelId': 50001, 'appealed': False, 'approveDocOrderDate': None, 'approveDocOrderNum': None, 'approveDocRequestDate': None, 'approveDocRequestNum': None, 'approveDocs': [], 'approveRequired': False, 'approved': True, 'approvedErknm': 'Согласовано', 'chlistCount': 0, 'chlistFilledCount': 0, 'chlistFillingIndicationTypeId': [], 'collaboratingOrganizations': [], 'collaboratingOrganizationsIds': [], 'comment': None, 'controllingOrganization': 'Управление Роспотребнадзора по Ивановской области', 'controllingOrganizationId': 10001013491, 'createPlanDate': None, 'createPlanDateLong': None, 'createdByErpDb': False, 'createdById': 175346, 'dataNotEqualEGRUL': False, 'dataSetNotInTime': True, 'deleted': False, 'directDurationDays': None, 'disapprove': False, 'district': 'Ивановская область', 'districtId': 1030240000000001, 'durationDays': 10, 'durationHours': None, 'erknmActViolationIds': [], 'erknmResultKindDecisionIds': [], 'erpId': '37230041000103152422', 'events': [{'startDate': '16.05.2023', 'stopDate': '29.05.2023', 'title': 'Получение письменных объяснений'}, {'startDate': '16.05.2023', 'stopDate': '29.05.2023', 'title': 'Истребование документов'}], 'federalLaw': '248', 'federalLawId': 3, 'fullFieldViolationKnm': False, 'hasViolations': False, 'id': 13224539, 'inn': '3719003888', 'inspectorFullName': [], 'isFromSmev': False, 'isHasApproveDocs': False, 'isHasCollaboratingOrganization': False, 'isHasRequirements': True, 'isHasViolationTerm': False, 'isPm': False, 'kind': 'Документарная проверка', 'knmAnnulled': False, 'knmRejected': False, 'knmType': 'Плановое КНМ', 'knmTypeId': 4, 'legalBasisDocName': [], 'links': [], 'mspCategory': ['Не является субъектом МСП'], 'noPunishment': False, 'notifyLate': False, 'objectsKind': ['Деятельность по организации отдыха детей и их оздоровления, в том числе лагеря с дневным пребыванием'], 'objectsSubKind': ['Деятельность по организации отдыха детей и их оздоровления, в том числе лагеря с дневным пребыванием'], 'objectsType': ['Деятельность и действия'], 'ogrn': '1033700720074', 'oldKnm': None, 'oldPlan': None, 'orderDone': False, 'organizationName': 'МУНИЦИПАЛЬНОЕ БЮДЖЕТНОЕ УЧРЕЖДЕНИЕ ДОПОЛНИТЕЛЬНОГО ОБРАЗОВАНИЯ ЦЕНТР ДЕТСКОГО И ЮНОШЕСКОГО ТВОРЧЕСТВА Г. ПРИВОЛЖСКА', 'organizationsInn': ['3719003888'], 'organizationsName': ['МУНИЦИПАЛЬНОЕ БЮДЖЕТНОЕ УЧРЕЖДЕНИЕ ДОПОЛНИТЕЛЬНОГО ОБРАЗОВАНИЯ ЦЕНТР ДЕТСКОГО И ЮНОШЕСКОГО ТВОРЧЕСТВА Г. ПРИВОЛЖСКА'], 'organizationsOgrn': ['1033700720074'], 'planId': '2023050673', 'prosecutorOrganization': 'Прокуратура Ивановской области', 'prosecutorOrganizationId': 130, 'publishedStatus': 'PUBLISHED', 'reasons': [201], 'reasonsList': [{'assignmentDate': None, 'assignmentDateEn': None, 'assignmentNumber': None, 'date': '04.07.2022', 'dateEn': '2022-07-04', 'requirementDetails': None, 'text': '(ФЗ 248) Истечение установленного федеральным законом о виде контроля, положением о виде контроля период времени с даты окончания проведения последнего планового контрольного (надзорного) мероприятия'}], 'recEmptyOrLate': False, 'regDateEgrul': '25.08.2022', 'regDateEgrulEn': '2022-08-25', 'regLate': False, 'regTypes': [], 'requirements': 4, 'requirementsList': [{'nameNpa': 'None', 'numberNpa': 'None', 'title': 'None'}, {'nameNpa': 'None', 'numberNpa': 'None', 'title': 'None'}, {'nameNpa': 'None', 'numberNpa': 'None', 'title': 'None'}, {'nameNpa': 'None', 'numberNpa': 'None', 'title': 'None'}], 'resolved': False, 'resultEmpty': True, 'resultEmptyOrLate': False, 'resultInfoTypeCodes': [], 'resultViolationKnm': False, 'riskCategory': ['чрезвычайно высокий риск'], 'riskCategoryAndDangerClass': ['чрезвычайно высокий риск'], 'sezRegistryExists': False, 'signed': True, 'smevInfoType': None, 'smevMessageType': None, 'smevReceivedAt': None, 'smevReceivedAtEn': None, 'smevReceivedAtMonth': None, 'smevReceivedAtYear': None, 'spvRegistryExists': False, 'startDate': '16.05.2023', 'startDateEn': '2023-05-16', 'status': 'Ожидает проведения', 'statusEgrul': 'Найден', 'statusId': 5, 'stopDate': '29.05.2023', 'stopDateEn': '2023-05-29', 'subjectTypeId': 0, 'supervisionType': 'Федеральный государственный санитарно-эпидемиологический контроль (надзор)', 'supervisionTypeId': 4, 'torRegistryExists': False, 'updatePlanDate': None, 'updatePlanDateLong': None, 'version': 'ERKNM', 'violationLawsuitTypeCodes': [], 'violationTypeCodes': [], 'year': 2023}
2023-01-19 12:36:02,996 - [INFO] - direct_sql.py - new_insert_in_database(268) - {'actCreateDate': None, 'actCreateDateEn': None, 'addresses': ['671240, РЕСПУБЛИКА БУРЯТИЯ, РАЙОН КАБАНСКИЙ, СЕЛО КРАСНЫЙ ЯР, УЛИЦА САДОВАЯ, 10, -, -'], 'admLevelId': 50001, 'appealed': False, 'approveDocOrderDate': None, 'approveDocOrderNum': None, 'approveDocRequestDate': None, 'approveDocRequestNum': None, 'approveDocs': [], 'approveRequired': False, 'approved': False, 'approvedErknm': 'Отказано', 'chlistCount': 0, 'chlistFilledCount': 0, 'chlistFillingIndicationTypeId': [], 'collaboratingOrganizations': [], 'collaboratingOrganizationsIds': [], 'comment': 'пункты 11 (3), 11 (4) Постановления Правительства Российской Федерации от 10.03.2022 № 336', 'controllingOrganization': 'Управление Роспотребнадзора по Республике Бурятия', 'controllingOrganizationId': 10001012187, 'createPlanDate': None, 'createPlanDateLong': None, 'createdByErpDb': False, 'createdById': 191024, 'dataNotEqualEGRUL': False, 'dataSetNotInTime': False, 'deleted': False, 'directDurationDays': None, 'disapprove': False, 'district': 'Республика Бурятия', 'districtId': 1036810000000001, 'durationDays': 10, 'durationHours': None, 'erknmActViolationIds': [], 'erknmResultKindDecisionIds': [], 'erpId': '03230041000103425909', 'events': [{'startDate': '02.05.2023', 'stopDate': '17.05.2023', 'title': 'Получение письменных объяснений'}, {'startDate': '02.05.2023', 'stopDate': '17.05.2023', 'title': 'Истребование документов'}], 'federalLaw': '248', 'federalLawId': 3, 'fullFieldViolationKnm': False, 'hasViolations': False, 'id': 13498026, 'inn': '0309009513', 'inspectorFullName': [], 'isFromSmev': False, 'isHasApproveDocs': False, 'isHasCollaboratingOrganization': False, 'isHasRequirements': True, 'isHasViolationTerm': False, 'isPm': False, 'kind': 'Документарная проверка', 'knmAnnulled': False, 'knmRejected': False, 'knmType': 'Плановое КНМ', 'knmTypeId': 4, 'legalBasisDocName': [], 'links': [], 'mspCategory': ['Не является субъектом МСП'], 'noPunishment': False, 'notifyLate': False, 'objectsKind': ['Деятельность по организации отдыха детей и их оздоровления, в том числе лагеря с дневным пребыванием'], 'objectsSubKind': ['Деятельность по организации отдыха детей и их оздоровления, в том числе лагеря с дневным пребыванием'], 'objectsType': ['Деятельность и действия'], 'ogrn': '1020300666880', 'oldKnm': None, 'oldPlan': None, 'orderDone': False, 'organizationName': 'МУНИЦИПАЛЬНОЕ АВТОНОМНОЕ ОБЩЕОБРАЗОВАТЕЛЬНОЕ УЧРЕЖДЕНИЕ КРАСНО-ЯРСКАЯ СРЕДНЯЯ ОБЩЕОБРАЗОВАТЕЛЬНАЯ ШКОЛА МО КАБАНСКИЙ РАЙОН РЕСПУБЛИКИ БУРЯТИЯ', 'organizationsInn': ['0309009513'], 'organizationsName': ['МУНИЦИПАЛЬНОЕ АВТОНОМНОЕ ОБЩЕОБРАЗОВАТЕЛЬНОЕ УЧРЕЖДЕНИЕ КРАСНО-ЯРСКАЯ СРЕДНЯЯ ОБЩЕОБРАЗОВАТЕЛЬНАЯ ШКОЛА МО КАБАНСКИЙ РАЙОН РЕСПУБЛИКИ БУРЯТИЯ'], 'organizationsOgrn': ['1020300666880'], 'planId': '2023058837', 'prosecutorOrganization': 'Прокуратура Республики Бурятия', 'prosecutorOrganizationId': 2511, 'publishedStatus': 'UNPUBLISHED', 'reasons': [204], 'reasonsList': [{'assignmentDate': None, 'assignmentDateEn': None, 'assignmentNumber': None, 'date': '20.06.2019', 'dateEn': '2019-06-20', 'requirementDetails': None, 'text': '(ФЗ 248) Истечение установленного федеральным законом о виде контроля, положением о виде контроля периода времени с даты иного события, установленного федеральным законом о виде контроля, положением о виде контроля, которое ведет к возникновению объекта контроля'}], 'recEmptyOrLate': False, 'regDateEgrul': '15.09.2022', 'regDateEgrulEn': '2022-09-15', 'regLate': False, 'regTypes': [], 'requirements': 17, 'requirementsList': [{'nameNpa': 'None', 'numberNpa': 'None', 'title': 'None'}, {'nameNpa': 'None', 'numberNpa': 'None', 'title': 'None'}, {'nameNpa': 'None', 'numberNpa': 'None', 'title': 'None'}, {'nameNpa': 'None', 'numberNpa': 'None', 'title': 'None'}, {'nameNpa': 'None', 'numberNpa': 'None', 'title': 'None'}, {'nameNpa': 'None', 'numberNpa': 'None', 'title': 'None'}, {'nameNpa': 'None', 'numberNpa': 'None', 'title': 'None'}, {'nameNpa': 'None', 'numberNpa': 'None', 'title': 'None'}, {'nameNpa': 'None', 'numberNpa': 'None', 'title': 'None'}, {'nameNpa': 'None', 'numberNpa': 'None', 'title': 'None'}, {'nameNpa': 'None', 'numberNpa': 'None', 'title': 'None'}, {'nameNpa': 'None', 'numberNpa': 'None', 'title': 'None'}, {'nameNpa': 'None', 'numberNpa': 'None', 'title': 'None'}, {'nameNpa': 'None', 'numberNpa': 'None', 'title': 'None'}, {'nameNpa': 'None', 'numberNpa': 'None', 'title': 'None'}, {'nameNpa': 'None', 'numberNpa': 'None', 'title': 'None'}, {'nameNpa': 'None', 'numberNpa': 'None', 'title': 'None'}], 'resolved': False, 'resultEmpty': True, 'resultEmptyOrLate': False, 'resultInfoTypeCodes': [], 'resultViolationKnm': False, 'riskCategory': ['чрезвычайно высокий риск'], 'riskCategoryAndDangerClass': ['чрезвычайно высокий риск'], 'sezRegistryExists': False, 'signed': True, 'smevInfoType': None, 'smevMessageType': None, 'smevReceivedAt': None, 'smevReceivedAtEn': None, 'smevReceivedAtMonth': None, 'smevReceivedAtYear': None, 'spvRegistryExists': False, 'startDate': '02.05.2023', 'startDateEn': '2023-05-02', 'status': 'Исключена', 'statusEgrul': 'Найден', 'statusId': 15, 'stopDate': '17.05.2023', 'stopDateEn': '2023-05-17', 'subjectTypeId': 0, 'supervisionType': 'Федеральный государственный санитарно-эпидемиологический контроль (надзор)', 'supervisionTypeId': 4, 'torRegistryExists': False, 'updatePlanDate': None, 'updatePlanDateLong': None, 'version': 'ERKNM', 'violationLawsuitTypeCodes': [], 'violationTypeCodes': [], 'year': 2023}
2023-01-19 12:36:02,996 - [ERROR] - direct_sql.py - new_insert_in_database(267) - (1040, 'ny connections')
торная попытка внесения с параметром special, результат неудачный.
2023-01-19 12:36:02,996 - [WARNING] - direct_sql.py - new_insert_in_database(269) - Проведена повторная попытка внесения с параметром special, результат неудачный.
2023-01-19 12:36:02,996 - [INFO] - direct_sql.py - database_inserts_conductor_for_multiprocessing(132) - Возникла ошибка, с которой не удалось справиться...
2023-01-19 12:36:02,996 - [INFO] - direct_sql.py - database_inserts_conductor_for_multiprocessing(132) - Возникла ошибка, с которой не удалось справиться...
2023-01-19 12:36:02,997 - [INFO] - direct_sql.py - database_inserts_conductor_for_multiprocessing(133) - 
2023-01-19 12:36:02,997 - [INFO] - direct_sql.py - database_inserts_conductor_for_multiprocessing(133) - 
2023-01-19 12:36:02,996 - [INFO] - direct_sql.py - new_insert_in_database(268) - {'actCreateDate': None, 'actCreateDateEn': None, 'addresses': ['169300, РЕСПУБЛИКА КОМИ, ГОРОД УХТА, УЛИЦА 30 ЛЕТ ОКТЯБРЯ, 6 А, ', 'Республика Коми, г. Ухта, ул. 30 лет Октября, д.6А\n'], 'admLevelId': 50001, 'appealed': False, 'approveDocOrderDate': None, 'approveDocOrderNum': None, 'approveDocRequestDate': None, 'approveDocRequestNum': None, 'approveDocs': [], 'approveRequired': False, 'approved': False, 'approvedErknm': 'Отказано', 'chlistCount': 2, 'chlistFilledCount': 2, 'chlistFillingIndicationTypeId': [], 'collaboratingOrganizations': [], 'collaboratingOrganizationsIds': [], 'comment': 'в силу положений п. 11(4) постановления Правительства Российской Федерации от 10.03.2022 № 336 в планы проведения плановых КНМ не подлежат включению плановые КНМ  в отношении государственных и муниципальных учреждений дошкольного и начального общего, основного общего и среднего общего образования, объекты контроля которых отнесены к категориям чрезвычайно высокого и высокого риска', 'controllingOrganization': 'Управление Роспотребнадзора по Республике Коми', 'controllingOrganizationId': 10001016637, 'createPlanDate': None, 'createPlanDateLong': None, 'createdByErpDb': False, 'createdById': 160403, 'dataNotEqualEGRUL': False, 'dataSetNotInTime': False, 'deleted': False, 'directDurationDays': None, 'disapprove': False, 'district': 'Республика Коми', 'districtId': 1031870000000001, 'durationDays': 10, 'durationHours': None, 'erknmActViolationIds': [], 'erknmResultKindDecisionIds': [], 'erpId': '11230041000103538878', 'events': [{'startDate': '05.06.2023', 'stopDate': '19.06.2023', 'title': 'Осмотр'}, {'startDate': '05.06.2023', 'stopDate': '19.06.2023', 'title': 'Опрос'}, {'startDate': '05.06.2023', 'stopDate': '19.06.2023', 'title': 'Получение письменных объяснений'}, {'startDate': '05.06.2023', 'stopDate': '19.06.2023', 'title': 'Истребование документов'}, {'startDate': '05.06.2023', 'stopDate': '19.06.2023', 'title': 'Отбор проб (образцов)'}, {'startDate': '05.06.2023', 'stopDate': '19.06.2023', 'title': 'Испытание'}, {'startDate': '05.06.2023', 'stopDate': '19.06.2023', 'title': 'Экспертиза'}], 'federalLaw': '248', 'federalLawId': 3, 'fullFieldViolationKnm': False, 'hasViolations': False, 'id': 13610995, 'inn': '1102024637', 'inspectorFullName': [], 'isFromSmev': False, 'isHasApproveDocs': False, 'isHasCollaboratingOrganization': False, 'isHasRequirements': True, 'isHasViolationTerm': False, 'isPm': False, 'kind': 'Выездная проверка', 'knmAnnulled': False, 'knmRejected': False, 'knmType': 'Плановое КНМ', 'knmTypeId': 4, 'legalBasisDocName': [], 'links': [], 'mspCategory': ['Не является субъектом МСП'], 'noPunishment': False, 'notifyLate': False, 'objectsKind': ['Деятельность по организации отдыха детей и их оздоровления, в том числе лагеря с дневным пребыванием', 'Деятельность по организации отдыха детей и их оздоровления, в том числе лагеря с дневным пребыванием'], 'objectsSubKind': ['Деятельность по организации отдыха детей и их оздоровления, в том числе лагеря с дневным пребыванием', 'Деятельность по организации отдыха детей и их оздоровления, в том числе лагеря с дневным пребыванием'], 'objectsType': ['Деятельность и действия', 'Деятельность и действия'], 'ogrn': '1021100740066', 'oldKnm': None, 'oldPlan': None, 'orderDone': False, 'organizationName': 'МУНИЦИПАЛЬНОЕ ОБЩЕОБРАЗОВАТЕЛЬНОЕ УЧРЕЖДЕНИЕ НАЧАЛЬНАЯ ШКОЛА-ДЕТСКИЙ САД №1', 'organizationsInn': ['1102024637'], 'organizationsName': ['МУНИЦИПАЛЬНОЕ ОБЩЕОБРАЗОВАТЕЛЬНОЕ УЧРЕЖДЕНИЕ НАЧАЛЬНАЯ ШКОЛА-ДЕТСКИЙ САД №1'], 'organizationsOgrn': ['1021100740066'], 'planId': '2023059758', 'prosecutorOrganization': 'Прокуратура Республики Коми', 'prosecutorOrganizationId': 654, 'publishedStatus': 'UNPUBLISHED', 'reasons': [204], 'reasonsList': [{'assignmentDate': None, 'assignmentDateEn': None, 'assignmentNumber': None, 'date': '01.06.2023', 'dateEn': '2023-06-01', 'requirementDetails': None, 'text': '(ФЗ 248) Истечение установленного федеральным законом о виде контроля, положением о виде контроля периода времени с даты иного события, установленного федеральным законом о виде контроля, положением о виде контроля, которое ведет к возникновению объекта контроля'}], 'recEmptyOrLate': False, 'regDateEgrul': '21.09.2022', 'regDateEgrulEn': '2022-09-21', 'regLate': False, 'regTypes': [], 'requirements': 1, 'requirementsList': [{'nameNpa': 'Федеральный закон №52-ФЗ от 30.03.1999 г. «О санитарно-эпидемиологическом благополучии населения» (ст.15, ст.17, ст.19, ст.21, ст.22, ст.24, ст.28, ст.29, ст.31, ст.32, ст.34, ст.36);\n- Федеральный закон от 24.07.1998г. № 124-ФЗ «Об основных гарантиях прав ребенка в Российской Федерации» (п.2 ст. 12);\n- Федеральный закон от 02.01.2000г. № 29-ФЗ «О качестве и безопасности пищевых продуктов» (п.1-3 ст. 3; п.1, 2 ст.5; п. 1, 3 ст.9; ст.15; ст.17; ст.20; ст.23; ст.24; п.1 ст.25.1; ст.25.2);\n- Федеральный закон от 23.02.2013г. №15-ФЗ «Об охране здоровья граждан от воздействия окружающего табачного дыма, последствий потребления табака или потребления никотинсодержащей продукции» (ст. 12, ст.20);\n- Федеральный закон от 17.09.1998 г. №157-ФЗ «Об иммунопрофилактике инфекционных болезней» (ст. 9, п. 4 ст.11);\n- Федеральный закон от 18.06.2001г. № 77-ФЗ «О предупреждении распро-странения туберкулёза в Российской Федерации» (п.п. 3, 4 ст. 8);\n- Федеральный закон от 24.06.1998 № 89-ФЗ Об отходах производства и потребления (ч.ч.1, 3 ст.13.4);\n- Технический регламент Таможенного союза «О безопасности пищевой продукции» ТР ТС 021/2011 (за исключением статьи 6, абзацев 2, 7, 12-14 части 5 статьи 7, части 3 статьи 13, части 2 статьи 18, статей 30 и 40); \n- Технический регламент Таможенного союза «Пищевая продукция в части её маркировки» ТР ТС 022/2011;\n- Технический регламент Таможенного союза «Технический регламент на соковую продукцию из фруктов и овощей» ТР ТС 023/2011 (ст. 3 - ст. 8);\n- Технический регламент Таможенного союза «Технический регламент на масложировую продукцию» ТР ТС 024/2011;\n- Технический регламент Таможенного союза «О безопасности мебельной продукции» ТР ТС 025/2012 (ст. 4 – ст.7);\n- Технический регламент Таможенного союза «О безопасности отдельных видов специализированной пищевой продукции, в том числе диетического, лечебного и диетического профилактического питания» ТР ТС 027/2012;\n- Технический регламент Таможенного союза «Требования безопасности пищевых добавок, ароматизаторов и технологических вспомогательных средств» ТР ТС 029/2012;\n- Технический регламент Таможенного союза «О безопасности молока и молочной продукции» ТР ТС 033/2013 (за исключением пунктов 13, 14, 97, 98 и 115);\n- Технический регламент Таможенного союза «О безопасности мяса и мясной продукции» ТР ТС 034/2013 (за исключением пунктов 1-8, 26-48, 53, 54 и абзаца 2 пункта 99);\n- Разделы IV и V (за исключением пункта 14), VIII, IX, X, XI (за исключе-нием пунктов 85, 86), XII Технического регламента Евразийского экономического союза «О безопасности рыбы и рыбной продукции» ТР ЕАЭС 040/2016;\n- разделы III, IV, V, VI, VII и X Технического регламента Евразийского эко-номического союза «О безопасности упакованной питьевой воды, включая природную минеральную воду» ТР ЕАЭС 044/2017; \n- Технический регламент Таможенного союза «О безопасности игрушек» ТР ТС 008/2011 (ст. 3 – ст. 7); \n- Технический регламент Таможенного союза «О безопасности продукции, предназначенной для детей и подростков» ТР ТС 007/2011 (ст. 3 – ст. 11, ст 13);\n- раздел IV, пункты 15, 16, подпункты а, д пункта 18 раздела VI, пункт 49 раздела VIII, разделы IX и X в части требований к покрытию для детских игровых площадок и связанным с ним процессам Технического регламента Евразийского экономического союза О безопасности оборудования для детских игровых площадок ТР ЕАЭС 042/2017; \n- Единые санитарно-эпидемиологические и гигиенические требования к то-варам, подлежащим санитарно-эпидемиологическому надзору (контролю), утвержденные решением Комиссии Таможенного союза 28.05.2010 № 299;   \n- СП 2.4.3648-20 Санитарно-эпидемиологические требования к организациям воспитания и обучения, отдыха и оздоровления детей и молодежи\n- СП 3.1/2.4.3598-20 «Санитарно-эпидемиологические требования к устрой-ству, содержанию и организации работы образовательных организаций и других объектов социальной инфраструктуры для детей и молодежи в усло-виях распространения новой коронавирусной инфекции (COVID-19)»; \n- СанПиН 2.3/2.4.3590-20 «Санитарно-эпидемиологические требования к организации общественного питания населения»;\n- СанПиН 1.2.3685-21 «Гигиенические нормативы и требования к обеспече-нию безопасности и (или) безвредности для человека факторов среды обитания»;\n- СанПиН 2.1.3684-21 «Санитарно-эпидемиологические требования к содержанию территорий городских и сельских поселений, к водным объектам, питьевой воде и питьевому водоснабжению, атмосферному воздуху, почвам, жилым помещениям, эксплуатации производственных, общественных помещений, организации и проведению санитарно-противоэпидемических (профилактических) мероприятий»;\n- СП 3.1.3597-20 Профилактика новой коронавирусной инфекции (COVID-19)\n- СанПиН 3.3686-21 Санитарно-эпидемиологические требования по профилактике инфекционных болезней; \n- СП 2.2.3670-20 «Санитарно-эпидемиологические требования к условиям труда»;\n- приказ Министерства труда и социальной защиты Российской Федерации и Министерства здравоохранения Российской Федерации от 31.12.2020 г. № 988н/1420н «Об утверждении перечня вредных и (или) опасных производственных факторов и работ, при выполнении которых проводятся обязательные предварительные медицинские осмотры при поступлении на работу и периодические медицинские осмотры»;\n- приказ Министерства здравоохранения Российской Федерации от 28.01.2021 года № 29н «Об утверждении Порядка проведения обязательных предварительных и периодических медицинских осмотров работников, предусмотренных частью четвертой статьи 213 Трудового кодекса Российской Федерации, перечня медицинских противопоказаний к осуществлению работ с вредными и (или) опасными производственными факторами, а также работам, при выполнении которых проводятся обязательные предварительные и периодические медицинские осмотры»\n\n', 'numberNpa': '30.03.1999', 'title': 'Соблюдение обязательных требований'}], 'resolved': False, 'resultEmpty': True, 'resultEmptyOrLate': False, 'resultInfoTypeCodes': [], 'resultViolationKnm': False, 'riskCategory': ['чрезвычайно высокий риск', 'чрезвычайно высокий риск'], 'riskCategoryAndDangerClass': ['чрезвычайно высокий риск / Первый', 'чрезвычайно высокий риск / Первый'], 'sezRegistryExists': False, 'signed': True, 'smevInfoType': None, 'smevMessageType': None, 'smevReceivedAt': None, 'smevReceivedAtEn': None, 'smevReceivedAtMonth': None, 'smevReceivedAtYear': None, 'spvRegistryExists': False, 'startDate': '05.06.2023', 'startDateEn': '2023-06-05', 'status': 'Исключена', 'statusEgrul': 'Найден', 'statusId': 15, 'stopDate': None, 'stopDateEn': None, 'subjectTypeId': 0, 'supervisionType': 'Федеральный государственный санитарно-эпидемиологический контроль (надзор)', 'supervisionTypeId': 4, 'torRegistryExists': False, 'updatePlanDate': None, 'updatePlanDateLong': None, 'version': 'ERKNM', 'violationLawsuitTypeCodes': [], 'violationTypeCodes': [], 'year': 2023}
2023-01-19 12:36:02,997 - [WARNING] - direct_sql.py - new_insert_in_database(269) - Проведена повторная попытка внесения с параметром special, результат неудачный.
2023-01-19 12:36:02,997 - [INFO] - direct_sql.py - database_inserts_conductor_for_multiprocessing(132) - Возникла ошибка, с которой не удалось справиться...
2023-01-19 12:36:02,998 - [INFO] - direct_sql.py - database_inserts_conductor_for_multiprocessing(133) - 
2023-01-19 12:36:03,012 - [ERROR] - direct_sql.py - new_insert_in_database(267) - (1040, 'ny connections')
2023-01-19 12:36:03,013 - [ERROR] - direct_sql.py - new_insert_in_database(267) - (1040, 'ny connections')
2023-01-19 12:36:03,013 - [INFO] - direct_sql.py - new_insert_in_database(268) - {'actCreateDate': None, 'actCreateDateEn': None, 'addresses': ['155044, ОБЛАСТЬ ИВАНОВСКАЯ, РАЙОН ТЕЙКОВСКИЙ, ДЕРЕВНЯ БОЛЬШОЕ КЛОЧКОВО, УЛИЦА ЦЕНТРАЛЬНАЯ, 53 А, ', '155044, ОБЛАСТЬ ИВАНОВСКАЯ, РАЙОН ТЕЙКОВСКИЙ, ДЕРЕВНЯ БОЛЬШОЕ КЛОЧКОВО, УЛИЦА СОВХОЗНАЯ, 11 А, '], 'admLevelId': 50001, 'appealed': False, 'approveDocOrderDate': None, 'approveDocOrderNum': None, 'approveDocRequestDate': None, 'approveDocRequestNum': None, 'approveDocs': [], 'approveRequired': False, 'approved': False, 'approvedErknm': 'Отказано', 'chlistCount': 0, 'chlistFilledCount': 0, 'chlistFillingIndicationTypeId': [], 'collaboratingOrganizations': [], 'collaboratingOrganizationsIds': [], 'comment': 'п. 11 (4) Постановления Правительства РФ от 10.03.2022 № 336', 'controllingOrganization': 'Управление Роспотребнадзора по Ивановской области', 'controllingOrganizationId': 10001013491, 'createPlanDate': None, 'createPlanDateLong': None, 'createdByErpDb': False, 'createdById': 160995, 'dataNotEqualEGRUL': False, 'dataSetNotInTime': False, 'deleted': False, 'directDurationDays': None, 'disapprove': False, 'district': 'Ивановская область', 'districtId': 1030240000000001, 'durationDays': 10, 'durationHours': None, 'erknmActViolationIds': [], 'erknmResultKindDecisionIds': [], 'erpId': '37230041000102886045', 'events': [{'startDate': '12.05.2023', 'stopDate': '25.05.2023', 'title': 'Получение письменных объяснений'}, {'startDate': '12.05.2023', 'stopDate': '25.05.2023', 'title': 'Истребование документов'}], 'federalLaw': '248', 'federalLawId': 3, 'fullFieldViolationKnm': False, 'hasViolations': False, 'id': 12958162, 'inn': '3724003435', 'inspectorFullName': [], 'isFromSmev': False, 'isHasApproveDocs': False, 'isHasCollaboratingOrganization': False, 'isHasRequirements': True, 'isHasViolationTerm': False, 'isPm': False, 'kind': 'Документарная проверка', 'knmAnnulled': False, 'knmRejected': False, 'knmType': 'Плановое КНМ', 'knmTypeId': 4, 'legalBasisDocName': [], 'links': [], 'mspCategory': ['Не является субъектом МСП'], 'noPunishment': False, 'notifyLate': False, 'objectsKind': ['Деятельность по организации отдыха детей и их оздоровления, в том числе лагеря с дневным пребыванием', 'Деятельность по организации отдыха детей и их оздоровления, в том числе лагеря с дневным пребыванием'], 'objectsSubKind': ['Деятельность по организации отдыха детей и их оздоровления, в том числе лагеря с дневным пребыванием', 'Деятельность по организации отдыха детей и их оздоровления, в том числе лагеря с дневным пребыванием'], 'objectsType': ['Деятельность и действия', 'Деятельность и действия'], 'ogrn': '1023701789814', 'oldKnm': None, 'oldPlan': None, 'orderDone': False, 'organizationName': 'МУНИЦИПАЛЬНОЕ КАЗЕННОЕ ОБЩЕОБРАЗОВАТЕЛЬНОЕ УЧРЕЖДЕНИЕ ТЕЙКОВСКОГО МУНИЦИПАЛЬНОГО РАЙОНА БОЛЬШЕКЛОЧКОВСКАЯ СРЕДНЯЯ ОБЩЕОБРАЗОВАТЕЛЬНАЯ ШКОЛА', 'organizationsInn': ['3724003435'], 'organizationsName': ['МУНИЦИПАЛЬНОЕ КАЗЕННОЕ ОБЩЕОБРАЗОВАТЕЛЬНОЕ УЧРЕЖДЕНИЕ ТЕЙКОВСКОГО МУНИЦИПАЛЬНОГО РАЙОНА БОЛЬШЕКЛОЧКОВСКАЯ СРЕДНЯЯ ОБЩЕОБРАЗОВАТЕЛЬНАЯ ШКОЛА'], 'organizationsOgrn': ['1023701789814'], 'planId': '2023050673', 'prosecutorOrganization': 'Прокуратура Ивановской области', 'prosecutorOrganizationId': 130, 'publishedStatus': 'UNPUBLISHED', 'reasons': [201], 'reasonsList': [{'assignmentDate': None, 'assignmentDateEn': None, 'assignmentNumber': None, 'date': '17.05.2022', 'dateEn': '2022-05-17', 'requirementDetails': None, 'text': '(ФЗ 248) Истечение установленного федеральным законом о виде контроля, положением о виде контроля период времени с даты окончания проведения последнего планового контрольного (надзорного) мероприятия'}], 'recEmptyOrLate': False, 'regDateEgrul': '16.08.2022', 'regDateEgrulEn': '2022-08-16', 'regLate': False, 'regTypes': [], 'requirements': 8, 'requirementsList': [{'nameNpa': 'Федеральный закон № 52-ФЗ от 30.03.1999 «О санитарно-эпидемиологическом благополучии населения» (ст.12, ст.13, ст.14, ст.15, ст.16, ст.17, ст.18, ст.19, ст.20, ст.21, ст.22, ст.23, ст.24, ст.25, ст.26, ст.27, ст.28, ст.29, ст.30, ст.31, ст.32, ст.33, ст.34, ст.36, ст.40, ст.41, ст.43, п.4 ст.44.1)', 'numberNpa': '30.03.1999', 'title': 'требования санитарного законодательства'}, {'nameNpa': 'Приказ Министерства здравоохранения Российской Федерации № 29н Об утверждении Порядка проведения обязательных предварительных и периодических медицинских осмотров работников, предусмотренных частью четвертой статьи 213 Трудового кодекса Российской Федерации, перечня медицинских противопоказаний к осуществлению работ с вредными и (или) опасными производственными факторами, а также работам, при выполнении которых проводятся обязательные предварительные и периодические медицинские осмотры (п. 4.1 приложения к Порядку проведения обязательных предварительных и периодических медицинских осмотров работников, предусмотренных частью четвертой статьи 213 Трудового кодекса Российской Федерации) ', 'numberNpa': '28.01.2021', 'title': 'требования санитарного законодательства'}, {'nameNpa': 'СП 2.4.3648-20 «Санитарно-эпидемиологические требования к организациям воспитания и обучения, отдыха и оздоровления детей и молодежи» (весь документ) ', 'numberNpa': '28.09.2020', 'title': 'требования санитарного законодательства'}, {'nameNpa': 'СанПиН 2.3/2.4.3590-20 «Санитарно-эпидемиологические требования к организации общественного питания населения» (весь документ) ', 'numberNpa': '27.10.2020', 'title': 'требования санитарного законодательства'}, {'nameNpa': 'СП 3.1./2.4.3598-20 «Санитарно-эпидемиологические требования к устройству, содержанию и организации работы образовательных организаций и других объектов социальной инфраструктуры для детей и молодежи в условиях распространения новой коронавирусной инфекции (COVID-19)» (весь документ) ', 'numberNpa': '30.06.2020', 'title': 'требования санитарного законодательства'}, {'nameNpa': 'СанПиН 1.2.3685-21 «Гигиенические нормативы и требования к обеспечению безопасности и (или) безвредности для человека факторов среды обитания» (весь документ) ', 'numberNpa': '28.01.2021', 'title': 'требования санитарного законодательства'}, {'nameNpa': 'СанПиН 2.1.3684-21 «Санитарно-эпидемиологические требования к содержанию территорий городских и сельских поселений, к водным объектам, питьевой воде и питьевому водоснабжению, атмосферному воздуху, почвам, жилым помещениям, эксплуатации производственных, общественных помещений, организации и проведению санитарно-противоэпидемиологических (профилактических) мероприятий» (весь документ) ', 'numberNpa': '28.01.2021', 'title': 'требования санитарного законодательства'}, {'nameNpa': 'СанПиН 3.3686-21 Санитарно-эпидемиологические требования по профилактике инфекционных болезней (весь документ) ', 'numberNpa': '28.01.2021', 'title': 'требования санитарного законодательства'}], 'resolved': False, 'resultEmpty': True, 'resultEmptyOrLate': False, 'resultInfoTypeCodes': [], 'resultViolationKnm': False, 'riskCategory': ['чрезвычайно высокий риск', 'чрезвычайно высокий риск'], 'riskCategoryAndDangerClass': ['чрезвычайно высокий риск', 'чрезвычайно высокий риск'], 'sezRegistryExists': False, 'signed': True, 'smevInfoType': None, 'smevMessageType': None, 'smevReceivedAt': None, 'smevReceivedAtEn': None, 'smevReceivedAtMonth': None, 'smevReceivedAtYear': None, 'spvRegistryExists': False, 'startDate': '12.05.2023', 'startDateEn': '2023-05-12', 'status': 'Исключена', 'statusEgrul': 'Найден', 'statusId': 15, 'stopDate': '25.05.2023', 'stopDateEn': '2023-05-25', 'subjectTypeId': 0, 'supervisionType': 'Федеральный государственный санитарно-эпидемиологический контроль (надзор)', 'supervisionTypeId': 4, 'torRegistryExists': False, 'updatePlanDate': None, 'updatePlanDateLong': None, 'version': 'ERKNM', 'violationLawsuitTypeCodes': [], 'violationTypeCodes': [], 'year': 2023}
2023-01-19 12:36:03,013 - [INFO] - direct_sql.py - new_insert_in_database(268) - {'actCreateDate': None, 'actCreateDateEn': None, 'addresses': ['305000, ОБЛАСТЬ, КУРСКАЯ, ГОРОД, КУРСК, УЛИЦА, КИРОВА, 22, 460000010000266'], 'admLevelId': 50001, 'appealed': False, 'approveDocOrderDate': None, 'approveDocOrderNum': None, 'approveDocRequestDate': None, 'approveDocRequestNum': None, 'approveDocs': [], 'approveRequired': False, 'approved': False, 'approvedErknm': 'Отказано', 'chlistCount': 1, 'chlistFilledCount': 1, 'chlistFillingIndicationTypeId': [], 'collaboratingOrganizations': [], 'collaboratingOrganizationsIds': [], 'comment': 'На основании пункта 11(4) постановления Правительства РФ от 10.03.2022 № 336 в планы проведения плановых КНМ на 2023 год не включаются КНМ в отношении государственных и муниципальных учреждений дошкольного и начального общего образования, основного общего и среднего общего образования, объекты которых отнесены к категориям чрезвычайно высокого и высокого риска.', 'controllingOrganization': 'Управления Роспотребнадзора по Курской области', 'controllingOrganizationId': 10001017235, 'createPlanDate': None, 'createPlanDateLong': None, 'createdByErpDb': False, 'createdById': 161797, 'dataNotEqualEGRUL': False, 'dataSetNotInTime': False, 'deleted': False, 'directDurationDays': None, 'disapprove': False, 'district': 'Курская область', 'districtId': 1030380000000001, 'durationDays': 10, 'durationHours': 75, 'erknmActViolationIds': [], 'erknmResultKindDecisionIds': [], 'erpId': '46230041000103121643', 'events': [{'startDate': '01.06.2023', 'stopDate': '15.06.2023', 'title': 'Осмотр'}, {'startDate': '01.06.2023', 'stopDate': '15.06.2023', 'title': 'Истребование документов'}, {'startDate': '01.06.2023', 'stopDate': '15.06.2023', 'title': 'Отбор проб (образцов)'}, {'startDate': '01.06.2023', 'stopDate': '15.06.2023', 'title': 'Инструментальное обследование'}, {'startDate': '01.06.2023', 'stopDate': '15.06.2023', 'title': 'Испытание'}, {'startDate': '01.06.2023', 'stopDate': '15.06.2023', 'title': 'Экспертиза'}], 'federalLaw': '248', 'federalLawId': 3, 'fullFieldViolationKnm': False, 'hasViolations': False, 'id': 13193760, 'inn': '4629020224', 'inspectorFullName': [], 'isFromSmev': False, 'isHasApproveDocs': False, 'isHasCollaboratingOrganization': False, 'isHasRequirements': True, 'isHasViolationTerm': False, 'isPm': False, 'kind': 'Выездная проверка', 'knmAnnulled': False, 'knmRejected': False, 'knmType': 'Плановое КНМ', 'knmTypeId': 4, 'legalBasisDocName': [], 'links': [], 'mspCategory': ['Не является субъектом МСП'], 'noPunishment': False, 'notifyLate': False, 'objectsKind': ['Деятельность по организации отдыха детей и их оздоровления, в том числе лагеря с дневным пребыванием'], 'objectsSubKind': ['Деятельность по организации отдыха детей и их оздоровления, в том числе лагеря с дневным пребыванием'], 'objectsType': ['Деятельность и действия'], 'ogrn': '1024600972220', 'oldKnm': None, 'oldPlan': None, 'orderDone': False, 'organizationName': 'МУНИЦИПАЛЬНОЕ БЮДЖЕТНОЕ ОБЩЕОБРАЗОВАТЕЛЬНОЕ УЧРЕЖДЕНИЕ ГИМНАЗИЯ № 4', 'organizationsInn': ['4629020224'], 'organizationsName': ['МУНИЦИПАЛЬНОЕ БЮДЖЕТНОЕ ОБЩЕОБРАЗОВАТЕЛЬНОЕ УЧРЕЖДЕНИЕ ГИМНАЗИЯ № 4'], 'organizationsOgrn': ['1024600972220'], 'planId': '2023050566', 'prosecutorOrganization': 'Прокуратура Курской области', 'prosecutorOrganizationId': 214, 'publishedStatus': 'UNPUBLISHED', 'reasons': [201], 'reasonsList': [{'assignmentDate': None, 'assignmentDateEn': None, 'assignmentNumber': None, 'date': '20.06.2022', 'dateEn': '2022-06-20', 'requirementDetails': None, 'text': '(ФЗ 248) Истечение установленного федеральным законом о виде контроля, положением о виде контроля период времени с даты окончания проведения последнего планового контрольного (надзорного) мероприятия'}], 'recEmptyOrLate': False, 'regDateEgrul': '23.08.2022', 'regDateEgrulEn': '2022-08-23', 'regLate': False, 'regTypes': [], 'requirements': 8, 'requirementsList': [{'nameNpa': 'Федеральный закон О санитарно-эпидемиологическом благополучии населения от 30.03.1999 N 52-ФЗ', 'numberNpa': '30.03.1999', 'title': 'соблюдение требований \nст.12, ст.13, ст.14, ст.15, ст.16, ст.17, ст.18, ст.19, ст.20, ст.21, ст.22, ст.23, ст.24, ст.25, ст.26, ст.27, ст.28, ст.29, ст.30, ст.31, ст.32, ст.33, ст.34, ст.36, ст.40, ст.41'}, {'nameNpa': 'Приказ Минздрава России от 28.01.2021 N 29н «Об утверждении Порядка проведения обязательных предварительных и периодических медицинских осмотров работников, предусмотренных частью четвертой статьи 213 Трудового кодекса Российской Федерации, перечня медицинских противопоказаний к осуществлению работ с вредными и (или) опасными производственными факторами, а также работам, при выполнении которых проводятся обязательные предварительные и периодические медицинские осмотры» ', 'numberNpa': '28.01.2021', 'title': 'соблюдение требований п. 4.1 приложения к Порядку проведения обязательных предварительных и периодических медицинских осмотров работников, предусмотренных частью четвертой статьи 213 Трудового кодекса Российской Федерации'}, {'nameNpa': 'Федеральный закон Об отходах производства и потребления от 24.06.1998 N 89-ФЗ ', 'numberNpa': '24.06.1998', 'title': 'соблюдение требований ч.1 ст.13, ч.1, 3, ст.13.4, ч.1,2 ст.16'}, {'nameNpa': 'СанПиН 3.3686-21 Санитарно-эпидемиологические требования по профилактике инфекционных болезней  ', 'numberNpa': '28.01.2021', 'title': 'соблюдение требований п. п. 5,9-11,13-78,21,22,24,26,35,36,38-42,52-54,58,62-65,72,75-78,79-89,90-94,98-107,108,109,110,111,114,115,116,117,126,130,752,764,784,808,823,901,1862,1880,1881,1884,1885,1887,1888,1890,1895,1896,1898,1900,1905,1997,1999,2001,\n2008,2180,2181,2182,2183,2190,2368,2369,2386,2387,2388,2401,2405,2406,2417,2426,2513,2516,2518,2519,2612,2613,2614,2616,2623,2624,2631,2665,2666,\n2667,2677,2678,2679,2680,2681,2686,2694,2695,2696,2709,2708,2709.2710,\n2743,2747,2751,2820,2850,2851,2891,2903,2905,2963,3020,3071,3131,3148,\n3149,3150,3151,3152,3153,3157,3263,3264,3267,3268,3271,3307,3366,3367,\n3368,3369,3371,3372,3373,3390 '}, {'nameNpa': 'СП 2.4.3648-20 «Санитарно – эпидемиологические требования к организациям воспитания и обучения, отдыха и оздоровления детей и молодежи» ', 'numberNpa': '28.09.2020', 'title': 'соблюдение требований п.1.1- п. 2.11.9.; п.3.11- п.3.11.11.'}, {'nameNpa': 'СанПиН 2.3./2.4.3590-20 «Санитарно – эпидемиологические требования к организации общественного питания населения»  ', 'numberNpa': '27.10.2020', 'title': 'соблюдение требований п.1.1. – п.5.2.; п.8.1.- п. 8.7.6., приложение 1-13   '}, {'nameNpa': 'СанПиН 1.2.3685-21 «Гигиенические нормативы и требования к обеспечению безопасности и (или) безвредности для человека факторов среды обитания» : \n', 'numberNpa': '28.01.2021', 'title': 'соблюдение требований раздел V, раздел VI  \n'}, {'nameNpa': 'СП 3.1/2.4.3598-20 «Санитарно – эпидемиологические требования к устройству, содержанию и организации работы образовательных организаций и других объектов социальной инфраструктуры для детей и молодежи в условиях распространении новой \nкоронавирусной инфекции (COVID-19): \n', 'numberNpa': '30.06.2020', 'title': 'соблюдение требований п.1.1.- п.2.7., п.3.1. '}], 'resolved': False, 'resultEmpty': True, 'resultEmptyOrLate': False, 'resultInfoTypeCodes': [], 'resultViolationKnm': False, 'riskCategory': ['чрезвычайно высокий риск'], 'riskCategoryAndDangerClass': ['чрезвычайно высокий риск / Не применяется'], 'sezRegistryExists': False, 'signed': True, 'smevInfoType': None, 'smevMessageType': None, 'smevReceivedAt': None, 'smevReceivedAtEn': None, 'smevReceivedAtMonth': None, 'smevReceivedAtYear': None, 'spvRegistryExists': False, 'startDate': '01.06.2023', 'startDateEn': '2023-06-01', 'status': 'Исключена', 'statusEgrul': 'Найден', 'statusId': 15, 'stopDate': '15.06.2023', 'stopDateEn': '2023-06-15', 'subjectTypeId': 0, 'supervisionType': 'Федеральный государственный санитарно-эпидемиологический контроль (надзор)', 'supervisionTypeId': 4, 'torRegistryExists': False, 'updatePlanDate': None, 'updatePlanDateLong': None, 'version': 'ERKNM', 'violationLawsuitTypeCodes': [], 'violationTypeCodes': [], 'year': 2023}
2023-01-19 12:36:03,013 - [WARNING] - direct_sql.py - new_insert_in_database(269) - Проведена повторная попытка внесения с параметром special, результат неудачный.
2023-01-19 12:36:03,014 - [INFO] - direct_sql.py - database_inserts_conductor_for_multiprocessing(132) - Возникла ошибка, с которой не удалось справиться...
2023-01-19 12:36:03,014 - [INFO] - direct_sql.py - database_inserts_conductor_for_multiprocessing(132) - Возникла ошибка, с которой не удалось справиться...
2023-01-19 12:36:03,014 - [INFO] - direct_sql.py - database_inserts_conductor_for_multiprocessing(133) - 
2023-01-19 12:36:03,014 - [WARNING] - direct_sql.py - new_insert_in_database(269) - Проведена повторная попытка внесения с параметром special, результат неудачный.
2023-01-19 12:36:03,014 - [INFO] - direct_sql.py - database_inserts_conductor_for_multiprocessing(133) - 
2023-01-19 12:36:03,014 - [INFO] - direct_sql.py - database_inserts_conductor_for_multiprocessing(132) - Возникла ошибка, с которой не удалось справиться...
2023-01-19 12:36:03,014 - [INFO] - direct_sql.py - database_inserts_conductor_for_multiprocessing(133) - 
2023-01-19 12:36:03,017 - [ERROR] - direct_sql.py - new_insert_in_database(267) - (1040, 'ny connections')
2023-01-19 12:36:03,017 - [INFO] - direct_sql.py - new_insert_in_database(268) - {'actCreateDate': None, 'actCreateDateEn': None, 'addresses': ['629305, АВТОНОМНЫЙ ОКРУГ, ЯМАЛО-НЕНЕЦКИЙ, ГОРОД, НОВЫЙ УРЕНГОЙ, УЛИЦА, ТАЕЖНАЯ, ДОМ 9, 890000060000046', '629305, АВТОНОМНЫЙ ОКРУГ, ЯМАЛО-НЕНЕЦКИЙ, ГОРОД, НОВЫЙ УРЕНГОЙ, УЛИЦА, ТАЕЖНАЯ, ДОМ 9, 890000060000046'], 'admLevelId': 50001, 'appealed': False, 'approveDocOrderDate': None, 'approveDocOrderNum': None, 'approveDocRequestDate': None, 'approveDocRequestNum': None, 'approveDocs': [], 'approveRequired': False, 'approved': False, 'approvedErknm': 'Отказано', 'chlistCount': 1, 'chlistFilledCount': 1, 'chlistFillingIndicationTypeId': [], 'collaboratingOrganizations': [], 'collaboratingOrganizationsIds': [], 'comment': 'Постановление Правительства РФ ', 'controllingOrganization': 'Управление Роспотребнадзора по Ямало-Ненецкому автономному округу', 'controllingOrganizationId': 10001030002, 'createPlanDate': None, 'createPlanDateLong': None, 'createdByErpDb': False, 'createdById': 190046, 'dataNotEqualEGRUL': False, 'dataSetNotInTime': False, 'deleted': False, 'directDurationDays': None, 'disapprove': False, 'district': 'Салехард', 'districtId': 1034711710000001, 'durationDays': 10, 'durationHours': None, 'erknmActViolationIds': [], 'erknmResultKindDecisionIds': [], 'erpId': '89230041000102862390', 'events': [{'startDate': '05.04.2023', 'stopDate': '18.04.2023', 'title': 'Осмотр'}, {'startDate': '05.04.2023', 'stopDate': '18.04.2023', 'title': 'Досмотр'}, {'startDate': '05.04.2023', 'stopDate': '18.04.2023', 'title': 'Опрос'}, {'startDate': '05.04.2023', 'stopDate': '18.04.2023', 'title': 'Получение письменных объяснений'}, {'startDate': '05.04.2023', 'stopDate': '18.04.2023', 'title': 'Истребование документов'}, {'startDate': '05.04.2023', 'stopDate': '18.04.2023', 'title': 'Отбор проб (образцов)'}, {'startDate': '05.04.2023', 'stopDate': '18.04.2023', 'title': 'Инструментальное обследование'}, {'startDate': '05.04.2023', 'stopDate': '18.04.2023', 'title': 'Испытание'}, {'startDate': '05.04.2023', 'stopDate': '18.04.2023', 'title': 'Экспертиза'}], 'federalLaw': '248', 'federalLawId': 3, 'fullFieldViolationKnm': False, 'hasViolations': False, 'id': 12934507, 'inn': '8904031960', 'inspectorFullName': [], 'isFromSmev': False, 'isHasApproveDocs': False, 'isHasCollaboratingOrganization': False, 'isHasRequirements': True, 'isHasViolationTerm': False, 'isPm': False, 'kind': 'Выездная проверка', 'knmAnnulled': False, 'knmRejected': False, 'knmType': 'Плановое КНМ', 'knmTypeId': 4, 'legalBasisDocName': [], 'links': [], 'mspCategory': ['Не является субъектом МСП'], 'noPunishment': False, 'notifyLate': False, 'objectsKind': ['дошкольные образовательные организации', 'здания, помещения, сооружения, линейные объекты, территории, включая водные, земельные и лесные участки, оборудование, устройства, предметы, материалы, транспортные средства и другие объекты, которыми граждане и организации владеют и (или) пользуются и к которым предъявляются обязательные требования'], 'objectsSubKind': ['дошкольные образовательные организации', 'здания, помещения, сооружения, линейные объекты, территории, включая водные, земельные и лесные участки, оборудование, устройства, предметы, материалы, транспортные средства и другие объекты, которыми граждане и организации владеют и (или) пользуются и к которым предъявляются обязательные требования'], 'objectsType': ['Деятельность и действия', 'Производственные объекты'], 'ogrn': '1028900631308', 'oldKnm': None, 'oldPlan': None, 'orderDone': False, 'organizationName': 'МУНИЦИПАЛЬНОЕ БЮДЖЕТНОЕ ДОШКОЛЬНОЕ ОБРАЗОВАТЕЛЬНОЕ УЧРЕЖДЕНИЕ ДЕТСКИЙ САД ОЛЕНЕНОК', 'organizationsInn': ['8904031960'], 'organizationsName': ['МУНИЦИПАЛЬНОЕ БЮДЖЕТНОЕ ДОШКОЛЬНОЕ ОБРАЗОВАТЕЛЬНОЕ УЧРЕЖДЕНИЕ ДЕТСКИЙ САД ОЛЕНЕНОК'], 'organizationsOgrn': ['1028900631308'], 'planId': '2023051007', 'prosecutorOrganization': 'Прокуратура Ямало-Ненецкого автономного округа', 'prosecutorOrganizationId': 3065, 'publishedStatus': 'UNPUBLISHED', 'reasons': [201], 'reasonsList': [{'assignmentDate': None, 'assignmentDateEn': None, 'assignmentNumber': None, 'date': '01.03.2021', 'dateEn': '2021-03-01', 'requirementDetails': None, 'text': '(ФЗ 248) Истечение установленного федеральным законом о виде контроля, положением о виде контроля период времени с даты окончания проведения последнего планового контрольного (надзорного) мероприятия'}], 'recEmptyOrLate': False, 'regDateEgrul': '04.09.2022', 'regDateEgrulEn': '2022-09-04', 'regLate': False, 'regTypes': [], 'requirements': 43, 'requirementsList': [{'nameNpa': ' «О безопасности мебельной продукции» ', 'numberNpa': '16.08.2011', 'title': 'технический регламент Таможенного союза «О безопасности мебельной продукции» (ТР ТС 025/2012)'}, {'nameNpa': 'О безопасности продукции легкой промышленности.', 'numberNpa': '09.12.2011', 'title': 'ТР ТС 017/2011. О безопасности продукции легкой промышленности.\n'}, {'nameNpa': 'О безопасности продукции, предназначенной для детей и подростков', 'numberNpa': '23.09.2011', 'title': 'ТР ТС 007/2011 О безопасности продукции, предназначенной для детей и подростков'}, {'nameNpa': 'ТР ТС 009/2011 О безопасности парфюмерно-косметической продукции', 'numberNpa': '23.09.2011', 'title': 'ТР ТС 009/2011 О безопасности парфюмерно-косметической продукции'}, {'nameNpa': 'О безопасности зерна', 'numberNpa': '09.12.2011', 'title': 'Технический регламент Таможенного союза. ТР ТС 015/2011'}, {'nameNpa': ' О безопасности игрушек', 'numberNpa': '23.09.2011', 'title': 'Технический регламент таможенного союза. Тр ТС 008/2011'}, {'nameNpa': '«О безопасности пищевой продукции»', 'numberNpa': '09.12.2011', 'title': 'ТР ТС 021/2011 '}, {'nameNpa': 'Технический регламент на масложировую продукцию', 'numberNpa': '09.12.2011', 'title': 'ТР ТС 024/2011 Технический регламент на масложировую продукцию'}, {'nameNpa': 'Технический регламент на соковую продукцию из фруктов и овощей', 'numberNpa': '09.12.2011', 'title': 'ТР ТС 023/2011 Технический регламент на соковую продукцию из фруктов и овощей'}, {'nameNpa': 'ТР ТС 029/2012 «Требования безопасности пищевых добавок, ароматизаторов и технологических вспомогательных средств»', 'numberNpa': '20.07.2022', 'title': 'ТР ТС 029/2012 «Требования безопасности пищевых добавок, ароматизаторов и технологических вспомогательных средств»'}, {'nameNpa': 'Пищевая продукция в части ее маркировки ', 'numberNpa': '09.12.2011', 'title': ' ТР ТС 022/2011 Пищевая продукция в части ее маркировки '}, {'nameNpa': ' «О безопасности молока и молочной продукции»', 'numberNpa': '09.10.2013', 'title': 'ТР ТС 033/2013 «О безопасности молока и молочной продукции»'}, {'nameNpa': 'О безопасности мяса и мясной продукции', 'numberNpa': '09.10.2013', 'title': '\t\nТР ТС 034/2013 О безопасности мяса и мясной продукции'}, {'nameNpa': '« О безопасности рыбы и рыбной продукции»', 'numberNpa': '18.10.2016', 'title': 'ТР ЕАЭС 040/2016 « О безопасности рыбы и рыбной продукции»'}, {'nameNpa': ' О безопасности упаковки ', 'numberNpa': '16.08.2011', 'title': 'ТР ТС 005/2011 О безопасности упаковки \n'}, {'nameNpa': 'О санитарно-эпидемиологическом благополучии населения', 'numberNpa': '30.03.1999', 'title': 'Федеральный закон № 52-ФЗ'}, {'nameNpa': 'Об отходах производства и потребления ', 'numberNpa': '24.06.1998', 'title': '89-ФЗ'}, {'nameNpa': '«О предупреждении распространения туберкулёза в Российской Федерации»', 'numberNpa': '18.06.2001', 'title': '№77-ФЗ'}, {'nameNpa': 'О техническом регулировании', 'numberNpa': '27.12.2002', 'title': 'Федеральный закон N184-ФЗ'}, {'nameNpa': 'Об иммунопрофилактике инфекционных болезней', 'numberNpa': '17.09.1998', 'title': 'Федеральный закон №157-ФЗ'}, {'nameNpa': 'О государственном контроле (надзоре) и муниципальном контроле в Российской Федерации ', 'numberNpa': '31.07.2021', 'title': 'Федеральный закон от 31.07.2020 N 248-ФЗ'}, {'nameNpa': '«О защите детей от информации, причиняющей вред их здоровью развитию»', 'numberNpa': '29.12.2010', 'title': '№ 436-ФЗ'}, {'nameNpa': '«О водоснабжении и водоотведении»', 'numberNpa': '07.12.2011', 'title': '№416-ФЗ'}, {'nameNpa': '«Об энергосбережении и повышении энергетической эффективности и о внесении изменений в отдельные законодательные акты Российской Федерации»', 'numberNpa': '23.11.2009', 'title': 'N 261-ФЗ'}, {'nameNpa': 'Об охране здоровья граждан от воздействия окружающего табачного дыма и последствий потребления табака', 'numberNpa': '23.02.2013', 'title': 'Федеральный закон №15-ФЗ'}, {'nameNpa': 'Об основах охраны здоровья граждан в Российской Федерации', 'numberNpa': '21.11.2011', 'title': 'N 323-ФЗ'}, {'nameNpa': 'Об утверждении перечня работ, выполнение которых связано с высоким риском заболевания инфекционными болезнями и требует обязательного проведения профилактических прививок', 'numberNpa': '15.07.1999', 'title': 'Постановление №825'}, {'nameNpa': 'О мерах по реализации указов Президента Российской Федерации\nот 6 августа 2014 г. N 560, от 24 июня 2015 г. N 320,\nот 29 июня 2016 г. N 305, от 30 июня 2017 г. N 293,\nот 12 июля 2018 г. N 420, от 24 июня 2019 г. N 293,\nот 21 ноября 2020 г. N 730 и от 20 сентября 2021 г. N 534', 'numberNpa': '07.08.2014', 'title': 'Постановление №778'}, {'nameNpa': 'Постановление Правительства РФ от 3 сентября 2010 г. N 681 Об утверждении Правил обращения с отходами производства и потребления в части осветительных устройств, электрических ламп, ненадлежащие сбор, накопление, использование, обезвреживание, транспортирование и размещение которых может повлечь причинение вреда жизни, здоровью граждан, вреда животным, растениям и окружающей среде', 'numberNpa': '03.09.2010', 'title': 'Постановление Правительства РФ от 3 сентября 2010 г. N 681 Об утверждении Правил обращения с отходами производства и потребления в части осветительных устройств, электрических ламп, ненадлежащие сбор, накопление, использование, обезвреживание, транспортирование и размещение которых может повлечь причинение вреда жизни, здоровью граждан, вреда животным, растениям и окружающей среде'}, {'nameNpa': '«О проведении профилактических прививок против новой коронавирусной инфекции (COVID – 19) на территории Ямало-Ненецкого автономного округа и о наличии обязательной вакцинации против COVID – 19 у работников, прибывающих на территорию региона для осуществления деятельности вахтово-экспедиционным методом»', 'numberNpa': '08.10.2021', 'title': 'Постановление Главного Государственного Санитарного врача по Ямало – Ненецкому автономному округу №29 '}, {'nameNpa': 'О применении отдельных специальных экономических мер в целях обеспечения безопасности Российской Федерации', 'numberNpa': '06.08.2014', 'title': 'Указ Президента № 560'}, {'nameNpa': '«Санитарно-эпидемиологические требования к эксплуатации помещений, зданий, сооружений, оборудования и транспорта, а также условиям деятельности хозяйствующих субъектов, осуществляющих продажу товаров, выполнение работ или оказание услуг»', 'numberNpa': '24.12.2020', 'title': 'Санитарные правила и нормы 2.1.3678-20 '}, {'nameNpa': 'Профилактика новой коронавирусной инфекции (COVID-19)', 'numberNpa': '22.05.2020', 'title': 'СП 3.1.3597-20 Профилактика новой коронавирусной инфекции (COVID-19)'}, {'nameNpa': 'Санитарно-эпидемиологические требования к организации общественного питания населения', 'numberNpa': '27.10.2020', 'title': 'Санитарные правила 2.3/2.4.3590-20'}, {'nameNpa': 'Санитарно-эпидемиологические требования к устройству, содержанию и организации работы образовательных организаций и других объектов социальной инфраструктуры для детей и молодежи в условиях распространения новой коронавирусной инфекции (COVID-19)', 'numberNpa': '30.06.2020', 'title': 'Санитарные правила 3.1/2.4.3598-20'}, {'nameNpa': 'Организация и проведение производственного контроля за соблюдением санитарных правил и выполнением санитарно-противоэпидемических (профилактических) мероприятий', 'numberNpa': '10.07.2001', 'title': 'СП 1.1.1058-01 Организация и проведение производственного контроля за соблюдением санитарных правил и выполнением санитарно-противоэпидемических (профилактических) мероприятий'}, {'nameNpa': 'Санитарно-эпидемиологические требования по профилактике инфекционных болезней', 'numberNpa': '28.01.2021', 'title': 'СанПиН 3.3686-21'}, {'nameNpa': 'Гигиенические нормативы и требования к обеспечению безопасности и (или) безвредности для человека факторов среды обитания', 'numberNpa': '28.01.2021', 'title': 'СанПиН 1.2.3685-21 Гигиенические нормативы и требования к обеспечению безопасности и (или) безвредности для человека факторов среды обитания'}, {'nameNpa': '«Санитарно-эпидемиологические требования к содержанию территорий городских и сельских поселений, к водным объектам, питьевой воде и питьевому водоснабжению, атмосферному воздуху, почвам, жилым помещениям, эксплуатации производственных, общественных помещений, организации и проведению санитарно-противоэпидемических мероприятий»', 'numberNpa': '28.01.2021', 'title': 'Санитарные правила и нормы 2.1.3684-21 '}, {'nameNpa': '«Об утверждении порядка проведения обязательных предварительных и периодических медицинских осмотров работников, предусмотренных частью четвертой статьи 213 Трудового кодекса РФ, перечня медицинских противопоказаний к осуществлению работ с вредными и (или) опасными производственными факторами, а также работам, при выполнении которых проводятся обязательные предварительные и периодические медицинские осмотры', 'numberNpa': '28.10.2021', 'title': 'Приказ № 29Н'}, {'nameNpa': 'Об утверждении требований к знаку о запрете курения и к порядку его размещения', 'numberNpa': '12.05.2014', 'title': 'Приказ Министерства здравоохранения РФ №214-н'}, {'nameNpa': 'О применении отдельных специальных экономических мер в целях обеспечения безопасности Российской Федерации', 'numberNpa': '06.08.2014', 'title': 'Указ Президента № 560'}, {'nameNpa': 'Санитарно-эпидемиологические требования к организациям воспитания и обучения, отдыха и оздоровления детей и молодежи', 'numberNpa': '01.01.2021', 'title': 'СанитарныеПравила 2.4.3648-20'}], 'resolved': False, 'resultEmpty': True, 'resultEmptyOrLate': False, 'resultInfoTypeCodes': [], 'resultViolationKnm': False, 'riskCategory': ['чрезвычайно высокий риск', 'чрезвычайно высокий риск'], 'riskCategoryAndDangerClass': ['чрезвычайно высокий риск / Первый', 'чрезвычайно высокий риск / Первый'], 'sezRegistryExists': False, 'signed': True, 'smevInfoType': None, 'smevMessageType': None, 'smevReceivedAt': None, 'smevReceivedAtEn': None, 'smevReceivedAtMonth': None, 'smevReceivedAtYear': None, 'spvRegistryExists': False, 'startDate': '05.04.2023', 'startDateEn': '2023-04-05', 'status': 'Исключена', 'statusEgrul': 'Найден', 'statusId': 15, 'stopDate': '18.04.2023', 'stopDateEn': '2023-04-18', 'subjectTypeId': 0, 'supervisionType': 'Федеральный государственный санитарно-эпидемиологический контроль (надзор)', 'supervisionTypeId': 4, 'torRegistryExists': False, 'updatePlanDate': None, 'updatePlanDateLong': None, 'version': 'ERKNM', 'violationLawsuitTypeCodes': [], 'violationTypeCodes': [], 'year': 2023}
2023-01-19 12:36:03,019 - [WARNING] - direct_sql.py - new_insert_in_database(269) - Проведена повторная попытка внесения с параметром special, результат неудачный.
2023-01-19 12:36:03,019 - [INFO] - direct_sql.py - database_inserts_conductor_for_multiprocessing(132) - Возникла ошибка, с которой не удалось справиться...
2023-01-19 12:36:03,019 - [INFO] - direct_sql.py - database_inserts_conductor_for_multiprocessing(133) - 
2023-01-19 12:36:03,026 - [ERROR] - direct_sql.py - new_insert_in_database(267) - (1040, 'ny connections')
2023-01-19 12:36:03,027 - [INFO] - direct_sql.py - new_insert_in_database(268) - {'actCreateDate': None, 'actCreateDateEn': None, 'addresses': ['427508, РЕСПУБЛИКА, УДМУРТСКАЯ, РАЙОН, ЯРСКИЙ, УЛИЦА, ШКОЛЬНАЯ, ДОМ 28 А, 180260000140016'], 'admLevelId': 50001, 'appealed': False, 'approveDocOrderDate': None, 'approveDocOrderNum': None, 'approveDocRequestDate': None, 'approveDocRequestNum': None, 'approveDocs': [], 'approveRequired': False, 'approved': False, 'approvedErknm': 'Отказано', 'chlistCount': 0, 'chlistFilledCount': 0, 'chlistFillingIndicationTypeId': [], 'collaboratingOrganizations': [], 'collaboratingOrganizationsIds': [], 'comment': 'Несоответствие запланированного планового контрольного (надзорного) мероприятия  требованиям пункта 11(4) Постановления Правительства Российской Федерации от 10.03.2022 № 336 «Об особенностях организации и осуществления государственного контроля (надзора), муниципального контроля». ', 'controllingOrganization': 'Управления Роспотребнадзора по Удмуртской Республике', 'controllingOrganizationId': 10001012486, 'createPlanDate': None, 'createPlanDateLong': None, 'createdByErpDb': False, 'createdById': 180679, 'dataNotEqualEGRUL': False, 'dataSetNotInTime': False, 'deleted': False, 'directDurationDays': None, 'disapprove': False, 'district': 'Удмуртская Республика', 'districtId': 1033940000000001, 'durationDays': 10, 'durationHours': None, 'erknmActViolationIds': [], 'erknmResultKindDecisionIds': [], 'erpId': '18230041000103706544', 'events': [{'startDate': '22.05.2023', 'stopDate': '02.06.2023', 'title': 'Получение письменных объяснений'}, {'startDate': '22.05.2023', 'stopDate': '02.06.2023', 'title': 'Истребование документов'}, {'startDate': '22.05.2023', 'stopDate': '02.06.2023', 'title': 'Экспертиза'}], 'federalLaw': '248', 'federalLawId': 3, 'fullFieldViolationKnm': False, 'hasViolations': False, 'id': 13778661, 'inn': '1825002811', 'inspectorFullName': [], 'isFromSmev': False, 'isHasApproveDocs': False, 'isHasCollaboratingOrganization': False, 'isHasRequirements': True, 'isHasViolationTerm': False, 'isPm': False, 'kind': 'Документарная проверка', 'knmAnnulled': False, 'knmRejected': False, 'knmType': 'Плановое КНМ', 'knmTypeId': 4, 'legalBasisDocName': [], 'links': [], 'mspCategory': ['Не является субъектом МСП'], 'noPunishment': False, 'notifyLate': False, 'objectsKind': ['Деятельность дошкольных образовательных организаций'], 'objectsSubKind': ['Деятельность дошкольных образовательных организаций'], 'objectsType': ['Деятельность и действия'], 'ogrn': '1021800584189', 'oldKnm': None, 'oldPlan': None, 'orderDone': False, 'organizationName': 'МУНИЦИПАЛЬНОЕ БЮДЖЕТНОЕ ДОШКОЛЬНОЕ ОБРАЗОВАТЕЛЬНОЕ УЧРЕЖДЕНИЕ ЛЕСОБАЗОВСКИЙ ДЕТСКИЙ САД', 'organizationsInn': ['1825002811'], 'organizationsName': ['МУНИЦИПАЛЬНОЕ БЮДЖЕТНОЕ ДОШКОЛЬНОЕ ОБРАЗОВАТЕЛЬНОЕ УЧРЕЖДЕНИЕ ЛЕСОБАЗОВСКИЙ ДЕТСКИЙ САД'], 'organizationsOgrn': ['1021800584189'], 'planId': '2023049688', 'prosecutorOrganization': 'Прокуратура Удмуртской Республики', 'prosecutorOrganizationId': 1324, 'publishedStatus': 'UNPUBLISHED', 'reasons': [201], 'reasonsList': [{'assignmentDate': None, 'assignmentDateEn': None, 'assignmentNumber': None, 'date': '19.05.2022', 'dateEn': '2022-05-19', 'requirementDetails': None, 'text': '(ФЗ 248) Истечение установленного федеральным законом о виде контроля, положением о виде контроля период времени с даты окончания проведения последнего планового контрольного (надзорного) мероприятия'}], 'recEmptyOrLate': False, 'regDateEgrul': '28.09.2022', 'regDateEgrulEn': '2022-09-28', 'regLate': False, 'regTypes': [], 'requirements': 1, 'requirementsList': [{'nameNpa': 'None', 'numberNpa': 'None', 'title': 'None'}], 'resolved': False, 'resultEmpty': True, 'resultEmptyOrLate': False, 'resultInfoTypeCodes': [], 'resultViolationKnm': False, 'riskCategory': ['чрезвычайно высокий риск'], 'riskCategoryAndDangerClass': ['чрезвычайно высокий риск'], 'sezRegistryExists': False, 'signed': True, 'smevInfoType': None, 'smevMessageType': None, 'smevReceivedAt': None, 'smevReceivedAtEn': None, 'smevReceivedAtMonth': None, 'smevReceivedAtYear': None, 'spvRegistryExists': False, 'startDate': '22.05.2023', 'startDateEn': '2023-05-22', 'status': 'Исключена', 'statusEgrul': 'Найден', 'statusId': 15, 'stopDate': '02.06.2023', 'stopDateEn': '2023-06-02', 'subjectTypeId': 0, 'supervisionType': 'Федеральный государственный санитарно-эпидемиологический контроль (надзор)', 'supervisionTypeId': 4, 'torRegistryExists': False, 'updatePlanDate': None, 'updatePlanDateLong': None, 'version': 'ERKNM', 'violationLawsuitTypeCodes': [], 'violationTypeCodes': [], 'year': 2023}
2023-01-19 12:36:03,028 - [WARNING] - direct_sql.py - new_insert_in_database(269) - Проведена повторная попытка внесения с параметром special, результат неудачный.
2023-01-19 12:36:03,028 - [INFO] - direct_sql.py - database_inserts_conductor_for_multiprocessing(132) - Возникла ошибка, с которой не удалось справиться...
2023-01-19 12:36:03,028 - [INFO] - direct_sql.py - database_inserts_conductor_for_multiprocessing(133) - 
2023-01-19 12:36:03,044 - [ERROR] - direct_sql.py - new_insert_in_database(267) - (1040, 'ny connections')
2023-01-19 12:36:03,045 - [ERROR] - direct_sql.py - new_insert_in_database(267) - (1040, 'ny connections')
2023-01-19 12:36:03,045 - [INFO] - direct_sql.py - new_insert_in_database(268) - {'actCreateDate': None, 'actCreateDateEn': None, 'addresses': ['169319, РЕСПУБЛИКА КОМИ, ГОРОД УХТА, ПРОЕЗД СТРОИТЕЛЕЙ, 25, ', 'Республика Коми, г. Ухта, пр.Строителей, д.25\n'], 'admLevelId': 50001, 'appealed': False, 'approveDocOrderDate': None, 'approveDocOrderNum': None, 'approveDocRequestDate': None, 'approveDocRequestNum': None, 'approveDocs': [], 'approveRequired': False, 'approved': False, 'approvedErknm': 'Отказано', 'chlistCount': 2, 'chlistFilledCount': 2, 'chlistFillingIndicationTypeId': [], 'collaboratingOrganizations': [], 'collaboratingOrganizationsIds': [], 'comment': 'в силу положений п. 11(4) постановления Правительства Российской Федерации от 10.03.2022 № 336 в планы проведения плановых КНМ не подлежат включению плановые КНМ  в отношении государственных и муниципальных учреждений дошкольного и начального общего, основного общего и среднего общего образования, объекты контроля которых отнесены к категориям чрезвычайно высокого и высокого риска', 'controllingOrganization': 'Управление Роспотребнадзора по Республике Коми', 'controllingOrganizationId': 10001016637, 'createPlanDate': None, 'createPlanDateLong': None, 'createdByErpDb': False, 'createdById': 160403, 'dataNotEqualEGRUL': False, 'dataSetNotInTime': False, 'deleted': False, 'directDurationDays': None, 'disapprove': False, 'district': 'Республика Коми', 'districtId': 1031870000000001, 'durationDays': 10, 'durationHours': None, 'erknmActViolationIds': [], 'erknmResultKindDecisionIds': [], 'erpId': '11230041000103539005', 'events': [{'startDate': '05.06.2023', 'stopDate': '19.06.2023', 'title': 'Осмотр'}, {'startDate': '05.06.2023', 'stopDate': '19.06.2023', 'title': 'Опрос'}, {'startDate': '05.06.2023', 'stopDate': '19.06.2023', 'title': 'Получение письменных объяснений'}, {'startDate': '05.06.2023', 'stopDate': '19.06.2023', 'title': 'Истребование документов'}, {'startDate': '05.06.2023', 'stopDate': '19.06.2023', 'title': 'Отбор проб (образцов)'}, {'startDate': '05.06.2023', 'stopDate': '19.06.2023', 'title': 'Испытание'}, {'startDate': '05.06.2023', 'stopDate': '19.06.2023', 'title': 'Экспертиза'}], 'federalLaw': '248', 'federalLawId': 3, 'fullFieldViolationKnm': False, 'hasViolations': False, 'id': 13611122, 'inn': '1102006571', 'inspectorFullName': [], 'isFromSmev': False, 'isHasApproveDocs': False, 'isHasCollaboratingOrganization': False, 'isHasRequirements': True, 'isHasViolationTerm': False, 'isPm': False, 'kind': 'Выездная проверка', 'knmAnnulled': False, 'knmRejected': False, 'knmType': 'Плановое КНМ', 'knmTypeId': 4, 'legalBasisDocName': [], 'links': [], 'mspCategory': ['Не является субъектом МСП'], 'noPunishment': False, 'notifyLate': False, 'objectsKind': ['Деятельность по организации отдыха детей и их оздоровления, в том числе лагеря с дневным пребыванием', 'Деятельность по организации отдыха детей и их оздоровления, в том числе лагеря с дневным пребыванием'], 'objectsSubKind': ['Деятельность по организации отдыха детей и их оздоровления, в том числе лагеря с дневным пребыванием', 'Деятельность по организации отдыха детей и их оздоровления, в том числе лагеря с дневным пребыванием'], 'objectsType': ['Деятельность и действия', 'Деятельность и действия'], 'ogrn': '1021100733290', 'oldKnm': None, 'oldPlan': None, 'orderDone': False, 'organizationName': 'МУНИЦИПАЛЬНОЕ АВТОНОМНОЕ ОБЩЕОБРАЗОВАТЕЛЬНОЕ УЧРЕЖДЕНИЕ УХТИНСКИЙ ТЕХНИЧЕСКИЙ ЛИЦЕЙ ИМ. Г.В. РАССОХИНА', 'organizationsInn': ['1102006571'], 'organizationsName': ['МУНИЦИПАЛЬНОЕ АВТОНОМНОЕ ОБЩЕОБРАЗОВАТЕЛЬНОЕ УЧРЕЖДЕНИЕ УХТИНСКИЙ ТЕХНИЧЕСКИЙ ЛИЦЕЙ ИМ. Г.В. РАССОХИНА'], 'organizationsOgrn': ['1021100733290'], 'planId': '2023059758', 'prosecutorOrganization': 'Прокуратура Республики Коми', 'prosecutorOrganizationId': 654, 'publishedStatus': 'UNPUBLISHED', 'reasons': [204], 'reasonsList': [{'assignmentDate': None, 'assignmentDateEn': None, 'assignmentNumber': None, 'date': '01.06.2023', 'dateEn': '2023-06-01', 'requirementDetails': None, 'text': '(ФЗ 248) Истечение установленного федеральным законом о виде контроля, положением о виде контроля периода времени с даты иного события, установленного федеральным законом о виде контроля, положением о виде контроля, которое ведет к возникновению объекта контроля'}], 'recEmptyOrLate': False, 'regDateEgrul': '21.09.2022', 'regDateEgrulEn': '2022-09-21', 'regLate': False, 'regTypes': [], 'requirements': 1, 'requirementsList': [{'nameNpa': 'Федеральный закон №52-ФЗ от 30.03.1999 г. «О санитарно-эпидемиологическом благополучии населения» (ст.15, ст.17, ст.19, ст.21, ст.22, ст.24, ст.28, ст.29, ст.31, ст.32, ст.34, ст.36);\n- Федеральный закон от 24.07.1998г. № 124-ФЗ «Об основных гарантиях прав ребенка в Российской Федерации» (п.2 ст. 12);\n- Федеральный закон от 02.01.2000г. № 29-ФЗ «О качестве и безопасности пищевых продуктов» (п.1-3 ст. 3; п.1, 2 ст.5; п. 1, 3 ст.9; ст.15; ст.17; ст.20; ст.23; ст.24; п.1 ст.25.1; ст.25.2);\n- Федеральный закон от 23.02.2013г. №15-ФЗ «Об охране здоровья граждан от воздействия окружающего табачного дыма, последствий потребления табака или потребления никотинсодержащей продукции» (ст. 12, ст.20);\n- Федеральный закон от 17.09.1998 г. №157-ФЗ «Об иммунопрофилактике инфекционных болезней» (ст. 9, п. 4 ст.11);\n- Федеральный закон от 18.06.2001г. № 77-ФЗ «О предупреждении распро-странения туберкулёза в Российской Федерации» (п.п. 3, 4 ст. 8);\n- Федеральный закон от 24.06.1998 № 89-ФЗ Об отходах производства и потребления (ч.ч.1, 3 ст.13.4);\n- Технический регламент Таможенного союза «О безопасности пищевой продукции» ТР ТС 021/2011 (за исключением статьи 6, абзацев 2, 7, 12-14 части 5 статьи 7, части 3 статьи 13, части 2 статьи 18, статей 30 и 40); \n- Технический регламент Таможенного союза «Пищевая продукция в части её маркировки» ТР ТС 022/2011;\n- Технический регламент Таможенного союза «Технический регламент на соковую продукцию из фруктов и овощей» ТР ТС 023/2011 (ст. 3 - ст. 8);\n- Технический регламент Таможенного союза «Технический регламент на масложировую продукцию» ТР ТС 024/2011;\n- Технический регламент Таможенного союза «О безопасности мебельной продукции» ТР ТС 025/2012 (ст. 4 – ст.7);\n- Технический регламент Таможенного союза «О безопасности отдельных видов специализированной пищевой продукции, в том числе диетического, лечебного и диетического профилактического питания» ТР ТС 027/2012;\n- Технический регламент Таможенного союза «Требования безопасности пищевых добавок, ароматизаторов и технологических вспомогательных средств» ТР ТС 029/2012;\n- Технический регламент Таможенного союза «О безопасности молока и молочной продукции» ТР ТС 033/2013 (за исключением пунктов 13, 14, 97, 98 и 115);\n- Технический регламент Таможенного союза «О безопасности мяса и мясной продукции» ТР ТС 034/2013 (за исключением пунктов 1-8, 26-48, 53, 54 и абзаца 2 пункта 99);\n- Разделы IV и V (за исключением пункта 14), VIII, IX, X, XI (за исключе-нием пунктов 85, 86), XII Технического регламента Евразийского экономического союза «О безопасности рыбы и рыбной продукции» ТР ЕАЭС 040/2016;\n- разделы III, IV, V, VI, VII и X Технического регламента Евразийского эко-номического союза «О безопасности упакованной питьевой воды, включая природную минеральную воду» ТР ЕАЭС 044/2017; \n- Технический регламент Таможенного союза «О безопасности игрушек» ТР ТС 008/2011 (ст. 3 – ст. 7); \n- Технический регламент Таможенного союза «О безопасности продукции, предназначенной для детей и подростков» ТР ТС 007/2011 (ст. 3 – ст. 11, ст 13);\n- раздел IV, пункты 15, 16, подпункты а, д пункта 18 раздела VI, пункт 49 раздела VIII, разделы IX и X в части требований к покрытию для детских игровых площадок и связанным с ним процессам Технического регламента Евразийского экономического союза О безопасности оборудования для детских игровых площадок ТР ЕАЭС 042/2017; \n- Единые санитарно-эпидемиологические и гигиенические требования к то-варам, подлежащим санитарно-эпидемиологическому надзору (контролю), утвержденные решением Комиссии Таможенного союза 28.05.2010 № 299;   \n- СП 2.4.3648-20 Санитарно-эпидемиологические требования к организациям воспитания и обучения, отдыха и оздоровления детей и молодежи\n- СП 3.1/2.4.3598-20 «Санитарно-эпидемиологические требования к устрой-ству, содержанию и организации работы образовательных организаций и других объектов социальной инфраструктуры для детей и молодежи в усло-виях распространения новой коронавирусной инфекции (COVID-19)»; \n- СанПиН 2.3/2.4.3590-20 «Санитарно-эпидемиологические требования к организации общественного питания населения»;\n- СанПиН 1.2.3685-21 «Гигиенические нормативы и требования к обеспече-нию безопасности и (или) безвредности для человека факторов среды обитания»;\n- СанПиН 2.1.3684-21 «Санитарно-эпидемиологические требования к содержанию территорий городских и сельских поселений, к водным объектам, питьевой воде и питьевому водоснабжению, атмосферному воздуху, почвам, жилым помещениям, эксплуатации производственных, общественных помещений, организации и проведению санитарно-противоэпидемических (профилактических) мероприятий»;\n- СП 3.1.3597-20 Профилактика новой коронавирусной инфекции (COVID-19)\n- СанПиН 3.3686-21 Санитарно-эпидемиологические требования по профилактике инфекционных болезней; \n- СП 2.2.3670-20 «Санитарно-эпидемиологические требования к условиям труда»;\n- приказ Министерства труда и социальной защиты Российской Федерации и Министерства здравоохранения Российской Федерации от 31.12.2020 г. № 988н/1420н «Об утверждении перечня вредных и (или) опасных производственных факторов и работ, при выполнении которых проводятся обязательные предварительные медицинские осмотры при поступлении на работу и периодические медицинские осмотры»;\n- приказ Министерства здравоохранения Российской Федерации от 28.01.2021 года № 29н «Об утверждении Порядка проведения обязательных предварительных и периодических медицинских осмотров работников, предусмотренных частью четвертой статьи 213 Трудового кодекса Российской Федерации, перечня медицинских противопоказаний к осуществлению работ с вредными и (или) опасными производственными факторами, а также работам, при выполнении которых проводятся обязательные предварительные и периодические медицинские осмотры»\n\n', 'numberNpa': '30.03.1999', 'title': 'Соблюдение обязательных требований'}], 'resolved': False, 'resultEmpty': True, 'resultEmptyOrLate': False, 'resultInfoTypeCodes': [], 'resultViolationKnm': False, 'riskCategory': ['чрезвычайно высокий риск', 'чрезвычайно высокий риск'], 'riskCategoryAndDangerClass': ['чрезвычайно высокий риск / Первый', 'чрезвычайно высокий риск / Первый'], 'sezRegistryExists': False, 'signed': True, 'smevInfoType': None, 'smevMessageType': None, 'smevReceivedAt': None, 'smevReceivedAtEn': None, 'smevReceivedAtMonth': None, 'smevReceivedAtYear': None, 'spvRegistryExists': False, 'startDate': '05.06.2023', 'startDateEn': '2023-06-05', 'status': 'Исключена', 'statusEgrul': 'Найден', 'statusId': 15, 'stopDate': None, 'stopDateEn': None, 'subjectTypeId': 0, 'supervisionType': 'Федеральный государственный санитарно-эпидемиологический контроль (надзор)', 'supervisionTypeId': 4, 'torRegistryExists': False, 'updatePlanDate': None, 'updatePlanDateLong': None, 'version': 'ERKNM', 'violationLawsuitTypeCodes': [], 'violationTypeCodes': [], 'year': 2023}
2023-01-19 12:36:03,046 - [WARNING] - direct_sql.py - new_insert_in_database(269) - Проведена повторная попытка внесения с параметром special, результат неудачный.
2023-01-19 12:36:03,046 - [INFO] - direct_sql.py - database_inserts_conductor_for_multiprocessing(132) - Возникла ошибка, с которой не удалось справиться...
2023-01-19 12:36:03,046 - [INFO] - direct_sql.py - database_inserts_conductor_for_multiprocessing(133) - 
2023-01-19 12:36:03,046 - [ERROR] - direct_sql.py - new_insert_in_database(267) - (1040, 'ny connections')
2023-01-19 12:36:03,046 - [INFO] - direct_sql.py - new_insert_in_database(268) - {'actCreateDate': None, 'actCreateDateEn': None, 'addresses': ['671942, РЕСПУБЛИКА БУРЯТИЯ, РАЙОН ЗАКАМЕНСКИЙ, УЛУС ХУРТАГА, УЛИЦА ЦЕНТРАЛЬНАЯ, ДОМ 17, КОРПУС А, (лагерь с дневным пребыванием)', '671942, РЕСПУБЛИКА БУРЯТИЯ, РАЙОН ЗАКАМЕНСКИЙ, УЛУС ХУРТАГА, УЛИЦА ЦЕНТРАЛЬНАЯ, ДОМ 17, КОРПУС А (лагерь труда и отдыха)'], 'admLevelId': 50001, 'appealed': False, 'approveDocOrderDate': None, 'approveDocOrderNum': None, 'approveDocRequestDate': None, 'approveDocRequestNum': None, 'approveDocs': [], 'approveRequired': False, 'approved': False, 'approvedErknm': 'Отказано', 'chlistCount': 0, 'chlistFilledCount': 0, 'chlistFillingIndicationTypeId': [], 'collaboratingOrganizations': [], 'collaboratingOrganizationsIds': [], 'comment': 'пункты 11 (3), 11 (4) Постановления Правительства Российской Федерации от 10.03.2022 № 336', 'controllingOrganization': 'Управление Роспотребнадзора по Республике Бурятия', 'controllingOrganizationId': 10001012187, 'createPlanDate': None, 'createPlanDateLong': None, 'createdByErpDb': False, 'createdById': 203596, 'dataNotEqualEGRUL': False, 'dataSetNotInTime': False, 'deleted': False, 'directDurationDays': None, 'disapprove': False, 'district': 'Республика Бурятия', 'districtId': 1036810000000001, 'durationDays': 10, 'durationHours': None, 'erknmActViolationIds': [], 'erknmResultKindDecisionIds': [], 'erpId': '03230041000103425957', 'events': [{'startDate': '04.05.2023', 'stopDate': '19.05.2023', 'title': 'Получение письменных объяснений'}, {'startDate': '04.05.2023', 'stopDate': '19.05.2023', 'title': 'Истребование документов'}], 'federalLaw': '248', 'federalLawId': 3, 'fullFieldViolationKnm': False, 'hasViolations': False, 'id': 13498074, 'inn': '0307007630', 'inspectorFullName': [], 'isFromSmev': False, 'isHasApproveDocs': False, 'isHasCollaboratingOrganization': False, 'isHasRequirements': True, 'isHasViolationTerm': False, 'isPm': False, 'kind': 'Документарная проверка', 'knmAnnulled': False, 'knmRejected': False, 'knmType': 'Плановое КНМ', 'knmTypeId': 4, 'legalBasisDocName': [], 'links': [], 'mspCategory': ['Не является субъектом МСП'], 'noPunishment': False, 'notifyLate': False, 'objectsKind': ['Деятельность по организации отдыха детей и их оздоровления, в том числе лагеря с дневным пребыванием', 'Деятельность по организации отдыха детей и их оздоровления, в том числе лагеря с дневным пребыванием'], 'objectsSubKind': ['Деятельность по организации отдыха детей и их оздоровления, в том числе лагеря с дневным пребыванием', 'Деятельность по организации отдыха детей и их оздоровления, в том числе лагеря с дневным пребыванием'], 'objectsType': ['Деятельность и действия', 'Деятельность и действия'], 'ogrn': '1020300633363', 'oldKnm': None, 'oldPlan': None, 'orderDone': False, 'organizationName': 'МУНИЦИПАЛЬНОЕ АВТОНОМНОЕ ОБЩЕОБРАЗОВАТЕЛЬНОЕ УЧРЕЖДЕНИЕ ХУРТАГИНСКАЯ СРЕДНЯЯ ОБЩЕОБРАЗОВАТЕЛЬНАЯ ШКОЛА', 'organizationsInn': ['0307007630'], 'organizationsName': ['МУНИЦИПАЛЬНОЕ АВТОНОМНОЕ ОБЩЕОБРАЗОВАТЕЛЬНОЕ УЧРЕЖДЕНИЕ ХУРТАГИНСКАЯ СРЕДНЯЯ ОБЩЕОБРАЗОВАТЕЛЬНАЯ ШКОЛА'], 'organizationsOgrn': ['1020300633363'], 'planId': '2023058837', 'prosecutorOrganization': 'Прокуратура Республики Бурятия', 'prosecutorOrganizationId': 2511, 'publishedStatus': 'UNPUBLISHED', 'reasons': [204], 'reasonsList': [{'assignmentDate': None, 'assignmentDateEn': None, 'assignmentNumber': None, 'date': '01.07.2022', 'dateEn': '2022-07-01', 'requirementDetails': None, 'text': '(ФЗ 248) Истечение установленного федеральным законом о виде контроля, положением о виде контроля периода времени с даты иного события, установленного федеральным законом о виде контроля, положением о виде контроля, которое ведет к возникновению объекта контроля'}], 'recEmptyOrLate': False, 'regDateEgrul': '15.09.2022', 'regDateEgrulEn': '2022-09-15', 'regLate': False, 'regTypes': [], 'requirements': 17, 'requirementsList': [{'nameNpa': 'None', 'numberNpa': 'None', 'title': 'None'}, {'nameNpa': 'None', 'numberNpa': 'None', 'title': 'None'}, {'nameNpa': 'None', 'numberNpa': 'None', 'title': 'None'}, {'nameNpa': 'None', 'numberNpa': 'None', 'title': 'None'}, {'nameNpa': 'None', 'numberNpa': 'None', 'title': 'None'}, {'nameNpa': 'None', 'numberNpa': 'None', 'title': 'None'}, {'nameNpa': 'None', 'numberNpa': 'None', 'title': 'None'}, {'nameNpa': 'None', 'numberNpa': 'None', 'title': 'None'}, {'nameNpa': 'None', 'numberNpa': 'None', 'title': 'None'}, {'nameNpa': 'None', 'numberNpa': 'None', 'title': 'None'}, {'nameNpa': 'None', 'numberNpa': 'None', 'title': 'None'}, {'nameNpa': 'None', 'numberNpa': 'None', 'title': 'None'}, {'nameNpa': 'None', 'numberNpa': 'None', 'title': 'None'}, {'nameNpa': 'None', 'numberNpa': 'None', 'title': 'None'}, {'nameNpa': 'None', 'numberNpa': 'None', 'title': 'None'}, {'nameNpa': 'None', 'numberNpa': 'None', 'title': 'None'}, {'nameNpa': 'None', 'numberNpa': 'None', 'title': 'None'}], 'resolved': False, 'resultEmpty': True, 'resultEmptyOrLate': False, 'resultInfoTypeCodes': [], 'resultViolationKnm': False, 'riskCategory': ['чрезвычайно высокий риск', 'чрезвычайно высокий риск'], 'riskCategoryAndDangerClass': ['чрезвычайно высокий риск', 'чрезвычайно высокий риск'], 'sezRegistryExists': False, 'signed': True, 'smevInfoType': None, 'smevMessageType': None, 'smevReceivedAt': None, 'smevReceivedAtEn': None, 'smevReceivedAtMonth': None, 'smevReceivedAtYear': None, 'spvRegistryExists': False, 'startDate': '04.05.2023', 'startDateEn': '2023-05-04', 'status': 'Исключена', 'statusEgrul': 'В процессе поиска', 'statusId': 15, 'stopDate': '19.05.2023', 'stopDateEn': '2023-05-19', 'subjectTypeId': 0, 'supervisionType': 'Федеральный государственный санитарно-эпидемиологический контроль (надзор)', 'supervisionTypeId': 4, 'torRegistryExists': False, 'updatePlanDate': None, 'updatePlanDateLong': None, 'version': 'ERKNM', 'violationLawsuitTypeCodes': [], 'violationTypeCodes': [], 'year': 2023}
2023-01-19 12:36:03,048 - [WARNING] - direct_sql.py - new_insert_in_database(269) - Проведена повторная попытка внесения с параметром special, результат неудачный.
ОРОД, ЗАВОЛЖСК, УЛИЦА, ГЕРЦЕНА, 4, 370050010000013'], 'admLevelId': 50001, 'appealed': False, 'approveDocOrderDate': None, 'approveDocOrderNum': None, 'approveDocRequestDate': None, 'approveDocRequestNum': None, 'approveDocs': [], 'approveRequired': False, 'approved': False, 'approvedErknm': 'Отказано', 'chlistCount': 2, 'chlistFilledCount': 2, 'chlistFillingIndicationTypeId': [], 'collaboratingOrganizations': [], 'collaboratingOrganizationsIds': [], 'comment': 'п. 11 (4) Постановления Правительства РФ от 10.03.2022 № 336', 'controllingOrganization': 'Управление Роспотребнадзора по Ивановской области', 'controllingOrganizationId': 10001013491, 'createPlanDate': None, 'createPlanDateLong': None, 'createdByErpDb': False, 'createdById': 166005, 'dataNotEqualEGRUL': False, 'dataSetNotInTime': False, 'deleted': False, 'directDurationDays': None, 'disapprove': False, 'district': 'Ивановская область', 'districtId': 1030240000000001, 'durationDays': 10, 'durationHours': None, 'erknmActViolationIds': [], 'erknmResultKindDecisionIds': [], 'erpId': '37230041000103154078', 'events': [{'startDate': '17.05.2023', 'stopDate': '30.05.2023', 'title': 'Осмотр'}, {'startDate': '17.05.2023', 'stopDate': '30.05.2023', 'title': 'Истребование документов'}, {'startDate': '17.05.2023', 'stopDate': '30.05.2023', 'title': 'Отбор проб (образцов)'}, {'startDate': '17.05.2023', 'stopDate': '30.05.2023', 'title': 'Инструментальное обследование'}, {'startDate': '17.05.2023', 'stopDate': '30.05.2023', 'title': 'Испытание'}, {'startDate': '17.05.2023', 'stopDate': '30.05.2023', 'title': 'Экспертиза'}], 'federalLaw': '248', 'federalLawId': 3, 'fullFieldViolationKnm': False, 'hasViolations': False, 'id': 13226195, 'inn': '3710004559', 'inspectorFullName': [], 'isFromSmev': False, 'isHasApproveDocs': False, 'isHasCollaboratingOrganization': False, 'isHasRequirements': True, 'isHasViolationTerm': False, 'isPm': False, 'kind': 'Выездная проверка', 'knmAnnulled': False, 'knmRejected': False, 'knmType': 'Плановое КНМ', 'knmTypeId': 4, 'legalBasisDocName': [], 'links': [], 'mspCategory': ['Не является субъектом МСП'], 'noPunishment': False, 'notifyLate': False, 'objectsKind': ['Деятельность дошкольных образовательных организаций'], 'objectsSubKind': ['Деятельность дошкольных образовательных организаций'], 'objectsType': ['Деятельность и действия'], 'ogrn': '1023701591286', 'oldKnm': None, 'oldPlan': None, 'orderDone': False, 'organizationName': 'МУНИЦИПАЛЬНОЕ КАЗЁННОЕ ДОШКОЛЬНОЕ ОБРАЗОВАТЕЛЬНОЕ УЧРЕЖДЕНИЕ ДЕТСКИЙ САД ОБЩЕРАЗВИВАЮЩЕГО ВИДА №3 Г.ЗАВОЛЖСКА', 'organizationsInn': ['3710004559'], 'organizationsName': ['МУНИЦИПАЛЬНОЕ КАЗЁННОЕ ДОШКОЛЬНОЕ ОБРАЗОВАТЕЛЬНОЕ УЧРЕЖДЕНИЕ ДЕТСКИЙ САД ОБЩЕРАЗВИВАЮЩЕГО ВИДА №3 Г.ЗАВОЛЖСКА'], 'organizationsOgrn': ['1023701591286'], 'planId': '2023050673', 'prosecutorOrganization': 'Прокуратура Ивановской области', 'prosecutorOrganizationId': 130, 'publishedStatus': 'UNPUBLISHED', 'reasons': [201], 'reasonsList': [{'assignmentDate': None, 'assignmentDateEn': None, 'assignmentNumber': None, 'date': '14.09.2017', 'dateEn': '2017-09-14', 'requirementDetails': None, 'text': '(ФЗ 248) Истечение установленного федеральным законом о виде контроля, положением о виде контроля период времени с даты окончания проведения последнего планового контрольного (надзорного) мероприятия'}], 'recEmptyOrLate': False, 'regDateEgrul': '25.08.2022', 'regDateEgrulEn': '2022-08-25', 'regLate': False, 'regTypes': [], 'requirements': 19, 'requirementsList': [{'nameNpa': 'Федеральный закон № 52-ФЗ от 30.03.1999 «О санитарно-эпидемиологическом благополучии населения» (ст.12, ст.13, ст.14, ст.15, ст.16, ст.17, ст.18, ст.19, ст.20, ст.21, ст.22, ст.23, ст.24, ст.25, ст.26, ст.27, ст.28, ст.29, ст.30, ст.31, ст.32, ст.33, ст.34, ст.36, ст.40, ст.41, ст.43, п.4 ст.44.1)\n\n\n\n\n\n\n', 'numberNpa': '30.03.1999', 'title': 'соблюдение обязательных требований'}, {'nameNpa': 'Федеральный закон № 29-ФЗ от 02.01.2000 «О качестве и безопасности пищевых продуктов» (п.1-3 ст.3, п.1,2 ст.5, п.1, 3 ст.9, ст. 12, ст.15, ст.16, ст.17, ст.18, ст.19, ст.20, п.1, 3 ст. 21, ст.22, ст.23, ст.24, п.1, 3.1, 5 ст.25.1, ст.25.2, ст.25.3, ст.25.4, ст.25.5, ст.25.6)\n', 'numberNpa': '02.01.2000', 'title': 'соблюдение обязательных требований'}, {'nameNpa': 'Федеральный закон № 184-ФЗ от 27.12.2002 «О техническом регулировании» (ст.23-27, ст.27, ч.1 ст.37, ч.1,2 ст.38) \n', 'numberNpa': '27.12.2002', 'title': 'соблюдение обязательных требований'}, {'nameNpa': 'Федеральный закон №157-ФЗ «Об иммунопрофилактике инфекционных болезней» (ст.11, п.1,3 ст.12, п. 1 ст. 13, п.2 ст.17) \n', 'numberNpa': '17.09.1998', 'title': 'соблюдение обязательных требований'}, {'nameNpa': 'СП 3.1.3597-20 Профилактика новой коронавирусной инфекции (COVID-19)» (Весь документ) \n', 'numberNpa': '22.05.2020', 'title': 'соблюдение обязательных требований'}, {'nameNpa': 'Приказ Министерства здравоохранения Российской Федерации № 29н Об утверждении Порядка проведения обязательных предварительных и периодических медицинских осмотров работников, предусмотренных частью четвертой статьи 213 Трудового кодекса Российской Федерации, перечня медицинских противопоказаний к осуществлению работ с вредными и (или) опасными производственными факторами, а также работам, при выполнении которых проводятся обязательные предварительные и периодические медицинские осмотры (п. 4.1 приложения к Порядку проведения обязательных предварительных и периодических медицинских осмотров работников, предусмотренных частью четвертой статьи 213 Трудового кодекса Российской Федерации) \n', 'numberNpa': '28.01.2021', 'title': 'соблюдение обязательных требований'}, {'nameNpa': 'СП 2.4.3648-20 «Санитарно-эпидемиологические требования к организациям воспитания и обучения, отдыха и оздоровления детей и молодежи» (Весь документ) \n', 'numberNpa': '28.09.2020', 'title': 'соблюдение обязательных требований'}, {'nameNpa': '\nСанПиН 2.3/2.4.3590-20 «Санитарно-эпидемиологические требования к организации общественного питания населения» (Весь документ) \n', 'numberNpa': '27.10.2020', 'title': 'соблюдение обязательных требований'}, {'nameNpa': 'СП 3.1./2.4.3598-20 «Санитарно-эпидемиологические требования к устройству, содержанию и организации работы образовательных организаций и других объектов социальной инфраструктуры для детей и молодежи в условиях распространения новой коронавирусной инфекции (COVID-19)» (Весь документ) \n', 'numberNpa': '30.06.2020', 'title': 'соблюдение обязательных требований'}, {'nameNpa': 'СанПиН 1.2.3685-21 «Гигиенические нормативы и требования к обеспечению безопасности и (или) безвредности для человека факторов среды обитания» (Весь документ) \n\n\n', 'numberNpa': '28.01.2021', 'title': 'соблюдение обязательных требований'}, {'nameNpa': 'СанПиН 2.1.3684-21 «Санитарно-эпидемиологические требования к содержанию территорий городских и сельских поселений, к водным объектам, питьевой воде и питьевому водоснабжению, атмосферному воздуху, почвам, жилым помещениям, эксплуатации производственных, общественных помещений, организации и проведению санитарно-противоэпидемиологических (профилактических) мероприятий» (Весь документ)\n', 'numberNpa': '28.01.2021', 'title': 'соблюдение обязательных требований'}, {'nameNpa': 'СанПиН 3.3686-21 Санитарно-эпидемиологические требования по профилактике инфекционных болезней (весь документ) \n', 'numberNpa': '28.01.2021', 'title': 'соблюдение обязательных требований'}, {'nameNpa': 'ТР ТС 021/2011. Технический регламент Таможенного союза «О безопасности пищевой продукции» (Весь регламент (за исключением статьи 6, абзацев второго, седьмого, двенадцатого - четырнадцатого части 5 статьи 7, части 3 статьи 13, части 2 статьи 18, статей 30 и 40 указанного технического регламента) \n', 'numberNpa': 'None', 'title': 'соблюдение обязательных требований'}, {'nameNpa': 'ТР ТС 022/2011. Технический регламент Таможенного союза «Пищевая продукция в части ее маркировки» (Весь регламент)\n', 'numberNpa': '09.12.2011', 'title': 'соблюдение обязательных требований'}, {'nameNpa': 'ТР ТС 024/2011. Технический регламент Таможенного союза «Технический регламент на масложировую продукцию» (Весь регламент) \n', 'numberNpa': '09.12.2011', 'title': 'соблюдение обязательных требований'}, {'nameNpa': 'ТР ТС 023/2011. Технический регламент Таможенного союза «Технический регламент на соковую продукцию из фруктов и овощей» (ст. 3, 4, 5, 6, 7, 8) 09.12.2011\n', 'numberNpa': '09.12.2011', 'title': 'соблюдение обязательных требований'}, {'nameNpa': 'ТР ТС 033/2013. Технический регламент Таможенного союза «О безопасности молока и молочной продукции» (Весь регламент (за исключением пунктов 13, 14, 97, 98 и 115 указанного технического регламента) \n', 'numberNpa': '09.10.2013', 'title': 'соблюдение обязательных требований'}, {'nameNpa': 'ТР ТС 034/2013. Технический регламент Таможенного союза «О безопасности мяса и мясной продукции» (Весь регламент (за исключением пунктов 1, 2, 3, 4, 5, 6, 7, 8, 26, 27, 28, 29, 30, 31, 32, 33, 34, 35, 36, 37, 38, 39, 40, 41, 42, 43, 44, 45, 46, 47, 48, 53, 54 и абзаца второго пункта 99 указанного технического регламента) \n\n\n', 'numberNpa': '09.10.2013', 'title': 'соблюдение обязательных требований'}, {'nameNpa': 'ТР ЕАЭС 040/2016. Технический регламент Евразийского экономического союза «О безопасности рыбы и рыбной продукции» (Разделы IV и V (за исключением пункта 14), VI, VII, VIII, IX, X, XI (за исключением пунктов 85, 86), XII) ', 'numberNpa': '18.10.2016', 'title': 'соблюдение обязательных требований'}], 'resolved': False, 'resultEmpty': True, 'resultEmptyOrLate': False, 'resultInfoTypeCodes': [], 'resultViolationKnm': False, 'riskCategory': ['чрезвычайно высокий риск'], 'riskCategoryAndDangerClass': ['чрезвычайно высокий риск'], 'sezRegistryExists': False, 'signed': True, 'smevInfoType': None, 'smevMessageType': None, 'smevReceivedAt': None, 'smevReceivedAtEn': None, 'smevReceivedAtMonth': None, 'smevReceivedAtYear': None, 'spvRegistryExists': False, 'startDate': '17.05.2023', 'startDateEn': '2023-05-17', 'status': 'Исключена', 'statusEgrul': 'Найден', 'statusId': 15, 'stopDate': '30.05.2023', 'stopDateEn': '2023-05-30', 'subjectTypeId': 0, 'supervisionType': 'Федеральный государственный санитарно-эпидемиологический контроль (надзор)', 'supervisionTypeId': 4, 'torRegistryExists': False, 'updatePlanDate': None, 'updatePlanDateLong': None, 'version': 'ERKNM', 'violationLawsuitTypeCodes': [], 'violationTypeCodes': [], 'year': 2023}
2023-01-19 12:36:03,050 - [WARNING] - direct_sql.py - new_insert_in_database(269) - Проведена повторная попытка внесения с параметром special, результат неудачный.
2023-01-19 12:36:03,050 - [INFO] - direct_sql.py - database_inserts_conductor_for_multiprocessing(132) - Возникла ошибка, с которой не удалось справиться...
2023-01-19 12:36:03,050 - [INFO] - direct_sql.py - database_inserts_conductor_for_multiprocessing(133) - 
2023-01-19 12:36:03,050 - [INFO] - direct_sql.py - database_inserts_conductor_for_multiprocessing(132) - Возникла ошибка, с которой не удалось справиться...
2023-01-19 12:36:03,051 - [INFO] - direct_sql.py - database_inserts_conductor_for_multiprocessing(133) - 
2023-01-19 12:36:03,070 - [ERROR] - direct_sql.py - new_insert_in_database(267) - (1040, 'ny connections')
2023-01-19 12:36:03,070 - [INFO] - direct_sql.py - new_insert_in_database(268) - {'actCreateDate': None, 'actCreateDateEn': None, 'addresses': ['305035, ОБЛАСТЬ КУРСКАЯ, ГОРОД КУРСК, УЛИЦА ПИОНЕРОВ, 65, 46, 460000010000562'], 'admLevelId': 50001, 'appealed': False, 'approveDocOrderDate': None, 'approveDocOrderNum': None, 'approveDocRequestDate': None, 'approveDocRequestNum': None, 'approveDocs': [], 'approveRequired': False, 'approved': False, 'approvedErknm': 'Отказано', 'chlistCount': 1, 'chlistFilledCount': 1, 'chlistFillingIndicationTypeId': [], 'collaboratingOrganizations': [], 'collaboratingOrganizationsIds': [], 'comment': 'На основании пункта 11(4) постановления Правительства РФ от 10.03.2022 № 336 в планы проведения плановых КНМ на 2023 год не включаются КНМ в отношении государственных и муниципальных учреждений дошкольного и начального общего образования, основного общего и среднего общего образования, объекты которых отнесены к категориям чрезвычайно высокого и высокого риска.', 'controllingOrganization': 'Управления Роспотребнадзора по Курской области', 'controllingOrganizationId': 10001017235, 'createPlanDate': None, 'createPlanDateLong': None, 'createdByErpDb': False, 'createdById': 161797, 'dataNotEqualEGRUL': False, 'dataSetNotInTime': False, 'deleted': False, 'directDurationDays': None, 'disapprove': False, 'district': 'Курская область', 'districtId': 1030380000000001, 'durationDays': None, 'durationHours': 75, 'erknmActViolationIds': [], 'erknmResultKindDecisionIds': [], 'erpId': '46230041000103123262', 'events': [{'startDate': '02.06.2023', 'stopDate': '16.06.2023', 'title': 'Осмотр'}, {'startDate': '02.06.2023', 'stopDate': '16.06.2023', 'title': 'Истребование документов'}, {'startDate': '02.06.2023', 'stopDate': '16.06.2023', 'title': 'Отбор проб (образцов)'}, {'startDate': '02.06.2023', 'stopDate': '16.06.2023', 'title': 'Инструментальное обследование'}, {'startDate': '02.06.2023', 'stopDate': '16.06.2023', 'title': 'Испытание'}, {'startDate': '02.06.2023', 'stopDate': '16.06.2023', 'title': 'Экспертиза'}], 'federalLaw': '248', 'federalLawId': 3, 'fullFieldViolationKnm': False, 'hasViolations': False, 'id': 13195379, 'inn': '4632028199', 'inspectorFullName': [], 'isFromSmev': False, 'isHasApproveDocs': False, 'isHasCollaboratingOrganization': False, 'isHasRequirements': True, 'isHasViolationTerm': False, 'isPm': False, 'kind': 'Выездная проверка', 'knmAnnulled': False, 'knmRejected': False, 'knmType': 'Плановое КНМ', 'knmTypeId': 4, 'legalBasisDocName': [], 'links': [], 'mspCategory': ['Не является субъектом МСП'], 'noPunishment': False, 'notifyLate': False, 'objectsKind': ['Деятельность по организации отдыха детей и их оздоровления, в том числе лагеря с дневным пребыванием'], 'objectsSubKind': ['Деятельность по организации отдыха детей и их оздоровления, в том числе лагеря с дневным пребыванием'], 'objectsType': ['Деятельность и действия'], 'ogrn': '1034637000034', 'oldKnm': None, 'oldPlan': None, 'orderDone': False, 'organizationName': 'МУНИЦИПАЛЬНОЕ БЮДЖЕТНОЕ ОБЩЕОБРАЗОВАТЕЛЬНОЕ УЧРЕЖДЕНИЕ ПРОГИМНАЗИЯ РАДУГА', 'organizationsInn': ['4632028199'], 'organizationsName': ['МУНИЦИПАЛЬНОЕ БЮДЖЕТНОЕ ОБЩЕОБРАЗОВАТЕЛЬНОЕ УЧРЕЖДЕНИЕ ПРОГИМНАЗИЯ РАДУГА'], 'organizationsOgrn': ['1034637000034'], 'planId': '2023050566', 'prosecutorOrganization': 'Прокуратура Курской области', 'prosecutorOrganizationId': 214, 'publishedStatus': 'UNPUBLISHED', 'reasons': [201], 'reasonsList': [{'assignmentDate': None, 'assignmentDateEn': None, 'assignmentNumber': None, 'date': '23.06.2022', 'dateEn': '2022-06-23', 'requirementDetails': None, 'text': '(ФЗ 248) Истечение установленного федеральным законом о виде контроля, положением о виде контроля период времени с даты окончания проведения последнего планового контрольного (надзорного) мероприятия'}], 'recEmptyOrLate': False, 'regDateEgrul': '23.08.2022', 'regDateEgrulEn': '2022-08-23', 'regLate': False, 'regTypes': [], 'requirements': 8, 'requirementsList': [{'nameNpa': 'Федеральный закон О санитарно-эпидемиологическом благополучии населения от 30.03.1999 N 52-ФЗ', 'numberNpa': '30.03.1999', 'title': 'соблюдение требований \nст.12, ст.13, ст.14, ст.15, ст.16, ст.17, ст.18, ст.19, ст.20, ст.21, ст.22, ст.23, ст.24, ст.25, ст.26, ст.27, ст.28, ст.29, ст.30, ст.31, ст.32, ст.33, ст.34, ст.36, ст.40, ст.41'}, {'nameNpa': 'Приказ Минздрава России от 28.01.2021 N 29н «Об утверждении Порядка проведения обязательных предварительных и периодических медицинских осмотров работников, предусмотренных частью четвертой статьи 213 Трудового кодекса Российской Федерации, перечня медицинских противопоказаний к осуществлению работ с вредными и (или) опасными производственными факторами, а также работам, при выполнении которых проводятся обязательные предварительные и периодические медицинские осмотры» ', 'numberNpa': '28.01.2021', 'title': 'соблюдение требований п. 4.1 приложения к Порядку проведения обязательных предварительных и периодических медицинских осмотров работников, предусмотренных частью четвертой статьи 213 Трудового кодекса Российской Федерации'}, {'nameNpa': 'Федеральный закон Об отходах производства и потребления от 24.06.1998 N 89-ФЗ ', 'numberNpa': '24.06.1998', 'title': 'соблюдение требований ч.1 ст.13, ч.1, 3, ст.13.4, ч.1,2 ст.16'}, {'nameNpa': 'СП 2.4.3648-20 «Санитарно – эпидемиологические требования к организациям воспитания и обучения, отдыха и оздоровления детей и молодежи» ', 'numberNpa': '28.09.2020', 'title': 'соблюдение требований п.1.1- п. 2.11.9.; п.3.11- п.3.11.11.'}, {'nameNpa': 'СанПиН 1.2.3685-21 «Гигиенические нормативы и требования к обеспечению безопасности и (или) безвредности для человека факторов среды обитания» : \n  \n', 'numberNpa': '28.01.2021', 'title': 'соблюдение требований раздел V, раздел VI'}, {'nameNpa': 'СанПиН 2.3./2.4.3590-20 «Санитарно – эпидемиологические требования к организации общественного питания населения»   ', 'numberNpa': '27.10.2020', 'title': 'соблюдение требований п.1.1. – п.5.2.; п.8.1.- п. 8.7.6., приложение 1-13   '}, {'nameNpa': 'СанПиН 3.3686-21 Санитарно-эпидемиологические требования по профилактике инфекционных болезней  ', 'numberNpa': '28.01.2021', 'title': 'соблюдение требований п. п. 5, 9-11,13-78, 21, 22, 24, 26, 35, 36, 38-42, 52-54, 58, 62-65, 72, 75-78, 79-89, 90-94, 98-107, 108, 109, 110, 111, 114, 115, 116, 117, 126, 130, 752, 764, 784, 808, 823, 901, 1862, 1880, 1881, 1884, 1885, 1887, 1888, 1890, 1895, 1896, 1898, 1900, 1905, 1997, 1999, 2001, 2008, 2180, 2181, 2182, 2183, 2190, 2368, 2369, 2386, 2387, 2388, 2401, 2405, 2406, 2417, 2426, 2513, 2516, 2518, 2519, 2612, 2613, 2614, 2616, 2623, 2624, 2631, 2665, 2666, 2667, 2677, 2678, 2679, 2680, 2681, 2686, 2694, 2695, 2696, 2709, 2708, 2709, 2710, 2743, 2747, 2751, 2820, 2850, 2851, 2891, 2903, 2905, 2963, 3020, 3071, 3131, 3148, 3149, 3150, 3151, 3152, 3153, 3157, 3263, 3264, 3267, 3268, 3271, 3307, 3366, 3367, 3368, 3369, 3371, 3372, 3373, 3390\n'}, {'nameNpa': 'СП 3.1/2.4.3598-20 «Санитарно – эпидемиологические требования к устройству, содержанию и организации работы образовательных организаций и других объектов социальной инфраструктуры для детей и молодежи в условиях распространении новой \nкоронавирусной инфекции (COVID-19): \n', 'numberNpa': '30.06.2020', 'title': 'соблюдение требований п.1.1.- п.2.7., п.3.1. '}], 'resolved': False, 'resultEmpty': True, 'resultEmptyOrLate': False, 'resultInfoTypeCodes': [], 'resultViolationKnm': False, 'riskCategory': ['чрезвычайно высокий риск'], 'riskCategoryAndDangerClass': ['чрезвычайно высокий риск / Не применяется'], 'sezRegistryExists': False, 'signed': True, 'smevInfoType': None, 'smevMessageType': None, 'smevReceivedAt': None, 'smevReceivedAtEn': None, 'smevReceivedAtMonth': None, 'smevReceivedAtYear': None, 'spvRegistryExists': False, 'startDate': '02.06.2023', 'startDateEn': '2023-06-02', 'status': 'Исключена', 'statusEgrul': 'Найден', 'statusId': 15, 'stopDate': '16.06.2023', 'stopDateEn': '2023-06-16', 'subjectTypeId': 0, 'supervisionType': 'Федеральный государственный санитарно-эпидемиологический контроль (надзор)', 'supervisionTypeId': 4, 'torRegistryExists': False, 'updatePlanDate': None, 'updatePlanDateLong': None, 'version': 'ERKNM', 'violationLawsuitTypeCodes': [], 'violationTypeCodes': [], 'year': 2023}
2023-01-19 12:36:03,070 - [WARNING] - direct_sql.py - new_insert_in_database(269) - Проведена повторная попытка внесения с параметром special, результат неудачный.
2023-01-19 12:36:03,070 - [INFO] - direct_sql.py - new_insert_in_database(268) - {'actCreateDate': None, 'actCreateDateEn': None, 'addresses': ['427405, РЕСПУБЛИКА, УДМУРТСКАЯ, РАЙОН, ВОТКИНСКИЙ, ДЕРЕВНЯ БЕРКУТЫ, УЛИЦА, ЮБИЛЕЙНАЯ, 1, 180050000060005'], 'admLevelId': 50001, 'appealed': False, 'approveDocOrderDate': None, 'approveDocOrderNum': None, 'approveDocRequestDate': None, 'approveDocRequestNum': None, 'approveDocs': [], 'approveRequired': False, 'approved': False, 'approvedErknm': 'Отказано', 'chlistCount': 0, 'chlistFilledCount': 0, 'chlistFillingIndicationTypeId': [], 'collaboratingOrganizations': [], 'collaboratingOrganizationsIds': [], 'comment': 'Несоответствие запланированного планового контрольного (надзорного) мероприятия  требованиям пункта 11(4) Постановления Правительства Российской Федерации от 10.03.2022 № 336 «Об особенностях организации и осуществления государственного контроля (надзора), муниципального контроля». ', 'controllingOrganization': 'Управления Роспотребнадзора по Удмуртской Республике', 'controllingOrganizationId': 10001012486, 'createPlanDate': None, 'createPlanDateLong': None, 'createdByErpDb': False, 'createdById': 168890, 'dataNotEqualEGRUL': False, 'dataSetNotInTime': False, 'deleted': False, 'directDurationDays': None, 'disapprove': False, 'district': 'Удмуртская Республика', 'districtId': 1033940000000001, 'durationDays': 10, 'durationHours': None, 'erknmActViolationIds': [], 'erknmResultKindDecisionIds': [], 'erpId': '18230041000103730063', 'events': [{'startDate': '22.05.2023', 'stopDate': '02.06.2023', 'title': 'Получение письменных объяснений'}, {'startDate': '22.05.2023', 'stopDate': '02.06.2023', 'title': 'Истребование документов'}, {'startDate': '22.05.2023', 'stopDate': '02.06.2023', 'title': 'Экспертиза'}], 'federalLaw': '248', 'federalLawId': 3, 'fullFieldViolationKnm': False, 'hasViolations': False, 'id': 13802180, 'inn': '1804006484', 'inspectorFullName': [], 'isFromSmev': False, 'isHasApproveDocs': False, 'isHasCollaboratingOrganization': False, 'isHasRequirements': True, 'isHasViolationTerm': False, 'isPm': False, 'kind': 'Документарная проверка', 'knmAnnulled': False, 'knmRejected': False, 'knmType': 'Плановое КНМ', 'knmTypeId': 4, 'legalBasisDocName': [], 'links': [], 'mspCategory': ['Не является субъектом МСП'], 'noPunishment': False, 'notifyLate': False, 'objectsKind': ['Основное общее и среднее (полное) общее образование'], 'objectsSubKind': ['Основное общее и среднее (полное) общее образование'], 'objectsType': ['Деятельность и действия'], 'ogrn': '1021801063900', 'oldKnm': None, 'oldPlan': None, 'orderDone': False, 'organizationName': 'МУНИЦИПАЛЬНОЕ БЮДЖЕТНОЕ ОБЩЕОБРАЗОВАТЕЛЬНОЕ УЧРЕЖДЕНИЕ БЕРКУТОВСКАЯ ОСНОВНАЯ ОБЩЕОБРАЗОВАТЕЛЬНАЯ ШКОЛА', 'organizationsInn': ['1804006484'], 'organizationsName': ['МУНИЦИПАЛЬНОЕ БЮДЖЕТНОЕ ОБЩЕОБРАЗОВАТЕЛЬНОЕ УЧРЕЖДЕНИЕ БЕРКУТОВСКАЯ ОСНОВНАЯ ОБЩЕОБРАЗОВАТЕЛЬНАЯ ШКОЛА'], 'organizationsOgrn': ['1021801063900'], 'planId': '2023049688', 'prosecutorOrganization': 'Прокуратура Удмуртской Республики', 'prosecutorOrganizationId': 1324, 'publishedStatus': 'UNPUBLISHED', 'reasons': [201], 'reasonsList': [{'assignmentDate': None, 'assignmentDateEn': None, 'assignmentNumber': None, 'date': '12.05.2022', 'dateEn': '2022-05-12', 'requirementDetails': None, 'text': '(ФЗ 248) Истечение установленного федеральным законом о виде контроля, положением о виде контроля период времени с даты окончания проведения последнего планового контрольного (надзорного) мероприятия'}], 'recEmptyOrLate': False, 'regDateEgrul': '29.09.2022', 'regDateEgrulEn': '2022-09-29', 'regLate': False, 'regTypes': [], 'requirements': 1, 'requirementsList': [{'nameNpa': 'None', 'numberNpa': 'None', 'title': 'None'}], 'resolved': False, 'resultEmpty': True, 'resultEmptyOrLate': False, 'resultInfoTypeCodes': [], 'resultViolationKnm': False, 'riskCategory': ['чрезвычайно высокий риск'], 'riskCategoryAndDangerClass': ['чрезвычайно высокий риск'], 'sezRegistryExists': False, 'signed': True, 'smevInfoType': None, 'smevMessageType': None, 'smevReceivedAt': None, 'smevReceivedAtEn': None, 'smevReceivedAtMonth': None, 'smevReceivedAtYear': None, 'spvRegistryExists': False, 'startDate': '22.05.2023', 'startDateEn': '2023-05-22', 'status': 'Исключена', 'statusEgrul': 'Найден', 'statusId': 15, 'stopDate': '02.06.2023', 'stopDateEn': '2023-06-02', 'subjectTypeId': 0, 'supervisionType': 'Федеральный государственный санитарно-эпидемиологический контроль (надзор)', 'supervisionTypeId': 4, 'torRegistryExists': False, 'updatePlanDate': None, 'updatePlanDateLong': None, 'version': 'ERKNM', 'violationLawsuitTypeCodes': [], 'violationTypeCodes': [], 'year': 2023}
2023-01-19 12:36:03,070 - [WARNING] - direct_sql.py - new_insert_in_database(269) - Проведена повторная попытка внесения с параметром special, результат неудачный.
2023-01-19 12:36:03,070 - [INFO] - direct_sql.py - database_inserts_conductor_for_multiprocessing(132) - Возникла ошибка, с которой не удалось справиться...
2023-01-19 12:36:03,070 - [INFO] - direct_sql.py - database_inserts_conductor_for_multiprocessing(132) - Возникла ошибка, с которой не удалось справиться...
2023-01-19 12:36:03,070 - [INFO] - direct_sql.py - database_inserts_conductor_for_multiprocessing(133) - 
2023-01-19 12:36:03,070 - [INFO] - direct_sql.py - database_inserts_conductor_for_multiprocessing(133) - 
2023-01-19 12:36:03,073 - [ERROR] - direct_sql.py - new_insert_in_database(267) - (1040, 'ny connections')
2023-01-19 12:36:03,073 - [ERROR] - direct_sql.py - new_insert_in_database(267) - (1040, 'ny connections')
2023-01-19 12:36:03,073 - [INFO] - direct_sql.py - new_insert_in_database(268) - {'actCreateDate': None, 'actCreateDateEn': None, 'addresses': ['155030, ОБЛАСТЬ ИВАНОВСКАЯ, РАЙОН ТЕЙКОВСКИЙ, ДЕРЕВНЯ ХАРИНО, ДОМ 37, СТРОЕНИЕ 1, '], 'admLevelId': 50001, 'appealed': False, 'approveDocOrderDate': None, 'approveDocOrderNum': None, 'approveDocRequestDate': None, 'approveDocRequestNum': None, 'approveDocs': [], 'approveRequired': False, 'approved': False, 'approvedErknm': 'Отказано', 'chlistCount': 0, 'chlistFilledCount': 0, 'chlistFillingIndicationTypeId': [], 'collaboratingOrganizations': [], 'collaboratingOrganizationsIds': [], 'comment': 'п. 11 (4) Постановления Правительства РФ от 10.03.2022 № 336', 'controllingOrganization': 'Управление Роспотребнадзора по Ивановской области', 'controllingOrganizationId': 10001013491, 'createPlanDate': None, 'createPlanDateLong': None, 'createdByErpDb': False, 'createdById': 160995, 'dataNotEqualEGRUL': False, 'dataSetNotInTime': False, 'deleted': False, 'directDurationDays': None, 'disapprove': False, 'district': 'Ивановская область', 'districtId': 1030240000000001, 'durationDays': 10, 'durationHours': None, 'erknmActViolationIds': [], 'erknmResultKindDecisionIds': [], 'erpId': '37230041000102886686', 'events': [{'startDate': '12.05.2023', 'stopDate': '25.05.2023', 'title': 'Получение письменных объяснений'}, {'startDate': '12.05.2023', 'stopDate': '25.05.2023', 'title': 'Истребование документов'}], 'federalLaw': '248', 'federalLawId': 3, 'fullFieldViolationKnm': False, 'hasViolations': False, 'id': 12958803, 'inn': '3724003481', 'inspectorFullName': [], 'isFromSmev': False, 'isHasApproveDocs': False, 'isHasCollaboratingOrganization': False, 'isHasRequirements': True, 'isHasViolationTerm': False, 'isPm': False, 'kind': 'Документарная проверка', 'knmAnnulled': False, 'knmRejected': False, 'knmType': 'Плановое КНМ', 'knmTypeId': 4, 'legalBasisDocName': [], 'links': [], 'mspCategory': ['Не является субъектом МСП'], 'noPunishment': False, 'notifyLate': False, 'objectsKind': ['Деятельность по организации отдыха детей и их оздоровления, в том числе лагеря с дневным пребыванием'], 'objectsSubKind': ['Деятельность по организации отдыха детей и их оздоровления, в том числе лагеря с дневным пребыванием'], 'objectsType': ['Деятельность и действия'], 'ogrn': '1023701790386', 'oldKnm': None, 'oldPlan': None, 'orderDone': False, 'organizationName': 'МУНИЦИПАЛЬНОЕ БЮДЖЕТНОЕ ОБЩЕОБРАЗОВАТЕЛЬНОЕ УЧРЕЖДЕНИЕ ТЕЙКОВСКОГО МУНИЦИПАЛЬНОГО РАЙОНА НЕРЛЬСКАЯ СРЕДНЯЯ ОБЩЕОБРАЗОВАТЕЛЬНАЯ ШКОЛА', 'organizationsInn': ['3724003481'], 'organizationsName': ['МУНИЦИПАЛЬНОЕ БЮДЖЕТНОЕ ОБЩЕОБРАЗОВАТЕЛЬНОЕ УЧРЕЖДЕНИЕ ТЕЙКОВСКОГО МУНИЦИПАЛЬНОГО РАЙОНА НЕРЛЬСКАЯ СРЕДНЯЯ ОБЩЕОБРАЗОВАТЕЛЬНАЯ ШКОЛА'], 'organizationsOgrn': ['1023701790386'], 'planId': '2023050673', 'prosecutorOrganization': 'Прокуратура Ивановской области', 'prosecutorOrganizationId': 130, 'publishedStatus': 'UNPUBLISHED', 'reasons': [201], 'reasonsList': [{'assignmentDate': None, 'assignmentDateEn': None, 'assignmentNumber': None, 'date': '24.05.2022', 'dateEn': '2022-05-24', 'requirementDetails': None, 'text': '(ФЗ 248) Истечение установленного федеральным законом о виде контроля, положением о виде контроля период времени с даты окончания проведения последнего планового контрольного (надзорного) мероприятия'}], 'recEmptyOrLate': False, 'regDateEgrul': '16.08.2022', 'regDateEgrulEn': '2022-08-16', 'regLate': False, 'regTypes': [], 'requirements': 8, 'requirementsList': [{'nameNpa': 'Федеральный закон № 52-ФЗ от 30.03.1999 «О санитарно-эпидемиологическом благополучии населения» (ст.12, ст.13, ст.14, ст.15, ст.16, ст.17, ст.18, ст.19, ст.20, ст.21, ст.22, ст.23, ст.24, ст.25, ст.26, ст.27, ст.28, ст.29, ст.30, ст.31, ст.32, ст.33, ст.34, ст.36, ст.40, ст.41, ст.43, п.4 ст.44.1)', 'numberNpa': '30.03.1999', 'title': 'требования санитарного законодательства'}, {'nameNpa': 'Приказ Министерства здравоохранения Российской Федерации № 29н Об утверждении Порядка проведения обязательных предварительных и периодических медицинских осмотров работников, предусмотренных частью четвертой статьи 213 Трудового кодекса Российской Федерации, перечня медицинских противопоказаний к осуществлению работ с вредными и (или) опасными производственными факторами, а также работам, при выполнении которых проводятся обязательные предварительные и периодические медицинские осмотры (п. 4.1 приложения к Порядку проведения обязательных предварительных и периодических медицинских осмотров работников, предусмотренных частью четвертой статьи 213 Трудового кодекса Российской Федерации) ', 'numberNpa': '28.01.2021', 'title': 'требования санитарного законодательства'}, {'nameNpa': 'СП 2.4.3648-20 «Санитарно-эпидемиологические требования к организациям воспитания и обучения, отдыха и оздоровления детей и молодежи» (весь документ) ', 'numberNpa': '28.09.2020', 'title': 'требования санитарного законодательства'}, {'nameNpa': 'СанПиН 2.3/2.4.3590-20 «Санитарно-эпидемиологические требования к организации общественного питания населения» (весь документ) ', 'numberNpa': '27.10.2020', 'title': 'требования санитарного законодательства'}, {'nameNpa': 'СП 3.1./2.4.3598-20 «Санитарно-эпидемиологические требования к устройству, содержанию и организации работы образовательных организаций и других объектов социальной инфраструктуры для детей и молодежи в условиях распространения новой коронавирусной инфекции (COVID-19)» (весь документ) ', 'numberNpa': '30.06.2020', 'title': 'требования санитарного законодательства'}, {'nameNpa': 'СанПиН 1.2.3685-21 «Гигиенические нормативы и требования к обеспечению безопасности и (или) безвредности для человека факторов среды обитания» (весь документ) ', 'numberNpa': '28.01.2021', 'title': 'требования санитарного законодательства'}, {'nameNpa': 'СанПиН 2.1.3684-21 «Санитарно-эпидемиологические требования к содержанию территорий городских и сельских поселений, к водным объектам, питьевой воде и питьевому водоснабжению, атмосферному воздуху, почвам, жилым помещениям, эксплуатации производственных, общественных помещений, организации и проведению санитарно-противоэпидемиологических (профилактических) мероприятий» (весь документ', 'numberNpa': '28.01.2021', 'title': 'требования санитарного законодательства'}, {'nameNpa': 'СанПиН 3.3686-21 Санитарно-эпидемиологические требования по профилактике инфекционных болезней (весь документ) ', 'numberNpa': '28.01.2021', 'title': 'требования санитарного законодательства'}], 'resolved': False, 'resultEmpty': True, 'resultEmptyOrLate': False, 'resultInfoTypeCodes': [], 'resultViolationKnm': False, 'riskCategory': ['чрезвычайно высокий риск'], 'riskCategoryAndDangerClass': ['чрезвычайно высокий риск'], 'sezRegistryExists': False, 'signed': True, 'smevInfoType': None, 'smevMessageType': None, 'smevReceivedAt': None, 'smevReceivedAtEn': None, 'smevReceivedAtMonth': None, 'smevReceivedAtYear': None, 'spvRegistryExists': False, 'startDate': '12.05.2023', 'startDateEn': '2023-05-12', 'status': 'Исключена', 'statusEgrul': 'Найден', 'statusId': 15, 'stopDate': '25.05.2023', 'stopDateEn': '2023-05-25', 'subjectTypeId': 0, 'supervisionType': 'Федеральный государственный санитарно-эпидемиологический контроль (надзор)', 'supervisionTypeId': 4, 'torRegistryExists': False, 'updatePlanDate': None, 'updatePlanDateLong': None, 'version': 'ERKNM', 'violationLawsuitTypeCodes': [], 'violationTypeCodes': [], 'year': 2023}
2023-01-19 12:36:03,073 - [WARNING] - direct_sql.py - new_insert_in_database(269) - Проведена повторная попытка внесения с параметром special, результат неудачный.
2023-01-19 12:36:03,073 - [INFO] - direct_sql.py - database_inserts_conductor_for_multiprocessing(132) - Возникла ошибка, с которой не удалось справиться...
2023-01-19 12:36:03,074 - [INFO] - direct_sql.py - database_inserts_conductor_for_multiprocessing(133) - 
2023-01-19 12:36:03,073 - [INFO] - direct_sql.py - new_insert_in_database(268) - {'actCreateDate': None, 'actCreateDateEn': None, 'addresses': ['629707, АВТОНОМНЫЙ ОКРУГ ЯМАЛО-НЕНЕЦКИЙ, РАЙОН ЯМАЛЬСКИЙ, СЕЛО ПАНАЕВСК, УЛИЦА ШКОЛЬНАЯ, ДОМ 6, КОРПУС А, '], 'admLevelId': 50001, 'appealed': False, 'approveDocOrderDate': None, 'approveDocOrderNum': None, 'approveDocRequestDate': None, 'approveDocRequestNum': None, 'approveDocs': [], 'approveRequired': False, 'approved': False, 'approvedErknm': 'Отказано', 'chlistCount': 1, 'chlistFilledCount': 1, 'chlistFillingIndicationTypeId': [], 'collaboratingOrganizations': [], 'collaboratingOrganizationsIds': [], 'comment': 'Постановление Правительства РФ ', 'controllingOrganization': 'Управление Роспотребнадзора по Ямало-Ненецкому автономному округу', 'controllingOrganizationId': 10001030002, 'createPlanDate': None, 'createPlanDateLong': None, 'createdByErpDb': False, 'createdById': 179267, 'dataNotEqualEGRUL': False, 'dataSetNotInTime': False, 'deleted': False, 'directDurationDays': None, 'disapprove': False, 'district': 'Салехард', 'districtId': 1034711710000001, 'durationDays': 10, 'durationHours': None, 'erknmActViolationIds': [], 'erknmResultKindDecisionIds': [], 'erpId': '89230041000102863353', 'events': [{'startDate': '03.04.2023', 'stopDate': '28.04.2023', 'title': 'Осмотр'}, {'startDate': '03.04.2023', 'stopDate': '28.04.2023', 'title': 'Опрос'}, {'startDate': '03.04.2023', 'stopDate': '28.04.2023', 'title': 'Истребование документов'}, {'startDate': '03.04.2023', 'stopDate': '28.04.2023', 'title': 'Отбор проб (образцов)'}, {'startDate': '03.04.2023', 'stopDate': '28.04.2023', 'title': 'Инструментальное обследование'}, {'startDate': '03.04.2023', 'stopDate': '28.04.2023', 'title': 'Испытание'}, {'startDate': '03.04.2023', 'stopDate': '28.04.2023', 'title': 'Экспертиза'}], 'federalLaw': '248', 'federalLawId': 3, 'fullFieldViolationKnm': False, 'hasViolations': False, 'id': 12935470, 'inn': '8909001126', 'inspectorFullName': [], 'isFromSmev': False, 'isHasApproveDocs': False, 'isHasCollaboratingOrganization': False, 'isHasRequirements': True, 'isHasViolationTerm': False, 'isPm': False, 'kind': 'Выездная проверка', 'knmAnnulled': False, 'knmRejected': False, 'knmType': 'Плановое КНМ', 'knmTypeId': 4, 'legalBasisDocName': [], 'links': [], 'mspCategory': ['Не является субъектом МСП'], 'noPunishment': False, 'notifyLate': False, 'objectsKind': ['Деятельность дошкольных образовательных организаций'], 'objectsSubKind': ['Деятельность дошкольных образовательных организаций'], 'objectsType': ['Деятельность и действия'], 'ogrn': '1028900512321', 'oldKnm': None, 'oldPlan': None, 'orderDone': False, 'organizationName': 'МУНИЦИПАЛЬНОЕ БЮДЖЕТНОЕ ДОШКОЛЬНОЕ ОБРАЗОВАТЕЛЬНОЕ УЧРЕЖДЕНИЕ ПАНАЕВСКИЙ ДЕТСКИЙ САД КРАСНАЯ ШАПОЧКА', 'organizationsInn': ['8909001126'], 'organizationsName': ['МУНИЦИПАЛЬНОЕ БЮДЖЕТНОЕ ДОШКОЛЬНОЕ ОБРАЗОВАТЕЛЬНОЕ УЧРЕЖДЕНИЕ ПАНАЕВСКИЙ ДЕТСКИЙ САД КРАСНАЯ ШАПОЧКА'], 'organizationsOgrn': ['1028900512321'], 'planId': '2023051007', 'prosecutorOrganization': 'Прокуратура Ямало-Ненецкого автономного округа', 'prosecutorOrganizationId': 3065, 'publishedStatus': 'UNPUBLISHED', 'reasons': [201], 'reasonsList': [{'assignmentDate': None, 'assignmentDateEn': None, 'assignmentNumber': None, 'date': '23.03.2022', 'dateEn': '2022-03-23', 'requirementDetails': None, 'text': '(ФЗ 248) Истечение установленного федеральным законом о виде контроля, положением о виде контроля период времени с даты окончания проведения последнего планового контрольного (надзорного) мероприятия'}], 'recEmptyOrLate': False, 'regDateEgrul': '13.08.2022', 'regDateEgrulEn': '2022-08-13', 'regLate': False, 'regTypes': [], 'requirements': 29, 'requirementsList': [{'nameNpa': 'О санитарно-эпидемиологическом благополучии населения', 'numberNpa': '30.03.1999', 'title': 'Федеральный закон № 52-ФЗ'}, {'nameNpa': 'Об иммунопрофилактике инфекционных болезней', 'numberNpa': '17.09.1998', 'title': 'Федеральный закон №157-ФЗ'}, {'nameNpa': 'Об охране здоровья граждан от воздействия окружающего табачного дыма и последствий потребления табака', 'numberNpa': '23.02.2013', 'title': 'Федеральный закон №15-ФЗ'}, {'nameNpa': 'О качестве и безопасности пищевых продуктов', 'numberNpa': '02.01.2000', 'title': 'Федеральный закон N 29-ФЗ'}, {'nameNpa': 'О техническом регулировании', 'numberNpa': '27.12.2002', 'title': 'Федеральный закон N184-ФЗ'}, {'nameNpa': 'Об утверждении порядка проведения обязательных предварительных и периодических медицинских осмотров работников, предусмотренных частью четвертой статьи 213 Трудового Кодекса Российской Федерации, перечня медицинских противопоказаний к осуществлению работ с вредными и (или) опасными производственными факторами, а также работам, при выполнении которых проводятся обязательные предварительные и периодические медицинские осмотры', 'numberNpa': '28.01.2021', 'title': 'Приказ Министерства здравоохранения и социального развития РФ №29н'}, {'nameNpa': 'Об утверждении требований к знаку о запрете курения и к порядку его размещения', 'numberNpa': '12.05.2014', 'title': 'Приказ Министерства здравоохранения РФ №214-н'}, {'nameNpa': '«Об утверждении перечней вредных и (или) опасных производственных факторов и работ, при выполнении которых проводятся обязательные предварительные медицинские осмотры при поступлении на работу и периодические медицинские осмотры»', 'numberNpa': 'None', 'title': 'Приказ Министерства труда и социальной защиты Российской Федерации №988н, Министерства здравоохранения и социального развития Российской Федерации №1420н от 31.12.2020 г. '}, {'nameNpa': '«Об утверждении перечня работ, выполнение которых связано с высоким риском заболевания инфекционными болезнями и требует обязательного проведения профилактических прививок»', 'numberNpa': 'None', 'title': 'Постановление Правительства РФ от 15.07.1999 №825 '}, {'nameNpa': 'Санитарно-эпидемиологические требования к организациям воспитания и обучения, отдыха и оздоровления детей и молодежи', 'numberNpa': 'None', 'title': 'СП 2.4.3648-20'}, {'nameNpa': 'Санитарно-эпидемиологические требования к организации общественного питания населения', 'numberNpa': 'None', 'title': 'СанПиН 2.3/2.4.3590-20'}, {'nameNpa': 'Гигиенические нормативы и требования к обеспечению безопасности и (или) безвредности для человека факторов среды обитания', 'numberNpa': 'None', 'title': 'СанПиН 1.2.3685-21'}, {'nameNpa': 'Санитарно-эпидемиологические требования по профилактике инфекционных болезней', 'numberNpa': '28.01.2021', 'title': 'СанПиН 3.3686-21'}, {'nameNpa': 'Санитарно-эпидемиологические требования к устройству, содержанию и организации работы образовательных организаций и других объектов социальной инфраструктуры для детей и молодежи в условиях распространения новой коронавирусной инфекции (COVID-19)', 'numberNpa': 'None', 'title': 'СП 3.1/2.4.3598-20'}, {'nameNpa': ' Профилактика новой коронавирусной инфекции (COVID-19)', 'numberNpa': 'None', 'title': 'СП 3.1.3597-20'}, {'nameNpa': 'О безопасности пищевой продукции', 'numberNpa': 'None', 'title': 'ТР ТС 021/2011'}, {'nameNpa': 'Пищевая продукция в части ее маркировки', 'numberNpa': 'None', 'title': 'ТР ТС 022/2011'}, {'nameNpa': 'Технический регламент на соковую продукцию из фруктов и овощей', 'numberNpa': 'None', 'title': 'ТР ТС 023/2011'}, {'nameNpa': 'Технический регламент на масложировую продукцию', 'numberNpa': 'None', 'title': 'ТР ТС 024/2011'}, {'nameNpa': 'Требования безопасности пищевых добавок, ароматизаторов и технологических вспомогательных средств', 'numberNpa': 'None', 'title': 'ТР ТС 029/2012'}, {'nameNpa': '«О безопасности молока и молочной продукции»', 'numberNpa': 'None', 'title': 'ТР ТС 033/2013 '}, {'nameNpa': 'О безопасности мяса и мясной продукции', 'numberNpa': 'None', 'title': 'ТР ТС 034/2013'}, {'nameNpa': 'О безопасности рыбы и рыбной продукции', 'numberNpa': 'None', 'title': 'ТР ЕАЭС 040/2016'}, {'nameNpa': 'О безопасности упакованной питьевой воды, включая природную минеральную воду', 'numberNpa': 'None', 'title': 'ТР ЕАЭС 044/2017'}, {'nameNpa': 'О безопасности мебельной продукции', 'numberNpa': 'None', 'title': 'ТР ТС 025/2012'}, {'nameNpa': 'О безопасности продукции, предназначенной для детей и подростков', 'numberNpa': 'None', 'title': 'ТР ТС 007/2011'}, {'nameNpa': 'О безопасности игрушек', 'numberNpa': 'None', 'title': 'ТР ТС 008/2011'}, {'nameNpa': 'О безопасности парфюмерно-косметической продукции', 'numberNpa': 'None', 'title': 'ТР ТС 009/2011'}, {'nameNpa': 'О безопасности продукции легкой промышленности', 'numberNpa': 'None', 'title': 'ТР ТС 017/2011'}], 'resolved': False, 'resultEmpty': True, 'resultEmptyOrLate': False, 'resultInfoTypeCodes': [], 'resultViolationKnm': False, 'riskCategory': ['чрезвычайно высокий риск'], 'riskCategoryAndDangerClass': ['чрезвычайно высокий риск / Не применяется'], 'sezRegistryExists': False, 'signed': True, 'smevInfoType': None, 'smevMessageType': None, 'smevReceivedAt': None, 'smevReceivedAtEn': None, 'smevReceivedAtMonth': None, 'smevReceivedAtYear': None, 'spvRegistryExists': False, 'startDate': '03.04.2023', 'startDateEn': '2023-04-03', 'status': 'Исключена', 'statusEgrul': 'Найден', 'statusId': 15, 'stopDate': '28.04.2023', 'stopDateEn': '2023-04-28', 'subjectTypeId': 0, 'supervisionType': 'Федеральный государственный санитарно-эпидемиологический контроль (надзор)', 'supervisionTypeId': 4, 'torRegistryExists': False, 'updatePlanDate': None, 'updatePlanDateLong': None, 'version': 'ERKNM', 'violationLawsuitTypeCodes': [], 'violationTypeCodes': [], 'year': 2023}
2023-01-19 12:36:03,074 - [WARNING] - direct_sql.py - new_insert_in_database(269) - Проведена повторная попытка внесения с параметром special, результат неудачный.
2023-01-19 12:36:03,074 - [INFO] - direct_sql.py - database_inserts_conductor_for_multiprocessing(132) - Возникла ошибка, с которой не удалось справиться...
2023-01-19 12:36:03,074 - [INFO] - direct_sql.py - database_inserts_conductor_for_multiprocessing(133) - 
2023-01-19 12:36:03,078 - [INFO] - direct_sql.py - new_insert_in_database(268) - {'actCreateDate': None, 'actCreateDateEn': None, 'addresses': ['427321, Удмуртская Республика, Вавожский район, с.Водзимонье, ул.Коммунальная, д.32\n'], 'admLevelId': 50001, 'appealed': False, 'approveDocOrderDate': None, 'approveDocOrderNum': None, 'approveDocRequestDate': None, 'approveDocRequestNum': None, 'approveDocs': [], 'approveRequired': False, 'approved': False, 'approvedErknm': 'Отказано', 'chlistCount': 1, 'chlistFilledCount': 1, 'chlistFillingIndicationTypeId': [], 'collaboratingOrganizations': [], 'collaboratingOrganizationsIds': [], 'comment': 'Несоответствие запланированного планового контрольного (надзорного) мероприятия  требованиям пункта 11(4) Постановления Правительства Российской Федерации от 10.03.2022 № 336 «Об особенностях организации и осуществления государственного контроля (надзора), муниципального контроля». ', 'controllingOrganization': 'Управления Роспотребнадзора по Удмуртской Республике', 'controllingOrganizationId': 10001012486, 'createPlanDate': None, 'createPlanDateLong': None, 'createdByErpDb': False, 'createdById': 177218, 'dataNotEqualEGRUL': False, 'dataSetNotInTime': False, 'deleted': False, 'directDurationDays': None, 'disapprove': False, 'district': 'Удмуртская Республика', 'districtId': 1033940000000001, 'durationDays': 10, 'durationHours': None, 'erknmActViolationIds': [], 'erknmResultKindDecisionIds': [], 'erpId': '18230041000103657933', 'events': [{'startDate': '20.04.2023', 'stopDate': '04.05.2023', 'title': 'Осмотр'}, {'startDate': '20.04.2023', 'stopDate': '04.05.2023', 'title': 'Получение письменных объяснений'}, {'startDate': '20.04.2023', 'stopDate': '04.05.2023', 'title': 'Истребование документов'}, {'startDate': '20.04.2023', 'stopDate': '04.05.2023', 'title': 'Отбор проб (образцов)'}, {'startDate': '20.04.2023', 'stopDate': '04.05.2023', 'title': 'Инструментальное обследование'}, {'startDate': '20.04.2023', 'stopDate': '04.05.2023', 'title': 'Испытание'}, {'startDate': '20.04.2023', 'stopDate': '04.05.2023', 'title': 'Экспертиза'}], 'federalLaw': '248', 'federalLawId': 3, 'fullFieldViolationKnm': False, 'hasViolations': False, 'id': 13730050, 'inn': '1803003184', 'inspectorFullName': [], 'isFromSmev': False, 'isHasApproveDocs': False, 'isHasCollaboratingOrganization': False, 'isHasRequirements': True, 'isHasViolationTerm': False, 'isPm': False, 'kind': 'Выездная проверка', 'knmAnnulled': False, 'knmRejected': False, 'knmType': 'Плановое КНМ', 'knmTypeId': 4, 'legalBasisDocName': [], 'links': [], 'mspCategory': ['Не является субъектом МСП'], 'noPunishment': False, 'notifyLate': False, 'objectsKind': ['Деятельность общеобразовательных организаций'], 'objectsSubKind': ['Деятельность общеобразовательных организаций'], 'objectsType': ['Деятельность и действия'], 'ogrn': '1021800917368', 'oldKnm': None, 'oldPlan': None, 'orderDone': False, 'organizationName': 'МУНИЦИПАЛЬНОЕ ОБЩЕОБРАЗОВАТЕЛЬНОЕ УЧРЕЖДЕНИЕ ВОДЗИМОНСКАЯ СРЕДНЯЯ ОБЩЕОБРАЗОВАТЕЛЬНАЯ ШКОЛА', 'organizationsInn': ['1803003184'], 'organizationsName': ['МУНИЦИПАЛЬНОЕ ОБЩЕОБРАЗОВАТЕЛЬНОЕ УЧРЕЖДЕНИЕ ВОДЗИМОНСКАЯ СРЕДНЯЯ ОБЩЕОБРАЗОВАТЕЛЬНАЯ ШКОЛА'], 'organizationsOgrn': ['1021800917368'], 'planId': '2023049688', 'prosecutorOrganization': 'Прокуратура Удмуртской Республики', 'prosecutorOrganizationId': 1324, 'publishedStatus': 'UNPUBLISHED', 'reasons': [201], 'reasonsList': [{'assignmentDate': None, 'assignmentDateEn': None, 'assignmentNumber': None, 'date': '03.11.2021', 'dateEn': '2021-11-03', 'requirementDetails': None, 'text': '(ФЗ 248) Истечение установленного федеральным законом о виде контроля, положением о виде контроля период времени с даты окончания проведения последнего планового контрольного (надзорного) мероприятия'}], 'recEmptyOrLate': False, 'regDateEgrul': '27.09.2022', 'regDateEgrulEn': '2022-09-27', 'regLate': False, 'regTypes': [], 'requirements': 1, 'requirementsList': [{'nameNpa': 'None', 'numberNpa': 'None', 'title': 'None'}], 'resolved': False, 'resultEmpty': True, 'resultEmptyOrLate': False, 'resultInfoTypeCodes': [], 'resultViolationKnm': False, 'riskCategory': ['чрезвычайно высокий риск'], 'riskCategoryAndDangerClass': ['чрезвычайно высокий риск'], 'sezRegistryExists': False, 'signed': True, 'smevInfoType': None, 'smevMessageType': None, 'smevReceivedAt': None, 'smevReceivedAtEn': None, 'smevReceivedAtMonth': None, 'smevReceivedAtYear': None, 'spvRegistryExists': False, 'startDate': '20.04.2023', 'startDateEn': '2023-04-20', 'status': 'Исключена', 'statusEgrul': 'Найден', 'statusId': 15, 'stopDate': '04.05.2023', 'stopDateEn': '2023-05-04', 'subjectTypeId': 0, 'supervisionType': 'Федеральный государственный санитарно-эпидемиологический контроль (надзор)', 'supervisionTypeId': 4, 'torRegistryExists': False, 'updatePlanDate': None, 'updatePlanDateLong': None, 'version': 'ERKNM', 'violationLawsuitTypeCodes': [], 'violationTypeCodes': [], 'year': 2023}
2023-01-19 12:36:03,079 - [WARNING] - direct_sql.py - new_insert_in_database(269) - Проведена повторная попытка внесения с параметром special, результат неудачный.
2023-01-19 12:36:03,079 - [INFO] - direct_sql.py - database_inserts_conductor_for_multiprocessing(132) - Возникла ошибка, с которой не удалось справиться...
2023-01-19 12:36:03,080 - [INFO] - direct_sql.py - database_inserts_conductor_for_multiprocessing(133) - 
2023-01-19 12:36:03,097 - [ERROR] - direct_sql.py - new_insert_in_database(267) - (1040, 'ny connections')
2023-01-19 12:36:03,097 - [INFO] - direct_sql.py - new_insert_in_database(268) - {'actCreateDate': None, 'actCreateDateEn': None, 'addresses': ['153048, ОБЛАСТЬ ИВАНОВСКАЯ, ГОРОД ИВАНОВО, МИКРОРАЙОН 30-Й, ДОМ 19, КВАРТИРА 151'], 'admLevelId': 50001, 'appealed': False, 'approveDocOrderDate': None, 'approveDocOrderNum': None, 'approveDocRequestDate': None, 'approveDocRequestNum': None, 'approveDocs': [], 'approveRequired': False, 'approved': True, 'approvedErknm': 'Согласовано', 'chlistCount': 0, 'chlistFilledCount': 0, 'chlistFillingIndicationTypeId': [], 'collaboratingOrganizations': [], 'collaboratingOrganizationsIds': [], 'comment': None, 'controllingOrganization': 'Управление Роспотребнадзора по Ивановской области', 'controllingOrganizationId': 10001013491, 'createPlanDate': None, 'createPlanDateLong': None, 'createdByErpDb': False, 'createdById': 162935, 'dataNotEqualEGRUL': False, 'dataSetNotInTime': True, 'deleted': False, 'directDurationDays': None, 'disapprove': False, 'district': 'Ивановская область', 'districtId': 1030240000000001, 'durationDays': 10, 'durationHours': None, 'erknmActViolationIds': [], 'erknmResultKindDecisionIds': [], 'erpId': '37230041000103221871', 'events': [{'startDate': '15.05.2023', 'stopDate': '26.05.2023', 'title': 'Получение письменных объяснений'}, {'startDate': '15.05.2023', 'stopDate': '26.05.2023', 'title': 'Истребование документов'}, {'startDate': '15.05.2023', 'stopDate': '26.05.2023', 'title': 'Экспертиза'}], 'federalLaw': '248', 'federalLawId': 3, 'fullFieldViolationKnm': False, 'hasViolations': False, 'id': 13293988, 'inn': '3702557084', 'inspectorFullName': [], 'isFromSmev': False, 'isHasApproveDocs': False, 'isHasCollaboratingOrganization': False, 'isHasRequirements': True, 'isHasViolationTerm': False, 'isPm': False, 'kind': 'Документарная проверка', 'knmAnnulled': False, 'knmRejected': False, 'knmType': 'Плановое КНМ', 'knmTypeId': 4, 'legalBasisDocName': [], 'links': [], 'mspCategory': ['Микропредприятие'], 'noPunishment': False, 'notifyLate': False, 'objectsKind': ['Деятельность по организации отдыха детей и их оздоровления, в том числе лагеря с дневным пребыванием'], 'objectsSubKind': ['Деятельность по организации отдыха детей и их оздоровления, в том числе лагеря с дневным пребыванием'], 'objectsType': ['Деятельность и действия'], 'ogrn': '1083700000416', 'oldKnm': None, 'oldPlan': None, 'orderDone': False, 'organizationName': 'ОБЩЕСТВО С ОГРАНИЧЕННОЙ ОТВЕТСТВЕННОСТЬЮ ЗАГОРОДНЫЙ ОЗДОРОВИТЕЛЬНЫЙ ЦЕНТР ЛОМЫ', 'organizationsInn': ['3702557084'], 'organizationsName': ['ОБЩЕСТВО С ОГРАНИЧЕННОЙ ОТВЕТСТВЕННОСТЬЮ ЗАГОРОДНЫЙ ОЗДОРОВИТЕЛЬНЫЙ ЦЕНТР ЛОМЫ'], 'organizationsOgrn': ['1083700000416'], 'planId': '2023050673', 'prosecutorOrganization': 'Прокуратура Ивановской области', 'prosecutorOrganizationId': 130, 'publishedStatus': 'PUBLISHED', 'reasons': [201], 'reasonsList': [{'assignmentDate': None, 'assignmentDateEn': None, 'assignmentNumber': None, 'date': '31.05.2022', 'dateEn': '2022-05-31', 'requirementDetails': None, 'text': '(ФЗ 248) Истечение установленного федеральным законом о виде контроля, положением о виде контроля период времени с даты окончания проведения последнего планового контрольного (надзорного) мероприятия'}], 'recEmptyOrLate': False, 'regDateEgrul': '31.08.2022', 'regDateEgrulEn': '2022-08-31', 'regLate': False, 'regTypes': ['MSP'], 'requirements': 9, 'requirementsList': [{'nameNpa': 'None', 'numberNpa': 'None', 'title': 'None'}, {'nameNpa': 'None', 'numberNpa': 'None', 'title': 'None'}, {'nameNpa': 'None', 'numberNpa': 'None', 'title': 'None'}, {'nameNpa': 'None', 'numberNpa': 'None', 'title': 'None'}, {'nameNpa': 'None', 'numberNpa': 'None', 'title': 'None'}, {'nameNpa': 'None', 'numberNpa': 'None', 'title': 'None'}, {'nameNpa': 'None', 'numberNpa': 'None', 'title': 'None'}, {'nameNpa': 'None', 'numberNpa': 'None', 'title': 'None'}, {'nameNpa': 'None', 'numberNpa': 'None', 'title': 'None'}], 'resolved': False, 'resultEmpty': True, 'resultEmptyOrLate': False, 'resultInfoTypeCodes': [], 'resultViolationKnm': False, 'riskCategory': ['чрезвычайно высокий риск'], 'riskCategoryAndDangerClass': ['чрезвычайно высокий риск'], 'sezRegistryExists': False, 'signed': True, 'smevInfoType': None, 'smevMessageType': None, 'smevReceivedAt': None, 'smevReceivedAtEn': None, 'smevReceivedAtMonth': None, 'smevReceivedAtYear': None, 'spvRegistryExists': False, 'startDate': '15.05.2023', 'startDateEn': '2023-05-15', 'status': 'Ожидает проведения', 'statusEgrul': 'Найден', 'statusId': 5, 'stopDate': None, 'stopDateEn': None, 'subjectTypeId': 0, 'supervisionType': 'Федеральный государственный санитарно-эпидемиологический контроль (надзор)', 'supervisionTypeId': 4, 'torRegistryExists': False, 'updatePlanDate': None, 'updatePlanDateLong': None, 'version': 'ERKNM', 'violationLawsuitTypeCodes': [], 'violationTypeCodes': [], 'year': 2023}
2023-01-19 12:36:03,098 - [WARNING] - direct_sql.py - new_insert_in_database(269) - Проведена повторная попытка внесения с параметром special, результат неудачный.
2023-01-19 12:36:03,098 - [INFO] - direct_sql.py - database_inserts_conductor_for_multiprocessing(132) - Возникла ошибка, с которой не удалось справиться...
2023-01-19 12:36:03,098 - [INFO] - direct_sql.py - database_inserts_conductor_for_multiprocessing(133) - 
2023-01-19 12:36:03,104 - [ERROR] - direct_sql.py - new_insert_in_database(267) - (1040, 'ny connections')
2023-01-19 12:36:03,104 - [ERROR] - direct_sql.py - new_insert_in_database(267) - (1040, 'ny connections')
2023-01-19 12:36:03,105 - [INFO] - direct_sql.py - new_insert_in_database(268) - {'actCreateDate': None, 'actCreateDateEn': None, 'addresses': ['671938, РЕСПУБЛИКА БУРЯТИЯ, РАЙОН ЗАКАМЕНСКИЙ, УЛУС ЦАГАН-МОРИН, УЛИЦА ЦЕНТРАЛЬНАЯ, 11 (лагерь с дневным пребыванием)'], 'admLevelId': 50001, 'appealed': False, 'approveDocOrderDate': None, 'approveDocOrderNum': None, 'approveDocRequestDate': None, 'approveDocRequestNum': None, 'approveDocs': [], 'approveRequired': False, 'approved': False, 'approvedErknm': 'Отказано', 'chlistCount': 0, 'chlistFilledCount': 0, 'chlistFillingIndicationTypeId': [], 'collaboratingOrganizations': [], 'collaboratingOrganizationsIds': [], 'comment': 'пункты 11 (3), 11 (4) Постановления Правительства Российской Федерации от 10.03.2022 № 336', 'controllingOrganization': 'Управление Роспотребнадзора по Республике Бурятия', 'controllingOrganizationId': 10001012187, 'createPlanDate': None, 'createPlanDateLong': None, 'createdByErpDb': False, 'createdById': 203596, 'dataNotEqualEGRUL': False, 'dataSetNotInTime': False, 'deleted': False, 'directDurationDays': None, 'disapprove': False, 'district': 'Республика Бурятия', 'districtId': 1036810000000001, 'durationDays': 10, 'durationHours': None, 'erknmActViolationIds': [], 'erknmResultKindDecisionIds': [], 'erpId': '03230041000103427767', 'events': [{'startDate': '04.05.2023', 'stopDate': '19.05.2023', 'title': 'Получение письменных объяснений'}, {'startDate': '04.05.2023', 'stopDate': '19.05.2023', 'title': 'Истребование документов'}], 'federalLaw': '248', 'federalLawId': 3, 'fullFieldViolationKnm': False, 'hasViolations': False, 'id': 13499884, 'inn': '0307031249', 'inspectorFullName': [], 'isFromSmev': False, 'isHasApproveDocs': False, 'isHasCollaboratingOrganization': False, 'isHasRequirements': True, 'isHasViolationTerm': False, 'isPm': False, 'kind': 'Документарная проверка', 'knmAnnulled': False, 'knmRejected': False, 'knmType': 'Плановое КНМ', 'knmTypeId': 4, 'legalBasisDocName': [], 'links': [], 'mspCategory': ['Не является субъектом МСП'], 'noPunishment': False, 'notifyLate': False, 'objectsKind': ['Деятельность по организации отдыха детей и их оздоровления, в том числе лагеря с дневным пребыванием'], 'objectsSubKind': ['Деятельность по организации отдыха детей и их оздоровления, в том числе лагеря с дневным пребыванием'], 'objectsType': ['Деятельность и действия'], 'ogrn': '1030300750886', 'oldKnm': None, 'oldPlan': None, 'orderDone': False, 'organizationName': 'МУНИЦИПАЛЬНОЕ АВТОНОМНОЕ ОБЩЕОБРАЗОВАТЕЛЬНОЕ УЧРЕЖДЕНИЕ ЦАГАН-МОРИНСКАЯ СРЕДНЯЯ ОБЩЕОБРАЗОВАТЕЛЬНАЯ ШКОЛА', 'organizationsInn': ['0307031249'], 'organizationsName': ['МУНИЦИПАЛЬНОЕ АВТОНОМНОЕ ОБЩЕОБРАЗОВАТЕЛЬНОЕ УЧРЕЖДЕНИЕ ЦАГАН-МОРИНСКАЯ СРЕДНЯЯ ОБЩЕОБРАЗОВАТЕЛЬНАЯ ШКОЛА'], 'organizationsOgrn': ['1030300750886'], 'planId': '2023058837', 'prosecutorOrganization': 'Прокуратура Республики Бурятия', 'prosecutorOrganizationId': 2511, 'publishedStatus': 'UNPUBLISHED', 'reasons': [204], 'reasonsList': [{'assignmentDate': None, 'assignmentDateEn': None, 'assignmentNumber': None, 'date': '04.07.2022', 'dateEn': '2022-07-04', 'requirementDetails': None, 'text': '(ФЗ 248) Истечение установленного федеральным законом о виде контроля, положением о виде контроля периода времени с даты иного события, установленного федеральным законом о виде контроля, положением о виде контроля, которое ведет к возникновению объекта контроля'}], 'recEmptyOrLate': False, 'regDateEgrul': '15.09.2022', 'regDateEgrulEn': '2022-09-15', 'regLate': False, 'regTypes': [], 'requirements': 17, 'requirementsList': [{'nameNpa': 'None', 'numberNpa': 'None', 'title': 'None'}, {'nameNpa': 'None', 'numberNpa': 'None', 'title': 'None'}, {'nameNpa': 'None', 'numberNpa': 'None', 'title': 'None'}, {'nameNpa': 'None', 'numberNpa': 'None', 'title': 'None'}, {'nameNpa': 'None', 'numberNpa': 'None', 'title': 'None'}, {'nameNpa': 'None', 'numberNpa': 'None', 'title': 'None'}, {'nameNpa': 'None', 'numberNpa': 'None', 'title': 'None'}, {'nameNpa': 'None', 'numberNpa': 'None', 'title': 'None'}, {'nameNpa': 'None', 'numberNpa': 'None', 'title': 'None'}, {'nameNpa': 'None', 'numberNpa': 'None', 'title': 'None'}, {'nameNpa': 'None', 'numberNpa': 'None', 'title': 'None'}, {'nameNpa': 'None', 'numberNpa': 'None', 'title': 'None'}, {'nameNpa': 'None', 'numberNpa': 'None', 'title': 'None'}, {'nameNpa': 'None', 'numberNpa': 'None', 'title': 'None'}, {'nameNpa': 'None', 'numberNpa': 'None', 'title': 'None'}, {'nameNpa': 'None', 'numberNpa': 'None', 'title': 'None'}, {'nameNpa': 'None', 'numberNpa': 'None', 'title': 'None'}], 'resolved': False, 'resultEmpty': True, 'resultEmptyOrLate': False, 'resultInfoTypeCodes': [], 'resultViolationKnm': False, 'riskCategory': ['чрезвычайно высокий риск'], 'riskCategoryAndDangerClass': ['чрезвычайно высокий риск'], 'sezRegistryExists': False, 'signed': True, 'smevInfoType': None, 'smevMessageType': None, 'smevReceivedAt': None, 'smevReceivedAtEn': None, 'smevReceivedAtMonth': None, 'smevReceivedAtYear': None, 'spvRegistryExists': False, 'startDate': '04.05.2023', 'startDateEn': '2023-05-04', 'status': 'Исключена', 'statusEgrul': 'В процессе поиска', 'statusId': 15, 'stopDate': '19.05.2023', 'stopDateEn': '2023-05-19', 'subjectTypeId': 0, 'supervisionType': 'Федеральный государственный санитарно-эпидемиологический контроль (надзор)', 'supervisionTypeId': 4, 'torRegistryExists': False, 'updatePlanDate': None, 'updatePlanDateLong': None, 'version': 'ERKNM', 'violationLawsuitTypeCodes': [], 'violationTypeCodes': [], 'year': 2023}
2023-01-19 12:36:03,105 - [WARNING] - direct_sql.py - new_insert_in_database(269) - Проведена повторная попытка внесения с параметром special, результат неудачный.
2023-01-19 12:36:03,105 - [INFO] - direct_sql.py - database_inserts_conductor_for_multiprocessing(132) - Возникла ошибка, с которой не удалось справиться...
2023-01-19 12:36:03,104 - [INFO] - direct_sql.py - new_insert_in_database(268) - {'actCreateDate': None, 'actCreateDateEn': None, 'addresses': ['169316, РЕСПУБЛИКА КОМИ, ГОРОД УХТА, УЛИЦА СОВЕТСКАЯ, 5, ', 'Республика Коми, г. Ухта, ул. Советская, д.5\n'], 'admLevelId': 50001, 'appealed': False, 'approveDocOrderDate': None, 'approveDocOrderNum': None, 'approveDocRequestDate': None, 'approveDocRequestNum': None, 'approveDocs': [], 'approveRequired': False, 'approved': False, 'approvedErknm': 'Отказано', 'chlistCount': 2, 'chlistFilledCount': 2, 'chlistFillingIndicationTypeId': [], 'collaboratingOrganizations': [], 'collaboratingOrganizationsIds': [], 'comment': 'в силу положений п. 11(4) постановления Правительства Российской Федерации от 10.03.2022 № 336 в планы проведения плановых КНМ не подлежат включению плановые КНМ  в отношении государственных и муниципальных учреждений дошкольного и начального общего, основного общего и среднего общего образования, объекты контроля которых отнесены к категориям чрезвычайно высокого и высокого риска', 'controllingOrganization': 'Управление Роспотребнадзора по Республике Коми', 'controllingOrganizationId': 10001016637, 'createPlanDate': None, 'createPlanDateLong': None, 'createdByErpDb': False, 'createdById': 160403, 'dataNotEqualEGRUL': False, 'dataSetNotInTime': False, 'deleted': False, 'directDurationDays': None, 'disapprove': False, 'district': 'Республика Коми', 'districtId': 1031870000000001, 'durationDays': 10, 'durationHours': None, 'erknmActViolationIds': [], 'erknmResultKindDecisionIds': [], 'erpId': '11230041000103539103', 'events': [{'startDate': '05.06.2023', 'stopDate': '19.06.2023', 'title': 'Осмотр'}, {'startDate': '05.06.2023', 'stopDate': '19.06.2023', 'title': 'Опрос'}, {'startDate': '05.06.2023', 'stopDate': '19.06.2023', 'title': 'Получение письменных объяснений'}, {'startDate': '05.06.2023', 'stopDate': '19.06.2023', 'title': 'Истребование документов'}, {'startDate': '05.06.2023', 'stopDate': '19.06.2023', 'title': 'Отбор проб (образцов)'}, {'startDate': '05.06.2023', 'stopDate': '19.06.2023', 'title': 'Испытание'}, {'startDate': '05.06.2023', 'stopDate': '19.06.2023', 'title': 'Экспертиза'}], 'federalLaw': '248', 'federalLawId': 3, 'fullFieldViolationKnm': False, 'hasViolations': False, 'id': 13611220, 'inn': '1102025662', 'inspectorFullName': [], 'isFromSmev': False, 'isHasApproveDocs': False, 'isHasCollaboratingOrganization': False, 'isHasRequirements': True, 'isHasViolationTerm': False, 'isPm': False, 'kind': 'Выездная проверка', 'knmAnnulled': False, 'knmRejected': False, 'knmType': 'Плановое КНМ', 'knmTypeId': 4, 'legalBasisDocName': [], 'links': [], 'mspCategory': ['Не является субъектом МСП'], 'noPunishment': False, 'notifyLate': False, 'objectsKind': ['Деятельность по организации отдыха детей и их оздоровления, в том числе лагеря с дневным пребыванием', 'Деятельность по организации отдыха детей и их оздоровления, в том числе лагеря с дневным пребыванием'], 'objectsSubKind': ['Деятельность по организации отдыха детей и их оздоровления, в том числе лагеря с дневным пребыванием', 'Деятельность по организации отдыха детей и их оздоровления, в том числе лагеря с дневным пребыванием'], 'objectsType': ['Деятельность и действия', 'Деятельность и действия'], 'ogrn': '1021100737426', 'oldKnm': None, 'oldPlan': None, 'orderDone': False, 'organizationName': 'МУНИЦИПАЛЬНОЕ ОБЩЕОБРАЗОВАТЕЛЬНОЕ УЧРЕЖДЕНИЕ СРЕДНЯЯ ОБЩЕОБРАЗОВАТЕЛЬНАЯ ШКОЛА №21 С УГЛУБЛЕННЫМ ИЗУЧЕНИЕМ ОТДЕЛЬНЫХ ПРЕДМЕТОВ', 'organizationsInn': ['1102025662'], 'organizationsName': ['МУНИЦИПАЛЬНОЕ ОБЩЕОБРАЗОВАТЕЛЬНОЕ УЧРЕЖДЕНИЕ СРЕДНЯЯ ОБЩЕОБРАЗОВАТЕЛЬНАЯ ШКОЛА №21 С УГЛУБЛЕННЫМ ИЗУЧЕНИЕМ ОТДЕЛЬНЫХ ПРЕДМЕТОВ'], 'organizationsOgrn': ['1021100737426'], 'planId': '2023059758', 'prosecutorOrganization': 'Прокуратура Республики Коми', 'prosecutorOrganizationId': 654, 'publishedStatus': 'UNPUBLISHED', 'reasons': [204], 'reasonsList': [{'assignmentDate': None, 'assignmentDateEn': None, 'assignmentNumber': None, 'date': '01.06.2023', 'dateEn': '2023-06-01', 'requirementDetails': None, 'text': '(ФЗ 248) Истечение установленного федеральным законом о виде контроля, положением о виде контроля периода времени с даты иного события, установленного федеральным законом о виде контроля, положением о виде контроля, которое ведет к возникновению объекта контроля'}], 'recEmptyOrLate': False, 'regDateEgrul': '21.09.2022', 'regDateEgrulEn': '2022-09-21', 'regLate': False, 'regTypes': [], 'requirements': 1, 'requirementsList': [{'nameNpa': 'Федеральный закон №52-ФЗ от 30.03.1999 г. «О санитарно-эпидемиологическом благополучии населения» (ст.15, ст.17, ст.19, ст.21, ст.22, ст.24, ст.28, ст.29, ст.31, ст.32, ст.34, ст.36);\n- Федеральный закон от 24.07.1998г. № 124-ФЗ «Об основных гарантиях прав ребенка в Российской Федерации» (п.2 ст. 12);\n- Федеральный закон от 02.01.2000г. № 29-ФЗ «О качестве и безопасности пищевых продуктов» (п.1-3 ст. 3; п.1, 2 ст.5; п. 1, 3 ст.9; ст.15; ст.17; ст.20; ст.23; ст.24; п.1 ст.25.1; ст.25.2);\n- Федеральный закон от 23.02.2013г. №15-ФЗ «Об охране здоровья граждан от воздействия окружающего табачного дыма, последствий потребления табака или потребления никотинсодержащей продукции» (ст. 12, ст.20);\n- Федеральный закон от 17.09.1998 г. №157-ФЗ «Об иммунопрофилактике инфекционных болезней» (ст. 9, п. 4 ст.11);\n- Федеральный закон от 18.06.2001г. № 77-ФЗ «О предупреждении распро-странения туберкулёза в Российской Федерации» (п.п. 3, 4 ст. 8);\n- Федеральный закон от 24.06.1998 № 89-ФЗ Об отходах производства и потребления (ч.ч.1, 3 ст.13.4);\n- Технический регламент Таможенного союза «О безопасности пищевой продукции» ТР ТС 021/2011 (за исключением статьи 6, абзацев 2, 7, 12-14 части 5 статьи 7, части 3 статьи 13, части 2 статьи 18, статей 30 и 40); \n- Технический регламент Таможенного союза «Пищевая продукция в части её маркировки» ТР ТС 022/2011;\n- Технический регламент Таможенного союза «Технический регламент на соковую продукцию из фруктов и овощей» ТР ТС 023/2011 (ст. 3 - ст. 8);\n- Технический регламент Таможенного союза «Технический регламент на масложировую продукцию» ТР ТС 024/2011;\n- Технический регламент Таможенного союза «О безопасности мебельной продукции» ТР ТС 025/2012 (ст. 4 – ст.7);\n- Технический регламент Таможенного союза «О безопасности отдельных видов специализированной пищевой продукции, в том числе диетического, лечебного и диетического профилактического питания» ТР ТС 027/2012;\n- Технический регламент Таможенного союза «Требования безопасности пищевых добавок, ароматизаторов и технологических вспомогательных средств» ТР ТС 029/2012;\n- Технический регламент Таможенного союза «О безопасности молока и молочной продукции» ТР ТС 033/2013 (за исключением пунктов 13, 14, 97, 98 и 115);\n- Технический регламент Таможенного союза «О безопасности мяса и мясной продукции» ТР ТС 034/2013 (за исключением пунктов 1-8, 26-48, 53, 54 и абзаца 2 пункта 99);\n- Разделы IV и V (за исключением пункта 14), VIII, IX, X, XI (за исключе-нием пунктов 85, 86), XII Технического регламента Евразийского экономического союза «О безопасности рыбы и рыбной продукции» ТР ЕАЭС 040/2016;\n- разделы III, IV, V, VI, VII и X Технического регламента Евразийского эко-номического союза «О безопасности упакованной питьевой воды, включая природную минеральную воду» ТР ЕАЭС 044/2017; \n- Технический регламент Таможенного союза «О безопасности игрушек» ТР ТС 008/2011 (ст. 3 – ст. 7); \n- Технический регламент Таможенного союза «О безопасности продукции, предназначенной для детей и подростков» ТР ТС 007/2011 (ст. 3 – ст. 11, ст 13);\n- раздел IV, пункты 15, 16, подпункты а, д пункта 18 раздела VI, пункт 49 раздела VIII, разделы IX и X в части требований к покрытию для детских игровых площадок и связанным с ним процессам Технического регламента Евразийского экономического союза О безопасности оборудования для детских игровых площадок ТР ЕАЭС 042/2017; \n- Единые санитарно-эпидемиологические и гигиенические требования к то-варам, подлежащим санитарно-эпидемиологическому надзору (контролю), утвержденные решением Комиссии Таможенного союза 28.05.2010 № 299;   \n- СП 2.4.3648-20 Санитарно-эпидемиологические требования к организациям воспитания и обучения, отдыха и оздоровления детей и молодежи\n- СП 3.1/2.4.3598-20 «Санитарно-эпидемиологические требования к устрой-ству, содержанию и организации работы образовательных организаций и других объектов социальной инфраструктуры для детей и молодежи в усло-виях распространения новой коронавирусной инфекции (COVID-19)»; \n- СанПиН 2.3/2.4.3590-20 «Санитарно-эпидемиологические требования к организации общественного питания населения»;\n- СанПиН 1.2.3685-21 «Гигиенические нормативы и требования к обеспече-нию безопасности и (или) безвредности для человека факторов среды обитания»;\n- СанПиН 2.1.3684-21 «Санитарно-эпидемиологические требования к содержанию территорий городских и сельских поселений, к водным объектам, питьевой воде и питьевому водоснабжению, атмосферному воздуху, почвам, жилым помещениям, эксплуатации производственных, общественных помещений, организации и проведению санитарно-противоэпидемических (профилактических) мероприятий»;\n- СП 3.1.3597-20 Профилактика новой коронавирусной инфекции (COVID-19)\n- СанПиН 3.3686-21 Санитарно-эпидемиологические требования по профилактике инфекционных болезней; \n- СП 2.2.3670-20 «Санитарно-эпидемиологические требования к условиям труда»;\n- приказ Министерства труда и социальной защиты Российской Федерации и Министерства здравоохранения Российской Федерации от 31.12.2020 г. № 988н/1420н «Об утверждении перечня вредных и (или) опасных производственных факторов и работ, при выполнении которых проводятся обязательные предварительные медицинские осмотры при поступлении на работу и периодические медицинские осмотры»;\n- приказ Министерства здравоохранения Российской Федерации от 28.01.2021 года № 29н «Об утверждении Порядка проведения обязательных предварительных и периодических медицинских осмотров работников, предусмотренных частью четвертой статьи 213 Трудового кодекса Российской Федерации, перечня медицинских противопоказаний к осуществлению работ с вредными и (или) опасными производственными факторами, а также работам, при выполнении которых проводятся обязательные предварительные и периодические медицинские осмотры»\n\n', 'numberNpa': '30.03.1999', 'title': 'Соблюдение обязательных требований'}], 'resolved': False, 'resultEmpty': True, 'resultEmptyOrLate': False, 'resultInfoTypeCodes': [], 'resultViolationKnm': False, 'riskCategory': ['чрезвычайно высокий риск', 'чрезвычайно высокий риск'], 'riskCategoryAndDangerClass': ['чрезвычайно высокий риск / Первый', 'чрезвычайно высокий риск / Первый'], 'sezRegistryExists': False, 'signed': True, 'smevInfoType': None, 'smevMessageType': None, 'smevReceivedAt': None, 'smevReceivedAtEn': None, 'smevReceivedAtMonth': None, 'smevReceivedAtYear': None, 'spvRegistryExists': False, 'startDate': '05.06.2023', 'startDateEn': '2023-06-05', 'status': 'Исключена', 'statusEgrul': 'Найден', 'statusId': 15, 'stopDate': None, 'stopDateEn': None, 'subjectTypeId': 0, 'supervisionType': 'Федеральный государственный санитарно-эпидемиологический контроль (надзор)', 'supervisionTypeId': 4, 'torRegistryExists': False, 'updatePlanDate': None, 'updatePlanDateLong': None, 'version': 'ERKNM', 'violationLawsuitTypeCodes': [], 'violationTypeCodes': [], 'year': 2023}
2023-01-19 12:36:03,105 - [INFO] - direct_sql.py - database_inserts_conductor_for_multiprocessing(133) - 
2023-01-19 12:36:03,105 - [WARNING] - direct_sql.py - new_insert_in_database(269) - Проведена повторная попытка внесения с параметром special, результат неудачный.
2023-01-19 12:36:03,105 - [INFO] - direct_sql.py - database_inserts_conductor_for_multiprocessing(132) - Возникла ошибка, с которой не удалось справиться...
2023-01-19 12:36:03,106 - [INFO] - direct_sql.py - database_inserts_conductor_for_multiprocessing(133) - 
2023-01-19 12:36:03,113 - [ERROR] - direct_sql.py - new_insert_in_database(267) - (1040, 'ny connections')
2023-01-19 12:36:03,114 - [INFO] - direct_sql.py - new_insert_in_database(268) - {'actCreateDate': None, 'actCreateDateEn': None, 'addresses': ['155051, ОБЛАСТЬ ИВАНОВСКАЯ, РАЙОН ТЕЙКОВСКИЙ, СЕЛО НОВОЕ ЛЕУШИНО, УЛИЦА ЛЕНИНА, 1, 37, 370170000760008'], 'admLevelId': 50001, 'appealed': False, 'approveDocOrderDate': None, 'approveDocOrderNum': None, 'approveDocRequestDate': None, 'approveDocRequestNum': None, 'approveDocs': [], 'approveRequired': False, 'approved': False, 'approvedErknm': 'Отказано', 'chlistCount': 0, 'chlistFilledCount': 0, 'chlistFillingIndicationTypeId': [], 'collaboratingOrganizations': [], 'collaboratingOrganizationsIds': [], 'comment': 'п. 11 (4) Постановления Правительства РФ от 10.03.2022 № 336', 'controllingOrganization': 'Управление Роспотребнадзора по Ивановской области', 'controllingOrganizationId': 10001013491, 'createPlanDate': None, 'createPlanDateLong': None, 'createdByErpDb': False, 'createdById': 160995, 'dataNotEqualEGRUL': False, 'dataSetNotInTime': False, 'deleted': False, 'directDurationDays': None, 'disapprove': False, 'district': 'Ивановская область', 'districtId': 1030240000000001, 'durationDays': 10, 'durationHours': None, 'erknmActViolationIds': [], 'erknmResultKindDecisionIds': [], 'erpId': '37230041000102886945', 'events': [{'startDate': '12.05.2023', 'stopDate': '25.05.2023', 'title': 'Получение письменных объяснений'}, {'startDate': '12.05.2023', 'stopDate': '25.05.2023', 'title': 'Истребование документов'}], 'federalLaw': '248', 'federalLawId': 3, 'fullFieldViolationKnm': False, 'hasViolations': False, 'id': 12959062, 'inn': '3724003509', 'inspectorFullName': [], 'isFromSmev': False, 'isHasApproveDocs': False, 'isHasCollaboratingOrganization': False, 'isHasRequirements': True, 'isHasViolationTerm': False, 'isPm': False, 'kind': 'Документарная проверка', 'knmAnnulled': False, 'knmRejected': False, 'knmType': 'Плановое КНМ', 'knmTypeId': 4, 'legalBasisDocName': [], 'links': [], 'mspCategory': ['Не является субъектом МСП'], 'noPunishment': False, 'notifyLate': False, 'objectsKind': ['Деятельность по организации отдыха детей и их оздоровления, в том числе лагеря с дневным пребыванием'], 'objectsSubKind': ['Деятельность по организации отдыха детей и их оздоровления, в том числе лагеря с дневным пребыванием'], 'objectsType': ['Деятельность и действия'], 'ogrn': '1023701790353', 'oldKnm': None, 'oldPlan': None, 'orderDone': False, 'organizationName': 'МУНИЦИПАЛЬНОЕ БЮДЖЕТНОЕ ОБЩЕОБРАЗОВАТЕЛЬНОЕ УЧРЕЖДЕНИЕ ТЕЙКОВСКОГО МУНИЦИПАЛЬНОГО РАЙОНА НОВОЛЕУШИНСКАЯ СРЕДНЯЯ ОБЩЕОБРАЗОВАТЕЛЬНАЯ ШКОЛА', 'organizationsInn': ['3724003509'], 'organizationsName': ['МУНИЦИПАЛЬНОЕ БЮДЖЕТНОЕ ОБЩЕОБРАЗОВАТЕЛЬНОЕ УЧРЕЖДЕНИЕ ТЕЙКОВСКОГО МУНИЦИПАЛЬНОГО РАЙОНА НОВОЛЕУШИНСКАЯ СРЕДНЯЯ ОБЩЕОБРАЗОВАТЕЛЬНАЯ ШКОЛА'], 'organizationsOgrn': ['1023701790353'], 'planId': '2023050673', 'prosecutorOrganization': 'Прокуратура Ивановской области', 'prosecutorOrganizationId': 130, 'publishedStatus': 'UNPUBLISHED', 'reasons': [201], 'reasonsList': [{'assignmentDate': None, 'assignmentDateEn': None, 'assignmentNumber': None, 'date': '24.05.2022', 'dateEn': '2022-05-24', 'requirementDetails': None, 'text': '(ФЗ 248) Истечение установленного федеральным законом о виде контроля, положением о виде контроля период времени с даты окончания проведения последнего планового контрольного (надзорного) мероприятия'}], 'recEmptyOrLate': False, 'regDateEgrul': '16.08.2022', 'regDateEgrulEn': '2022-08-16', 'regLate': False, 'regTypes': [], 'requirements': 8, 'requirementsList': [{'nameNpa': 'Федеральный закон № 52-ФЗ от 30.03.1999 «О санитарно-эпидемиологическом благополучии населения» (ст.12, ст.13, ст.14, ст.15, ст.16, ст.17, ст.18, ст.19, ст.20, ст.21, ст.22, ст.23, ст.24, ст.25, ст.26, ст.27, ст.28, ст.29, ст.30, ст.31, ст.32, ст.33, ст.34, ст.36, ст.40, ст.41, ст.43, п.4 ст.44.1)', 'numberNpa': '30.03.1999', 'title': 'требования санитарного законодательства'}, {'nameNpa': 'Приказ Министерства здравоохранения Российской Федерации № 29н Об утверждении Порядка проведения обязательных предварительных и периодических медицинских осмотров работников, предусмотренных частью четвертой статьи 213 Трудового кодекса Российской Федерации, перечня медицинских противопоказаний к осуществлению работ с вредными и (или) опасными производственными факторами, а также работам, при выполнении которых проводятся обязательные предварительные и периодические медицинские осмотры (п. 4.1 приложения к Порядку проведения обязательных предварительных и периодических медицинских осмотров работников, предусмотренных частью четвертой статьи 213 Трудового кодекса Российской Федерации) ', 'numberNpa': '28.01.2021', 'title': 'требования санитарного законодательства'}, {'nameNpa': 'СП 2.4.3648-20 «Санитарно-эпидемиологические требования к организациям воспитания и обучения, отдыха и оздоровления детей и молодежи» (весь документ) ', 'numberNpa': '28.09.2020', 'title': 'требования санитарного законодательства'}, {'nameNpa': 'СанПиН 2.3/2.4.3590-20 «Санитарно-эпидемиологические требования к организации общественного питания населения» (весь документ) ', 'numberNpa': '27.10.2020', 'title': 'требования санитарного законодательства'}, {'nameNpa': 'СП 3.1./2.4.3598-20 «Санитарно-эпидемиологические требования к устройству, содержанию и организации работы образовательных организаций и других объектов социальной инфраструктуры для детей и молодежи в условиях распространения новой коронавирусной инфекции (COVID-19)» (весь документ) ', 'numberNpa': '30.06.2020', 'title': 'требования санитарного законодательства'}, {'nameNpa': 'СанПиН 1.2.3685-21 «Гигиенические нормативы и требования к обеспечению безопасности и (или) безвредности для человека факторов среды обитания» (весь документ) ', 'numberNpa': '28.01.2021', 'title': 'требования санитарного законодательства'}, {'nameNpa': ' СанПиН 2.1.3684-21 «Санитарно-эпидемиологические требования к содержанию территорий городских и сельских поселений, к водным объектам, питьевой воде и питьевому водоснабжению, атмосферному воздуху, почвам, жилым помещениям, эксплуатации производственных, общественных помещений, организации и проведению санитарно-противоэпидемиологических (профилактических) мероприятий» (весь документ)', 'numberNpa': '28.01.2021', 'title': 'требования санитарного законодательства'}, {'nameNpa': 'СанПиН 3.3686-21 Санитарно-эпидемиологические требования по профилактике инфекционных болезней (весь документ) ', 'numberNpa': '28.01.2021', 'title': 'требования санитарного законодательства'}], 'resolved': False, 'resultEmpty': True, 'resultEmptyOrLate': False, 'resultInfoTypeCodes': [], 'resultViolationKnm': False, 'riskCategory': ['чрезвычайно высокий риск'], 'riskCategoryAndDangerClass': ['чрезвычайно высокий риск'], 'sezRegistryExists': False, 'signed': True, 'smevInfoType': None, 'smevMessageType': None, 'smevReceivedAt': None, 'smevReceivedAtEn': None, 'smevReceivedAtMonth': None, 'smevReceivedAtYear': None, 'spvRegistryExists': False, 'startDate': '12.05.2023', 'startDateEn': '2023-05-12', 'status': 'Исключена', 'statusEgrul': 'Найден', 'statusId': 15, 'stopDate': '25.05.2023', 'stopDateEn': '2023-05-25', 'subjectTypeId': 0, 'supervisionType': 'Федеральный государственный санитарно-эпидемиологический контроль (надзор)', 'supervisionTypeId': 4, 'torRegistryExists': False, 'updatePlanDate': None, 'updatePlanDateLong': None, 'version': 'ERKNM', 'violationLawsuitTypeCodes': [], 'violationTypeCodes': [], 'year': 2023}
2023-01-19 12:36:03,114 - [WARNING] - direct_sql.py - new_insert_in_database(269) - Проведена повторная попытка внесения с параметром special, результат неудачный.
2023-01-19 12:36:03,114 - [ERROR] - direct_sql.py - new_insert_in_database(267) - (1040, 'ny connections')
2023-01-19 12:36:03,114 - [INFO] - direct_sql.py - database_inserts_conductor_for_multiprocessing(132) - Возникла ошибка, с которой не удалось справиться...
2023-01-19 12:36:03,114 - [INFO] - direct_sql.py - database_inserts_conductor_for_multiprocessing(133) - 
2023-01-19 12:36:03,114 - [INFO] - direct_sql.py - new_insert_in_database(268) - {'actCreateDate': None, 'actCreateDateEn': None, 'addresses': ['629707, АВТОНОМНЫЙ ОКРУГ, ЯМАЛО-НЕНЕЦКИЙ, РАЙОН, ЯМАЛЬСКИЙ, УЛИЦА, ОБСКАЯ, ДОМ 6, 890070000040003', '629707, АВТОНОМНЫЙ ОКРУГ, ЯМАЛО-НЕНЕЦКИЙ, РАЙОН, ЯМАЛЬСКИЙ, УЛИЦА, ОБСКАЯ, ДОМ 6', '629707, АВТОНОМНЫЙ ОКРУГ, ЯМАЛО-НЕНЕЦКИЙ, РАЙОН, ЯМАЛЬСКИЙ, УЛИЦА, ШКОЛЬНАЯ, ДОМ 6', '629707, АВТОНОМНЫЙ ОКРУГ, ЯМАЛО-НЕНЕЦКИЙ, РАЙОН, ЯМАЛЬСКИЙ, УЛИЦА, ШКОЛЬНАЯ, ДОМ 6', '629707, АВТОНОМНЫЙ ОКРУГ, ЯМАЛО-НЕНЕЦКИЙ, РАЙОН ЯМАЛЬСКИЙ, ПАНАЕВСК, УЛИЦА, Школьная 2А, ', '629707, АВТОНОМНЫЙ ОКРУГ, ЯМАЛО-НЕНЕЦКИЙ, РАЙОН ЯМАЛЬСКИЙ, ПАНАЕВСК, УЛИЦА, Школьная 2А, ', '629707, АВТОНОМНЫЙ ОКРУГ, ЯМАЛО-НЕНЕЦКИЙ, РАЙОН, ЯМАЛЬСКИЙ, с.Панаевск, ул. Советская 19а', '629707, АВТОНОМНЫЙ ОКРУГ, ЯМАЛО-НЕНЕЦКИЙ, РАЙОН ЯМАЛЬСКИЙ, с.Панаевск, ул. Советская 19а'], 'admLevelId': 50001, 'appealed': False, 'approveDocOrderDate': None, 'approveDocOrderNum': None, 'approveDocRequestDate': None, 'approveDocRequestNum': None, 'approveDocs': [], 'approveRequired': False, 'approved': False, 'approvedErknm': 'Отказано', 'chlistCount': 1, 'chlistFilledCount': 1, 'chlistFillingIndicationTypeId': [], 'collaboratingOrganizations': [], 'collaboratingOrganizationsIds': [], 'comment': 'Постановление Правительства РФ ', 'controllingOrganization': 'Управление Роспотребнадзора по Ямало-Ненецкому автономному округу', 'controllingOrganizationId': 10001030002, 'createPlanDate': None, 'createPlanDateLong': None, 'createdByErpDb': False, 'createdById': 179267, 'dataNotEqualEGRUL': False, 'dataSetNotInTime': False, 'deleted': False, 'directDurationDays': None, 'disapprove': False, 'district': 'Салехард', 'districtId': 1034711710000001, 'durationDays': 10, 'durationHours': None, 'erknmActViolationIds': [], 'erknmResultKindDecisionIds': [], 'erpId': '89230041000102863658', 'events': [{'startDate': '03.04.2023', 'stopDate': '29.04.2023', 'title': 'Осмотр'}, {'startDate': '03.04.2023', 'stopDate': '29.04.2023', 'title': 'Опрос'}, {'startDate': '03.04.2023', 'stopDate': '29.04.2023', 'title': 'Истребование документов'}, {'startDate': '03.04.2023', 'stopDate': '29.04.2023', 'title': 'Отбор проб (образцов)'}, {'startDate': '03.04.2023', 'stopDate': '29.04.2023', 'title': 'Инструментальное обследование'}, {'startDate': '03.04.2023', 'stopDate': '29.04.2023', 'title': 'Испытание'}, {'startDate': '03.04.2023', 'stopDate': '29.04.2023', 'title': 'Экспертиза'}], 'federalLaw': '248', 'federalLawId': 3, 'fullFieldViolationKnm': False, 'hasViolations': False, 'id': 12935775, 'inn': '8909001574', 'inspectorFullName': [], 'isFromSmev': False, 'isHasApproveDocs': False, 'isHasCollaboratingOrganization': False, 'isHasRequirements': True, 'isHasViolationTerm': False, 'isPm': False, 'kind': 'Выездная проверка', 'knmAnnulled': False, 'knmRejected': False, 'knmType': 'Плановое КНМ', 'knmTypeId': 4, 'legalBasisDocName': [], 'links': [], 'mspCategory': ['Не является субъектом МСП'], 'noPunishment': False, 'notifyLate': False, 'objectsKind': ['Основное общее и среднее (полное) общее образование', 'школы-интернаты, специальные (коррекционные) общеобразовательные организации', 'Основное общее и среднее (полное) общее образование', 'школы-интернаты, специальные (коррекционные) общеобразовательные организации', 'Основное общее и среднее (полное) общее образование', 'школы-интернаты, специальные (коррекционные) общеобразовательные организации', 'Основное общее и среднее (полное) общее образование', 'школы-интернаты, специальные (коррекционные) общеобразовательные организации'], 'objectsSubKind': ['Основное общее и среднее (полное) общее образование', 'школы-интернаты, специальные (коррекционные) общеобразовательные организации', 'Основное общее и среднее (полное) общее образование', 'школы-интернаты, специальные (коррекционные) общеобразовательные организации', 'Основное общее и среднее (полное) общее образование', 'школы-интернаты, специальные (коррекционные) общеобразовательные организации', 'Основное общее и среднее (полное) общее образование', 'школы-интернаты, специальные (коррекционные) общеобразовательные организации'], 'objectsType': ['Деятельность и действия', 'Производственные объекты', 'Деятельность и действия', 'Производственные объекты', 'Деятельность и действия', 'Производственные объекты', 'Деятельность и действия', 'Производственные объекты'], 'ogrn': '1028900512630', 'oldKnm': None, 'oldPlan': None, 'orderDone': False, 'organizationName': 'МУНИЦИПАЛЬНОЕ КАЗЕННОЕ ОБЩЕОБРАЗОВАТЕЛЬНОЕ УЧРЕЖДЕНИЕ ПАНАЕВСКАЯ ШКОЛА-ИНТЕРНАТ', 'organizationsInn': ['8909001574'], 'organizationsName': ['МУНИЦИПАЛЬНОЕ КАЗЕННОЕ ОБЩЕОБРАЗОВАТЕЛЬНОЕ УЧРЕЖДЕНИЕ ПАНАЕВСКАЯ ШКОЛА-ИНТЕРНАТ'], 'organizationsOgrn': ['1028900512630'], 'planId': '2023051007', 'prosecutorOrganization': 'Прокуратура Ямало-Ненецкого автономного округа', 'prosecutorOrganizationId': 3065, 'publishedStatus': 'UNPUBLISHED', 'reasons': [201], 'reasonsList': [{'assignmentDate': None, 'assignmentDateEn': None, 'assignmentNumber': None, 'date': '28.03.2022', 'dateEn': '2022-03-28', 'requirementDetails': None, 'text': '(ФЗ 248) Истечение установленного федеральным законом о виде контроля, положением о виде контроля период времени с даты окончания проведения последнего планового контрольного (надзорного) мероприятия'}], 'recEmptyOrLate': False, 'regDateEgrul': '14.08.2022', 'regDateEgrulEn': '2022-08-14', 'regLate': False, 'regTypes': [], 'requirements': 29, 'requirementsList': [{'nameNpa': 'О санитарно-эпидемиологическом благополучии населения', 'numberNpa': '30.03.1999', 'title': 'Федеральный закон № 52-ФЗ'}, {'nameNpa': 'Об иммунопрофилактике инфекционных болезней', 'numberNpa': '17.09.1998', 'title': 'Федеральный закон №157-ФЗ'}, {'nameNpa': 'Об охране здоровья граждан от воздействия окружающего табачного дыма и последствий потребления табака', 'numberNpa': '23.02.2013', 'title': 'Федеральный закон №15-ФЗ'}, {'nameNpa': 'О качестве и безопасности пищевых продуктов', 'numberNpa': '02.01.2000', 'title': 'Федеральный закон N 29-ФЗ'}, {'nameNpa': 'О техническом регулировании', 'numberNpa': '27.12.2002', 'title': 'Федеральный закон N184-ФЗ'}, {'nameNpa': 'Об утверждении порядка проведения обязательных предварительных и периодических медицинских осмотров работников, предусмотренных частью четвертой статьи 213 Трудового Кодекса Российской Федерации, перечня медицинских противопоказаний к осуществлению работ с вредными и (или) опасными производственными факторами, а также работам, при выполнении которых проводятся обязательные предварительные и периодические медицинские осмотры', 'numberNpa': '28.01.2021', 'title': 'Приказ Министерства здравоохранения и социального развития РФ №29н'}, {'nameNpa': 'Об утверждении требований к знаку о запрете курения и к порядку его размещения', 'numberNpa': '12.05.2014', 'title': 'Приказ Министерства здравоохранения РФ №214-н «»'}, {'nameNpa': '«Об утверждении перечней вредных и (или) опасных производственных факторов и работ, при выполнении которых проводятся обязательные предварительные медицинские осмотры при поступлении на работу и периодические медицинские осмотры»', 'numberNpa': 'None', 'title': 'Приказ Министерства труда и социальной защиты Российской Федерации №988н, Министерства здравоохранения и социального развития Российской Федерации №1420н от 31.12.2020 г. '}, {'nameNpa': '«Об утверждении перечня работ, выполнение которых связано с высоким риском заболевания инфекционными болезнями и требует обязательного проведения профилактических прививок»', 'numberNpa': 'None', 'title': 'Постановление Правительства РФ от 15.07.1999 №825 '}, {'nameNpa': 'Санитарно-эпидемиологические требования к организациям воспитания и обучения, отдыха и оздоровления детей и молодежи', 'numberNpa': 'None', 'title': 'СП 2.4.3648-20'}, {'nameNpa': 'Санитарно-эпидемиологические требования к организации общественного питания населения', 'numberNpa': 'None', 'title': 'СанПиН 2.3/2.4.3590-20'}, {'nameNpa': 'Гигиенические нормативы и требования к обеспечению безопасности и (или) безвредности для человека факторов среды обитания', 'numberNpa': 'None', 'title': 'СанПиН 1.2.3685-21'}, {'nameNpa': 'Санитарно-эпидемиологические требования по профилактике инфекционных болезней', 'numberNpa': '28.01.2021', 'title': 'СанПиН 3.3686-21'}, {'nameNpa': 'Санитарно-эпидемиологические требования к устройству, содержанию и организации работы образовательных организаций и других объектов социальной инфраструктуры для детей и молодежи в условиях распространения новой коронавирусной инфекции (COVID-19)', 'numberNpa': 'None', 'title': 'СП 3.1/2.4.3598-20'}, {'nameNpa': 'Профилактика новой коронавирусной инфекции (COVID-19)', 'numberNpa': 'None', 'title': 'СП 3.1.3597-20'}, {'nameNpa': 'О безопасности пищевой продукции', 'numberNpa': 'None', 'title': 'ТР ТС 021/2011'}, {'nameNpa': 'Пищевая продукция в части ее маркировки', 'numberNpa': 'None', 'title': 'ТР ТС 022/2011'}, {'nameNpa': 'Технический регламент на соковую продукцию из фруктов и овощей', 'numberNpa': 'None', 'title': 'ТР ТС 023/2011'}, {'nameNpa': 'Технический регламент на масложировую продукцию', 'numberNpa': 'None', 'title': 'ТР ТС 024/2011'}, {'nameNpa': 'Требования безопасности пищевых добавок, ароматизаторов и технологических вспомогательных средств', 'numberNpa': 'None', 'title': 'ТР ТС 029/2012'}, {'nameNpa': '«О безопасности молока и молочной продукции»', 'numberNpa': 'None', 'title': 'ТР ТС 033/2013 '}, {'nameNpa': 'О безопасности мяса и мясной продукции', 'numberNpa': 'None', 'title': 'ТР ТС 034/2013'}, {'nameNpa': 'О безопасности рыбы и рыбной продукции', 'numberNpa': 'None', 'title': 'ТР ЕАЭС 040/2016'}, {'nameNpa': 'О безопасности упакованной питьевой воды, включая природную минеральную воду', 'numberNpa': 'None', 'title': 'ТР ЕАЭС 044/2017'}, {'nameNpa': 'О безопасности мебельной продукции', 'numberNpa': 'None', 'title': 'ТР ТС 025/2012'}, {'nameNpa': 'О безопасности продукции, предназначенной для детей и подростков', 'numberNpa': 'None', 'title': 'ТР ТС 007/2011'}, {'nameNpa': 'О безопасности игрушек', 'numberNpa': 'None', 'title': 'ТР ТС 008/2011'}, {'nameNpa': 'О безопасности парфюмерно-косметической продукции', 'numberNpa': 'None', 'title': 'ТР ТС 009/2011'}, {'nameNpa': 'О безопасности продукции легкой промышленности', 'numberNpa': 'None', 'title': 'ТР ТС 017/2011'}], 'resolved': False, 'resultEmpty': True, 'resultEmptyOrLate': False, 'resultInfoTypeCodes': [], 'resultViolationKnm': False, 'riskCategory': ['чрезвычайно высокий риск', 'чрезвычайно высокий риск', 'чрезвычайно высокий риск', 'чрезвычайно высокий риск', 'чрезвычайно высокий риск', 'чрезвычайно высокий риск', 'чрезвычайно высокий риск', 'чрезвычайно высокий риск'], 'riskCategoryAndDangerClass': ['чрезвычайно высокий риск', 'чрезвычайно высокий риск / Не применяется', 'чрезвычайно высокий риск / Не применяется', 'чрезвычайно высокий риск / Не применяется', 'чрезвычайно высокий риск / Не применяется', 'чрезвычайно высокий риск / Не применяется', 'чрезвычайно высокий риск / Не применяется', 'чрезвычайно высокий риск / Не применяется'], 'sezRegistryExists': False, 'signed': True, 'smevInfoType': None, 'smevMessageType': None, 'smevReceivedAt': None, 'smevReceivedAtEn': None, 'smevReceivedAtMonth': None, 'smevReceivedAtYear': None, 'spvRegistryExists': False, 'startDate': '03.04.2023', 'startDateEn': '2023-04-03', 'status': 'Исключена', 'statusEgrul': 'Найден', 'statusId': 15, 'stopDate': '29.04.2023', 'stopDateEn': '2023-04-29', 'subjectTypeId': 0, 'supervisionType': 'Федеральный государственный санитарно-эпидемиологический контроль (надзор)', 'supervisionTypeId': 4, 'torRegistryExists': False, 'updatePlanDate': None, 'updatePlanDateLong': None, 'version': 'ERKNM', 'violationLawsuitTypeCodes': [], 'violationTypeCodes': [], 'year': 2023}
2023-01-19 12:36:03,115 - [ERROR] - direct_sql.py - new_insert_in_database(267) - (1040, 'ny connections')
2023-01-19 12:36:03,115 - [INFO] - direct_sql.py - new_insert_in_database(268) - {'actCreateDate': None, 'actCreateDateEn': None, 'addresses': ['655018, РЕСПУБЛИКА, ХАКАСИЯ, ГОРОД, АБАКАН, ПЛОЩАДЬ, ПАВШИХ КОММУНАРОВ, ДОМ 100, 190000010000146'], 'admLevelId': 50001, 'appealed': False, 'approveDocOrderDate': None, 'approveDocOrderNum': None, 'approveDocRequestDate': None, 'approveDocRequestNum': None, 'approveDocs': [], 'approveRequired': False, 'approved': False, 'approvedErknm': 'Отказано', 'chlistCount': 2, 'chlistFilledCount': 2, 'chlistFillingIndicationTypeId': [], 'collaboratingOrganizations': [], 'collaboratingOrganizationsIds': [], 'comment': 'п 11(4) постановления Правительства РФ от 10.03.2022 № 336', 'controllingOrganization': 'Управление Роспотребнадзора по Республике Хакасия', 'controllingOrganizationId': 10001021478, 'createPlanDate': None, 'createPlanDateLong': None, 'createdByErpDb': False, 'createdById': 159084, 'dataNotEqualEGRUL': False, 'dataSetNotInTime': False, 'deleted': False, 'directDurationDays': None, 'disapprove': False, 'district': 'Республика Хакасия', 'districtId': 1035950000000001, 'durationDays': 10, 'durationHours': 80, 'erknmActViolationIds': [], 'erknmResultKindDecisionIds': [], 'erpId': '19230041000102881451', 'events': [{'startDate': '22.05.2023', 'stopDate': '02.06.2023', 'title': 'Осмотр'}, {'startDate': '22.05.2023', 'stopDate': '02.06.2023', 'title': 'Досмотр'}, {'startDate': '22.05.2023', 'stopDate': '02.06.2023', 'title': 'Опрос'}, {'startDate': '22.05.2023', 'stopDate': '02.06.2023', 'title': 'Получение письменных объяснений'}, {'startDate': '22.05.2023', 'stopDate': '02.06.2023', 'title': 'Истребование документов'}, {'startDate': '22.05.2023', 'stopDate': '02.06.2023', 'title': 'Отбор проб (образцов)'}, {'startDate': '22.05.2023', 'stopDate': '02.06.2023', 'title': 'Инструментальное обследование'}, {'startDate': '22.05.2023', 'stopDate': '02.06.2023', 'title': 'Испытание'}, {'startDate': '22.05.2023', 'stopDate': '02.06.2023', 'title': 'Экспертиза'}], 'federalLaw': '248', 'federalLawId': 3, 'fullFieldViolationKnm': False, 'hasViolations': False, 'id': 12953568, 'inn': '1901100933', 'inspectorFullName': [], 'isFromSmev': False, 'isHasApproveDocs': False, 'isHasCollaboratingOrganization': False, 'isHasRequirements': True, 'isHasViolationTerm': False, 'isPm': False, 'kind': 'Выездная проверка', 'knmAnnulled': False, 'knmRejected': False, 'knmType': 'Плановое КНМ', 'knmTypeId': 4, 'legalBasisDocName': [], 'links': [], 'mspCategory': ['Не является субъектом МСП'], 'noPunishment': False, 'notifyLate': False, 'objectsKind': ['Дошкольное и начальное общее образование'], 'objectsSubKind': ['Дошкольное и начальное общее образование'], 'objectsType': ['Деятельность и действия'], 'ogrn': '1131900000121', 'oldKnm': None, 'oldPlan': None, 'orderDone': False, 'organizationName': 'ЧАСТНОЕ ДОШКОЛЬНОЕ ОБРАЗОВАТЕЛЬНОЕ УЧРЕЖДЕНИЕ ЦЕНТР РАЗВИТИЯ РЕБЕНКА - ДЕТСКИЙ САД ВОЛШЕБНАЯ СТРАНА', 'organizationsInn': ['1901100933'], 'organizationsName': ['ЧАСТНОЕ ДОШКОЛЬНОЕ ОБРАЗОВАТЕЛЬНОЕ УЧРЕЖДЕНИЕ ЦЕНТР РАЗВИТИЯ РЕБЕНКА - ДЕТСКИЙ САД ВОЛШЕБНАЯ СТРАНА'], 'organizationsOgrn': ['1131900000121'], 'planId': '2023050183', 'prosecutorOrganization': 'Прокуратура Республики Хакасия', 'prosecutorOrganizationId': 2080, 'publishedStatus': 'UNPUBLISHED', 'reasons': [202], 'reasonsList': [{'assignmentDate': None, 'assignmentDateEn': None, 'assignmentNumber': None, 'date': '13.02.2013', 'dateEn': '2013-02-13', 'requirementDetails': None, 'text': '(ФЗ 248) Истечение установленного федеральным законом о виде контроля, положением о виде контроля периода времени с даты государственной регистрации организации или гражданина в качестве индивидуального предпринимателя'}], 'recEmptyOrLate': False, 'regDateEgrul': '15.08.2022', 'regDateEgrulEn': '2022-08-15', 'regLate': False, 'regTypes': [], 'requirements': 32, 'requirementsList': [{'nameNpa': 'None', 'numberNpa': 'None', 'title': 'None'}, {'nameNpa': 'None', 'numberNpa': 'None', 'title': 'None'}, {'nameNpa': 'None', 'numberNpa': 'None', 'title': 'None'}, {'nameNpa': 'None', 'numberNpa': 'None', 'title': 'None'}, {'nameNpa': 'None', 'numberNpa': 'None', 'title': 'None'}, {'nameNpa': 'None', 'numberNpa': 'None', 'title': 'None'}, {'nameNpa': 'None', 'numberNpa': 'None', 'title': 'None'}, {'nameNpa': 'None', 'numberNpa': 'None', 'title': 'None'}, {'nameNpa': 'None', 'numberNpa': 'None', 'title': 'None'}, {'nameNpa': 'None', 'numberNpa': 'None', 'title': 'None'}, {'nameNpa': 'None', 'numberNpa': 'None', 'title': 'None'}, {'nameNpa': 'None', 'numberNpa': 'None', 'title': 'None'}, {'nameNpa': 'None', 'numberNpa': 'None', 'title': 'None'}, {'nameNpa': 'None', 'numberNpa': 'None', 'title': 'None'}, {'nameNpa': 'None', 'numberNpa': 'None', 'title': 'None'}, {'nameNpa': 'None', 'numberNpa': 'None', 'title': 'None'}, {'nameNpa': 'None', 'numberNpa': 'None', 'title': 'None'}, {'nameNpa': 'None', 'numberNpa': 'None', 'title': 'None'}, {'nameNpa': 'None', 'numberNpa': 'None', 'title': 'None'}, {'nameNpa': 'None', 'numberNpa': 'None', 'title': 'None'}, {'nameNpa': 'None', 'numberNpa': 'None', 'title': 'None'}, {'nameNpa': 'None', 'numberNpa': 'None', 'title': 'None'}, {'nameNpa': 'None', 'numberNpa': 'None', 'title': 'None'}, {'nameNpa': 'None', 'numberNpa': 'None', 'title': 'None'}, {'nameNpa': 'None', 'numberNpa': 'None', 'title': 'None'}, {'nameNpa': 'None', 'numberNpa': 'None', 'title': 'None'}, {'nameNpa': 'None', 'numberNpa': 'None', 'title': 'None'}, {'nameNpa': 'None', 'numberNpa': 'None', 'title': 'None'}, {'nameNpa': 'None', 'numberNpa': 'None', 'title': 'None'}, {'nameNpa': 'None', 'numberNpa': 'None', 'title': 'None'}, {'nameNpa': 'None', 'numberNpa': 'None', 'title': 'None'}, {'nameNpa': 'None', 'numberNpa': 'None', 'title': 'None'}], 'resolved': False, 'resultEmpty': True, 'resultEmptyOrLate': False, 'resultInfoTypeCodes': [], 'resultViolationKnm': False, 'riskCategory': ['чрезвычайно высокий риск'], 'riskCategoryAndDangerClass': ['чрезвычайно высокий риск'], 'sezRegistryExists': False, 'signed': True, 'smevInfoType': None, 'smevMessageType': None, 'smevReceivedAt': None, 'smevReceivedAtEn': None, 'smevReceivedAtMonth': None, 'smevReceivedAtYear': None, 'spvRegistryExists': False, 'startDate': '22.05.2023', 'startDateEn': '2023-05-22', 'status': 'Исключена', 'statusEgrul': 'Найден', 'statusId': 15, 'stopDate': None, 'stopDateEn': None, 'subjectTypeId': 0, 'supervisionType': 'Федеральный государственный санитарно-эпидемиологический контроль (надзор)', 'supervisionTypeId': 4, 'torRegistryExists': False, 'updatePlanDate': None, 'updatePlanDateLong': None, 'version': 'ERKNM', 'violationLawsuitTypeCodes': [], 'violationTypeCodes': [], 'year': 2023}
2023-01-19 12:36:03,115 - [INFO] - direct_sql.py - database_inserts_conductor_for_multiprocessing(132) - Возникла ошибка, с которой не удалось справиться...
2023-01-19 12:36:03,115 - [WARNING] - direct_sql.py - new_insert_in_database(269) - Проведена повторная попытка внесения с параметром special, результат неудачный.
2023-01-19 12:36:03,115 - [INFO] - direct_sql.py - new_insert_in_database(268) - {'actCreateDate': None, 'actCreateDateEn': None, 'addresses': ['427721, Удмуртская Республика, Кизнерский район, д.Верхняя Тыжма, ул.Шанхайская, д.14'], 'admLevelId': 50001, 'appealed': False, 'approveDocOrderDate': None, 'approveDocOrderNum': None, 'approveDocRequestDate': None, 'approveDocRequestNum': None, 'approveDocs': [], 'approveRequired': False, 'approved': False, 'approvedErknm': 'Отказано', 'chlistCount': 0, 'chlistFilledCount': 0, 'chlistFillingIndicationTypeId': [], 'collaboratingOrganizations': [], 'collaboratingOrganizationsIds': [], 'comment': 'Несоответствие запланированного планового контрольного (надзорного) мероприятия  требованиям пункта 11(4) Постановления Правительства Российской Федерации от 10.03.2022 № 336 «Об особенностях организации и осуществления государственного контроля (надзора), муниципального контроля». ', 'controllingOrganization': 'Управления Роспотребнадзора по Удмуртской Республике', 'controllingOrganizationId': 10001012486, 'createPlanDate': None, 'createPlanDateLong': None, 'createdByErpDb': False, 'createdById': 177218, 'dataNotEqualEGRUL': False, 'dataSetNotInTime': False, 'deleted': False, 'directDurationDays': None, 'disapprove': False, 'district': 'Удмуртская Республика', 'districtId': 1033940000000001, 'durationDays': 10, 'durationHours': None, 'erknmActViolationIds': [], 'erknmResultKindDecisionIds': [], 'erpId': '18230041000103671752', 'events': [{'startDate': '19.04.2023', 'stopDate': '03.05.2023', 'title': 'Получение письменных объяснений'}, {'startDate': '19.04.2023', 'stopDate': '03.05.2023', 'title': 'Истребование документов'}, {'startDate': '19.04.2023', 'stopDate': '03.05.2023', 'title': 'Экспертиза'}], 'federalLaw': '248', 'federalLawId': 3, 'fullFieldViolationKnm': False, 'hasViolations': False, 'id': 13743869, 'inn': '1813003602', 'inspectorFullName': [], 'isFromSmev': False, 'isHasApproveDocs': False, 'isHasCollaboratingOrganization': False, 'isHasRequirements': True, 'isHasViolationTerm': False, 'isPm': False, 'kind': 'Документарная проверка', 'knmAnnulled': False, 'knmRejected': False, 'knmType': 'Плановое КНМ', 'knmTypeId': 4, 'legalBasisDocName': [], 'links': [], 'mspCategory': ['Не является субъектом МСП'], 'noPunishment': False, 'notifyLate': False, 'objectsKind': ['Деятельность общеобразовательных организаций'], 'objectsSubKind': ['Деятельность общеобразовательных организаций'], 'objectsType': ['Деятельность и действия'], 'ogrn': '1021800841700', 'oldKnm': None, 'oldPlan': None, 'orderDone': False, 'organizationName': 'МУНИЦИПАЛЬНОЕ БЮДЖЕТНОЕ ОБЩЕОБРАЗОВАТЕЛЬНОЕ УЧРЕЖДЕНИЕ ВЕРХНЕТЫЖМИНСКАЯ ОСНОВНАЯ ОБЩЕОБРАЗОВАТЕЛЬНАЯ ШКОЛА', 'organizationsInn': ['1813003602'], 'organizationsName': ['МУНИЦИПАЛЬНОЕ БЮДЖЕТНОЕ ОБЩЕОБРАЗОВАТЕЛЬНОЕ УЧРЕЖДЕНИЕ ВЕРХНЕТЫЖМИНСКАЯ ОСНОВНАЯ ОБЩЕОБРАЗОВАТЕЛЬНАЯ ШКОЛА'], 'organizationsOgrn': ['1021800841700'], 'planId': '2023049688', 'prosecutorOrganization': 'Прокуратура Удмуртской Республики', 'prosecutorOrganizationId': 1324, 'publishedStatus': 'UNPUBLISHED', 'reasons': [201], 'reasonsList': [{'assignmentDate': None, 'assignmentDateEn': None, 'assignmentNumber': None, 'date': '05.05.2022', 'dateEn': '2022-05-05', 'requirementDetails': None, 'text': '(ФЗ 248) Истечение установленного федеральным законом о виде контроля, положением о виде контроля период времени с даты окончания проведения последнего планового контрольного (надзорного) мероприятия'}], 'recEmptyOrLate': False, 'regDateEgrul': '27.09.2022', 'regDateEgrulEn': '2022-09-27', 'regLate': False, 'regTypes': [], 'requirements': 1, 'requirementsList': [{'nameNpa': 'None', 'numberNpa': 'None', 'title': 'None'}], 'resolved': False, 'resultEmpty': True, 'resultEmptyOrLate': False, 'resultInfoTypeCodes': [], 'resultViolationKnm': False, 'riskCategory': ['чрезвычайно высокий риск'], 'riskCategoryAndDangerClass': ['чрезвычайно высокий риск'], 'sezRegistryExists': False, 'signed': True, 'smevInfoType': None, 'smevMessageType': None, 'smevReceivedAt': None, 'smevReceivedAtEn': None, 'smevReceivedAtMonth': None, 'smevReceivedAtYear': None, 'spvRegistryExists': False, 'startDate': '19.04.2023', 'startDateEn': '2023-04-19', 'status': 'Исключена', 'statusEgrul': 'Найден', 'statusId': 15, 'stopDate': '03.05.2023', 'stopDateEn': '2023-05-03', 'subjectTypeId': 0, 'supervisionType': 'Федеральный государственный санитарно-эпидемиологический контроль (надзор)', 'supervisionTypeId': 4, 'torRegistryExists': False, 'updatePlanDate': None, 'updatePlanDateLong': None, 'version': 'ERKNM', 'violationLawsuitTypeCodes': [], 'violationTypeCodes': [], 'year': 2023}
2023-01-19 12:36:03,115 - [INFO] - direct_sql.py - database_inserts_conductor_for_multiprocessing(132) - Возникла ошибка, с которой не удалось справиться...
2023-01-19 12:36:03,115 - [WARNING] - direct_sql.py - new_insert_in_database(269) - Проведена повторная попытка внесения с параметром special, результат неудачный.
2023-01-19 12:36:03,115 - [INFO] - direct_sql.py - database_inserts_conductor_for_multiprocessing(133) - 
2023-01-19 12:36:03,115 - [INFO] - direct_sql.py - database_inserts_conductor_for_multiprocessing(133) - 
2023-01-19 12:36:03,115 - [INFO] - direct_sql.py - database_inserts_conductor_for_multiprocessing(132) - Возникла ошибка, с которой не удалось справиться...
2023-01-19 12:36:03,115 - [INFO] - direct_sql.py - database_inserts_conductor_for_multiprocessing(133) - 
2023-01-19 12:36:03,122 - [ERROR] - direct_sql.py - new_insert_in_database(267) - (1040, 'ny connections')
2023-01-19 12:36:03,123 - [INFO] - direct_sql.py - new_insert_in_database(268) - {'actCreateDate': None, 'actCreateDateEn': None, 'addresses': ['305514, ОБЛАСТЬ КУРСКАЯ, РАЙОН КУРСКИЙ, ПОСЕЛОК ИСКРА, ДОМ 54, '], 'admLevelId': 50001, 'appealed': False, 'approveDocOrderDate': None, 'approveDocOrderNum': None, 'approveDocRequestDate': None, 'approveDocRequestNum': None, 'approveDocs': [], 'approveRequired': False, 'approved': False, 'approvedErknm': 'Отказано', 'chlistCount': 2, 'chlistFilledCount': 2, 'chlistFillingIndicationTypeId': [], 'collaboratingOrganizations': [], 'collaboratingOrganizationsIds': [], 'comment': 'На основании пункта 11(4) постановления Правительства РФ от 10.03.2022 № 336 в планы проведения плановых КНМ на 2023 год не включаются КНМ в отношении государственных и муниципальных учреждений дошкольного и начального общего образования, основного общего и среднего общего образования, объекты которых отнесены к категориям чрезвычайно высокого и высокого риска.', 'controllingOrganization': 'Управления Роспотребнадзора по Курской области', 'controllingOrganizationId': 10001017235, 'createPlanDate': None, 'createPlanDateLong': None, 'createdByErpDb': False, 'createdById': 161797, 'dataNotEqualEGRUL': False, 'dataSetNotInTime': False, 'deleted': False, 'directDurationDays': None, 'disapprove': False, 'district': 'Курская область', 'districtId': 1030380000000001, 'durationDays': 10, 'durationHours': 75, 'erknmActViolationIds': [], 'erknmResultKindDecisionIds': [], 'erpId': '46230041000103125093', 'events': [{'startDate': '02.06.2023', 'stopDate': '16.06.2023', 'title': 'Осмотр'}, {'startDate': '02.06.2023', 'stopDate': '16.06.2023', 'title': 'Истребование документов'}, {'startDate': '02.06.2023', 'stopDate': '16.06.2023', 'title': 'Отбор проб (образцов)'}, {'startDate': '02.06.2023', 'stopDate': '16.06.2023', 'title': 'Инструментальное обследование'}, {'startDate': '02.06.2023', 'stopDate': '16.06.2023', 'title': 'Испытание'}, {'startDate': '02.06.2023', 'stopDate': '16.06.2023', 'title': 'Экспертиза'}], 'federalLaw': '248', 'federalLawId': 3, 'fullFieldViolationKnm': False, 'hasViolations': False, 'id': 13197210, 'inn': '4611004662', 'inspectorFullName': [], 'isFromSmev': False, 'isHasApproveDocs': False, 'isHasCollaboratingOrganization': False, 'isHasRequirements': True, 'isHasViolationTerm': False, 'isPm': False, 'kind': 'Выездная проверка', 'knmAnnulled': False, 'knmRejected': False, 'knmType': 'Плановое КНМ', 'knmTypeId': 4, 'legalBasisDocName': [], 'links': [], 'mspCategory': ['Не является субъектом МСП'], 'noPunishment': False, 'notifyLate': False, 'objectsKind': ['Деятельность по организации отдыха детей и их оздоровления, в том числе лагеря с дневным пребыванием'], 'objectsSubKind': ['Деятельность по организации отдыха детей и их оздоровления, в том числе лагеря с дневным пребыванием'], 'objectsType': ['Деятельность и действия'], 'ogrn': '1024600617018', 'oldKnm': None, 'oldPlan': None, 'orderDone': False, 'organizationName': 'МУНИЦИПАЛЬНОЕ БЮДЖЕТНОЕ ОБЩЕОБРАЗОВАТЕЛЬНОЕ УЧРЕЖДЕНИЕ СРЕДНЯЯ ОБЩЕОБРАЗОВАТЕЛЬНАЯ ШКОЛА ИМЕНИ АЛЕКСАНДРА НЕВСКОГО КУРСКОГО РАЙОНА КУРСКОЙ ОБЛАСТИ', 'organizationsInn': ['4611004662'], 'organizationsName': ['МУНИЦИПАЛЬНОЕ БЮДЖЕТНОЕ ОБЩЕОБРАЗОВАТЕЛЬНОЕ УЧРЕЖДЕНИЕ СРЕДНЯЯ ОБЩЕОБРАЗОВАТЕЛЬНАЯ ШКОЛА ИМЕНИ АЛЕКСАНДРА НЕВСКОГО КУРСКОГО РАЙОНА КУРСКОЙ ОБЛАСТИ'], 'organizationsOgrn': ['1024600617018'], 'planId': '2023050566', 'prosecutorOrganization': 'Прокуратура Курской области', 'prosecutorOrganizationId': 214, 'publishedStatus': 'UNPUBLISHED', 'reasons': [201], 'reasonsList': [{'assignmentDate': None, 'assignmentDateEn': None, 'assignmentNumber': None, 'date': '16.06.2022', 'dateEn': '2022-06-16', 'requirementDetails': None, 'text': '(ФЗ 248) Истечение установленного федеральным законом о виде контроля, положением о виде контроля период времени с даты окончания проведения последнего планового контрольного (надзорного) мероприятия'}], 'recEmptyOrLate': False, 'regDateEgrul': '23.08.2022', 'regDateEgrulEn': '2022-08-23', 'regLate': False, 'regTypes': [], 'requirements': 15, 'requirementsList': [{'nameNpa': 'Федеральный закон О санитарно-эпидемиологическом благополучии населения от 30.03.1999 N 52-ФЗ', 'numberNpa': '30.03.1999', 'title': 'соблюдение требований \nст.12, ст.13, ст.14, ст.15, ст.16, ст.17, ст.18, ст.19, ст.20, ст.21, ст.22, ст.23, ст.24, ст.25, ст.26, ст.27, ст.28, ст.29, ст.30, ст.31, ст.32, ст.33, ст.34, ст.36, ст.40, ст.41'}, {'nameNpa': 'Приказ Минздрава России от 28.01.2021 N 29н «Об утверждении Порядка проведения обязательных предварительных и периодических медицинских осмотров работников, предусмотренных частью четвертой статьи 213 Трудового кодекса Российской Федерации, перечня медицинских противопоказаний к осуществлению работ с вредными и (или) опасными производственными факторами, а также работам, при выполнении которых проводятся обязательные предварительные и периодические медицинские осмотры» ', 'numberNpa': '28.01.2021', 'title': 'соблюдение требований п. 4.1 приложения к Порядку проведения обязательных предварительных и периодических медицинских осмотров работников, предусмотренных частью четвертой статьи 213 Трудового кодекса Российской Федерации\n'}, {'nameNpa': 'Федеральный закон О качестве и безопасности пищевых продуктов от 02.01.2000 N 29-ФЗ', 'numberNpa': '02.01.2000', 'title': ' соблюдение требований п.1-3 ст.3, п.1,2 ст.5, п.1, 3 ст.9, ст. 12, ст.15, ст.16, ст.17, ст.18, ст.19, ст.20, п.1, 3 ст. 21, ст.22, ст.23, ст.24, п.1, 3.1, 5 ст.25.1, ст.25.2, ст.25.3, ст.25.4, ст.25.5, ст.25.6'}, {'nameNpa': 'Федеральный закон Об отходах производства и потребления от 24.06.1998 N 89-ФЗ ', 'numberNpa': '24.06.1998', 'title': 'соблюдение требований ч.1 ст.13, ч.1, 3, ст.13.4, ч.1,2 ст.16'}, {'nameNpa': 'СанПиН 3.3686-21 Санитарно-эпидемиологические требования по профилактике инфекционных болезней   ', 'numberNpa': '28.01.2021', 'title': 'соблюдение требований п. п. 5,9-11,13-78,21,22,24,26,35,36,38-42,52-54,58,62-65,72,75-78,79-89,90-94,98-107,108,109,110,111,114,115,116,117,126,130,752,764,784,808,823,901,1862,1880,1881,1884,1885,1887,1888,1890,1895,1896,1898,1900,1905,1997,1999,2001,\n2008,2180,2181,2182,2183,2190,2368,2369,2386,2387,2388,2401,2405,2406,2417,2426,2513,2516,2518,2519,2612,2613,2614,2616,2623,2624,2631,2665,2666,\n2667,2677,2678,2679,2680,2681,2686,2694,2695,2696,2709,2708,2709.2710,\n2743,2747,2751,2820,2850,2851,2891,2903,2905,2963,3020,3071,3131,3148,\n3149,3150,3151,3152,3153,3157,3263,3264,3267,3268,3271,3307,3366,3367,\n3368,3369,3371,3372,3373,3390'}, {'nameNpa': 'СП 2.4.3648-20 «Санитарно – эпидемиологические требования к организациям воспитания и обучения, отдыха и оздоровления детей и молодежи» ', 'numberNpa': '28.09.2020', 'title': 'соблюдение требований п.1.1- п. 2.11.9.; п.3.11- п.3.11.11.'}, {'nameNpa': 'СанПиН 2.3./2.4.3590-20 «Санитарно – эпидемиологические требования к организации общественного питания населения»   ', 'numberNpa': '27.10.2020', 'title': 'соблюдение требований п.1.1. – п.5.2.; п.8.1.- п. 8.7.6., приложение 1-13 '}, {'nameNpa': 'ТР ТС 021/2011О безопасности пищевой продукции (ТР ТС 021/2011)      ', 'numberNpa': '09.12.2011', 'title': 'соблюдение требований ст. 1-5; ст. 7 ч.1-4, ч. 5 абзац 1; ст. 8; ст. 13 ч. 1, 2, 4; ст. 14-17; ст. 18 ч.1, 7, 8; ст. 21 ч.1; ст. 23 ч. 1, 2, 3; ст. 24 ч. 1,2; ст. 39\nприложения № 1-4, 6, 8, 9, 10 '}, {'nameNpa': 'ТР ТС 022/2011 «Пищевая продукция в части ее маркировки» ', 'numberNpa': '12.09.2011', 'title': 'соблюдение требований ст. 1-5, приложение 1-5  '}, {'nameNpa': 'ТР ТС 023/2011 Технический регламент на соковую продукцию из фруктов и овощей', 'numberNpa': '09.12.2011', 'title': 'соблюдение требований ст. 3, 4, 5, 6, 7, 8   \n'}, {'nameNpa': 'ТР ТС 033/2013 О безопасности молока и молочной продукции', 'numberNpa': '09.10.2013', 'title': 'соблюдение требований п. 1-8, п. 30, 32-36, п. 47-59, 60, 62, 65-84, 86-96, 99, 100, 103, 105, 111-114 приложения № 1-4, 8-11, 13, 16  '}, {'nameNpa': 'ТР ТС 034/2013 «О безопасности мяса и мясной продукции» ', 'numberNpa': '09.10.2013', 'title': 'соблюдение требований п. 9; п. 10 ч. 1, п. 11-19; п. 59-60; п. 89-98; п. 101, 102, п. 106-126; п. 129, 132, 133, п. 147-149; приложения № 1-5'}, {'nameNpa': 'ТР ЕАЭС 040/2016 О безопасности рыбы и рыбной продукции ', 'numberNpa': '18.10.2016', 'title': 'соблюдение требований Разделы IV и V (за исключением пункта 14), VI, VII, VIII, IX, X, XI (за исключением пунктов 85, 86), XII'}, {'nameNpa': 'СанПиН 1.2.3685-21 «Гигиенические нормативы и требования к обеспечению безопасности и (или) безвредности для человека факторов среды обитания» : \n ', 'numberNpa': '28.01.2021', 'title': 'соблюдение требований раздел V, раздел VI '}, {'nameNpa': 'СП 3.1/2.4.3598-20 «Санитарно – эпидемиологические требования к устройству, содержанию и организации работы образовательных организаций и других объектов социальной инфраструктуры для детей и молодежи в условиях распространении новой \nкоронавирусной инфекции (COVID-19): \n', 'numberNpa': '30.06.2020', 'title': 'соблюдение требований п.1.1.- п.2.7., п.3.1. '}], 'resolved': False, 'resultEmpty': True, 'resultEmptyOrLate': False, 'resultInfoTypeCodes': [], 'resultViolationKnm': False, 'riskCategory': ['чрезвычайно высокий риск'], 'riskCategoryAndDangerClass': ['чрезвычайно высокий риск / Не применяется'], 'sezRegistryExists': False, 'signed': True, 'smevInfoType': None, 'smevMessageType': None, 'smevReceivedAt': None, 'smevReceivedAtEn': None, 'smevReceivedAtMonth': None, 'smevReceivedAtYear': None, 'spvRegistryExists': False, 'startDate': '02.06.2023', 'startDateEn': '2023-06-02', 'status': 'Исключена', 'statusEgrul': 'Найден', 'statusId': 15, 'stopDate': '16.06.2023', 'stopDateEn': '2023-06-16', 'subjectTypeId': 0, 'supervisionType': 'Федеральный государственный санитарно-эпидемиологический контроль (надзор)', 'supervisionTypeId': 4, 'torRegistryExists': False, 'updatePlanDate': None, 'updatePlanDateLong': None, 'version': 'ERKNM', 'violationLawsuitTypeCodes': [], 'violationTypeCodes': [], 'year': 2023}
2023-01-19 12:36:03,124 - [WARNING] - direct_sql.py - new_insert_in_database(269) - Проведена повторная попытка внесения с параметром special, результат неудачный.
2023-01-19 12:36:03,124 - [INFO] - direct_sql.py - database_inserts_conductor_for_multiprocessing(132) - Возникла ошибка, с которой не удалось справиться...
2023-01-19 12:36:03,124 - [INFO] - direct_sql.py - database_inserts_conductor_for_multiprocessing(133) - 
2023-01-19 12:36:03,128 - [ERROR] - direct_sql.py - new_insert_in_database(267) - (1040, 'ny connections')
2023-01-19 12:36:03,128 - [ERROR] - direct_sql.py - new_insert_in_database(267) - (1040, 'ny connections')
2023-01-19 12:36:03,128 - [INFO] - direct_sql.py - new_insert_in_database(268) - {'actCreateDate': None, 'actCreateDateEn': None, 'addresses': ['169302, РЕСПУБЛИКА КОМИ, ГОРОД УХТА, УЛИЦА ТИХОНОВИЧА, 3, ', 'Республика Коми, г. Ухта, ул.Тихоновича, д.3\n'], 'admLevelId': 50001, 'appealed': False, 'approveDocOrderDate': None, 'approveDocOrderNum': None, 'approveDocRequestDate': None, 'approveDocRequestNum': None, 'approveDocs': [], 'approveRequired': False, 'approved': False, 'approvedErknm': 'Отказано', 'chlistCount': 2, 'chlistFilledCount': 2, 'chlistFillingIndicationTypeId': [], 'collaboratingOrganizations': [], 'collaboratingOrganizationsIds': [], 'comment': 'в силу положений п. 11(4) постановления Правительства Российской Федерации от 10.03.2022 № 336 в планы проведения плановых КНМ не подлежат включению плановые КНМ  в отношении государственных и муниципальных учреждений дошкольного и начального общего, основного общего и среднего общего образования, объекты контроля которых отнесены к категориям чрезвычайно высокого и высокого риска', 'controllingOrganization': 'Управление Роспотребнадзора по Республике Коми', 'controllingOrganizationId': 10001016637, 'createPlanDate': None, 'createPlanDateLong': None, 'createdByErpDb': False, 'createdById': 160403, 'dataNotEqualEGRUL': False, 'dataSetNotInTime': False, 'deleted': False, 'directDurationDays': None, 'disapprove': False, 'district': 'Республика Коми', 'districtId': 1031870000000001, 'durationDays': 5, 'durationHours': None, 'erknmActViolationIds': [], 'erknmResultKindDecisionIds': [], 'erpId': '11230041000103539207', 'events': [{'startDate': '06.06.2023', 'stopDate': '13.06.2023', 'title': 'Осмотр'}, {'startDate': '06.06.2023', 'stopDate': '13.06.2023', 'title': 'Опрос'}, {'startDate': '06.06.2023', 'stopDate': '13.06.2023', 'title': 'Получение письменных объяснений'}, {'startDate': '06.06.2023', 'stopDate': '13.06.2023', 'title': 'Истребование документов'}, {'startDate': '06.06.2023', 'stopDate': '13.06.2023', 'title': 'Отбор проб (образцов)'}, {'startDate': '06.06.2023', 'stopDate': '13.06.2023', 'title': 'Испытание'}, {'startDate': '06.06.2023', 'stopDate': '13.06.2023', 'title': 'Экспертиза'}], 'federalLaw': '248', 'federalLawId': 3, 'fullFieldViolationKnm': False, 'hasViolations': False, 'id': 13611324, 'inn': '1102026458', 'inspectorFullName': [], 'isFromSmev': False, 'isHasApproveDocs': False, 'isHasCollaboratingOrganization': False, 'isHasRequirements': True, 'isHasViolationTerm': False, 'isPm': False, 'kind': 'Выездная проверка', 'knmAnnulled': False, 'knmRejected': False, 'knmType': 'Плановое КНМ', 'knmTypeId': 4, 'legalBasisDocName': [], 'links': [], 'mspCategory': ['Не является субъектом МСП'], 'noPunishment': False, 'notifyLate': False, 'objectsKind': ['Деятельность по организации отдыха детей и их оздоровления, в том числе лагеря с дневным пребыванием', 'Деятельность по организации отдыха детей и их оздоровления, в том числе лагеря с дневным пребыванием'], 'objectsSubKind': ['Деятельность по организации отдыха детей и их оздоровления, в том числе лагеря с дневным пребыванием', 'Деятельность по организации отдыха детей и их оздоровления, в том числе лагеря с дневным пребыванием'], 'objectsType': ['Деятельность и действия', 'Деятельность и действия'], 'ogrn': '1021100740946', 'oldKnm': None, 'oldPlan': None, 'orderDone': False, 'organizationName': 'МУНИЦИПАЛЬНОЕ ОБЩЕОБРАЗОВАТЕЛЬНОЕ УЧРЕЖДЕНИЕ СРЕДНЯЯ ОБЩЕОБРАЗОВАТЕЛЬНАЯ ШКОЛА №13', 'organizationsInn': ['1102026458'], 'organizationsName': ['МУНИЦИПАЛЬНОЕ ОБЩЕОБРАЗОВАТЕЛЬНОЕ УЧРЕЖДЕНИЕ СРЕДНЯЯ ОБЩЕОБРАЗОВАТЕЛЬНАЯ ШКОЛА №13'], 'organizationsOgrn': ['1021100740946'], 'planId': '2023059758', 'prosecutorOrganization': 'Прокуратура Республики Коми', 'prosecutorOrganizationId': 654, 'publishedStatus': 'UNPUBLISHED', 'reasons': [204], 'reasonsList': [{'assignmentDate': None, 'assignmentDateEn': None, 'assignmentNumber': None, 'date': '01.06.2023', 'dateEn': '2023-06-01', 'requirementDetails': None, 'text': '(ФЗ 248) Истечение установленного федеральным законом о виде контроля, положением о виде контроля периода времени с даты иного события, установленного федеральным законом о виде контроля, положением о виде контроля, которое ведет к возникновению объекта контроля'}], 'recEmptyOrLate': False, 'regDateEgrul': '21.09.2022', 'regDateEgrulEn': '2022-09-21', 'regLate': False, 'regTypes': [], 'requirements': 1, 'requirementsList': [{'nameNpa': 'Федеральный закон №52-ФЗ от 30.03.1999 г. «О санитарно-эпидемиологическом благополучии населения» (ст.15, ст.17, ст.19, ст.21, ст.22, ст.24, ст.28, ст.29, ст.31, ст.32, ст.34, ст.36);\n- Федеральный закон от 24.07.1998г. № 124-ФЗ «Об основных гарантиях прав ребенка в Российской Федерации» (п.2 ст. 12);\n- Федеральный закон от 02.01.2000г. № 29-ФЗ «О качестве и безопасности пищевых продуктов» (п.1-3 ст. 3; п.1, 2 ст.5; п. 1, 3 ст.9; ст.15; ст.17; ст.20; ст.23; ст.24; п.1 ст.25.1; ст.25.2);\n- Федеральный закон от 23.02.2013г. №15-ФЗ «Об охране здоровья граждан от воздействия окружающего табачного дыма, последствий потребления табака или потребления никотинсодержащей продукции» (ст. 12, ст.20);\n- Федеральный закон от 17.09.1998 г. №157-ФЗ «Об иммунопрофилактике инфекционных болезней» (ст. 9, п. 4 ст.11);\n- Федеральный закон от 18.06.2001г. № 77-ФЗ «О предупреждении распро-странения туберкулёза в Российской Федерации» (п.п. 3, 4 ст. 8);\n- Федеральный закон от 24.06.1998 № 89-ФЗ Об отходах производства и потребления (ч.ч.1, 3 ст.13.4);\n- Технический регламент Таможенного союза «О безопасности пищевой продукции» ТР ТС 021/2011 (за исключением статьи 6, абзацев 2, 7, 12-14 части 5 статьи 7, части 3 статьи 13, части 2 статьи 18, статей 30 и 40); \n- Технический регламент Таможенного союза «Пищевая продукция в части её маркировки» ТР ТС 022/2011;\n- Технический регламент Таможенного союза «Технический регламент на соковую продукцию из фруктов и овощей» ТР ТС 023/2011 (ст. 3 - ст. 8);\n- Технический регламент Таможенного союза «Технический регламент на масложировую продукцию» ТР ТС 024/2011;\n- Технический регламент Таможенного союза «О безопасности мебельной продукции» ТР ТС 025/2012 (ст. 4 – ст.7);\n- Технический регламент Таможенного союза «О безопасности отдельных видов специализированной пищевой продукции, в том числе диетического, лечебного и диетического профилактического питания» ТР ТС 027/2012;\n- Технический регламент Таможенного союза «Требования безопасности пищевых добавок, ароматизаторов и технологических вспомогательных средств» ТР ТС 029/2012;\n- Технический регламент Таможенного союза «О безопасности молока и молочной продукции» ТР ТС 033/2013 (за исключением пунктов 13, 14, 97, 98 и 115);\n- Технический регламент Таможенного союза «О безопасности мяса и мясной продукции» ТР ТС 034/2013 (за исключением пунктов 1-8, 26-48, 53, 54 и абзаца 2 пункта 99);\n- Разделы IV и V (за исключением пункта 14), VIII, IX, X, XI (за исключе-нием пунктов 85, 86), XII Технического регламента Евразийского экономического союза «О безопасности рыбы и рыбной продукции» ТР ЕАЭС 040/2016;\n- разделы III, IV, V, VI, VII и X Технического регламента Евразийского эко-номического союза «О безопасности упакованной питьевой воды, включая природную минеральную воду» ТР ЕАЭС 044/2017; \n- Технический регламент Таможенного союза «О безопасности игрушек» ТР ТС 008/2011 (ст. 3 – ст. 7); \n- Технический регламент Таможенного союза «О безопасности продукции, предназначенной для детей и подростков» ТР ТС 007/2011 (ст. 3 – ст. 11, ст 13);\n- раздел IV, пункты 15, 16, подпункты а, д пункта 18 раздела VI, пункт 49 раздела VIII, разделы IX и X в части требований к покрытию для детских игровых площадок и связанным с ним процессам Технического регламента Евразийского экономического союза О безопасности оборудования для детских игровых площадок ТР ЕАЭС 042/2017; \n- Единые санитарно-эпидемиологические и гигиенические требования к то-варам, подлежащим санитарно-эпидемиологическому надзору (контролю), утвержденные решением Комиссии Таможенного союза 28.05.2010 № 299;   \n- СП 2.4.3648-20 Санитарно-эпидемиологические требования к организациям воспитания и обучения, отдыха и оздоровления детей и молодежи\n- СП 3.1/2.4.3598-20 «Санитарно-эпидемиологические требования к устрой-ству, содержанию и организации работы образовательных организаций и других объектов социальной инфраструктуры для детей и молодежи в усло-виях распространения новой коронавирусной инфекции (COVID-19)»; \n- СанПиН 2.3/2.4.3590-20 «Санитарно-эпидемиологические требования к организации общественного питания населения»;\n- СанПиН 1.2.3685-21 «Гигиенические нормативы и требования к обеспече-нию безопасности и (или) безвредности для человека факторов среды обитания»;\n- СанПиН 2.1.3684-21 «Санитарно-эпидемиологические требования к содержанию территорий городских и сельских поселений, к водным объектам, питьевой воде и питьевому водоснабжению, атмосферному воздуху, почвам, жилым помещениям, эксплуатации производственных, общественных помещений, организации и проведению санитарно-противоэпидемических (профилактических) мероприятий»;\n- СП 3.1.3597-20 Профилактика новой коронавирусной инфекции (COVID-19)\n- СанПиН 3.3686-21 Санитарно-эпидемиологические требования по профилактике инфекционных болезней; \n- СП 2.2.3670-20 «Санитарно-эпидемиологические требования к условиям труда»;\n- приказ Министерства труда и социальной защиты Российской Федерации и Министерства здравоохранения Российской Федерации от 31.12.2020 г. № 988н/1420н «Об утверждении перечня вредных и (или) опасных производственных факторов и работ, при выполнении которых проводятся обязательные предварительные медицинские осмотры при поступлении на работу и периодические медицинские осмотры»;\n- приказ Министерства здравоохранения Российской Федерации от 28.01.2021 года № 29н «Об утверждении Порядка проведения обязательных предварительных и периодических медицинских осмотров работников, предусмотренных частью четвертой статьи 213 Трудового кодекса Российской Федерации, перечня медицинских противопоказаний к осуществлению работ с вредными и (или) опасными производственными факторами, а также работам, при выполнении которых проводятся обязательные предварительные и периодические медицинские осмотры»\n\n', 'numberNpa': '30.03.1999', 'title': 'Соблюдение обязательных требований'}], 'resolved': False, 'resultEmpty': True, 'resultEmptyOrLate': False, 'resultInfoTypeCodes': [], 'resultViolationKnm': False, 'riskCategory': ['чрезвычайно высокий риск', 'чрезвычайно высокий риск'], 'riskCategoryAndDangerClass': ['чрезвычайно высокий риск / Первый', 'чрезвычайно высокий риск / Первый'], 'sezRegistryExists': False, 'signed': True, 'smevInfoType': None, 'smevMessageType': None, 'smevReceivedAt': None, 'smevReceivedAtEn': None, 'smevReceivedAtMonth': None, 'smevReceivedAtYear': None, 'spvRegistryExists': False, 'startDate': '06.06.2023', 'startDateEn': '2023-06-06', 'status': 'Исключена', 'statusEgrul': 'Найден', 'statusId': 15, 'stopDate': None, 'stopDateEn': None, 'subjectTypeId': 0, 'supervisionType': 'Федеральный государственный санитарно-эпидемиологический контроль (надзор)', 'supervisionTypeId': 4, 'torRegistryExists': False, 'updatePlanDate': None, 'updatePlanDateLong': None, 'version': 'ERKNM', 'violationLawsuitTypeCodes': [], 'violationTypeCodes': [], 'year': 2023}
2023-01-19 12:36:03,128 - [INFO] - direct_sql.py - new_insert_in_database(268) - {'actCreateDate': None, 'actCreateDateEn': None, 'addresses': ['671927, РЕСПУБЛИКА БУРЯТИЯ, РАЙОН ДЖИДИНСКИЙ, СЕЛО НАРЫН, УЛИЦА ЦЕНТРАЛЬНАЯ, 58А, (лагерь с днем пребывания)'], 'admLevelId': 50001, 'appealed': False, 'approveDocOrderDate': None, 'approveDocOrderNum': None, 'approveDocRequestDate': None, 'approveDocRequestNum': None, 'approveDocs': [], 'approveRequired': False, 'approved': False, 'approvedErknm': 'Отказано', 'chlistCount': 0, 'chlistFilledCount': 0, 'chlistFillingIndicationTypeId': [], 'collaboratingOrganizations': [], 'collaboratingOrganizationsIds': [], 'comment': 'пункты 11 (3), 11 (4) Постановления Правительства Российской Федерации от 10.03.2022 № 336', 'controllingOrganization': 'Управление Роспотребнадзора по Республике Бурятия', 'controllingOrganizationId': 10001012187, 'createPlanDate': None, 'createPlanDateLong': None, 'createdByErpDb': False, 'createdById': 203596, 'dataNotEqualEGRUL': False, 'dataSetNotInTime': False, 'deleted': False, 'directDurationDays': None, 'disapprove': False, 'district': 'Республика Бурятия', 'districtId': 1036810000000001, 'durationDays': 10, 'durationHours': None, 'erknmActViolationIds': [], 'erknmResultKindDecisionIds': [], 'erpId': '03230041000103428036', 'events': [{'startDate': '03.05.2023', 'stopDate': '17.05.2023', 'title': 'Получение письменных объяснений'}, {'startDate': '03.05.2023', 'stopDate': '17.05.2023', 'title': 'Истребование документов'}], 'federalLaw': '248', 'federalLawId': 3, 'fullFieldViolationKnm': False, 'hasViolations': False, 'id': 13500153, 'inn': '0304004920', 'inspectorFullName': [], 'isFromSmev': False, 'isHasApproveDocs': False, 'isHasCollaboratingOrganization': False, 'isHasRequirements': True, 'isHasViolationTerm': False, 'isPm': False, 'kind': 'Документарная проверка', 'knmAnnulled': False, 'knmRejected': False, 'knmType': 'Плановое КНМ', 'knmTypeId': 4, 'legalBasisDocName': [], 'links': [], 'mspCategory': ['Не является субъектом МСП'], 'noPunishment': False, 'notifyLate': False, 'objectsKind': ['Деятельность по организации отдыха детей и их оздоровления, в том числе лагеря с дневным пребыванием'], 'objectsSubKind': ['Деятельность по организации отдыха детей и их оздоровления, в том числе лагеря с дневным пребыванием'], 'objectsType': ['Деятельность и действия'], 'ogrn': '1030300350475', 'oldKnm': None, 'oldPlan': None, 'orderDone': False, 'organizationName': 'МУНИЦИПАЛЬНОЕ БЮДЖЕТНОЕ ОБЩЕОБРАЗОВАТЕЛЬНОЕ УЧРЕЖДЕНИЕ БОЛЬШЕ-НАРЫНСКАЯ СРЕДНЯЯ ОБЩЕОБРАЗОВАТЕЛЬНАЯ ШКОЛА', 'organizationsInn': ['0304004920'], 'organizationsName': ['МУНИЦИПАЛЬНОЕ БЮДЖЕТНОЕ ОБЩЕОБРАЗОВАТЕЛЬНОЕ УЧРЕЖДЕНИЕ БОЛЬШЕ-НАРЫНСКАЯ СРЕДНЯЯ ОБЩЕОБРАЗОВАТЕЛЬНАЯ ШКОЛА'], 'organizationsOgrn': ['1030300350475'], 'planId': '2023058837', 'prosecutorOrganization': 'Прокуратура Республики Бурятия', 'prosecutorOrganizationId': 2511, 'publishedStatus': 'UNPUBLISHED', 'reasons': [204], 'reasonsList': [{'assignmentDate': None, 'assignmentDateEn': None, 'assignmentNumber': None, 'date': '23.06.2022', 'dateEn': '2022-06-23', 'requirementDetails': None, 'text': '(ФЗ 248) Истечение установленного федеральным законом о виде контроля, положением о виде контроля периода времени с даты иного события, установленного федеральным законом о виде контроля, положением о виде контроля, которое ведет к возникновению объекта контроля'}], 'recEmptyOrLate': False, 'regDateEgrul': '15.09.2022', 'regDateEgrulEn': '2022-09-15', 'regLate': False, 'regTypes': [], 'requirements': 17, 'requirementsList': [{'nameNpa': 'None', 'numberNpa': 'None', 'title': 'None'}, {'nameNpa': 'None', 'numberNpa': 'None', 'title': 'None'}, {'nameNpa': 'None', 'numberNpa': 'None', 'title': 'None'}, {'nameNpa': 'None', 'numberNpa': 'None', 'title': 'None'}, {'nameNpa': 'None', 'numberNpa': 'None', 'title': 'None'}, {'nameNpa': 'None', 'numberNpa': 'None', 'title': 'None'}, {'nameNpa': 'None', 'numberNpa': 'None', 'title': 'None'}, {'nameNpa': 'None', 'numberNpa': 'None', 'title': 'None'}, {'nameNpa': 'None', 'numberNpa': 'None', 'title': 'None'}, {'nameNpa': 'None', 'numberNpa': 'None', 'title': 'None'}, {'nameNpa': 'None', 'numberNpa': 'None', 'title': 'None'}, {'nameNpa': 'None', 'numberNpa': 'None', 'title': 'None'}, {'nameNpa': 'None', 'numberNpa': 'None', 'title': 'None'}, {'nameNpa': 'None', 'numberNpa': 'None', 'title': 'None'}, {'nameNpa': 'None', 'numberNpa': 'None', 'title': 'None'}, {'nameNpa': 'None', 'numberNpa': 'None', 'title': 'None'}, {'nameNpa': 'None', 'numberNpa': 'None', 'title': 'None'}], 'resolved': False, 'resultEmpty': True, 'resultEmptyOrLate': False, 'resultInfoTypeCodes': [], 'resultViolationKnm': False, 'riskCategory': ['чрезвычайно высокий риск'], 'riskCategoryAndDangerClass': ['чрезвычайно высокий риск'], 'sezRegistryExists': False, 'signed': True, 'smevInfoType': None, 'smevMessageType': None, 'smevReceivedAt': None, 'smevReceivedAtEn': None, 'smevReceivedAtMonth': None, 'smevReceivedAtYear': None, 'spvRegistryExists': False, 'startDate': '03.05.2023', 'startDateEn': '2023-05-03', 'status': 'Исключена', 'statusEgrul': 'В процессе поиска', 'statusId': 15, 'stopDate': '18.05.2023', 'stopDateEn': '2023-05-18', 'subjectTypeId': 0, 'supervisionType': 'Федеральный государственный санитарно-эпидемиологический контроль (надзор)', 'supervisionTypeId': 4, 'torRegistryExists': False, 'updatePlanDate': None, 'updatePlanDateLong': None, 'version': 'ERKNM', 'violationLawsuitTypeCodes': [], 'violationTypeCodes': [], 'year': 2023}
2023-01-19 12:36:03,128 - [WARNING] - direct_sql.py - new_insert_in_database(269) - Проведена повторная попытка внесения с параметром special, результат неудачный.
2023-01-19 12:36:03,129 - [INFO] - direct_sql.py - database_inserts_conductor_for_multiprocessing(132) - Возникла ошибка, с которой не удалось справиться...
2023-01-19 12:36:03,128 - [WARNING] - direct_sql.py - new_insert_in_database(269) - Проведена повторная попытка внесения с параметром special, результат неудачный.
2023-01-19 12:36:03,129 - [INFO] - direct_sql.py - database_inserts_conductor_for_multiprocessing(133) - 
2023-01-19 12:36:03,129 - [INFO] - direct_sql.py - database_inserts_conductor_for_multiprocessing(132) - Возникла ошибка, с которой не удалось справиться...
2023-01-19 12:36:03,129 - [INFO] - direct_sql.py - database_inserts_conductor_for_multiprocessing(133) - 
2023-01-19 12:36:03,135 - [ERROR] - direct_sql.py - new_insert_in_database(267) - (1040, 'ny connections')
2023-01-19 12:36:03,135 - [INFO] - direct_sql.py - new_insert_in_database(268) - {'actCreateDate': None, 'actCreateDateEn': None, 'addresses': ['155030, ОБЛАСТЬ ИВАНОВСКАЯ, РАЙОН ТЕЙКОВСКИЙ, ДЕРЕВНЯ ХАРИНО, ДОМ 37, СТРОЕНИЕ 1, '], 'admLevelId': 50001, 'appealed': False, 'approveDocOrderDate': None, 'approveDocOrderNum': None, 'approveDocRequestDate': None, 'approveDocRequestNum': None, 'approveDocs': [], 'approveRequired': False, 'approved': True, 'approvedErknm': 'Согласовано', 'chlistCount': 0, 'chlistFilledCount': 0, 'chlistFillingIndicationTypeId': [], 'collaboratingOrganizations': [], 'collaboratingOrganizationsIds': [], 'comment': None, 'controllingOrganization': 'Управление Роспотребнадзора по Ивановской области', 'controllingOrganizationId': 10001013491, 'createPlanDate': None, 'createPlanDateLong': None, 'createdByErpDb': False, 'createdById': 160995, 'dataNotEqualEGRUL': False, 'dataSetNotInTime': True, 'deleted': False, 'directDurationDays': None, 'disapprove': False, 'district': 'Ивановская область', 'districtId': 1030240000000001, 'durationDays': 10, 'durationHours': None, 'erknmActViolationIds': [], 'erknmResultKindDecisionIds': [], 'erpId': '37230041000102887316', 'events': [{'startDate': '12.05.2023', 'stopDate': '25.05.2023', 'title': 'Получение письменных объяснений'}, {'startDate': '12.05.2023', 'stopDate': '25.05.2023', 'title': 'Истребование документов'}], 'federalLaw': '248', 'federalLawId': 3, 'fullFieldViolationKnm': False, 'hasViolations': False, 'id': 12959433, 'inn': '3724003682', 'inspectorFullName': [], 'isFromSmev': False, 'isHasApproveDocs': False, 'isHasCollaboratingOrganization': False, 'isHasRequirements': True, 'isHasViolationTerm': False, 'isPm': False, 'kind': 'Документарная проверка', 'knmAnnulled': False, 'knmRejected': False, 'knmType': 'Плановое КНМ', 'knmTypeId': 4, 'legalBasisDocName': [], 'links': [], 'mspCategory': ['Не является субъектом МСП'], 'noPunishment': False, 'notifyLate': False, 'objectsKind': ['Деятельность по организации отдыха детей и их оздоровления, в том числе лагеря с дневным пребыванием'], 'objectsSubKind': ['Деятельность по организации отдыха детей и их оздоровления, в том числе лагеря с дневным пребыванием'], 'objectsType': ['Деятельность и действия'], 'ogrn': '1033700470594', 'oldKnm': None, 'oldPlan': None, 'orderDone': False, 'organizationName': 'МУНИЦИПАЛЬНОЕ БЮДЖЕТНОЕ УЧРЕЖДЕНИЕ ДОПОЛНИТЕЛЬНОГО ОБРАЗОВАНИЯ ТЕЙКОВСКОГО МУНИЦИПАЛЬНОГО РАЙОНА ЦЕНТР РАЗВИТИЯ ТВОРЧЕСТВА ДЕТЕЙ И ЮНОШЕСТВА', 'organizationsInn': ['3724003682'], 'organizationsName': ['МУНИЦИПАЛЬНОЕ БЮДЖЕТНОЕ УЧРЕЖДЕНИЕ ДОПОЛНИТЕЛЬНОГО ОБРАЗОВАНИЯ ТЕЙКОВСКОГО МУНИЦИПАЛЬНОГО РАЙОНА ЦЕНТР РАЗВИТИЯ ТВОРЧЕСТВА ДЕТЕЙ И ЮНОШЕСТВА'], 'organizationsOgrn': ['1033700470594'], 'planId': '2023050673', 'prosecutorOrganization': 'Прокуратура Ивановской области', 'prosecutorOrganizationId': 130, 'publishedStatus': 'PUBLISHED', 'reasons': [201], 'reasonsList': [{'assignmentDate': None, 'assignmentDateEn': None, 'assignmentNumber': None, 'date': '25.05.2022', 'dateEn': '2022-05-25', 'requirementDetails': None, 'text': '(ФЗ 248) Истечение установленного федеральным законом о виде контроля, положением о виде контроля период времени с даты окончания проведения последнего планового контрольного (надзорного) мероприятия'}], 'recEmptyOrLate': False, 'regDateEgrul': '16.08.2022', 'regDateEgrulEn': '2022-08-16', 'regLate': False, 'regTypes': [], 'requirements': 8, 'requirementsList': [{'nameNpa': 'None', 'numberNpa': 'None', 'title': 'None'}, {'nameNpa': 'None', 'numberNpa': 'None', 'title': 'None'}, {'nameNpa': 'None', 'numberNpa': 'None', 'title': 'None'}, {'nameNpa': 'None', 'numberNpa': 'None', 'title': 'None'}, {'nameNpa': 'None', 'numberNpa': 'None', 'title': 'None'}, {'nameNpa': 'None', 'numberNpa': 'None', 'title': 'None'}, {'nameNpa': 'None', 'numberNpa': 'None', 'title': 'None'}, {'nameNpa': 'None', 'numberNpa': 'None', 'title': 'None'}], 'resolved': False, 'resultEmpty': True, 'resultEmptyOrLate': False, 'resultInfoTypeCodes': [], 'resultViolationKnm': False, 'riskCategory': ['чрезвычайно высокий риск'], 'riskCategoryAndDangerClass': ['чрезвычайно высокий риск'], 'sezRegistryExists': False, 'signed': True, 'smevInfoType': None, 'smevMessageType': None, 'smevReceivedAt': None, 'smevReceivedAtEn': None, 'smevReceivedAtMonth': None, 'smevReceivedAtYear': None, 'spvRegistryExists': False, 'startDate': '12.05.2023', 'startDateEn': '2023-05-12', 'status': 'Ожидает проведения', 'statusEgrul': 'Найден', 'statusId': 5, 'stopDate': '25.05.2023', 'stopDateEn': '2023-05-25', 'subjectTypeId': 0, 'supervisionType': 'Федеральный государственный санитарно-эпидемиологический контроль (надзор)', 'supervisionTypeId': 4, 'torRegistryExists': False, 'updatePlanDate': None, 'updatePlanDateLong': None, 'version': 'ERKNM', 'violationLawsuitTypeCodes': [], 'violationTypeCodes': [], 'year': 2023}
2023-01-19 12:36:03,136 - [WARNING] - direct_sql.py - new_insert_in_database(269) - Проведена повторная попытка внесения с параметром special, результат неудачный.
2023-01-19 12:36:03,136 - [INFO] - direct_sql.py - database_inserts_conductor_for_multiprocessing(132) - Возникла ошибка, с которой не удалось справиться...
2023-01-19 12:36:03,136 - [INFO] - direct_sql.py - database_inserts_conductor_for_multiprocessing(133) - 
2023-01-19 12:36:03,139 - [ERROR] - direct_sql.py - new_insert_in_database(267) - (1040, 'ny connections')
2023-01-19 12:36:03,141 - [INFO] - direct_sql.py - new_insert_in_database(268) - {'actCreateDate': None, 'actCreateDateEn': None, 'addresses': ['153038, ОБЛАСТЬ ИВАНОВСКАЯ, ГОРОД ИВАНОВО, УЛИЦА МАРШАЛА ВАСИЛЕВСКОГО, 7, '], 'admLevelId': 50001, 'appealed': False, 'approveDocOrderDate': None, 'approveDocOrderNum': None, 'approveDocRequestDate': None, 'approveDocRequestNum': None, 'approveDocs': [], 'approveRequired': False, 'approved': False, 'approvedErknm': 'Отказано', 'chlistCount': 0, 'chlistFilledCount': 0, 'chlistFillingIndicationTypeId': [], 'collaboratingOrganizations': [], 'collaboratingOrganizationsIds': [], 'comment': 'п. 11 (4) Постановления Правительства РФ от 10.03.2022 № 336', 'controllingOrganization': 'Управление Роспотребнадзора по Ивановской области', 'controllingOrganizationId': 10001013491, 'createPlanDate': None, 'createPlanDateLong': None, 'createdByErpDb': False, 'createdById': 162935, 'dataNotEqualEGRUL': False, 'dataSetNotInTime': False, 'deleted': False, 'directDurationDays': None, 'disapprove': False, 'district': 'Ивановская область', 'districtId': 1030240000000001, 'durationDays': 10, 'durationHours': None, 'erknmActViolationIds': [], 'erknmResultKindDecisionIds': [], 'erpId': '37230041000103230877', 'events': [{'startDate': '15.05.2023', 'stopDate': '26.05.2023', 'title': 'Получение письменных объяснений'}, {'startDate': '15.05.2023', 'stopDate': '26.05.2023', 'title': 'Истребование документов'}, {'startDate': '15.05.2023', 'stopDate': '26.05.2023', 'title': 'Экспертиза'}], 'federalLaw': '248', 'federalLawId': 3, 'fullFieldViolationKnm': False, 'hasViolations': False, 'id': 13302994, 'inn': '3728033007', 'inspectorFullName': [], 'isFromSmev': False, 'isHasApproveDocs': False, 'isHasCollaboratingOrganization': False, 'isHasRequirements': True, 'isHasViolationTerm': False, 'isPm': False, 'kind': 'Документарная проверка', 'knmAnnulled': False, 'knmRejected': False, 'knmType': 'Плановое КНМ', 'knmTypeId': 4, 'legalBasisDocName': [], 'links': [], 'mspCategory': ['Не является субъектом МСП'], 'noPunishment': False, 'notifyLate': False, 'objectsKind': ['Деятельность по организации отдыха детей и их оздоровления, в том числе лагеря с дневным пребыванием'], 'objectsSubKind': ['Деятельность по организации отдыха детей и их оздоровления, в том числе лагеря с дневным пребыванием'], 'objectsType': ['Деятельность и действия'], 'ogrn': '1033700068192', 'oldKnm': None, 'oldPlan': None, 'orderDone': False, 'organizationName': 'МУНИЦИПАЛЬНОЕ БЮДЖЕТНОЕ ОБЩЕОБРАЗОВАТЕЛЬНОЕ УЧРЕЖДЕНИЕ СРЕДНЯЯ ШКОЛА № 19', 'organizationsInn': ['3728033007'], 'organizationsName': ['МУНИЦИПАЛЬНОЕ БЮДЖЕТНОЕ ОБЩЕОБРАЗОВАТЕЛЬНОЕ УЧРЕЖДЕНИЕ СРЕДНЯЯ ШКОЛА № 19'], 'organizationsOgrn': ['1033700068192'], 'planId': '2023050673', 'prosecutorOrganization': 'Прокуратура Ивановской области', 'prosecutorOrganizationId': 130, 'publishedStatus': 'UNPUBLISHED', 'reasons': [201], 'reasonsList': [{'assignmentDate': None, 'assignmentDateEn': None, 'assignmentNumber': None, 'date': '27.05.2022', 'dateEn': '2022-05-27', 'requirementDetails': None, 'text': '(ФЗ 248) Истечение установленного федеральным законом о виде контроля, положением о виде контроля период времени с даты окончания проведения последнего планового контрольного (надзорного) мероприятия'}], 'recEmptyOrLate': False, 'regDateEgrul': '01.09.2022', 'regDateEgrulEn': '2022-09-01', 'regLate': False, 'regTypes': [], 'requirements': 9, 'requirementsList': [{'nameNpa': 'Федеральный закон №52-ФЗ «О санитарно-эпидемиологическом благополучии населения» (ст.12, ст.13, ст.14, ст.15, ст.16, ст.17, ст.18, ст.19, ст.20, ст.21, ст.22, ст.23, ст.24, ст.25, ст.26, ст.27, ст.28, ст.29, ст.30, ст.31, ст.32, ст.33, ст.34, ст.36, ст.40, ст.41, ст.43, п.4 ст.44.1)\t', 'numberNpa': '30.03.1999', 'title': 'соблюдение обязательных требований'}, {'nameNpa': 'Федеральный закон №157-ФЗ «Об иммунопрофилактике инфекционных болезней» (ст.11, п.1,3 ст.12, п. 1 ст. 13, п.2 ст.17)\t', 'numberNpa': '17.09.1998', 'title': 'соблюдение обязательных требований'}, {'nameNpa': 'Приказ Министерства здравоохранения Российской Федерации №29н Об утверждении Порядка проведения обязательных предварительных и периодических медицинских осмотров работников, предусмотренных частью четвертой статьи 213 Трудового кодекса Российской Федерации, перечня медицинских противопоказаний к осуществлению работ с вредными и (или) опасными производственными факторами, а также работам, при выполнении которых проводятся обязательные предварительные и периодические медицинские осмотры. (п. 4.1 приложения\nк Порядку проведения обязательных\nпредварительных и периодических\nмедицинских осмотров работников,\nпредусмотренных частью четвертой\nстатьи 213 Трудового кодекса\nРоссийской Федерации)\t', 'numberNpa': '28.01.2021', 'title': 'соблюдение обязательных требований'}, {'nameNpa': 'Постановление Главного государственного санитарного врача Российской Федерации №15 «Об утверждении санитарно-эпидемиологических правил\nСП 3.1.3597-20 Профилактика новой коронавирусной инфекции (COVID-19)» (Весь документ)\t', 'numberNpa': '22.05.2020', 'title': 'соблюдение обязательных требований'}, {'nameNpa': 'Постановление Главного государственного санитарного врача Российской Федерации №16 «Об утверждении санитарно-эпидемиологических правил\nСП 3.1/2.4.3598-20 «Санитарно-эпидемиологические требования к устройству, содержанию и организации работы образовательных организаций и других объектов социальной инфраструктуры для детей и молодежи в условиях распространения новой коронавирусной инфекции (COVID-19)» (Весь документ)\t', 'numberNpa': '30.06.2020', 'title': 'соблюдение обязательных требований'}, {'nameNpa': 'Постановление Главного государственного санитарного врача Российской Федерации №32 «Об утверждении санитарно-эпидемиологических правил и норм\nСанПиН 2.3/2.4.3590-20 «Санитарно-эпидемиологические требования к организации общественного питания населения» (Весь документ)\t', 'numberNpa': '27.10.2020', 'title': 'соблюдение обязательных требований'}, {'nameNpa': 'Постановление Главного государственного санитарного врача Российской Федерации №2 «Об утверждении санитарных правил и норм СанПин 1.2.3685-21 «Гигиенические нормативы и требования к обеспечению безопасности и (или) безвредности для человека факторов среды обитания» (весь документ)\t28.01.2021', 'numberNpa': '28.01.2021', 'title': 'соблюдение обязательных требований'}, {'nameNpa': 'Постановление Главного государственного санитарного врача Российской Федерации №3 «Об утверждении санитарных правил и норм СанПин 2.1.3684-21 «Санитарно-эпидемиологические требования к содержанию территорий городских и сельских поселений, к водным объектам, питьевой воде и питьевому водоснабжению, атмосферному воздуху, почвам, жилым помещениям, эксплуатации производственных, общественных помещений, организации и проведению санитарно-противоэпидемиологических (профилактических) мероприятий» (весь документ)\t', 'numberNpa': '28.01.2021', 'title': 'соблюдение обязательных требований'}, {'nameNpa': 'Постановление Главного государственного санитарного врача Российской Федерации №28 «Об утверждении санитарных правил СП 2.2.3648-20 «Санитарно-эпидемиологические требования к \nорганизациям воспитания и обучения, отдыха и оздоровления детей и молодежи» (Весь документ)\t\n', 'numberNpa': '28.09.2020', 'title': 'соблюдение обязательных требований'}], 'resolved': False, 'resultEmpty': True, 'resultEmptyOrLate': False, 'resultInfoTypeCodes': [], 'resultViolationKnm': False, 'riskCategory': ['чрезвычайно высокий риск'], 'riskCategoryAndDangerClass': ['чрезвычайно высокий риск'], 'sezRegistryExists': False, 'signed': True, 'smevInfoType': None, 'smevMessageType': None, 'smevReceivedAt': None, 'smevReceivedAtEn': None, 'smevReceivedAtMonth': None, 'smevReceivedAtYear': None, 'spvRegistryExists': False, 'startDate': '15.05.2023', 'startDateEn': '2023-05-15', 'status': 'Исключена', 'statusEgrul': 'Найден', 'statusId': 15, 'stopDate': None, 'stopDateEn': None, 'subjectTypeId': 0, 'supervisionType': 'Федеральный государственный санитарно-эпидемиологический контроль (надзор)', 'supervisionTypeId': 4, 'torRegistryExists': False, 'updatePlanDate': None, 'updatePlanDateLong': None, 'version': 'ERKNM', 'violationLawsuitTypeCodes': [], 'violationTypeCodes': [], 'year': 2023}
2023-01-19 12:36:03,142 - [WARNING] - direct_sql.py - new_insert_in_database(269) - Проведена повторная попытка внесения с параметром special, результат неудачный.
2023-01-19 12:36:03,142 - [INFO] - direct_sql.py - database_inserts_conductor_for_multiprocessing(132) - Возникла ошибка, с которой не удалось справиться...
2023-01-19 12:36:03,143 - [INFO] - direct_sql.py - database_inserts_conductor_for_multiprocessing(133) - 
2023-01-19 12:36:03,146 - [ERROR] - direct_sql.py - new_insert_in_database(267) - (1040, 'ny connections')
2023-01-19 12:36:03,147 - [INFO] - direct_sql.py - new_insert_in_database(268) - {'actCreateDate': None, 'actCreateDateEn': None, 'addresses': ['655016, РЕСПУБЛИКА, ХАКАСИЯ, ГОРОД, АБАКАН, УЛИЦА, ТОРОСОВА, ДОМ 23Б, 190000010000210'], 'admLevelId': 50001, 'appealed': False, 'approveDocOrderDate': None, 'approveDocOrderNum': None, 'approveDocRequestDate': None, 'approveDocRequestNum': None, 'approveDocs': [], 'approveRequired': False, 'approved': False, 'approvedErknm': 'Отказано', 'chlistCount': 2, 'chlistFilledCount': 2, 'chlistFillingIndicationTypeId': [], 'collaboratingOrganizations': [], 'collaboratingOrganizationsIds': [], 'comment': 'п 11(4) постановления Правительства РФ от 10.03.2022 № 336', 'controllingOrganization': 'Управление Роспотребнадзора по Республике Хакасия', 'controllingOrganizationId': 10001021478, 'createPlanDate': None, 'createPlanDateLong': None, 'createdByErpDb': False, 'createdById': 159084, 'dataNotEqualEGRUL': False, 'dataSetNotInTime': False, 'deleted': False, 'directDurationDays': None, 'disapprove': False, 'district': 'Республика Хакасия', 'districtId': 1035950000000001, 'durationDays': 10, 'durationHours': 80, 'erknmActViolationIds': [], 'erknmResultKindDecisionIds': [], 'erpId': '19230041000102881646', 'events': [{'startDate': '23.05.2023', 'stopDate': '05.06.2023', 'title': 'Осмотр'}, {'startDate': '23.05.2023', 'stopDate': '05.06.2023', 'title': 'Досмотр'}, {'startDate': '23.05.2023', 'stopDate': '05.06.2023', 'title': 'Опрос'}, {'startDate': '23.05.2023', 'stopDate': '05.06.2023', 'title': 'Получение письменных объяснений'}, {'startDate': '23.05.2023', 'stopDate': '05.06.2023', 'title': 'Истребование документов'}, {'startDate': '23.05.2023', 'stopDate': '05.06.2023', 'title': 'Отбор проб (образцов)'}, {'startDate': '23.05.2023', 'stopDate': '05.06.2023', 'title': 'Инструментальное обследование'}, {'startDate': '23.05.2023', 'stopDate': '05.06.2023', 'title': 'Испытание'}, {'startDate': '23.05.2023', 'stopDate': '05.06.2023', 'title': 'Экспертиза'}], 'federalLaw': '248', 'federalLawId': 3, 'fullFieldViolationKnm': False, 'hasViolations': False, 'id': 12953763, 'inn': '1901115390', 'inspectorFullName': [], 'isFromSmev': False, 'isHasApproveDocs': False, 'isHasCollaboratingOrganization': False, 'isHasRequirements': True, 'isHasViolationTerm': False, 'isPm': False, 'kind': 'Выездная проверка', 'knmAnnulled': False, 'knmRejected': False, 'knmType': 'Плановое КНМ', 'knmTypeId': 4, 'legalBasisDocName': [], 'links': [], 'mspCategory': ['Не является субъектом МСП'], 'noPunishment': False, 'notifyLate': False, 'objectsKind': ['Дошкольное и начальное общее образование'], 'objectsSubKind': ['Дошкольное и начальное общее образование'], 'objectsType': ['Деятельность и действия'], 'ogrn': '1131901004663', 'oldKnm': None, 'oldPlan': None, 'orderDone': False, 'organizationName': 'МУНИЦИПАЛЬНОЕ БЮДЖЕТНОЕ ДОШКОЛЬНОЕ ОБРАЗОВАТЕЛЬНОЕ УЧРЕЖДЕНИЕ ГОРОДА АБАКАНА ДЕТСКИЙ САД КАПИТОШКА', 'organizationsInn': ['1901115390'], 'organizationsName': ['МУНИЦИПАЛЬНОЕ БЮДЖЕТНОЕ ДОШКОЛЬНОЕ ОБРАЗОВАТЕЛЬНОЕ УЧРЕЖДЕНИЕ ГОРОДА АБАКАНА ДЕТСКИЙ САД КАПИТОШКА'], 'organizationsOgrn': ['1131901004663'], 'planId': '2023050183', 'prosecutorOrganization': 'Прокуратура Республики Хакасия', 'prosecutorOrganizationId': 2080, 'publishedStatus': 'UNPUBLISHED', 'reasons': [201], 'reasonsList': [{'assignmentDate': None, 'assignmentDateEn': None, 'assignmentNumber': None, 'date': '10.10.2016', 'dateEn': '2016-10-10', 'requirementDetails': None, 'text': '(ФЗ 248) Истечение установленного федеральным законом о виде контроля, положением о виде контроля период времени с даты окончания проведения последнего планового контрольного (надзорного) мероприятия'}], 'recEmptyOrLate': False, 'regDateEgrul': '15.08.2022', 'regDateEgrulEn': '2022-08-15', 'regLate': False, 'regTypes': [], 'requirements': 32, 'requirementsList': [{'nameNpa': 'None', 'numberNpa': 'None', 'title': 'None'}, {'nameNpa': 'None', 'numberNpa': 'None', 'title': 'None'}, {'nameNpa': 'None', 'numberNpa': 'None', 'title': 'None'}, {'nameNpa': 'None', 'numberNpa': 'None', 'title': 'None'}, {'nameNpa': 'None', 'numberNpa': 'None', 'title': 'None'}, {'nameNpa': 'None', 'numberNpa': 'None', 'title': 'None'}, {'nameNpa': 'None', 'numberNpa': 'None', 'title': 'None'}, {'nameNpa': 'None', 'numberNpa': 'None', 'title': 'None'}, {'nameNpa': 'None', 'numberNpa': 'None', 'title': 'None'}, {'nameNpa': 'None', 'numberNpa': 'None', 'title': 'None'}, {'nameNpa': 'None', 'numberNpa': 'None', 'title': 'None'}, {'nameNpa': 'None', 'numberNpa': 'None', 'title': 'None'}, {'nameNpa': 'None', 'numberNpa': 'None', 'title': 'None'}, {'nameNpa': 'None', 'numberNpa': 'None', 'title': 'None'}, {'nameNpa': 'None', 'numberNpa': 'None', 'title': 'None'}, {'nameNpa': 'None', 'numberNpa': 'None', 'title': 'None'}, {'nameNpa': 'None', 'numberNpa': 'None', 'title': 'None'}, {'nameNpa': 'None', 'numberNpa': 'None', 'title': 'None'}, {'nameNpa': 'None', 'numberNpa': 'None', 'title': 'None'}, {'nameNpa': 'None', 'numberNpa': 'None', 'title': 'None'}, {'nameNpa': 'None', 'numberNpa': 'None', 'title': 'None'}, {'nameNpa': 'None', 'numberNpa': 'None', 'title': 'None'}, {'nameNpa': 'None', 'numberNpa': 'None', 'title': 'None'}, {'nameNpa': 'None', 'numberNpa': 'None', 'title': 'None'}, {'nameNpa': 'None', 'numberNpa': 'None', 'title': 'None'}, {'nameNpa': 'None', 'numberNpa': 'None', 'title': 'None'}, {'nameNpa': 'None', 'numberNpa': 'None', 'title': 'None'}, {'nameNpa': 'None', 'numberNpa': 'None', 'title': 'None'}, {'nameNpa': 'None', 'numberNpa': 'None', 'title': 'None'}, {'nameNpa': 'None', 'numberNpa': 'None', 'title': 'None'}, {'nameNpa': 'None', 'numberNpa': 'None', 'title': 'None'}, {'nameNpa': 'None', 'numberNpa': 'None', 'title': 'None'}], 'resolved': False, 'resultEmpty': True, 'resultEmptyOrLate': False, 'resultInfoTypeCodes': [], 'resultViolationKnm': False, 'riskCategory': ['чрезвычайно высокий риск'], 'riskCategoryAndDangerClass': ['чрезвычайно высокий риск'], 'sezRegistryExists': False, 'signed': True, 'smevInfoType': None, 'smevMessageType': None, 'smevReceivedAt': None, 'smevReceivedAtEn': None, 'smevReceivedAtMonth': None, 'smevReceivedAtYear': None, 'spvRegistryExists': False, 'startDate': '23.05.2023', 'startDateEn': '2023-05-23', 'status': 'Исключена', 'statusEgrul': 'Найден', 'statusId': 15, 'stopDate': None, 'stopDateEn': None, 'subjectTypeId': 0, 'supervisionType': 'Федеральный государственный санитарно-эпидемиологический контроль (надзор)', 'supervisionTypeId': 4, 'torRegistryExists': False, 'updatePlanDate': None, 'updatePlanDateLong': None, 'version': 'ERKNM', 'violationLawsuitTypeCodes': [], 'violationTypeCodes': [], 'year': 2023}
2023-01-19 12:36:03,150 - [WARNING] - direct_sql.py - new_insert_in_database(269) - Проведена повторная попытка внесения с параметром special, результат неудачный.
2023-01-19 12:36:03,150 - [INFO] - direct_sql.py - database_inserts_conductor_for_multiprocessing(132) - Возникла ошибка, с которой не удалось справиться...
2023-01-19 12:36:03,150 - [INFO] - direct_sql.py - database_inserts_conductor_for_multiprocessing(133) - 
2023-01-19 12:36:03,155 - [ERROR] - direct_sql.py - new_insert_in_database(267) - (1040, 'ny connections')
2023-01-19 12:36:03,155 - [ERROR] - direct_sql.py - new_insert_in_database(267) - (1040, 'ny connections')
2023-01-19 12:36:03,155 - [INFO] - direct_sql.py - new_insert_in_database(268) - {'actCreateDate': None, 'actCreateDateEn': None, 'addresses': ['629303, АВТОНОМНЫЙ ОКРУГ ЯМАЛО-НЕНЕЦКИЙ, ГОРОД НОВЫЙ УРЕНГОЙ, МИКРОРАЙОН МИРНЫЙ, ДОМ 1, КОРПУС 1Б, ОФИС ЭТАЖ 8', '629303, АВТОНОМНЫЙ ОКРУГ ЯМАЛО-НЕНЕЦКИЙ, ГОРОД НОВЫЙ УРЕНГОЙ, МИКРОРАЙОН МИРНЫЙ, ДОМ 1, КОРПУС 1Б, ОФИС ЭТАЖ 8'], 'admLevelId': 50001, 'appealed': False, 'approveDocOrderDate': None, 'approveDocOrderNum': None, 'approveDocRequestDate': None, 'approveDocRequestNum': None, 'approveDocs': [], 'approveRequired': False, 'approved': True, 'approvedErknm': 'Согласовано', 'chlistCount': 1, 'chlistFilledCount': 1, 'chlistFillingIndicationTypeId': [], 'collaboratingOrganizations': [], 'collaboratingOrganizationsIds': [], 'comment': None, 'controllingOrganization': 'Управление Роспотребнадзора по Ямало-Ненецкому автономному округу', 'controllingOrganizationId': 10001030002, 'createPlanDate': None, 'createPlanDateLong': None, 'createdByErpDb': False, 'createdById': 177282, 'dataNotEqualEGRUL': False, 'dataSetNotInTime': True, 'deleted': False, 'directDurationDays': None, 'disapprove': False, 'district': 'Салехард', 'districtId': 1034711710000001, 'durationDays': None, 'durationHours': 50, 'erknmActViolationIds': [], 'erknmResultKindDecisionIds': [], 'erpId': '89230041000102863885', 'events': [{'startDate': '05.04.2023', 'stopDate': '18.04.2023', 'title': 'Осмотр'}, {'startDate': '05.04.2023', 'stopDate': '18.04.2023', 'title': 'Досмотр'}, {'startDate': '05.04.2023', 'stopDate': '18.04.2023', 'title': 'Опрос'}, {'startDate': '05.04.2023', 'stopDate': '18.04.2023', 'title': 'Получение письменных объяснений'}, {'startDate': '05.04.2023', 'stopDate': '18.04.2023', 'title': 'Истребование документов'}, {'startDate': '05.04.2023', 'stopDate': '18.04.2023', 'title': 'Отбор проб (образцов)'}, {'startDate': '05.04.2023', 'stopDate': '18.04.2023', 'title': 'Инструментальное обследование'}, {'startDate': '05.04.2023', 'stopDate': '18.04.2023', 'title': 'Испытание'}, {'startDate': '05.04.2023', 'stopDate': '18.04.2023', 'title': 'Экспертиза'}], 'federalLaw': '248', 'federalLawId': 3, 'fullFieldViolationKnm': False, 'hasViolations': False, 'id': 12936002, 'inn': '8904052159', 'inspectorFullName': [], 'isFromSmev': False, 'isHasApproveDocs': False, 'isHasCollaboratingOrganization': False, 'isHasRequirements': True, 'isHasViolationTerm': False, 'isPm': False, 'kind': 'Выездная проверка', 'knmAnnulled': False, 'knmRejected': False, 'knmType': 'Плановое КНМ', 'knmTypeId': 4, 'legalBasisDocName': [], 'links': [], 'mspCategory': ['Малое предприятие'], 'noPunishment': False, 'notifyLate': False, 'objectsKind': ['Деятельность в области здравоохранения', 'здания, помещения, сооружения, линейные объекты, территории, включая водные, земельные и лесные участки, оборудование, устройства, предметы, материалы, транспортные средства и другие объекты, которыми граждане и организации владеют и (или) пользуются и к которым предъявляются обязательные требования'], 'objectsSubKind': ['Деятельность в области здравоохранения', 'здания, помещения, сооружения, линейные объекты, территории, включая водные, земельные и лесные участки, оборудование, устройства, предметы, материалы, транспортные средства и другие объекты, которыми граждане и организации владеют и (или) пользуются и к которым предъявляются обязательные требования'], 'objectsType': ['Деятельность и действия', 'Производственные объекты'], 'ogrn': '1078904000614', 'oldKnm': None, 'oldPlan': None, 'orderDone': False, 'organizationName': 'ОБЩЕСТВО С ОГРАНИЧЕННОЙ ОТВЕТСТВЕННОСТЬЮ СЕМЕЙНЫЙ ДОКТОР', 'organizationsInn': ['8904052159'], 'organizationsName': ['ОБЩЕСТВО С ОГРАНИЧЕННОЙ ОТВЕТСТВЕННОСТЬЮ СЕМЕЙНЫЙ ДОКТОР'], 'organizationsOgrn': ['1078904000614'], 'planId': '2023051007', 'prosecutorOrganization': 'Прокуратура Ямало-Ненецкого автономного округа', 'prosecutorOrganizationId': 3065, 'publishedStatus': 'PUBLISHED', 'reasons': [201], 'reasonsList': [{'assignmentDate': None, 'assignmentDateEn': None, 'assignmentNumber': None, 'date': '23.11.2018', 'dateEn': '2018-11-23', 'requirementDetails': None, 'text': '(ФЗ 248) Истечение установленного федеральным законом о виде контроля, положением о виде контроля период времени с даты окончания проведения последнего планового контрольного (надзорного) мероприятия'}], 'recEmptyOrLate': False, 'regDateEgrul': '04.09.2022', 'regDateEgrulEn': '2022-09-04', 'regLate': False, 'regTypes': ['MSP'], 'requirements': 33, 'requirementsList': [{'nameNpa': 'None', 'numberNpa': 'None', 'title': 'None'}, {'nameNpa': 'None', 'numberNpa': 'None', 'title': 'None'}, {'nameNpa': 'None', 'numberNpa': 'None', 'title': 'None'}, {'nameNpa': 'None', 'numberNpa': 'None', 'title': 'None'}, {'nameNpa': 'None', 'numberNpa': 'None', 'title': 'None'}, {'nameNpa': 'None', 'numberNpa': 'None', 'title': 'None'}, {'nameNpa': 'None', 'numberNpa': 'None', 'title': 'None'}, {'nameNpa': 'None', 'numberNpa': 'None', 'title': 'None'}, {'nameNpa': 'None', 'numberNpa': 'None', 'title': 'None'}, {'nameNpa': 'None', 'numberNpa': 'None', 'title': 'None'}, {'nameNpa': 'None', 'numberNpa': 'None', 'title': 'None'}, {'nameNpa': 'None', 'numberNpa': 'None', 'title': 'None'}, {'nameNpa': 'None', 'numberNpa': 'None', 'title': 'None'}, {'nameNpa': 'None', 'numberNpa': 'None', 'title': 'None'}, {'nameNpa': 'None', 'numberNpa': 'None', 'title': 'None'}, {'nameNpa': 'None', 'numberNpa': 'None', 'title': 'None'}, {'nameNpa': 'None', 'numberNpa': 'None', 'title': 'None'}, {'nameNpa': 'None', 'numberNpa': 'None', 'title': 'None'}, {'nameNpa': 'None', 'numberNpa': 'None', 'title': 'None'}, {'nameNpa': 'None', 'numberNpa': 'None', 'title': 'None'}, {'nameNpa': 'None', 'numberNpa': 'None', 'title': 'None'}, {'nameNpa': 'None', 'numberNpa': 'None', 'title': 'None'}, {'nameNpa': 'None', 'numberNpa': 'None', 'title': 'None'}, {'nameNpa': 'None', 'numberNpa': 'None', 'title': 'None'}, {'nameNpa': 'None', 'numberNpa': 'None', 'title': 'None'}, {'nameNpa': 'None', 'numberNpa': 'None', 'title': 'None'}, {'nameNpa': 'None', 'numberNpa': 'None', 'title': 'None'}, {'nameNpa': 'None', 'numberNpa': 'None', 'title': 'None'}, {'nameNpa': 'None', 'numberNpa': 'None', 'title': 'None'}, {'nameNpa': 'None', 'numberNpa': 'None', 'title': 'None'}, {'nameNpa': 'None', 'numberNpa': 'None', 'title': 'None'}, {'nameNpa': 'None', 'numberNpa': 'None', 'title': 'None'}, {'nameNpa': 'None', 'numberNpa': 'None', 'title': 'None'}], 'resolved': False, 'resultEmpty': True, 'resultEmptyOrLate': False, 'resultInfoTypeCodes': [], 'resultViolationKnm': False, 'riskCategory': ['высокий риск', 'высокий риск'], 'riskCategoryAndDangerClass': ['высокий риск / Второй', 'высокий риск / Второй'], 'sezRegistryExists': False, 'signed': True, 'smevInfoType': None, 'smevMessageType': None, 'smevReceivedAt': None, 'smevReceivedAtEn': None, 'smevReceivedAtMonth': None, 'smevReceivedAtYear': None, 'spvRegistryExists': False, 'startDate': '05.04.2023', 'startDateEn': '2023-04-05', 'status': 'Ожидает проведения', 'statusEgrul': 'Найден', 'statusId': 5, 'stopDate': '18.04.2023', 'stopDateEn': '2023-04-18', 'subjectTypeId': 0, 'supervisionType': 'Федеральный государственный санитарно-эпидемиологический контроль (надзор)', 'supervisionTypeId': 4, 'torRegistryExists': False, 'updatePlanDate': None, 'updatePlanDateLong': None, 'version': 'ERKNM', 'violationLawsuitTypeCodes': [], 'violationTypeCodes': [], 'year': 2023}
2023-01-19 12:36:03,155 - [INFO] - direct_sql.py - new_insert_in_database(268) - {'actCreateDate': None, 'actCreateDateEn': None, 'addresses': ['427431, РЕСПУБЛИКА УДМУРТСКАЯ, ГОРОД ВОТКИНСК, УЛИЦА МАЯКОВСКОГО, 45, '], 'admLevelId': 50001, 'appealed': False, 'approveDocOrderDate': None, 'approveDocOrderNum': None, 'approveDocRequestDate': None, 'approveDocRequestNum': None, 'approveDocs': [], 'approveRequired': False, 'approved': False, 'approvedErknm': 'Отказано', 'chlistCount': 0, 'chlistFilledCount': 0, 'chlistFillingIndicationTypeId': [], 'collaboratingOrganizations': [], 'collaboratingOrganizationsIds': [], 'comment': 'Несоответствие запланированного планового контрольного (надзорного) мероприятия  требованиям пункта 11(4) Постановления Правительства Российской Федерации от 10.03.2022 № 336 «Об особенностях организации и осуществления государственного контроля (надзора), муниципального контроля». ', 'controllingOrganization': 'Управления Роспотребнадзора по Удмуртской Республике', 'controllingOrganizationId': 10001012486, 'createPlanDate': None, 'createPlanDateLong': None, 'createdByErpDb': False, 'createdById': 168890, 'dataNotEqualEGRUL': False, 'dataSetNotInTime': False, 'deleted': False, 'directDurationDays': None, 'disapprove': False, 'district': 'Удмуртская Республика', 'districtId': 1033940000000001, 'durationDays': 10, 'durationHours': None, 'erknmActViolationIds': [], 'erknmResultKindDecisionIds': [], 'erpId': '18230041000103733509', 'events': [{'startDate': '20.04.2023', 'stopDate': '04.05.2023', 'title': 'Получение письменных объяснений'}, {'startDate': '20.04.2023', 'stopDate': '04.05.2023', 'title': 'Истребование документов'}, {'startDate': '20.04.2023', 'stopDate': '04.05.2023', 'title': 'Экспертиза'}], 'federalLaw': '248', 'federalLawId': 3, 'fullFieldViolationKnm': False, 'hasViolations': False, 'id': 13805626, 'inn': '1828009879', 'inspectorFullName': [], 'isFromSmev': False, 'isHasApproveDocs': False, 'isHasCollaboratingOrganization': False, 'isHasRequirements': True, 'isHasViolationTerm': False, 'isPm': False, 'kind': 'Документарная проверка', 'knmAnnulled': False, 'knmRejected': False, 'knmType': 'Плановое КНМ', 'knmTypeId': 4, 'legalBasisDocName': [], 'links': [], 'mspCategory': ['Не является субъектом МСП'], 'noPunishment': False, 'notifyLate': False, 'objectsKind': ['Деятельность дошкольных образовательных организаций'], 'objectsSubKind': ['Деятельность дошкольных образовательных организаций'], 'objectsType': ['Деятельность и действия'], 'ogrn': '1021801063976', 'oldKnm': None, 'oldPlan': None, 'orderDone': False, 'organizationName': 'МУНИЦИПАЛЬНОЕ БЮДЖЕТНОЕ ДОШКОЛЬНОЕ ОБРАЗОВАТЕЛЬНОЕ УЧРЕЖДЕНИЕ ДЕТСКИЙ САД №33 ГОРОДА ВОТКИНСКА УДМУРТСКОЙ РЕСПУБЛИКИ', 'organizationsInn': ['1828009879'], 'organizationsName': ['МУНИЦИПАЛЬНОЕ БЮДЖЕТНОЕ ДОШКОЛЬНОЕ ОБРАЗОВАТЕЛЬНОЕ УЧРЕЖДЕНИЕ ДЕТСКИЙ САД №33 ГОРОДА ВОТКИНСКА УДМУРТСКОЙ РЕСПУБЛИКИ'], 'organizationsOgrn': ['1021801063976'], 'planId': '2023049688', 'prosecutorOrganization': 'Прокуратура Удмуртской Республики', 'prosecutorOrganizationId': 1324, 'publishedStatus': 'UNPUBLISHED', 'reasons': [201], 'reasonsList': [{'assignmentDate': None, 'assignmentDateEn': None, 'assignmentNumber': None, 'date': '11.04.2022', 'dateEn': '2022-04-11', 'requirementDetails': None, 'text': '(ФЗ 248) Истечение установленного федеральным законом о виде контроля, положением о виде контроля период времени с даты окончания проведения последнего планового контрольного (надзорного) мероприятия'}], 'recEmptyOrLate': False, 'regDateEgrul': '29.09.2022', 'regDateEgrulEn': '2022-09-29', 'regLate': False, 'regTypes': [], 'requirements': 1, 'requirementsList': [{'nameNpa': 'None', 'numberNpa': 'None', 'title': 'None'}], 'resolved': False, 'resultEmpty': True, 'resultEmptyOrLate': False, 'resultInfoTypeCodes': [], 'resultViolationKnm': False, 'riskCategory': ['чрезвычайно высокий риск'], 'riskCategoryAndDangerClass': ['чрезвычайно высокий риск'], 'sezRegistryExists': False, 'signed': True, 'smevInfoType': None, 'smevMessageType': None, 'smevReceivedAt': None, 'smevReceivedAtEn': None, 'smevReceivedAtMonth': None, 'smevReceivedAtYear': None, 'spvRegistryExists': False, 'startDate': '20.04.2023', 'startDateEn': '2023-04-20', 'status': 'Исключена', 'statusEgrul': 'В процессе поиска', 'statusId': 15, 'stopDate': '04.05.2023', 'stopDateEn': '2023-05-04', 'subjectTypeId': 0, 'supervisionType': 'Федеральный государственный санитарно-эпидемиологический контроль (надзор)', 'supervisionTypeId': 4, 'torRegistryExists': False, 'updatePlanDate': None, 'updatePlanDateLong': None, 'version': 'ERKNM', 'violationLawsuitTypeCodes': [], 'violationTypeCodes': [], 'year': 2023}
2023-01-19 12:36:03,155 - [WARNING] - direct_sql.py - new_insert_in_database(269) - Проведена повторная попытка внесения с параметром special, результат неудачный.
2023-01-19 12:36:03,156 - [WARNING] - direct_sql.py - new_insert_in_database(269) - Проведена повторная попытка внесения с параметром special, результат неудачный.
2023-01-19 12:36:03,156 - [INFO] - direct_sql.py - database_inserts_conductor_for_multiprocessing(132) - Возникла ошибка, с которой не удалось справиться...
2023-01-19 12:36:03,156 - [INFO] - direct_sql.py - database_inserts_conductor_for_multiprocessing(132) - Возникла ошибка, с которой не удалось справиться...
2023-01-19 12:36:03,156 - [INFO] - direct_sql.py - database_inserts_conductor_for_multiprocessing(133) - 
2023-01-19 12:36:03,156 - [INFO] - direct_sql.py - database_inserts_conductor_for_multiprocessing(133) - 
2023-01-19 12:36:03,160 - [ERROR] - direct_sql.py - new_insert_in_database(267) - (1040, 'ny connections')
2023-01-19 12:36:03,160 - [INFO] - direct_sql.py - new_insert_in_database(268) - {'actCreateDate': None, 'actCreateDateEn': None, 'addresses': ['169313, РЕСПУБЛИКА КОМИ, ГОРОД УХТА, УЛИЦА ОПЛЕСНИНА, 28, ', 'Республика Коми, г. Ухта, ул. Оплеснина, д.28\n'], 'admLevelId': 50001, 'appealed': False, 'approveDocOrderDate': None, 'approveDocOrderNum': None, 'approveDocRequestDate': None, 'approveDocRequestNum': None, 'approveDocs': [], 'approveRequired': False, 'approved': False, 'approvedErknm': 'Отказано', 'chlistCount': 2, 'chlistFilledCount': 2, 'chlistFillingIndicationTypeId': [], 'collaboratingOrganizations': [], 'collaboratingOrganizationsIds': [], 'comment': 'в силу положений п. 11(4) постановления Правительства Российской Федерации от 10.03.2022 № 336 в планы проведения плановых КНМ не подлежат включению плановые КНМ  в отношении государственных и муниципальных учреждений дошкольного и начального общего, основного общего и среднего общего образования, объекты контроля которых отнесены к категориям чрезвычайно высокого и высокого риска', 'controllingOrganization': 'Управление Роспотребнадзора по Республике Коми', 'controllingOrganizationId': 10001016637, 'createPlanDate': None, 'createPlanDateLong': None, 'createdByErpDb': False, 'createdById': 160403, 'dataNotEqualEGRUL': False, 'dataSetNotInTime': False, 'deleted': False, 'directDurationDays': None, 'disapprove': False, 'district': 'Республика Коми', 'districtId': 1031870000000001, 'durationDays': 10, 'durationHours': None, 'erknmActViolationIds': [], 'erknmResultKindDecisionIds': [], 'erpId': '11230041000103539910', 'events': [{'startDate': '06.06.2023', 'stopDate': '20.06.2023', 'title': 'Осмотр'}, {'startDate': '06.06.2023', 'stopDate': '20.06.2023', 'title': 'Опрос'}, {'startDate': '06.06.2023', 'stopDate': '20.06.2023', 'title': 'Получение письменных объяснений'}, {'startDate': '06.06.2023', 'stopDate': '20.06.2023', 'title': 'Истребование документов'}, {'startDate': '06.06.2023', 'stopDate': '20.06.2023', 'title': 'Отбор проб (образцов)'}, {'startDate': '06.06.2023', 'stopDate': '20.06.2023', 'title': 'Испытание'}, {'startDate': '06.06.2023', 'stopDate': '20.06.2023', 'title': 'Экспертиза'}], 'federalLaw': '248', 'federalLawId': 3, 'fullFieldViolationKnm': False, 'hasViolations': False, 'id': 13612027, 'inn': '1102026497', 'inspectorFullName': [], 'isFromSmev': False, 'isHasApproveDocs': False, 'isHasCollaboratingOrganization': False, 'isHasRequirements': True, 'isHasViolationTerm': False, 'isPm': False, 'kind': 'Выездная проверка', 'knmAnnulled': False, 'knmRejected': False, 'knmType': 'Плановое КНМ', 'knmTypeId': 4, 'legalBasisDocName': [], 'links': [], 'mspCategory': ['Не является субъектом МСП'], 'noPunishment': False, 'notifyLate': False, 'objectsKind': ['Деятельность по организации отдыха детей и их оздоровления, в том числе лагеря с дневным пребыванием', 'Деятельность по организации отдыха детей и их оздоровления, в том числе лагеря с дневным пребыванием'], 'objectsSubKind': ['Деятельность по организации отдыха детей и их оздоровления, в том числе лагеря с дневным пребыванием', 'Деятельность по организации отдыха детей и их оздоровления, в том числе лагеря с дневным пребыванием'], 'objectsType': ['Деятельность и действия', 'Деятельность и действия'], 'ogrn': '1021100735358', 'oldKnm': None, 'oldPlan': None, 'orderDone': False, 'organizationName': 'МУНИЦИПАЛЬНОЕ ОБЩЕОБРАЗОВАТЕЛЬНОЕ УЧРЕЖДЕНИЕ СРЕДНЯЯ ОБЩЕОБРАЗОВАТЕЛЬНАЯ ШКОЛА №3 ИМЕНИ ГЕРОЯ РОССИИ А.И. АЛЕКСЕЕВА', 'organizationsInn': ['1102026497'], 'organizationsName': ['МУНИЦИПАЛЬНОЕ ОБЩЕОБРАЗОВАТЕЛЬНОЕ УЧРЕЖДЕНИЕ СРЕДНЯЯ ОБЩЕОБРАЗОВАТЕЛЬНАЯ ШКОЛА №3 ИМЕНИ ГЕРОЯ РОССИИ А.И. АЛЕКСЕЕВА'], 'organizationsOgrn': ['1021100735358'], 'planId': '2023059758', 'prosecutorOrganization': 'Прокуратура Республики Коми', 'prosecutorOrganizationId': 654, 'publishedStatus': 'UNPUBLISHED', 'reasons': [204], 'reasonsList': [{'assignmentDate': None, 'assignmentDateEn': None, 'assignmentNumber': None, 'date': '01.06.2023', 'dateEn': '2023-06-01', 'requirementDetails': None, 'text': '(ФЗ 248) Истечение установленного федеральным законом о виде контроля, положением о виде контроля периода времени с даты иного события, установленного федеральным законом о виде контроля, положением о виде контроля, которое ведет к возникновению объекта контроля'}], 'recEmptyOrLate': False, 'regDateEgrul': '21.09.2022', 'regDateEgrulEn': '2022-09-21', 'regLate': False, 'regTypes': [], 'requirements': 1, 'requirementsList': [{'nameNpa': 'Федеральный закон №52-ФЗ от 30.03.1999 г. «О санитарно-эпидемиологическом благополучии населения» (ст.15, ст.17, ст.19, ст.21, ст.22, ст.24, ст.28, ст.29, ст.31, ст.32, ст.34, ст.36);\n- Федеральный закон от 24.07.1998г. № 124-ФЗ «Об основных гарантиях прав ребенка в Российской Федерации» (п.2 ст. 12);\n- Федеральный закон от 02.01.2000г. № 29-ФЗ «О качестве и безопасности пищевых продуктов» (п.1-3 ст. 3; п.1, 2 ст.5; п. 1, 3 ст.9; ст.15; ст.17; ст.20; ст.23; ст.24; п.1 ст.25.1; ст.25.2);\n- Федеральный закон от 23.02.2013г. №15-ФЗ «Об охране здоровья граждан от воздействия окружающего табачного дыма, последствий потребления табака или потребления никотинсодержащей продукции» (ст. 12, ст.20);\n- Федеральный закон от 17.09.1998 г. №157-ФЗ «Об иммунопрофилактике инфекционных болезней» (ст. 9, п. 4 ст.11);\n- Федеральный закон от 18.06.2001г. № 77-ФЗ «О предупреждении распро-странения туберкулёза в Российской Федерации» (п.п. 3, 4 ст. 8);\n- Федеральный закон от 24.06.1998 № 89-ФЗ Об отходах производства и потребления (ч.ч.1, 3 ст.13.4);\n- Технический регламент Таможенного союза «О безопасности пищевой продукции» ТР ТС 021/2011 (за исключением статьи 6, абзацев 2, 7, 12-14 части 5 статьи 7, части 3 статьи 13, части 2 статьи 18, статей 30 и 40); \n- Технический регламент Таможенного союза «Пищевая продукция в части её маркировки» ТР ТС 022/2011;\n- Технический регламент Таможенного союза «Технический регламент на соковую продукцию из фруктов и овощей» ТР ТС 023/2011 (ст. 3 - ст. 8);\n- Технический регламент Таможенного союза «Технический регламент на масложировую продукцию» ТР ТС 024/2011;\n- Технический регламент Таможенного союза «О безопасности мебельной продукции» ТР ТС 025/2012 (ст. 4 – ст.7);\n- Технический регламент Таможенного союза «О безопасности отдельных видов специализированной пищевой продукции, в том числе диетического, лечебного и диетического профилактического питания» ТР ТС 027/2012;\n- Технический регламент Таможенного союза «Требования безопасности пищевых добавок, ароматизаторов и технологических вспомогательных средств» ТР ТС 029/2012;\n- Технический регламент Таможенного союза «О безопасности молока и молочной продукции» ТР ТС 033/2013 (за исключением пунктов 13, 14, 97, 98 и 115);\n- Технический регламент Таможенного союза «О безопасности мяса и мясной продукции» ТР ТС 034/2013 (за исключением пунктов 1-8, 26-48, 53, 54 и абзаца 2 пункта 99);\n- Разделы IV и V (за исключением пункта 14), VIII, IX, X, XI (за исключе-нием пунктов 85, 86), XII Технического регламента Евразийского экономического союза «О безопасности рыбы и рыбной продукции» ТР ЕАЭС 040/2016;\n- разделы III, IV, V, VI, VII и X Технического регламента Евразийского эко-номического союза «О безопасности упакованной питьевой воды, включая природную минеральную воду» ТР ЕАЭС 044/2017; \n- Технический регламент Таможенного союза «О безопасности игрушек» ТР ТС 008/2011 (ст. 3 – ст. 7); \n- Технический регламент Таможенного союза «О безопасности продукции, предназначенной для детей и подростков» ТР ТС 007/2011 (ст. 3 – ст. 11, ст 13);\n- раздел IV, пункты 15, 16, подпункты а, д пункта 18 раздела VI, пункт 49 раздела VIII, разделы IX и X в части требований к покрытию для детских игровых площадок и связанным с ним процессам Технического регламента Евразийского экономического союза О безопасности оборудования для детских игровых площадок ТР ЕАЭС 042/2017; \n- Единые санитарно-эпидемиологические и гигиенические требования к то-варам, подлежащим санитарно-эпидемиологическому надзору (контролю), утвержденные решением Комиссии Таможенного союза 28.05.2010 № 299;   \n- СП 2.4.3648-20 Санитарно-эпидемиологические требования к организациям воспитания и обучения, отдыха и оздоровления детей и молодежи\n- СП 3.1/2.4.3598-20 «Санитарно-эпидемиологические требования к устрой-ству, содержанию и организации работы образовательных организаций и других объектов социальной инфраструктуры для детей и молодежи в усло-виях распространения новой коронавирусной инфекции (COVID-19)»; \n- СанПиН 2.3/2.4.3590-20 «Санитарно-эпидемиологические требования к организации общественного питания населения»;\n- СанПиН 1.2.3685-21 «Гигиенические нормативы и требования к обеспече-нию безопасности и (или) безвредности для человека факторов среды обитания»;\n- СанПиН 2.1.3684-21 «Санитарно-эпидемиологические требования к содержанию территорий городских и сельских поселений, к водным объектам, питьевой воде и питьевому водоснабжению, атмосферному воздуху, почвам, жилым помещениям, эксплуатации производственных, общественных помещений, организации и проведению санитарно-противоэпидемических (профилактических) мероприятий»;\n- СП 3.1.3597-20 Профилактика новой коронавирусной инфекции (COVID-19)\n- СанПиН 3.3686-21 Санитарно-эпидемиологические требования по профилактике инфекционных болезней; \n- СП 2.2.3670-20 «Санитарно-эпидемиологические требования к условиям труда»;\n- приказ Министерства труда и социальной защиты Российской Федерации и Министерства здравоохранения Российской Федерации от 31.12.2020 г. № 988н/1420н «Об утверждении перечня вредных и (или) опасных производственных факторов и работ, при выполнении которых проводятся обязательные предварительные медицинские осмотры при поступлении на работу и периодические медицинские осмотры»;\n- приказ Министерства здравоохранения Российской Федерации от 28.01.2021 года № 29н «Об утверждении Порядка проведения обязательных предварительных и периодических медицинских осмотров работников, предусмотренных частью четвертой статьи 213 Трудового кодекса Российской Федерации, перечня медицинских противопоказаний к осуществлению работ с вредными и (или) опасными производственными факторами, а также работам, при выполнении которых проводятся обязательные предварительные и периодические медицинские осмотры»\n\n', 'numberNpa': '30.03.1999', 'title': 'Соблюдение обязательных требований'}], 'resolved': False, 'resultEmpty': True, 'resultEmptyOrLate': False, 'resultInfoTypeCodes': [], 'resultViolationKnm': False, 'riskCategory': ['чрезвычайно высокий риск', 'чрезвычайно высокий риск'], 'riskCategoryAndDangerClass': ['чрезвычайно высокий риск / Первый', 'чрезвычайно высокий риск / Первый'], 'sezRegistryExists': False, 'signed': True, 'smevInfoType': None, 'smevMessageType': None, 'smevReceivedAt': None, 'smevReceivedAtEn': None, 'smevReceivedAtMonth': None, 'smevReceivedAtYear': None, 'spvRegistryExists': False, 'startDate': '06.06.2023', 'startDateEn': '2023-06-06', 'status': 'Исключена', 'statusEgrul': 'Найден', 'statusId': 15, 'stopDate': None, 'stopDateEn': None, 'subjectTypeId': 0, 'supervisionType': 'Федеральный государственный санитарно-эпидемиологический контроль (надзор)', 'supervisionTypeId': 4, 'torRegistryExists': False, 'updatePlanDate': None, 'updatePlanDateLong': None, 'version': 'ERKNM', 'violationLawsuitTypeCodes': [], 'violationTypeCodes': [], 'year': 2023}
2023-01-19 12:36:03,161 - [WARNING] - direct_sql.py - new_insert_in_database(269) - Проведена повторная попытка внесения с параметром special, результат неудачный.
2023-01-19 12:36:03,161 - [INFO] - direct_sql.py - database_inserts_conductor_for_multiprocessing(132) - Возникла ошибка, с которой не удалось справиться...
2023-01-19 12:36:03,161 - [INFO] - direct_sql.py - database_inserts_conductor_for_multiprocessing(133) - 
2023-01-19 12:36:03,164 - [ERROR] - direct_sql.py - new_insert_in_database(267) - (1040, 'ny connections')
2023-01-19 12:36:03,164 - [INFO] - direct_sql.py - new_insert_in_database(268) - {'actCreateDate': None, 'actCreateDateEn': None, 'addresses': ['305518, ОБЛАСТЬ КУРСКАЯ, РАЙОН КУРСКИЙ, СЕЛО ГЛЕБОВО, ДОМ 37, '], 'admLevelId': 50001, 'appealed': False, 'approveDocOrderDate': None, 'approveDocOrderNum': None, 'approveDocRequestDate': None, 'approveDocRequestNum': None, 'approveDocs': [], 'approveRequired': False, 'approved': False, 'approvedErknm': 'Отказано', 'chlistCount': 2, 'chlistFilledCount': 2, 'chlistFillingIndicationTypeId': [], 'collaboratingOrganizations': [], 'collaboratingOrganizationsIds': [], 'comment': 'На основании пункта 11(4) постановления Правительства РФ от 10.03.2022 № 336 в планы проведения плановых КНМ на 2023 год не включаются КНМ в отношении государственных и муниципальных учреждений дошкольного и начального общего образования, основного общего и среднего общего образования, объекты которых отнесены к категориям чрезвычайно высокого и высокого риска.', 'controllingOrganization': 'Управления Роспотребнадзора по Курской области', 'controllingOrganizationId': 10001017235, 'createPlanDate': None, 'createPlanDateLong': None, 'createdByErpDb': False, 'createdById': 161797, 'dataNotEqualEGRUL': False, 'dataSetNotInTime': False, 'deleted': False, 'directDurationDays': None, 'disapprove': False, 'district': 'Курская область', 'districtId': 1030380000000001, 'durationDays': 10, 'durationHours': 75, 'erknmActViolationIds': [], 'erknmResultKindDecisionIds': [], 'erpId': '46230041000103125452', 'events': [{'startDate': '02.06.2023', 'stopDate': '16.06.2023', 'title': 'Осмотр'}, {'startDate': '02.06.2023', 'stopDate': '16.06.2023', 'title': 'Истребование документов'}, {'startDate': '02.06.2023', 'stopDate': '16.06.2023', 'title': 'Отбор проб (образцов)'}, {'startDate': '02.06.2023', 'stopDate': '16.06.2023', 'title': 'Инструментальное обследование'}, {'startDate': '02.06.2023', 'stopDate': '16.06.2023', 'title': 'Испытание'}, {'startDate': '02.06.2023', 'stopDate': '16.06.2023', 'title': 'Экспертиза'}], 'federalLaw': '248', 'federalLawId': 3, 'fullFieldViolationKnm': False, 'hasViolations': False, 'id': 13197569, 'inn': '4611005666', 'inspectorFullName': [], 'isFromSmev': False, 'isHasApproveDocs': False, 'isHasCollaboratingOrganization': False, 'isHasRequirements': True, 'isHasViolationTerm': False, 'isPm': False, 'kind': 'Выездная проверка', 'knmAnnulled': False, 'knmRejected': False, 'knmType': 'Плановое КНМ', 'knmTypeId': 4, 'legalBasisDocName': [], 'links': [], 'mspCategory': ['Не является субъектом МСП'], 'noPunishment': False, 'notifyLate': False, 'objectsKind': ['Деятельность по организации отдыха детей и их оздоровления, в том числе лагеря с дневным пребыванием'], 'objectsSubKind': ['Деятельность по организации отдыха детей и их оздоровления, в том числе лагеря с дневным пребыванием'], 'objectsType': ['Деятельность и действия'], 'ogrn': '1024600616963', 'oldKnm': None, 'oldPlan': None, 'orderDone': False, 'organizationName': 'МУНИЦИПАЛЬНОЕ БЮДЖЕТНОЕ ОБЩЕОБРАЗОВАТЕЛЬНОЕ УЧРЕЖДЕНИЕ ГЛЕБОВСКАЯ СРЕДНЯЯ ОБЩЕОБРАЗОВАТЕЛЬНАЯ ШКОЛА КУРСКОГО РАЙОНА КУРСКОЙ ОБЛАСТИ', 'organizationsInn': ['4611005666'], 'organizationsName': ['МУНИЦИПАЛЬНОЕ БЮДЖЕТНОЕ ОБЩЕОБРАЗОВАТЕЛЬНОЕ УЧРЕЖДЕНИЕ ГЛЕБОВСКАЯ СРЕДНЯЯ ОБЩЕОБРАЗОВАТЕЛЬНАЯ ШКОЛА КУРСКОГО РАЙОНА КУРСКОЙ ОБЛАСТИ'], 'organizationsOgrn': ['1024600616963'], 'planId': '2023050566', 'prosecutorOrganization': 'Прокуратура Курской области', 'prosecutorOrganizationId': 214, 'publishedStatus': 'UNPUBLISHED', 'reasons': [201], 'reasonsList': [{'assignmentDate': None, 'assignmentDateEn': None, 'assignmentNumber': None, 'date': '16.06.2022', 'dateEn': '2022-06-16', 'requirementDetails': None, 'text': '(ФЗ 248) Истечение установленного федеральным законом о виде контроля, положением о виде контроля период времени с даты окончания проведения последнего планового контрольного (надзорного) мероприятия'}], 'recEmptyOrLate': False, 'regDateEgrul': '23.08.2022', 'regDateEgrulEn': '2022-08-23', 'regLate': False, 'regTypes': [], 'requirements': 15, 'requirementsList': [{'nameNpa': 'Федеральный закон О санитарно-эпидемиологическом благополучии населения от 30.03.1999 N 52-ФЗ', 'numberNpa': '30.03.1999', 'title': 'соблюдение требований \nст.12, ст.13, ст.14, ст.15, ст.16, ст.17, ст.18, ст.19, ст.20, ст.21, ст.22, ст.23, ст.24, ст.25, ст.26, ст.27, ст.28, ст.29, ст.30, ст.31, ст.32, ст.33, ст.34, ст.36, ст.40, ст.41'}, {'nameNpa': 'Приказ Минздрава России от 28.01.2021 N 29н «Об утверждении Порядка проведения обязательных предварительных и периодических медицинских осмотров работников, предусмотренных частью четвертой статьи 213 Трудового кодекса Российской Федерации, перечня медицинских противопоказаний к осуществлению работ с вредными и (или) опасными производственными факторами, а также работам, при выполнении которых проводятся обязательные предварительные и периодические медицинские осмотры» ', 'numberNpa': '28.01.2021', 'title': 'соблюдение требований п. 4.1 приложения к Порядку проведения обязательных предварительных и периодических медицинских осмотров работников, предусмотренных частью четвертой статьи 213 Трудового кодекса Российской Федерации\n'}, {'nameNpa': 'Федеральный закон О качестве и безопасности пищевых продуктов от 02.01.2000 N 29-ФЗ', 'numberNpa': '02.01.2000', 'title': ' соблюдение требований п.1-3 ст.3, п.1,2 ст.5, п.1, 3 ст.9, ст. 12, ст.15, ст.16, ст.17, ст.18, ст.19, ст.20, п.1, 3 ст. 21, ст.22, ст.23, ст.24, п.1, 3.1, 5 ст.25.1, ст.25.2, ст.25.3, ст.25.4, ст.25.5, ст.25.6'}, {'nameNpa': 'Федеральный закон Об отходах производства и потребления от 24.06.1998 N 89-ФЗ ', 'numberNpa': '24.06.1998', 'title': 'соблюдение требований ч.1 ст.13, ч.1, 3, ст.13.4, ч.1,2 ст.16'}, {'nameNpa': 'СанПиН 3.3686-21 Санитарно-эпидемиологические требования по профилактике инфекционных болезней  ', 'numberNpa': '28.01.2021', 'title': 'соблюдение требований п. п. 5,9-11,13-78,21,22,24,26,35,36,38-42,52-54,58,62-65,72,75-78,79-89,90-94,98-107,108,109,110,111,114,115,116,117,126,130,752,764,784,808,823,901,1862,1880,1881,1884,1885,1887,1888,1890,1895,1896,1898,1900,1905,1997,1999,2001,\n2008,2180,2181,2182,2183,2190,2368,2369,2386,2387,2388,2401,2405,2406,2417,2426,2513,2516,2518,2519,2612,2613,2614,2616,2623,2624,2631,2665,2666,\n2667,2677,2678,2679,2680,2681,2686,2694,2695,2696,2709,2708,2709.2710,\n2743,2747,2751,2820,2850,2851,2891,2903,2905,2963,3020,3071,3131,3148,\n3149,3150,3151,3152,3153,3157,3263,3264,3267,3268,3271,3307,3366,3367,\n3368,3369,3371,3372,3373,3390 '}, {'nameNpa': 'СП 2.4.3648-20 «Санитарно – эпидемиологические требования к организациям воспитания и обучения, отдыха и оздоровления детей и молодежи» ', 'numberNpa': '28.09.2020', 'title': 'соблюдение требований п.1.1- п. 2.11.9.; п.3.11- п.3.11.11.'}, {'nameNpa': 'СанПиН 2.3./2.4.3590-20 «Санитарно – эпидемиологические требования к организации общественного питания населения»   ', 'numberNpa': '27.10.2020', 'title': 'соблюдение требований п.1.1. – п.5.2.; п.8.1.- п. 8.7.6., приложение 1-13 '}, {'nameNpa': 'ТР ТС 021/2011О безопасности пищевой продукции (ТР ТС 021/2011)     ', 'numberNpa': '12.09.2011', 'title': 'соблюдение требований ст. 1-5; ст. 7 ч.1-4, ч. 5 абзац 1; ст. 8; ст. 13 ч. 1, 2, 4; ст. 14-17; ст. 18 ч.1, 7, 8; ст. 21 ч.1; ст. 23 ч. 1, 2, 3; ст. 24 ч. 1,2; ст. 39\nприложения № 1-4, 6, 8, 9, 10  '}, {'nameNpa': 'ТР ТС 022/2011 «Пищевая продукция в части ее маркировки» ', 'numberNpa': '09.12.2011', 'title': 'соблюдение требований ст. 1-5, приложение 1-5  '}, {'nameNpa': 'ТР ТС 023/2011 Технический регламент на соковую продукцию из фруктов и овощей ', 'numberNpa': '12.09.2011', 'title': 'соблюдение требований ст. 3, 4, 5, 6, 7, 8  '}, {'nameNpa': 'ТР ТС 033/2013 О безопасности молока и молочной продукции', 'numberNpa': '09.10.2013', 'title': 'соблюдение требований п. 1-8, п. 30, 32-36, п. 47-59, 60, 62, 65-84, 86-96, 99, 100, 103, 105, 111-114 приложения № 1-4, 8-11, 13, 16 '}, {'nameNpa': 'ТР ТС 034/2013 «О безопасности мяса и мясной продукции» ', 'numberNpa': '09.10.2013', 'title': 'соблюдение требований п. 9; п. 10 ч. 1, п. 11-19; п. 59-60; п. 89-98; п. 101, 102, п. 106-126; п. 129, 132, 133, п. 147-149; приложения № 1-5'}, {'nameNpa': '\nТР ЕАЭС 040/2016 О безопасности рыбы и рыбной продукции ', 'numberNpa': '18.10.2016', 'title': 'соблюдение требований Разделы IV и V (за исключением пункта 14), VI, VII, VIII, IX, X, XI (за исключением пунктов 85, 86), XII'}, {'nameNpa': 'СанПиН 1.2.3685-21 «Гигиенические нормативы и требования к обеспечению безопасности и (или) безвредности для человека факторов среды обитания» : \n', 'numberNpa': '28.01.2021', 'title': 'соблюдение требований раздел V, раздел VI  '}, {'nameNpa': 'СП 3.1/2.4.3598-20 «Санитарно – эпидемиологические требования к устройству, содержанию и организации работы образовательных организаций и других объектов социальной инфраструктуры для детей и молодежи в условиях распространении новой \nкоронавирусной инфекции (COVID-19): \n', 'numberNpa': '30.06.2020', 'title': 'соблюдение требований п.1.1.- п.2.7., п.3.1. '}], 'resolved': False, 'resultEmpty': True, 'resultEmptyOrLate': False, 'resultInfoTypeCodes': [], 'resultViolationKnm': False, 'riskCategory': ['чрезвычайно высокий риск'], 'riskCategoryAndDangerClass': ['чрезвычайно высокий риск / Не применяется'], 'sezRegistryExists': False, 'signed': True, 'smevInfoType': None, 'smevMessageType': None, 'smevReceivedAt': None, 'smevReceivedAtEn': None, 'smevReceivedAtMonth': None, 'smevReceivedAtYear': None, 'spvRegistryExists': False, 'startDate': '02.06.2023', 'startDateEn': '2023-06-02', 'status': 'Исключена', 'statusEgrul': 'Найден', 'statusId': 15, 'stopDate': '16.06.2023', 'stopDateEn': '2023-06-16', 'subjectTypeId': 0, 'supervisionType': 'Федеральный государственный санитарно-эпидемиологический контроль (надзор)', 'supervisionTypeId': 4, 'torRegistryExists': False, 'updatePlanDate': None, 'updatePlanDateLong': None, 'version': 'ERKNM', 'violationLawsuitTypeCodes': [], 'violationTypeCodes': [], 'year': 2023}
2023-01-19 12:36:03,165 - [WARNING] - direct_sql.py - new_insert_in_database(269) - Проведена повторная попытка внесения с параметром special, результат неудачный.
2023-01-19 12:36:03,165 - [INFO] - direct_sql.py - database_inserts_conductor_for_multiprocessing(132) - Возникла ошибка, с которой не удалось справиться...
2023-01-19 12:36:03,165 - [INFO] - direct_sql.py - database_inserts_conductor_for_multiprocessing(133) - 
2023-01-19 12:36:03,175 - [ERROR] - direct_sql.py - new_insert_in_database(267) - (1040, 'ny connections')
2023-01-19 12:36:03,175 - [ERROR] - direct_sql.py - new_insert_in_database(267) - (1040, 'ny connections')
2023-01-19 12:36:03,175 - [ERROR] - direct_sql.py - new_insert_in_database(267) - (1040, 'ny connections')
2023-01-19 12:36:03,175 - [INFO] - direct_sql.py - new_insert_in_database(268) - {'actCreateDate': None, 'actCreateDateEn': None, 'addresses': ['153505, ОБЛАСТЬ ИВАНОВСКАЯ, Р-Н ИВАНОВСКИЙ, Д ВЫСОКОВО, Д. Д. П/О ОЗЕРНОЕ, '], 'admLevelId': 50001, 'appealed': False, 'approveDocOrderDate': None, 'approveDocOrderNum': None, 'approveDocRequestDate': None, 'approveDocRequestNum': None, 'approveDocs': [], 'approveRequired': False, 'approved': True, 'approvedErknm': 'Согласовано', 'chlistCount': 0, 'chlistFilledCount': 0, 'chlistFillingIndicationTypeId': [], 'collaboratingOrganizations': [], 'collaboratingOrganizationsIds': [], 'comment': None, 'controllingOrganization': 'Управление Роспотребнадзора по Ивановской области', 'controllingOrganizationId': 10001013491, 'createPlanDate': None, 'createPlanDateLong': None, 'createdByErpDb': False, 'createdById': 162935, 'dataNotEqualEGRUL': False, 'dataSetNotInTime': True, 'deleted': False, 'directDurationDays': None, 'disapprove': False, 'district': 'Ивановская область', 'districtId': 1030240000000001, 'durationDays': 10, 'durationHours': None, 'erknmActViolationIds': [], 'erknmResultKindDecisionIds': [], 'erpId': '37230041000103230973', 'events': [{'startDate': '15.05.2023', 'stopDate': '26.05.2023', 'title': 'Получение письменных объяснений'}, {'startDate': '15.05.2023', 'stopDate': '26.05.2023', 'title': 'Истребование документов'}, {'startDate': '15.05.2023', 'stopDate': '26.05.2023', 'title': 'Экспертиза'}], 'federalLaw': '248', 'federalLawId': 3, 'fullFieldViolationKnm': False, 'hasViolations': False, 'id': 13303090, 'inn': '3711003188', 'inspectorFullName': [], 'isFromSmev': False, 'isHasApproveDocs': False, 'isHasCollaboratingOrganization': False, 'isHasRequirements': True, 'isHasViolationTerm': False, 'isPm': False, 'kind': 'Документарная проверка', 'knmAnnulled': False, 'knmRejected': False, 'knmType': 'Плановое КНМ', 'knmTypeId': 4, 'legalBasisDocName': [], 'links': [], 'mspCategory': ['Среднее предприятие'], 'noPunishment': False, 'notifyLate': False, 'objectsKind': ['Деятельность по организации отдыха детей и их оздоровления, в том числе лагеря с дневным пребыванием'], 'objectsSubKind': ['Деятельность по организации отдыха детей и их оздоровления, в том числе лагеря с дневным пребыванием'], 'objectsType': ['Деятельность и действия'], 'ogrn': '1023701509919', 'oldKnm': None, 'oldPlan': None, 'orderDone': False, 'organizationName': 'ОБЩЕСТВО С ОГРАНИЧЕННОЙ ОТВЕТСТВЕННОСТЬЮ ДЕТСКИЙ САНАТОРНЫЙ ОЗДОРОВИТЕЛЬНЫЙ ЛАГЕРЬ КРУГЛОГОДИЧНОГО ДЕЙСТВИЯ БЕРЕЗОВАЯ РОЩА', 'organizationsInn': ['3711003188'], 'organizationsName': ['ОБЩЕСТВО С ОГРАНИЧЕННОЙ ОТВЕТСТВЕННОСТЬЮ ДЕТСКИЙ САНАТОРНЫЙ ОЗДОРОВИТЕЛЬНЫЙ ЛАГЕРЬ КРУГЛОГОДИЧНОГО ДЕЙСТВИЯ БЕРЕЗОВАЯ РОЩА'], 'organizationsOgrn': ['1023701509919'], 'planId': '2023050673', 'prosecutorOrganization': 'Прокуратура Ивановской области', 'prosecutorOrganizationId': 130, 'publishedStatus': 'PUBLISHED', 'reasons': [201], 'reasonsList': [{'assignmentDate': None, 'assignmentDateEn': None, 'assignmentNumber': None, 'date': '03.06.2022', 'dateEn': '2022-06-03', 'requirementDetails': None, 'text': '(ФЗ 248) Истечение установленного федеральным законом о виде контроля, положением о виде контроля период времени с даты окончания проведения последнего планового контрольного (надзорного) мероприятия'}], 'recEmptyOrLate': False, 'regDateEgrul': '01.09.2022', 'regDateEgrulEn': '2022-09-01', 'regLate': False, 'regTypes': ['MSP'], 'requirements': 9, 'requirementsList': [{'nameNpa': 'None', 'numberNpa': 'None', 'title': 'None'}, {'nameNpa': 'None', 'numberNpa': 'None', 'title': 'None'}, {'nameNpa': 'None', 'numberNpa': 'None', 'title': 'None'}, {'nameNpa': 'None', 'numberNpa': 'None', 'title': 'None'}, {'nameNpa': 'None', 'numberNpa': 'None', 'title': 'None'}, {'nameNpa': 'None', 'numberNpa': 'None', 'title': 'None'}, {'nameNpa': 'None', 'numberNpa': 'None', 'title': 'None'}, {'nameNpa': 'None', 'numberNpa': 'None', 'title': 'None'}, {'nameNpa': 'None', 'numberNpa': 'None', 'title': 'None'}], 'resolved': False, 'resultEmpty': True, 'resultEmptyOrLate': False, 'resultInfoTypeCodes': [], 'resultViolationKnm': False, 'riskCategory': ['чрезвычайно высокий риск'], 'riskCategoryAndDangerClass': ['чрезвычайно высокий риск'], 'sezRegistryExists': False, 'signed': True, 'smevInfoType': None, 'smevMessageType': None, 'smevReceivedAt': None, 'smevReceivedAtEn': None, 'smevReceivedAtMonth': None, 'smevReceivedAtYear': None, 'spvRegistryExists': False, 'startDate': '15.05.2023', 'startDateEn': '2023-05-15', 'status': 'Ожидает проведения', 'statusEgrul': 'Найден', 'statusId': 5, 'stopDate': None, 'stopDateEn': None, 'subjectTypeId': 0, 'supervisionType': 'Федеральный государственный санитарно-эпидемиологический контроль (надзор)', 'supervisionTypeId': 4, 'torRegistryExists': False, 'updatePlanDate': None, 'updatePlanDateLong': None, 'version': 'ERKNM', 'violationLawsuitTypeCodes': [], 'violationTypeCodes': [], 'year': 2023}
one', 'numberNpa': 'None', 'title': 'None'}, {'nameNpa': 'None', 'numberNpa': 'None', 'title': 'None'}, {'nameNpa': 'None', 'numberNpa': 'None', 'title': 'None'}, {'nameNpa': 'None', 'numberNpa': 'None', 'title': 'None'}, {'nameNpa': 'None', 'numberNpa': 'None', 'title': 'None'}, {'nameNpa': 'None', 'numberNpa': 'None', 'title': 'None'}, {'nameNpa': 'None', 'numberNpa': 'None', 'title': 'None'}], 'resolved': False, 'resultEmpty': True, 'resultEmptyOrLate': False, 'resultInfoTypeCodes': [], 'resultViolationKnm': False, 'riskCategory': ['чрезвычайно высокий риск'], 'riskCategoryAndDangerClass': ['чрезвычайно высокий риск'], 'sezRegistryExists': False, 'signed': True, 'smevInfoType': None, 'smevMessageType': None, 'smevReceivedAt': None, 'smevReceivedAtEn': None, 'smevReceivedAtMonth': None, 'smevReceivedAtYear': None, 'spvRegistryExists': False, 'startDate': '25.05.2023', 'startDateEn': '2023-05-25', 'status': 'Исключена', 'statusEgrul': 'Найден', 'statusId': 15, 'stopDate': None, 'stopDateEn': None, 'subjectTypeId': 0, 'supervisionType': 'Федеральный государственный санитарно-эпидемиологический контроль (надзор)', 'supervisionTypeId': 4, 'torRegistryExists': False, 'updatePlanDate': None, 'updatePlanDateLong': None, 'version': 'ERKNM', 'violationLawsuitTypeCodes': [], 'violationTypeCodes': [], 'year': 2023}
2023-01-19 12:36:03,176 - [WARNING] - direct_sql.py - new_insert_in_database(269) - Проведена повторная попытка внесения с параметром special, результат неудачный.
2023-01-19 12:36:03,176 - [INFO] - direct_sql.py - new_insert_in_database(268) - {'actCreateDate': None, 'actCreateDateEn': None, 'addresses': ['671943, РЕСПУБЛИКА, БУРЯТИЯ, РАЙОН, ЗАКАМЕНСКИЙ, СЕЛО ЦАКИР, УЛИЦА, ПОГРАНИЧНАЯ, 80 (лагерь с дневным пребыванием)', '671943, РЕСПУБЛИКА, БУРЯТИЯ, РАЙОН, ЗАКАМЕНСКИЙ, СЕЛО ЦАКИР, УЛИЦА, ПОГРАНИЧНАЯ, 80 (лагерь труда и отдыха)'], 'admLevelId': 50001, 'appealed': False, 'approveDocOrderDate': None, 'approveDocOrderNum': None, 'approveDocRequestDate': None, 'approveDocRequestNum': None, 'approveDocs': [], 'approveRequired': False, 'approved': False, 'approvedErknm': 'Отказано', 'chlistCount': 0, 'chlistFilledCount': 0, 'chlistFillingIndicationTypeId': [], 'collaboratingOrganizations': [], 'collaboratingOrganizationsIds': [], 'comment': 'пункты 11 (3), 11 (4) Постановления Правительства Российской Федерации от 10.03.2022 № 336', 'controllingOrganization': 'Управление Роспотребнадзора по Республике Бурятия', 'controllingOrganizationId': 10001012187, 'createPlanDate': None, 'createPlanDateLong': None, 'createdByErpDb': False, 'createdById': 203596, 'dataNotEqualEGRUL': False, 'dataSetNotInTime': False, 'deleted': False, 'directDurationDays': None, 'disapprove': False, 'district': 'Республика Бурятия', 'districtId': 1036810000000001, 'durationDays': 10, 'durationHours': None, 'erknmActViolationIds': [], 'erknmResultKindDecisionIds': [], 'erpId': '03230041000103428741', 'events': [{'startDate': '04.05.2023', 'stopDate': '19.05.2023', 'title': 'Получение письменных объяснений'}, {'startDate': '04.05.2023', 'stopDate': '19.05.2023', 'title': 'Истребование документов'}], 'federalLaw': '248', 'federalLawId': 3, 'fullFieldViolationKnm': False, 'hasViolations': False, 'id': 13500858, 'inn': '0307008680', 'inspectorFullName': [], 'isFromSmev': False, 'isHasApproveDocs': False, 'isHasCollaboratingOrganization': False, 'isHasRequirements': True, 'isHasViolationTerm': False, 'isPm': False, 'kind': 'Документарная проверка', 'knmAnnulled': False, 'knmRejected': False, 'knmType': 'Плановое КНМ', 'knmTypeId': 4, 'legalBasisDocName': [], 'links': [], 'mspCategory': ['Не является субъектом МСП'], 'noPunishment': False, 'notifyLate': False, 'objectsKind': ['Деятельность по организации отдыха детей и их оздоровления, в том числе лагеря с дневным пребыванием', 'Деятельность по организации отдыха детей и их оздоровления, в том числе лагеря с дневным пребыванием'], 'objectsSubKind': ['Деятельность по организации отдыха детей и их оздоровления, в том числе лагеря с дневным пребыванием', 'Деятельность по организации отдыха детей и их оздоровления, в том числе лагеря с дневным пребыванием'], 'objectsType': ['Деятельность и действия', 'Деятельность и действия'], 'ogrn': '1020300632571', 'oldKnm': None, 'oldPlan': None, 'orderDone': False, 'organizationName': 'МУНИЦИПАЛЬНОЕ АВТОНОМНОЕ ОБЩЕОБРАЗОВАТЕЛЬНОЕ УЧРЕЖДЕНИЕ ЦАКИРСКАЯ СРЕДНЯЯ ОБЩЕОБРАЗОВАТЕЛЬНАЯ ШКОЛА', 'organizationsInn': ['0307008680'], 'organizationsName': ['МУНИЦИПАЛЬНОЕ АВТОНОМНОЕ ОБЩЕОБРАЗОВАТЕЛЬНОЕ УЧРЕЖДЕНИЕ ЦАКИРСКАЯ СРЕДНЯЯ ОБЩЕОБРАЗОВАТЕЛЬНАЯ ШКОЛА'], 'organizationsOgrn': ['1020300632571'], 'planId': '2023058837', 'prosecutorOrganization': 'Прокуратура Республики Бурятия', 'prosecutorOrganizationId': 2511, 'publishedStatus': 'UNPUBLISHED', 'reasons': [204], 'reasonsList': [{'assignmentDate': None, 'assignmentDateEn': None, 'assignmentNumber': None, 'date': '28.06.2022', 'dateEn': '2022-06-28', 'requirementDetails': None, 'text': '(ФЗ 248) Истечение установленного федеральным законом о виде контроля, положением о виде контроля периода времени с даты иного события, установленного федеральным законом о виде контроля, положением о виде контроля, которое ведет к возникновению объекта контроля'}], 'recEmptyOrLate': False, 'regDateEgrul': '15.09.2022', 'regDateEgrulEn': '2022-09-15', 'regLate': False, 'regTypes': [], 'requirements': 17, 'requirementsList': [{'nameNpa': 'None', 'numberNpa': 'None', 'title': 'None'}, {'nameNpa': 'None', 'numberNpa': 'None', 'title': 'None'}, {'nameNpa': 'None', 'numberNpa': 'None', 'title': 'None'}, {'nameNpa': 'None', 'numberNpa': 'None', 'title': 'None'}, {'nameNpa': 'None', 'numberNpa': 'None', 'title': 'None'}, {'nameNpa': 'None', 'numberNpa': 'None', 'title': 'None'}, {'nameNpa': 'None', 'numberNpa': 'None', 'title': 'None'}, {'nameNpa': 'None', 'numberNpa': 'None', 'title': 'None'}, {'nameNpa': 'None', 'numberNpa': 'None', 'title': 'None'}, {'nameNpa': 'None', 'numberNpa': 'None', 'title': 'None'}, {'nameNpa': 'None', 'numberNpa': 'None', 'title': 'None'}, {'nameNpa': 'None', 'numberNpa': 'None', 'title': 'None'}, {'nameNpa': 'None', 'numberNpa': 'None', 'title': 'None'}, {'nameNpa': 'None', 'numberNpa': 'None', 'title': 'None'}, {'nameNpa': 'None', 'numberNpa': 'None', 'title': 'None'}, {'nameNpa': 'None', 'numberNpa': 'None', 'title': 'None'}, {'nameNpa': 'None', 'numberNpa': 'None', 'title': 'None'}], 'resolved': False, 'resultEmpty': True, 'resultEmptyOrLate': False, 'resultInfoTypeCodes': [], 'resultViolationKnm': False, 'riskCategory': ['чрезвычайно высокий риск', 'чрезвычайно высокий риск'], 'riskCategoryAndDangerClass': ['чрезвычайно высокий риск', 'чрезвычайно высокий риск'], 'sezRegistryExists': False, 'signed': True, 'smevInfoType': None, 'smevMessageType': None, 'smevReceivedAt': None, 'smevReceivedAtEn': None, 'smevReceivedAtMonth': None, 'smevReceivedAtYear': None, 'spvRegistryExists': False, 'startDate': '04.05.2023', 'startDateEn': '2023-05-04', 'status': 'Исключена', 'statusEgrul': 'В процессе поиска', 'statusId': 15, 'stopDate': '19.05.2023', 'stopDateEn': '2023-05-19', 'subjectTypeId': 0, 'supervisionType': 'Федеральный государственный санитарно-эпидемиологический контроль (надзор)', 'supervisionTypeId': 4, 'torRegistryExists': False, 'updatePlanDate': None, 'updatePlanDateLong': None, 'version': 'ERKNM', 'violationLawsuitTypeCodes': [], 'violationTypeCodes': [], 'year': 2023}
2023-01-19 12:36:03,176 - [WARNING] - direct_sql.py - new_insert_in_database(269) - Проведена повторная попытка внесения с параметром special, результат неудачный.
2023-01-19 12:36:03,176 - [WARNING] - direct_sql.py - new_insert_in_database(269) - Проведена повторная попытка внесения с параметром special, результат неудачный.
2023-01-19 12:36:03,176 - [INFO] - direct_sql.py - database_inserts_conductor_for_multiprocessing(133) - 
2023-01-19 12:36:03,176 - [INFO] - direct_sql.py - database_inserts_conductor_for_multiprocessing(132) - Возникла ошибка, с которой не удалось справиться...
2023-01-19 12:36:03,176 - [INFO] - direct_sql.py - database_inserts_conductor_for_multiprocessing(132) - Возникла ошибка, с которой не удалось справиться...
2023-01-19 12:36:03,176 - [INFO] - direct_sql.py - database_inserts_conductor_for_multiprocessing(133) - 
2023-01-19 12:36:03,176 - [INFO] - direct_sql.py - database_inserts_conductor_for_multiprocessing(133) - 
2023-01-19 12:36:03,177 - [ERROR] - direct_sql.py - new_insert_in_database(267) - (1040, 'ny connections')
2023-01-19 12:36:03,178 - [INFO] - direct_sql.py - new_insert_in_database(268) - {'actCreateDate': None, 'actCreateDateEn': None, 'addresses': ['155035, ОБЛАСТЬ ИВАНОВСКАЯ, РАЙОН ТЕЙКОВСКИЙ, СЕЛО МОРОЗОВО, УЛИЦА МОЛОДЕЖНАЯ, 1-А, '], 'admLevelId': 50001, 'appealed': False, 'approveDocOrderDate': None, 'approveDocOrderNum': None, 'approveDocRequestDate': None, 'approveDocRequestNum': None, 'approveDocs': [], 'approveRequired': False, 'approved': False, 'approvedErknm': 'Отказано', 'chlistCount': 0, 'chlistFilledCount': 0, 'chlistFillingIndicationTypeId': [], 'collaboratingOrganizations': [], 'collaboratingOrganizationsIds': [], 'comment': 'п. 11 (4) Постановления Правительства РФ от 10.03.2022 № 336', 'controllingOrganization': 'Управление Роспотребнадзора по Ивановской области', 'controllingOrganizationId': 10001013491, 'createPlanDate': None, 'createPlanDateLong': None, 'createdByErpDb': False, 'createdById': 160995, 'dataNotEqualEGRUL': False, 'dataSetNotInTime': False, 'deleted': False, 'directDurationDays': None, 'disapprove': False, 'district': 'Ивановская область', 'districtId': 1030240000000001, 'durationDays': 10, 'durationHours': None, 'erknmActViolationIds': [], 'erknmResultKindDecisionIds': [], 'erpId': '37230041000102887621', 'events': [{'startDate': '12.05.2023', 'stopDate': '25.05.2023', 'title': 'Получение письменных объяснений'}, {'startDate': '12.05.2023', 'stopDate': '25.05.2023', 'title': 'Истребование документов'}], 'federalLaw': '248', 'federalLawId': 3, 'fullFieldViolationKnm': False, 'hasViolations': False, 'id': 12959738, 'inn': '3724003467', 'inspectorFullName': [], 'isFromSmev': False, 'isHasApproveDocs': False, 'isHasCollaboratingOrganization': False, 'isHasRequirements': True, 'isHasViolationTerm': False, 'isPm': False, 'kind': 'Документарная проверка', 'knmAnnulled': False, 'knmRejected': False, 'knmType': 'Плановое КНМ', 'knmTypeId': 4, 'legalBasisDocName': [], 'links': [], 'mspCategory': ['Не является субъектом МСП'], 'noPunishment': False, 'notifyLate': False, 'objectsKind': ['Деятельность по организации отдыха детей и их оздоровления, в том числе лагеря с дневным пребыванием'], 'objectsSubKind': ['Деятельность по организации отдыха детей и их оздоровления, в том числе лагеря с дневным пребыванием'], 'objectsType': ['Деятельность и действия'], 'ogrn': '1023701790420', 'oldKnm': None, 'oldPlan': None, 'orderDone': False, 'organizationName': 'МУНИЦИПАЛЬНОЕ КАЗЕННОЕ ОБЩЕОБРАЗОВАТЕЛЬНОЕ УЧРЕЖДЕНИЕ ТЕЙКОВСКОГО МУНИЦИПАЛЬНОГО РАЙОНА МОРОЗОВСКАЯ СРЕДНЯЯ ОБЩЕОБРАЗОВАТЕЛЬНАЯ ШКОЛА', 'organizationsInn': ['3724003467'], 'organizationsName': ['МУНИЦИПАЛЬНОЕ КАЗЕННОЕ ОБЩЕОБРАЗОВАТЕЛЬНОЕ УЧРЕЖДЕНИЕ ТЕЙКОВСКОГО МУНИЦИПАЛЬНОГО РАЙОНА МОРОЗОВСКАЯ СРЕДНЯЯ ОБЩЕОБРАЗОВАТЕЛЬНАЯ ШКОЛА'], 'organizationsOgrn': ['1023701790420'], 'planId': '2023050673', 'prosecutorOrganization': 'Прокуратура Ивановской области', 'prosecutorOrganizationId': 130, 'publishedStatus': 'UNPUBLISHED', 'reasons': [201], 'reasonsList': [{'assignmentDate': None, 'assignmentDateEn': None, 'assignmentNumber': None, 'date': '11.06.2019', 'dateEn': '2019-06-11', 'requirementDetails': None, 'text': '(ФЗ 248) Истечение установленного федеральным законом о виде контроля, положением о виде контроля период времени с даты окончания проведения последнего планового контрольного (надзорного) мероприятия'}], 'recEmptyOrLate': False, 'regDateEgrul': '16.08.2022', 'regDateEgrulEn': '2022-08-16', 'regLate': False, 'regTypes': [], 'requirements': 8, 'requirementsList': [{'nameNpa': 'Федеральный закон № 52-ФЗ от 30.03.1999 «О санитарно-эпидемиологическом благополучии населения» (ст.12, ст.13, ст.14, ст.15, ст.16, ст.17, ст.18, ст.19, ст.20, ст.21, ст.22, ст.23, ст.24, ст.25, ст.26, ст.27, ст.28, ст.29, ст.30, ст.31, ст.32, ст.33, ст.34, ст.36, ст.40, ст.41, ст.43, п.4 ст.44.1)', 'numberNpa': '30.03.1999', 'title': 'требования санитарного законодательства'}, {'nameNpa': 'Приказ Министерства здравоохранения Российской Федерации № 29н Об утверждении Порядка проведения обязательных предварительных и периодических медицинских осмотров работников, предусмотренных частью четвертой статьи 213 Трудового кодекса Российской Федерации, перечня медицинских противопоказаний к осуществлению работ с вредными и (или) опасными производственными факторами, а также работам, при выполнении которых проводятся обязательные предварительные и периодические медицинские осмотры (п. 4.1 приложения к Порядку проведения обязательных предварительных и периодических медицинских осмотров работников, предусмотренных частью четвертой статьи 213 Трудового кодекса Российской Федерации) ', 'numberNpa': '28.01.2021', 'title': 'требования санитарного законодательства'}, {'nameNpa': 'СП 2.4.3648-20 «Санитарно-эпидемиологические требования к организациям воспитания и обучения, отдыха и оздоровления детей и молодежи» (весь документ) ', 'numberNpa': '28.09.2020', 'title': 'требования санитарного законодательства'}, {'nameNpa': 'СанПиН 2.3/2.4.3590-20 «Санитарно-эпидемиологические требования к организации общественного питания населения» (весь документ) ', 'numberNpa': '27.10.2020', 'title': 'требования санитарного законодательства'}, {'nameNpa': 'СП 3.1./2.4.3598-20 «Санитарно-эпидемиологические требования к устройству, содержанию и организации работы образовательных организаций и других объектов социальной инфраструктуры для детей и молодежи в условиях распространения новой коронавирусной инфекции (COVID-19)» (весь документ) ', 'numberNpa': '30.06.2020', 'title': 'требования санитарного законодательства'}, {'nameNpa': 'СанПиН 1.2.3685-21 «Гигиенические нормативы и требования к обеспечению безопасности и (или) безвредности для человека факторов среды обитания» (весь документ) ', 'numberNpa': '28.01.2021', 'title': 'требования санитарного законодательства'}, {'nameNpa': 'СанПиН 2.1.3684-21 «Санитарно-эпидемиологические требования к содержанию территорий городских и сельских поселений, к водным объектам, питьевой воде и питьевому водоснабжению, атмосферному воздуху, почвам, жилым помещениям, эксплуатации производственных, общественных помещений, организации и проведению санитарно-противоэпидемиологических (профилактических) мероприятий» (весь документ) ', 'numberNpa': '28.01.2021', 'title': 'требования санитарного законодательства'}, {'nameNpa': 'СанПиН 3.3686-21 Санитарно-эпидемиологические требования по профилактике инфекционных болезней (весь документ) ', 'numberNpa': '28.01.2021', 'title': 'требования санитарного законодательства'}], 'resolved': False, 'resultEmpty': True, 'resultEmptyOrLate': False, 'resultInfoTypeCodes': [], 'resultViolationKnm': False, 'riskCategory': ['чрезвычайно высокий риск'], 'riskCategoryAndDangerClass': ['чрезвычайно высокий риск'], 'sezRegistryExists': False, 'signed': True, 'smevInfoType': None, 'smevMessageType': None, 'smevReceivedAt': None, 'smevReceivedAtEn': None, 'smevReceivedAtMonth': None, 'smevReceivedAtYear': None, 'spvRegistryExists': False, 'startDate': '12.05.2023', 'startDateEn': '2023-05-12', 'status': 'Исключена', 'statusEgrul': 'Найден', 'statusId': 15, 'stopDate': '25.05.2023', 'stopDateEn': '2023-05-25', 'subjectTypeId': 0, 'supervisionType': 'Федеральный государственный санитарно-эпидемиологический контроль (надзор)', 'supervisionTypeId': 4, 'torRegistryExists': False, 'updatePlanDate': None, 'updatePlanDateLong': None, 'version': 'ERKNM', 'violationLawsuitTypeCodes': [], 'violationTypeCodes': [], 'year': 2023}
2023-01-19 12:36:03,179 - [WARNING] - direct_sql.py - new_insert_in_database(269) - Проведена повторная попытка внесения с параметром special, результат неудачный.
2023-01-19 12:36:03,179 - [INFO] - direct_sql.py - database_inserts_conductor_for_multiprocessing(132) - Возникла ошибка, с которой не удалось справиться...
2023-01-19 12:36:03,179 - [INFO] - direct_sql.py - database_inserts_conductor_for_multiprocessing(133) - 
2023-01-19 12:42:10,834 - [ERROR] - direct_sql.py - new_insert_in_database(267) - (1040, 'ny connections')
2023-01-19 12:42:10,834 - [INFO] - direct_sql.py - new_insert_in_database(268) - {'actCreateDate': None, 'actCreateDateEn': None, 'addresses': ['354008, КРАЙ КРАСНОДАРСКИЙ, ГОРОД СОЧИ, УЛИЦА ВИНОГРАДНАЯ (ЦЕНТРАЛЬНЫЙ Р-Н), 158, '], 'admLevelId': 50001, 'appealed': False, 'approveDocOrderDate': None, 'approveDocOrderNum': None, 'approveDocRequestDate': None, 'approveDocRequestNum': None, 'approveDocs': [], 'approveRequired': False, 'approved': True, 'approvedErknm': 'Согласовано', 'chlistCount': 1, 'chlistFilledCount': 1, 'chlistFillingIndicationTypeId': [], 'collaboratingOrganizations': [], 'collaboratingOrganizationsIds': [], 'comment': None, 'controllingOrganization': 'Управление Роспотребнадзора по Краснодарскому краю', 'controllingOrganizationId': 10001016832, 'createPlanDate': None, 'createPlanDateLong': None, 'createdByErpDb': False, 'createdById': 175544, 'dataNotEqualEGRUL': False, 'dataSetNotInTime': True, 'deleted': False, 'directDurationDays': None, 'disapprove': False, 'district': 'Краснодарский край', 'districtId': 1040030000000001, 'durationDays': 10, 'durationHours': 50, 'erknmActViolationIds': [], 'erknmResultKindDecisionIds': [], 'erpId': '23230041000103735949', 'events': [{'startDate': '01.09.2023', 'stopDate': '14.09.2023', 'title': 'Осмотр'}, {'startDate': '01.09.2023', 'stopDate': '14.09.2023', 'title': 'Получение письменных объяснений'}, {'startDate': '01.09.2023', 'stopDate': '14.09.2023', 'title': 'Истребование документов'}, {'startDate': '01.09.2023', 'stopDate': '14.09.2023', 'title': 'Отбор проб (образцов)'}, {'startDate': '01.09.2023', 'stopDate': '14.09.2023', 'title': 'Испытание'}, {'startDate': '01.09.2023', 'stopDate': '14.09.2023', 'title': 'Экспертиза'}], 'federalLaw': '248', 'federalLawId': 3, 'fullFieldViolationKnm': False, 'hasViolations': False, 'id': 13808066, 'inn': '2320137390', 'inspectorFullName': [], 'isFromSmev': False, 'isHasApproveDocs': False, 'isHasCollaboratingOrganization': False, 'isHasRequirements': True, 'isHasViolationTerm': False, 'isPm': False, 'kind': 'Выездная проверка', 'knmAnnulled': False, 'knmRejected': False, 'knmType': 'Плановое КНМ', 'knmTypeId': 4, 'legalBasisDocName': [], 'links': [], 'mspCategory': ['Малое предприятие'], 'noPunishment': False, 'notifyLate': False, 'objectsKind': ['Деятельность, действия (бездействие) контролируемых лиц, в рамках которых должны соблюдаться обязательные требования, в том числе предъявляемые к контролируемым лицам, осуществляющим деятельность, действия (бездействие)'], 'objectsSubKind': ['Деятельность, действия (бездействие) контролируемых лиц, в рамках которых должны соблюдаться обязательные требования, в том числе предъявляемые к контролируемым лицам, осуществляющим деятельность, действия (бездействие)'], 'objectsType': ['Деятельность и действия'], 'ogrn': '1062320009476', 'oldKnm': None, 'oldPlan': None, 'orderDone': False, 'organizationName': 'ОБЩЕСТВО С ОГРАНИЧЕННОЙ ОТВЕТСТВЕННОСТЬЮ ВОСТОК', 'organizationsInn': ['2320137390'], 'organizationsName': ['ОБЩЕСТВО С ОГРАНИЧЕННОЙ ОТВЕТСТВЕННОСТЬЮ ВОСТОК'], 'organizationsOgrn': ['1062320009476'], 'planId': '2023050889', 'prosecutorOrganization': 'Прокуратура Краснодарского края', 'prosecutorOrganizationId': 922, 'publishedStatus': 'PUBLISHED', 'reasons': [202], 'reasonsList': [{'assignmentDate': None, 'assignmentDateEn': None, 'assignmentNumber': None, 'date': '09.03.2006', 'dateEn': '2006-03-09', 'requirementDetails': None, 'text': '(ФЗ 248) Истечение установленного федеральным законом о виде контроля, положением о виде контроля периода времени с даты государственной регистрации организации или гражданина в качестве индивидуального предпринимателя'}], 'recEmptyOrLate': False, 'regDateEgrul': '29.09.2022', 'regDateEgrulEn': '2022-09-29', 'regLate': False, 'regTypes': ['MSP'], 'requirements': 7, 'requirementsList': [{'nameNpa': 'None', 'numberNpa': 'None', 'title': 'None'}, {'nameNpa': 'None', 'numberNpa': 'None', 'title': 'None'}, {'nameNpa': 'None', 'numberNpa': 'None', 'title': 'None'}, {'nameNpa': 'None', 'numberNpa': 'None', 'title': 'None'}, {'nameNpa': 'None', 'numberNpa': 'None', 'title': 'None'}, {'nameNpa': 'None', 'numberNpa': 'None', 'title': 'None'}, {'nameNpa': 'None', 'numberNpa': 'None', 'title': 'None'}], 'resolved': False, 'resultEmpty': True, 'resultEmptyOrLate': False, 'resultInfoTypeCodes': [], 'resultViolationKnm': False, 'riskCategory': ['высокий риск'], 'riskCategoryAndDangerClass': ['высокий риск / Второй'], 'sezRegistryExists': False, 'signed': True, 'smevInfoType': None, 'smevMessageType': None, 'smevReceivedAt': None, 'smevReceivedAtEn': None, 'smevReceivedAtMonth': None, 'smevReceivedAtYear': None, 'spvRegistryExists': False, 'startDate': '01.09.2023', 'startDateEn': '2023-09-01', 'status': 'Ожидает проведения', 'statusEgrul': 'Найден', 'statusId': 5, 'stopDate': '14.09.2023', 'stopDateEn': '2023-09-14', 'subjectTypeId': 0, 'supervisionType': 'Федеральный государственный санитарно-эпидемиологический контроль (надзор)', 'supervisionTypeId': 4, 'torRegistryExists': False, 'updatePlanDate': None, 'updatePlanDateLong': None, 'version': 'ERKNM', 'violationLawsuitTypeCodes': [], 'violationTypeCodes': [], 'year': 2023}
2023-01-19 12:42:10,836 - [WARNING] - direct_sql.py - new_insert_in_database(269) - Проведена повторная попытка внесения с параметром special, результат неудачный.
2023-01-19 12:42:10,836 - [INFO] - direct_sql.py - database_inserts_conductor_for_multiprocessing(132) - Возникла ошибка, с которой не удалось справиться...
2023-01-19 12:42:10,836 - [INFO] - direct_sql.py - database_inserts_conductor_for_multiprocessing(133) - 
2023-01-19 12:42:10,842 - [ERROR] - direct_sql.py - new_insert_in_database(267) - (1040, 'ny connections')
2023-01-19 12:42:10,842 - [ERROR] - direct_sql.py - new_insert_in_database(267) - (1040, 'ny connections')
2023-01-19 12:42:10,843 - [INFO] - direct_sql.py - new_insert_in_database(268) - {'actCreateDate': None, 'actCreateDateEn': None, 'addresses': ['685911, ОБЛАСТЬ, МАГАДАНСКАЯ, РАЙОН, ОЛЬСКИЙ, УЛИЦА, НАБЕРЕЖНАЯ, 4, 490020000050003'], 'admLevelId': 50001, 'appealed': False, 'approveDocOrderDate': None, 'approveDocOrderNum': None, 'approveDocRequestDate': None, 'approveDocRequestNum': None, 'approveDocs': [], 'approveRequired': False, 'approved': False, 'approvedErknm': 'Отказано', 'chlistCount': 2, 'chlistFilledCount': 2, 'chlistFillingIndicationTypeId': [], 'collaboratingOrganizations': [], 'collaboratingOrganizationsIds': [], 'comment': 'В соответствии с п. 11(4) постановления Правительства РФ от 10.03.2022 №336 плановые КНМ в отношении государственных и муниципальных учреждений дошкольного и начального общего образования, основного общего и среднего общего образования, объекты контроля которых отнесены к категории чрезвычайно высокого и высокого рисков не проводятся', 'controllingOrganization': 'Управление Роспотребнадзора по Магаданской области', 'controllingOrganizationId': 10001024121, 'createPlanDate': None, 'createPlanDateLong': None, 'createdByErpDb': False, 'createdById': 190968, 'dataNotEqualEGRUL': False, 'dataSetNotInTime': False, 'deleted': False, 'directDurationDays': None, 'disapprove': False, 'district': 'Магаданская область', 'districtId': 1036440000000001, 'durationDays': 10, 'durationHours': 80, 'erknmActViolationIds': [], 'erknmResultKindDecisionIds': [], 'erpId': '49230041000103229716', 'events': [{'startDate': '05.07.2023', 'stopDate': '18.07.2023', 'title': 'Осмотр'}, {'startDate': '05.07.2023', 'stopDate': '18.07.2023', 'title': 'Досмотр'}, {'startDate': '05.07.2023', 'stopDate': '18.07.2023', 'title': 'Опрос'}, {'startDate': '05.07.2023', 'stopDate': '18.07.2023', 'title': 'Получение письменных объяснений'}, {'startDate': '05.07.2023', 'stopDate': '18.07.2023', 'title': 'Истребование документов'}, {'startDate': '05.07.2023', 'stopDate': '18.07.2023', 'title': 'Отбор проб (образцов)'}, {'startDate': '05.07.2023', 'stopDate': '18.07.2023', 'title': 'Инструментальное обследование'}, {'startDate': '05.07.2023', 'stopDate': '18.07.2023', 'title': 'Испытание'}, {'startDate': '05.07.2023', 'stopDate': '18.07.2023', 'title': 'Экспертиза'}], 'federalLaw': '248', 'federalLawId': 3, 'fullFieldViolationKnm': False, 'hasViolations': False, 'id': 13301833, 'inn': '4901005675', 'inspectorFullName': [], 'isFromSmev': False, 'isHasApproveDocs': False, 'isHasCollaboratingOrganization': False, 'isHasRequirements': True, 'isHasViolationTerm': False, 'isPm': False, 'kind': 'Выездная проверка', 'knmAnnulled': False, 'knmRejected': False, 'knmType': 'Плановое КНМ', 'knmTypeId': 4, 'legalBasisDocName': [], 'links': [], 'mspCategory': ['Не является субъектом МСП'], 'noPunishment': False, 'notifyLate': False, 'objectsKind': ['Деятельность по организации отдыха детей и их оздоровления, в том числе лагеря с дневным пребыванием'], 'objectsSubKind': ['Деятельность по организации отдыха детей и их оздоровления, в том числе лагеря с дневным пребыванием'], 'objectsType': ['Деятельность и действия'], 'ogrn': '1034900245247', 'oldKnm': None, 'oldPlan': None, 'orderDone': False, 'organizationName': 'МУНИЦИПАЛЬНОЕ КАЗЁННОЕ ОБЩЕОБРАЗОВАТЕЛЬНОЕ УЧРЕЖДЕНИЕ НАЧАЛЬНАЯ ШКОЛА - ДЕТСКИЙ САД С. ГАДЛЯ', 'organizationsInn': ['4901005675'], 'organizationsName': ['МУНИЦИПАЛЬНОЕ КАЗЁННОЕ ОБЩЕОБРАЗОВАТЕЛЬНОЕ УЧРЕЖДЕНИЕ НАЧАЛЬНАЯ ШКОЛА - ДЕТСКИЙ САД С. ГАДЛЯ'], 'organizationsOgrn': ['1034900245247'], 'planId': '2023050302', 'prosecutorOrganization': 'Прокуратура Магаданской области', 'prosecutorOrganizationId': 2693, 'publishedStatus': 'UNPUBLISHED', 'reasons': [201], 'reasonsList': [{'assignmentDate': None, 'assignmentDateEn': None, 'assignmentNumber': None, 'date': '24.06.2022', 'dateEn': '2022-06-24', 'requirementDetails': None, 'text': '(ФЗ 248) Истечение установленного федеральным законом о виде контроля, положением о виде контроля период времени с даты окончания проведения последнего планового контрольного (надзорного) мероприятия'}], 'recEmptyOrLate': False, 'regDateEgrul': '01.09.2022', 'regDateEgrulEn': '2022-09-01', 'regLate': False, 'regTypes': [], 'requirements': 25, 'requirementsList': [{'nameNpa': '«О санитарно-эпидемиологическом благополучии населения»', 'numberNpa': '30.03.1999', 'title': 'Федеральный закон № 52-ФЗ (ст.12, ст.13, ст.14, ст.15, ст.16, ст.17, ст.18, ст.19, ст.20, ст.21, ст.22, ст.23, ст.24, ст.25, ст.26, ст.27, ст.28, ст.29, ст.30, ст.31, ст.32, ст.33, ст.34, ст.36, ст.40, ст.41, ст.43, п.4 ст.44.1)'}, {'nameNpa': ' «О качестве и безопасности пищевых продуктов»', 'numberNpa': '02.01.2000', 'title': 'Федеральный закон № 29-ФЗ (п.1-3 ст.3, п.1,2 ст.5, п.1, 3 ст.9, ст. 12, ст.15, ст.16, ст.17, ст.18, ст.19, ст.20, п.1, 3 ст. 21, ст.22, ст.23, ст.24, п.1, 3.1, 5 ст.25.1, ст.25.2, ст.25.3, ст.25.4, ст.25.5, ст.25.6)'}, {'nameNpa': 'Об иммунопрофилактике инфекционных болезней', 'numberNpa': '17.09.1998', 'title': 'Федеральный закон № 157-ФЗ (ст.11, п.1,3 ст.12, п. 1 ст. 13, п.2 ст.17)'}, {'nameNpa': 'Об охране здоровья граждан от воздействия окружающего табачного дыма, последствий потребления табака или потребления никотинсодержащей продукции', 'numberNpa': '23.02.2013', 'title': 'Федеральный закон «15-ФЗ (ст. 12, ст.14, ст.16 ст.18, ст.20)'}, {'nameNpa': 'Об утверждении перечня работ, выполнение которых связано с высоким риском заболевания инфекционными болезнями и требуют обязательного проведения профилактических прививок', 'numberNpa': '15.07.1999', 'title': 'Постановление Правительства РФ № 825 (весь документ)'}, {'nameNpa': '«О безопасности пищевой продукции»', 'numberNpa': '09.12.2011', 'title': 'Технический регламент Таможенного союза ТР ТС 021/2011 (весь регламент (за исключением статьи 6, абзацев второго, седьмого, двенадцатого - четырнадцатого части 5 статьи 7, части 3 статьи 13, части 2 статьи 18, статей 30 и 40 указанного технического регламента)'}, {'nameNpa': '«Пищевая продукция в части ее маркировки»\n', 'numberNpa': '09.12.2011', 'title': 'Технический регламент Таможенного союза ТР ТС 022/2011 (весь регламент)\n'}, {'nameNpa': '«О безопасности мяса и мясной продукции» \n', 'numberNpa': '09.10.2013', 'title': 'Технический регламент Таможенного союза ТР ТС 034/2013 (весь регламент за исключением пунктов 1, 2, 3, 4, 5, 6, 7, 8, 26, 27, 28, 29, 30, 31, 32, 33, 34, 35, 36, 37, 38, 39, 40, 41, 42, 43, 44, 45, 46, 47, 48, 53, 54 и абзаца второго пункта 99 указанного технического регламента)\n'}, {'nameNpa': '«О безопасности молока и молочной продукции»', 'numberNpa': '09.10.2013', 'title': 'Технический регламент Таможенного союза ТР ТС 033/2013 (весь регламент, за исключением пунктов 13, 14, 97, 98 и 115 указанного технического регламента)'}, {'nameNpa': '«О безопасности рыбы и рыбной продукции»', 'numberNpa': '18.10.2016', 'title': 'Технический регламент Евразийского экономического союза ТР ЕАЭС 040/2016 Разделы IV и V (за исключением пункта 14), VI, VII, VIII, IX, X, XI (за исключением пунктов 85, 86), XII'}, {'nameNpa': '«Технический регламент на соковую продукцию из фруктов и овощей»\n', 'numberNpa': '09.12.2011', 'title': ' Технический регламент Таможенного союза ТР ТС 023/2011 (ст. 3, 4, 5, 6, 7, 8)\n'}, {'nameNpa': ' «Технический регламент на масложировую продукцию»', 'numberNpa': '09.12.2011', 'title': 'Технический регламент Таможенного союза (ТР ТС 024/2011 – весь регламент)'}, {'nameNpa': ' «О безопасности упакованной питьевой воды, включая природную минеральную воду»', 'numberNpa': '23.06.2017', 'title': 'Технический регламент Евразийского экономического союза ТР ЕАЭС 044/2017 (раздел III, IV, V, VI, VII, X)'}, {'nameNpa': ' О техническом регламенте Евразийского экономического союза О безопасности мяса птицы и продукции его переработки (вместе с ТР ЕАЭС 051/2021. Технический регламент Евразийского экономического Союза О безопасности мяса птицы и продукции его переработки)', 'numberNpa': '29.10.2021', 'title': 'Решение Совета Евразийской экономической комиссии N 110 Разделы III, IV, V, X, XII, XIII '}, {'nameNpa': '«Санитарно-эпидемиологические требования к содержанию территорий городских и сельских поселений, к водным объектам, питьевой воде и питьевому водоснабжению, атмосферному воздуху, почвам, жилым помещениям, эксплуатации производственных, общественных помещений, организации и проведению санитарно-противоэпидемиологических (профилактических) мероприятий»', 'numberNpa': '28.01.2021', 'title': 'СанПиН 2.1.3684-21 Разделы II,IV,VIII,X'}, {'nameNpa': '«Санитарно-эпидемиологические требования к организации общественного питания населения»', 'numberNpa': '27.10.2020', 'title': 'СанПиН 2.3/2.4.3590-20 (весь документ);'}, {'nameNpa': '«Гигиенические нормативы и требования к обеспечению безопасности и (или) безвредности для человека факторов среды обитания»', 'numberNpa': '28.01.2021', 'title': 'СанПиН 1.2.3685-21 (весь документ)'}, {'nameNpa': '«Санитарно-эпидемиологические требования к организациям воспитания и обучения, отдыха и оздоровления детей и молодежи»', 'numberNpa': '28.09.2020', 'title': 'СП 2.4.3648-20 (весь документ)'}, {'nameNpa': 'Санитарно-эпидемиологические требования к условиям труда', 'numberNpa': '02.12.2020', 'title': 'СП 2.1.3678-20 Разделы I, II, IX'}, {'nameNpa': '«С2023-01-19 12:42:10,844 - [WARNING] - direct_sql.py - new_insert_in_database(269) - Проведена повторная попытка внесения с параметром special, результат неудачный.
-эпидемиологические требования по профилактике инфекционных болезней', 'numberNpa': '28.01.2021', 'title': 'СанПиН 3.3686-21 (весь документ); '}, {'nameNpa': '«Профилактика новой коронавирусной инфекции (COVID-19)»', 'numberNpa': '22.05.2020', 'title': 'СП 3.1.3597-20(весь документ)'}, {'nameNpa': '«Санитарно-эпидемиологические требования к устройству, содержанию и организации работы образовательных организаций и других объектов социальной инфраструктуры для детей и молодежи в условиях распространения новой коронавирусной инфекции (COVID-19)»', 'numberNpa': '30.06.2020', 'title': 'СП 3.1/2.4.3598-20 (весь документ)'}, {'nameNpa': 'Об утверждении национального календаря профилактических прививок и календаря профилактических прививок по эпидемическим показаниям', 'numberNpa': '06.12.2021', 'title': 'Приказ Минздрава России № 1122н (весь документ);'}, {'nameNpa': 'Об утверждении Порядка проведения обязательных предварительных и периодических медицинских осмотров работников, предусмотренных частью четвертой статьи 213 Трудового кодекса Российской Федерации, перечня медицинских противопоказаний к осуществлению работ с вредными и (или) опасными производственными факторами, а также работам, при выполнении которых проводятся обязательные предварительные и периодические медицинские осмотры', 'numberNpa': '28.01.2021', 'title': 'Приказ Министерства здравоохранения Российской Федерации № 29н. (п.4.1приложения к Порядку проведения обязательных предварительных и периодических медицинских осмотров работников, предусмотренных частью четвертой статьи 213 Трудового кодекса Российской Федерации.'}], 'resolved': False, 'resultEmpty': True, 'resultEmptyOrLate': False, 'resultInfoTypeCodes': [], 'resultViolationKnm': False, 'riskCategory': ['чрезвычайно высокий риск'], 'riskCategoryAndDangerClass': ['чрезвычайно высокий риск / Не применяется'], 'sezRegistryExists': False, 'signed': True, 'smevInfoType': None, 'smevMessageType': None, 'smevReceivedAt': None, 'smevReceivedAtEn': None, 'smevReceivedAtMonth': None, 'smevReceivedAtYear': None, 'spvRegistryExists': False, 'startDate': '05.07.2023', 'startDateEn': '2023-07-05', 'status': 'Исключена', 'statusEgrul': 'Найден', 'statusId': 15, 'stopDate': '18.07.2023', 'stopDateEn': '2023-07-18', 'subjectTypeId': 0, 'supervisionType': 'Федеральный государственный санитарно-эпидемиологический контроль (надзор)', 'supervisionTypeId': 4, 'torRegistryExists': False, 'updatePlanDate': None, 'updatePlanDateLong': None, 'version': 'ERKNM', 'violationLawsuitTypeCodes': [], 'violationTypeCodes': [], 'year': 2023}
2023-01-19 12:42:10,844 - [INFO] - direct_sql.py - database_inserts_conductor_for_multiprocessing(132) - Возникла ошибка, с которой не удалось справиться...
тат неудачный.
2023-01-19 12:42:10,844 - [INFO] - direct_sql.py - database_inserts_conductor_for_multiprocessing(132) - Возникла ошибка, с которой не удалось справиться...
2023-01-19 12:42:10,845 - [INFO] - direct_sql.py - database_inserts_conductor_for_multiprocessing(133) - 
2023-01-19 12:42:10,862 - [ERROR] - direct_sql.py - new_insert_in_database(267) - (1040, 'ny connections')
2023-01-19 12:42:10,862 - [INFO] - direct_sql.py - new_insert_in_database(268) - {'actCreateDate': None, 'actCreateDateEn': None, 'addresses': ['663129, КРАЙ КРАСНОЯРСКИЙ, РАЙОН ПИРОВСКИЙ, СЕЛО ТРОИЦА, УЛИЦА МИРА, 63, '], 'admLevelId': 50001, 'appealed': False, 'approveDocOrderDate': None, 'approveDocOrderNum': None, 'approveDocRequestDate': None, 'approveDocRequestNum': None, 'approveDocs': [], 'approveRequired': False, 'approved': False, 'approvedErknm': 'Отказано', 'chlistCount': 0, 'chlistFilledCount': 0, 'chlistFillingIndicationTypeId': [], 'collaboratingOrganizations': [], 'collaboratingOrganizationsIds': [], 'comment': 'в соответствии с п. 11(4) постановления Правительства РФ от 10.03.2022 № 336', 'controllingOrganization': 'Управление Роспотребнадзора по Красноярскому краю', 'controllingOrganizationId': 10001011837, 'createPlanDate': None, 'createPlanDateLong': None, 'createdByErpDb': False, 'createdById': 159045, 'dataNotEqualEGRUL': False, 'dataSetNotInTime': False, 'deleted': False, 'directDurationDays': None, 'disapprove': False, 'district': 'Красноярский край', 'districtId': 1035040000000001, 'durationDays': 10, 'durationHours': 0, 'erknmActViolationIds': [], 'erknmResultKindDecisionIds': [], 'erpId': '24230041000102591148', 'events': [{'startDate': '01.09.2023', 'stopDate': '14.09.2023', 'title': 'Получение письменных объяснений'}, {'startDate': '01.09.2023', 'stopDate': '14.09.2023', 'title': 'Истребование документов'}, {'startDate': '01.09.2023', 'stopDate': '14.09.2023', 'title': 'Экспертиза'}], 'federalLaw': '248', 'federalLawId': 3, 'fullFieldViolationKnm': False, 'hasViolations': False, 'id': 12663267, 'inn': '2431001570', 'inspectorFullName': [], 'isFromSmev': False, 'isHasApproveDocs': False, 'isHasCollaboratingOrganization': False, 'isHasRequirements': True, 'isHasViolationTerm': False, 'isPm': False, 'kind': 'Документарная проверка', 'knmAnnulled': False, 'knmRejected': False, 'knmType': 'Плановое КНМ', 'knmTypeId': 4, 'legalBasisDocName': [], 'links': [], 'mspCategory': ['Не является субъектом МСП'], 'noPunishment': False, 'notifyLate': False, 'objectsKind': ['Деятельность общеобразовательных организаций'], 'objectsSubKind': ['Деятельность общеобразовательных организаций'], 'objectsType': ['Деятельность и действия'], 'ogrn': '1022401276589', 'oldKnm': None, 'oldPlan': None, 'orderDone': False, 'organizationName': 'МУНИЦИПАЛЬНОЕ БЮДЖЕТНОЕ ОБЩЕОБРАЗОВАТЕЛЬНОЕ УЧРЕЖДЕНИЕ ТРОИЦКАЯ СРЕДНЯЯ ШКОЛА', 'organizationsInn': ['2431001570'], 'organizationsName': ['МУНИЦИПАЛЬНОЕ БЮДЖЕТНОЕ ОБЩЕОБРАЗОВАТЕЛЬНОЕ УЧРЕЖДЕНИЕ ТРОИЦКАЯ СРЕДНЯЯ ШКОЛА'], 'organizationsOgrn': ['1022401276589'], 'planId': '2023050264', 'prosecutorOrganization': 'Прокуратура Красноярского края', 'prosecutorOrganizationId': 2169, 'publishedStatus': 'UNPUBLISHED', 'reasons': [201], 'reasonsList': [{'assignmentDate': None, 'assignmentDateEn': None, 'assignmentNumber': None, 'date': '17.01.2022', 'dateEn': '2022-01-17', 'requirementDetails': None, 'text': '(ФЗ 248) Истечение установленного федеральным законом о виде контроля, положением о виде контроля период времени с даты окончания проведения последнего планового контрольного (надзорного) мероприятия'}], 'recEmptyOrLate': False, 'regDateEgrul': '20.07.2022', 'regDateEgrulEn': '2022-07-20', 'regLate': False, 'regTypes': [], 'requirements': 32, 'requirementsList': [{'nameNpa': '«Об охране здоровья граждан от воздействия окружающего табачного дыма и последствий потребления табака» ', 'numberNpa': '23.02.2013', 'title': 'ст.ст. 9-12, 19, 23 Федерального закона № 15-ФЗ '}, {'nameNpa': '«О техническом регулировании» ', 'numberNpa': '27.12.2002', 'title': 'ст.ст. 24, 27, 32 Федерального закона № 184-ФЗ'}, {'nameNpa': '«О предупреждении распространения туберкулёза в РФ»', 'numberNpa': '18.06.2001', 'title': 'ст. 8, 16 Федерального закона № 77-ФЗ '}, {'nameNpa': '«О безопасности пищевой продукции»', 'numberNpa': '09.12.2011', 'title': 'ТР ТС 021/2011 (за исключением статьи 6, абзацев второго, седьмого, двенадцатого – четырнадцатого части 5 статьи 7, части 3 статьи 13, части 2 статьи 18, статей 30 и 40); '}, {'nameNpa': 'Технический регламент на соковую продукцию из фруктов и овощей', 'numberNpa': '09.12.2011', 'title': 'ст. 3, 4, 5, 6, 7 и 8 TP ТС 023/2011'}, {'nameNpa': ' О безопасности молока и молочной продукции ', 'numberNpa': '09.10.2013', 'title': 'TP ТС 033/2013 (за исключением п. 13, 14, 97, 98 и 115)'}, {'nameNpa': '«О безопасности упакованной питьевой воды, включая природную минеральную воду» ', 'numberNpa': '23.06.2017', 'title': 'разделы 3-7, 10 ТР ЕАЭС 044/2017'}, {'nameNpa': '«Санитарно-эпидемиологические требования к организациям воспитания и обучения, отдыха и оздоровления детей и молодежи»', 'numberNpa': '28.09.2020', 'title': 'разделы 1-2, п.п. 3.4.1-3.4.19 СП 2.4.3648-20'}, {'nameNpa': '«Санитарно-эпидемиологические требования к организации общественного питания населения»', 'numberNpa': '27.10.2020', 'title': 'разделы 1-5, 8 СанПиН 2.3/2.4.3590-20'}, {'nameNpa': '«Об утверждении перечня вредных и (или) опасных производственных факторов и работ, при выполнении которых проводятся обязательные предварительные медицинские осмотры при поступлении на работу и периодические медицинские осмотры»', 'numberNpa': '31.12.2020', 'title': 'Приказ Министерства труда и социальной защиты Российской Федерации, Министерства здравоохранения Российской Федерации № 988н/1420н '}, {'nameNpa': '«Санитарно - эпидемиологические требования к устройству, содержанию и организации работы образовательных организаций и других объектов социальной инфраструктуры для детей и молодежи в условиях распространения новой коронавирусной инфекции (COVID-19)', 'numberNpa': '30.06.2020', 'title': 'разделы 1-2, ст. 3.2 СП 3.1/2.4.3598-20'}, {'nameNpa': '«Об утверждении Порядка проведения обязательных предварительных и периодических медицинских осмотров работников, предусмотренных частью четвертой статьи 213 Трудового кодекса Российской Федерации, перечня медицинских противопоказаний к осуществлению работ с вредными и (или) опасными производственными факторами, а также работам, при выполнении которых проводятся обязательные предварительные и периодические медицинские осмотры»', 'numberNpa': '28.01.2021', 'title': 'Приказ МинЗдрава России № 29н'}, {'nameNpa': '«О проведении профилактических прививок отдельным группам граждан по эпидемическим показаниям»', 'numberNpa': '23.07.2021', 'title': 'Постановление Главного государственного санитарного врача по Красноярскому краю № 43 '}, {'nameNpa': '«О санитарно-эпидемиологическом благополучии населения»', 'numberNpa': '30.03.1999', 'title': 'ст.ст. 11, 15, 17-22, 27-29, 32, 34-36, 40 Федерального закона № 52-ФЗ'}, {'nameNpa': '«О качестве и безопасности пищевых продуктов» ', 'numberNpa': '02.01.2000', 'title': 'ст.ст. 3, 15-20, 22-24, 25.1-25.3, 25.5, 26.1 Федерального закона № 29-ФЗ'}, {'nameNpa': '«Об иммунопрофилактике населения»', 'numberNpa': '17.09.1998', 'title': 'ст.ст. 5, 9, 10, 22 Федерального закона № 157-ФЗ'}, {'nameNpa': '«О водоснабжении и водоотведении»', 'numberNpa': '07.12.2011', 'title': 'главы 3, 4 Федерального закона № 416-ФЗ'}, {'nameNpa': 'О безопасности упаковки', 'numberNpa': '16.08.2011', 'title': 'ст.ст. 3-8 ТР ТС 005/2011'}, {'nameNpa': '«О безопасности продукции, предназначенной для детей и подростков» ', 'numberNpa': '23.09.2011', 'title': 'ст.ст. 1-5, 8-14 ТР ТС 007/2011'}, {'nameNpa': '«О безопасности парфюмерно-косметической продукции»', 'numberNpa': '23.09.2011', 'title': 'ст.ст. 4, 5, 5.1, 7 ТР ТС 009/2011'}, {'nameNpa': '«О безопасности зерна»', 'numberNpa': '09.12.2011', 'title': 'ст.ст. 3, 4, 6, 8 ТР ТС 015/2011'}, {'nameNpa': '«Пищевая продукция в части ее маркировки»', 'numberNpa': '09.12.2011', 'title': 'ст.ст. 4, 5 ТР ТС 022/2011'}, {'nameNpa': '«Технический регламент на масложировую продукцию» ', 'numberNpa': '09.12.2011', 'title': 'главы 3, 4, 5 (ст.ст. 14-17), 6 (ст. 20), 7 ТР ТС 024/2011'}, {'nameNpa': '«О безопасности мебельной продукции»', 'numberNpa': '15.06.2012', 'title': 'ст.ст. 4-7 ТР ТС 025/2012'}, {'nameNpa': '«О безопасности отдельных видов специализированной пищевой продукции, в том числе диетического лечебного и диетического профилактического питания» ', 'numberNpa': '15.06.2012', 'title': 'ст.ст. 5-11 ТР ТС 027/2012 '}, {'nameNpa': '«Требования безопасности пищевых добавок, ароматизаторов и технологических вспомогательных средств» ', 'numberNpa': '20.07.2012', 'title': 'ст.ст. 5-7, 9-11 ТР ТС 029/2012'}, {'nameNpa': '«О безопасности мяса и мясной продукции»', 'numberNpa': '09.10.2013', 'title': 'ТР ТС 034/2013 (за исключением п.п. 1-8, 26-48, 53, 54 и абзаца второго п. 99)'}, {'nameNpa': '«О безопасности рыбы и рыбной продукции»', 'numberNpa': '18.10.2016', 'title': 'разделы 4, 5 (за исключением п. 14), 6-10, 11 (за исключением п.п. 85, 86), 12 ТР ЕАЭС 040/2016'}, {'nameNpa': '«Санитарно-эпидемиологические требования к эксплуатации помещений, зданий, сооружений, оборудования и транспорта, а также условиям деятельности хозяйствующих субъектов, осуществляющих продажу товаров, выполнение работ или оказание услуг', 'numberNpa': '24.12.2020', 'title': 'разделы 1-4 СП 2.1.3678-20 '}, {'nameNpa': '«Санитарно-эпидемиологические требования к содержанию территорий городских и сельских поселений, к водным объектам, питьевой воде и питьевому водоснабжению, атмосферному воздуху, почвам, жилым помещениям, эксплуатации производственных, общественных помещений, организации и проведению санитарно-противоэпидемических (профилактических) мероприятий»', 'numberNpa': '28.01.2021', 'title': 'разделы 2, 4, 7, 10 СанПиН 2.1.3684-21 '}, {'nameNpa': '«Гигиенические нормативы и требования к обеспечению безопасности и (или) безвредности для человека факторов среды обитания»', 'numberNpa': '28.01.2021', 'title': 'разделы 3-6 СанПиН 1.2.3685-21 '}, {'nameNpa': '«Санитарно-эпидемиологические требования по профилактике инфекционных болезней', 'numberNpa': '28.01.2021', 'title': 'разделы 1-3, 7-8, 24, 26-29, 33-34, 43 СанПиН 3.3686-21 '}], 'resolved': False, 'resultEmpty': True, 'resultEmptyOrLate': False, 'resultInfoTypeCodes': [], 'resultViolationKnm': False, 'riskCategory': ['чрезвычайно высокий риск'], 'riskCategoryAndDangerClass': ['чрезвычайно высокий риск'], 'sezRegistryExists': False, 'signed': True, 'smevInfoType': None, 'smevMessageType': None, 'smevReceivedAt': None, 'smevReceivedAtEn': None, 'smevReceivedAtMonth': None, 'smevReceivedAtYear': None, 'spvRegistryExists': False, 'startDate': '01.09.2023', 'startDateEn': '2023-09-01', 'status': 'Исключена', 'statusEgrul': 'В процессе поиска', 'statusId': 15, 'stopDate': '14.09.2023', 'stopDateEn': '2023-09-14', 'subjectTypeId': 0, 'supervisionType': 'Федеральный государственный санитарно-эпидемиологический контроль (надзор)', 'supervisionTypeId': 4, 'torRegistryExists': False, 'updatePlanDate': None, 'updatePlanDateLong': None, 'version': 'ERKNM', 'violationLawsuitTypeCodes': [], 'violationTypeCodes': [], 'year': 2023}
2023-01-19 12:42:10,864 - [WARNING] - direct_sql.py - new_insert_in_database(269) - Проведена повторная попытка внесения с параметром special, результат неудачный.
2023-01-19 12:42:10,865 - [INFO] - direct_sql.py - database_inserts_conductor_for_multiprocessing(132) - Возникла ошибка, с которой не удалось справиться...
2023-01-19 12:42:10,865 - [INFO] - direct_sql.py - database_inserts_conductor_for_multiprocessing(133) - 
2023-01-19 12:42:10,870 - [ERROR] - direct_sql.py - new_insert_in_database(267) - (1040, 'ny connections')
2023-01-19 12:42:10,871 - [ERROR] - direct_sql.py - new_insert_in_database(267) - (1040, 'ny connections')
2023-01-19 12:42:10,871 - [INFO] - direct_sql.py - new_insert_in_database(268) - {'actCreateDate': None, 'actCreateDateEn': None, 'addresses': ['356403, Ставропольский край, Р-Н Благодарненский, С Сотниковское, УЛ. Красная, Д. Д.172/1, '], 'admLevelId': 50001, 'appealed': False, 'approveDocOrderDate': None, 'approveDocOrderNum': None, 'approveDocRequestDate': None, 'approveDocRequestNum': None, 'approveDocs': [], 'approveRequired': False, 'approved': False, 'approvedErknm': 'Отказано', 'chlistCount': 1, 'chlistFilledCount': 1, 'chlistFillingIndicationTypeId': [], 'collaboratingOrganizations': [], 'collaboratingOrganizationsIds': [], 'comment': 'не указан срок проведения КНМ, отсутствует в реестре ЕРВК', 'controllingOrganization': 'Управления Роспотребнадзора по Ставропольскому краю', 'controllingOrganizationId': 10001020884, 'createPlanDate': None, 'createPlanDateLong': None, 'createdByErpDb': False, 'createdById': 161948, 'dataNotEqualEGRUL': False, 'dataSetNotInTime': False, 'deleted': False, 'directDurationDays': None, 'disapprove': False, 'district': 'Ставропольский край', 'districtId': 1038070000000001, 'durationDays': None, 'durationHours': 15, 'erknmActViolationIds': [], 'erknmResultKindDecisionIds': [], 'erpId': '26230041000103351010', 'events': [{'startDate': '19.06.2023', 'stopDate': '30.06.2023', 'title': 'Осмотр'}, {'startDate': '19.06.2023', 'stopDate': '30.06.2023', 'title': 'Отбор проб (образцов)'}, {'startDate': '19.06.2023', 'stopDate': '30.06.2023', 'title': 'Испытание'}, {'startDate': '19.06.2023', 'stopDate': '30.06.2023', 'title': 'Истребование документов'}], 'federalLaw': '248', 'federalLawId': 3, 'fullFieldViolationKnm': False, 'hasViolations': False, 'id': 13423127, 'inn': '260505277022', 'inspectorFullName': [], 'isFromSmev': False, 'isHasApproveDocs': False, 'isHasCollaboratingOrganization': False, 'isHasRequirements': True, 'isHasViolationTerm': False, 'isPm': False, 'kind': 'Выездная проверка', 'knmAnnulled': False, 'knmRejected': False, 'knmType': 'Плановое КНМ', 'knmTypeId': 4, 'legalBasisDocName': [], 'links': [], 'mspCategory': ['Микропредприятие'], 'noPunishment': False, 'notifyLate': False, 'objectsKind': ['Иная деятельность по производству пищевых продуктов, предоставлению услуг общественного питания и торговле пищевыми продуктами'], 'objectsSubKind': ['Иная деятельность по производству пищевых продуктов, предоставлению услуг общественного питания и торговле пищевыми продуктами'], 'objectsType': ['Деятельность и действия'], 'ogrn': '311265118200270', 'oldKnm': None, 'oldPlan': None, 'orderDone': False, 'organizationName': 'ВОРОЖКО РОМАН АЛЕКСАНДРОВИЧ', 'organizationsInn': ['260505277022'], 'organizationsName': ['ВОРОЖКО РОМАН АЛЕКСАНДРОВИЧ'], 'organizationsOgrn': ['311265118200270'], 'planId': '2023050561', 'prosecutorOrganization': 'Прокуратура Ставропольского края', 'prosecutorOrganizationId': 2905, 'publishedStatus': 'UNPUBLISHED', 'reasons': [201], 'reasonsList': [{'assignmentDate': None, 'assignmentDateEn': None, 'assignmentNumber': None, 'date': '03.03.2020', 'dateEn': '2020-03-03', 'requirementDetails': None, 'text': '(ФЗ 248) Истечение установленного федеральным законом о виде контроля, положением о виде контроля период времени с даты окончания проведения последнего планового контрольного (надзорного) мероприятия'}], 'recEmptyOrLate': False, 'regDateEgrul': '09.09.2022', 'regDateEgrulEn': '2022-09-09', 'regLate': False, 'regTypes': ['MSP'], 'requirements': 21, 'requirementsList': [{'nameNpa': 'Федеральный закон от 30.03.1999г №52-ФЗ «О са-нитарно-эпидемиологическом бла-гополучии населения» \t', 'numberNpa': '30.03.1999', 'title': 'статьи 10, 12-17,19-22, 24-25, 27,29, 32, 34, 35, 44 '}, {'nameNpa': 'Федеральный закон от 23.02.2023г №15-ФЗ «Об ох-ране здоровья граждан от воздействия окружающего табачного дыма и последст-вий потребления табака или потребления никотинсодер-жащей продукции» \t', 'numberNpa': '23.02.2013', 'title': ' ст.10 п.2, ст. 12 п.п.1-3,5 \t'}, {'nameNpa': 'Федеральный закон от 22.11.1995г № 171-ФЗ «О го-сударственном регулирова-нии производства и оборота этилового спирта, алкоголь-ной и спиртосодержащей продукции и об ограничении потребления (распития) ал-когольной продукции» \t', 'numberNpa': '22.11.1995', 'title': 'т. 10.2, ст.16 \t'}, {'nameNpa': 'Федеральный закон от 02.01.2000 г № 29-ФЗ «О ка-честве и безопасности пище-вых продуктов»   \t', 'numberNpa': '02.01.2000', 'title': 'ст.3 '}, {'nameNpa': 'Федеральный закон от 27.12.2002 г. №184-ФЗ «О техническом регулировании»  \t', 'numberNpa': '27.12.2002', 'title': 'п. 1 ст.37, ст.38\t'}, {'nameNpa': 'Федеральный закон от 24.06.1998 г. №89-ФЗ «Об отходах производства и по-требления» \t', 'numberNpa': '24.06.1998', 'title': 'ст.11, ст.14'}, {'nameNpa': 'ТР ТС 021/2011 О безопас-ности пищевой продукции\t', 'numberNpa': '09.12.2011', 'title': 'ст. 4-5, ст. 7 ч.1-4, ч.5-12, ст.8-12, ст.13 ч.1,2,4, ст.14-17, ст. 18 ч.1, 3-8, ст.20-21, ст.39 '}, {'nameNpa': 'ТР ТС 022/2011 «Пищевая продукция в части ее марки-ровки» \t', 'numberNpa': '09.12.2011', 'title': 'ст. 2-5 '}, {'nameNpa': '\tТР ТС 033/2013 «О безопас-ности молока и молочной продукции» \t', 'numberNpa': '01.10.2013', 'title': 'Положения за исключени-ем ст. 6 абзаца 2,7,12-14, ч.5 ст.7, ч.3 ст.13, ч.2 ст.18, ст.30,40   п.9-25, п.88,п.106-116, п.121,122, п.129, п.132 '}, {'nameNpa': 'ТР ТС 034/2013 «О безопас-ности мяса и мясной продук-ции» \t', 'numberNpa': '09.10.2013', 'title': 'разделы IV,V,X,XI за ис-ключением п. 1-8, 26-48, 53,54 и абзаца 2 п.99 '}, {'nameNpa': 'ТР ЕАЭС 040/2016 «О безо-пасности рыбы и рыбной продукции» \t', 'numberNpa': '18.10.2016', 'title': 'раздел IV-V за исключе-ние пункта 14, раздел VI,VII,VIII, IX, X, XI (за ис-ключением пункта 85,86) \t'}, {'nameNpa': 'ТР ТС 029/2012 от 20.07.2012г. «Требования безопасности пищевых доба-вок, ароматизаторов и техно-логических вспомогательных средств», \t', 'numberNpa': '20.07.2012', 'title': 'ст.1-11\t'}, {'nameNpa': 'ТР ТС 024/2011 от 09.12.2011г. «Технический регламент на масложировую продукцию»,\t', 'numberNpa': '09.12.2011', 'title': 'ст.1-20 '}, {'nameNpa': 'СанПиН 2.1.3684-21 «Сани-тарно-эпидемиологические требования к содержанию территории городских и сельских поселений, к вод-ным объектам, питьевой воде и питьевому водоснабжению, атмосферному воздуху, поч-вам, жилым помещениям, эксплуатации производст-венных, общественных по-мещений, организации и проведению санитарно-противоэпидемических (про-филактических) мероприя-тий» \t', 'numberNpa': '28.01.2021', 'title': 'п.8, п. 47,п. 48, п. 49, раз-дел III п.66, п.73, раздел IV п.75, п.77   \t'}, {'nameNpa': 'ТР ТС 023/2011 от 09.12.2011г. «Технический регламент на соковую про-дукцию из фруктов и ово-щей»\t\n\n', 'numberNpa': '09.12.2011', 'title': 'ст.3-8 \t'}, {'nameNpa': '                                \tСанПиН 1.2.3685-21 Гигие-нические нормативы и тре-бования к обеспечению безо-пасности и (или) безвредно-сти для человека факторов среды обитания \t', 'numberNpa': '30.12.2020', 'title': 'раздел IV п.75, п.77 гла-вы II-V '}, {'nameNpa': 'СП 3.1.3597-20 «Профилак-тика новой коронавирусной инфекции (COVID-19)» \t', 'numberNpa': '22.05.2020', 'title': 'п. 4.4'}, {'nameNpa': 'СанПиН 2.3/2.4.3590-20 «Са-нитарно-эпидемиологические требования к организации общественного питания на-селения»\t', 'numberNpa': '27.10.2020', 'title': 'главы II-V \t'}, {'nameNpa': ' \tСП 2.3.6.3668-20 «Санитар-но-эпидемиологические тре-бования к условиям деятель-ности торговых объектов и рынков, реализующих пище-вую продукцию   \t', 'numberNpa': '20.11.2020', 'title': 'главы II -VIII '}, {'nameNpa': 'ТР ЕАЭС 044/2017 О безо-пасности упакованной питье-вой воды, включая природ-ную минеральную воду \t\n', 'numberNpa': '01.10.2017', 'title': 'разделы III, IV, V, VI, VII и X '}, {'nameNpa': 'СанПиН 3.3686-21 «Сани-тарно-эпидемиологические требования по профилактике инфекционных болезней»\t', 'numberNpa': '28.01.2021', 'title': 'разделы II, III, VIII, IX, X, XV, XVIII, XXIV, XXVI, XXIX, XXXII, XXXIV, XXXV, XXXVII, XXVIII, XLIII, XLVI, XLII, XLVIII\t'}], 'resolved': False, 'resultEmpty': True, 'resultEmptyOrLate': False, 'resultInfoTypeCodes': [], 'resultViolationKnm': False, 'riskCategory': ['высокий риск'], 'riskCategoryAndDangerClass': ['высокий риск'], 'sezRegistryExists': False, 'signed': True, 'smevInfoType': None, 'smevMessageType': None, 'smevReceivedAt': None, 'smevReceivedAtEn': None, 'smevReceivedAtMonth': None, 'smevReceivedAtYear': None, 'spvRegistryExists': False, 'startDate': '19.06.2023', 'startDateEn': '2023-06-19', 'status': 'Исключена', 'statusEgrul': 'Не найден', 'statusId': 15, 'stopDate': '30.06.2023', 'stopDateEn': '2023-06-30', 'subjectTypeId': 0, 'supervisionType': 'Федеральный государственный санитарно-эпидемиологический контроль (надзор)', 'supervisionTypeId': 4, 'torRegistryExists': False, 'updatePlanDate': None, 'updatePlanDateLong': None, 'version': 'ERKNM', 'violationLawsuitTypeCodes': [], 'violationTypeCodes': [], 'year': 2023}
2023-01-19 12:42:10,871 - [INFO] - direct_sql.py - new_insert_in_database(268) - {'actCreateDate': None, 'actCreateDateEn': None, 'addresses': ['353210, КРАЙ, КРАСНОДАРСКИЙ, РАЙОН, ДИНСКОЙ, УЛИЦА, ДЗЕРЖИНСКОГО, ДОМ 15А, '], 'admLevelId': 50001, 'appealed': False, 'approveDocOrderDate': None, 'approveDocOrderNum': None, 'approveDocRequestDate': None, 'approveDocRequestNum': None, 'approveDocs': [], 'approveRequired': False, 'approved': False, 'approvedErknm': 'Отказано', 'chlistCount': 2, 'chlistFilledCount': 2, 'chlistFillingIndicationTypeId': [], 'collaboratingOrganizations': [], 'collaboratingOrganizationsIds': [], 'comment': 'В соответствии с п. 11 (3), 11 (4) постановления Правительства РФ от 10.03.2022 N 336 не подлежит включению в План на 2023 г.', 'controllingOrganization': 'Управление Роспотребнадзора по Краснодарскому краю', 'controllingOrganizationId': 10001016832, 'createPlanDate': None, 'createPlanDateLong': None, 'createdByErpDb': False, 'createdById': 217719, 'dataNotEqualEGRUL': False, 'dataSetNotInTime': False, 'deleted': False, 'directDurationDays': None, 'disapprove': False, 'district': 'Краснодарский край', 'districtId': 1040030000000001, 'durationDays': 10, 'durationHours': None, 'erknmActViolationIds': [], 'erknmResultKindDecisionIds': [], 'erpId': '23230041000103486438', 'events': [{'startDate': '07.08.2023', 'stopDate': '18.08.2023', 'title': 'Осмотр'}, {'startDate': '07.08.2023', 'stopDate': '18.08.2023', 'title': 'Получение письменных объяснений'}, {'startDate': '07.08.2023', 'stopDate': '18.08.2023', 'title': 'Истребование документов'}, {'startDate': '07.08.2023', 'stopDate': '18.08.2023', 'title': 'Отбор проб (образцов)'}, {'startDate': '07.08.2023', 'stopDate': '18.08.2023', 'title': 'Инструментальное обследование'}, {'startDate': '07.08.2023', 'stopDate': '18.08.2023', 'title': 'Испытание'}, {'startDate': '07.08.2023', 'stopDate': '18.08.2023', 'title': 'Экспертиза'}], 'federalLaw': '248', 'federalLawId': 3, 'fullFieldViolationKnm': False, 'hasViolations': False, 'id': 13558555, 'inn': '2330034650', 'inspectorFullName': [], 'isFromSmev': False, 'isHasApproveDocs': False, 'isHasCollaboratingOrganization': False, 'isHasRequirements': True, 'isHasViolationTerm': False, 'isPm': False, 'kind': 'Выездная проверка', 'knmAnnulled': False, 'knmRejected': False, 'knmType': 'Плановое КНМ', 'knmTypeId': 4, 'legalBasisDocName': [], 'links': [], 'mspCategory': ['Не является субъектом МСП'], 'noPunishment': False, 'notifyLate': False, 'objectsKind': ['Деятельность дошкольных образовательных организаций'], 'objectsSubKind': ['Деятельность дошкольных образовательных организаций'], 'objectsType': ['Деятельность и действия'], 'ogrn': '1072330001150', 'oldKnm': None, 'oldPlan': None, 'orderDone': False, 'organizationName': 'БЮДЖЕТНОЕ ДОШКОЛЬНОЕ ОБРАЗОВАТЕЛЬНОЕ УЧРЕЖДЕНИЕ МУНИЦИПАЛЬНОГО ОБРАЗОВАНИЯ ДИНСКОЙ РАЙОН ДЕТСКИЙ САД № 59', 'organizationsInn': ['2330034650'], 'organizationsName': ['БЮДЖЕТНОЕ ДОШКОЛЬНОЕ ОБРАЗОВАТЕЛЬНОЕ УЧРЕЖДЕНИЕ МУНИЦИПАЛЬНОГО ОБРАЗОВАНИЯ ДИНСКОЙ РАЙОН ДЕТСКИЙ САД № 59'], 'organizationsOgrn': ['1072330001150'], 'planId': '2023057070', 'prosecutorOrganization': 'Прокуратура Краснодарского края', 'prosecutorOrganizationId': 922, 'publishedStatus': 'UNPUBLISHED', 'reasons': [201], 'reasonsList': [{'assignmentDate': None, 'assignmentDateEn': None, 'assignmentNumber': None, 'date': '18.10.2021', 'dateEn': '2021-10-18', 'requirementDetails': None, 'text': '(ФЗ 248) Истечение установленного федеральным законом о виде контроля, положением о виде контроля период времени с даты окончания проведения последнего планового контрольного (надзорного) мероприятия'}], 'recEmptyOrLate': False, 'regDateEgrul': '19.09.2022', 'regDateEgrulEn': '2022-09-19', 'regLate': False, 'regTypes': [], 'requirements': 23, 'requirementsList': [{'nameNpa': 'ст.11, ст. 17, ст.19, ст.24, ст.28, ст.34, ст.35, ст.36 Федерального закона от 30.03.1999 № 52-ФЗ О санитарно-эпидемиологическом благополучии населения', 'numberNpa': '30.03.1999', 'title': 'соблюдение обязательных требований'}, {'nameNpa': 'Федеральный закон от 23.02.2013 № 15-ФЗ «Об охране здоровья граждан от воздействия окружающего табачного дыма, последствий потребления табака или потребления никотинсодержащей продукции»', 'numberNpa': '23.02.2013', 'title': 'соблюдение обязательных требований'}, {'nameNpa': 'Федеральный закон от 24.06.1998 № 89-ФЗ «Об отходах производства и потребления»', 'numberNpa': '24.06.1998', 'title': 'соблюдение обязательных требований'}, {'nameNpa': 'Федеральный закон от 22.12.2008 № 268-ФЗ «Технический регламент на табачную продукцию»', 'numberNpa': '22.12.2008', 'title': 'соблюдение обязательных требований'}, {'nameNpa': 'Федеральный закон от 17.09.1998 N 157-ФЗ Об иммунопрофилактике инфекционных болезней ', 'numberNpa': '17.09.1998', 'title': 'соблюдение обязательных требований'}, {'nameNpa': 'Технический регламент Таможенного союза ТР ТС 021/2011 «О безопасности пищевой продукции», утвержденный решением Комиссии Таможенного союза от 09.12.2011 № 880', 'numberNpa': '09.12.2011', 'title': 'соблюдение обязательных требований'}, {'nameNpa': 'Технический регламент Таможенного союза ТР ТС 007/2011 «О безопасности продукции, предназначенной для детей и подростков», утвержденный решением Комиссии Таможенного союза от 23.09.2011 № 797', 'numberNpa': '23.09.2011', 'title': 'соблюдение обязательных требований'}, {'nameNpa': 'Технический регламент Таможенного союза ТР ТС 025/2012 «О безопасности мебельной продукции», утвержденный решением Совета Евразийской экономической комиссии от 15.06.2012 № 32', 'numberNpa': '15.06.2012', 'title': 'соблюдение обязательных требований'}, {'nameNpa': 'Технический регламент Таможенного союза ТР ТС 009/2011 «О безопасности парфюмерно-косметической продукции», утвержденный решением Комиссии Таможенного союза от 23.09.2011 № 799', 'numberNpa': '23.09.2011', 'title': 'соблюдение обязательных требований'}, {'nameNpa': 'гл.гл. 1 – 7, ст.ст. 1-21 ТР ТС 024/2011 Технический регламент Таможенного союза «Технический регламент на масложировую продукцию» от 09.12.2011', 'numberNpa': '09.12.2011', 'title': 'соблюдение обязательных требований'}, {'nameNpa': 'п.п. 1-115 ТР ТС 033/2013 Технический регламент Таможенного союза «О безопасности молока и \n молочной продукции» от 09.10.2013', 'numberNpa': '09.10.2013', 'title': 'соблюдение обязательных требований'}, {'nameNpa': 'п.п. 1 – 151 ТР ТС 034/2013Технический регламент Таможенного союза О безопасности мяса и мясной продукции от 09.10.2013', 'numberNpa': '09.10.2013', 'title': 'соблюдение обязательных требований'}, {'nameNpa': 'п.п. 4, 5-12, 68-78, 99-102 ТР ЕАЭС 040/2016 Технический регламент Евразийского экономического союза «О безопасности рыбы и рыбной продукции» от 18.10.2016', 'numberNpa': '18.10.2016', 'title': 'соблюдение обязательных требований'}, {'nameNpa': 'ст. 1-8 технического регламента Таможенного союза ТР ТС 023/2011 «Технический регламент на соковую продукцию из фруктов и овощей» (утвержденный решением комиссии Таможенного союза от 09.12.2011', 'numberNpa': '09.12.2011', 'title': 'соблюдение обязательных требований'}, {'nameNpa': 'п.п. 8-13, 33-50, 66-69 ТР ЕАЭС 044/2017 Технический регламент Евразийского экономического союза «О безопасности упакованной питьевой воды, включая природную минеральную воду» от 23.06.2017', 'numberNpa': '23.06.2017', 'title': 'соблюдение обязательных требований'}, {'nameNpa': 'п.п.6-8, 14-16, 21-23, 35-42 Технического регламента «Требования к безопасности синтетических моющих средств и товаров бытовой химии», утвержденного постановлением Правительства Республики Казахстан от 04.03.2008 № 217', 'numberNpa': '04.03.2008', 'title': 'соблюдение обязательных требований'}, {'nameNpa': 'Технический регламент Таможенного союза ТР ТС 035/2014 «Технический регламент на табачную продукцию», утвержденный решением Совета Евразийской экономической комиссии от 12.11.2014 № 107', 'numberNpa': '12.11.2014', 'title': 'соблюдение обязательных требований'}, {'nameNpa': 'Единые санитарно-эпидемиологические и гигиенические требования к товарам, подлежащим санитарно-эпидемиологическому надзору (контролю), утвержденные решением Комиссии Таможенного союза от 28.05.2010 № 299', 'numberNpa': '28.05.2010', 'title': 'соблюдение обязательных требований'}, {'nameNpa': 'СанПиН 2.4.3648-20 Санитарно-эпидемиологические требования к организации воспитания и обучения, отдыха и оздоровления детей и молодежи, утвержденные постановлением Главного государственного санитарного врача Российской Федерации от 28.09.2020 № 28', 'numberNpa': '28.09.2020', 'title': 'соблюдение обязательных требований'}, {'nameNpa': 'разделы I-V, VIII СанПиН 2.3/2.4.3590-20 Санитарно-эпидемиологические требования к организации общественного питания населения, утвержденных постановлением Главного государственного санитарного врача Российской Федерации от 27.10.2020 № 32', 'numberNpa': '27.10.2020', 'title': 'соблюдение обязательных требований'}, {'nameNpa': 'СанПиН 1.2.3685-21 «Гигиенические нормативы и требования к обеспечению безопасности и (или) безвредности для человека факторов среды обитания», утвержденные постановлением Главного государственного санитарного врача Российской Федерации от 28.01.2021 № 2', 'numberNpa': '28.01.2021', 'title': 'соблюдение обязательных требований'}, {'nameNpa': 'СанПиН 2.1.3.3684-21 «Санитарно - эпидемиологические требования к содержанию территорий городских и сельских поселений к водным объектам, питьевой воде и питьевому водоснабжению, атмосферному воздуху, почвам, жилым помещениям, эксплуатации производственных, общественных помещений, организации и проведению санитарно-противоэпидемических (профилактических) мероприятий», утвержденные постановлением Главного государственного санитарного врача Российской Федерации от 28.01.2021 № 3', 'numberNpa': '28.01.2021', 'title': 'соблюдение обязательных требований'}, {'nameNpa': 'СП 3.1/2.4.3598-20 Санитарно-эпидемиологические требования к устройству, содержанию и организации работы образовательных организаций и других объектов социальной инфраструктуры для детей и молодежи в условиях распространения новой коронавирусной инфекции (COVID-19) главы1-3, утвержденные постановлением Главного государственного санитарного врача Российской Федерации от 30.06.2020 № 16', 'numberNpa': '30.06.2020', 'title': 'соблюдение обязательных требований'}], 'resolved': False, 'resultEmpty': True, 'resultEmptyOrLate': False, 'resultInfoTypeCodes': [], 'resultViolationKnm': False, 'riskCategory': ['чрезвычайно высокий риск'], 'riskCategoryAndDangerClass': ['чрезвычайно высокий риск / Не применяется'], 'sezRegistryExists': False, 'signed': True, 'smevInfoType': None, 'smevMessageType': None, 'smevReceivedAt': None, 'smevReceivedAtEn': None, 'smevReceivedAtMonth': None, 'smevReceivedAtYear': None, 'spvRegistryExists': False, 'startDate': '07.08.2023', 'startDateEn': '2023-08-07', 'status': 'Исключена', 'statusEgrul': 'Найден', 'statusId': 15, 'stopDate': '18.08.2023', 'stopDateEn': '2023-08-18', 'subjectTypeId': 0, 'supervisionType': 'Федеральный государственный санитарно-эпидемиологический контроль (надзор)', 'supervisionTypeId': 4, 'torRegistryExists': False, 'updatePlanDate': None, 'updatePlanDateLong': None, 'version': 'ERKNM', 'violationLawsuitTypeCodes': [], 'violationTypeCodes': [], 'year': 2023}
2023-01-19 12:42:10,871 - [WARNING] - direct_sql.py - new_insert_in_database(269) - Проведена повторная попытка внесения с параметром special, результат неудачный.
2023-01-19 12:42:10,872 - [INFO] - direct_sql.py - database_inserts_conductor_for_multiprocessing(133) - 
озникла ошибка, с которой не удалось справиться...
2023-01-19 12:42:10,872 - [INFO] - direct_sql.py - database_inserts_conductor_for_multiprocessing(133) - 
2023-01-19 12:42:10,874 - [ERROR] - direct_sql.py - new_insert_in_database(267) - (1040, 'ny connections')
2023-01-19 12:42:10,874 - [INFO] - direct_sql.py - new_insert_in_database(268) - {'actCreateDate': None, 'actCreateDateEn': None, 'addresses': ['685930, ОБЛАСТЬ МАГАДАНСКАЯ, РАЙОН ОЛЬСКИЙ, ПОСЕЛОК АРМАНЬ, УЛИЦА ПУШКИНА, ДОМ 17, '], 'admLevelId': 50001, 'appealed': False, 'approveDocOrderDate': None, 'approveDocOrderNum': None, 'approveDocRequestDate': None, 'approveDocRequestNum': None, 'approveDocs': [], 'approveRequired': False, 'approved': False, 'approvedErknm': 'Отказано', 'chlistCount': 2, 'chlistFilledCount': 2, 'chlistFillingIndicationTypeId': [], 'collaboratingOrganizations': [], 'collaboratingOrganizationsIds': [], 'comment': 'В соответствии с п. 11(4) постановления Правительства РФ от 10.03.2022 №336 плановые КНМ в отношении государственных и муниципальных учреждений дошкольного и начального общего образования, основного общего и среднего общего образования, объекты контроля которых отнесены к категории чрезвычайно высокого и высокого рисков не проводятся', 'controllingOrganization': 'Управление Роспотребнадзора по Магаданской области', 'controllingOrganizationId': 10001024121, 'createPlanDate': None, 'createPlanDateLong': None, 'createdByErpDb': False, 'createdById': 190968, 'dataNotEqualEGRUL': False, 'dataSetNotInTime': False, 'deleted': False, 'directDurationDays': None, 'disapprove': False, 'district': 'Магаданская область', 'districtId': 1036440000000001, 'durationDays': 10, 'durationHours': 80, 'erknmActViolationIds': [], 'erknmResultKindDecisionIds': [], 'erpId': '49230041000103229838', 'events': [{'startDate': '03.07.2023', 'stopDate': '14.07.2023', 'title': 'Осмотр'}, {'startDate': '03.07.2023', 'stopDate': '14.07.2023', 'title': 'Досмотр'}, {'startDate': '03.07.2023', 'stopDate': '14.07.2023', 'title': 'Опрос'}, {'startDate': '03.07.2023', 'stopDate': '14.07.2023', 'title': 'Получение письменных объяснений'}, {'startDate': '03.07.2023', 'stopDate': '14.07.2023', 'title': 'Истребование документов'}, {'startDate': '03.07.2023', 'stopDate': '14.07.2023', 'title': 'Отбор проб (образцов)'}, {'startDate': '03.07.2023', 'stopDate': '14.07.2023', 'title': 'Инструментальное обследование'}, {'startDate': '03.07.2023', 'stopDate': '14.07.2023', 'title': 'Испытание'}, {'startDate': '03.07.2023', 'stopDate': '14.07.2023', 'title': 'Экспертиза'}], 'federalLaw': '248', 'federalLawId': 3, 'fullFieldViolationKnm': False, 'hasViolations': False, 'id': 13301955, 'inn': '4901004061', 'inspectorFullName': [], 'isFromSmev': False, 'isHasApproveDocs': False, 'isHasCollaboratingOrganization': False, 'isHasRequirements': True, 'isHasViolationTerm': False, 'isPm': False, 'kind': 'Выездная проверка', 'knmAnnulled': False, 'knmRejected': False, 'knmType': 'Плановое КНМ', 'knmTypeId': 4, 'legalBasisDocName': [], 'links': [], 'mspCategory': ['Не является субъектом МСП'], 'noPunishment': False, 'notifyLate': False, 'objectsKind': ['Деятельность по организации отдыха детей и их оздоровления, в том числе лагеря с дневным пребыванием'], 'objectsSubKind': ['Деятельность по организации отдыха детей и их оздоровления, в том числе лагеря с дневным пребыванием'], 'objectsType': ['Деятельность и действия'], 'ogrn': '1024900625705', 'oldKnm': None, 'oldPlan': None, 'orderDone': False, 'organizationName': 'МУНИЦИПАЛЬНОЕ КАЗЁННОЕ ОБЩЕОБРАЗОВАТЕЛЬНОЕ УЧРЕЖДЕНИЕ СРЕДНЯЯ ОБЩЕОБРАЗОВАТЕЛЬНАЯ ШКОЛА П.АРМАНЬ', 'organizationsInn': ['4901004061'], 'organizationsName': ['МУНИЦИПАЛЬНОЕ КАЗЁННОЕ ОБЩЕОБРАЗОВАТЕЛЬНОЕ УЧРЕЖДЕНИЕ СРЕДНЯЯ ОБЩЕОБРАЗОВАТЕЛЬНАЯ ШКОЛА П.АРМАНЬ'], 'organizationsOgrn': ['1024900625705'], 'planId': '2023050302', 'prosecutorOrganization': 'Прокуратура Магаданской области', 'prosecutorOrganizationId': 2693, 'publishedStatus': 'UNPUBLISHED', 'reasons': [201], 'reasonsList': [{'assignmentDate': None, 'assignmentDateEn': None, 'assignmentNumber': None, 'date': '24.06.2022', 'dateEn': '2022-06-24', 'requirementDetails': None, 'text': '(ФЗ 248) Истечение установленного федеральным законом о виде контроля, положением о виде контроля период времени с даты окончания проведения последнего планового контрольного (надзорного) мероприятия'}], 'recEmptyOrLate': False, 'regDateEgrul': '01.09.2022', 'regDateEgrulEn': '2022-09-01', 'regLate': False, 'regTypes': [], 'requirements': 25, 'requirementsList': [{'nameNpa': '«О санитарно-эпидемиологическом благополучии населения»', 'numberNpa': '30.03.1999', 'title': 'Федеральный закон № 52-ФЗ (ст.12, ст.13, ст.14, ст.15, ст.16, ст.17, ст.18, ст.19, ст.20, ст.21, ст.22, ст.23, ст.24, ст.25, ст.26, ст.27, ст.28, ст.29, ст.30, ст.31, ст.32, ст.33, ст.34, ст.36, ст.40, ст.41, ст.43, п.4 ст.44.1)'}, {'nameNpa': ' «О качестве и безопасности пищевых продуктов»\n', 'numberNpa': '02.01.2000', 'title': 'Федеральный закон № 29-ФЗ (п.1-3 ст.3, п.1,2 ст.5, п.1, 3 ст.9, ст. 12, ст.15, ст.16, ст.17, ст.18, ст.19, ст.20, п.1, 3 ст. 21, ст.22, ст.23, ст.24, п.1, 3.1, 5 ст.25.1, ст.25.2, ст.25.3, ст.25.4, ст.25.5, ст.25.6)\n'}, {'nameNpa': 'Об иммунопрофилактике инфекционных болезней', 'numberNpa': '17.09.1998', 'title': 'Федеральный закон № 157-ФЗ (ст.11, п.1,3 ст.12, п. 1 ст. 13, п.2 ст.17)'}, {'nameNpa': 'Об охране здоровья граждан от воздействия окружающего табачного дыма, последствий потребления табака или потребления никотинсодержащей продукции', 'numberNpa': '23.02.2013', 'title': 'Федеральный закон «15-ФЗ (ст. 12, ст.14, ст.16 ст.18, ст.20)'}, {'nameNpa': 'Об утверждении перечня работ, выполнение которых связано с высоким риском заболевания инфекционными болезнями и требуют обязательного проведения профилактических прививок', 'numberNpa': '15.07.1999', 'title': 'Постановление Правительства РФ № 825 (весь документ)'}, {'nameNpa': '«О безопасности пищевой продукции»', 'numberNpa': '09.12.2011', 'title': 'Технический регламент Таможенного союза ТР ТС 021/2011 (весь регламент (за исключением статьи 6, абзацев второго, седьмого, двенадцатого - четырнадцатого части 5 статьи 7, части 3 статьи 13, части 2 статьи 18, статей 30 и 40 указанного технического регламента)'}, {'nameNpa': '«Пищевая продукция в части ее маркировки»', 'numberNpa': '09.12.2011', 'title': 'Технический регламент Таможенного союза ТР ТС 022/2011 (весь регламент)'}, {'nameNpa': '«О безопасности мяса и мясной продукции» \n', 'numberNpa': '09.10.2013', 'title': 'Технический регламент Таможенного союза ТР ТС 034/2013 (весь регламент за исключением пунктов 1, 2, 3, 4, 5, 6, 7, 8, 26, 27, 28, 29, 30, 31, 32, 33, 34, 35, 36, 37, 38, 39, 40, 41, 42, 43, 44, 45, 46, 47, 48, 53, 54 и абзаца второго пункта 99 указанного технического регламента)\n'}, {'nameNpa': '«О безопасности молока и молочной продукции»', 'numberNpa': '09.10.2013', 'title': 'Технический регламент Таможенного союза ТР ТС 033/2013 (весь регламент, за исключением пунктов 13, 14, 97, 98 и 115 указанного технического регламента)'}, {'nameNpa': '«О безопасности рыбы и рыбной продукции»', 'numberNpa': '18.10.2016', 'title': 'Технический регламент Евразийского экономического союза ТР ЕАЭС 040/2016 Разделы IV и V (за исключением пункта 14), VI, VII, VIII, IX, X, XI (за исключением пунктов 85, 86), XII'}, {'nameNpa': '«Технический регламент на соковую продукцию из фруктов и овощей»', 'numberNpa': '09.12.2011', 'title': ' Технический регламент Таможенного союза ТР ТС 023/2011 (ст. 3, 4, 5, 6, 7, 8)'}, {'nameNpa': ' «Технический регламент на масложировую продукцию»', 'numberNpa': '09.12.2011', 'title': 'Технический регламент Таможенного союза (ТР ТС 024/2011 – весь регламент)'}, {'nameNpa': ' «О безопасности упакованной питьевой воды, включая природную минеральную воду»', 'numberNpa': '23.06.2017', 'title': 'Технический регламент Евразийского экономического союза ТР ЕАЭС 044/2017 (раздел III, IV, V, VI, VII, X)'}, {'nameNpa': ' О техническом регламенте Евразийского экономического союза О безопасности мяса птицы и продукции его переработки (вместе с ТР ЕАЭС 051/2021. Технический регламент Евразийского экономического Союза О безопасности мяса птицы и продукции его переработки)', 'numberNpa': '29.10.2021', 'title': 'Решение Совета Евразийской экономической комиссии N 110 Разделы III, IV, V, X, XII, XIII '}, {'nameNpa': '«Санитарно-эпидемиологические требования к содержанию территорий городских и сельских поселений, к водным объектам, питьевой воде и питьевому водоснабжению, атмосферному воздуху, почвам, жилым помещениям, эксплуатации производственных, общественных помещений, организации и проведению санитарно-противоэпидемиологических (профилактических) мероприятий»', 'numberNpa': '28.01.2021', 'title': 'СанПиН 2.1.3684-21 Разделы II,IV,VIII,X'}, {'nameNpa': '«Санитарно-эпидемиологические требования к организации общественного питания населения»', 'numberNpa': '27.10.2020', 'title': 'СанПиН 2.3/2.4.3590-20 (весь документ);'}, {'nameNpa': '«Гигиенические нормативы и требования к обеспечению безопасности и (или) безвредности для человека факторов среды обитания»', 'numberNpa': '28.01.2021', 'title': 'СанПиН 1.2.3685-21 (весь документ)'}, {'nameNpa': '«Санитарно-эпидемиологические требования к организациям воспитания и обучения, отдыха и оздоровления детей и молодежи»', 'numberNpa': '28.09.2020', 'title': 'СП 2.4.3648-20 (весь документ)'}, {'nameNpa': 'Санитарно-эпидемиологические требования к условиям труда', 'numberNpa': '02.12.2020', 'title': 'СП 2.1.3678-20 Разделы I, II, IX'}, {'nameNpa': 'СП 3.1.3597-20 Профилактика новой коронавирусной инфекции (COVID-19)', 'numberNpa': '02.12.2020', 'title': 'СП 2.2.3670-20 (весь документ)'}, {'nameNpa': ' Санитарно-эпидемиологические требования по профилактике инфекционных болезней', 'numberNpa': '28.01.2021', 'title': 'СанПиН 3.3686-21 (весь документ); '}, {'nameNpa': '«Профилактика новой коронавирусной инфекции (COVID-19)»', 'numberNpa': '22.05.2020', 'title': 'СП 3.1.3597-20(весь документ)'}, {'nameNpa': '«Санитарно-эпидемиологические требования к устройству, содержанию и организации работы образовательных организаций и других объектов социальной инфраструктуры для детей и молодежи в условиях распространения новой коронавирусной инфекции (COVID-19)»', 'numberNpa': '30.06.2020', 'title': 'СП 3.1/2.4.3598-20 (весь документ)'}, {'nameNpa': 'Об утверждении национального календаря профилактических прививок и календаря профилактических прививок по эпидемическим показаниям', 'numberNpa': '06.12.2021', 'title': 'Приказ Минздрава России № 1122н (весь документ);'}, {'nameNpa': 'Об утверждении Порядка проведения обязательных предварительных и периодических медицинских осмотров работников, предусмотренных частью четвертой статьи 213 Трудового кодекса Российской Федерации, перечня медицинских противопоказаний к осуществлению работ с вредными и (или) опасными производственными факторами, а также работам, при выполнении которых проводятся обязательные предварительные и периодические медицинские осмотры', 'numberNpa': '28.01.2021', 'title': 'Приказ Министерства здравоохранения Российской Федерации № 29н. (п.4.1приложения к Порядку проведения обязательных предварительных и периодических медицинских осмотров работников, предусмотренных частью четвертой статьи 213 Трудового кодекса Российской Федерации.'}], 'resolved': False, 'resultEmpty': True, 'resultEmptyOrLate': False, 'resultInfoTypeCodes': [], 'resultViolationKnm': False, 'riskCategory': ['чрезвычайно высокий риск'], 'riskCategoryAndDangerClass': ['чрезвычайно высокий риск / Не применяется'], 'sezRegistryExists': False, 'signed': True, 'smevInfoType': None, 'smevMessageType': None, 'smevReceivedAt': None, 'smevReceivedAtEn': None, 'smevReceivedAtMonth': None, 'smevReceivedAtYear': None, 'spvRegistryExists': False, 'startDate': '03.07.2023', 'startDateEn': '2023-07-03', 'status': 'Исключена', 'statusEgrul': 'Найден', 'statusId': 15, 'stopDate': '14.07.2023', 'stopDateEn': '2023-07-14', 'subjectTypeId': 0, 'supervisionType': 'Федеральный государственный санитарно-эпидемиологический контроль (надзор)', 'supervisionTypeId': 4, 'torRegistryExists': False, 'updatePlanDate': None, 'updatePlanDateLong': None, 'version': 'ERKNM', 'violationLawsuitTypeCodes': [], 'violationTypeCodes': [], 'year': 2023}
2023-01-19 12:42:10,875 - [WARNING] - direct_sql.py - new_insert_in_database(269) - Проведена повторная попытка внесения с параметром special, результат неудачный.
2023-01-19 12:42:10,875 - [INFO] - direct_sql.py - database_inserts_conductor_for_multiprocessing(132) - Возникла ошибка, с которой не удалось справиться...
2023-01-19 12:42:10,875 - [INFO] - direct_sql.py - new_insert_in_database(268) - {'actCreateDate': None, 'actCreateDateEn': None, 'addresses': ['614068, Край Пермский, Город Пермь, Улица Екатерининская, 174, ', '614068, Пермский край, г. Пермь, ул. Екатерининская, 174'], 'admLevelId': 50001, 'appealed': False, 'approveDocOrderDate': None, 'approveDocOrderNum': None, 'approveDocRequestDate': None, 'approveDocRequestNum': None, 'approveDocs': [], 'approveRequired': False, 'approved': False, 'approvedErknm': 'Отказано', 'chlistCount': 1, 'chlistFilledCount': 1, 'chlistFillingIndicationTypeId': [], 'collaboratingOrganizations': [], 'collaboratingOrganizationsIds': [], 'comment': 'п. 11 (4) постановления Правительства РФ от 10.03.2022 № 336 (в редакции постановления Правительства РФ от 01.10.2022 № 1743)', 'controllingOrganization': 'Управления Роспотребнадзора по Пермскому краю', 'controllingOrganizationId': 10001019671, 'createPlanDate': None, 'createPlanDateLong': None, 'createdByErpDb': False, 'createdById': 169549, 'dataNotEqualEGRUL': False, 'dataSetNotInTime': False, 'deleted': False, 'directDurationDays': None, 'disapprove': False, 'district': 'Пермский край', 'districtId': 1033570000000001, 'durationDays': 10, 'durationHours': None, 'erknmActViolationIds': [], 'erknmResultKindDecisionIds': [], 'erpId': '59230041000103450113', 'events': [{'startDate': '06.06.2023', 'stopDate': '19.06.2023', 'title': 'Осмотр'}, {'startDate': '06.06.2023', 'stopDate': '19.06.2023', 'title': 'Получение письменных объяснений'}, {'startDate': '06.06.2023', 'stopDate': '19.06.2023', 'title': 'Истребование документов'}, {'startDate': '06.06.2023', 'stopDate': '19.06.2023', 'title': 'Отбор проб (образцов)'}, {'startDate': '06.06.2023', 'stopDate': '19.06.2023', 'title': 'Инструментальное обследование'}, {'startDate': '06.06.2023', 'stopDate': '19.06.2023', 'title': 'Испытание'}, {'startDate': '06.06.2023', 'stopDate': '19.06.2023', 'title': 'Экспертиза'}], 'federalLaw': '248', 'federalLawId': 3, 'fullFieldViolationKnm': False, 'hasViolations': False, 'id': 13522230, 'inn': '5902291678', 'inspectorFullName': [], 'isFromSmev': False, 'isHasApproveDocs': False, 'isHasCollaboratingOrganization': False, 'isHasRequirements': True, 'isHasViolationTerm': False, 'isPm': False, 'kind': 'Выездная проверка', 'knmAnnulled': False, 'knmRejected': False, 'knmType': 'Плановое КНМ', 'knmTypeId': 4, 'legalBasisDocName': [], 'links': [], 'mspCategory': ['Не является субъектом МСП'], 'noPunishment': False, 'notifyLate': False, 'objectsKind': ['Деятельность по организации отдыха детей и их оздоровления, в том числе лагеря с дневным пребыванием', 'организации отдыха детей и их оздоровления, в том числе лагеря с дневным пребыванием'], 'objectsSubKind': ['Деятельность по организации отдыха детей и их оздоровления, в том числе лагеря с дневным пребыванием', 'организации отдыха детей и их оздоровления, в том числе лагеря с дневным пребыванием'], 'objectsType': ['Деятельность и действия', 'Производственные объекты'], 'ogrn': '1025900522097', 'oldKnm': None, 'oldPlan': None, 'orderDone': False, 'organizationName': 'МУНИЦИПАЛЬНОЕ АВТОНОМНОЕ ОБЩЕОБРАЗОВАТЕЛЬНОЕ УЧРЕЖДЕНИЕ СРЕДНЯЯ ОБЩЕОБРАЗОВАТЕЛЬНАЯ ШКОЛА № 6 ИМЕНИ ГЕРОЯ РОССИИ С.Л.ЯШКИНА Г.ПЕРМИ', 'organizationsInn': ['5902291678'], 'organizationsName': ['МУНИЦИПАЛЬНОЕ АВТОНОМНОЕ ОБЩЕОБРАЗОВАТЕЛЬНОЕ УЧРЕЖДЕНИЕ СРЕДНЯЯ ОБЩЕОБРАЗОВАТЕЛЬНАЯ ШКОЛА № 6 ИМЕНИ ГЕРОЯ РОССИИ С.Л.ЯШКИНА Г.ПЕРМИ'], 'organizationsOgrn': ['1025900522097'], 'planId': '2023051009', 'prosecutorOrganization': 'Прокуратура Пермского края', 'prosecutorOrganizationId': 1581, 'publishedStatus': 'UNPUBLISHED', 'reasons': [201], 'reasonsList': [{'assignmentDate': None, 'assignmentDateEn': None, 'assignmentNumber': None, 'date': '16.06.2022', 'dateEn': '2022-06-16', 'requirementDetails': None, 'text': '(ФЗ 248) Истечение установленного федеральным законом о виде контроля, положением о виде контроля период времени с даты окончания проведения последнего планового контрольного (надзорного) мероприятия'}], 'recEmptyOrLate': False, 'regDateEgrul': '16.09.2022', 'regDateEgrulEn': '2022-09-16', 'regLate': False, 'regTypes': [], 'requirements': 10, 'requirementsList': [{'nameNpa': '4.\tФедеральный закон от 18.06.2001 г. № 77-ФЗ «О предупреждении распространения туберкулеза в Российской Федерации»', 'numberNpa': '18.06.2001', 'title': '4.\tФедеральный закон от 18.06.2001 г. № 77-ФЗ «О предупреждении распространения туберкулеза в Российской Федерации»'}, {'nameNpa': 'Федеральный закон Российской Федерации от 17.09.1998 г. № 157-ФЗ «Об иммунопрофилактике инфекционных болезней»', 'numberNpa': '17.09.1998', 'title': 'Федеральным законом Российской Федерации от 17.09.1998 г. № 157-ФЗ «Об иммунопрофилактике инфекционных болезней»'}, {'nameNpa': '2.\tФедеральный закон от 23.02.2013 г. № 15-ФЗ «Об охране здоровья граждан от воздействия окружающего табачного дыма и последствий потребления табака»', 'numberNpa': '23.02.2013', 'title': '2.\tФедеральный закон от 23.02.2013 г. № 15-ФЗ «Об охране здоровья граждан от воздействия окружающего табачного дыма и последствий потребления табака»'}, {'nameNpa': 'Федеральный закон Российской Федерации от 30.03.1999 г. № 52-ФЗ «О санитарно-эпидемиологическом благополучии населения»', 'numberNpa': '30.03.1999', 'title': 'Федеральным законом Российской Федерации от 30.03.1999 г. № 52-ФЗ «О санитарно-эпидемиологическом благополучии населения»'}, {'nameNpa': 'СП 2.4.3648-20 «Санитарно-эпидемиологические требования к организациям воспитания и обучения, отдыха и оздоровления детей и молодежи»', 'numberNpa': '28.09.2020', 'title': 'СП 2.4.3648-20 «Санитарно-эпидемиологические требования к организациям воспитания и обучения, отдыха и оздоровления детей и молодежи»'}, {'nameNpa': 'СанПиН 1.2.3685-21 «Гигиенические нормативы и требования к обеспечению безопасности и (или) безвредности для человека факторов среды обитания»', 'numberNpa': '28.01.2021', 'title': 'СанПиН 1.2.3685-21 «Гигиенические нормативы и требования к обеспечению безопасности и (или) безвредности для человека факторов среды обитания»'}, {'nameNpa': 'СанПиН 2.1.3684-21 Санитарно-эпидемиологические требования к содержанию территорий городских и сельских поселений, к водным объектам, питьевой воде и питьевому водоснабжению, атмосферному воздуху, почвам, жилым помещениям, эксплуатации производственных, общественных помещений, организации и проведению санитарно-противоэпидемических (профилактических) мероприятий', 'numberNpa': '28.01.2021', 'title': 'СанПиН 2.1.3684-21 Санитарно-эпидемиологические требования к содержанию территорий городских и сельских поселений, к водным объектам, питьевой воде и питьевому водоснабжению, атмосферному воздуху, почвам, жилым помещениям, эксплуатации производственных, общественных помещений, организации и проведению санитарно-противоэпидемических (профилактических) мероприятий'}, {'nameNpa': 'СанПиН 3.3686-21 Санитарно-эпидемиологические требования по профилактике инфекционных болезней', 'numberNpa': '28.01.2021', 'title': 'СанПиН 3.3686-21 Санитарно-эпидемиологические требования по профилактике инфекционных болезней'}, {'nameNpa': 'Техническим регламентом Евразийского экономического союза ТР ЕАЭС 044/2017 «О безопасности упакованной питьевой воды, включая природную минеральную воду»', 'numberNpa': '23.06.2017', 'title': 'Техническим регламентом Евразийского экономического союза ТР ЕАЭС 044/2017 «О безопасности упакованной питьевой воды, включая природную минеральную воду»'}, {'nameNpa': 'СанПиН 2.3/2.4.3590-20 «Санитарно-эпидемиологические требования к организации общественного питания населения»', 'numberNpa': '29.10.2020', 'title': 'СанПиН 2.3/2.4.3590-20 «Санитарно-эпидемиологические требования к организации общественного питания населения»'}], 'resolved': False, 'resultEmpty': True, 'resultEmptyOrLate': False, 'resultInfoTypeCodes': [], 'resultViolationKnm': False, 'riskCategory': ['чрезвычайно высокий риск', 'чрезвычайно высокий риск'], 'riskCategoryAndDangerClass': ['чрезвычайно высокий риск', 'чрезвычайно высокий риск'], 'sezRegistryExists': False, 'signed': True, 'smevInfoType': None, 'smevMessageType': None, 'smevReceivedAt': None, 'smevReceivedAtEn': None, 'smevReceivedAtMonth': None, 'smevReceivedAtYear': None, 'spvRegistryExists': False, 'startDate': '06.06.2023', 'startDateEn': '2023-06-06', 'status': 'Исключена', 'statusEgrul': 'Найден', 'statusId': 15, 'stopDate': '19.06.2023', 'stopDateEn': '2023-06-19', 'subjectTypeId': 0, 'supervisionType': 'Федеральный государственный санитарно-эпидемиологический контроль (надзор)', 'supervisionTypeId': 4, 'torRegistryExists': False, 'updatePlanDate': None, 'updatePlanDateLong': None, 'version': 'ERKNM', 'violationLawsuitTypeCodes': [], 'violationTypeCodes': [], 'year': 2023}
2023-01-19 12:42:10,876 - [WARNING] - direct_sql.py - new_insert_in_database(269) - Проведена повторная попытка внесения с параметром special, результат неудачный.
2023-01-19 12:42:10,877 - [INFO] - direct_sql.py - database_inserts_conductor_for_multiprocessing(132) - Возникла ошибка, с которой не удалось справиться...
2023-01-19 12:42:10,877 - [INFO] - direct_sql.py - database_inserts_conductor_for_multiprocessing(133) - 
2023-01-19 12:42:10,889 - [ERROR] - direct_sql.py - new_insert_in_database(267) - (1040, 'ny connections')
2023-01-19 12:42:10,889 - [INFO] - direct_sql.py - new_insert_in_database(268) - {'actCreateDate': None, 'actCreateDateEn': None, 'addresses': ['663123, КРАЙ КРАСНОЯРСКИЙ, РАЙОН ПИРОВСКИЙ, СЕЛО КИРИКОВО, УЛИЦА ЗЕЛЕНАЯ, 1, Д, ', '663123, КРАЙ КРАСНОЯРСКИЙ, РАЙОН ПИРОВСКИЙ, СЕЛО КИРИКОВО, УЛИЦА ЗЕЛЕНАЯ, 1, Д, ', '663123, КРАЙ КРАСНОЯРСКИЙ, РАЙОН ПИРОВСКИЙ, СЕЛО КИРИКОВО, УЛИЦА ЗЕЛЕНАЯ, 1, Д, ', '663123, КРАЙ КРАСНОЯРСКИЙ, РАЙОН ПИРОВСКИЙ, СЕЛО КИРИКОВО, УЛИЦА ЗЕЛЕНАЯ, 1, Д, ', '663123, КРАЙ КРАСНОЯРСКИЙ, РАЙОН ПИРОВСКИЙ, СЕЛО КИРИКОВО, УЛИЦА ЗЕЛЕНАЯ, 1, Д, ', '663123, КРАЙ КРАСНОЯРСКИЙ, РАЙОН ПИРОВСКИЙ, СЕЛО КИРИКОВО, УЛИЦА ЗЕЛЕНАЯ, 1, Д, ', '663123, КРАЙ КРАСНОЯРСКИЙ, РАЙОН ПИРОВСКИЙ, СЕЛО КИРИКОВО, УЛИЦА ЗЕЛЕНАЯ, 1, Д, '], 'admLevelId': 50001, 'appealed': False, 'approveDocOrderDate': None, 'approveDocOrderNum': None, 'approveDocRequestDate': None, 'approveDocRequestNum': None, 'approveDocs': [], 'approveRequired': False, 'approved': False, 'approvedErknm': 'Отказано', 'chlistCount': 2, 'chlistFilledCount': 2, 'chlistFillingIndicationTypeId': [], 'collaboratingOrganizations': [], 'collaboratingOrganizationsIds': [], 'comment': 'в соответствии с п. 11(4) постановления Правительства РФ от 10.03.2022 № 336', 'controllingOrganization': 'Управление Роспотребнадзора по Красноярскому краю', 'controllingOrganizationId': 10001011837, 'createPlanDate': None, 'createPlanDateLong': None, 'createdByErpDb': False, 'createdById': 212527, 'dataNotEqualEGRUL': False, 'dataSetNotInTime': False, 'deleted': False, 'directDurationDays': None, 'disapprove': False, 'district': 'Красноярский край', 'districtId': 1035040000000001, 'durationDays': 10, 'durationHours': 70, 'erknmActViolationIds': [], 'erknmResultKindDecisionIds': [], 'erpId': '24230041000102645133', 'events': [{'startDate': '01.09.2023', 'stopDate': '14.09.2023', 'title': 'Осмотр'}, {'startDate': '01.09.2023', 'stopDate': '14.09.2023', 'title': 'Опрос'}, {'startDate': '01.09.2023', 'stopDate': '14.09.2023', 'title': 'Получение письменных объяснений'}, {'startDate': '01.09.2023', 'stopDate': '14.09.2023', 'title': 'Истребование документов'}, {'startDate': '01.09.2023', 'stopDate': '14.09.2023', 'title': 'Отбор проб (образцов)'}, {'startDate': '01.09.2023', 'stopDate': '14.09.2023', 'title': 'Инструментальное обследование'}, {'startDate': '01.09.2023', 'stopDate': '14.09.2023', 'title': 'Испытание'}, {'startDate': '01.09.2023', 'stopDate': '14.09.2023', 'title': 'Экспертиза'}], 'federalLaw': '248', 'federalLawId': 3, 'fullFieldViolationKnm': False, 'hasViolations': False, 'id': 12717252, 'inn': '2431001556', 'inspectorFullName': [], 'isFromSmev': False, 'isHasApproveDocs': False, 'isHasCollaboratingOrganization': False, 'isHasRequirements': True, 'isHasViolationTerm': False, 'isPm': False, 'kind': 'Выездная проверка', 'knmAnnulled': False, 'knmRejected': False, 'knmType': 'Плановое КНМ', 'knmTypeId': 4, 'legalBasisDocName': [], 'links': [], 'mspCategory': ['Не является субъектом МСП'], 'noPunishment': False, 'notifyLate': False, 'objectsKind': ['Деятельность общеобразовательных организаций', 'мясо и мясные продукты', 'молоко, молочные продукты', 'рыба, рыбные продукты и др. гидробионты', 'плодовоовощная продукция', 'продукция предприятий общественного питания', 'здания, помещения, сооружения, территория, оборудование, устройства, предметы, транспортные средства и другие объекты, которыми контролируемые лица владеют и (или) пользуются в рамках осуществления деятельности'], 'objectsSubKind': ['Деятельность общеобразовательных организаций', 'мясо и мясные продукты', 'молоко, молочные продукты', 'рыба, рыбные продукты и др. гидробионты', 'плодовоовощная продукция', 'продукция предприятий общественного питания', 'здания, помещения, сооружения, территория, оборудование, устройства, предметы, транспортные средства и другие объекты, которыми контролируемые лица владеют и (или) пользуются в рамках осуществления деятельности'], 'objectsType': ['Деятельность и действия', 'Результаты деятельности', 'Результаты деятельности', 'Результаты деятельности', 'Результаты деятельности', 'Результаты деятельности', 'Производственные объекты'], 'ogrn': '1022401272574', 'oldKnm': None, 'oldPlan': None, 'orderDone': False, 'organizationName': 'МУНИЦИПАЛЬНОЕ БЮДЖЕТНОЕ ОБЩЕОБРАЗОВАТЕЛЬНОЕ УЧРЕЖДЕНИЕ КИРИКОВСКАЯ СРЕДНЯЯ ШКОЛА', 'organizationsInn': ['2431001556'], 'organizationsName': ['МУНИЦИПАЛЬНОЕ БЮДЖЕТНОЕ ОБЩЕОБРАЗОВАТЕЛЬНОЕ УЧРЕЖДЕНИЕ КИРИКОВСКАЯ СРЕДНЯЯ ШКОЛА'], 'organizationsOgrn': ['1022401272574'], 'planId': '2023050264', 'prosecutorOrganization': 'Прокуратура Красноярского края', 'prosecutorOrganizationId': 2169, 'publishedStatus': 'UNPUBLISHED', 'reasons': [201], 'reasonsList': [{'assignmentDate': None, 'assignmentDateEn': None, 'assignmentNumber': None, 'date': '18.04.2022', 'dateEn': '2022-04-18', 'requirementDetails': None, 'text': '(ФЗ 248) Истечение установленного федеральным законом о виде контроля, положением о виде контроля период времени с даты окончания проведения последнего планового контрольного (надзорного) мероприятия'}], 'recEmptyOrLate': False, 'regDateEgrul': '26.07.2022', 'regDateEgrulEn': '2022-07-26', 'regLate': False, 'regTypes': [], 'requirements': 33, 'requirementsList': [{'nameNpa': '«О качестве и безопасности пищевых продуктов»', 'numberNpa': '02.01.2000', 'title': 'ст.: 3, 15, 16, 17, 18, 19, 20, 22, 23, 24, 25.1, 25.2, 26.1 Федерального закона № 29-ФЗ'}, {'nameNpa': '«О водоснабжении и водоотведении»', 'numberNpa': '07.12.2011', 'title': '№ 416-ФЗ гл. 3, 4'}, {'nameNpa': '«О санитарно-эпидемиологическом благополучии населения»', 'numberNpa': '30.03.1999', 'title': '№ 52-ФЗ статьи: 15, 17, 18, 19, 20, 21, 22, 23, 24, 25, 27, 28, 32, 34, 35, 36'}, {'nameNpa': '«О предупреждении распространения туберкулёза в Российской Федерации» ', 'numberNpa': '18.06.2001', 'title': '№ 77-ФЗ - ст. 8, 16 '}, {'nameNpa': '«Об утверждении Порядка проведения обязательных предварительных и периодических медицинских осмотров работников, предусмотренных частью четвертой статьи 213 Трудового кодекса Российской Федерации, перечня медицинских противопоказаний к осуществлению работ с вредными и (или) опасными производственными факторами, а также работам, при выполнении которых проводятся обязательные предварительные и периодические медицинские осмотры». ', 'numberNpa': '28.01.2021', 'title': 'Приказ Министерства здравоохранения РФ № 29н '}, {'nameNpa': '«О техническом регулировании» ', 'numberNpa': '27.12.2002', 'title': '№ 184-ФЗ ст. 24, 27, 32 '}, {'nameNpa': '«Об охране здоровья граждан от воздействия окружающего табачного дыма и последствий потребления табака»', 'numberNpa': '23.02.2013', 'title': 'ст.: 10, 12, 19 Федерального закона № 15-ФЗ '}, {'nameNpa': '«Об утверждении перечня вредных и (или) опасных производственных факторов и работ, при выполнении которых проводятся обязательные предварительные медицинские осмотры при поступлении на работу и периодические медицинские осмотры»', 'numberNpa': '31.12.2020', 'title': 'Приказ Министерства труда и социальной защиты Российской Федерации, Министерства здравоохранения Российской Федерации № 988н/1420н '}, {'nameNpa': 'О безопасности продукции, предназначенной для детей и подростков', 'numberNpa': '23.09.2011', 'title': 'ст. 3, 4, 5, 6, 7, 8, 9, 10, 11 и 13 TP ТС 007/2011'}, {'nameNpa': '«Технический регламент на соковую продукцию из фруктов и овощей», утвержденный Решением Комиссии Таможенного союза от 09.12.2011 г. № 882', 'numberNpa': '09.12.2011', 'title': 'ст.ст. 3, 4, 5, 6, 7 и 8 Технического регламента Таможенного союза ТР ТС 023/2011, № 882'}, {'nameNpa': 'О безопасности упакованной питьевой воды, включая природную минеральную воду', 'numberNpa': '23.06.2017', 'title': 'разделы III, IV, V, VI, VII и X TP ЕАЭС 044/2017 \n\n'}, {'nameNpa': '«Санитарно-эпидемиологические требования к организациям воспитания и обучения, отдыха и оздоровления детей и молодежи»', 'numberNpa': '28.09.2020', 'title': 'СП 2.4.3648-20 раздел I п.п. 1.1., 1.2., 1.3., 1.4., 1.5., 1.6., 1.7., 1.8., 1.9., 1.10., 1.12., раздел II п.п. 2.1., 2.1.1., 2.1.2., 2.1.3, 2.2., 2.2.1., 2.2.2., 2.2.3., 2.2.4., 2.2.5., 2.2.6., 2.3., 2.3.1., 2.3.2., 2.3.3., 2.4., 2.4.1., 2.4.2., 2.4.3., 2.4.4., 2.4.5., 2.4.6., 2.4.6.1., 2.4.6.2., 2.4.6.3., 2.4.9., 2.4.10., 2.4., 2.4.9., 2.4.10., 2.4.11., 2.4.12., 2.4.13., 2.5.1., 2.5.2., 2.5.3.,2.6.1.,2.6.2.,2.6.3., 2.6.4., 2.6.5., 2.6.6., 2.7., 2.7.1., 2.7.2.,2.7.3., 2.7.4., 2.7.5., 2.8., 2.8.1., 2.8.2., 2.8.3., 2.8.4., 2.8.5., 2.8.6., 2.8.7., 2.8.8., 2.8.9., 2.8.10., 2.9., 2.9.1., 2.9.2., 2.9.3., 2.9.4., 2.9.5., 2.9.7., 2.10., 2.10.1., 2.10.2., 2.10.3., 2.10.4., 2.11., 2.11.1., 2.11.2., 2.11.3., 2.11.4., 2.11.6., 2.11.7., 2.11.8., 2.11.9., раздел III п.п. 3.4., 3.4.1., 3.4.2., 3.4.3., 3.4.4., 3.4.5., 3.4.6., 3.4.7., 3.4.8., 3.4.9., 3.4.10., 3.4.11., 3.4.12., 3.4.13., 3.4.14., 3.4.15., 3.4.16., 3.4.17., 3.4.18., 3.4.19., 3.5., 3.5.1., 3.5.2., 3.5.3., 3.5.4., 3.5.5., 3.5.6., 3.5.7., 3.5.8., 3.5.9., 3.5.10., 3.5.11, 3.5.12., 3.5.13., 3.5.14., 3.5.15.'}, {'nameNpa': '«Санитарно-эпидемиологические требования к эксплуатации помещений, зданий, сооружений, оборудования и транспорта, а также условиям деятельности хозяйствующих субъектов, осуществляющих продажу товаров, выполнение работ или оказание услуг»', 'numberNpa': '24.12.2020', 'title': 'п. 1.1 – 3.5, раздел IX санитарных правил СП 2.1.3678-20 '}, {'nameNpa': '«Санитарно-эпидемиологические требования к организации общественного питания населения»', 'numberNpa': '27.10.2020', 'title': 'разделы I-V, VIII СанПиН 2.3/2.4.3590-20 '}, {'nameNpa': ' «Гигиенические нормативы и требования к обеспечению безопасности и (или) безвредности для человека факторов среды обитания»', 'numberNpa': '28.01.2021', 'title': 'СанПиН 1.2.3685-21 раздел I, III, V '}, {'nameNpa': '«Санитарно-эпидемиологические требования к содержанию территорий городских и сельских поселений, к водным объектам, питьевой воде и питьевому водоснабжению населения, атмосферному воздуху, почвам, жилым помещениям, эксплуатации производственных, общественных помещений, организации и проведению санитарно-противоэпидемических (профилактических) мероприятий»', 'numberNpa': '28.01.2021', 'title': 'разделы I-XIII СанПиН 2.1.3684-21 '}, {'nameNpa': '«Санитарно-эпидемиологические требования по профилактике инфекционных болезней»', 'numberNpa': '28.01.2021', 'title': 'главы I-III, VIII, XIII, XXV-XXXI, XXXIV, XLII, XLIII санитарных правил и норм СанПиН 3.3686-21 '}, {'nameNpa': 'Санитарно-эпидемиологические требования к устройству, содержанию и организации работы образовательных организаций и других объектов социальной инфраструктуры для детей и молодежи в условиях распространения новой коронавирусной инфекции (COVID-19)', 'numberNpa': '30.06.2020', 'title': 'раздел I, II, п. 3.1 СП 3.1/2.4.3598-20'}, {'nameNpa': '«О проведении профилактических прививок отдельным группам граждан по эпидемическим показаниям»', 'numberNpa': '23.07.2021', 'title': 'Постановление Главного государственного санитарного врача по Красноярскому краю № 43 '}, {'nameNpa': '«О безопасности парфюмерно-косметической продукции»', 'numberNpa': '23.09.2011', 'title': 'ст. 4, 5, 5.1 Технического регламента Таможенного союза ТР ТС 009/2011'}, {'nameNpa': 'О безопасности мебельной продукции', 'numberNpa': '15.06.2012', 'title': 'ст. 4, 5, 6 и 7 TP ТС 025/2012'}, {'nameNpa': 'О безопасности пищевой продукции', 'numberNpa': '09.12.2011', 'title': 'положения TP ТС 021/2011 (за исключением статьи 6, абзацев второго, седьмого, двенадцатого - четырнадцатого части 5 статьи 7, части 3 статьи 13, части 2 статьи 18, статей 30 и 40)\n\n'}, {'nameNpa': 'Технический регламент на масложировую продукцию ', 'numberNpa': '09.12.2011', 'title': 'ст. 5, 6, 8, 18, 20 TP ТС 024/2011 '}, {'nameNpa': '«Об иммунопрофилактике населения» ', 'numberNpa': '17.09.1998', 'title': '№ 157-ФЗ - ст. 3, 5, 9, 10 '}, {'nameNpa': '«Пищевая продукция в части ее маркировки»', 'numberNpa': '09.12.2011', 'title': 'ст. 3 – 5 технического регламента Таможенного союза ТР ТС 022/2011 , утвержденного решением Комиссии Таможенного союза \n9 декабря 2011 г. № 881\n'}, {'nameNpa': 'О безопасности молока и молочной продукции', 'numberNpa': '09.10.2013', 'title': 'TP ТС 033/2013 (за исключением п. 13, 14, 97, 98 и 115)'}, {'nameNpa': '«О безопасности упаковки» ', 'numberNpa': '16.08.2011', 'title': 'статьи 3, 4, 5, 6, 7, 8\nТР ТС 005/2011'}, {'nameNpa': ' О безопасности мяса и мясной продукции ', 'numberNpa': '09.10.2013', 'title': 'TP ТС 034/2013 (за искл. п. 1, 2, 3, 4, 5, 6, 7, 8, 26, 27, 28, 29, 30, 31, 32, 33, 34, 35, 36, 37, 38, 39, 40, 41, 42, 43, 44, 45, 46, 47, 48, 53, 54 и абзаца второго пункта 99)'}, {'nameNpa': 'О безопасности рыбы и рыбной продукции', 'numberNpa': '18.10.2016', 'title': 'разделы IV и V (за исключением пункта 14), VI, VII, VIII, IX, X, XI (за исключением пунктов 85, 86) и XII TP ЕАЭС 040/2016 '}, {'nameNpa': ' О безопасности зерна', 'numberNpa': '09.12.2011', 'title': 'ст. 3, 4, 6 и 8 TP ТС 015/2011 '}, {'nameNpa': '«О безопасности отдельных видов специализированной пищевой продукции, в том числе диетического лечебного и диетического профилактического питания» ', 'numberNpa': '15.06.2012', 'title': 'ст.ст. 3 – 7, ст.ст. 9 – 11 Технического регламента Таможенного союза ТР ТС 027/2012 '}, {'nameNpa': 'Требования безопасности пищевых добавок, ароматизаторов и технологических вспомогательных средств ', 'numberNpa': '20.07.2012', 'title': 'TP ТС 029/2012 ст. 7, 9, 10, 11 '}, {'nameNpa': ' О безопасности зерна', 'numberNpa': '09.12.2011', 'title': 'ст. 3, 4, 6 и 8 TP ТС 015/2011 '}], 'resolved': False, 'resultEmpty': True, 'resultEmptyOrLate': False, 'resultInfoTypeCodes': [], 'resultViolationKnm': False, 'riskCategory': ['чрезвычайно высокий риск', 'чрезвычайно высокий риск', 'чрезвычайно высокий риск', 'чрезвычайно высокий риск', 'чрезвычайно высокий риск', 'чрезвычайно высокий риск', 'чрезвычайно высокий риск'], 'riskCategoryAndDangerClass': ['чрезвычайно высокий риск / Не применяется', 'чрезвычайно высокий риск / Не применяется', 'чрезвычайно высокий риск / Не применяется', 'чрезвычайно высокий риск / Не применяется', 'чрезвычайно высокий риск / Не применяется', 'чрезвычайно высокий риск / Не применяется', 'чрезвычайно высокий риск'], 'sezRegistryExists': False, 'signed': True, 'smevInfoType': None, 'smevMessageType': None, 'smevReceivedAt': None, 'smevReceivedAtEn': None, 'smevReceivedAtMonth': None, 'smevReceivedAtYear': None, 'spvRegistryExists': False, 'startDate': '01.09.2023', 'startDateEn': '2023-09-01', 'status': 'Исключена', 'statusEgrul': 'Выписка не может быть предоставлена в текущий момент', 'statusId': 15, 'stopDate': '14.09.2023', 'stopDateEn': '2023-09-14', 'subjectTypeId': 0, 'supervisionType': 'Федеральный государственный санитарно-эпидемиологический контроль (надзор)', 'supervisionTypeId': 4, 'torRegistryExists': False, 'updatePlanDate': None, 'updatePlanDateLong': None, 'version': 'ERKNM', 'violationLawsuitTypeCodes': [], 'violationTypeCodes': [], 'year': 2023}
2023-01-19 12:42:10,890 - [WARNING] - direct_sql.py - new_insert_in_database(269) - Проведена повторная попытка внесения с параметром special, результат неудачный.
2023-01-19 12:42:10,890 - [INFO] - direct_sql.py - database_inserts_conductor_for_multiprocessing(132) - Возникла ошибка, с которой не удалось справиться...
2023-01-19 12:42:10,891 - [INFO] - direct_sql.py - database_inserts_conductor_for_multiprocessing(133) - 
2023-01-19 12:42:10,901 - [ERROR] - direct_sql.py - new_insert_in_database(267) - (1040, 'ny connections')
2023-01-19 12:42:10,901 - [ERROR] - direct_sql.py - new_insert_in_database(267) - (1040, 'ny connections')
2023-01-19 12:42:10,901 - [ERROR] - direct_sql.py - new_insert_in_database(267) - (1040, 'ny connections')
2023-01-19 12:42:10,901 - [INFO] - direct_sql.py - new_insert_in_database(268) - {'actCreateDate': None, 'actCreateDateEn': None, 'addresses': ['685910, ОБЛАСТЬ, МАГАДАНСКАЯ, РАЙОН, ОЛЬСКИЙ, УЛИЦА, ОКТЯБРЬСКАЯ, 20, 490020000010022'], 'admLevelId': 50001, 'appealed': False, 'approveDocOrderDate': None, 'approveDocOrderNum': None, 'approveDocRequestDate': None, 'approveDocRequestNum': None, 'approveDocs': [], 'approveRequired': False, 'approved': False, 'approvedErknm': 'Отказано', 'chlistCount': 2, 'chlistFilledCount': 2, 'chlistFillingIndicationTypeId': [], 'collaboratingOrganizations': [], 'collaboratingOrganizationsIds': [], 'comment': 'В соответствии с п. 11(4) постановления Правительства РФ от 10.03.2022 №336 плановые КНМ в отношении государственных и муниципальных учреждений дошкольного и начального общего образования, основного общего и среднего общего образования, объекты контроля которых отнесены к категории чрезвычайно высокого и высокого рисков не проводятся', 'controllingOrganization': 'Управление Роспотребнадзора по Магаданской области', 'controllingOrganizationId': 10001024121, 'createPlanDate': None, 'createPlanDateLong': None, 'createdByErpDb': False, 'createdById': 190968, 'dataNotEqualEGRUL': False, 'dataSetNotInTime': False, 'deleted': False, 'directDurationDays': None, 'disapprove': False, 'district': 'Магаданская область', 'districtId': 1036440000000001, 'durationDays': 10, 'durationHours': 80, 'erknmActViolationIds': [], 'erknmResultKindDecisionIds': [], 'erpId': '49230041000103229878', 'events': [{'startDate': '05.07.2023', 'stopDate': '18.07.2023', 'title': 'Осмотр'}, {'startDate': '05.07.2023', 'stopDate': '18.07.2023', 'title': 'Досмотр'}, {'startDate': '05.07.2023', 'stopDate': '18.07.2023', 'title': 'Опрос'}, {'startDate': '05.07.2023', 'stopDate': '18.07.2023', 'title': 'Получение письменных объяснений'}, {'startDate': '05.07.2023', 'stopDate': '18.07.2023', 'title': 'Истребование документов'}, {'startDate': '05.07.2023', 'stopDate': '18.07.2023', 'title': 'Отбор проб (образцов)'}, {'startDate': '05.07.2023', 'stopDate': '18.07.2023', 'title': 'Инструментальное обследование'}, {'startDate': '05.07.2023', 'stopDate': '18.07.2023', 'title': 'Испытание'}, {'startDate': '05.07.2023', 'stopDate': '18.07.2023', 'title': 'Экспертиза'}], 'federalLaw': '248', 'federalLawId': 3, 'fullFieldViolationKnm': False, 'hasViolations': False, 'id': 13301995, 'inn': '4901005890', 'inspectorFullName': [], 'isFromSmev': False, 'isHasApproveDocs': False, 'isHasCollaboratingOrganization': False, 'isHasRequirements': True, 'isHasViolationTerm': False, 'isPm': False, 'kind': 'Выездная проверка', 'knmAnnulled': False, 'knmRejected': False, 'knmType': 'Плановое КНМ', 'knmTypeId': 4, 'legalBasisDocName': [], 'links': [], 'mspCategory': ['Не является субъектом МСП'], 'noPunishment': False, 'notifyLate': False, 'objectsKind': ['Деятельность по организации отдыха детей и их оздоровления, в том числе лагеря с дневным пребыванием'], 'objectsSubKind': ['Деятельность по организации отдыха детей и их оздоровления, в том числе лагеря с дневным пребыванием'], 'objectsType': ['Деятельность и действия'], 'ogrn': '1024900626277', 'oldKnm': None, 'oldPlan': None, 'orderDone': False, 'organizationName': 'МУНИЦИПАЛЬНОЕ КАЗЁННОЕ УЧРЕЖДЕНИЕ ДОПОЛНИТЕЛЬНОГО ОБРАЗОВАНИЯ ЦЕНТР ДОПОЛНИТЕЛЬНОГО ОБРАЗОВАНИЯ ДЕТЕЙ П.ОЛА', 'organizationsInn': ['4901005890'], 'organizationsName': ['МУНИЦИПАЛЬНОЕ КАЗЁННОЕ УЧРЕЖДЕНИЕ ДОПОЛНИТЕЛЬНОГО ОБРАЗОВАНИЯ ЦЕНТР ДОПОЛНИТЕЛЬНОГО ОБРАЗОВАНИЯ ДЕТЕЙ П.ОЛА'], 'organizationsOgrn': ['1024900626277'], 'planId': '2023050302', 'prosecutorOrganization': 'Прокуратура Магаданской области', 'prosecutorOrganizationId': 2693, 'publishedStatus': 'UNPUBLISHED', 'reasons': [201], 'reasonsList': [{'assignmentDate': None, 'assignmentDateEn': None, 'assignmentNumber': None, 'date': '27.06.2022', 'dateEn': '2022-06-27', 'requirementDetails': None, 'text': '(ФЗ 248) Истечение установленного федеральным законом о виде контроля, положением о виде контроля период времени с даты окончания проведения последнего планового контрольного (надзорного) мероприятия'}], 'recEmptyOrLate': False, 'regDateEgrul': '01.09.2022', 'regDateEgrulEn': '2022-09-01', 'regLate': False, 'regTypes': [], 'requirements': 25, 'requirementsList': [{'nameNpa': '«О санитарно-эпидемиологическом благополучии населения»', 'numberNpa': '30.03.1999', 'title': 'Федеральный закон № 52-ФЗ (ст.12, ст.13, ст.14, ст.15, ст.16, ст.17, ст.18, ст.19, ст.20, ст.21, ст.22, ст.23, ст.24, ст.25, ст.26, ст.27, ст.28, ст.29, ст.30, ст.31, ст.32, ст.33, ст.34, ст.36, ст.40, ст.41, ст.43, п.4 ст.44.1)'}, {'nameNpa': ' «О качестве и безопасности пищевых продуктов»', 'numberNpa': '02.01.2000', 'title': 'Федеральный закон № 29-ФЗ (п.1-3 ст.3, п.1,2 ст.5, п.1, 3 ст.9, ст. 12, ст.15, ст.16, ст.17, ст.18, ст.19, ст.20, п.1, 3 ст. 21, ст.22, ст.23, ст.24, п.1, 3.1, 5 ст.25.1, ст.25.2, ст.25.3, ст.25.4, ст.25.5, ст.25.6)'}, {'nameNpa': 'Об иммунопрофилактике инфекционных болезней', 'numberNpa': '17.09.1998', 'title': 'Федеральный закон № 157-ФЗ (ст.11, п.1,3 ст.12, п. 1 ст. 13, п.2 ст.17)'}, {'nameNpa': 'Об охране здоровья граждан от воздействия окружающего табачного дыма, последствий потребления табака или потребления никотинсодержащей продукции', 'numberNpa': '23.02.2013', 'title': 'Федеральный закон «15-ФЗ (ст. 12, ст.14, ст.16 ст.18, ст.20)'}, {'nameNpa': 'Об утверждении перечня работ, выполнение которых связано с высоким риском заболевания инфекционными болезнями и требуют обязательного проведения профилактических прививок', 'numberNpa': '15.07.1999', 'title': 'Постановление Правительства РФ № 825 (весь документ)'}, {'nameNpa': '«О безопасности пищевой продукции»', 'numberNpa': '09.12.2011', 'title': 'Технический регламент Таможенного союза ТР ТС 021/2011 (весь регламент (за исключением статьи 6, абзацев второго, седьмого, двенадцатого - четырнадцатого части 5 статьи 7, части 3 статьи 13, части 2 статьи 18, статей 30 и 40 указанного технического регламента)'}, {'nameNpa': '«Пищевая продукция в части ее маркировки»\n', 'numberNpa': '09.12.2011', 'title': 'Технический регламент Таможенного союза ТР ТС 022/2011 (весь регламент)\n'}, {'nameNpa': '«О безопасности мяса и мясной продукции» \n', 'numberNpa': '09.10.2013', 'title': 'Технический регламент Таможенного союза ТР ТС 034/2013 (весь регламент за исключением пунктов 1, 2, 3, 4, 5, 6, 7, 8, 26, 27, 28, 29, 30, 31, 32, 33, 34, 35, 36, 37, 38, 39, 40, 41, 42, 43, 44, 45, 46, 47, 48, 53, 54 и абзаца второго пункта 99 указанного технического регламента)\n'}, {'nameNpa': '«О безопасности молока и молочной продукции»', 'numberNpa': '09.10.2013', 'title': 'Технический регламент Таможенного союза ТР ТС 033/2013 (весь регламент, за исключением пунктов 13, 14, 97, 98 и 115 указанного технического регламента)'}, {'nameNpa': '«О безопасности рыбы и рыбной продукции»', 'numberNpa': '18.10.2016', 'title': 'Технический регламент Евразийского экономического союза ТР ЕАЭС 040/2016 Разделы IV и V (за исключением пункта 14), VI, VII, VIII, IX, X, XI (за исключением пунктов 85, 86), XII'}, {'nameNpa': '«Технический регламент на соковую продукцию из фруктов и овощей»', 'numberNpa': '09.12.2011', 'title': ' Технический регламент Таможенного союза ТР ТС 023/2011 (ст. 3, 4, 5, 6, 7, 8)'}, {'nameNpa': ' «Технический регламент на масложировую продукцию»', 'numberNpa': '09.12.2011', 'title': 'Технический регламент Таможенного союза (ТР ТС 024/2011 – весь регламент)'}, {'nameNpa': ' «О безопасности упакованной питьевой воды, включая природную минеральную воду»', 'numberNpa': '23.06.2017', 'title': 'Технический регламент Евразийского экономического союза ТР ЕАЭС 044/2017 (раздел III, IV, V, VI, VII, X)'}, {'nameNpa': ' О техническом регламенте Евразийского экономического союза О безопасности мяса птицы и продукции его переработки (вместе с ТР ЕАЭС 051/2021. Технический регламент Евразийского экономического Союза О безопасности мяса птицы и продукции его переработки)', 'numberNpa': '29.10.2021', 'title': 'Решение Совета Евразийской экономической комиссии N 110 Разделы III, IV, V, X, XII, XIII '}, {'nameNpa': '«Санитарно-эпидемиологические требования к содержанию территорий городских и сельских поселений, к водным объектам, питьевой воде и питьевому водоснабжению, атмосферному воздуху, почвам, жилым помещениям, эксплуатации производственных, общественных помещений, организации и проведению санитарно-противоэпидемиологических (профилактических) мероприятий»', 'numberNpa': '28.01.2021', 'title': 'СанПиН 2.1.3684-21 Разделы II,IV,VIII,X'}, {'nameNpa': '«Санитарно-эпидемиологические требования к организации общественного питания населения»', 'numberNpa': '27.10.2020', 'title': 'СанПиН 2.3/2.4.3590-20 (весь документ);'}, {'nameNpa': '«Гигиенические нормативы и требования к обеспечению безопасности и (или) безвредности для человека факторов среды обитания»', 'numberNpa': '28.01.2021', 'title': 'СанПиН 1.2.3685-21 (весь документ)'}, {'nameNpa': '«Санитарно-эпидемиологические требования к организациям воспитания и обучения, отдыха и оздоровления детей и молодежи»', 'numberNpa': '28.09.2020', 'title': 'СП 2.4.3648-20 (весь документ)'}, {'nameNpa': '«Санитарно-эпидемиологические требования к эксплуатации помещений, зданий, сооружений, оборудования и транспорта, а также условиям деятельности хозяйствующих субъектов, осуществляющих продажу товаров, выполнение работ или оказание услуг»', 'numberNpa': '24.12.2020', 'title': 'СП 2.1.3678-20 Разделы I, II, IX'}, {'nameNpa': 'СП 3.1.3597-20 Профилактика новой коронавирусной инфекции (COVID-19)', 'numberNpa': '02.12.2020', 'title': 'СП 2.2.3670-20 (весь документ)'}, {'nameNpa': ' Санитарно-эпидемиологические требования по профилактике инфекционных болезней', 'numberNpa': '28.01.2021', 'title': 'СанПиН 3.3686-21 (весь документ); '}, {'nameNpa': '«Профилактика новой коронавирусной инфекции (COVID-19)»', 'numberNpa': '22.05.2020', 'title': 'СП 3.1.3597-20(весь документ)'}, {'nameNpa': '«Санитарно-эпидемиологические требования к устройству, содержанию и организации работы образовательных организаций и других объектов социальной инфраструктуры для детей и молодежи в условиях распространения новой коронавирусной инфекции (COVID-19)»', 'numberNpa': '30.06.2020', 'title': 'СП 3.1/2.4.3598-20 (весь документ)'}, {'nameNpa': 'Об утверждении национального календаря профилактических прививок и календаря профилактических прививок по эпидемическим показаниям', 'numberNpa': '06.12.2021', 'title': 'Приказ Минздрава России № 1122н (весь документ);'}, {'nameNpa': 'Об утверждении Порядка проведения обязательных предварительных и периодических медицинских осмотров работников, предусмотренных частью четвертой статьи 213 Трудового кодекса Российской Федерации, перечня медицинских противопоказаний к осуществлению работ с вредными и (или) опасными производственными факторами, а также работам, при выполнении которых проводятся обязательные предварительные и периодические медицинские осмотры', 'numberNpa': '28.01.2021', 'title': 'Приказ Министерства здравоохранения Российской Федерации № 29н. (п.4.1приложения к Порядку проведения обязательных предварительных и периодических медицинских осмотров работников, предусмотренных частью четвертой статьи 213 Трудового кодекса Российской Федерации.'}], 'resolved': False, 'resultEmpty': True, 'resultEmptyOrLate': False, 'resultInfoTypeCodes': [], 'resultViolationKnm': False, 'riskCategory': ['чрезвычайно высокий риск'], 'riskCategoryAndDangerClass': ['чрезвычайно высокий риск / Не применяется'], 'sezRegistryExists': False, 'signed': True, 'smevInfoType': None, 'smevMessageType': None, 'smevReceivedAt': None, 'smevReceivedAtEn': None, 'smevReceivedAtMonth': None, 'smevReceivedAtYear': None, 'spvRegistryExists': False, 'startDate': '05.07.2023', 'startDateEn': '2023-07-05', 'status': 'Исключена', 'statusEgrul': 'Найден', 'statusId': 15, 'stopDate': '18.07.2023', 'stopDateEn': '2023-07-18', 'subjectTypeId': 0, 'supervisionType': 'Федеральный государственный санитарно-эпидемиологический контроль (надзор)', 'supervisionTypeId': 4, 'torRegistryExists': False, 'updatePlanDate': None, 'updatePlanDateLong': None, 'version': 'ERKNM', 'violationLawsuitTypeCodes': [], 'violationTypeCodes': [], 'year': 2023}
2023-01-19 12:42:10,902 - [WARNING] - direct_sql.py - new_insert_in_database(269) - Проведена повторная попытка внесения с параметром special, результат неудачный.
2023-01-19 12:42:10,902 - [WARNING] - direct_sql.py - new_insert_in_database(269) - Проведена повторная попытка внесения с параметром special, результат неудачный.
2023-01-19 12:42:10,902 - [INFO] - direct_sql.py - database_inserts_conductor_for_multiprocessing(132) - Возникла ошибка, с которой не удалось справиться...
2023-01-19 12:42:10,901 - [INFO] - direct_sql.py - new_insert_in_database(268) - {'actCreateDate': None, 'actCreateDateEn': None, 'addresses': ['618703, КРАЙ, ПЕРМСКИЙ, ГОРОД, ДОБРЯНКА, УЛИЦА, БОЛЬНИЧНАЯ, 1, 590000060280007', 'Пермский край, г. Добрянка, р.п.Полазна, ул.Больничная, д.1', 'Пермский край, г. Добрянка, р.п.Полазна, ул.Больничная, д.1'], 'admLevelId': 50001, 'appealed': False, 'approveDocOrderDate': None, 'approveDocOrderNum': None, 'approveDocRequestDate': None, 'approveDocRequestNum': None, 'approveDocs': [], 'approveRequired': False, 'approved': True, 'approvedErknm': 'Согласовано', 'chlistCount': 1, 'chlistFilledCount': 1, 'chlistFillingIndicationTypeId': [], 'collaboratingOrganizations': [], 'collaboratingOrganizationsIds': [], 'comment': None, 'controllingOrganization': 'Управления Роспотребнадзора по Пермскому краю', 'controllingOrganizationId': 10001019671, 'createPlanDate': None, 'createPlanDateLong': None, 'createdByErpDb': False, 'createdById': 199667, 'dataNotEqualEGRUL': False, 'dataSetNotInTime': True, 'deleted': False, 'directDurationDays': None, 'disapprove': False, 'district': 'Пермский край', 'districtId': 1033570000000001, 'durationDays': 10, 'durationHours': None, 'erknmActViolationIds': [], 'erknmResultKindDecisionIds': [], 'erpId': '59230041000103450726', 'events': [{'startDate': '06.06.2023', 'stopDate': '20.06.2023', 'title': 'Осмотр'}, {'startDate': '06.06.2023', 'stopDate': '20.06.2023', 'title': 'Опрос'}, {'startDate': '06.06.2023', 'stopDate': '20.06.2023', 'title': 'Получение письменных объяснений'}, {'startDate': '06.06.2023', 'stopDate': '20.06.2023', 'title': 'Истребование документов'}, {'startDate': '06.06.2023', 'stopDate': '20.06.2023', 'title': 'Отбор проб (образцов)'}, {'startDate': '06.06.2023', 'stopDate': '20.06.2023', 'title': 'Инструментальное обследование'}, {'startDate': '06.06.2023', 'stopDate': '20.06.2023', 'title': 'Испытание'}, {'startDate': '06.06.2023', 'stopDate': '20.06.2023', 'title': 'Экспертиза'}], 'federalLaw': '248', 'federalLawId': 3, 'fullFieldViolationKnm': False, 'hasViolations': False, 'id': 13522843, 'inn': '5914020168', 'inspectorFullName': [], 'isFromSmev': False, 'isHasApproveDocs': False, 'isHasCollaboratingOrganization': False, 'isHasRequirements': True, 'isHasViolationTerm': False, 'isPm': False, 'kind': 'Выездная проверка', 'knmAnnulled': False, 'knmRejected': False, 'knmType': 'Плановое КНМ', 'knmTypeId': 4, 'legalBasisDocName': [], 'links': [], 'mspCategory': ['Не является субъектом МСП'], 'noPunishment': False, 'notifyLate': False, 'objectsKind': ['Деятельность по организации отдыха детей и их оздоровления, в том числе лагеря с дневным пребыванием', 'Деятельность по организации отдыха детей и их оздоровления, в том числе лагеря с дневным пребыванием', 'Деятельность по организации отдыха детей и их оздоровления, в том числе лагеря с дневным пребыванием'], 'objectsSubKind': ['Деятельность по организации отдыха детей и их оздоровления, в том числе лагеря с дневным пребыванием', 'Деятельность по организации отдыха детей и их оздоровления, в том числе лагеря с дневным пребыванием', 'Деятельность по организации отдыха детей и их оздоровления, в том числе лагеря с дневным пребыванием'], 'objectsType': ['Деятельность и действия', 'Деятельность и действия', 'Производственные объекты'], 'ogrn': '1055905052312', 'oldKnm': None, 'oldPlan': None, 'orderDone': False, 'organizationName': 'МУНИЦИПАЛЬНОЕ БЮДЖЕТНОЕ УЧРЕЖДЕНИЕ ДОПОЛНИТЕЛЬНОГО ОБРАЗОВАНИЯ ПОЛАЗНЕНСКИЙ ЦЕНТР ДОПОЛНИТЕЛЬНОГО ОБРАЗОВАНИЯ ДЕТЕЙ ШКОЛА ТЕХНИЧЕСКОГО РЕЗЕРВА', 'organizationsInn': ['5914020168'], 'organizationsName': ['МУНИЦИПАЛЬНОЕ БЮДЖЕТНОЕ УЧРЕЖДЕНИЕ ДОПОЛНИТЕЛЬНОГО ОБРАЗОВАНИЯ ПОЛАЗНЕНСКИЙ ЦЕНТР ДОПОЛНИТЕЛЬНОГО ОБРАЗОВАНИЯ ДЕТЕЙ ШКОЛА ТЕХНИЧЕСКОГО РЕЗЕРВА'], 'organizationsOgrn': ['1055905052312'], 'planId': '2023051009', 'prosecutorOrganization': 'Прокуратура Пермского края', 'prosecutorOrganizationId': 1581, 'publishedStatus': 'PUBLISHED', 'reasons': [201], 'reasonsList': [{'assignmentDate': None, 'assignmentDateEn': None, 'assignmentNumber': None, 'date': '20.06.2022', 'dateEn': '2022-06-20', 'requirementDetails': None, 'text': '(ФЗ 248) Истечение установленного федеральным законом о виде контроля, положением о виде контроля период времени с даты окончания проведения последнего планового контрольного (надзорного) мероприятия'}], 'recEmptyOrLate': False, 'regDateEgrul': '16.09.2022', 'regDateEgrulEn': '2022-09-16', 'regLate': False, 'regTypes': [], 'requirements': 9, 'requirementsList': [{'nameNpa': 'None', 'numberNpa': 'None', 'title': 'None'}, {'nameNpa': 'None', 'numberNpa': 'None', 'title': 'None'}, {'nameNpa': 'None', 'numberNpa': 'None', 'title': 'None'}, {'nameNpa': 'None', 'numberNpa': 'None', 'title': 'None'}, {'nameNpa': 'None', 'numberNpa': 'None', 'title': 'None'}, {'nameNpa': 'None', 'numberNpa': 'None', 'title': 'None'}, {'nameNpa': 'None', 'numberNpa': 'None', 'title': 'None'}, {'nameNpa': 'None', 'numberNpa': 'None', 'title': 'None'}, {'nameNpa': 'None', 'numberNpa': 'None', 'title': 'None'}], 'resolved': False, 'resultEmpty': True, 'resultEmptyOrLate': False, 'resultInfoTypeCodes': [], 'resultViolationKnm': False, 'riskCategory': ['чрезвычайно высокий риск', 'чрезвычайно высокий риск', 'чрезвычайно высокий риск'], 'riskCategoryAndDangerClass': ['чрезвычайно высокий риск', 'чрезвычайно высокий риск', 'чрезвычайно высокий риск'], 'sezRegistryExists': False, 'signed': True, 'smevInfoType': None, 'smevMessageType': None, 'smevReceivedAt': None, 'smevReceivedAtEn': None, 'smevReceivedAtMonth': None, 'smevReceivedAtYear': None, 'spvRegistryExists': False, 'startDate': '06.06.2023', 'startDateEn': '2023-06-06', 'status': 'Ожидает проведения', 'statusEgrul': 'Найден', 'statusId': 5, 'stopDate': '20.06.2023', 'stopDateEn': '2023-06-20', 'subjectTypeId': 0, 'supervisionType': 'Федеральный государственный санитарно-эпидемиологический контроль (надзор)', 'supervisionTypeId': 4, 'torRegistryExists': False, 'updatePlanDate': None, 'updatePlanDateLong': None, 'version': 'ERKNM', 'violationLawsuitTypeCodes': [], 'violationTypeCodes': [], 'year': 2023}
2023-01-19 12:42:10,902 - [INFO] - direct_sql.py - database_inserts_conductor_for_multiprocessing(133) - 
