2022-12-20 10:46:07,414 - [INFO] - undetected_chromedriver.patcher - patch_exe(231) - patching driver executable C:\Users\zaitsev_ad\appdata\roaming\undetected_chromedriver\283a12e0b1e261c1_chromedriver.exe
2022-12-20 10:46:12,094 - [INFO] - main_ERKNM - __init__(59) - Начало авторизации
2022-12-20 10:46:21,567 - [INFO] - main_ERKNM - autorize(138) - Autorization successfull completed!
2022-12-20 10:57:46,234 - [INFO] - ERKNM_http.py - get_all_knm_and_pm_for_a_year(168) - Запись в json завершена, заносим в базу данных
2022-12-20 10:57:46,253 - [INFO] - create_doc.py - make_xl_from_kmns(27) - Создаем файл
2022-12-20 10:58:03,534 - [INFO] - create_doc.py - make_xl_from_kmns(74) - Файл наполнен данными, сохраняем
2022-12-20 11:02:25,447 - [INFO] - create_doc.py - make_xl_from_kmns(76) - Файл сохранен
2022-12-20 12:14:26,099 - [INFO] - undetected_chromedriver.patcher - patch_exe(231) - patching driver executable C:\Users\zaitsev_ad\appdata\roaming\undetected_chromedriver\6252d4e989ea67ac_chromedriver.exe
2022-12-20 12:14:29,150 - [INFO] - main_ERKNM - __init__(59) - Начало авторизации
2022-12-20 12:14:38,718 - [INFO] - main_ERKNM - autorize(138) - Autorization successfull completed!
2022-12-20 12:25:55,272 - [INFO] - ERKNM_http.py - get_all_knm_and_pm_for_a_year(168) - Запись в json завершена, заносим в базу данных
2022-12-20 12:25:55,272 - [INFO] - direct_sql.py - multiple_inserts(141) - старт программы
2022-12-20 12:30:54,334 - [ERROR] - sql.py - ultra_create_handler(167) - не получилось внести субъект (не рейд):
Traceback (most recent call last):
  File "C:\Users\zaitsev_ad\PycharmProjects\ERKNM\sql.py", line 159, in ultra_create_handler
    cursor.execute(f"""INSERT INTO knd_subject(name, address, inn, ogrn, e_mail, district) VALUES (
  File "C:\Users\zaitsev_ad\PycharmProjects\ERKNM\venv\lib\site-packages\pymysql\cursors.py", line 148, in execute
    result = self._query(query)
  File "C:\Users\zaitsev_ad\PycharmProjects\ERKNM\venv\lib\site-packages\pymysql\cursors.py", line 310, in _query
    conn.query(q)
  File "C:\Users\zaitsev_ad\PycharmProjects\ERKNM\venv\lib\site-packages\pymysql\connections.py", line 548, in query
    self._affected_rows = self._read_query_result(unbuffered=unbuffered)
  File "C:\Users\zaitsev_ad\PycharmProjects\ERKNM\venv\lib\site-packages\pymysql\connections.py", line 775, in _read_query_result
    result.read()
  File "C:\Users\zaitsev_ad\PycharmProjects\ERKNM\venv\lib\site-packages\pymysql\connections.py", line 1156, in read
    first_packet = self.connection._read_packet()
  File "C:\Users\zaitsev_ad\PycharmProjects\ERKNM\venv\lib\site-packages\pymysql\connections.py", line 725, in _read_packet
    packet.raise_for_error()
  File "C:\Users\zaitsev_ad\PycharmProjects\ERKNM\venv\lib\site-packages\pymysql\protocol.py", line 221, in raise_for_error
    err.raise_mysql_exception(self._data)
  File "C:\Users\zaitsev_ad\PycharmProjects\ERKNM\venv\lib\site-packages\pymysql\err.py", line 143, in raise_mysql_exception
    raise errorclass(errno, errval)
pymysql.err.ProgrammingError: (1064, "You have an error in your SQL syntax; check the manual that corresponds to your MySQL server version for the right syntax to use near 'МУНИЦИПАЛЬНОЕ КАЗЕННОЕ ОБЩЕОБРАЗОВАТЕЛЬНО' at line 2")
2022-12-20 12:30:54,347 - [INFO] - sql.py - ultra_create_handler(168) - {'actCreateDate': None, 'actCreateDateEn': None, 'addresses': ['368317, РЕСПУБЛИКА ДАГЕСТАН, РАЙОН ЛЕВАШИНСКИЙ, СЕЛО ТАГИРКЕНТ, '], 'admLevelId': 50001, 'appealed': False, 'approveDocOrderDate': None, 'approveDocOrderNum': None, 'approveDocRequestDate': None, 'approveDocRequestNum': None, 'approveDocs': [], 'approveRequired': False, 'approved': False, 'approvedErknm': 'Отказано', 'chlistCount': 2, 'chlistFilledCount': 2, 'chlistFillingIndicationTypeId': [], 'collaboratingOrganizations': [], 'collaboratingOrganizationsIds': [], 'comment': 'П.11 (4) Постановления  Правительства РФ от 10.03.2022 N 336 (ред. от 01.10.2022) "Об особенностях организации и осуществления государственного контроля (надзора), муниципального контроля"', 'controllingOrganization': 'Управление Роспотребнадзора по Республике Дагестан', 'controllingOrganizationId': 10001013421, 'createPlanDate': None, 'createPlanDateLong': None, 'createdByErpDb': False, 'createdById': 196779, 'dataNotEqualEGRUL': False, 'dataSetNotInTime': False, 'deleted': False, 'directDurationDays': None, 'disapprove': False, 'district': 'Левашинский район', 'districtId': 1038822340000001, 'durationDays': 10, 'durationHours': None, 'erknmActViolationIds': [], 'erknmResultKindDecisionIds': [], 'erpId': '05230041000103452147', 'events': [{'startDate': '14.02.2023', 'stopDate': '27.02.2023', 'title': 'Осмотр'}, {'startDate': '14.02.2023', 'stopDate': '27.02.2023', 'title': 'Истребование документов'}, {'startDate': '14.02.2023', 'stopDate': '27.02.2023', 'title': 'Отбор проб (образцов)'}, {'startDate': '14.02.2023', 'stopDate': '27.02.2023', 'title': 'Экспертиза'}], 'federalLaw': '248', 'federalLawId': 3, 'fullFieldViolationKnm': False, 'hasViolations': False, 'id': 13524264, 'inn': '0521008520', 'inspectorFullName': ['Омаров Шамиль Магомедович '], 'isFromSmev': False, 'isHasApproveDocs': False, 'isHasCollaboratingOrganization': False, 'isHasRequirements': True, 'isHasViolationTerm': False, 'isPm': False, 'kind': 'Выездная проверка', 'knmAnnulled': False, 'knmRejected': False, 'knmType': 'Плановое КНМ', 'knmTypeId': 4, 'legalBasisDocName': [], 'links': [], 'mspCategory': ['Не является субъектом МСП'], 'noPunishment': False, 'notifyLate': False, 'objectsKind': ['Деятельность общеобразовательных организаций'], 'objectsSubKind': ['Деятельность общеобразовательных организаций'], 'objectsType': ['Деятельность и действия'], 'ogrn': '1070521001374', 'oldKnm': None, 'oldPlan': None, 'orderDone': False, 'organizationName': '\'МУНИЦИПАЛЬНОЕ КАЗЕННОЕ ОБЩЕОБРАЗОВАТЕЛЬНОЕ УЧРЕЖДЕНИЕ "ТАГЗИРКЕНТСКАЯ ОСНОВНАЯ ОБЩЕОБРАЗОВАТЕЛЬНАЯ ШКОЛА" МР "ЛЕВАШИНСКИЙ РАЙОН"', 'organizationsInn': ['0521008520'], 'organizationsName': ['\'МУНИЦИПАЛЬНОЕ КАЗЕННОЕ ОБЩЕОБРАЗОВАТЕЛЬНОЕ УЧРЕЖДЕНИЕ "ТАГЗИРКЕНТСКАЯ ОСНОВНАЯ ОБЩЕОБРАЗОВАТЕЛЬНАЯ ШКОЛА" МР "ЛЕВАШИНСКИЙ РАЙОН"'], 'organizationsOgrn': ['1070521001374'], 'planId': '2023051364', 'prosecutorOrganization': 'Прокуратура Республики Дагестан', 'prosecutorOrganizationId': 2796, 'publishedStatus': 'UNPUBLISHED', 'reasons': [201], 'reasonsList': [{'assignmentDate': None, 'assignmentDateEn': None, 'assignmentNumber': None, 'date': '14.02.2022', 'dateEn': '2022-02-14', 'requirementDetails': None, 'text': '(ФЗ 248) Истечение установленного федеральным законом о виде контроля, положением о виде контроля период времени с даты окончания проведения последнего планового контрольного (надзорного) мероприятия'}], 'recEmptyOrLate': False, 'regDateEgrul': '16.09.2022', 'regDateEgrulEn': '2022-09-16', 'regLate': False, 'regTypes': [], 'requirements': 1, 'requirementsList': [{'nameNpa': None, 'numberNpa': None, 'title': None}], 'resolved': False, 'resultEmpty': True, 'resultEmptyOrLate': False, 'resultInfoTypeCodes': [], 'resultViolationKnm': False, 'riskCategory': ['чрезвычайно высокий риск'], 'riskCategoryAndDangerClass': ['чрезвычайно высокий риск'], 'sezRegistryExists': False, 'signed': True, 'smevInfoType': None, 'smevMessageType': None, 'smevReceivedAt': None, 'smevReceivedAtEn': None, 'smevReceivedAtMonth': None, 'smevReceivedAtYear': None, 'spvRegistryExists': False, 'startDate': '14.02.2023', 'startDateEn': '2023-02-14', 'status': 'Исключена', 'statusEgrul': 'Найден', 'statusId': 15, 'stopDate': '27.02.2023', 'stopDateEn': '2023-02-27', 'subjectTypeId': 0, 'supervisionType': 'Федеральный государственный санитарно-эпидемиологический контроль (надзор)', 'supervisionTypeId': 4, 'torRegistryExists': False, 'updatePlanDate': None, 'updatePlanDateLong': None, 'version': 'ERKNM', 'violationLawsuitTypeCodes': [], 'violationTypeCodes': [], 'year': 2023}
2022-12-20 12:36:42,386 - [ERROR] - sql.py - ultra_create_handler(197) - не получилось внести объект (не рейд):
Traceback (most recent call last):
  File "C:\Users\zaitsev_ad\PycharmProjects\ERKNM\sql.py", line 177, in ultra_create_handler
    cursor.execute(
  File "C:\Users\zaitsev_ad\PycharmProjects\ERKNM\venv\lib\site-packages\pymysql\cursors.py", line 148, in execute
    result = self._query(query)
  File "C:\Users\zaitsev_ad\PycharmProjects\ERKNM\venv\lib\site-packages\pymysql\cursors.py", line 310, in _query
    conn.query(q)
  File "C:\Users\zaitsev_ad\PycharmProjects\ERKNM\venv\lib\site-packages\pymysql\connections.py", line 548, in query
    self._affected_rows = self._read_query_result(unbuffered=unbuffered)
  File "C:\Users\zaitsev_ad\PycharmProjects\ERKNM\venv\lib\site-packages\pymysql\connections.py", line 775, in _read_query_result
    result.read()
  File "C:\Users\zaitsev_ad\PycharmProjects\ERKNM\venv\lib\site-packages\pymysql\connections.py", line 1156, in read
    first_packet = self.connection._read_packet()
  File "C:\Users\zaitsev_ad\PycharmProjects\ERKNM\venv\lib\site-packages\pymysql\connections.py", line 725, in _read_packet
    packet.raise_for_error()
  File "C:\Users\zaitsev_ad\PycharmProjects\ERKNM\venv\lib\site-packages\pymysql\protocol.py", line 221, in raise_for_error
    err.raise_mysql_exception(self._data)
  File "C:\Users\zaitsev_ad\PycharmProjects\ERKNM\venv\lib\site-packages\pymysql\err.py", line 143, in raise_mysql_exception
    raise errorclass(errno, errval)
pymysql.err.ProgrammingError: (1064, "You have an error in your SQL syntax; check the manual that corresponds to your MySQL server version for the right syntax to use near 'Котовский район, х. Нижние коробки, ул. Центр' at line 1")
2022-12-20 12:36:42,387 - [INFO] - sql.py - ultra_create_handler(198) - {'actCreateDate': None, 'actCreateDateEn': None, 'addresses': ['403801, ОБЛАСТЬ ВОЛГОГРАДСКАЯ, РАЙОН КОТОВСКИЙ, ГОРОД КОТОВО, УЛИЦА ЛЕНИНА, 89, ', "403818 Волгоградская область 'Котовский район, х. Нижние коробки, ул. Центральная, д. 2'"], 'admLevelId': 50001, 'appealed': False, 'approveDocOrderDate': None, 'approveDocOrderNum': None, 'approveDocRequestDate': None, 'approveDocRequestNum': None, 'approveDocs': [], 'approveRequired': False, 'approved': False, 'approvedErknm': 'Отказано', 'chlistCount': 0, 'chlistFilledCount': 0, 'chlistFillingIndicationTypeId': [], 'collaboratingOrganizations': [], 'collaboratingOrganizationsIds': [], 'comment': 'Объекты контроля включены в план вопреки п. 11 (4) Постановления Правительства РФ от 10.03.2022 № 336 «Об особенностях организации и осуществления государственного контроля (надзора), муниципального контроля», согласно которому в планы проведения плановых контрольных (надзорных) мероприятий на 2023 год не включаются плановые контрольные (надзорные) мероприятия в отношении государственных и муниципальных учреждений дошкольного и начального общего образования, основного общего и среднего общего образования, объекты контроля которых отнесены к категориям чрезвычайно высокого и высокого риска.', 'controllingOrganization': 'Управление Роспотребнадзора по Волгоградской области', 'controllingOrganizationId': 10001013326, 'createPlanDate': None, 'createPlanDateLong': None, 'createdByErpDb': False, 'createdById': 166438, 'dataNotEqualEGRUL': False, 'dataSetNotInTime': False, 'deleted': False, 'directDurationDays': None, 'disapprove': False, 'district': 'Волгоградская область', 'districtId': 1040180000000001, 'durationDays': 10, 'durationHours': None, 'erknmActViolationIds': [], 'erknmResultKindDecisionIds': [], 'erpId': '34230041000103542651', 'events': [{'startDate': '13.02.2023', 'stopDate': '27.02.2023', 'title': 'Осмотр'}, {'startDate': '13.02.2023', 'stopDate': '27.02.2023', 'title': 'Получение письменных объяснений'}, {'startDate': '13.02.2023', 'stopDate': '27.02.2023', 'title': 'Истребование документов'}, {'startDate': '13.02.2023', 'stopDate': '27.02.2023', 'title': 'Отбор проб (образцов)'}, {'startDate': '13.02.2023', 'stopDate': '27.02.2023', 'title': 'Инструментальное обследование'}, {'startDate': '13.02.2023', 'stopDate': '27.02.2023', 'title': 'Испытание'}], 'federalLaw': '248', 'federalLawId': 3, 'fullFieldViolationKnm': False, 'hasViolations': False, 'id': 13614768, 'inn': '3414004100', 'inspectorFullName': [], 'isFromSmev': False, 'isHasApproveDocs': False, 'isHasCollaboratingOrganization': False, 'isHasRequirements': True, 'isHasViolationTerm': False, 'isPm': False, 'kind': 'Выездная проверка', 'knmAnnulled': False, 'knmRejected': False, 'knmType': 'Плановое КНМ', 'knmTypeId': 4, 'legalBasisDocName': [], 'links': [], 'mspCategory': ['Не является субъектом МСП'], 'noPunishment': False, 'notifyLate': False, 'objectsKind': ['общеобразовательные организации', 'общеобразовательные организации'], 'objectsSubKind': ['общеобразовательные организации', 'общеобразовательные организации'], 'objectsType': ['Деятельность и действия', 'Деятельность и действия'], 'ogrn': '1023404974780', 'oldKnm': None, 'oldPlan': None, 'orderDone': False, 'organizationName': 'МУНИЦИПАЛЬНОЕ БЮДЖЕТНОЕ ОБЩЕОБРАЗОВАТЕЛЬНОЕ УЧРЕЖДЕНИЕ "СРЕДНЯЯ ШКОЛА № 3 С УГЛУБЛЕННЫМ ИЗУЧЕНИЕМ ОТДЕЛЬНЫХ ПРЕДМЕТОВ Г. КОТОВО" КОТОВСКОГО МУНИЦИПАЛЬНОГО РАЙОНА ВОЛГОГРАДСКОЙ ОБЛАСТИ', 'organizationsInn': ['3414004100'], 'organizationsName': ['МУНИЦИПАЛЬНОЕ БЮДЖЕТНОЕ ОБЩЕОБРАЗОВАТЕЛЬНОЕ УЧРЕЖДЕНИЕ "СРЕДНЯЯ ШКОЛА № 3 С УГЛУБЛЕННЫМ ИЗУЧЕНИЕМ ОТДЕЛЬНЫХ ПРЕДМЕТОВ Г. КОТОВО" КОТОВСКОГО МУНИЦИПАЛЬНОГО РАЙОНА ВОЛГОГРАДСКОЙ ОБЛАСТИ'], 'organizationsOgrn': ['1023404974780'], 'planId': '2023050594', 'prosecutorOrganization': 'Прокуратура Волгоградской области', 'prosecutorOrganizationId': 995, 'publishedStatus': 'UNPUBLISHED', 'reasons': [201], 'reasonsList': [{'assignmentDate': None, 'assignmentDateEn': None, 'assignmentNumber': None, 'date': '06.05.2019', 'dateEn': '2019-05-06', 'requirementDetails': None, 'text': '(ФЗ 248) Истечение установленного федеральным законом о виде контроля, положением о виде контроля период времени с даты окончания проведения последнего планового контрольного (надзорного) мероприятия'}], 'recEmptyOrLate': False, 'regDateEgrul': '21.09.2022', 'regDateEgrulEn': '2022-09-21', 'regLate': False, 'regTypes': [], 'requirements': 9, 'requirementsList': [{'nameNpa': ' «О санитарно – эпидемиологическом благополучии населения» ч.3 ст. 39, п.1 , п. 5 ч.2, ст.44, ст. 10, ст.11, ст.24, ст.28, п.3 ст.29, ст.34, ст.35, ст.36', 'numberNpa': '30.03.1999', 'title': 'Федеральный закон РФ № 52-ФЗ от 30.03.1999  '}, {'nameNpa': '"САНИТАРНО-ЭПИДЕМИОЛОГИЧЕСКИЕ ТРЕБОВАНИЯ К ОРГАНИЗАЦИЯМ\nВОСПИТАНИЯ И ОБУЧЕНИЯ, ОТДЫХА И ОЗДОРОВЛЕНИЯ ДЕТЕЙ\nИ МОЛОДЕЖИ"', 'numberNpa': '28.10.2020', 'title': 'СП 2.4.3648-20    28.10.2020\n'}, {'nameNpa': '"Санитарно-эпидемиологические требования к организации общественного питания населения"', 'numberNpa': '27.10.2020', 'title': 'СанПиН 2.3/2.4.3590-20  27.10.2020\n'}, {'nameNpa': '"О качестве и безопасности пищевых продуктов" (с изменениями и дополнениями)', 'numberNpa': '02.01.2000', 'title': 'Федеральный закон N 29-ФЗ от 02.01.2000 г. '}, {'nameNpa': '« Гигиенические нормативы  и требования к обеспечению безопасности (или) безвредности  для человека факторов среды  обитания»', 'numberNpa': '29.01.2021', 'title': 'Сан ПиН 1.2.3685-21    29.01.2021\n'}, {'nameNpa': '«Санитарно-эпидемиологические требования к содержанию территорий городских и сельских поселений, к водным объектам, питьевой воде и питьевому водоснабжению, атмосферному воздух, почвам, жилым помещениям, эксплуатации производственных, общественных помещений, организации проведению санитарно-противоэпидемических (профилактических) мероприятий» (разделы I, II, IV, VIII, X с приложениями', 'numberNpa': '28.01.2021', 'title': 'СанПиН 2.1.3684-21       28.01.2021\n'}, {'nameNpa': '"Санитарно-эпидемиологические требования по профилактике инфекционных болезней"', 'numberNpa': '15.02.2021', 'title': 'СанПиН 3.3686-21      15.02.2021 г\n \n'}, {'nameNpa': '«Санитарно-эпидемиологические требования к устройству, содержанию и организации работы образовательных организаций и других объектов социальной инфраструктуры для детей и молодежи в условиях распространения новой коронавирусной инфекции  (COVID-19)»   гл.I.II.III\n(разделы I, II, V)', 'numberNpa': '30.06.2020', 'title': 'СП 3.1/2.4.3598-20     30.06.2020 г\n'}, {'nameNpa': '  " Организация и проведение производственного контроля за соблюдением санитарных правил и выполнением санитарно-противоэпидемических (профилактических) мероприятий»\n  Раздел II.раздел III,', 'numberNpa': '30.10.2001', 'title': 'СП 1.1.1058-01    30.10.2001\n\n'}], 'resolved': False, 'resultEmpty': True, 'resultEmptyOrLate': False, 'resultInfoTypeCodes': [], 'resultViolationKnm': False, 'riskCategory': ['чрезвычайно высокий риск', 'чрезвычайно высокий риск'], 'riskCategoryAndDangerClass': ['чрезвычайно высокий риск / Первый', 'чрезвычайно высокий риск / Первый'], 'sezRegistryExists': False, 'signed': True, 'smevInfoType': None, 'smevMessageType': None, 'smevReceivedAt': None, 'smevReceivedAtEn': None, 'smevReceivedAtMonth': None, 'smevReceivedAtYear': None, 'spvRegistryExists': False, 'startDate': '13.02.2023', 'startDateEn': '2023-02-13', 'status': 'Исключена', 'statusEgrul': 'Найден', 'statusId': 15, 'stopDate': '27.02.2023', 'stopDateEn': '2023-02-27', 'subjectTypeId': 0, 'supervisionType': 'Федеральный государственный санитарно-эпидемиологический контроль (надзор)', 'supervisionTypeId': 4, 'torRegistryExists': False, 'updatePlanDate': None, 'updatePlanDateLong': None, 'version': 'ERKNM', 'violationLawsuitTypeCodes': [], 'violationTypeCodes': [], 'year': 2023}
2022-12-20 12:41:51,860 - [ERROR] - sql.py - ultra_create_handler(197) - не получилось внести объект (не рейд):
Traceback (most recent call last):
  File "C:\Users\zaitsev_ad\PycharmProjects\ERKNM\sql.py", line 177, in ultra_create_handler
    cursor.execute(
  File "C:\Users\zaitsev_ad\PycharmProjects\ERKNM\venv\lib\site-packages\pymysql\cursors.py", line 148, in execute
    result = self._query(query)
  File "C:\Users\zaitsev_ad\PycharmProjects\ERKNM\venv\lib\site-packages\pymysql\cursors.py", line 310, in _query
    conn.query(q)
  File "C:\Users\zaitsev_ad\PycharmProjects\ERKNM\venv\lib\site-packages\pymysql\connections.py", line 548, in query
    self._affected_rows = self._read_query_result(unbuffered=unbuffered)
  File "C:\Users\zaitsev_ad\PycharmProjects\ERKNM\venv\lib\site-packages\pymysql\connections.py", line 775, in _read_query_result
    result.read()
  File "C:\Users\zaitsev_ad\PycharmProjects\ERKNM\venv\lib\site-packages\pymysql\connections.py", line 1156, in read
    first_packet = self.connection._read_packet()
  File "C:\Users\zaitsev_ad\PycharmProjects\ERKNM\venv\lib\site-packages\pymysql\connections.py", line 725, in _read_packet
    packet.raise_for_error()
  File "C:\Users\zaitsev_ad\PycharmProjects\ERKNM\venv\lib\site-packages\pymysql\protocol.py", line 221, in raise_for_error
    err.raise_mysql_exception(self._data)
  File "C:\Users\zaitsev_ad\PycharmProjects\ERKNM\venv\lib\site-packages\pymysql\err.py", line 143, in raise_mysql_exception
    raise errorclass(errno, errval)
pymysql.err.ProgrammingError: (1064, "You have an error in your SQL syntax; check the manual that corresponds to your MySQL server version for the right syntax to use near '403780',Волгоградская область,'Жирновский райо' at line 1")
2022-12-20 12:41:51,863 - [INFO] - sql.py - ultra_create_handler(198) - {'actCreateDate': None, 'actCreateDateEn': None, 'addresses': ['403780, ОБЛАСТЬ, ВОЛГОГРАДСКАЯ, РАЙОН, ЖИРНОВСКИЙ, УЛИЦА, НОВАЯ, ДОМ 102А, 340080000160049', "'403780',Волгоградская область,'Жирновский район, р.п. Красный Яр, ул. Центральная, д. 14'", "  '403772' Волгоградская область,'Жирновский район, р.п. Медведицкий, ул. Песчаная, д. 40'"], 'admLevelId': 50001, 'appealed': False, 'approveDocOrderDate': None, 'approveDocOrderNum': None, 'approveDocRequestDate': None, 'approveDocRequestNum': None, 'approveDocs': [], 'approveRequired': False, 'approved': False, 'approvedErknm': 'Отказано', 'chlistCount': 0, 'chlistFilledCount': 0, 'chlistFillingIndicationTypeId': [], 'collaboratingOrganizations': [], 'collaboratingOrganizationsIds': [], 'comment': 'Объекты контроля включены в план вопреки п. 11 (4) Постановления Правительства РФ от 10.03.2022 № 336 «Об особенностях организации и осуществления государственного контроля (надзора), муниципального контроля», согласно которому в планы проведения плановых контрольных (надзорных) мероприятий на 2023 год не включаются плановые контрольные (надзорные) мероприятия в отношении государственных и муниципальных учреждений дошкольного и начального общего образования, основного общего и среднего общего образования, объекты контроля которых отнесены к категориям чрезвычайно высокого и высокого риска.', 'controllingOrganization': 'Управление Роспотребнадзора по Волгоградской области', 'controllingOrganizationId': 10001013326, 'createPlanDate': None, 'createPlanDateLong': None, 'createdByErpDb': False, 'createdById': 166438, 'dataNotEqualEGRUL': False, 'dataSetNotInTime': False, 'deleted': False, 'directDurationDays': None, 'disapprove': False, 'district': 'Волгоградская область', 'districtId': 1040180000000001, 'durationDays': 10, 'durationHours': None, 'erknmActViolationIds': [], 'erknmResultKindDecisionIds': [], 'erpId': '34230041000103186971', 'events': [{'startDate': '07.04.2023', 'stopDate': '20.04.2023', 'title': 'Осмотр'}, {'startDate': '07.04.2023', 'stopDate': '20.04.2023', 'title': 'Получение письменных объяснений'}, {'startDate': '07.04.2023', 'stopDate': '20.04.2023', 'title': 'Истребование документов'}, {'startDate': '07.04.2023', 'stopDate': '20.04.2023', 'title': 'Отбор проб (образцов)'}, {'startDate': '07.04.2023', 'stopDate': '20.04.2023', 'title': 'Инструментальное обследование'}, {'startDate': '07.04.2023', 'stopDate': '20.04.2023', 'title': 'Испытание'}], 'federalLaw': '248', 'federalLawId': 3, 'fullFieldViolationKnm': False, 'hasViolations': False, 'id': 13259088, 'inn': '3407007252', 'inspectorFullName': [], 'isFromSmev': False, 'isHasApproveDocs': False, 'isHasCollaboratingOrganization': False, 'isHasRequirements': True, 'isHasViolationTerm': False, 'isPm': False, 'kind': 'Выездная проверка', 'knmAnnulled': False, 'knmRejected': False, 'knmType': 'Плановое КНМ', 'knmTypeId': 4, 'legalBasisDocName': [], 'links': [], 'mspCategory': ['Не является субъектом МСП'], 'noPunishment': False, 'notifyLate': False, 'objectsKind': ['дошкольные образовательные организации', 'дошкольные образовательные организации', 'дошкольные образовательные организации'], 'objectsSubKind': ['дошкольные образовательные организации', 'дошкольные образовательные организации', 'дошкольные образовательные организации'], 'objectsType': ['Деятельность и действия', 'Деятельность и действия', 'Деятельность и действия'], 'ogrn': '1023404971446', 'oldKnm': None, 'oldPlan': None, 'orderDone': False, 'organizationName': 'ДОШКОЛЬНОЕ ОБРАЗОВАТЕЛЬНОЕ УЧРЕЖДЕНИЕ КРАСНОЯРСКИЙ МУНИЦИПАЛЬНЫЙ ДЕТСКИЙ САД № 4 "СВЕТЛЯЧОК" ЖИРНОВСКОГО МУНИЦИПАЛЬНОГО РАЙОНА ВОЛГОГРАДСКОЙ ОБЛАСТИ', 'organizationsInn': ['3407007252'], 'organizationsName': ['ДОШКОЛЬНОЕ ОБРАЗОВАТЕЛЬНОЕ УЧРЕЖДЕНИЕ КРАСНОЯРСКИЙ МУНИЦИПАЛЬНЫЙ ДЕТСКИЙ САД № 4 "СВЕТЛЯЧОК" ЖИРНОВСКОГО МУНИЦИПАЛЬНОГО РАЙОНА ВОЛГОГРАДСКОЙ ОБЛАСТИ'], 'organizationsOgrn': ['1023404971446'], 'planId': '2023050594', 'prosecutorOrganization': 'Прокуратура Волгоградской области', 'prosecutorOrganizationId': 995, 'publishedStatus': 'UNPUBLISHED', 'reasons': [201], 'reasonsList': [{'assignmentDate': None, 'assignmentDateEn': None, 'assignmentNumber': None, 'date': '27.04.2021', 'dateEn': '2021-04-27', 'requirementDetails': None, 'text': '(ФЗ 248) Истечение установленного федеральным законом о виде контроля, положением о виде контроля период времени с даты окончания проведения последнего планового контрольного (надзорного) мероприятия'}], 'recEmptyOrLate': False, 'regDateEgrul': '29.08.2022', 'regDateEgrulEn': '2022-08-29', 'regLate': False, 'regTypes': [], 'requirements': 8, 'requirementsList': [{'nameNpa': '"САНИТАРНО-ЭПИДЕМИОЛОГИЧЕСКИЕ ТРЕБОВАНИЯ К ОРГАНИЗАЦИЯМ\nВОСПИТАНИЯ И ОБУЧЕНИЯ, ОТДЫХА И ОЗДОРОВЛЕНИЯ ДЕТЕЙ\nИ МОЛОДЕЖИ"', 'numberNpa': '28.10.2020', 'title': 'СП 2.4.3648-20    28.10.2020'}, {'nameNpa': '"Санитарно-эпидемиологические требования к организации общественного питания населения"', 'numberNpa': '27.10.2020', 'title': 'СанПиН 2.3/2.4.3590-20  27.10.2020\n'}, {'nameNpa': '"О качестве и безопасности пищевых продуктов" (с изменениями и дополнениями', 'numberNpa': '02.01.2000', 'title': 'Федеральный закон N 29-ФЗ от 02.01.2000 г. '}, {'nameNpa': '« Гигиенические нормативы  и требования к обеспечению безопасности (или) безвредности  для человека факторов среды  обитания»', 'numberNpa': '29.01.2021', 'title': 'Сан ПиН 1.2.3685-21    29.01.2021'}, {'nameNpa': '«Санитарно-эпидемиологические требования к содержанию территорий городских и сельских поселений, к водным объектам, питьевой воде и питьевому водоснабжению, атмосферному воздух, почвам, жилым помещениям, эксплуатации производственных, общественных помещений, организации проведению санитарно-противоэпидемических (профилактических) мероприятий» (разделы I, II, IV, VIII, X с приложениями);', 'numberNpa': '28.01.2021', 'title': 'СанПиН 2.1.3684-21       28.01.2021'}, {'nameNpa': '«Санитарно-эпидемиологические требования к устройству, содержанию и организации работы образовательных организаций и других объектов социальной инфраструктуры для детей и молодежи в условиях распространения новой коронавирусной инфекции  (COVID-19)»', 'numberNpa': '30.06.2020', 'title': 'СП 3.1/2.4.3598-20     30.06.2020 г\n'}, {'nameNpa': '" Организация и проведение производственного контроля за соблюдением санитарных правил и выполнением санитарно-противоэпидемических (профилактических) мероприятий»', 'numberNpa': '30.10.2001', 'title': 'СП 1.1.1058-01    30.10.2001\n  \n'}, {'nameNpa': '«О санитарно – эпидемиологическом благополучии населения» ч.3 ст. 39, п.1 , п. 5 ч.2, ст.44, ст. 10, ст.11, ст.24, ст.28, п.3 ст.29, ст.34, ст.35, ст.36', 'numberNpa': '30.03.1999', 'title': 'Федеральный закон РФ № 52-ФЗ от 30.03.1999   '}], 'resolved': False, 'resultEmpty': True, 'resultEmptyOrLate': False, 'resultInfoTypeCodes': [], 'resultViolationKnm': False, 'riskCategory': ['чрезвычайно высокий риск', 'чрезвычайно высокий риск', 'чрезвычайно высокий риск'], 'riskCategoryAndDangerClass': ['чрезвычайно высокий риск / Первый', 'чрезвычайно высокий риск / Первый', 'чрезвычайно высокий риск / Первый'], 'sezRegistryExists': False, 'signed': True, 'smevInfoType': None, 'smevMessageType': None, 'smevReceivedAt': None, 'smevReceivedAtEn': None, 'smevReceivedAtMonth': None, 'smevReceivedAtYear': None, 'spvRegistryExists': False, 'startDate': '07.04.2023', 'startDateEn': '2023-04-07', 'status': 'Исключена', 'statusEgrul': 'Найден', 'statusId': 15, 'stopDate': '20.04.2023', 'stopDateEn': '2023-04-20', 'subjectTypeId': 0, 'supervisionType': 'Федеральный государственный санитарно-эпидемиологический контроль (надзор)', 'supervisionTypeId': 4, 'torRegistryExists': False, 'updatePlanDate': None, 'updatePlanDateLong': None, 'version': 'ERKNM', 'violationLawsuitTypeCodes': [], 'violationTypeCodes': [], 'year': 2023}
2022-12-20 12:42:13,774 - [ERROR] - sql.py - ultra_create_handler(197) - не получилось внести объект (не рейд):
Traceback (most recent call last):
  File "C:\Users\zaitsev_ad\PycharmProjects\ERKNM\sql.py", line 177, in ultra_create_handler
    cursor.execute(
  File "C:\Users\zaitsev_ad\PycharmProjects\ERKNM\venv\lib\site-packages\pymysql\cursors.py", line 148, in execute
    result = self._query(query)
  File "C:\Users\zaitsev_ad\PycharmProjects\ERKNM\venv\lib\site-packages\pymysql\cursors.py", line 310, in _query
    conn.query(q)
  File "C:\Users\zaitsev_ad\PycharmProjects\ERKNM\venv\lib\site-packages\pymysql\connections.py", line 548, in query
    self._affected_rows = self._read_query_result(unbuffered=unbuffered)
  File "C:\Users\zaitsev_ad\PycharmProjects\ERKNM\venv\lib\site-packages\pymysql\connections.py", line 775, in _read_query_result
    result.read()
  File "C:\Users\zaitsev_ad\PycharmProjects\ERKNM\venv\lib\site-packages\pymysql\connections.py", line 1156, in read
    first_packet = self.connection._read_packet()
  File "C:\Users\zaitsev_ad\PycharmProjects\ERKNM\venv\lib\site-packages\pymysql\connections.py", line 725, in _read_packet
    packet.raise_for_error()
  File "C:\Users\zaitsev_ad\PycharmProjects\ERKNM\venv\lib\site-packages\pymysql\protocol.py", line 221, in raise_for_error
    err.raise_mysql_exception(self._data)
  File "C:\Users\zaitsev_ad\PycharmProjects\ERKNM\venv\lib\site-packages\pymysql\err.py", line 143, in raise_mysql_exception
    raise errorclass(errno, errval)
pymysql.err.ProgrammingError: (1064, "You have an error in your SQL syntax; check the manual that corresponds to your MySQL server version for the right syntax to use near 'Котовский район, с.Мокрая Ольховка, ул.Ленин' at line 1")
2022-12-20 12:42:13,776 - [INFO] - sql.py - ultra_create_handler(198) - {'actCreateDate': None, 'actCreateDateEn': None, 'addresses': ['403820, ОБЛАСТЬ ВОЛГОГРАДСКАЯ, РАЙОН КОТОВСКИЙ, СЕЛО МОКРАЯ ОЛЬХОВКА, УЛИЦА ШКОЛЬНАЯ, 9, ', " 403820,Волгоградская область,'Котовский район, с.Мокрая Ольховка, ул.Ленина, д.22", '403821, обл. Волгоградская, р-н Котовский, с Перещепное, ул. Школьная, д 24', "403822 Волгоградская область 'Котовский район, с. Крячки, ул. Школьная, д. 2'"], 'admLevelId': 50001, 'appealed': False, 'approveDocOrderDate': None, 'approveDocOrderNum': None, 'approveDocRequestDate': None, 'approveDocRequestNum': None, 'approveDocs': [], 'approveRequired': False, 'approved': False, 'approvedErknm': 'Отказано', 'chlistCount': 0, 'chlistFilledCount': 0, 'chlistFillingIndicationTypeId': [], 'collaboratingOrganizations': [], 'collaboratingOrganizationsIds': [], 'comment': 'Объекты контроля включены в план вопреки п. 11 (4) Постановления Правительства РФ от 10.03.2022 № 336 «Об особенностях организации и осуществления государственного контроля (надзора), муниципального контроля», согласно которому в планы проведения плановых контрольных (надзорных) мероприятий на 2023 год не включаются плановые контрольные (надзорные) мероприятия в отношении государственных и муниципальных учреждений дошкольного и начального общего образования, основного общего и среднего общего образования, объекты контроля которых отнесены к категориям чрезвычайно высокого и высокого риска.', 'controllingOrganization': 'Управление Роспотребнадзора по Волгоградской области', 'controllingOrganizationId': 10001013326, 'createPlanDate': None, 'createPlanDateLong': None, 'createdByErpDb': False, 'createdById': 166438, 'dataNotEqualEGRUL': False, 'dataSetNotInTime': False, 'deleted': False, 'directDurationDays': None, 'disapprove': False, 'district': 'Волгоградская область', 'districtId': 1040180000000001, 'durationDays': 10, 'durationHours': None, 'erknmActViolationIds': [], 'erknmResultKindDecisionIds': [], 'erpId': '34230041000103545592', 'events': [{'startDate': '05.04.2023', 'stopDate': '17.04.2023', 'title': 'Осмотр'}, {'startDate': '05.04.2023', 'stopDate': '17.04.2023', 'title': 'Получение письменных объяснений'}, {'startDate': '05.04.2023', 'stopDate': '17.04.2023', 'title': 'Истребование документов'}, {'startDate': '05.04.2023', 'stopDate': '17.04.2023', 'title': 'Отбор проб (образцов)'}, {'startDate': '05.04.2023', 'stopDate': '17.04.2023', 'title': 'Инструментальное обследование'}, {'startDate': '05.04.2023', 'stopDate': '17.04.2023', 'title': 'Испытание'}], 'federalLaw': '248', 'federalLawId': 3, 'fullFieldViolationKnm': False, 'hasViolations': False, 'id': 13617709, 'inn': '3414012447', 'inspectorFullName': [], 'isFromSmev': False, 'isHasApproveDocs': False, 'isHasCollaboratingOrganization': False, 'isHasRequirements': True, 'isHasViolationTerm': False, 'isPm': False, 'kind': 'Выездная проверка', 'knmAnnulled': False, 'knmRejected': False, 'knmType': 'Плановое КНМ', 'knmTypeId': 4, 'legalBasisDocName': [], 'links': [], 'mspCategory': ['Не является субъектом МСП'], 'noPunishment': False, 'notifyLate': False, 'objectsKind': ['общеобразовательные организации', 'дошкольные образовательные организации', 'общеобразовательные организации', 'общеобразовательные организации'], 'objectsSubKind': ['общеобразовательные организации', 'дошкольные образовательные организации', 'общеобразовательные организации', 'общеобразовательные организации'], 'objectsType': ['Деятельность и действия', 'Деятельность и действия', 'Деятельность и действия', 'Деятельность и действия'], 'ogrn': '1023404975384', 'oldKnm': None, 'oldPlan': None, 'orderDone': False, 'organizationName': 'МУНИЦИПАЛЬНОЕ КАЗЕННОЕ ОБЩЕОБРАЗОВАТЕЛЬНОЕ УЧРЕЖДЕНИЕ "МОКРО-ОЛЬХОВСКАЯ СРЕДНЯЯ ШКОЛА" КОТОВСКОГО МУНИЦИПАЛЬНОГО РАЙОНА ВОЛГОГРАДСКОЙ ОБЛАСТИ', 'organizationsInn': ['3414012447'], 'organizationsName': ['МУНИЦИПАЛЬНОЕ КАЗЕННОЕ ОБЩЕОБРАЗОВАТЕЛЬНОЕ УЧРЕЖДЕНИЕ "МОКРО-ОЛЬХОВСКАЯ СРЕДНЯЯ ШКОЛА" КОТОВСКОГО МУНИЦИПАЛЬНОГО РАЙОНА ВОЛГОГРАДСКОЙ ОБЛАСТИ'], 'organizationsOgrn': ['1023404975384'], 'planId': '2023050594', 'prosecutorOrganization': 'Прокуратура Волгоградской области', 'prosecutorOrganizationId': 995, 'publishedStatus': 'UNPUBLISHED', 'reasons': [201], 'reasonsList': [{'assignmentDate': None, 'assignmentDateEn': None, 'assignmentNumber': None, 'date': '27.09.2019', 'dateEn': '2019-09-27', 'requirementDetails': None, 'text': '(ФЗ 248) Истечение установленного федеральным законом о виде контроля, положением о виде контроля период времени с даты окончания проведения последнего планового контрольного (надзорного) мероприятия'}], 'recEmptyOrLate': False, 'regDateEgrul': '21.09.2022', 'regDateEgrulEn': '2022-09-21', 'regLate': False, 'regTypes': [], 'requirements': 9, 'requirementsList': [{'nameNpa': '«О санитарно – эпидемиологическом благополучии населения» ч.3 ст. 39, п.1 , п. 5 ч.2, ст.44, ст. 10, ст.11, ст.24, ст.28, п.3 ст.29, ст.34, ст.35, ст.36', 'numberNpa': '30.03.1999', 'title': 'Федеральный закон РФ № 52-ФЗ от 30.03.1999   '}, {'nameNpa': '"САНИТАРНО-ЭПИДЕМИОЛОГИЧЕСКИЕ ТРЕБОВАНИЯ К ОРГАНИЗАЦИЯМ\nВОСПИТАНИЯ И ОБУЧЕНИЯ, ОТДЫХА И ОЗДОРОВЛЕНИЯ ДЕТЕЙ\nИ МОЛОДЕЖИ"\n', 'numberNpa': '28.10.2020', 'title': 'СП 2.4.3648-20    28.10.2020\n'}, {'nameNpa': '"Санитарно-эпидемиологические требования к организации общественного питания населения"', 'numberNpa': '27.10.2020', 'title': 'СанПиН 2.3/2.4.3590-20  27.10.2020\n\n'}, {'nameNpa': ' "О качестве и безопасности пищевых продуктов" (с изменениями и дополнениями)', 'numberNpa': '02.01.2000', 'title': 'Федеральный закон N 29-ФЗ от 02.01.2000 г.'}, {'nameNpa': '« Гигиенические нормативы  и требования к обеспечению безопасности (или) безвредности  для человека факторов среды  обитания»\n', 'numberNpa': '29.01.2021', 'title': 'Сан ПиН 1.2.3685-21    29.01.2021\n'}, {'nameNpa': '«Санитарно-эпидемиологические требования к содержанию территорий городских и сельских поселений, к водным объектам, питьевой воде и питьевому водоснабжению, атмосферному воздух, почвам, жилым помещениям, эксплуатации производственных, общественных помещений, организации проведению санитарно-противоэпидемических (профилактических) мероприятий» (разделы I, II, IV, VIII, X с приложениями);', 'numberNpa': '28.01.2021', 'title': 'СанПиН 2.1.3684-21       28.01.2021\n\n'}, {'nameNpa': ' "Санитарно-эпидемиологические требования по профилактике инфекционных болезней"', 'numberNpa': '15.02.2021', 'title': 'СанПиН 3.3686-21      15.02.2021 г\n\n'}, {'nameNpa': '«Санитарно-эпидемиологические требования к устройству, содержанию и организации работы образовательных организаций и других объектов социальной инфраструктуры для детей и молодежи в условиях распространения новой коронавирусной инфекции  (COVID-19)»   гл.I.II.III\n(разделы I, II, V).', 'numberNpa': '30.06.2020', 'title': 'СП 3.1/2.4.3598-20     30.06.2020 г\n\n'}, {'nameNpa': ' " Организация и проведение производственного контроля за соблюдением санитарных правил и выполнением санитарно-противоэпидемических (профилактических) мероприятий»\n  Раздел II.раздел III,', 'numberNpa': '30.10.2001', 'title': 'СП 1.1.1058-01    30.10.2001\n \n'}], 'resolved': False, 'resultEmpty': True, 'resultEmptyOrLate': False, 'resultInfoTypeCodes': [], 'resultViolationKnm': False, 'riskCategory': ['чрезвычайно высокий риск', 'чрезвычайно высокий риск', 'чрезвычайно высокий риск', 'чрезвычайно высокий риск'], 'riskCategoryAndDangerClass': ['чрезвычайно высокий риск / Первый', 'чрезвычайно высокий риск / Первый', 'чрезвычайно высокий риск / Первый', 'чрезвычайно высокий риск / Первый'], 'sezRegistryExists': False, 'signed': True, 'smevInfoType': None, 'smevMessageType': None, 'smevReceivedAt': None, 'smevReceivedAtEn': None, 'smevReceivedAtMonth': None, 'smevReceivedAtYear': None, 'spvRegistryExists': False, 'startDate': '05.04.2023', 'startDateEn': '2023-04-05', 'status': 'Исключена', 'statusEgrul': 'Найден', 'statusId': 15, 'stopDate': '18.04.2023', 'stopDateEn': '2023-04-18', 'subjectTypeId': 0, 'supervisionType': 'Федеральный государственный санитарно-эпидемиологический контроль (надзор)', 'supervisionTypeId': 4, 'torRegistryExists': False, 'updatePlanDate': None, 'updatePlanDateLong': None, 'version': 'ERKNM', 'violationLawsuitTypeCodes': [], 'violationTypeCodes': [], 'year': 2023}
2022-12-20 12:45:26,889 - [ERROR] - sql.py - ultra_create_handler(167) - не получилось внести субъект (не рейд):
Traceback (most recent call last):
  File "C:\Users\zaitsev_ad\PycharmProjects\ERKNM\sql.py", line 159, in ultra_create_handler
    cursor.execute(f"""INSERT INTO knd_subject(name, address, inn, ogrn, e_mail, district) VALUES (
  File "C:\Users\zaitsev_ad\PycharmProjects\ERKNM\venv\lib\site-packages\pymysql\cursors.py", line 148, in execute
    result = self._query(query)
  File "C:\Users\zaitsev_ad\PycharmProjects\ERKNM\venv\lib\site-packages\pymysql\cursors.py", line 310, in _query
    conn.query(q)
  File "C:\Users\zaitsev_ad\PycharmProjects\ERKNM\venv\lib\site-packages\pymysql\connections.py", line 548, in query
    self._affected_rows = self._read_query_result(unbuffered=unbuffered)
  File "C:\Users\zaitsev_ad\PycharmProjects\ERKNM\venv\lib\site-packages\pymysql\connections.py", line 775, in _read_query_result
    result.read()
  File "C:\Users\zaitsev_ad\PycharmProjects\ERKNM\venv\lib\site-packages\pymysql\connections.py", line 1156, in read
    first_packet = self.connection._read_packet()
  File "C:\Users\zaitsev_ad\PycharmProjects\ERKNM\venv\lib\site-packages\pymysql\connections.py", line 725, in _read_packet
    packet.raise_for_error()
  File "C:\Users\zaitsev_ad\PycharmProjects\ERKNM\venv\lib\site-packages\pymysql\protocol.py", line 221, in raise_for_error
    err.raise_mysql_exception(self._data)
  File "C:\Users\zaitsev_ad\PycharmProjects\ERKNM\venv\lib\site-packages\pymysql\err.py", line 143, in raise_mysql_exception
    raise errorclass(errno, errval)
pymysql.err.ProgrammingError: (1064, 'You have an error in your SQL syntax; check the manual that corresponds to your MySQL server version for the right syntax to use near \'АРТ"\', \'394018, ОБЛАСТЬ ВОРОНЕЖСКАЯ, ГОРОД ВОРОНÐ\' at line 2')
2022-12-20 12:45:26,907 - [INFO] - sql.py - ultra_create_handler(168) - {'actCreateDate': None, 'actCreateDateEn': None, 'addresses': ['394018, ОБЛАСТЬ ВОРОНЕЖСКАЯ, ГОРОД ВОРОНЕЖ, УЛИЦА ПУШКИНСКАЯ, ДОМ 11А, ОФИС 6'], 'admLevelId': 50001, 'appealed': False, 'approveDocOrderDate': None, 'approveDocOrderNum': None, 'approveDocRequestDate': None, 'approveDocRequestNum': None, 'approveDocs': [], 'approveRequired': False, 'approved': True, 'approvedErknm': 'Согласовано', 'chlistCount': 1, 'chlistFilledCount': 1, 'chlistFillingIndicationTypeId': [], 'collaboratingOrganizations': [], 'collaboratingOrganizationsIds': [], 'comment': 'В нарушение требований ст.61 Федерального закона от 31.07.2020 №248-ФЗ, Правил, утвержденных постановлением Правительства РФ от 31.12.2020 №2428, не указан срок проведения контрольного (надзорного) мероприятия.', 'controllingOrganization': 'Управление Роспотребнадзора по Воронежской области', 'controllingOrganizationId': 10001013401, 'createPlanDate': None, 'createPlanDateLong': None, 'createdByErpDb': False, 'createdById': 215779, 'dataNotEqualEGRUL': False, 'dataSetNotInTime': False, 'deleted': False, 'directDurationDays': None, 'disapprove': False, 'district': 'Воронежская область', 'districtId': 1030200000000001, 'durationDays': 2, 'durationHours': 15, 'erknmActViolationIds': [], 'erknmResultKindDecisionIds': [], 'erpId': '36230041000102904655', 'events': [{'startDate': '09.02.2023', 'stopDate': '10.02.2023', 'title': 'Осмотр'}, {'startDate': '09.02.2023', 'stopDate': '10.02.2023', 'title': 'Досмотр'}, {'startDate': '09.02.2023', 'stopDate': '10.02.2023', 'title': 'Опрос'}, {'startDate': '09.02.2023', 'stopDate': '10.02.2023', 'title': 'Получение письменных объяснений'}, {'startDate': '09.02.2023', 'stopDate': '10.02.2023', 'title': 'Истребование документов'}, {'startDate': '09.02.2023', 'stopDate': '09.02.2023', 'title': 'Отбор проб (образцов)'}, {'startDate': '09.02.2023', 'stopDate': '09.02.2023', 'title': 'Инструментальное обследование'}, {'startDate': '09.02.2023', 'stopDate': '10.02.2023', 'title': 'Испытание'}, {'startDate': '09.02.2023', 'stopDate': '10.02.2023', 'title': 'Экспертиза'}], 'federalLaw': '248', 'federalLawId': 3, 'fullFieldViolationKnm': False, 'hasViolations': False, 'id': 12976772, 'inn': '3666109704', 'inspectorFullName': [], 'isFromSmev': False, 'isHasApproveDocs': False, 'isHasCollaboratingOrganization': False, 'isHasRequirements': True, 'isHasViolationTerm': False, 'isPm': False, 'kind': 'Выездная проверка', 'knmAnnulled': False, 'knmRejected': False, 'knmType': 'Плановое КНМ', 'knmTypeId': 4, 'legalBasisDocName': [], 'links': [], 'mspCategory': ['Микропредприятие'], 'noPunishment': False, 'notifyLate': False, 'objectsKind': ['Деятельность лечебно-профилактических организаций'], 'objectsSubKind': ['Деятельность лечебно-профилактических организаций'], 'objectsType': ['Деятельность и действия'], 'ogrn': '1033600145688', 'oldKnm': None, 'oldPlan': None, 'orderDone': False, 'organizationName': 'ОБЩЕСТВО С ОГРАНИЧЕННОЙ ОТВЕТСТВЕННОСТЬЮ СТОМАТОЛОГИЧЕСКАЯ КЛИНИКА "Д\'АРТ"', 'organizationsInn': ['3666109704'], 'organizationsName': ['ОБЩЕСТВО С ОГРАНИЧЕННОЙ ОТВЕТСТВЕННОСТЬЮ СТОМАТОЛОГИЧЕСКАЯ КЛИНИКА "Д\'АРТ"'], 'organizationsOgrn': ['1033600145688'], 'planId': '2023050903', 'prosecutorOrganization': 'Прокуратура Воронежской области', 'prosecutorOrganizationId': 87, 'publishedStatus': 'UNPUBLISHED', 'reasons': [201], 'reasonsList': [{'assignmentDate': None, 'assignmentDateEn': None, 'assignmentNumber': None, 'date': '29.04.2019', 'dateEn': '2019-04-29', 'requirementDetails': None, 'text': '(ФЗ 248) Истечение установленного федеральным законом о виде контроля, положением о виде контроля период времени с даты окончания проведения последнего планового контрольного (надзорного) мероприятия'}], 'recEmptyOrLate': False, 'regDateEgrul': '17.08.2022', 'regDateEgrulEn': '2022-08-17', 'regLate': False, 'regTypes': ['MSP'], 'requirements': 16, 'requirementsList': [{'nameNpa': None, 'numberNpa': None, 'title': None}, {'nameNpa': None, 'numberNpa': None, 'title': None}, {'nameNpa': None, 'numberNpa': None, 'title': None}, {'nameNpa': None, 'numberNpa': None, 'title': None}, {'nameNpa': None, 'numberNpa': None, 'title': None}, {'nameNpa': None, 'numberNpa': None, 'title': None}, {'nameNpa': None, 'numberNpa': None, 'title': None}, {'nameNpa': None, 'numberNpa': None, 'title': None}, {'nameNpa': None, 'numberNpa': None, 'title': None}, {'nameNpa': None, 'numberNpa': None, 'title': None}, {'nameNpa': None, 'numberNpa': None, 'title': None}, {'nameNpa': None, 'numberNpa': None, 'title': None}, {'nameNpa': None, 'numberNpa': None, 'title': None}, {'nameNpa': None, 'numberNpa': None, 'title': None}, {'nameNpa': None, 'numberNpa': None, 'title': None}, {'nameNpa': None, 'numberNpa': None, 'title': None}], 'resolved': False, 'resultEmpty': True, 'resultEmptyOrLate': False, 'resultInfoTypeCodes': [], 'resultViolationKnm': False, 'riskCategory': ['высокий риск'], 'riskCategoryAndDangerClass': ['высокий риск'], 'sezRegistryExists': False, 'signed': True, 'smevInfoType': None, 'smevMessageType': None, 'smevReceivedAt': None, 'smevReceivedAtEn': None, 'smevReceivedAtMonth': None, 'smevReceivedAtYear': None, 'spvRegistryExists': False, 'startDate': '09.02.2023', 'startDateEn': '2023-02-09', 'status': 'Ожидает проведения', 'statusEgrul': 'Найден', 'statusId': 5, 'stopDate': '10.02.2023', 'stopDateEn': '2023-02-10', 'subjectTypeId': 0, 'supervisionType': 'Федеральный государственный санитарно-эпидемиологический контроль (надзор)', 'supervisionTypeId': 4, 'torRegistryExists': False, 'updatePlanDate': None, 'updatePlanDateLong': None, 'version': 'ERKNM', 'violationLawsuitTypeCodes': [], 'violationTypeCodes': [], 'year': 2023}
2022-12-20 12:46:12,567 - [ERROR] - sql.py - ultra_create_handler(167) - не получилось внести субъект (не рейд):
Traceback (most recent call last):
  File "C:\Users\zaitsev_ad\PycharmProjects\ERKNM\sql.py", line 159, in ultra_create_handler
    cursor.execute(f"""INSERT INTO knd_subject(name, address, inn, ogrn, e_mail, district) VALUES (
  File "C:\Users\zaitsev_ad\PycharmProjects\ERKNM\venv\lib\site-packages\pymysql\cursors.py", line 148, in execute
    result = self._query(query)
  File "C:\Users\zaitsev_ad\PycharmProjects\ERKNM\venv\lib\site-packages\pymysql\cursors.py", line 310, in _query
    conn.query(q)
  File "C:\Users\zaitsev_ad\PycharmProjects\ERKNM\venv\lib\site-packages\pymysql\connections.py", line 548, in query
    self._affected_rows = self._read_query_result(unbuffered=unbuffered)
  File "C:\Users\zaitsev_ad\PycharmProjects\ERKNM\venv\lib\site-packages\pymysql\connections.py", line 775, in _read_query_result
    result.read()
  File "C:\Users\zaitsev_ad\PycharmProjects\ERKNM\venv\lib\site-packages\pymysql\connections.py", line 1156, in read
    first_packet = self.connection._read_packet()
  File "C:\Users\zaitsev_ad\PycharmProjects\ERKNM\venv\lib\site-packages\pymysql\connections.py", line 725, in _read_packet
    packet.raise_for_error()
  File "C:\Users\zaitsev_ad\PycharmProjects\ERKNM\venv\lib\site-packages\pymysql\protocol.py", line 221, in raise_for_error
    err.raise_mysql_exception(self._data)
  File "C:\Users\zaitsev_ad\PycharmProjects\ERKNM\venv\lib\site-packages\pymysql\err.py", line 143, in raise_mysql_exception
    raise errorclass(errno, errval)
pymysql.err.ProgrammingError: (1064, 'You have an error in your SQL syntax; check the manual that corresponds to your MySQL server version for the right syntax to use near \'30" с.ш. 60*07\'57"в.д., \', \'6682001206\', \'6682001206\', \' \', \' \')\' at line 2')
2022-12-20 12:46:12,569 - [INFO] - sql.py - ultra_create_handler(168) - {'actCreateDate': None, 'actCreateDateEn': None, 'addresses': ['624170, Невьянский район, п. Цементный, -На территории НГО в 1 км северо-западнее п. Цементный на левобережье р. Северной Шуралки в 0.2-0.3 км от русла 57*28\'30" с.ш. 60*07\'57"в.д., ', '624190, г. Невьянск, -На застроенной юго-западной окраине г. Невьянска в 1 км юго-восточнее ж\\д вокзала ст. Невьянск на правом берегу р. Белая(левый приток р. Нейва в 1.2-, -', '624190, г. Невьянск, -, -\n', '624190, г. Невьянск, - На застроенной юго-западной окраине г. Невьянска, в 1 км юго-восточнее ж/д вокзала ст. Невьянск, на правом берегу реки Белая (левый приток р. Нейва, -\n', "624190, г. Невьянск, -В  3.5км северо-восточнее г. Невьянска.0.8км западнее с. Ьыньги в долине р Ближняя Быньга,, на ее правобережье в 0.14-0.18км от ее русла. 57*32' с.ш., -\n", '624190, Невьянский район, п. Цементный, -250 м на север от границ поселка Цементный 57°28’32"с.ш.  60°07’60"в.д., -\n'], 'admLevelId': 50001, 'appealed': False, 'approveDocOrderDate': None, 'approveDocOrderNum': None, 'approveDocRequestDate': None, 'approveDocRequestNum': None, 'approveDocs': [], 'approveRequired': False, 'approved': True, 'approvedErknm': 'Согласовано', 'chlistCount': 0, 'chlistFilledCount': 0, 'chlistFillingIndicationTypeId': [], 'collaboratingOrganizations': [], 'collaboratingOrganizationsIds': [], 'comment': '1.\tРаздел «Предмет контрольного (надзорного) мероприятия» не сформирован в соответствии с подп. «в» п. 8 Правил формирования плана проведения плановых контрольных (надзорных) мероприятий на очередной календарный год, его согласования с органами прокуратуры, включения в него и исключения из него контрольных (надзорных) мероприятий в течение года, утвержденных постановлением Правительства Российской Федерации от 31.12.2020 № 2428, п.п. 1, 2 ч. 1 ст. 15, ч. 5.5 ст. 98 Федерального закона от 31.07.2020 № 248-ФЗ «О государственном контроле (надзоре) и муниципальном контроле в Российской Федерации» (обязательные требования, подлежащие проверке, должны быть сформированы по данным Реестра обязательных требований).\n2.\tВ нарушение абз. 5 подп. «в» п. 5 Правил формирования и ведения единого реестра видов федерального государственного контроля (надзора), регионального государственного контроля (надзора), муниципального контроля, являющихся приложением к Правилам ведения федеральной государственной информационной системы «Федеральный реестр государственных и муниципальных услуг (функций)», утвержденным постановлением Правительства РФ от 24.10.2021 № 861 «О федеральных государственных информационных системах, обеспечивающих предоставление в электронной форме государственных и муниципальных услуг (осуществление функций)» отсутствуют сведения о присвоенной объекту контроля категории риска в Едином реестре видов контроля.\n3.\tДокументарная проверка в силу ч. 1 ст. 72 Федерального закона от 31.07.2020 № 248-ФЗ «О государственном контроле (надзоре) и муниципальном контроле в Российской Федерации» проводится по месту нахождения контрольного (надзорного) органа.', 'controllingOrganization': 'Управление Роспотребнадзора по Свердловской области', 'controllingOrganizationId': 10001020657, 'createPlanDate': None, 'createPlanDateLong': None, 'createdByErpDb': False, 'createdById': 194900, 'dataNotEqualEGRUL': False, 'dataSetNotInTime': False, 'deleted': False, 'directDurationDays': None, 'disapprove': False, 'district': 'Свердловская область', 'districtId': 1034650000000001, 'durationDays': 10, 'durationHours': None, 'erknmActViolationIds': [], 'erknmResultKindDecisionIds': [], 'erpId': '66230041000103487083', 'events': [{'startDate': '15.02.2023', 'stopDate': '02.03.2023', 'title': 'Истребование документов'}, {'startDate': '15.02.2023', 'stopDate': '02.03.2023', 'title': 'Получение письменных объяснений'}, {'startDate': '15.02.2023', 'stopDate': '02.03.2023', 'title': 'Экспертиза'}], 'federalLaw': '248', 'federalLawId': 3, 'fullFieldViolationKnm': False, 'hasViolations': False, 'id': 13559200, 'inn': '6682001206', 'inspectorFullName': [], 'isFromSmev': False, 'isHasApproveDocs': False, 'isHasCollaboratingOrganization': False, 'isHasRequirements': True, 'isHasViolationTerm': False, 'isPm': False, 'kind': 'Документарная проверка', 'knmAnnulled': False, 'knmRejected': False, 'knmType': 'Плановое КНМ', 'knmTypeId': 4, 'legalBasisDocName': [], 'links': [], 'mspCategory': ['Не является субъектом МСП'], 'noPunishment': False, 'notifyLate': False, 'objectsKind': ['Деятельность по водоподготовке и водоснабжению', 'Деятельность по водоподготовке и водоснабжению', 'Деятельность по водоподготовке и водоснабжению', 'Деятельность по водоподготовке и водоснабжению', 'Деятельность по водоподготовке и водоснабжению', 'Деятельность по водоподготовке и водоснабжению'], 'objectsSubKind': ['Деятельность по водоподготовке и водоснабжению', 'Деятельность по водоподготовке и водоснабжению', 'Деятельность по водоподготовке и водоснабжению', 'Деятельность по водоподготовке и водоснабжению', 'Деятельность по водоподготовке и водоснабжению', 'Деятельность по водоподготовке и водоснабжению'], 'objectsType': ['Деятельность и действия', 'Деятельность и действия', 'Деятельность и действия', 'Деятельность и действия', 'Деятельность и действия', 'Деятельность и действия'], 'ogrn': '1126682001270', 'oldKnm': None, 'oldPlan': None, 'orderDone': False, 'organizationName': 'МУНИЦИПАЛЬНОЕ УНИТАРНОЕ ПРЕДПРИЯТИЕ "НЕВЬЯНСКИЙ ВОДОКАНАЛ" НЕВЬЯНСКОГО ГОРОДСКОГО ОКРУГА', 'organizationsInn': ['6682001206'], 'organizationsName': ['МУНИЦИПАЛЬНОЕ УНИТАРНОЕ ПРЕДПРИЯТИЕ "НЕВЬЯНСКИЙ ВОДОКАНАЛ" НЕВЬЯНСКОГО ГОРОДСКОГО ОКРУГА'], 'organizationsOgrn': ['1126682001270'], 'planId': '2023051239', 'prosecutorOrganization': 'Прокуратура Свердловской области', 'prosecutorOrganizationId': 1821, 'publishedStatus': 'UNPUBLISHED', 'reasons': [201], 'reasonsList': [{'assignmentDate': None, 'assignmentDateEn': None, 'assignmentNumber': None, 'date': '26.08.2021', 'dateEn': '2021-08-26', 'requirementDetails': None, 'text': '(ФЗ 248) Истечение установленного федеральным законом о виде контроля, положением о виде контроля период времени с даты окончания проведения последнего планового контрольного (надзорного) мероприятия'}], 'recEmptyOrLate': False, 'regDateEgrul': '19.09.2022', 'regDateEgrulEn': '2022-09-19', 'regLate': False, 'regTypes': [], 'requirements': 14, 'requirementsList': [{'nameNpa': None, 'numberNpa': None, 'title': None}, {'nameNpa': None, 'numberNpa': None, 'title': None}, {'nameNpa': None, 'numberNpa': None, 'title': None}, {'nameNpa': None, 'numberNpa': None, 'title': None}, {'nameNpa': None, 'numberNpa': None, 'title': None}, {'nameNpa': None, 'numberNpa': None, 'title': None}, {'nameNpa': None, 'numberNpa': None, 'title': None}, {'nameNpa': None, 'numberNpa': None, 'title': None}, {'nameNpa': None, 'numberNpa': None, 'title': None}, {'nameNpa': None, 'numberNpa': None, 'title': None}, {'nameNpa': None, 'numberNpa': None, 'title': None}, {'nameNpa': None, 'numberNpa': None, 'title': None}, {'nameNpa': None, 'numberNpa': None, 'title': None}, {'nameNpa': None, 'numberNpa': None, 'title': None}], 'resolved': False, 'resultEmpty': True, 'resultEmptyOrLate': False, 'resultInfoTypeCodes': [], 'resultViolationKnm': False, 'riskCategory': ['чрезвычайно высокий риск', 'чрезвычайно высокий риск', 'чрезвычайно высокий риск', 'чрезвычайно высокий риск', 'чрезвычайно высокий риск', 'чрезвычайно высокий риск'], 'riskCategoryAndDangerClass': ['чрезвычайно высокий риск', 'чрезвычайно высокий риск', 'чрезвычайно высокий риск', 'чрезвычайно высокий риск', 'чрезвычайно высокий риск', 'чрезвычайно высокий риск'], 'sezRegistryExists': False, 'signed': True, 'smevInfoType': None, 'smevMessageType': None, 'smevReceivedAt': None, 'smevReceivedAtEn': None, 'smevReceivedAtMonth': None, 'smevReceivedAtYear': None, 'spvRegistryExists': False, 'startDate': '15.02.2023', 'startDateEn': '2023-02-15', 'status': 'Ожидает проведения', 'statusEgrul': 'В процессе поиска', 'statusId': 5, 'stopDate': '02.03.2023', 'stopDateEn': '2023-03-02', 'subjectTypeId': 0, 'supervisionType': 'Федеральный государственный санитарно-эпидемиологический контроль (надзор)', 'supervisionTypeId': 4, 'torRegistryExists': False, 'updatePlanDate': None, 'updatePlanDateLong': None, 'version': 'ERKNM', 'violationLawsuitTypeCodes': [], 'violationTypeCodes': [], 'year': 2023}
2022-12-20 12:54:35,591 - [ERROR] - sql.py - ultra_create_handler(167) - не получилось внести субъект (не рейд):
Traceback (most recent call last):
  File "C:\Users\zaitsev_ad\PycharmProjects\ERKNM\sql.py", line 159, in ultra_create_handler
    cursor.execute(f"""INSERT INTO knd_subject(name, address, inn, ogrn, e_mail, district) VALUES (
  File "C:\Users\zaitsev_ad\PycharmProjects\ERKNM\venv\lib\site-packages\pymysql\cursors.py", line 148, in execute
    result = self._query(query)
  File "C:\Users\zaitsev_ad\PycharmProjects\ERKNM\venv\lib\site-packages\pymysql\cursors.py", line 310, in _query
    conn.query(q)
  File "C:\Users\zaitsev_ad\PycharmProjects\ERKNM\venv\lib\site-packages\pymysql\connections.py", line 548, in query
    self._affected_rows = self._read_query_result(unbuffered=unbuffered)
  File "C:\Users\zaitsev_ad\PycharmProjects\ERKNM\venv\lib\site-packages\pymysql\connections.py", line 775, in _read_query_result
    result.read()
  File "C:\Users\zaitsev_ad\PycharmProjects\ERKNM\venv\lib\site-packages\pymysql\connections.py", line 1156, in read
    first_packet = self.connection._read_packet()
  File "C:\Users\zaitsev_ad\PycharmProjects\ERKNM\venv\lib\site-packages\pymysql\connections.py", line 725, in _read_packet
    packet.raise_for_error()
  File "C:\Users\zaitsev_ad\PycharmProjects\ERKNM\venv\lib\site-packages\pymysql\protocol.py", line 221, in raise_for_error
    err.raise_mysql_exception(self._data)
  File "C:\Users\zaitsev_ad\PycharmProjects\ERKNM\venv\lib\site-packages\pymysql\err.py", line 143, in raise_mysql_exception
    raise errorclass(errno, errval)
pymysql.err.ProgrammingError: (1064, 'You have an error in your SQL syntax; check the manual that corresponds to your MySQL server version for the right syntax to use near \'К"\', \'160017, г. Вологда, ул. Ленинградская, д. 75-б\',\' at line 2')
2022-12-20 12:54:35,608 - [INFO] - sql.py - ultra_create_handler(168) - {'actCreateDate': None, 'actCreateDateEn': None, 'addresses': ['160017, г. Вологда, ул. Ленинградская, д. 75-б'], 'admLevelId': 50001, 'appealed': False, 'approveDocOrderDate': None, 'approveDocOrderNum': None, 'approveDocRequestDate': '25.11.2022', 'approveDocRequestNum': None, 'approveDocs': [], 'approveRequired': False, 'approved': True, 'approvedErknm': 'Согласовано', 'chlistCount': 1, 'chlistFilledCount': 1, 'chlistFillingIndicationTypeId': [], 'collaboratingOrganizations': [], 'collaboratingOrganizationsIds': [], 'comment': None, 'controllingOrganization': 'Управление Роспотребнадзора по Вологодской области', 'controllingOrganizationId': 10001013342, 'createPlanDate': None, 'createPlanDateLong': None, 'createdByErpDb': False, 'createdById': 184524, 'dataNotEqualEGRUL': False, 'dataSetNotInTime': False, 'deleted': False, 'directDurationDays': None, 'disapprove': False, 'district': 'Вологодская область', 'districtId': 1031190000000001, 'durationDays': 10, 'durationHours': 15, 'erknmActViolationIds': [], 'erknmResultKindDecisionIds': [], 'erpId': '35230041000103376772', 'events': [{'startDate': '29.03.2023', 'stopDate': '11.04.2023', 'title': 'Осмотр'}, {'startDate': '29.03.2023', 'stopDate': '11.04.2023', 'title': 'Получение письменных объяснений'}, {'startDate': '29.03.2023', 'stopDate': '11.04.2023', 'title': 'Истребование документов'}, {'startDate': '29.03.2023', 'stopDate': '11.04.2023', 'title': 'Отбор проб (образцов)'}, {'startDate': '29.03.2023', 'stopDate': '11.04.2023', 'title': 'Инструментальное обследование'}, {'startDate': '29.03.2023', 'stopDate': '11.04.2023', 'title': 'Испытание'}, {'startDate': '29.03.2023', 'stopDate': '11.04.2023', 'title': 'Экспертиза'}], 'federalLaw': '248', 'federalLawId': 3, 'fullFieldViolationKnm': False, 'hasViolations': False, 'id': 13448889, 'inn': '3525245398', 'inspectorFullName': [], 'isFromSmev': False, 'isHasApproveDocs': False, 'isHasCollaboratingOrganization': False, 'isHasRequirements': True, 'isHasViolationTerm': False, 'isPm': False, 'kind': 'Выездная проверка', 'knmAnnulled': False, 'knmRejected': False, 'knmType': 'Плановое КНМ', 'knmTypeId': 4, 'legalBasisDocName': [], 'links': [], 'mspCategory': ['Микропредприятие'], 'noPunishment': False, 'notifyLate': False, 'objectsKind': ['Деятельность стоматологических поликлиник(кабинетов), не использующих источники ионизирующего излучения'], 'objectsSubKind': ['Деятельность стоматологических поликлиник(кабинетов), не использующих источники ионизирующего излучения'], 'objectsType': ['Деятельность и действия'], 'ogrn': '1103525011941', 'oldKnm': None, 'oldPlan': None, 'orderDone': False, 'organizationName': 'ОБЩЕСТВО С ОГРАНИЧЕННОЙ ОТВЕТСТВЕННОСТЬЮ "ЗУБ О\'К"', 'organizationsInn': ['3525245398'], 'organizationsName': ['ОБЩЕСТВО С ОГРАНИЧЕННОЙ ОТВЕТСТВЕННОСТЬЮ "ЗУБ О\'К"'], 'organizationsOgrn': ['1103525011941'], 'planId': '2023058383', 'prosecutorOrganization': 'Прокуратура Вологодской области', 'prosecutorOrganizationId': 713, 'publishedStatus': 'UNPUBLISHED', 'reasons': [201], 'reasonsList': [{'assignmentDate': None, 'assignmentDateEn': None, 'assignmentNumber': None, 'date': '14.08.2018', 'dateEn': '2018-08-14', 'requirementDetails': None, 'text': '(ФЗ 248) Истечение установленного федеральным законом о виде контроля, положением о виде контроля период времени с даты окончания проведения последнего планового контрольного (надзорного) мероприятия'}], 'recEmptyOrLate': False, 'regDateEgrul': '12.09.2022', 'regDateEgrulEn': '2022-09-12', 'regLate': False, 'regTypes': ['MSP'], 'requirements': 11, 'requirementsList': [{'nameNpa': None, 'numberNpa': None, 'title': None}, {'nameNpa': None, 'numberNpa': None, 'title': None}, {'nameNpa': None, 'numberNpa': None, 'title': None}, {'nameNpa': None, 'numberNpa': None, 'title': None}, {'nameNpa': None, 'numberNpa': None, 'title': None}, {'nameNpa': None, 'numberNpa': None, 'title': None}, {'nameNpa': None, 'numberNpa': None, 'title': None}, {'nameNpa': None, 'numberNpa': None, 'title': None}, {'nameNpa': None, 'numberNpa': None, 'title': None}, {'nameNpa': None, 'numberNpa': None, 'title': None}, {'nameNpa': None, 'numberNpa': None, 'title': None}], 'resolved': False, 'resultEmpty': True, 'resultEmptyOrLate': False, 'resultInfoTypeCodes': [], 'resultViolationKnm': False, 'riskCategory': ['высокий риск'], 'riskCategoryAndDangerClass': ['высокий риск / Второй'], 'sezRegistryExists': False, 'signed': True, 'smevInfoType': None, 'smevMessageType': None, 'smevReceivedAt': None, 'smevReceivedAtEn': None, 'smevReceivedAtMonth': None, 'smevReceivedAtYear': None, 'spvRegistryExists': False, 'startDate': '29.03.2023', 'startDateEn': '2023-03-29', 'status': 'Ожидает проведения', 'statusEgrul': 'Найден', 'statusId': 5, 'stopDate': '11.04.2023', 'stopDateEn': '2023-04-11', 'subjectTypeId': 0, 'supervisionType': 'Федеральный государственный санитарно-эпидемиологический контроль (надзор)', 'supervisionTypeId': 4, 'torRegistryExists': False, 'updatePlanDate': None, 'updatePlanDateLong': None, 'version': 'ERKNM', 'violationLawsuitTypeCodes': [], 'violationTypeCodes': [], 'year': 2023}
2022-12-20 12:58:56,676 - [ERROR] - sql.py - ultra_create_handler(197) - не получилось внести объект (не рейд):
Traceback (most recent call last):
  File "C:\Users\zaitsev_ad\PycharmProjects\ERKNM\sql.py", line 177, in ultra_create_handler
    cursor.execute(
  File "C:\Users\zaitsev_ad\PycharmProjects\ERKNM\venv\lib\site-packages\pymysql\cursors.py", line 148, in execute
    result = self._query(query)
  File "C:\Users\zaitsev_ad\PycharmProjects\ERKNM\venv\lib\site-packages\pymysql\cursors.py", line 310, in _query
    conn.query(q)
  File "C:\Users\zaitsev_ad\PycharmProjects\ERKNM\venv\lib\site-packages\pymysql\connections.py", line 548, in query
    self._affected_rows = self._read_query_result(unbuffered=unbuffered)
  File "C:\Users\zaitsev_ad\PycharmProjects\ERKNM\venv\lib\site-packages\pymysql\connections.py", line 775, in _read_query_result
    result.read()
  File "C:\Users\zaitsev_ad\PycharmProjects\ERKNM\venv\lib\site-packages\pymysql\connections.py", line 1156, in read
    first_packet = self.connection._read_packet()
  File "C:\Users\zaitsev_ad\PycharmProjects\ERKNM\venv\lib\site-packages\pymysql\connections.py", line 725, in _read_packet
    packet.raise_for_error()
  File "C:\Users\zaitsev_ad\PycharmProjects\ERKNM\venv\lib\site-packages\pymysql\protocol.py", line 221, in raise_for_error
    err.raise_mysql_exception(self._data)
  File "C:\Users\zaitsev_ad\PycharmProjects\ERKNM\venv\lib\site-packages\pymysql\err.py", line 143, in raise_mysql_exception
    raise errorclass(errno, errval)
pymysql.err.ProgrammingError: (1064, "You have an error in your SQL syntax; check the manual that corresponds to your MySQL server version for the right syntax to use near 'Жирновский район, с.Бородачи, ул.ЦентральнаÑ' at line 1")
2022-12-20 12:58:56,690 - [INFO] - sql.py - ultra_create_handler(198) - {'actCreateDate': None, 'actCreateDateEn': None, 'addresses': ['403787, ОБЛАСТЬ ВОЛГОГРАДСКАЯ, РАЙОН ЖИРНОВСКИЙ, РАБОЧИЙ ПОСЕЛОК КРАСНЫЙ ЯР, УЛИЦА КАМЫШИНСКАЯ, 2А, ', "Волгоградская область,  'Жирновский район, с.Бородачи, ул.Центральная, д.45'; ", " '403772' Волгоградская область,'Жирновский район, р.п. Медведицкий, ул. Песчаная, д. 40'"], 'admLevelId': 50001, 'appealed': False, 'approveDocOrderDate': None, 'approveDocOrderNum': None, 'approveDocRequestDate': None, 'approveDocRequestNum': None, 'approveDocs': [], 'approveRequired': False, 'approved': False, 'approvedErknm': 'Отказано', 'chlistCount': 0, 'chlistFilledCount': 0, 'chlistFillingIndicationTypeId': [], 'collaboratingOrganizations': [], 'collaboratingOrganizationsIds': [], 'comment': 'Объекты контроля включены в план вопреки п. 11 (4) Постановления Правительства РФ от 10.03.2022 № 336 «Об особенностях организации и осуществления государственного контроля (надзора), муниципального контроля», согласно которому в планы проведения плановых контрольных (надзорных) мероприятий на 2023 год не включаются плановые контрольные (надзорные) мероприятия в отношении государственных и муниципальных учреждений дошкольного и начального общего образования, основного общего и среднего общего образования, объекты контроля которых отнесены к категориям чрезвычайно высокого и высокого риска.', 'controllingOrganization': 'Управление Роспотребнадзора по Волгоградской области', 'controllingOrganizationId': 10001013326, 'createPlanDate': None, 'createPlanDateLong': None, 'createdByErpDb': False, 'createdById': 166438, 'dataNotEqualEGRUL': False, 'dataSetNotInTime': False, 'deleted': False, 'directDurationDays': None, 'disapprove': False, 'district': 'Волгоградская область', 'districtId': 1040180000000001, 'durationDays': 10, 'durationHours': None, 'erknmActViolationIds': [], 'erknmResultKindDecisionIds': [], 'erpId': '34230041000103186761', 'events': [{'startDate': '07.03.2023', 'stopDate': '21.03.2023', 'title': 'Осмотр'}, {'startDate': '07.03.2023', 'stopDate': '21.03.2023', 'title': 'Получение письменных объяснений'}, {'startDate': '07.03.2023', 'stopDate': '21.03.2023', 'title': 'Истребование документов'}, {'startDate': '07.03.2023', 'stopDate': '21.03.2023', 'title': 'Отбор проб (образцов)'}, {'startDate': '07.03.2023', 'stopDate': '21.03.2023', 'title': 'Инструментальное обследование'}, {'startDate': '07.03.2023', 'stopDate': '21.03.2023', 'title': 'Испытание'}], 'federalLaw': '248', 'federalLawId': 3, 'fullFieldViolationKnm': False, 'hasViolations': False, 'id': 13258878, 'inn': '3407007647', 'inspectorFullName': [], 'isFromSmev': False, 'isHasApproveDocs': False, 'isHasCollaboratingOrganization': False, 'isHasRequirements': True, 'isHasViolationTerm': False, 'isPm': False, 'kind': 'Выездная проверка', 'knmAnnulled': False, 'knmRejected': False, 'knmType': 'Плановое КНМ', 'knmTypeId': 4, 'legalBasisDocName': [], 'links': [], 'mspCategory': ['Не является субъектом МСП'], 'noPunishment': False, 'notifyLate': False, 'objectsKind': ['дошкольные образовательные организации', 'дошкольные образовательные организации', 'дошкольные образовательные организации'], 'objectsSubKind': ['дошкольные образовательные организации', 'дошкольные образовательные организации', 'дошкольные образовательные организации'], 'objectsType': ['Деятельность и действия', 'Деятельность и действия', 'Деятельность и действия'], 'ogrn': '1023404971853', 'oldKnm': None, 'oldPlan': None, 'orderDone': False, 'organizationName': 'ДОШКОЛЬНОЕ ОБРАЗОВАТЕЛЬНОЕ УЧРЕЖДЕНИЕ КРАСНОЯРСКИЙ МУНИЦИПАЛЬНЫЙ ДЕТСКИЙ САД №3 "СМОРОДИНКА" ЖИРНОВСКОГО МУНИЦИПАЛЬНОГО РАЙОНА ВОЛГОГРАДСКОЙ ОБЛАСТИ', 'organizationsInn': ['3407007647'], 'organizationsName': ['ДОШКОЛЬНОЕ ОБРАЗОВАТЕЛЬНОЕ УЧРЕЖДЕНИЕ КРАСНОЯРСКИЙ МУНИЦИПАЛЬНЫЙ ДЕТСКИЙ САД №3 "СМОРОДИНКА" ЖИРНОВСКОГО МУНИЦИПАЛЬНОГО РАЙОНА ВОЛГОГРАДСКОЙ ОБЛАСТИ'], 'organizationsOgrn': ['1023404971853'], 'planId': '2023050594', 'prosecutorOrganization': 'Прокуратура Волгоградской области', 'prosecutorOrganizationId': 995, 'publishedStatus': 'UNPUBLISHED', 'reasons': [201], 'reasonsList': [{'assignmentDate': None, 'assignmentDateEn': None, 'assignmentNumber': None, 'date': '18.08.2018', 'dateEn': '2018-08-18', 'requirementDetails': None, 'text': '(ФЗ 248) Истечение установленного федеральным законом о виде контроля, положением о виде контроля период времени с даты окончания проведения последнего планового контрольного (надзорного) мероприятия'}], 'recEmptyOrLate': False, 'regDateEgrul': '29.08.2022', 'regDateEgrulEn': '2022-08-29', 'regLate': False, 'regTypes': [], 'requirements': 9, 'requirementsList': [{'nameNpa': '«О санитарно – эпидемиологическом благополучии населения» ч.3 ст. 39, п.1 , п. 5 ч.2, ст.44, ст. 10, ст.11, ст.24, ст.28, п.3 ст.29, ст.34, ст.35, ст.36', 'numberNpa': '30.03.1999', 'title': 'Федеральный закон РФ № 52-ФЗ от 30.03.1999   '}, {'nameNpa': '"САНИТАРНО-ЭПИДЕМИОЛОГИЧЕСКИЕ ТРЕБОВАНИЯ К ОРГАНИЗАЦИЯМ\nВОСПИТАНИЯ И ОБУЧЕНИЯ, ОТДЫХА И ОЗДОРОВЛЕНИЯ ДЕТЕЙ\nИ МОЛОДЕЖИ"', 'numberNpa': None, 'title': 'СП 2.4.3648-20    28.10.2020'}, {'nameNpa': '"Санитарно-эпидемиологические требования к организации общественного питания населения"', 'numberNpa': '27.10.2020', 'title': 'СанПиН 2.3/2.4.3590-20  27.10.2020'}, {'nameNpa': '"О качестве и безопасности пищевых продуктов" (с изменениями и дополнениями)', 'numberNpa': '02.01.2000', 'title': 'Федеральный закон N 29-ФЗ от 02.01.2000 г. '}, {'nameNpa': '« Гигиенические нормативы  и требования к обеспечению безопасности (или) безвредности  для человека факторов среды  обитания»', 'numberNpa': '29.01.2021', 'title': 'Сан ПиН 1.2.3685-21    29.01.2021'}, {'nameNpa': '«Санитарно-эпидемиологические требования к содержанию территорий городских и сельских поселений, к водным объектам, питьевой воде и питьевому водоснабжению, атмосферному воздух, почвам, жилым помещениям, эксплуатации производственных, общественных помещений, организации проведению санитарно-противоэпидемических (профилактических) мероприятий» (разделы I, II, IV, VIII, X с приложениями);', 'numberNpa': '28.01.2021', 'title': 'СанПиН 2.1.3684-21       28.01.2021'}, {'nameNpa': ' "Санитарно-эпидемиологические требования по профилактике инфекционных болезней"', 'numberNpa': '15.02.2021', 'title': 'СанПиН 3.3686-21      15.02.2021 г'}, {'nameNpa': '«Санитарно-эпидемиологические требования к устройству, содержанию и организации работы образовательных организаций и других объектов социальной инфраструктуры для детей и молодежи в условиях распространения новой коронавирусной инфекции  (COVID-19)»', 'numberNpa': '30.06.2020', 'title': 'СП 3.1/2.4.3598-20     30.06.2020 г'}, {'nameNpa': '  " Организация и проведение производственного контроля за соблюдением санитарных правил и выполнением санитарно-противоэпидемических (профилактических) мероприятий»', 'numberNpa': '30.10.2001', 'title': 'СП 1.1.1058-01    30.10.2001'}], 'resolved': False, 'resultEmpty': True, 'resultEmptyOrLate': False, 'resultInfoTypeCodes': [], 'resultViolationKnm': False, 'riskCategory': ['чрезвычайно высокий риск', 'чрезвычайно высокий риск', 'чрезвычайно высокий риск'], 'riskCategoryAndDangerClass': ['чрезвычайно высокий риск / Первый', 'чрезвычайно высокий риск / Первый', 'чрезвычайно высокий риск / Первый'], 'sezRegistryExists': False, 'signed': True, 'smevInfoType': None, 'smevMessageType': None, 'smevReceivedAt': None, 'smevReceivedAtEn': None, 'smevReceivedAtMonth': None, 'smevReceivedAtYear': None, 'spvRegistryExists': False, 'startDate': '07.03.2023', 'startDateEn': '2023-03-07', 'status': 'Исключена', 'statusEgrul': 'Найден', 'statusId': 15, 'stopDate': '21.03.2023', 'stopDateEn': '2023-03-21', 'subjectTypeId': 0, 'supervisionType': 'Федеральный государственный санитарно-эпидемиологический контроль (надзор)', 'supervisionTypeId': 4, 'torRegistryExists': False, 'updatePlanDate': None, 'updatePlanDateLong': None, 'version': 'ERKNM', 'violationLawsuitTypeCodes': [], 'violationTypeCodes': [], 'year': 2023}
2022-12-20 13:12:15,291 - [ERROR] - sql.py - ultra_create_handler(197) - не получилось внести объект (не рейд):
Traceback (most recent call last):
  File "C:\Users\zaitsev_ad\PycharmProjects\ERKNM\sql.py", line 177, in ultra_create_handler
    cursor.execute(
  File "C:\Users\zaitsev_ad\PycharmProjects\ERKNM\venv\lib\site-packages\pymysql\cursors.py", line 148, in execute
    result = self._query(query)
  File "C:\Users\zaitsev_ad\PycharmProjects\ERKNM\venv\lib\site-packages\pymysql\cursors.py", line 310, in _query
    conn.query(q)
  File "C:\Users\zaitsev_ad\PycharmProjects\ERKNM\venv\lib\site-packages\pymysql\connections.py", line 548, in query
    self._affected_rows = self._read_query_result(unbuffered=unbuffered)
  File "C:\Users\zaitsev_ad\PycharmProjects\ERKNM\venv\lib\site-packages\pymysql\connections.py", line 775, in _read_query_result
    result.read()
  File "C:\Users\zaitsev_ad\PycharmProjects\ERKNM\venv\lib\site-packages\pymysql\connections.py", line 1156, in read
    first_packet = self.connection._read_packet()
  File "C:\Users\zaitsev_ad\PycharmProjects\ERKNM\venv\lib\site-packages\pymysql\connections.py", line 725, in _read_packet
    packet.raise_for_error()
  File "C:\Users\zaitsev_ad\PycharmProjects\ERKNM\venv\lib\site-packages\pymysql\protocol.py", line 221, in raise_for_error
    err.raise_mysql_exception(self._data)
  File "C:\Users\zaitsev_ad\PycharmProjects\ERKNM\venv\lib\site-packages\pymysql\err.py", line 143, in raise_mysql_exception
    raise errorclass(errno, errval)
pymysql.err.ProgrammingError: (1064, "You have an error in your SQL syntax; check the manual that corresponds to your MySQL server version for the right syntax to use near '606029, Нижегородская область, город Дзержинск' at line 1")
2022-12-20 13:12:15,293 - [INFO] - sql.py - ultra_create_handler(198) - {'actCreateDate': None, 'actCreateDateEn': None, 'addresses': ['606016, ОБЛАСТЬ НИЖЕГОРОДСКАЯ, ГОРОД ДЗЕРЖИНСК, ПРОСПЕКТ ЛЕНИНА, 115, ', '606007, Нижегородская область, город Дзержинск, ул. Пирогова, д. 34Б организация общественного питания в МБОУ «Средняя школа № 70»', '606037, Нижегородская область, город  Дзержинск, ул. Петрищева, д. 23 организация общественного питания в МБОУ «Средняя школа № 71»', '606036, Нижегородская область, город  Дзержинск, ул. Матросова, д. 30Б, организация общественного питания в МБОУ «Средняя школа № 68»', '606023, Нижегородская область, город Дзержинск, б-р Мира, д 3,  организация общественного питания в МБОУ «Средняя школа № 40»', '606034, Нижегородская область, город  Дзержинск, ул. Строителей, д. 11, организация общественного питания в МБОУ «Средняя школа № 37»', ' 606015, Нижегородская область , город   Дзержинск, ул. Будённого, д. 10А, организация общественного питания в МБОУ «Средняя школа № 35»', ' 606002, Нижегородская область, город Дзержинск, ул. Щорса, д. 3, организация общественного питания в МБОУ "Средняя школа № 33",', ' 606023, Нижегородская область,   город Дзержинск, ул. Марковникова, д.19, организация общественного питания в МБОУ «Средняя школа № 24»', '606025, Нижегородская область, город Дзержинск, пр. Циолковского, д. 17В, организация общественного питания в МБОУ СШ № 29', '  606024, Нижегородская область, город Дзержинск, ул. Ватутина, д. 54, организация общественного питания в МБОУ Школа № 26', '606040, Нижегородская область, город Дзержинск, поселок Бабино, улица 8 Марта, дом 100, организация общественного питания в МБОУ ОШ № 25', '606025, Нижегородская обл.,  город Дзержинск, ул. Гайдара, д.74 Б, организация общественного питания в  МБОУ СШ № 22 с углубленным изучением французского языка', '606039, Нижегородская область, город Дзержинск, улица Комбрига Патоличева, дом 31, организация общественного питания в МБОУ "Лицей № 21"', '606002, Нижегородская область, город Дзержинск, проспект Ленинского Комсомола, дом 12 А, организация общественного питания в МБОУ "Средняя школа № 18"', '606034, Нижегородская область, город Дзержинск, улица Галкина, дом 9 А, организация общественного питания в МБОУ "Средняя школа № 17"', '\'606029, Нижегородская область, город Дзержинск, улица Терешковой,  дом 46 А, организация общественного питания в МБОУ "Средняя школа № 14" ', '606029, Нижегородская область, город Дзержинск, улица Петрищева, дом 7, организация общественного питания в МБОУ "Средняя школа № 13"', '606025, Нижегородская область, город Дзержинск, бульвар Мира, дом 36, организация общественного питания в МБОУ "Средняя школа № 12"', '606029, Нижегородская область, город Дзержинск, улица Терешковой, дом 34, организация общественного питания в МБОУ Школа № 9', '606007, Нижегородская область, город Дзержинск, улица Матросова, дом 19, организация общественного питания в МБОУ Школа № 7', "'606055, Нижегородская область, город Дзержинск, поселок Пыра, улица Чкалова, дом 12, организация общественного питания в МБОУ Основная школа № 6", '606000, Нижегородская область, город Дзержинск, улица Маяковского, дом 18, организация общественного питания в МБОУ "Школа № 5"', '606036, Нижегородская область, город Дзержинск, улица Советская, дом 9 Б, организация общественного питания в МБОУ "Средняя школа № 3"', '606000, Нижегородская область, город Дзержинск, улица Гагарина, дом 3, организация общественного питания в в МБОУ СШ № 2', '606033, Нижегородская область, город Дзержинск, бульвар Химиков, д. 6, к. А, организация общественного питания в МБОУ Школа № 34', '606031, Нижегородская область, Город Дзержинск, улица Рудольфа Удриса, д. 8, организация общественного питания в МБОУ "Гимназия № 38", ', '606025, Нижегородская область, город Дзержинск, проспект Циолковского, д. 18А, организация общественного питания в МБОУ школа № 39'], 'admLevelId': 50001, 'appealed': False, 'approveDocOrderDate': None, 'approveDocOrderNum': None, 'approveDocRequestDate': None, 'approveDocRequestNum': None, 'approveDocs': [], 'approveRequired': False, 'approved': True, 'approvedErknm': 'Согласовано', 'chlistCount': 0, 'chlistFilledCount': 0, 'chlistFillingIndicationTypeId': [], 'collaboratingOrganizations': [], 'collaboratingOrganizationsIds': [], 'comment': None, 'controllingOrganization': 'Управление Роспотребнадзора по Нижегородской области', 'controllingOrganizationId': 10001019235, 'createPlanDate': None, 'createPlanDateLong': None, 'createdByErpDb': False, 'createdById': 171305, 'dataNotEqualEGRUL': False, 'dataSetNotInTime': False, 'deleted': False, 'directDurationDays': None, 'disapprove': False, 'district': 'Нижегородская область', 'districtId': 1033220000000001, 'durationDays': 10, 'durationHours': 80, 'erknmActViolationIds': [], 'erknmResultKindDecisionIds': [], 'erpId': '52230041000102946491', 'events': [{'startDate': '10.05.2023', 'stopDate': '23.05.2023', 'title': 'Получение письменных объяснений'}, {'startDate': '10.05.2023', 'stopDate': '23.05.2023', 'title': 'Истребование документов'}], 'federalLaw': '248', 'federalLawId': 3, 'fullFieldViolationKnm': False, 'hasViolations': False, 'id': 13018608, 'inn': '5249018774', 'inspectorFullName': [], 'isFromSmev': False, 'isHasApproveDocs': False, 'isHasCollaboratingOrganization': False, 'isHasRequirements': True, 'isHasViolationTerm': False, 'isPm': False, 'kind': 'Документарная проверка', 'knmAnnulled': False, 'knmRejected': False, 'knmType': 'Плановое КНМ', 'knmTypeId': 4, 'legalBasisDocName': [], 'links': [], 'mspCategory': ['Не является субъектом МСП'], 'noPunishment': False, 'notifyLate': False, 'objectsKind': ['Деятельность по организации общественного питания детей в организациях, осуществляющих образовательную деятельность, оказание услуг по воспитанию и обучению, уходу и присмотру за детьми, отдыху и оздоровлению, предоставлению мест временного проживания, социальных, медицинских услуг', 'Деятельность по организации общественного питания детей в организациях, осуществляющих образовательную деятельность, оказание услуг по воспитанию и обучению, уходу и присмотру за детьми, отдыху и оздоровлению, предоставлению мест временного проживания, социальных, медицинских услуг', 'Деятельность по организации общественного питания детей в организациях, осуществляющих образовательную деятельность, оказание услуг по воспитанию и обучению, уходу и присмотру за детьми, отдыху и оздоровлению, предоставлению мест временного проживания, социальных, медицинских услуг', 'Деятельность по организации общественного питания детей в организациях, осуществляющих образовательную деятельность, оказание услуг по воспитанию и обучению, уходу и присмотру за детьми, отдыху и оздоровлению, предоставлению мест временного проживания, социальных, медицинских услуг', 'Деятельность по организации общественного питания детей в организациях, осуществляющих образовательную деятельность, оказание услуг по воспитанию и обучению, уходу и присмотру за детьми, отдыху и оздоровлению, предоставлению мест временного проживания, социальных, медицинских услуг', 'Деятельность по организации общественного питания детей в организациях, осуществляющих образовательную деятельность, оказание услуг по воспитанию и обучению, уходу и присмотру за детьми, отдыху и оздоровлению, предоставлению мест временного проживания, социальных, медицинских услуг', 'Деятельность по организации общественного питания детей в организациях, осуществляющих образовательную деятельность, оказание услуг по воспитанию и обучению, уходу и присмотру за детьми, отдыху и оздоровлению, предоставлению мест временного проживания, социальных, медицинских услуг', 'Деятельность по организации общественного питания детей в организациях, осуществляющих образовательную деятельность, оказание услуг по воспитанию и обучению, уходу и присмотру за детьми, отдыху и оздоровлению, предоставлению мест временного проживания, социальных, медицинских услуг', 'Деятельность по организации общественного питания детей в организациях, осуществляющих образовательную деятельность, оказание услуг по воспитанию и обучению, уходу и присмотру за детьми, отдыху и оздоровлению, предоставлению мест временного проживания, социальных, медицинских услуг', 'Деятельность по организации общественного питания детей в организациях, осуществляющих образовательную деятельность, оказание услуг по воспитанию и обучению, уходу и присмотру за детьми, отдыху и оздоровлению, предоставлению мест временного проживания, социальных, медицинских услуг', 'Деятельность по организации общественного питания детей в организациях, осуществляющих образовательную деятельность, оказание услуг по воспитанию и обучению, уходу и присмотру за детьми, отдыху и оздоровлению, предоставлению мест временного проживания, социальных, медицинских услуг', 'Деятельность по организации общественного питания детей в организациях, осуществляющих образовательную деятельность, оказание услуг по воспитанию и обучению, уходу и присмотру за детьми, отдыху и оздоровлению, предоставлению мест временного проживания, социальных, медицинских услуг', 'Деятельность по организации общественного питания детей в организациях, осуществляющих образовательную деятельность, оказание услуг по воспитанию и обучению, уходу и присмотру за детьми, отдыху и оздоровлению, предоставлению мест временного проживания, социальных, медицинских услуг', 'Деятельность по организации общественного питания детей в организациях, осуществляющих образовательную деятельность, оказание услуг по воспитанию и обучению, уходу и присмотру за детьми, отдыху и оздоровлению, предоставлению мест временного проживания, социальных, медицинских услуг', 'Деятельность по организации общественного питания детей в организациях, осуществляющих образовательную деятельность, оказание услуг по воспитанию и обучению, уходу и присмотру за детьми, отдыху и оздоровлению, предоставлению мест временного проживания, социальных, медицинских услуг', 'Деятельность по организации общественного питания детей в организациях, осуществляющих образовательную деятельность, оказание услуг по воспитанию и обучению, уходу и присмотру за детьми, отдыху и оздоровлению, предоставлению мест временного проживания, социальных, медицинских услуг', 'Деятельность по организации общественного питания детей в организациях, осуществляющих образовательную деятельность, оказание услуг по воспитанию и обучению, уходу и присмотру за детьми, отдыху и оздоровлению, предоставлению мест временного проживания, социальных, медицинских услуг', 'Деятельность по организации общественного питания детей в организациях, осуществляющих образовательную деятельность, оказание услуг по воспитанию и обучению, уходу и присмотру за детьми, отдыху и оздоровлению, предоставлению мест временного проживания, социальных, медицинских услуг', 'Деятельность по организации общественного питания детей в организациях, осуществляющих образовательную деятельность, оказание услуг по воспитанию и обучению, уходу и присмотру за детьми, отдыху и оздоровлению, предоставлению мест временного проживания, социальных, медицинских услуг', 'Деятельность по организации общественного питания детей в организациях, осуществляющих образовательную деятельность, оказание услуг по воспитанию и обучению, уходу и присмотру за детьми, отдыху и оздоровлению, предоставлению мест временного проживания, социальных, медицинских услуг', 'Деятельность по организации общественного питания детей в организациях, осуществляющих образовательную деятельность, оказание услуг по воспитанию и обучению, уходу и присмотру за детьми, отдыху и оздоровлению, предоставлению мест временного проживания, социальных, медицинских услуг', 'Деятельность по организации общественного питания детей в организациях, осуществляющих образовательную деятельность, оказание услуг по воспитанию и обучению, уходу и присмотру за детьми, отдыху и оздоровлению, предоставлению мест временного проживания, социальных, медицинских услуг', 'Деятельность по организации общественного питания детей в организациях, осуществляющих образовательную деятельность, оказание услуг по воспитанию и обучению, уходу и присмотру за детьми, отдыху и оздоровлению, предоставлению мест временного проживания, социальных, медицинских услуг', 'Деятельность по организации общественного питания детей в организациях, осуществляющих образовательную деятельность, оказание услуг по воспитанию и обучению, уходу и присмотру за детьми, отдыху и оздоровлению, предоставлению мест временного проживания, социальных, медицинских услуг', 'Деятельность по организации общественного питания детей в организациях, осуществляющих образовательную деятельность, оказание услуг по воспитанию и обучению, уходу и присмотру за детьми, отдыху и оздоровлению, предоставлению мест временного проживания, социальных, медицинских услуг', 'Деятельность по организации общественного питания детей в организациях, осуществляющих образовательную деятельность, оказание услуг по воспитанию и обучению, уходу и присмотру за детьми, отдыху и оздоровлению, предоставлению мест временного проживания, социальных, медицинских услуг', 'Деятельность по организации общественного питания детей в организациях, осуществляющих образовательную деятельность, оказание услуг по воспитанию и обучению, уходу и присмотру за детьми, отдыху и оздоровлению, предоставлению мест временного проживания, социальных, медицинских услуг', 'Деятельность по организации общественного питания детей в организациях, осуществляющих образовательную деятельность, оказание услуг по воспитанию и обучению, уходу и присмотру за детьми, отдыху и оздоровлению, предоставлению мест временного проживания, социальных, медицинских услуг'], 'objectsSubKind': ['Деятельность по организации общественного питания детей в организациях, осуществляющих образовательную деятельность, оказание услуг по воспитанию и обучению, уходу и присмотру за детьми, отдыху и оздоровлению, предоставлению мест временного проживания, социальных, медицинских услуг', 'Деятельность по организации общественного питания детей в организациях, осуществляющих образовательную деятельность, оказание услуг по воспитанию и обучению, уходу и присмотру за детьми, отдыху и оздоровлению, предоставлению мест временного проживания, социальных, медицинских услуг', 'Деятельность по организации общественного питания детей в организациях, осуществляющих образовательную деятельность, оказание услуг по воспитанию и обучению, уходу и присмотру за детьми, отдыху и оздоровлению, предоставлению мест временного проживания, социальных, медицинских услуг', 'Деятельность по организации общественного питания детей в организациях, осуществляющих образовательную деятельность, оказание услуг по воспитанию и обучению, уходу и присмотру за детьми, отдыху и оздоровлению, предоставлению мест временного проживания, социальных, медицинских услуг', 'Деятельность по организации общественного питания детей в организациях, осуществляющих образовательную деятельность, оказание услуг по воспитанию и обучению, уходу и присмотру за детьми, отдыху и оздоровлению, предоставлению мест временного проживания, социальных, медицинских услуг', 'Деятельность по организации общественного питания детей в организациях, осуществляющих образовательную деятельность, оказание услуг по воспитанию и обучению, уходу и присмотру за детьми, отдыху и оздоровлению, предоставлению мест временного проживания, социальных, медицинских услуг', 'Деятельность по организации общественного питания детей в организациях, осуществляющих образовательную деятельность, оказание услуг по воспитанию и обучению, уходу и присмотру за детьми, отдыху и оздоровлению, предоставлению мест временного проживания, социальных, медицинских услуг', 'Деятельность по организации общественного питания детей в организациях, осуществляющих образовательную деятельность, оказание услуг по воспитанию и обучению, уходу и присмотру за детьми, отдыху и оздоровлению, предоставлению мест временного проживания, социальных, медицинских услуг', 'Деятельность по организации общественного питания детей в организациях, осуществляющих образовательную деятельность, оказание услуг по воспитанию и обучению, уходу и присмотру за детьми, отдыху и оздоровлению, предоставлению мест временного проживания, социальных, медицинских услуг', 'Деятельность по организации общественного питания детей в организациях, осуществляющих образовательную деятельность, оказание услуг по воспитанию и обучению, уходу и присмотру за детьми, отдыху и оздоровлению, предоставлению мест временного проживания, социальных, медицинских услуг', 'Деятельность по организации общественного питания детей в организациях, осуществляющих образовательную деятельность, оказание услуг по воспитанию и обучению, уходу и присмотру за детьми, отдыху и оздоровлению, предоставлению мест временного проживания, социальных, медицинских услуг', 'Деятельность по организации общественного питания детей в организациях, осуществляющих образовательную деятельность, оказание услуг по воспитанию и обучению, уходу и присмотру за детьми, отдыху и оздоровлению, предоставлению мест временного проживания, социальных, медицинских услуг', 'Деятельность по организации общественного питания детей в организациях, осуществляющих образовательную деятельность, оказание услуг по воспитанию и обучению, уходу и присмотру за детьми, отдыху и оздоровлению, предоставлению мест временного проживания, социальных, медицинских услуг', 'Деятельность по организации общественного питания детей в организациях, осуществляющих образовательную деятельность, оказание услуг по воспитанию и обучению, уходу и присмотру за детьми, отдыху и оздоровлению, предоставлению мест временного проживания, социальных, медицинских услуг', 'Деятельность по организации общественного питания детей в организациях, осуществляющих образовательную деятельность, оказание услуг по воспитанию и обучению, уходу и присмотру за детьми, отдыху и оздоровлению, предоставлению мест временного проживания, социальных, медицинских услуг', 'Деятельность по организации общественного питания детей в организациях, осуществляющих образовательную деятельность, оказание услуг по воспитанию и обучению, уходу и присмотру за детьми, отдыху и оздоровлению, предоставлению мест временного проживания, социальных, медицинских услуг', 'Деятельность по организации общественного питания детей в организациях, осуществляющих образовательную деятельность, оказание услуг по воспитанию и обучению, уходу и присмотру за детьми, отдыху и оздоровлению, предоставлению мест временного проживания, социальных, медицинских услуг', 'Деятельность по организации общественного питания детей в организациях, осуществляющих образовательную деятельность, оказание услуг по воспитанию и обучению, уходу и присмотру за детьми, отдыху и оздоровлению, предоставлению мест временного проживания, социальных, медицинских услуг', 'Деятельность по организации общественного питания детей в организациях, осуществляющих образовательную деятельность, оказание услуг по воспитанию и обучению, уходу и присмотру за детьми, отдыху и оздоровлению, предоставлению мест временного проживания, социальных, медицинских услуг', 'Деятельность по организации общественного питания детей в организациях, осуществляющих образовательную деятельность, оказание услуг по воспитанию и обучению, уходу и присмотру за детьми, отдыху и оздоровлению, предоставлению мест временного проживания, социальных, медицинских услуг', 'Деятельность по организации общественного питания детей в организациях, осуществляющих образовательную деятельность, оказание услуг по воспитанию и обучению, уходу и присмотру за детьми, отдыху и оздоровлению, предоставлению мест временного проживания, социальных, медицинских услуг', 'Деятельность по организации общественного питания детей в организациях, осуществляющих образовательную деятельность, оказание услуг по воспитанию и обучению, уходу и присмотру за детьми, отдыху и оздоровлению, предоставлению мест временного проживания, социальных, медицинских услуг', 'Деятельность по организации общественного питания детей в организациях, осуществляющих образовательную деятельность, оказание услуг по воспитанию и обучению, уходу и присмотру за детьми, отдыху и оздоровлению, предоставлению мест временного проживания, социальных, медицинских услуг', 'Деятельность по организации общественного питания детей в организациях, осуществляющих образовательную деятельность, оказание услуг по воспитанию и обучению, уходу и присмотру за детьми, отдыху и оздоровлению, предоставлению мест временного проживания, социальных, медицинских услуг', 'Деятельность по организации общественного питания детей в организациях, осуществляющих образовательную деятельность, оказание услуг по воспитанию и обучению, уходу и присмотру за детьми, отдыху и оздоровлению, предоставлению мест временного проживания, социальных, медицинских услуг', 'Деятельность по организации общественного питания детей в организациях, осуществляющих образовательную деятельность, оказание услуг по воспитанию и обучению, уходу и присмотру за детьми, отдыху и оздоровлению, предоставлению мест временного проживания, социальных, медицинских услуг', 'Деятельность по организации общественного питания детей в организациях, осуществляющих образовательную деятельность, оказание услуг по воспитанию и обучению, уходу и присмотру за детьми, отдыху и оздоровлению, предоставлению мест временного проживания, социальных, медицинских услуг', 'Деятельность по организации общественного питания детей в организациях, осуществляющих образовательную деятельность, оказание услуг по воспитанию и обучению, уходу и присмотру за детьми, отдыху и оздоровлению, предоставлению мест временного проживания, социальных, медицинских услуг'], 'objectsType': ['Деятельность и действия', 'Деятельность и действия', 'Деятельность и действия', 'Деятельность и действия', 'Деятельность и действия', 'Деятельность и действия', 'Деятельность и действия', 'Деятельность и действия', 'Деятельность и действия', 'Деятельность и действия', 'Деятельность и действия', 'Деятельность и действия', 'Деятельность и действия', 'Деятельность и действия', 'Деятельность и действия', 'Деятельность и действия', 'Деятельность и действия', 'Деятельность и действия', 'Деятельность и действия', 'Деятельность и действия', 'Деятельность и действия', 'Деятельность и действия', 'Деятельность и действия', 'Деятельность и действия', 'Деятельность и действия', 'Деятельность и действия', 'Деятельность и действия', 'Деятельность и действия'], 'ogrn': '1025201745580', 'oldKnm': None, 'oldPlan': None, 'orderDone': False, 'organizationName': 'МУНИЦИПАЛЬНОЕ УНИТАРНОЕ ПРЕДПРИЯТИЕ "КОМБИНАТ ПИТАНИЯ" ГОРОДА ДЗЕРЖИНСКА"', 'organizationsInn': ['5249018774'], 'organizationsName': ['МУНИЦИПАЛЬНОЕ УНИТАРНОЕ ПРЕДПРИЯТИЕ "КОМБИНАТ ПИТАНИЯ" ГОРОДА ДЗЕРЖИНСКА"'], 'organizationsOgrn': ['1025201745580'], 'planId': '2023050341', 'prosecutorOrganization': 'Прокуратура Нижегородской области', 'prosecutorOrganizationId': 1433, 'publishedStatus': 'UNPUBLISHED', 'reasons': [201], 'reasonsList': [{'assignmentDate': None, 'assignmentDateEn': None, 'assignmentNumber': None, 'date': '22.03.2022', 'dateEn': '2022-03-22', 'requirementDetails': None, 'text': '(ФЗ 248) Истечение установленного федеральным законом о виде контроля, положением о виде контроля период времени с даты окончания проведения последнего планового контрольного (надзорного) мероприятия'}], 'recEmptyOrLate': False, 'regDateEgrul': '19.08.2022', 'regDateEgrulEn': '2022-08-19', 'regLate': False, 'regTypes': [], 'requirements': 17, 'requirementsList': [{'nameNpa': '  Федеральный  закон от 30.03.1999 г № 52-ФЗ «О санитарно-эпидемиологическом благополучии населения', 'numberNpa': '30.03.1999', 'title': 'ст. ст. 11, 15, 17 ,18, 19, 28,29,32,34,35,36, 50, 52'}, {'nameNpa': ' Федеральный закон от 02.01.2000 N 29-ФЗ "О качестве и безопасности пищевых продуктов"', 'numberNpa': '02.01.2000', 'title': 'гл. I-V'}, {'nameNpa': ' Закона № 157-ФЗ от 17.09.98 г. «Об иммунопрофилактике инфекционных болезней»', 'numberNpa': None, 'title': 'гл. I-V'}, {'nameNpa': ' Федеральный закон от 27 декабря 2002 г. № 184-ФЗ «О техническом регулировании»', 'numberNpa': '27.12.2002', 'title': 'гл. 1-10'}, {'nameNpa': 'Федеральный закон от 18.06.2001 N 77-ФЗ "О предупреждении распространения туберкулеза в Российской Федерации"', 'numberNpa': '18.06.2001', 'title': 'гл I-VII '}, {'nameNpa': 'СанПиН 1.2.3685-21 «Гигиенические нормативы и требования к обеспечению безопасности и (или) безвредности для человека факторов среды обитания» разделы III, V, VI, IX; ', 'numberNpa': '28.01.2021', 'title': 'разделы VI, IX '}, {'nameNpa': 'СП 2.4. 3648-20 «Санитарно-эпидемиологические требования к организациям воспитания и обучения, отдыха и оздоровления детей и молодежи» ', 'numberNpa': '28.09.2020', 'title': 'пункты 1.1-1.10, 2.3.3, 2.4.6-2.4.6.2, 2.9.5,2.11.9, '}, {'nameNpa': 'СП 3.1/2.4.3598-20 «Санитарно-эпидемиологические требования к устройству, содержанию и организации работы образовательных организаций и других объектов социальной инфраструктуры для детей и молодежи в условиях распространения новой коронавирусной инфекции (COVID-19)» ; ', 'numberNpa': '30.06.2020', 'title': 'п. 1.1-1.3, 2.1-2.3,2.5,3.3 '}, {'nameNpa': ' СанПиН 2.1.3684-21 "Санитарно-эпидемиологические требования к содержанию территорий городских и сельских поселений, к водным объектам, питьевой воде и питьевому водоснабжению, атмосферному воздуху, почвам, жилым помещениям, эксплуатации производственных, общественных помещений, организации и проведению санитарно-противоэпидемических (профилактических) мероприятий" ', 'numberNpa': '28.01.2021', 'title': 'п.п. 212- 239, '}, {'nameNpa': 'СанПиН 3.3686-21 от 28.01.2021г. "Санитарно-эпидемиологические требования по профилактике инфекционных болезней»', 'numberNpa': '28.01.2021', 'title': 'гл. I-III, VII, VIII, XVIII, XXIV, XXVI, XXVII, XXIX, XXXII-XXXV, XXXVII-XXXVIII, XLV-XLVII, Приложение 1-40 '}, {'nameNpa': ' СП 1.1.1058-01 "Организация и проведение производственного контроля за соблюдением санитарных правил и выполнением санитарно-противоэпидемических (профилактических) мероприятий ; ', 'numberNpa': '01.01.1917', 'title': 'п.п. 1.1-2.8, 3.1-3.9, 4.1а),5.1-6.2'}, {'nameNpa': 'Постановление Правительства РФ от 15 июля 1999 г. N 825 "Об утверждении перечня работ, выполнение которых связано с высоким риском заболевания инфекционными болезня